respondent.commune,business_name,place_id,fr_categories,business_address,treatment_arm
Clévilliers,Bb Asie,ChIJ27qzFUcM5EcR0LaOdzG37EU,"Restaurant, Restaurant De Fusion Asiatique, Restaurant Asiatique, Restaurant Chinois, Restaurant Japonais, Restaurant Panasiatique","7 Rue De La Couronne, Chartres",NA
Clévilliers,Kyotori,ChIJD6FEx0YM5EcRHWkhzO07BUw,"Restaurant Japonais, Restaurant Asiatique, Restaurant, Restaurant De Sushis","13 Rue Général Koenig, Chartres",NA
Clévilliers,Shogun Sushi,ChIJwawcD0QM5EcRyZh7kQeZS5I,"Restaurant Japonais, Restaurant Japonais Authentique, Steakhouse Japonais, Restaurant De Livraison","8 Rue Du Dr Michel Gibert, Chartres",NA
Cloyes-les-Trois-Rivières,Sandwicherie De La Place,ChIJI0PZRaR540cRqNrjMjjOC5c,Kebab,"52 Rue Nationale, Cloyes-les-Trois-Rivières",1
Cloyes-les-Trois-Rivières,Kebab Du Centre Châteaudun,ChIJxVzrzYp_40cRUb1YR912AtQ,"Kebab, Restaurant De Restauration Rapide","38bis Pl. Du 18 Octobre, Châteaudun",1
Cloyes-les-Trois-Rivières,Grill Istanbul,ChIJy6QU0op_40cRvItJ8_lGpMo,Restaurant Turc,"38 Pl. Du 18 Octobre, Châteaudun",1
Cloyes-les-Trois-Rivières,L'etoile De Marrakech,ChIJoUdh9fR_40cR56pQByHEvwQ,Restaurant Marocain,"35 Rue Gambetta, Châteaudun",1
Cloyes-les-Trois-Rivières,Marmara,ChIJJY1naDR_40cR58LkPmd4RyU,Restaurant Turc,"63 Rue Gambetta, Châteaudun",1
Cloyes-les-Trois-Rivières,Au Bon Coin,ChIJS2dKZGF540cRQf84PrctYSk,"Restaurant De Couscous, Bar, Restaurant, Brasserie","41 Rue Nationale, Cloyes-les-Trois-Rivières",0
Cloyes-les-Trois-Rivières,Restaurant Le Val Fleuri,ChIJ18gdCWV540cRjpUEXs8q5h0,"Restaurant, Bar, Brasserie, Lieu De L'événement, Restaurant Français","Rte De Montigny, Cloyes-les-Trois-Rivières",0
Cloyes-les-Trois-Rivières,Le Petit Pâtre,ChIJewttmL5540cRO4TmcmAMu68,Crêperie,"4 Rue Jean Chauveau, Cloyes-les-Trois-Rivières",0
Cloyes-les-Trois-Rivières,Le Moulin Des Trois Rivières,ChIJpa85XmJ540cRcxR1y0nIOUU,"Restaurant Français, Galerie D'art, Chambres D'hôtes, Dîner-Théâtre, Lieu De Mariage","20 Rue Victorien Isambert, Cloyes-les-Trois-Rivières",0
Cloyes-les-Trois-Rivières,Le P'tit Langey,ChIJzb73gi9440cRXa6J2fyD2Ig,"Restaurant, Bar, Restaurant Français","1 Pl. De L'église, Vald'Yerre",0
Cloyes-les-Trois-Rivières,Sushi’lys,ChIJWc_TUPB_40cRIUdoJZmZoq4,Restaurant De Sushis,"7 Rue Gambetta, Châteaudun",NA
Cloyes-les-Trois-Rivières,Délice Châteaudun,ChIJa4KEMvV_40cRbXBvi-koy68,Plats Chinois À Emporter,"32 Pl. Du 18 Octobre, Châteaudun",NA
Cloyes-les-Trois-Rivières,Le Punjab Grill,ChIJI8eRDVZ_40cRd3GIOKw7WfA,Restaurant Indien,"75bis Rue De La République, Châteaudun",NA
Cloyes-les-Trois-Rivières,"Le Royal Wok, Châteaudun",ChIJHUvyGRGA40cR0wiR-AZnC7M,"Restaurant Chinois, Restaurant Asiatique, Restaurant","1-23 Chem. Des Basses Garennes, Châteaudun",NA
Cloyes-les-Trois-Rivières,Feng,ChIJCyWN0bp55EcRVhY_sLTwHYg,Restaurant Chinois,"20 Rue De Chartres, Bonneval",NA
Coltainville,Istanbul Kebab Grill - Le Bois Paris / Chartres 28,ChIJ1b9seCUS5EcRe3DGWaNU36c,"Restaurant Turc, Kebab","9 Voie De La Liberté, Nogent-le-Phaye",1
Coltainville,Babylone Madeleine Kebab,ChIJw_vzkL8N5EcRPIuwsiTNUoQ,"Kebab, Bar, Restaurant Barbecue, Café, Restaurant De Restauration Rapide, Restaurant De Hamburgers, Restaurant","2 Av. Joseph Pichard, Chartres",1
Coltainville,Altın Döner,ChIJF451n7sN5EcRwEY_QIQX55c,"Kebab, Restaurant De Restauration Rapide","8 Rue Francis Vovelle, Chartres",1
Coltainville,Dj Food,ChIJv4yjAjwT5EcRl0PELD0vIKM,"Traiteur, Restaurant Africain, Restaurant De Restauration Rapide, Restaurant Halal","5 Rue Du Traité, Sours",1
Coltainville,Royal Kebab Chartres,ChIJUegW-OAN5EcRAeXfhAiE9Ic,"Kebab, Restaurant De Restauration Rapide","10 Rue Saint-Maurice, Chartres",1
Coltainville,Buffalo Grill Gasville-Oisème,ChIJI1_335YT5EcR4_Nm0lNYhCY,"Restaurant, Restaurant Américain, Bar Et Grill, Restaurant Barbecue, Restaurant Familial, Restaurant De Hamburgers, Restaurant À Emporter, Steak House","Aire De Chartres, Gasville-Oisème",0
Coltainville,Burger King,ChIJCdbm6CkS5EcRtc7QYgxhx8w,"Restaurant De Restauration Rapide, Restaurant Américain, Bar Et Grill, Restaurant Familial, Restaurant De Hamburgers, Restaurant À Emporter","Aire De Chartres Bois-Paris, Gasville-Oisème",0
Coltainville,Auberge De La Gare,ChIJKSBLnzIQ5EcRv4vU5wLGexg,Restaurant Français,"33 Av. De La Gare, Jouy",0
Coltainville,La _ Parenthèse,ChIJG1hneCwQ5EcRF5GneF4hqCM,"Restaurant, Restaurant Français","10 Pl. De L'église, Jouy",0
Coltainville,231 East Street Chartres - Le Gourmet Burger À Chartres,ChIJ2x9i6rET5EcRbVvQyjtdeLk,"Restaurant De Restauration Rapide, Restaurant Américain, Restaurant De Hamburgers, Bar Karaoké","Karting De, Chartres",0
Coltainville,Paradis D'asie,ChIJdypJXiQS5EcRIFFiUKRR2ZM,"Restaurant Asiatique, Restaurant Chinois, Restaurant Mandarin","4 Rue Du Bois Paris, Nogent-le-Phaye",NA
Coltainville,Sushi Daily Chartres,ChIJ38o0XzkN5EcRSYThfuDVbJU,Sushis À Emporter,"Av. Marcel Proust, Chartres",NA
Coltainville,Au Royal De Chartres,ChIJEYThaksM5EcRFiZ5fbnbpmc,"Restaurant Chinois, Restaurant Thaïlandais","2 Rue Du Faubourg La Grappe, Chartres",NA
Coltainville,Restaurant Thai,ChIJ__9rjFoM5EcRld13qgLDAjw,Restaurant Thaïlandais,"24 Rue De La Prte Morard, Chartres",NA
Coltainville,Restaurant Asiatique,ChIJR_Y1bqcN5EcRlgGUOxPcDLo,Restaurant Asiatique,"Av. D'orléans, Le Coudray",NA
Combres,Kebab Istanbul,ChIJzXMNCcGa40cR_onZRkUQ72o,"Restaurant Turc, Bar, Restaurant De Restauration Rapide, Kebab","6 Rue Des Changes, Brou",1
Combres,Ada Délices,ChIJrbqEAPnB40cRD_sfeGQH6PM,"Kebab, Restaurant De Restauration Rapide","3 Rue Du Château, La Loupe",1
Combres,Ozkaya Duran,ChIJMyBjSfjB40cRHseAvVFDLhs,"Kebab, Restaurant De Restauration Rapide, Restaurant De Pizzas","8 Pl. De L'hôtel De Ville, La Loupe",1
Combres,Grill İstanbul,ChIJrTupN0-340cR0imb-T1OCo4,"Kebab, Gril, Restaurant De Pizzas, Restaurant Turc","29 Rue Giroust, Nogent-le-Rotrou",1
Combres,Resto St Pol,ChIJdZeO6za340cRyqwobsQoiOA,Restaurant Turc,"Place Gén De Saint Pol 14, Nogent-le-Rotrou",1
Combres,La Croix Blanche,ChIJ4xGCGjKU40cRRlpfP7IW9DI,"Restaurant Français, Hôtel","3 Rue Jean Moulin, Combres",0
Combres,Le Pré De Frazé,ChIJBQC4NvBv5kcRabvm4z8L7Ok,Restaurant Français,"6-8 Rue Du Huit Mai 1945, Frazé",0
Combres,Restaurant Le Saint Pierre,ChIJaUF8QaWR40cRHgs9rUfvnwI,Restaurant Français,"2 Rue D'illiers, Montigny-le-Chartif",0
Combres,Le Sebastopol,ChIJN_eEiTDr40cRTWMjExdESXE,"Restaurant, Restaurant Français","24 Grande Rue, Champrond-en-Gâtine",0
Combres,La Table Du Perche,ChIJN_eEiTDr40cRSibh9m4t-b8,"Restaurant Français, Bar, Restaurant","5 Grande Rue, Champrond-en-Gâtine",0
Combres,Siècle D’or,ChIJKWwJgDOb40cRR2RCRfAWFKo,Restaurant Chinois,"France, Brou",NA
Combres,Chef Jin Traiteur Asiatique,ChIJ4Yn39Da340cRTYtq3INVhew,"Plats Chinois À Emporter, Restaurant Chinois","20 Rue Villette Gâte, Nogent-le-Rotrou",NA
Combres,Indian Street,ChIJxfTrRUu340cRkbR6hZMzQ-Y,Restaurant Indien,"13 Place St Pol, Nogent-le-Rotrou",NA
Combres,L’étoile D’asie,ChIJw0AlbS-340cRUWBSRexE84s,"Restaurant, Restaurant Asiatique, Restaurant Chinois, Restaurant De Sushis","19 Av. De La Victoire Du 11 Novembre 1918, Nogent-le-Rotrou",NA
Combres,Maikruathai,ChIJW4sDv4-H40cRD3q-tkBujS8,"Restaurant, Restaurant Thaïlandais","1 Chem. De Dangeau, Trizay-lès-Bonneval",NA
Conie-Molitard,Boucherie Halal,ChIJ9SshHAeA40cRv8gpImrBm4A,Boucherie,"34 Av. Du Général De Gaulle, Châteaudun",1
Conie-Molitard,Chiken Cottage,ChIJu_1MEKSB40cRI8laxSHfa1I,Restaurant Halal,"10 Rue Albert Camus, Châteaudun",1
Conie-Molitard,Pamukkale Restaurant,ChIJVZvO79J_40cRZeeTfh2psz4,Restaurant Turc,"45 Bd Kellermann, Châteaudun",1
Conie-Molitard,Saveur Marocaine,ChIJUYCCLAB_40cRLSCrJdxfW4g,Restaurant Marocain,"1 Bd Toutin, Châteaudun",1
Conie-Molitard,Les Plaisirs Du Maroc,ChIJy_VodrR_40cRPgoNjo9b_dg,Restaurant Marocain,"1 Bd Toutin, Châteaudun",1
Conie-Molitard,La Joconde,ChIJYRr11JeA5EcRFBqyUOMUeQo,"Restaurant Français, Bar","16 Rue Robert Pothier, Villemaury",0
Conie-Molitard,L'union,ChIJlU3cN-V45EcReDItmLEaw-g,"Restaurant, Bar, Café, Restaurant Français","45 Rue Hérisson, Bonneval",0
Conie-Molitard,Sarl _ Au P'tit Gourmand,ChIJsczqC4SB40cRB47lp4r4gfU,"Restaurant Français, Restaurant, Restaurant Traditionnel","Z.a. Hodier, Donnemain-Saint-Mamès",0
Conie-Molitard,Burger King,ChIJLXz7kyyB40cRN2v15K_vK1M,"Restaurant De Restauration Rapide, Restaurant Américain, Bar Et Grill, Restaurant Familial, Restaurant De Hamburgers, Restaurant À Emporter","6 Rue Des Saxifrages, Châteaudun",0
Conie-Molitard,La Galmotte Horaires Dernière Prises De Commandes,ChIJJVMcAvB45EcRBHMhzYf6vQ0,"Crêperie, Restaurant De Pizzas","5 Pl. De L'église, Bonneval",0
Conie-Molitard,"Le Royal Wok, Châteaudun",ChIJHUvyGRGA40cR0wiR-AZnC7M,"Restaurant Chinois, Restaurant Asiatique, Restaurant","1-23 Chem. Des Basses Garennes, Châteaudun",NA
Conie-Molitard,Feng,ChIJCyWN0bp55EcRVhY_sLTwHYg,Restaurant Chinois,"20 Rue De Chartres, Bonneval",NA
Conie-Molitard,Le Punjab Grill,ChIJI8eRDVZ_40cRd3GIOKw7WfA,Restaurant Indien,"75bis Rue De La République, Châteaudun",NA
Conie-Molitard,Délice Châteaudun,ChIJa4KEMvV_40cRbXBvi-koy68,Plats Chinois À Emporter,"32 Pl. Du 18 Octobre, Châteaudun",NA
Conie-Molitard,Sushi’lys,ChIJWc_TUPB_40cRIUdoJZmZoq4,Restaurant De Sushis,"7 Rue Gambetta, Châteaudun",NA
Corancez,Le Kangourou A Moustache,ChIJOc8MkKh05EcROqBxaZzuc3o,"Restaurant Turc, Restaurant Français, Hôtel, Hébergement Indépendant, Hébergement Avec Services","15 Rue Nationale, Thivars",1
Corancez,Snack 28,ChIJ-xHwfwcN5EcRowTopBi_baI,"Restaurant, Restaurant De Restauration Rapide, Restaurant Français, Restaurant Halal, Restaurant De Hamburgers, Kebab, Restaurant De Pizzas, Magasin De Salades, Sandwicherie, Restaurant De Tacos","29 Rue Vincent Chevard, Chartres",1
Corancez,La Pause Kebab,ChIJjdBJzj0M5EcRBRrVlBnr5IU,"Kebab, Restaurant De Restauration Rapide","11 Rue De L'orme De Sours, Luisant",1
Corancez,Dj Food,ChIJv4yjAjwT5EcRl0PELD0vIKM,"Traiteur, Restaurant Africain, Restaurant De Restauration Rapide, Restaurant Halal","5 Rue Du Traité, Sours",1
Corancez,Istanbul Grill,ChIJX2Sei7AN5EcRrwqf1UOr6qk,"Restaurant Turc, Restaurant Barbecue, Dîner, Restaurant Halal, Restaurant Haut De Gamme Français, Kebab","9 Rue Des Chênes, Luisant",1
Corancez,Restaurant _ Le Bergerac,ChIJc3bHANcM5EcRdCMcaryr3Uw,"Restaurant, Restaurant Gastronomique, Restaurant Français","15 Rue De Chartres, Morancez",0
Corancez,La Sellerie,ChIJL9c-z6d05EcRvk9QvN8soeo,"Restaurant, Traiteur, Restaurant Français","48 Rue Nationale, Thivars",0
Corancez,La Table Des Berges,ChIJd-8TTDp15EcR_IcqNiBpKco,"Restaurant, Restaurant Haut De Gamme Français","14 Rue Nationale, Thivars",0
Corancez,Au Bureau,ChIJcerMN5MM5EcRypETMyxDacI,"Restaurant, Bar, Restaurant Européen, Restaurant Français, Restaurant De Hamburgers, Restaurant Irlandais, Pub, Bar Sportif","Zac De La Torche, Barjouville",0
Corancez,Flunch Chartres Barjouville,ChIJ-Ss1DJcM5EcRfmDRws_9JFA,"Restaurant, Restaurant Buffet, Traiteur, Crêperie, Restaurant Familial, Restaurant De Restauration Rapide, Restaurant Français, Restaurant De Coupes Glacées","Centre Commercial Leclerc - Zi, Barjouville",0
Corancez,Papylee,ChIJV5zDkL4N5EcRIG4opTnKpr0,Sushis À Emporter,"1 Rue Des Orvilles Chez E.leclerc, Barjouville",NA
Corancez,Chichiko,ChIJHTEfTQAN5EcRc1SARXMkd-c,Restaurant Coréen,"13 Rue Des Pierres Missigault, Barjouville",NA
Corancez,Wok D Asie,ChIJlQE2M5cM5EcRgsAeTsak0kE,"Restaurant Asiatique, Restaurant Buffet, Restaurant Chinois","France, Barjouville",NA
Corancez,Restaurant Asiatique,ChIJR_Y1bqcN5EcRlgGUOxPcDLo,Restaurant Asiatique,"Av. D'orléans, Le Coudray",NA
Corancez,Festin D'asie,ChIJr1X55gkN5EcRdQNVq3fYxSs,"Restaurant Asiatique, Restaurant Chinois, Restaurant De Sushis","3 Rue De La Maladrerie, Le Coudray",NA
Cormainville,Lorient Kebab,ChIJh_toi3Jh5EcRLGCgyyyrPwc,Restaurant De Pizzas,"1 Place Ste Barbe, Orgères-en-Beauce",1
Cormainville,Ludovic Brassaud,ChIJwZv8BkNl5kcRQqizLYFguJg,"Traiteur, Pâtisserie, Restaurant Français, Restaurant Halal, Restaurant Du Déjeuner, Pâtisserie, Restaurant Végétarien","Amoinville, Éole-en-Beauce",1
Cormainville,Restaurant Méditerranée,ChIJk4U6dSlp5EcRrBf4W44hbso,"Restaurant, Kebab, Restaurant De Pizzas, Pizza À Emporter, Sandwicherie","16 Rue Du Voisin, Les Villages Vovéens",1
Cormainville,Launay Traiteur,ChIJ23v3gg1p5EcRn7hm6C16hVQ,"Traiteur, Magasin De Bière, Pâtisserie, Restaurant Français, Restaurant Sans Gluten, Restaurant Halal, Pâtisserie, Restaurant Végétalien, Restaurant Végétarien","1 Bis Rue Du Dr Rabourdin, Les Villages Vovéens",1
Cormainville,Boucherie Halal,ChIJ9SshHAeA40cRv8gpImrBm4A,Boucherie,"34 Av. Du Général De Gaulle, Châteaudun",1
Cormainville,Le Commerce,ChIJvZI7vqtl5EcRm9oaCqOgm1g,"Restaurant, Restaurant Français, Bar","6 Pl. Du Marché, Sancheville",0
Cormainville,Le Saint Florian,ChIJVRHyYUr15EcR_FBQFUiGegE,"Bar, Restaurant Français","21 Rue De La Croix Blanche, Patay",0
Cormainville,Le Relais Saint Jacques,ChIJ3802ar6L5EcRXEQrI-FgVnE,"Restaurant, Restaurant Français, Hôtel","35 Rue De La Mairie, Tournoisis",0
Cormainville,Restaurant De La Mairie,ChIJbey00Chp5EcRX8ZjIQ0zrB4,Restaurant Français,"18 Rue Roger Gommier, Les Villages Vovéens",0
Cormainville,La Joconde,ChIJYRr11JeA5EcRFBqyUOMUeQo,"Restaurant Français, Bar","16 Rue Robert Pothier, Villemaury",0
Cormainville,Feng,ChIJCyWN0bp55EcRVhY_sLTwHYg,Restaurant Chinois,"20 Rue De Chartres, Bonneval",NA
Cormainville,"Le Royal Wok, Châteaudun",ChIJHUvyGRGA40cR0wiR-AZnC7M,"Restaurant Chinois, Restaurant Asiatique, Restaurant","1-23 Chem. Des Basses Garennes, Châteaudun",NA
Cormainville,Le Punjab Grill,ChIJI8eRDVZ_40cRd3GIOKw7WfA,Restaurant Indien,"75bis Rue De La République, Châteaudun",NA
Cormainville,Maikruathai,ChIJW4sDv4-H40cRD3q-tkBujS8,"Restaurant, Restaurant Thaïlandais","1 Chem. De Dangeau, Trizay-lès-Bonneval",NA
Cormainville,Sushi’lys,ChIJWc_TUPB_40cRIUdoJZmZoq4,Restaurant De Sushis,"7 Rue Gambetta, Châteaudun",NA
Les Corvées-les-Yys,Le Paradize,ChIJRfb-RLTz40cRFfq2Bx2nV0k,"Kebab, Restaurant De Restauration Rapide","64 Rue Pannard, Courville-sur-Eure",1
Les Corvées-les-Yys,Pizza Service,ChIJpZ2XUnjz40cR03HACdNC_QI,"Restaurant De Pizzas, Restaurant De Restauration Rapide, Restaurant Halal, Restaurant De Hamburgers, Kebab, Restaurant À Emporter, Livraison De Pizzas, Pizza À Emporter, Sandwicherie, Restaurant De Tacos","5 Rue De La Madeleine, Courville-sur-Eure",1
Les Corvées-les-Yys,Ada Délices,ChIJrbqEAPnB40cRD_sfeGQH6PM,"Kebab, Restaurant De Restauration Rapide","3 Rue Du Château, La Loupe",1
Les Corvées-les-Yys,Ozkaya Duran,ChIJMyBjSfjB40cRHseAvVFDLhs,"Kebab, Restaurant De Restauration Rapide, Restaurant De Pizzas","8 Pl. De L'hôtel De Ville, La Loupe",1
Les Corvées-les-Yys,Allo Pizza,ChIJKad2Ycn140cRH5kNuYyHQeY,"Restaurant, Restaurant De Hamburgers, Pizza À Emporter, Magasin De Salades, Sandwicherie, Restaurant De Tacos","5 Pl. De La République, Saint-Georges-sur-Eure",1
Les Corvées-les-Yys,La Table Du Perche,ChIJN_eEiTDr40cRSibh9m4t-b8,"Restaurant Français, Bar, Restaurant","5 Grande Rue, Champrond-en-Gâtine",0
Les Corvées-les-Yys,Le Sebastopol,ChIJN_eEiTDr40cRTWMjExdESXE,"Restaurant, Restaurant Français","24 Grande Rue, Champrond-en-Gâtine",0
Les Corvées-les-Yys,La Croix Blanche,ChIJ4xGCGjKU40cRRlpfP7IW9DI,"Restaurant Français, Hôtel","3 Rue Jean Moulin, Combres",0
Les Corvées-les-Yys,Z'épicuriens,ChIJg_voP6Ht40cRBnlKUZdFYVg,"Restaurant Français, Bar","1 Rue De La Libération, Chuisnes",0
Les Corvées-les-Yys,Restaurant Le Saint Pierre,ChIJaUF8QaWR40cRHgs9rUfvnwI,Restaurant Français,"2 Rue D'illiers, Montigny-le-Chartif",0
Les Corvées-les-Yys,Siècle D’or,ChIJKWwJgDOb40cRR2RCRfAWFKo,Restaurant Chinois,"France, Brou",NA
Les Corvées-les-Yys,Maikruathai,ChIJW4sDv4-H40cRD3q-tkBujS8,"Restaurant, Restaurant Thaïlandais","1 Chem. De Dangeau, Trizay-lès-Bonneval",NA
Les Corvées-les-Yys,Chef Jin Traiteur Asiatique,ChIJ4Yn39Da340cRTYtq3INVhew,"Plats Chinois À Emporter, Restaurant Chinois","20 Rue Villette Gâte, Nogent-le-Rotrou",NA
Les Corvées-les-Yys,Indian Street,ChIJxfTrRUu340cRkbR6hZMzQ-Y,Restaurant Indien,"13 Place St Pol, Nogent-le-Rotrou",NA
Les Corvées-les-Yys,Chez Wang Chartres Lucé,ChIJj_irmoQL5EcRegGgyPvPfic,Restaurant Chinois,"Rue De Touraine, Lucé",NA
Le Coudray,Snack 28,ChIJ-xHwfwcN5EcRowTopBi_baI,"Restaurant, Restaurant De Restauration Rapide, Restaurant Français, Restaurant Halal, Restaurant De Hamburgers, Kebab, Restaurant De Pizzas, Magasin De Salades, Sandwicherie, Restaurant De Tacos","29 Rue Vincent Chevard, Chartres",1
Le Coudray,La Manne,ChIJXz97LOAN5EcRsPkFIYflYTs,"Traiteur, Restaurant Africain, Pâtisserie, Restaurant Caribéen, Restaurant Créole, Restaurant Halal, Pâtisserie, Restaurant Traditionnel, Restaurant Végétarien","28000 Chartres, Chartres",1
Le Coudray,O'tacos Chartres,ChIJ-0051UgM5EcRbEiMxAsrmfA,"Restaurant, Restaurant De Restauration Rapide, Sandwicherie, Restaurant De Tacos","3 Pl. De L'étape Au Vin, Chartres",1
Le Coudray,Mésopotamie,ChIJF34VT0kM5EcRE8YV5RlxPzo,Kebab,"30 Rue Saint-Pierre, Chartres",1
Le Coudray,Pizzwich Bellardi Ubereats &Deliveroo,ChIJb06QnEsM5EcRNHKltm8bwwI,"Restaurant, Kebab, Restaurant De Pizzas, Restaurant De Livraison","28 Rue De La Prte Morard, Chartres",1
Le Coudray,Street Burger,ChIJ0RP1egIN5EcRWZsCD0x0XmQ,"Restaurant, Restaurant De Restauration Rapide, Restaurant Français, Restaurant Sans Gluten, Restaurant De Hamburgers, Restaurant Du Déjeuner, Sandwicherie, Restaurant Végétarien","43 Rue Du Chemin De Couppé, Le Coudray",0
Le Coudray,Les Vagues Abondent,ChIJK6QbKyQN5EcRsXYBspZ4wvs,Crêperie,"2 Imp. De La Suiferie, Le Coudray",0
Le Coudray,Restaurant La Boucherie,ChIJox413wkN5EcRAZ5oFKadqSM,"Restaurant Chophouse, Restaurant Barbecue, Brasserie, Boucherie, Restaurant Familial, Restaurant Français, Restaurant De Steakhouse Français, Salon, Restaurant De Plats De Viande","Le Forum Du Coudray, Le Coudray",0
Le Coudray,Mcdonald's,ChIJYyYs8QkN5EcROi9BLViFqlk,"Restaurant De Restauration Rapide, Restaurant Américain, Restaurant De Hamburgers, Restaurant De Pizzas, Restaurant, Sandwicherie","Lotissement Le Forum Du, Le Coudray",0
Le Coudray,L Aquarelle,ChIJGZtCO68N5EcRf54cPSsJ_oI,Restaurant Français,"5 Rue D'allonnes, Chartres",0
Le Coudray,Festin D'asie,ChIJr1X55gkN5EcRdQNVq3fYxSs,"Restaurant Asiatique, Restaurant Chinois, Restaurant De Sushis","3 Rue De La Maladrerie, Le Coudray",NA
Le Coudray,Restaurant Asiatique,ChIJR_Y1bqcN5EcRlgGUOxPcDLo,Restaurant Asiatique,"Av. D'orléans, Le Coudray",NA
Le Coudray,Le Kashmir Chartres,ChIJ_wtoEQAN5EcRYRecbEzBVKQ,"Restaurant Indien, Restaurant Pakistanais","28000 Fr, Luisant",NA
Le Coudray,Sakura Du Paradis,ChIJcQo0G08M5EcR3ru6YED4A7w,"Restaurant Japonais, Restaurant, Restaurant De Sushis","11 Rue Saint-Michel, Chartres",NA
Le Coudray,Chichiko,ChIJHTEfTQAN5EcRc1SARXMkd-c,Restaurant Coréen,"13 Rue Des Pierres Missigault, Barjouville",NA
Coudray-au-Perche,Berlinois Döner Kebab,ChIJ9V3gHJ2340cRI5Q5F020jMg,Restaurant De Kebab Doner,"38 Rue Paul Deschanel, Nogent-le-Rotrou",1
Coudray-au-Perche,Resto St Pol,ChIJdZeO6za340cRyqwobsQoiOA,Restaurant Turc,"Place Gén De Saint Pol 14, Nogent-le-Rotrou",1
Coudray-au-Perche,Grill İstanbul,ChIJrTupN0-340cR0imb-T1OCo4,"Kebab, Gril, Restaurant De Pizzas, Restaurant Turc","29 Rue Giroust, Nogent-le-Rotrou",1
Coudray-au-Perche,Capadocce,ChIJz6eKOjG340cRl7TIacl_fOE,"Restaurant Turc, Restaurant De Restauration Rapide, Kebab","3b Rue Tochon, Nogent-le-Rotrou",1
Coudray-au-Perche,La Cuisine Du Soleil,ChIJTa-cdDtT4kcR9-ovHsfvqDk,"Restaurant De Restauration Rapide, Restaurant Halal","37 Rue De Paris, La Ferté-Bernard",1
Coudray-au-Perche,Le Saint-Pierre,ChIJ48qY202l40cR6MuC32KHsAk,Restaurant Français,"3 Rue De La Rhône, Coudray-au-Perche",0
Coudray-au-Perche,Restaurant Du Golf Du Perche,ChIJYcwhR-6640cRyou3gRLmxfA,"Restaurant, Restaurant Français","La Vall. Des Aulnes, Souancé-au-Perche",0
Coudray-au-Perche,Restaurant Le Lion D'or,ChIJqQdLR-Wt40cR_SM-RARYdVM,"Restaurant, Bar, Restaurant Français","3 Rue Du Theil, Ceton",0
Coudray-au-Perche,Restaurant De La Halle,ChIJrZA4gsK840cRcBbs_s5CWkA,"Restaurant, Bar, Bar À Tabac, Café, Restaurant Français","5 Pl. De La Halle, Beaumont-les-Autels",0
Coudray-au-Perche,Brocéliande,ChIJB_yK2TW340cRsJafy64L-HA,Crêperie,"28 Rue De Sully, Nogent-le-Rotrou",0
Coudray-au-Perche,Chef Jin Traiteur Asiatique,ChIJ4Yn39Da340cRTYtq3INVhew,"Plats Chinois À Emporter, Restaurant Chinois","20 Rue Villette Gâte, Nogent-le-Rotrou",NA
Coudray-au-Perche,Indian Street,ChIJxfTrRUu340cRkbR6hZMzQ-Y,Restaurant Indien,"13 Place St Pol, Nogent-le-Rotrou",NA
Coudray-au-Perche,L’étoile D’asie,ChIJw0AlbS-340cRUWBSRexE84s,"Restaurant, Restaurant Asiatique, Restaurant Chinois, Restaurant De Sushis","19 Av. De La Victoire Du 11 Novembre 1918, Nogent-le-Rotrou",NA
Coudray-au-Perche,Fast Biryani,ChIJX27Q9bVT4kcRwBZOJGa0Fhc,Restaurant Indien,"8 Rue Ledru-Rollin, La Ferté-Bernard",NA
Coudray-au-Perche,Fleur De Lotus,ChIJOTfv0DxT4kcR1jDybl62avI,"Restaurant Mandarin, Restaurant Thaïlandais, Restaurant Vietnamien","10 Rue Jean Courtois, La Ferté-Bernard",NA
Coulombs,Lakasbah2,ChIJ3QvGDUAD5EcR1iosV9aafJY,"Restaurant De Restauration Rapide, Restaurant Halal, Restaurant Turc","18 Rue Du Général De Gaulle, Nogent-le-Roi",1
Coulombs,"Larri's Food (Pizzeria ,Kebab ,Tacos,Burgers)",ChIJK7nlQi4D5EcRhlkUiSCLz_8,"Restaurant De Pizzas, Restaurant De Restauration Rapide, Livraison De Pizzas, Pizza À Emporter, Restaurant, Sandwicherie","39 Rue Du Général De Gaulle, Nogent-le-Roi",1
Coulombs,K-Burger (Sarl),ChIJ7QyHZ4EB5EcRsms-zxct3tw,"Restaurant, Restaurant De Restauration Rapide, Restaurant De Hamburgers, Kebab, Restaurant De Tacos","72 Grande Rue, Villemeux-sur-Eure",1
Coulombs,Restaurant _ Oriental La Rose Des Sables,ChIJ3SEHE-Ia5EcR26ooOatHf88,"Restaurant, Restaurant Français, Restaurant Du Déjeuner, Restaurant Méditerranéen, Restaurant Marocain, Magasin De Salades, Restaurant De Fruits De Mer","3 Rue Collin D'harleville, Maintenon",1
Coulombs,Cappadoce,ChIJESAvFeIa5EcRp2wA4XJaSso,"Restaurant Turc, Kebab","8 Pl. Aristide Briand, Maintenon",1
Coulombs,Le Palais Breton,ChIJQ6r4NjcD5EcRxUbmBJCC1HM,"Crêperie, Restaurant Français","1 Rue De La Cavée De Houdan, Coulombs",0
Coulombs,O'bistro,ChIJOaL1hD8D5EcRog1VRhpMuP0,"Brasserie, Bar, Bistro, Traiteur, Restaurant Français, Restaurant","20 Rue De La Volaille, Nogent-le-Roi",0
Coulombs,Traiteur Asiatique La Bienvenue,ChIJ34MRkUAD5EcRcB8NkHzDT48,"Restaurant, Magasin De Bière, Restaurant De Petit-Déjeuner, Bar À Cocktails, Restaurant Français, Restaurant De Hamburgers, Restaurant Du Déjeuner, Magasin De Salades, Restaurant Traditionnel","6 Pl. De L'étoile, Nogent-le-Roi",0
Coulombs,Le Capucin Gourmand,ChIJ3UD8bUAD5EcRY7e8ne5Q0-U,Restaurant Haut De Gamme Français,"1 Rue De La Volaille, Nogent-le-Roi",0
Coulombs,Relais Des Remparts,ChIJnbW7q2oD5EcRRevpGE4ICts,"Restaurant Français, Restaurant Gastronomique, Restaurant Haut De Gamme Français","2 Rue Du Marché Aux Légumes, Nogent-le-Roi",0
Coulombs,Punjab,ChIJh3t-A0YD5EcRvBj6Fpg8oHE,Restaurant Indien,"2 Rue De L'église, Nogent-le-Roi",NA
Coulombs,Maison Huang,ChIJ37_yyUYb5EcR6U0zXA1dyUc,Restaurant Chinois,"Fr, Maintenon",NA
Coulombs,Asian Lounge,ChIJ19iWkdob5EcRWwCUGYElZZg,Restaurant Japonais,"24 Rue De La Ferté, Maintenon",NA
Coulombs,Grill 168,ChIJE13qCgIZ5EcRVbfh1tA8U0M,"Restaurant Asiatique, Restaurant Chinois, Restaurant Japonais, Restaurant De Sushis","200 Av. De L'europe, Épernon",NA
Coulombs,Nagoya,ChIJA2ZGnzRV4UcRY7GpY1oXHwo,Restaurant De Sushis,"15 Rue De Rome, Vernouillet",NA
Courbehaye,Lorient Kebab,ChIJh_toi3Jh5EcRLGCgyyyrPwc,Restaurant De Pizzas,"1 Place Ste Barbe, Orgères-en-Beauce",1
Courbehaye,Ludovic Brassaud,ChIJwZv8BkNl5kcRQqizLYFguJg,"Traiteur, Pâtisserie, Restaurant Français, Restaurant Halal, Restaurant Du Déjeuner, Pâtisserie, Restaurant Végétarien","Amoinville, Éole-en-Beauce",1
Courbehaye,Restaurant Méditerranée,ChIJk4U6dSlp5EcRrBf4W44hbso,"Restaurant, Kebab, Restaurant De Pizzas, Pizza À Emporter, Sandwicherie","16 Rue Du Voisin, Les Villages Vovéens",1
Courbehaye,Launay Traiteur,ChIJ23v3gg1p5EcRn7hm6C16hVQ,"Traiteur, Magasin De Bière, Pâtisserie, Restaurant Français, Restaurant Sans Gluten, Restaurant Halal, Pâtisserie, Restaurant Végétalien, Restaurant Végétarien","1 Bis Rue Du Dr Rabourdin, Les Villages Vovéens",1
Courbehaye,Kebab Grille Janville,ChIJlQm6zHNQ5EcRAeJmZgMAUNo,"Kebab, Gril, Restaurant De Pizzas, Restaurant De Tacos","5 Pl. Du Martroi, Janville-en-Beauce",1
Courbehaye,Le Commerce,ChIJvZI7vqtl5EcRm9oaCqOgm1g,"Restaurant, Restaurant Français, Bar","6 Pl. Du Marché, Sancheville",0
Courbehaye,Le Saint Florian,ChIJVRHyYUr15EcR_FBQFUiGegE,"Bar, Restaurant Français","21 Rue De La Croix Blanche, Patay",0
Courbehaye,Restaurant De La Mairie,ChIJbey00Chp5EcRX8ZjIQ0zrB4,Restaurant Français,"18 Rue Roger Gommier, Les Villages Vovéens",0
Courbehaye,Le Relais Saint Jacques,ChIJ3802ar6L5EcRXEQrI-FgVnE,"Restaurant, Restaurant Français, Hôtel","35 Rue De La Mairie, Tournoisis",0
Courbehaye,Le Francoeur,ChIJ7YrpdgBD5EcRSNsXXzDChzQ,Restaurant Français,"6qmm+5v, Guilleville",0
Courbehaye,Feng,ChIJCyWN0bp55EcRVhY_sLTwHYg,Restaurant Chinois,"20 Rue De Chartres, Bonneval",NA
Courbehaye,Maikruathai,ChIJW4sDv4-H40cRD3q-tkBujS8,"Restaurant, Restaurant Thaïlandais","1 Chem. De Dangeau, Trizay-lès-Bonneval",NA
Courbehaye,"Le Royal Wok, Châteaudun",ChIJHUvyGRGA40cR0wiR-AZnC7M,"Restaurant Chinois, Restaurant Asiatique, Restaurant","1-23 Chem. Des Basses Garennes, Châteaudun",NA
Courbehaye,Le Punjab Grill,ChIJI8eRDVZ_40cRd3GIOKw7WfA,Restaurant Indien,"75bis Rue De La République, Châteaudun",NA
Courbehaye,Délice Châteaudun,ChIJa4KEMvV_40cRbXBvi-koy68,Plats Chinois À Emporter,"32 Pl. Du 18 Octobre, Châteaudun",NA
