respondent.commune,business_name,place_id,fr_categories,business_address,treatment_arm
29147,Restaurant Bar Bowling L'eden Bowl,ChIJq5GmLKT6EEgR48XSD2dThvg,"Salle De Bowling, Restaurant Américain, Bar, Restaurant Italien, Restaurant De Pizzas, Pizza À Emporter, Salle De Billard, Pub, Magasin D'articles De Sport","Zc De Kervidanou 3 Lieu-Dit, Mellac",0
29147,Bionems,ChIJ12lYqC77EEgRiE7cYywN3-c,"Restaurant Vietnamien, Restaurant De Fondue Chinoise, Restaurant Bio","52 Rue De Pont-Aven, Quimperlé",2
29147,La Raffineriz,ChIJ9Zg293P6EEgRCfR_JpFmhS0,"Restaurant Japonais, Restaurant De Sushis","4 Pl. Carnot, Quimperlé",2
29147,Bao&Cie Street Food Vietnamienne,ChIJhezr0eb7EEgRvCLHfFmttZk,"Restaurant Vietnamien, Restaurant De Fondue Chinoise, Restaurant Thaïlandais","21 Rue De Moëlan, Quimperlé",2
29147,Nguyen Thi Thu,ChIJSSUtUHb6EEgRzHH2ctHyluE,Restaurant Asiatique,"16 Rue De Clohars, Quimperlé",2
29147,Kinh Dô,ChIJ55LCU3b6EEgR1mDZQXTgPL8,"Restaurant Vietnamien, Restaurant Chinois","16 Rue De Clohars, Quimperlé",2
29148,Le Ty Kebab,ChIJr38mtgPjE0gROdqv9wzkAbc,Kebab,"Le Croissant, Plougoulm",1
29148,Kreisker Kebab,ChIJq6p-UobhE0gRpHZay2PEBH0,Restaurant,"1 Rue Cadiou, Saint-Pol-de-Léon",1
29148,Asya Kebab,ChIJF0DPxobhE0gRodq4cbn02Eo,"Kebab, Restaurant De Restauration Rapide","7 Pl. Alfred De Guébriant, Saint-Pol-de-Léon",1
29148,Oz Kebab,ChIJlWz-3IbhE0gROs1SsGf9k2Y,Restaurant,"7 Pl. Alfred De Guébriant, Saint-Pol-de-Léon",1
29148,Royal Kebab,ChIJ_Sxh3An-E0gR4Z5I_sPWXOg,"Kebab, Restaurant De Restauration Rapide","44 Rue Maréchal Foch, Plouescat",1
29148,Crêpes : Chez Évelyne,ChIJcRDrArZYEUgRhrNllada-Ww,Crêperie,"Bel Air, Plouénan",0
29148,Moulin De Kerguiduff,ChIJYcEf7-pXEUgR_4ncNVEFgy4,Restaurant Français,"Kerguidu, Tréflaouénan",0
29148,Sm'art Club Cafe Snack Animation Bar Restauration,ChIJkSM65ZFZEUgRaj1hplSiGHg,Bar Et Grill,"4 Rue Charles De Gaulle, Plouvorn",0
29148,Le Comptoir Des Johnnies,ChIJ_-aCpGZfEUgR2A-P5UfZ990,Restaurant Français,"Château De Kerlaudy, Plouénan",0
29148,"Un Jour, Une Crêpe",ChIJgY2UgCNXEUgRu7n3OuGTmV8,"Restaurant De Restauration Rapide, Crêperie","6 Pl. Du Champ De Foire, Plouzévédé",0
29148,Ô Vietnam,ChIJD3XppLtZEUgRn3YlY1RXSQU,Restaurant Vietnamien,"5 Impasse Des Marronniers, Plouvorn",2
29148,Wok & Grill,ChIJ91bPtLZgEUgRXwlOYsqxiH4,"Restaurant Chinois, Restaurant De Sushis","Rue Goarem Pella, Saint-Martin-des-Champs",2
29148,Pao Klua Thaï,ChIJf0bP1WFbEUgRoi0eohWfPbA,Restaurant Thaïlandais,"2, Lieu-Dit, Guiclan",2
29148,Sim Sushi,ChIJ-5Godl1REUgRwqJlchYC5-8,Restaurant De Sushis,"17 Rue Saint-Guenal, Landivisiau",2
29148,La Baie D'halong,ChIJXdtLPk7hE0gRJNWdN3xxaYA,"Restaurant Vietnamien, Restaurant Asiatique, Bar, Restaurant Chinois, Restaurant Thaïlandais","22 Rue Gambetta, Roscoff",2
29150,Amara Kebab 2,ChIJ07MxVtzvEEgRYWjGtu4dq00,Restaurant,"2 Rue Des Plages, Moëlan-sur-Mer",1
29150,Amed Kebab,ChIJvdJPCKbDEEgRhXD8sc6IbdM,Restaurant Turc,"4 Pl. De La Chapelle Sainte-Barbe, Névez",1
29150,Breizh Kebab,ChIJHQfnrtn7EEgRxgwfa7pVvBo,"Restaurant, Restaurant De Restauration Rapide","3 Rue Mellac, Quimperlé",1
29150,Jiyan Kebab,ChIJv54k-3T6EEgRFpZN_wE003I,"Kebab, Restaurant De Restauration Rapide","21 Rue Du Bourgneuf, Quimperlé",1
29150,La Cappadoce Kebab,ChIJoZ5w2B_0EEgRzurFwCkP5ys,"Restaurant Turc, Restaurant Familial, Kebab","2 Rue De Saint-Maurice, Guidel",1
29150,Huitres Morvan,ChIJgYxDpSvsEEgRskdDZPzCjVI,"Ferme De Fruits De Mer, Ferme Piscicole, Restaurant De Fruits De Mer","Ria De Merrien, Moëlan-sur-Mer",0
29150,La Poêlée Toquée,ChIJW-_xlkXuEEgRUatt56Rx4jg,"Restaurant Français, Restaurant Méditerranéen","12 Rue De Braspart, Moëlan-sur-Mer",0
29150,Les Saveurs Du Puits,ChIJaWoif0buEEgRTNMJM7h6GLM,"Restaurant Français, Restaurant","13 Rue Pont Ar Laer, Moëlan-sur-Mer",0
29150,L'auberge De La Mer,ChIJXabRIG3pEEgRWkg3KsIc-SE,"Restaurant, Restaurant Français","23 Hent Ar Mor, Moëlan-sur-Mer",0
29150,Creperie Le Preau,ChIJWYYZ0EXuEEgRSApwr469OpU,"Crêperie, Restaurant Français","3 Rue Des Plages, Moëlan-sur-Mer",0
29150,Bao&Cie Street Food Vietnamienne,ChIJhezr0eb7EEgRvCLHfFmttZk,"Restaurant Vietnamien, Restaurant De Fondue Chinoise, Restaurant Thaïlandais","21 Rue De Moëlan, Quimperlé",2
29150,Nguyen Thi Thu,ChIJSSUtUHb6EEgRzHH2ctHyluE,Restaurant Asiatique,"16 Rue De Clohars, Quimperlé",2
29150,Kinh Dô,ChIJ55LCU3b6EEgR1mDZQXTgPL8,"Restaurant Vietnamien, Restaurant Chinois","16 Rue De Clohars, Quimperlé",2
29150,Bionems,ChIJ12lYqC77EEgRiE7cYywN3-c,"Restaurant Vietnamien, Restaurant De Fondue Chinoise, Restaurant Bio","52 Rue De Pont-Aven, Quimperlé",2
29150,La Raffineriz,ChIJ9Zg293P6EEgRCfR_JpFmhS0,"Restaurant Japonais, Restaurant De Sushis","4 Pl. Carnot, Quimperlé",2
29151,La Ruche Kebab Morlaix,ChIJcw7n1jJhEUgR9vRV0UKnPXQ,"Restaurant De Restauration Rapide, Kebab","30 Route De Paris, Morlaix",1
29151,Kebab De Plouigneau,ChIJowRbgollEUgR11stu8vgENQ,Restaurant De Restauration Rapide,"18 Rue Du 9 Août, Plouigneau",1
29151,Kebab Antalya,ChIJT_M1Ss5dEUgRlN4vCMEn37U,Restaurant Turc,"82 Rue De La République, Pleyber-Christ",1
29151,Kreisker Kebab,ChIJq6p-UobhE0gRpHZay2PEBH0,Restaurant,"1 Rue Cadiou, Saint-Pol-de-Léon",1
29151,Asya Kebab,ChIJF0DPxobhE0gRodq4cbn02Eo,"Kebab, Restaurant De Restauration Rapide","7 Pl. Alfred De Guébriant, Saint-Pol-de-Léon",1
29151,L'hermine,ChIJJ3qLpC1hEUgRS1lQMNVKeYk,Crêperie,"35 Rue Ange De Guernisac, Morlaix",0
29151,Lipouz Restaurant,ChIJTVXhHSxhEUgR6ox-4ADhwJ0,"Restaurant, Restaurant Français, Restaurant Méditerranéen","39 Pl. Charles De Gaulle, Morlaix",0
29151,L'echappée,ChIJJfV0vENhEUgRNT9wbW5_kFY,"Restaurant, Bar, Bistro","185 Coat Congar, Morlaix",0
29151,Le Bains-Douches,ChIJ-59f2jJhEUgRiyq_qUNCiUA,"Restaurant Français, Bar, Restaurant","45 All. Du Poan Ben, Morlaix",0
29151,Le Grand Café De La Terrasse,ChIJjzWKUixhEUgRVgIrl33Mvjc,"Restaurant Français, Bar","31 Pl. Des Otages, Morlaix",0
29151,Saigon,ChIJUZx3BcBhEUgRm_LMUQV0978,Restaurant Vietnamien,"4 Ven. Au Son, Morlaix",2
29151,Indochine Specialites Asiatiques,ChIJLzMiri5hEUgRBtDOb0HP2XA,"Restaurant Vietnamien, Restaurant Asiatique, Restaurant Chinois, Restaurant, Restaurant Thaïlandais","31 Pl. Charles De Gaulle, Morlaix",2
29151,Le Rajasthan,ChIJCxbEJ5thEUgRWUD3nHPGqUc,Restaurant Indien,"24 Rue Ange De Guernisac, Morlaix",2
29151,Le Taj Mahal,ChIJwXHyRS1hEUgRdmw3s_R3Qxg,"Restaurant Indien, Bar, Restaurant","3 Pl. De Viarmes, Morlaix",2
29151,Sim Sushi,ChIJn2xa3Y1nEUgRJapQCvQUex4,Restaurant Japonais,"Centre Commercial La Galerie Carrefour, Saint-Martin-des-Champs",2
29152,La Brasserie Marocaine,ChIJiTTd3QgMEUgRlLESLbdW7qg,"Restaurant Marocain, Brasserie, Restaurant De Couscous, Restaurant De Hamburgers, Restaurant À Emporter, Bar À Vin","2 Pl. De La Mairie, Carhaix-Plouguer",1
29152,Bosphore Kebab,ChIJV6TjLvYLEUgRsKZWx6wAUiE,"Kebab, Restaurant Turc","31 Rue Des Martyrs, Carhaix-Plouguer",1
29152,Antalya Kebab,ChIJm09G8PYLEUgRVx-u-j85Ot0,"Restaurant Turc, Restaurant De Restauration Rapide, Kebab","22 Av. Du Général De Gaulle, Carhaix-Plouguer",1
29152,Dounia Kebab,ChIJJ7mrw_YLEUgRDN3NHg24ms0,"Kebab, Restaurant De Restauration Rapide","37 Av. Du Général De Gaulle, Carhaix-Plouguer",1
29152,Kebab De La Gare Gourin,ChIJofeL-3kFEUgRoTEMH6Wn-LA,Restaurant De Restauration Rapide,"2 Rue De La Gare, Gourin",1
29152,L'etape,ChIJ-Z21N0APEUgRw1_th9yevvk,"Crêperie, Bar, Restaurant Français, Restaurant À Emporter","Moulin Neuf, Motreff",0
29152,Le Relais Des Montagnes Noires,ChIJB4g_ekMPEUgROIVIQbx00fw,"Restaurant Français, Bar","Pont Kervranneg, Saint-Hernin",0
29152,Auberge Du Poher,ChIJf51N4-0OEUgR4ozW-rUUMWM,"Restaurant Français, Bar","D769 Port De Carhaix, Motreff",0
29152,Koz Kastell,ChIJzw55OgAPEUgRqXMLzZvAwiU,Crêperie,"154 Ecl De Koz Kastell, Saint-Hernin",0
29152,Restaurant Les Retrouvailles,ChIJj1ZMJbMJEUgReS0iBkzpUlU,"Restaurant, Bar, Restaurant Français","15 Pl. De La Mairie, Plévin",0
29152,Karaez Thaï Food,ChIJnzoWIQkMEUgRgNvqGNPOP8I,Restaurant Thaïlandais,"8 Rue Brizeux, Carhaix-Plouguer",2
29152,Matin Calme,ChIJPZfPsBMLEUgRFui6umpjwYU,Restaurant Coréen,"26 Av. Du Général De Gaulle, Carhaix-Plouguer",2
29152,Au Petit Viet Linh,ChIJbY_i9vYLEUgRnMZCHOTc_Lc,Restaurant Vietnamien,"16 Av. Du Général De Gaulle, Carhaix-Plouguer",2
29152,Dragon D'asie,ChIJqa70q_ELEUgRTll_syhUVH0,"Restaurant, Restaurant Asiatique, Restaurant Chinois","24 Av. Victor Hugo, Carhaix-Plouguer",2
29152,Thai Kitchen,ChIJpwIKu2MlEUgRHMFRVFrpmNQ,"Restaurant, Restaurant Du Déjeuner, Restaurant Thaïlandais","10 Rue Laennec, Briec",2
29153,Amed Kebab,ChIJvdJPCKbDEEgRhXD8sc6IbdM,Restaurant Turc,"4 Pl. De La Chapelle Sainte-Barbe, Névez",1
29153,Chez Cetin Tacos,ChIJo6BhpErDEEgRUkDtk-5I0uA,"Restaurant, Restaurant De Tacos","12 Rue De Concarneau, Trégunc",1
29153,Amara Kebab 2,ChIJ07MxVtzvEEgRYWjGtu4dq00,Restaurant,"2 Rue Des Plages, Moëlan-sur-Mer",1
29153,Le Touareg,ChIJK7OAVhjbEEgRUmRhXWXDhWQ,"Restaurant, Restaurant Méditerranéen, Restaurant Marocain","71 Av. Alain Le Lay, Concarneau",1
29153,Istanbul Kebab Rosporden,ChIJfbr3I0LeEEgRX90pkViDXPQ,"Restaurant Turc, Restaurant De Restauration Rapide","13 Rue Hippolyte Le Bas, Rosporden",1
29153,Ar Men Du,ChIJx7pYHxbCEEgREej1x_A1F5E,"Restaurant Haut De Gamme Français, Hôtel","47 Rue Des Îles, Névez",0
29153,Les Gâs De Névez,ChIJ05sdUH3CEEgRzzeu9ykAlWg,"Restaurant, Restaurant Français","4 Pl. De L'église, Névez",0
29153,La Table De Nêz,ChIJrSIG9i3DEEgRXvHxnGgBDHU,"Restaurant, Crêperie","21 Pl. De L'église, Névez",0
29153,Le Dragon Et La Girafe,ChIJu5rUtIbDEEgRrmw9faIVcRQ,Crêperie,"32 Tremorvezen, Névez",0
29153,La Châtaigneraie,ChIJa1N4XqLpEEgRY59sBzRygQ0,"Restaurant Français, Crêperie, Glacier","16 Rue De La Plage, Névez",0
29153,Taj Mahal Restaurant,ChIJC3s1UiHbEEgRQq_VISU9xVc,"Restaurant, Magasin De Bière, Bar À Cocktails, Restaurant Indien, Bar À Vin","1 Rue Alfred Leray, Concarneau",2
29153,Sushi Nami,ChIJnWVwhpjbEEgRipTdHL9YNs4,Restaurant Japonais,"43 Av. De La Gare, Concarneau",2
29153,Thaï Box,ChIJH2dEFx_bEEgRlF2U63AiM3s,"Restaurant Thaïlandais, Restaurant De Restauration Rapide","51 Av. De La Gare, Concarneau",2
29153,Bao&Cie Street Food Vietnamienne,ChIJhezr0eb7EEgRvCLHfFmttZk,"Restaurant Vietnamien, Restaurant De Fondue Chinoise, Restaurant Thaïlandais","21 Rue De Moëlan, Quimperlé",2
29153,Bionems,ChIJ12lYqC77EEgRiE7cYywN3-c,"Restaurant Vietnamien, Restaurant De Fondue Chinoise, Restaurant Bio","52 Rue De Pont-Aven, Quimperlé",2
29155,L Oriental Kebab,ChIJWyak09WTFkgR2dTU5KkFQpc,"Restaurant, Restaurant De Livraison, Service D'expédition","8 Rue Pen Ar Bed, Plougonvelin",1
29155,Le Délicieux Kebab,ChIJHV_smdOYFkgR7nQJsiE_w9E,"Kebab, Restaurant De Restauration Rapide","9 Rue Henri Provostic, Ploudalmézeau",1
29155,Ty Korn Ouessant,ChIJEX9Li0d7FkgRGGQBhuLnNNc,"Pub, Bar, Restaurant Français, Restaurant De Fruits De Mer","Le Bourg, Ouessant",0
29155,Crêperie Du Stang,ChIJ52wG4Ud7FkgRHEz_y8S-RpE,"Crêperie, Restaurant","Le Bourg, Ouessant",0
29155,Les Pointes Du Kailhoù,ChIJWfSUlAh7FkgRRir8qxIjf28,Brasserie,"Stang Ar Glan, Ouessant",0
29155,Ar Piliguet Restaurant,ChIJLcZ4jkd7FkgR23Zr5SZ7NUM,"Restaurant, Restaurant Français Moderne, Restaurant, Restaurant De Fruits De Mer, Bar À Vin","29242 Ouessant, Ouessant",0
29155,Y'a Skiff,ChIJCwJKdjgdDkgRDiVDqY-O50M,"Restaurant, Restaurant Français, Épicerie Fine, Bar À Vin","Place De L'église, Ouessant",0
29156,Good Time,ChIJJzjpMNuyFkgRVOlNjuGzs2A,"Restaurant De Restauration Rapide, Restaurant Italien, Restaurant De Pizzas, Restaurant De Tacos","12 Rue Du Pont, Landerneau",1
29156,L'elorn Kebab,ChIJAcCJM9uyFkgR4d0j_Bss-cs,Restaurant,"9 Rue Du Pont, Landerneau",1
29156,Restaurant Kardelen,ChIJuapAqMSyFkgRhZ0bHJfaucY,"Restaurant Turc, Restaurant De Restauration Rapide, Kebab, Restaurant","14 Rue De La Font Blanche, Landerneau",1
29156,Helline Kebab,ChIJ5Zos39yyFkgRRMAywrlsnt0,"Restaurant Turc, Restaurant De Restauration Rapide, Kebab","42 Quai De Léon, Landerneau",1
29156,Kemer Kebab,ChIJK11N9hi3FkgRG7V-X9w1w58,Kebab,"3 Pl. Du Calvaire, Plougastel-Daoulas",1
29156,Les Quatre Pompes,ChIJM4q0O9uyFkgRcdVpnybPRK8,"Restaurant, Restaurant Français","2 Pl. Des 4 Pompes, Landerneau",0
29156,La Crêperie Du Pont,ChIJBRBpMNuyFkgRvpO9MR8qfpc,"Crêperie, Restaurant Français","Le Pont Habité, Landerneau",0
29156,Le Rohan Le 1510,ChIJc1bhJNuyFkgR9ithfQ-wwMk,"Restaurant, Restaurant Français","11 Rue Du Pont, Landerneau",0
29156,Creperie Grill Entre Terre Et Mer,ChIJZXRjQtuyFkgRIJiAV3YSKFk,"Crêperie, Gril, Restaurant Français","17 Quai De Cornouaille, Landerneau",0
29156,La Duchesse Anne - Salon De Thé & Crêperie,ChIJdwb4s8SyFkgR-KzrwdGGd1I,"Salon De Thé, Café, Crêperie, Monument Culturel, Monument Historique","9 Pl. Du Général De Gaulle, Landerneau",0
29156,Restaurant Thailand'erne Landerneau,ChIJkRqKV8OyFkgRzMF-1vIV63w,"Restaurant Thaïlandais, Restaurant Asiatique, Restaurant Japonais, Restaurant De Sushis, Sushis À Emporter, Restaurant Végétarien","18 Rue De La Font Blanche, Landerneau",2
29156,Sarl Baan Thai & Sushi,ChIJV1eHV8OyFkgRj2zYdeE-f6c,"Restaurant De Sushis, Restaurant Japonais, Restaurant Thaïlandais","18 Rue De La Font Blanche, Landerneau",2
29156,Shish Mahal,ChIJS3euztyyFkgRveyPiXeK_Ug,Restaurant Indien,"8 Rue De Brest, Landerneau",2
29156,Pondicherry,ChIJK7V6w2mzFkgRRf9Z7BXiiIw,Restaurant Indien,"55 Rue De Brest, Landerneau",2
29156,Sushi Manga Sensei,ChIJIw-vFF63FkgR3nOHXg4uUgA,Restaurant Asiatique,"7 Rue De L'église, Plougastel-Daoulas",2
29158,Bosphore Kebab,ChIJgSEi8_owF0gRHJNV8KLVzqY,"Restaurant Turc, Restaurant De Restauration Rapide, Kebab, Restaurant","35 Rue De La Marine, Guilvinec",1
29158,Mashallah,ChIJT-gnvfctF0gRDDZTjn_nplw,Kebab,"4 Pl. Du Pont Guern, Pont-l'Abbé",1
29158,Ploneour Kebab,ChIJ20Pct4kvF0gRIyo_-mNqwAY,Restaurant,"18 Rue Jules Ferry, Plonéour-Lanvern",1
29158,Restaurant Ty Grill Et Mezze,ChIJ049lNgvVEEgR9HFSzTEkW8U,Restaurant Turc,"24 Hent Kerfram, Plomelin",1
29158,Elfida Kebab&Tacos Restaurant,ChIJv_sCypbhFkgR18CX6MSX1qQ,Restaurant,"3 Rue Victor Hugo, Audierne",1
29158,Restaurant Haut-Linage,ChIJy0qSIlo7F0gRyqNS-dlHM7E,Restaurant Haut De Gamme Français,"Pl. Du Maréchal Davout, Penmarch",0
29158,Restaurant Hôtel Le Sterenn,ChIJ3ZbVhhs7F0gRd2AalCaQhqE,"Restaurant Haut De Gamme Français, Hôtel","432 Rue De La Joie, Penmarch",0
29158,Tomcafé,ChIJT-99wKQ7F0gRSoUVGXFEbEE,"Restaurant, Bar, Brasserie, Crêperie, Bar De Musique Live, Restaurant De Pizzas","413 Rue Du Musée De La Préhistoire, Penmarch",0
29158,Les Ondines,ChIJQUUPvhs7F0gRqANUBoUt9H8,"Restaurant, Restaurant Français, Hôtel","90 Rue Pasteur, Penmarch",0
29158,Bar Restaurant Le Doris,ChIJLeAfI5I6F0gR2_CZrV0D_Bc,"Restaurant, Bar, Restaurant De Fruits De Mer","55 Quai Du Général De Gaulle, Penmarch",0
29158,Sushi Sakana,ChIJrXvnivkxF0gRcE9iF1KyFZQ,Restaurant Japonais,"1 Rue Pen Allée, Plomeur",2
29158,Ô Ty Viet,ChIJ5YSXDLMtF0gRm3iIHy_6FCs,Restaurant Vietnamien,"Les Halles, Pont-l'Abbé",2
29158,Thaï Street Food,ChIJgysAsb8tF0gRrgNJRyld4Wo,Restaurant Thaïlandais,"13 Rue De La Gare, Pont-l'Abbé",2
29158,Restaurant Asiatique Aigle Royal,ChIJLV1LkSTUEEgRoq_sdzcGeKg,"Restaurant Asiatique, Restaurant Buffet, Restaurant Chinois, Restaurant Japonais, Restaurant De Sushis","440 Rte De Bénodet, Quimper",2
29158,Restaurant La Baguette D'or,ChIJz71-VBvREEgRgm90nqYQ5lM,"Restaurant, Bar, Restaurant Chinois, Restaurant Vietnamien","15 Chem. De Toul An Ael, Fouesnant",2
29159,Ploneour Kebab,ChIJ20Pct4kvF0gRIyo_-mNqwAY,Restaurant,"18 Rue Jules Ferry, Plonéour-Lanvern",1
29159,Restaurant Ty Grill Et Mezze,ChIJ049lNgvVEEgR9HFSzTEkW8U,Restaurant Turc,"24 Hent Kerfram, Plomelin",1
29159,Mashallah,ChIJT-gnvfctF0gRDDZTjn_nplw,Kebab,"4 Pl. Du Pont Guern, Pont-l'Abbé",1
29159,Chez Ali,ChIJuyk_SiHVEEgRV_DExg8FDig,"Restaurant Marocain, Restaurant Arabe, Restaurant De Couscous, Restaurant Familial, Restaurant Halal, Restaurant Du Déjeuner, Restaurant À Emporter, Restaurant Nord-Africain, Restaurant, Restaurant Végétarien","6bis Av. De La Libération, Quimper",1
29159,O’delices Restaurant Kebab,ChIJ1XYpfmTRFkgRwaWi0NqjfLA,"Kebab, Restaurant De Restauration Rapide, Restaurant Turc","53 Rue Duguay Trouin, Douarnenez",1
29159,Vince Et Versa,ChIJH5loNE0vF0gR9B6rtAsC5RU,"Crêperie, Restaurant Français, Restaurant","5 Vc Grand Rue, Tréogat",0
29159,Brasserie De Pouldreuzic,ChIJ83XiJkQmF0gRCq1aATz1X24,Brasserie,"Tregonguen Névez, Pouldreuzic",0
29159,La Crêpe Postale,ChIJ4dMEUoEnF0gRuBdN8DfNKek,Crêperie,"31 Rue De Plozevet, Pouldreuzic",0
29159,Delarue Régis,ChIJ6T-Nud0uF0gRmlWUrl2qeHQ,"Marché Aux Fruits De Mer, Restaurant De Fruits De Mer","5 Rue Des Alliés, Plonéour-Lanvern",0
29159,L'attrape Crêpes - Food Truck,ChIJ4fXiSEMvF0gRoB04PsfvdQs,Crêperie,"29720 Plonéour-Lanvern, Plonéour-Lanvern",0
29159,Thaï Street Food,ChIJgysAsb8tF0gRrgNJRyld4Wo,Restaurant Thaïlandais,"13 Rue De La Gare, Pont-l'Abbé",2
29159,Ô Ty Viet,ChIJ5YSXDLMtF0gRm3iIHy_6FCs,Restaurant Vietnamien,"Les Halles, Pont-l'Abbé",2
29159,Sushi Sakana,ChIJrXvnivkxF0gRcE9iF1KyFZQ,Restaurant Japonais,"1 Rue Pen Allée, Plomeur",2
29159,Le Mahraja,ChIJJaqd45LVEEgR1160PD_u9Lk,"Restaurant Indien, Restaurant À Emporter, Restaurant Pakistanais","43 Bd Amiral De Kerguélen, Quimper",2
29159,Restaurant Le Gandhi,ChIJcxoDL-3VEEgR-CSnzEf2dKM,"Restaurant Indien, Restaurant Népalais","13 Bd Amiral De Kerguélen, Quimper",2
29160,Resto Kebab,ChIJJUUGgmKlFkgR_O5NK8KzNgQ,"Kebab, Restaurant De Restauration Rapide","18 Pl. Général De Gaulle, Plabennec",1
29160,Kebab Gouesnou,ChIJwwOzXHi7FkgR9on4gHuDA7g,Restaurant,"36 Pl. Des Fusillés, Gouesnou",1
29160,Lorine Kebab,ChIJES2u1LemFkgRHqqW5In2JlY,"Restaurant, Restaurant De Restauration Rapide","2 Rue De La Mairie, Lannilis",1
29160,Meilleur Kebab,ChIJ9VPdAiinFkgRiMoParEXt9o,Restaurant,"2 Rue De La Mairie, Lannilis",1
29160,Le Berlinois,ChIJHb5Mi-yrFkgR4bWo-B7X9NM,Kebab,"3 Rue Alain Fergent, Lesneven",1
29160,Le Colibri,ChIJodICPoivFkgRTUg2QLxTdc4,"Restaurant, Bar, Traiteur, Lieu De L'événement, Restaurant Familial, Restaurant Français, Buffet De Mariage","6 Rue Maréchal Leclerc, Plabennec",0
29160,Crêperie Ty Breizh,ChIJRX2xmh6lFkgR-BjVglhpYqk,Crêperie,"7 Pl. Général De Gaulle, Plabennec",0
29160,Urdiel Julie,ChIJmzene2KlFkgRQxxtXUpy-mY,"Restaurant Américain, Restaurant De Restauration Rapide, Restaurant De Pizzas","11 Rue Des 3 Frères Le Roy, Plabennec",0
29160,Le Styvell,ChIJ45AhqpWlFkgRT5bPTAbVDT8,"Restaurant, Restaurant Français, Bar","92 Pl. De La Mairie, Plouvien",0
29160,La Caverne De Merlin,ChIJFTV5RZCkFkgRPO-Q1NpNHbg,"Restaurant, Bar, Restaurant Français, Restaurant De Pizzas","1 Rue De Brest, Bourg-Blanc",0
29160,Dragon D'or Sarl,ChIJUekLvUG6FkgR9yBu86NDSm4,"Restaurant Chinois, Restaurant","105 Rue Pierre Jakez Helias, Guipavas",2
29160,Osaka,ChIJjwRDyEG6FkgRJRlEFvzYqsw,Restaurant Japonais,"105c Rue Pierre Jakez Helias, Guipavas",2
29160,Le Lotus Bleu - Buffet À Volonté & Wok,ChIJneEPWbO7FkgRkqAffeT6mTg,"Restaurant Asiatique, Restaurant Buffet, Restaurant Chinois, Restaurant Japonais, Restaurant Thaïlandais","Rue Edouard Belin, Brest",2
29160,Soi 95,ChIJV1mWDfyrFkgRwBBDyYpGxF8,Restaurant Thaïlandais,"95 Rue De La Marne, Lesneven",2
29160,Le Phnom Penh,ChIJIzuo3JSrFkgRvu-IsseZwp4,"Restaurant Chinois, Restaurant Asiatique, Restaurant Cambodgien, Restaurant D'asie Du Sud-Est, Restaurant Thaïlandais","21 Rue Du Saint-Esprit, Lesneven",2
29161,Restaurant Ty Grill Et Mezze,ChIJ049lNgvVEEgR9HFSzTEkW8U,Restaurant Turc,"24 Hent Kerfram, Plomelin",1
29161,Kebab Ô P'tit Creux,ChIJkwFgo6vXEEgRNWQ8GwwnO-E,"Restaurant, Restaurant De Restauration Rapide, Kebab, Restaurant De Tacos","2 Place François Balès, Ergué-Gabéric",1
29161,Chez Ali,ChIJuyk_SiHVEEgRV_DExg8FDig,"Restaurant Marocain, Restaurant Arabe, Restaurant De Couscous, Restaurant Familial, Restaurant Halal, Restaurant Du Déjeuner, Restaurant À Emporter, Restaurant Nord-Africain, Restaurant, Restaurant Végétarien","6bis Av. De La Libération, Quimper",1
29161,Le Touareg,ChIJK7OAVhjbEEgRUmRhXWXDhWQ,"Restaurant, Restaurant Méditerranéen, Restaurant Marocain","71 Av. Alain Le Lay, Concarneau",1
29161,Mashallah,ChIJT-gnvfctF0gRDDZTjn_nplw,Kebab,"4 Pl. Du Pont Guern, Pont-l'Abbé",1
29161,Crêperie L'épi D'or À Fouesnant - Pleuven,ChIJg_PE5l3REEgRqo64GTRpaDQ,Crêperie,"Ty Keravec, Pleuven",0
29161,Crêperie Île Saint-Nicolas,ChIJ4Tf1Z_vQEEgROIfbXTMwQlg,Crêperie,"1 Roz An Barz, Fouesnant",0
29161,Le P'tit Resto 29,ChIJlRrZxRPXEEgR-RVI17q2Skw,"Restaurant De Restauration Rapide, Restaurant Américain, Restaurant De Hamburgers","5 Rue De Kerneveleck, Fouesnant",0
29161,Le Bistrot Du Coin,ChIJdSYH2P7QEEgRinRxAyaL8nw,"Restaurant, Bar, Bistro, Restaurant Français","18 Rue De Cornouaille, Fouesnant",0
29161,L'ile St Nicolas,ChIJyZFxT_nQEEgRiWCrYsnolP4,"Restaurant Français, Bar, Crêperie, Restaurant À Emporter","1 Dsc Du Douric, Fouesnant",0
29161,Restaurant La Baguette D'or,ChIJz71-VBvREEgRgm90nqYQ5lM,"Restaurant, Bar, Restaurant Chinois, Restaurant Vietnamien","15 Chem. De Toul An Ael, Fouesnant",2
29161,Restaurant Asiatique Aigle Royal,ChIJLV1LkSTUEEgRoq_sdzcGeKg,"Restaurant Asiatique, Restaurant Buffet, Restaurant Chinois, Restaurant Japonais, Restaurant De Sushis","440 Rte De Bénodet, Quimper",2
29161,La Cuisine Thai De Maman Ploy,ChIJW6QvcA7WEEgRW8iu8yb6Dkg,"Restaurant À Emporter, Nourriture Et Boisson, Restaurant Thaïlandais","13 Av. Du Rouillen, Ergué-Gabéric",2
29161,Thaï Box,ChIJH2dEFx_bEEgRlF2U63AiM3s,"Restaurant Thaïlandais, Restaurant De Restauration Rapide","51 Av. De La Gare, Concarneau",2
29161,Sushi Nami,ChIJnWVwhpjbEEgRipTdHL9YNs4,Restaurant Japonais,"43 Av. De La Gare, Concarneau",2
29162,Kebab Tacos Pleyben,ChIJC-Asq5U7EUgRFhkXYL7QnFY,"Restaurant De Restauration Rapide, Restaurant, Restaurant Turc","43 Pl. Charles De Gaulle, Pleyben",1
29162,Océan Kebab,ChIJybNeoPoxEUgRm2sfuk9N6aA,Kebab,"40 Quai Carnot, Châteaulin",1
29162,Restaurant Royal,ChIJ5YJkPe4XEUgR9mI6i6VzueQ,"Restaurant Familial, Kebab, Restaurant","7 Pl. De La Résistance, Châteauneuf-du-Faou",1
29162,Au Royal Glazik Kebab,ChIJYS0pWNolEUgR5FAkd0yHB74,"Kebab, Restaurant De Restauration Rapide, Restaurant De Hamburgers, Restaurant À Emporter, Restaurant De Tacos","10 Bis Rue De La Paix, Briec",1
29162,Istambul Kebab,ChIJx7ViuPclEUgRRb0iUyU-6xU,"Kebab, Restaurant De Restauration Rapide, Restaurant Turc","5 Rue De La Résistance, Briec",1
29162,La Fée Délice,ChIJOy5z_707EUgRXrnZLr0lJT0,"Restaurant Français, Restaurant De Pizzas","3 Rue De Quimper, Pleyben",0
29162,Restaurant Pizzeria De L Enclos,ChIJDfsn7bQ7EUgR1OIGicjm190,"Restaurant, Restaurant Français","51 Pl. Charles De Gaulle, Pleyben",0
29162,Le P'tit Jeannot,ChIJDfsn7bQ7EUgR-aGh6mtTjRQ,"Restaurant Français, Restaurant À Emporter","51 Pl. Charles De Gaulle, Pleyben",0
29162,Le Stirwen,ChIJGQM2OLM7EUgRjSjy7aFgdew,Crêperie,"17 Rue De Quimper, Pleyben",0
29162,Le Mickphil,ChIJ85gXnrQ7EUgRb6rpWPRtceU,"Restaurant De Pizzas, Bar, Restaurant Français","40 Pl. Charles De Gaulle, Pleyben",0
29162,Les Délices De Ty Hien,ChIJoVuMnZoxEUgRoy-3I1FoKiY,"Restaurant Asiatique, Restaurant Chinois, Restaurant Thaïlandais","16 Quai Charles De Gaulle, Châteaulin",2
29162,Thai Kitchen,ChIJpwIKu2MlEUgRHMFRVFrpmNQ,"Restaurant, Restaurant Du Déjeuner, Restaurant Thaïlandais","10 Rue Laennec, Briec",2
29162,La Cuisine Thai De Maman Ploy,ChIJW6QvcA7WEEgRW8iu8yb6Dkg,"Restaurant À Emporter, Nourriture Et Boisson, Restaurant Thaïlandais","13 Av. Du Rouillen, Ergué-Gabéric",2
29162,Restaurant Le Gandhi,ChIJcxoDL-3VEEgR-CSnzEf2dKM,"Restaurant Indien, Restaurant Népalais","13 Bd Amiral De Kerguélen, Quimper",2
29162,Le Mahraja,ChIJJaqd45LVEEgR1160PD_u9Lk,"Restaurant Indien, Restaurant À Emporter, Restaurant Pakistanais","43 Bd Amiral De Kerguélen, Quimper",2
29163,Kebab Antalya,ChIJT_M1Ss5dEUgRlN4vCMEn37U,Restaurant Turc,"82 Rue De La République, Pleyber-Christ",1
29163,La Ruche Kebab Morlaix,ChIJcw7n1jJhEUgR9vRV0UKnPXQ,"Restaurant De Restauration Rapide, Kebab","30 Route De Paris, Morlaix",1
29163,La Ruche Kebab Landivisiau,ChIJzZlidXNQEUgRWhVQ7dGaA5A,"Restaurant De Restauration Rapide, Kebab","24 Pl. Jeanne D'arc, Landivisiau",1
29163,Kebab De Plouigneau,ChIJowRbgollEUgR11stu8vgENQ,Restaurant De Restauration Rapide,"18 Rue Du 9 Août, Plouigneau",1
29163,Delices Burger Kebab,ChIJb4NlW2xQEUgRtu-TP06_PYY,"Kebab, Restaurant De Restauration Rapide, Restaurant De Hamburgers","12 Rue Général De Gaulle, Landivisiau",1
29163,Crêperie Des Fougères,ChIJ_ygyR1hdEUgR2_Ome78AP8M,"Crêperie, Restaurant Français","5 Pl. Gambetta, Pleyber-Christ",0
29163,L'aromate,ChIJS_47JVhdEUgRTbHSgL_J4zI,"Restaurant, Restaurant Français, Restaurant Italien, Restaurant De Pizzas","86 Rue De La République, Pleyber-Christ",0
29163,Ty Grean,ChIJieGtHptCEUgRtOH1QalcaSM,"Restaurant, Bar, Restaurant Français","29410 Plounéour-Ménez, Plounéour-Ménez",0
29163,Le Relais De Coat Conval,ChIJG8bht15nEUgRzGSQH_pSbOE,"Restaurant Français, Café","Zone Artisanale De, Sainte-Sève",0
29163,Bistrot Du Marché Plourin Les Morlaix,ChIJpXn3Io5nEUgRE8K_NNywIjc,"Restaurant, Bar Et Grill, Restaurant De Petit-Déjeuner, Restaurant Familial, Restaurant De Restauration Rapide, Marché De Produits Frais, Restaurant Du Déjeuner, Restaurant À Emporter, Restaurant De Plats De Viande, Restaurant Traditionnel","Plateau, Plourin-lès-Morlaix",0
29163,Makly,ChIJY3Ui481nEUgRUO0yX5RD6TY,Plats Chinois À Emporter,"Prajen Vian, Plourin-lès-Morlaix",2
29163,Sim Sushi,ChIJn2xa3Y1nEUgRJapQCvQUex4,Restaurant Japonais,"Centre Commercial La Galerie Carrefour, Saint-Martin-des-Champs",2
29163,Wok & Grill,ChIJ91bPtLZgEUgRXwlOYsqxiH4,"Restaurant Chinois, Restaurant De Sushis","Rue Goarem Pella, Saint-Martin-des-Champs",2
29163,Saigon,ChIJUZx3BcBhEUgRm_LMUQV0978,Restaurant Vietnamien,"4 Ven. Au Son, Morlaix",2
29163,Le Taj Mahal,ChIJwXHyRS1hEUgRdmw3s_R3Qxg,"Restaurant Indien, Bar, Restaurant","3 Pl. De Viarmes, Morlaix",2
