respondent.commune,business_name,place_id,fr_categories,business_address,treatment_arm
Pierre-Bénite,Chick N Food,ChIJFyQRymHp9EcRY-wgOO-sb6k,"Restaurant, Restaurant Halal, Restaurant Du Déjeuner, Sandwicherie","96 Rue Des Martyrs De La Libération, Pierre-Bénite",1
Pierre-Bénite,Kebab Pachamm,ChIJF_L3B9rp9EcRbmuGuZgHjGE,"Kebab, Restaurant De Kebab Doner, Restaurant De Restauration Rapide","4 Rue Voltaire, Pierre-Bénite",1
Pierre-Bénite,Casa Dina,ChIJ5bGUGX3p9EcRRtQL0W9u0Dw,"Restaurant De Pizzas, Restaurant Barbecue, Traiteur, Restaurant De Restauration Rapide, Restaurant Halal, Magasin De Salades","29/33 Chem. Des Mûriers, Pierre-Bénite",1
Pierre-Bénite,Ba Kebab Tacos,ChIJhdLRwK7p9EcRzU0dYolwEAI,"Kebab, Restaurant De Tacos","17 Chem. Des Mûriers, Pierre-Bénite",1
Pierre-Bénite,Point B Oullins,ChIJpXT9o9zp9EcRMsSwpKr-6fE,"Restaurant De Restauration Rapide, Restaurant Halal, Restaurant De Hamburgers","11 Bd De L'europe, Oullins",1
Pierre-Bénite,Restaurant De L'europe,ChIJkVzARqDp9EcR5sdUxB35aaA,"Restaurant, Magasin De Bière, Pâtisserie, Chocolaterie, Restaurant Français, Glacier, Restaurant Italien, Pâtisserie, Bar À Vin","21 Bd De L'europe, Pierre-Bénite",0
Pierre-Bénite,Bubble Game,ChIJLQ1YM5Hp9EcRn7qLXb9z2hU,Crêperie,"67 Rue Roger Salengro, Pierre-Bénite",0
Pierre-Bénite,Le Minhoto,ChIJ4wtLinXp9EcRHrtFU9iQD70,"Restaurant Portugais, Restaurant Français","119 Av. Jean Jaurès, Oullins",0
Pierre-Bénite,310 À Table,ChIJ74K-pa_p9EcRN5ohlYGxffQ,"Restaurant, Restaurant Familial, Restaurant Français, Brasserie","L'europe, Pierre-Bénite",0
Pierre-Bénite,Burger King,ChIJ_ayW5K7p9EcR-OKgzUbu4U4,"Restaurant De Restauration Rapide, Restaurant Américain, Bar Et Grill, Restaurant Familial, Restaurant De Hamburgers, Restaurant À Emporter","Chem. Des Mûriers, Pierre-Bénite",0
Pierre-Bénite,Léo Sushi,ChIJvxO_9J_p9EcR5YRHNZoK9oA,"Restaurant Japonais, Restaurant, Restaurant De Sushis","14 Bd De L'europe, Pierre-Bénite",NA
Pierre-Bénite,My Nem Is Tchavye - Restaurant / Traiteur Asiatique,ChIJocWbc5Tp9EcRsqO0e_T5kkg,"Restaurant Asiatique, Traiteur, Restaurant De Fondue Chinoise, Restaurant De Livraison, Restaurant À Emporter","12 All. Du Château, Pierre-Bénite",NA
Pierre-Bénite,Toasushi Pierre-Bénite,ChIJleN5y-7p9EcRIt5bvgApVMo,"Restaurant De Sushis, Restaurant De Fondue Chinoise, Restaurant Japonais, Restaurant Panasiatique","4 Chem. Du Barrage, Pierre-Bénite",NA
Pierre-Bénite,"Petit Osaka Oullins - Restaurant Japonais, Sushis, Poké Bowls À Oullins - Parc Du Prado",ChIJI_eutyjp9EcRVHRsvt23wx8,"Restaurant Japonais, Restaurant Asiatique, Restaurant Japonais Authentique, Restaurant Japonais De Style Kyoto, Restaurant De Sushis","143 Grande Rue, Oullins",NA
Pierre-Bénite,Tandoori Place,ChIJ__8j-27p9EcReikpHjKtrP8,"Restaurant Indien, Restaurant","116 Grande Rue, Oullins",NA
Poleymieux-au-Mont-d'Or,Fresh'cook Saint Germain Au Mont D’or,ChIJwZ_NIqSR9EcRyCO1ah3k_-k,"Restaurant, Restaurant Barbecue, Restaurant Halal, Restaurant De Hamburgers, Restaurant Méditerranéen, Restaurant De Pizzas, Restaurant Traditionnel","1 Pl Du 11 Novembre, Saint-Germain-au-Mont-d'Or",1
Poleymieux-au-Mont-d'Or,Moon,ChIJZTidUPyV9EcRZdJALF-9B70,"Restaurant Halal, Crêperie, Restaurant De Desserts","196 Quai Pierre Dupont, Rochetaillée-sur-Saône",1
Poleymieux-au-Mont-d'Or,Hilal Kebab 1992,ChIJhUfibyiU9EcRvJyuEXafAX4,"Kebab, Restaurant De Restauration Rapide, Sandwicherie, Restaurant De Tacos","9 Quai Pasteur, Neuville-sur-Saône",1
Poleymieux-au-Mont-d'Or,Karaman Kebab,ChIJkXsVRSiU9EcR2Ilklhz0CTc,"Restaurant De Restauration Rapide, Kebab, Restaurant À Emporter, Restaurant De Pizzas, Sandwicherie","8 Rue Adrien Ducrot, Neuville-sur-Saône",1
Poleymieux-au-Mont-d'Or,Chamas Tacos® Neuville-Sur-Saône,ChIJOc4BCvGV9EcRFndO2vfjWok,"Restaurant Halal, Restaurant De Restauration Rapide, Restaurant, Restaurant De Tacos","2 Rue Camille, Neuville-sur-Saône",1
Poleymieux-au-Mont-d'Or,Auberge De Poleymieux,ChIJv2Qr6RiU9EcRBcmcfAmhRXQ,"Restaurant Français, Bar","Place De La Mairie, Poleymieux-au-Mont-d'Or",0
Poleymieux-au-Mont-d'Or,Bière Bio Monts D'or,ChIJtbZ0DRqU9EcRoI2kvL5DXkg,"Brasserie, Brasserie","18 Chem. Des Carrières, Curis-au-Mont-d'Or",0
Poleymieux-au-Mont-d'Or,La Table D'albigny,ChIJ9wVYkDuU9EcRmBjgi5aNFq0,"Restaurant Français, Bistro, Restaurant Gastronomique, Restaurant Haut De Gamme Français, Restaurant","11 Pl. De Verdun, Albigny-sur-Saône",0
Poleymieux-au-Mont-d'Or,Restaurant Hôtel De La Gare,ChIJk_UhSkWU9EcRTCtNsXAoEZ0,"Restaurant Français, Restaurant De Cuisine Campagnarde, Dîner, Service De Planification De Réunions, Restaurant Français Moderne, Restaurant Végétarien, Lieu De Mariage, Cave À Vin","26 Rue Gabriel Péri, Couzon-au-Mont-d'Or",0
Poleymieux-au-Mont-d'Or,La Voile Verte,ChIJD5yAcEiU9EcRNHQC6A8k_Bw,"Restaurant Français, Bar","41 Av. Henri Barbusse, Albigny-sur-Saône",0
Poleymieux-au-Mont-d'Or,Ô Goût De L'inde,ChIJ7ygR0xOR9EcR4JAjGaY8hUs,Restaurant Indien,"1 Place Du 11 Novembre 1918, Saint-Germain-au-Mont-d'Or",NA
Poleymieux-au-Mont-d'Or,Sushi K • Limonest,ChIJ27Zm9ceT9EcRlADK2nghyYg,"Restaurant De Sushis, Restaurant Japonais","618 Av. Général De Gaulle, Limonest",NA
Poleymieux-au-Mont-d'Or,Sushi K • Neuville-Sur-Saône,ChIJSRTUNZ2W9EcRPAZ8m5RtaXE,"Restaurant Japonais, Restaurant De Sushis","8 Quai Pasteur, Neuville-sur-Saône",NA
Poleymieux-au-Mont-d'Or,Restaurant Le Quai D'asie,ChIJ0TJfDp2W9EcRnqFO_Unigvs,"Restaurant Vietnamien, Restaurant Asiatique, Bar, Restaurant Chinois, Restaurant","1 Quai Armand Barbès, Neuville-sur-Saône",NA
Poleymieux-au-Mont-d'Or,Weili Et Fan,ChIJVydDVP2V9EcRGLMEBYza3hM,Restaurant Mandarin,"17 Rue Pierre Bouvier, Fontaines-sur-Saône",NA
Pollionnay,Le Sympathique,ChIJ87fdVMDt9EcRZbNgpl4UKBk,"Restaurant De Restauration Rapide, Restaurant Américain, Bar, Restaurant De Hamburgers, Kebab","111 Av. Pierre Dumond, Craponne",1
Pollionnay,Craponne Kebab,ChIJ___bkcnt9EcR-ufDw8pkuSY,"Kebab, Restaurant De Restauration Rapide","36 Av. Edouard Millaud, Craponne",1
Pollionnay,Chamas Tacos® Craponne,ChIJrzVu12bt9EcRCMtpq4tw1h8,"Restaurant De Restauration Rapide, Restaurant Halal, Restaurant, Restaurant De Tacos","12 Av. Edouard Millaud, Craponne",1
Pollionnay,Kebab Du Centre Sain Bel 100%Veau (Broche Fait Maison),ChIJD9R004H19EcREw9sQKdNV6U,Restaurant,"3 Pl. Du 8 Mai 1945, Sain-Bel",1
Pollionnay,Sain Bel Kebab,ChIJUU2t9of0ikcRduLkrLzZkMg,"Restaurant, Restaurant De Restauration Rapide","22 Quai De La Brévenne, Sain-Bel",1
Pollionnay,Le Verre' Maison,ChIJd0rBgFTy9EcRRevc7AbD91Y,Restaurant Français,"20 Gd Rue Jean Paul Dumortier, Pollionnay",0
Pollionnay,Chick'n Mich,ChIJO95_nUPz9EcRscc3avsMr5Q,Restaurant Barbecue,"Place Des Platanes, Pollionnay",0
Pollionnay,Au Petit Varenne,ChIJm5r4tw3y9EcRdkdOjCU9kzI,"Restaurant Français, Bar","26 Grande Rue, Grézieu-la-Varenne",0
Pollionnay,Robino Pizza Café,ChIJQ5dUPgzy9EcRViECz9HNA_c,"Restaurant De Pizzas, Bar, Bistro, Café, Restaurant Italien, Restaurant, Brasserie","Pl. Des Anciens Combattants, Grézieu-la-Varenne",0
Pollionnay,Toane Restaurant,ChIJAVIWegzy9EcRhzKX-8O5wlc,Restaurant Français,"1 Rue De Finale En Émilie, Grézieu-la-Varenne",0
Pollionnay,Toasushi Grézieu-La-Varenne,ChIJQwEJOQzy9EcRd0d4f_6c0Vg,"Restaurant De Sushis, Restaurant De Fondue Chinoise, Restaurant Japonais, Restaurant Panasiatique","Centre E.leclerc, Grézieu-la-Varenne",NA
Pollionnay,Délices Thaï,ChIJZbGlTObt9EcRy0k2jkMgOdw,Restaurant Thaïlandais,"120 Av. Pierre Dumond, Craponne",NA
Pollionnay,Toasushi Craponne,ChIJJ_fIlfvt9EcRNIOypy79mow,"Restaurant De Sushis, Restaurant De Fondue Chinoise, Restaurant Japonais, Restaurant Panasiatique","89 Av. Edouard Millaud, Craponne",NA
Pollionnay,Le New Saïgon,ChIJzSJcTcjt9EcRQrNXPjRJ3kQ,"Restaurant Vietnamien, Restaurant Asiatique, Bar, Restaurant Chinois, Restaurant D'asie Du Sud-Est","46 Bis Av. Edouard Millaud, Craponne",NA
Pollionnay,Siam Restaurant Craponne,ChIJLUN9PP_t9EcRit6mEsV9Wwo,Restaurant Thaïlandais,"987 Rue Pierre Auguste Roiret, Craponne",NA
Pomeys,Pacha Kebab,ChIJD-LsehxX9EcRHhkmuGnJnj0,"Kebab, Restaurant De Restauration Rapide, Sandwicherie","22 Rue De La Doue, Saint-Symphorien-sur-Coise",1
Pomeys,Le Reyhan,ChIJr9sfrRxX9EcRz9pFs0JfCE4,"Kebab, Restaurant De Restauration Rapide, Restaurant De Tacos","108 Rue Centrale, Saint-Symphorien-sur-Coise",1
Pomeys,Restaurant La Cappadoce,ChIJHVGUlPpQ9EcRmhtWK80AhWE,"Kebab, Restaurant De Restauration Rapide, Restaurant De Tacos","7 Rue Lafont, Chazelles-sur-Lyon",1
Pomeys,Smash Factory Chazelles Sur Lyon,ChIJNWTno5pR9EcRfrCbpKuFDa8,"Restaurant, Restaurant De Hamburgers, Kebab, Restaurant De Tacos","11 Carr Saint-Roch, Chazelles-sur-Lyon",1
Pomeys,L’original,ChIJlXdAivpQ9EcRhnQS4KLq77Q,"Kebab, Restaurant De Pizzas, Restaurant","14 Rue Alexandre Séon, Chazelles-sur-Lyon",1
Pomeys,Restaurant De La Mairie,ChIJUVSR10BX9EcRIM8cheDGtfA,Restaurant Français,"Le Bourg, Pomeys",0
Pomeys,Auberge De Fourchet,ChIJ4dyoVmFX9EcR-tyVT1lyQf4,"Restaurant, Bar, Chambres D'hôtes, Restaurant Français, Loge","1761 Rte Du Fourchet, Pomeys",0
Pomeys,Restaurant La Cannelle,ChIJq9teUhtX9EcRJmEgIl_BM7c,Restaurant Français,"55 Pl. De Verdun, Saint-Symphorien-sur-Coise",0
Pomeys,Restaurant Le Tire Bouchon,ChIJw4VZlxxX9EcRI2NTgGpezhg,Restaurant Français,"150 Pl. Du Marché, Saint-Symphorien-sur-Coise",0
Pomeys,Le Derby,ChIJAdPBXxxX9EcRCCPOI87vUw8,"Restaurant, Bar, Restaurant Français","61 Bd André Margot, Saint-Symphorien-sur-Coise",0
Pomeys,Vietviet Sushi Nouille Nem,ChIJ91OQR6JX9EcR8AjS4hJTNRg,"Restaurant De Sushis, Restaurant Asiatique, Restaurant De Nouilles, Poké Bar","54 Rue Centrale, Saint-Symphorien-sur-Coise",NA
Pomeys,Khao Thip D'asie,ChIJ4azqTj5b9EcRi8HoUWVEejU,Sushis À Emporter,"65 Grande Rue, Sainte-Foy-l'Argentière",NA
Pomeys,Asian Sushi,ChIJd4wqpktJ9EcRD-i_rK9DmUI,"Restaurant Japonais, Restaurant Chinois, Sushis À Emporter","72 Av. Des Sources, Montrond-les-Bains",NA
Pomeys,Kanfunfu,ChIJd7kMgK0B9UcRue-zRn8Wswo,"Restaurant Mandarin, Restaurant De Fondue Chinoise, Restaurant Japonais, Restaurant Thaïlandais, Restaurant De Wok","647 Rue De La Peronnière 83 Lotissement Manissol 8 Place Du General Valluy Rue Victor Hugo, Genilac",NA
Pomeys,Eat Sushi Andrezieux-Bouthéon,ChIJD2IyMyFN9EcRwUcku1XZvxI,"Restaurant De Sushis, Restaurant Japonais, Restaurant De Livraison, Restaurant, Sushis À Emporter","12 Av. Hélène Boucher, Andrézieux-Bouthéon",NA
Pommiers,Chez Mex (Mesken),ChIJV6kyFz6F9EcRPbQK4NhC3SA,Restaurant Turc,"428 Rue De Belleroche, Villefranche-sur-Saône",1
Pommiers,La Calade Gourmande,ChIJ1aGORkCF9EcRqk3N9FG4U4M,"Restaurant De Restauration Rapide, Restaurant Italien, Kebab, Restaurant De Pizzas, Restaurant, Restaurant De Tacos","84 Rue Henri Depagneux, Limas",1
Pommiers,Campus Kebab Grill,ChIJlaslGQCF9EcRFCzDxbROgwM,Restaurant Turc,"84 Rue Henri Depagneux, Limas",1
Pommiers,Red Lunch,ChIJuYXQnkCF9EcRAdJNw2s71cY,"Restaurant De Kebab Doner, Restaurant Américain, Restaurant De Hamburgers, Restaurant À Emporter, Restaurant, Sandwicherie, Restaurant De Tacos","86 Rue Des Chantiers Du Beaujolais, Limas",1
Pommiers,"Kebab, Pizza, Burger, Tacos, Café De La Mairie Anse",ChIJe_ceFJGP9EcRpC45aDTkeqU,Restaurant De Pizzas,"14 Av. De Brianne, Anse",1
Pommiers,Les Terrasses De Pommiers,ChIJteWKuGKF9EcRHgkivkIkmNs,Restaurant Français,"706 Mnt De Buisante, Pommiers",0
Pommiers,Le Petit Bourg,ChIJ5UfpLYKP9EcRAC1qMZU-pR8,"Restaurant, Restaurant Français","2 Chem. Du Neyra, Pommiers",0
Pommiers,Le Bistrot,ChIJSaQVNWyF9EcRY9zQob58TH0,"Bistro, Bar, Restaurant","4 Rue Pierre Ponot, Limas",0
Pommiers,Les Coulisses Restaurant,ChIJ2_5dPj-F9EcR_NT7BnA4nO0,"Restaurant Français, Bar","415 Rte D'anse, Limas",0
Pommiers,La Corbeille Fleurie,ChIJr7xBU6uI9EcRDhCbIKc3YeE,Restaurant Français,"395 Mnt Saint-Eloi, Porte des Pierres Dorées",0
Pommiers,Gold & Roll's,ChIJNasQIUCF9EcRie6t2R9t6p0,Restaurant Japonais,"136 Rue Antoine Arnaud, Villefranche-sur-Saône",NA
Pommiers,Espace Asie Restaurant Thaïlandais & Laotien,ChIJwR1AZD2F9EcRqPkUqvtgjWA,"Restaurant Laotien, Restaurant Asiatique, Restaurant Thaïlandais","137 Rue De Thizy, Villefranche-sur-Saône",NA
Pommiers,Fast Mahal,ChIJp32yZT2F9EcRffsAJsj6ZDk,Restaurant Indien,"129 Rue De Thizy, Villefranche-sur-Saône",NA
Pommiers,Orijines,ChIJs4pyy8eF9EcRylMMUsOM1zs,Restaurant De Fusion Asiatique,"216 Rue De Thizy, Villefranche-sur-Saône",NA
Pommiers,Maharajah - Spécialités Sri Lankaises Et Indiennes,ChIJ198U_DyF9EcRZAX5smh-fcc,Restaurant Indien,"56 Rue De Stalingrad, Villefranche-sur-Saône",NA
Vindry-sur-Turdine,Es Grill Kebab,ChIJO3h4Bu5n9EcRiN1cPWybq-E,"Kebab, Restaurant Familial","56 Bd Voltaire, Tarare",1
Vindry-sur-Turdine,Restaurant Aspendos,ChIJgaARxidk9EcR8qyC9Sj6yRM,"Restaurant Turc, Restaurant Méditerranéen, Restaurant","16 Rue Anna Bibert, Tarare",1
Vindry-sur-Turdine,Megafood,ChIJTbVRzidk9EcR07hklTt-Yf8,"Restaurant De Restauration Rapide, Restaurant De Hamburgers, Kebab, Restaurant De Tacos","22 Rue Anna Bibert, Tarare",1
Vindry-sur-Turdine,Restaurant Orientale Kossaina,ChIJm0sPWcFl9EcRIYAY8X_otoc,Restaurant Halal,"34 Rue De La République, Tarare",1
Vindry-sur-Turdine,Tacos Et Pizzas À L'arbresle Fanzy Pizz Hamburger Tacos Sandwich,ChIJAbY2fGWL9EcR-hgBV1EcaZM,"Restaurant De Tacos, Restaurant Américain, Restaurant De Restauration Rapide, Restaurant De Hamburgers, Livraison De Pizzas, Restaurant De Pizzas, Pizza À Emporter, Sandwicherie","4 Rue De Paris, L'Arbresle",1
Vindry-sur-Turdine,L'attablee,ChIJJYGUfRZh9EcRUTuMoww-Xh0,"Restaurant, Restaurant Français","108 Rte De Pontcharra, Saint-Forgeux",0
Vindry-sur-Turdine,Mcdonald's,ChIJK8PYlaFm9EcRYZnT5bhqo6I,"Restaurant Américain, Restaurant De Restauration Rapide, Restaurant De Hamburgers, Restaurant De Pizzas, Restaurant, Sandwicherie","Bd Garibaldi, Tarare",0
Vindry-sur-Turdine,Le Rendez-Vous Des Amis,ChIJLRN_yZ9m9EcRH_EDK8Kb-KI,"Restaurant, Restaurant Français","8 Av. Edouard Herriot, Tarare",0
Vindry-sur-Turdine,Les Halles,ChIJE_Dayp9m9EcRLDGuoUfWuMY,"Restaurant, Restaurant Français","6 Av. Edouard Herriot, Tarare",0
Vindry-sur-Turdine,Brasserie Hoodo,ChIJl3Qaezhh9EcRrSPeTsmSHbo,"Brasserie, Brasserie","1 Av. Edouard Herriot, Tarare",0
Vindry-sur-Turdine,Tikka Restaurant Indien,ChIJv3zotINl9EcR5u6cDQcg1k8,Restaurant Indien,"34 Rue De La République, Tarare",NA
Vindry-sur-Turdine,Yeti Sushi,ChIJb6FIMNmJ9EcRem5BIPus1bQ,Restaurant De Sushis,"307 Rte De La Vallée, Chessy",NA
Vindry-sur-Turdine,Restaurant Swagath,ChIJQaxNjUKL9EcRwtTVVTiOeSk,Restaurant Indien,"22 Rue Pierre Brossolette, L'Arbresle",NA
Vindry-sur-Turdine,U’poke Charnay,ChIJj31Q2z2N9EcR_APsUonHe48,"Restaurant De Restauration Rapide, Restaurant Panasiatique","685 Ladry, Charnay",NA
Vindry-sur-Turdine,Le B Complexe Hôtel,ChIJ4wVsyaSN9EcR8eUpMSDPIPY,"Restaurant, Bar, Planificateur D'événements, Hôtel, Restaurant De Livraison, Sushis À Emporter","37 Rue De L'entreprise, Lozanne",NA
Porte des Pierres Dorées,La Caverne Cogny,ChIJpZqr6HGH9EcRO1-GT-TazXU,"Restaurant De Restauration Rapide, Restaurant De Hamburgers, Restaurant De Pizzas, Pizza À Emporter, Restaurant De Tacos","253 Le Bourg, Cogny",1
Porte des Pierres Dorées,Chez Mex (Mesken),ChIJV6kyFz6F9EcRPbQK4NhC3SA,Restaurant Turc,"428 Rue De Belleroche, Villefranche-sur-Saône",1
Porte des Pierres Dorées,L'oriental Express Pizza,ChIJw2AbWheF9EcRESwsMvczNBc,"Restaurant De Pizzas, Restaurant De Restauration Rapide, Restaurant De Hamburgers, Sandwicherie, Restaurant De Tacos","529 Rue De Thizy, Villefranche-sur-Saône",1
Porte des Pierres Dorées,La Calade Gourmande,ChIJ1aGORkCF9EcRqk3N9FG4U4M,"Restaurant De Restauration Rapide, Restaurant Italien, Kebab, Restaurant De Pizzas, Restaurant, Restaurant De Tacos","84 Rue Henri Depagneux, Limas",1
Porte des Pierres Dorées,Campus Kebab Grill,ChIJlaslGQCF9EcRFCzDxbROgwM,Restaurant Turc,"84 Rue Henri Depagneux, Limas",1
Porte des Pierres Dorées,La Corbeille Fleurie,ChIJr7xBU6uI9EcRDhCbIKc3YeE,Restaurant Français,"395 Mnt Saint-Eloi, Porte des Pierres Dorées",0
Porte des Pierres Dorées,La Bascule Pouilly Le Monial,ChIJ359ZOlWP9EcRH-Hu0kUun5s,"Restaurant Traditionnel, Restaurant Français","14 Rte De Theizé, Porte des Pierres Dorées",0
Porte des Pierres Dorées,Authentik Saveurs,ChIJYfxZLoWF9EcRistuDpTzHVA,Restaurant Français,"395 Mnt Saint-Eloi, Porte des Pierres Dorées",0
Porte des Pierres Dorées,Le Petit Bourg,ChIJ5UfpLYKP9EcRAC1qMZU-pR8,"Restaurant, Restaurant Français","2 Chem. Du Neyra, Pommiers",0
Porte des Pierres Dorées,Les Terrasses De Pommiers,ChIJteWKuGKF9EcRHgkivkIkmNs,Restaurant Français,"706 Mnt De Buisante, Pommiers",0
Porte des Pierres Dorées,Tandoori Masala Food Truck,ChIJH4L0CgqJ9EcRnwEd2oT8n1A,"Restaurant Indien, Restaurant De Restauration Rapide","473 Rte Des Meules, Cogny",NA
Porte des Pierres Dorées,Orijines,ChIJs4pyy8eF9EcRylMMUsOM1zs,Restaurant De Fusion Asiatique,"216 Rue De Thizy, Villefranche-sur-Saône",NA
Porte des Pierres Dorées,Espace Asie Restaurant Thaïlandais & Laotien,ChIJwR1AZD2F9EcRqPkUqvtgjWA,"Restaurant Laotien, Restaurant Asiatique, Restaurant Thaïlandais","137 Rue De Thizy, Villefranche-sur-Saône",NA
Porte des Pierres Dorées,Fast Mahal,ChIJp32yZT2F9EcRffsAJsj6ZDk,Restaurant Indien,"129 Rue De Thizy, Villefranche-sur-Saône",NA
Porte des Pierres Dorées,Sushi Académie,ChIJV7LM8BeF9EcRnmV4DtHygu8,Restaurant Japonais,"54 Rue De La Paix, Villefranche-sur-Saône",NA
Poule-les-Écharmeaux,Restaurant Kebab D'or,ChIJy11dsCyA80cR6O7k2F03CIo,Kebab,"38 Rue De La République, Beaujeu",1
Poule-les-Écharmeaux,Le Snack De Cours (Anciennement Pacha Kebab),ChIJiym63yR19EcRZ0pHD0tBEXo,Restaurant De Restauration Rapide,"406 Rue Georges Clemenceau, Cours",1
Poule-les-Écharmeaux,Kebab,ChIJOTQ104F19EcRthxoQLwRUxQ,Restaurant,"10 Rue Gambetta, Cours",1
Poule-les-Écharmeaux,Mpizz'tacos,ChIJfWZmz9l19EcRxw1AM8CDzZg,"Restaurant De Pizzas, Restaurant De Tacos","153 Rue Georges Clemenceau, Cours",1
Poule-les-Écharmeaux,Jamelino's,ChIJn7y10ZB980cRyVWeSwNYd5g,"Pizza À Emporter, Restaurant De Hamburgers, Restaurant De Tacos","20 Rue Baudelaire, Villié-Morgon",1
Poule-les-Écharmeaux,Auberge Des Tilleuls,ChIJo8NdHTaG80cRR1GbR4eqAEA,"Restaurant, Restaurant Français","Col Des Echarmeaux, Poule-les-Écharmeaux",0
Poule-les-Écharmeaux,Le Gribouille,ChIJAVCfYqaH80cRabrl36PXfjU,"Restaurant, Restaurant Français","Le Bourg, 56 Place Pola, Poule-les-Écharmeaux",0
Poule-les-Écharmeaux,Auberge Des Echarmeaux,ChIJsxEbQDaG80cR1X0M2Wk8l0M,Restaurant Français,"69870 Poule-Les-Écharmeaux, Poule-les-Écharmeaux",0
Poule-les-Écharmeaux,Chez Annette,ChIJXYPSydyG80cROd4WlpjPLTw,"Restaurant, Restaurant Français","7 Pl. Ganelon, Chénelette",0
Poule-les-Écharmeaux,Auberge Le Belleroche,ChIJy7BL7YWI80cRQxwVY9GiPV0,"Restaurant, Restaurant Français","Le Bourg, Belleroche",0
Poule-les-Écharmeaux,Baï Maï Thaï,ChIJfaQXXWKN80cRNczqdAdNL4Q,Restaurant Thaïlandais,"21 Pl. De L'hôtel De Ville, Chauffailles",NA
Poule-les-Écharmeaux,Pojangmatcha Plats Corréens,ChIJnwQ51rb180cR1q9nZlnOZ5o,"Restaurant Coréen, Restaurant De Fondue Chinoise, Restaurant À Emporter","15 Michaudon, Maizilly",NA
Poule-les-Écharmeaux,Tandori Massala,ChIJmeKAqVSB9EcRv1SQ0GlWvc0,Restaurant Indien,"69460 Saint-Étienne-Des-Oullières, Saint-Étienne-des-Oullières",NA
Poule-les-Écharmeaux,Star Sushi,ChIJG1fKLkB980cRgjZklUxCrHc,"Sushis À Emporter, Restaurant Asiatique, Restaurant Japonais, Restaurant Sri-Lankais","11 Imp. Edith Piaf, Belleville-en-Beaujolais",NA
Poule-les-Écharmeaux,Namtha Foodtruck,ChIJ53BaCv1980cRHpgDpZ4DiYs,Restaurant Asiatique,"Rue Marechal Foch, Belleville-en-Beaujolais",NA
Propières,Restaurant Kebab D'or,ChIJy11dsCyA80cR6O7k2F03CIo,Kebab,"38 Rue De La République, Beaujeu",1
Propières,Le Snack De Cours (Anciennement Pacha Kebab),ChIJiym63yR19EcRZ0pHD0tBEXo,Restaurant De Restauration Rapide,"406 Rue Georges Clemenceau, Cours",1
Propières,Kebab,ChIJOTQ104F19EcRthxoQLwRUxQ,Restaurant,"10 Rue Gambetta, Cours",1
Propières,Mpizz'tacos,ChIJfWZmz9l19EcRxw1AM8CDzZg,"Restaurant De Pizzas, Restaurant De Tacos","153 Rue Georges Clemenceau, Cours",1
Propières,Le Bosphore Le Bosphore Cevik Hasan,ChIJ20xjo4iS80cRu_4mgNUdbA8,"Restaurant Turc, Restaurant De Restauration Rapide, Restaurant De Pizzas","10 Rue Centrale, La Clayette",1
Propières,Rod & Sève Hôtel Restaurant Traiteur,ChIJBXZMfw-G80cRNMRFh7NBm4o,"Restaurant, Traiteur, Restaurant Français, Hôtel","6 Rte Du Qur Blanc, Propières",0
Propières,Auberge Des Echarmeaux,ChIJsxEbQDaG80cR1X0M2Wk8l0M,Restaurant Français,"69870 Poule-Les-Écharmeaux, Poule-les-Écharmeaux",0
Propières,Auberge Des Tilleuls,ChIJo8NdHTaG80cRR1GbR4eqAEA,"Restaurant, Restaurant Français","Col Des Echarmeaux, Poule-les-Écharmeaux",0
Propières,Auberge Le Belleroche,ChIJy7BL7YWI80cRQxwVY9GiPV0,"Restaurant, Restaurant Français","Le Bourg, Belleroche",0
Propières,Chez Annette,ChIJXYPSydyG80cROd4WlpjPLTw,"Restaurant, Restaurant Français","7 Pl. Ganelon, Chénelette",0
Propières,Baï Maï Thaï,ChIJfaQXXWKN80cRNczqdAdNL4Q,Restaurant Thaïlandais,"21 Pl. De L'hôtel De Ville, Chauffailles",NA
Propières,Pojangmatcha Plats Corréens,ChIJnwQ51rb180cR1q9nZlnOZ5o,"Restaurant Coréen, Restaurant De Fondue Chinoise, Restaurant À Emporter","15 Michaudon, Maizilly",NA
Propières,Charlieu Sushi N'co,ChIJHWYGSBv180cRGFsS16L1Rts,"Restaurant De Sushis, Sushis À Emporter","47 Rue Jean Morel, Charlieu",NA
Propières,Tandori Massala,ChIJmeKAqVSB9EcRv1SQ0GlWvc0,Restaurant Indien,"69460 Saint-Étienne-Des-Oullières, Saint-Étienne-des-Oullières",NA
Propières,Star Sushi,ChIJG1fKLkB980cRgjZklUxCrHc,"Sushis À Emporter, Restaurant Asiatique, Restaurant Japonais, Restaurant Sri-Lankais","11 Imp. Edith Piaf, Belleville-en-Beaujolais",NA
Quincié-en-Beaujolais,Restaurant Kebab D'or,ChIJy11dsCyA80cR6O7k2F03CIo,Kebab,"38 Rue De La République, Beaujeu",1
Quincié-en-Beaujolais,Kebab Factory,ChIJ6TwYNaCB9EcR45OdJvEC_Pk,Restaurant De Restauration Rapide,"360 Rue Du Beaujolais, Saint-Étienne-des-Oullières",1
Quincié-en-Beaujolais,Jamelino's,ChIJn7y10ZB980cRyVWeSwNYd5g,"Pizza À Emporter, Restaurant De Hamburgers, Restaurant De Tacos","20 Rue Baudelaire, Villié-Morgon",1
Quincié-en-Beaujolais,Golden Kebab,ChIJkbG4Qb5980cRC-L_unzSBJI,Kebab,"127 Rue Pasteur, Villié-Morgon",1
Quincié-en-Beaujolais,Zozan,ChIJdU018GF980cRpMAKJ7PU70c,"Restaurant, Kebab","4 Rue Marechal Foch, Belleville-en-Beaujolais",1
Quincié-en-Beaujolais,Café De La Roche,ChIJa_dG3dZ_80cRMK-9SNyqQMg,"Restaurant, Bar, Restaurant Français","359 Rue Du Ribouillon, Quincié-en-Beaujolais",0
Quincié-en-Beaujolais,Crêperie Le Balostan,ChIJ01Xz8BF_80cRoqjb2jl6LHM,"Crêperie, Café, Restaurant, Salon De Thé","13 Place Quincius Vinum, Quincié-en-Beaujolais",0
Quincié-en-Beaujolais,Le Bistrojolais,ChIJ4fJ0Yi1-80cRC7l6k80c2uI,"Restaurant, Restaurant Français","Rte De Saint-Vincent, Régnié-Durette",0
Quincié-en-Beaujolais,Auberge Du Pont Des Samsons,ChIJAQRPcdWB9EcR17qaUYW80Xg,Restaurant Français,"85 Rte De Saint-Vincent, Quincié-en-Beaujolais",0
Quincié-en-Beaujolais,Auberge La Vigneronne,ChIJMWOw_Uh-80cR2EFovG72sD8,"Restaurant, Restaurant Français","304 Rue Du Bourg, Régnié-Durette",0
Quincié-en-Beaujolais,Tandori Massala,ChIJmeKAqVSB9EcRv1SQ0GlWvc0,Restaurant Indien,"69460 Saint-Étienne-Des-Oullières, Saint-Étienne-des-Oullières",NA
Quincié-en-Beaujolais,Star Sushi,ChIJG1fKLkB980cRgjZklUxCrHc,"Sushis À Emporter, Restaurant Asiatique, Restaurant Japonais, Restaurant Sri-Lankais","11 Imp. Edith Piaf, Belleville-en-Beaujolais",NA
Quincié-en-Beaujolais,Namtha Foodtruck,ChIJ53BaCv1980cRHpgDpZ4DiYs,Restaurant Asiatique,"Rue Marechal Foch, Belleville-en-Beaujolais",NA
Quincié-en-Beaujolais,Gold & Roll's,ChIJNWyrO1l980cRILeK34gzrCo,Restaurant Japonais,"263 Av. De L'europe, Belleville-en-Beaujolais",NA
Quincié-en-Beaujolais,Bar À Cocktails & Restaurant Indian Garden,ChIJ1cO4vjB980cRFRH4ZCKQRaQ,Restaurant Indien,"27 Rue De Bourgogne, Belleville-en-Beaujolais",NA
Quincieux,Like Tacos,ChIJ3QF-JR6R9EcRlJrSJyV6FPg,Restaurant De Tacos,"7 Rue Du Palais, Trévoux",1
Quincieux,Kebab Isa,ChIJs95rm4uQ9EcRaNzqwjVHkLs,"Kebab, Restaurant De Tacos","11 Rue Du Palais, Trévoux",1
Quincieux,Fresh'cook Saint Germain Au Mont D’or,ChIJwZ_NIqSR9EcRyCO1ah3k_-k,"Restaurant, Restaurant Barbecue, Restaurant Halal, Restaurant De Hamburgers, Restaurant Méditerranéen, Restaurant De Pizzas, Restaurant Traditionnel","1 Pl Du 11 Novembre, Saint-Germain-au-Mont-d'Or",1
Quincieux,Le Tacos Play,ChIJxXWjkWGQ9EcRt1b70uQ3-sw,"Restaurant De Restauration Rapide, Kebab, Livraison De Pizzas, Restaurant De Tacos","5 Bd De L'industrie, Trévoux",1
Quincieux,Le Pacha Kebab,ChIJnXUDfdyP9EcRYKx0_Adx-LE,Restaurant Turc,"3 Rue Du Four Banal, Anse",1
Quincieux,Auberge De Campagne Du Petit Veyssieux Retraite,ChIJVePtpPSQ9EcR9FsqicFEtGo,"Restaurant, Restaurant Français","Pré Petit, Quincieux",0
Quincieux,L'inattendu,ChIJM9pvcIzq9EcR8V1a7yP5Pbw,"Restaurant Français, Restaurant","311 Chem. De Port Bernalin, Reyrieux",0
Quincieux,"""Belles Rives"" Braises & Condiments",ChIJvdjUhPKQ9EcRj9rNe10Fep8,Restaurant Français,"376 Av. Des Tuileries, Trévoux",0
Quincieux,Les Petites Voiles,ChIJ01Ep8tSQ9EcRK2uQj_0k584,"Restaurant Français, Restaurant De Hamburgers, Restaurant De Plats De Viande, Restaurant Traditionnel","197 Chem. De Halage, Parcieux",0
Quincieux,Bistro Saône,ChIJK8G0O42Q9EcRzkr5-iW9-5A,"Restaurant Français, Bistro","108 Imp. De La Sidoine, Trévoux",0
Quincieux,Ô Goût De L'inde,ChIJ7ygR0xOR9EcR4JAjGaY8hUs,Restaurant Indien,"1 Place Du 11 Novembre 1918, Saint-Germain-au-Mont-d'Or",NA
Quincieux,Restaurant Le Quai D'asie,ChIJ0TJfDp2W9EcRnqFO_Unigvs,"Restaurant Vietnamien, Restaurant Asiatique, Bar, Restaurant Chinois, Restaurant","1 Quai Armand Barbès, Neuville-sur-Saône",NA
Quincieux,Sushi K • Neuville-Sur-Saône,ChIJSRTUNZ2W9EcRPAZ8m5RtaXE,"Restaurant Japonais, Restaurant De Sushis","8 Quai Pasteur, Neuville-sur-Saône",NA
