respondent.commune,business_name,place_id,fr_categories,business_address,treatment_arm
56001,Breizh Kebab(Redon),ChIJe_qo-BGcD0gRnslOZLR-B1I,"Kebab, Restaurant De Tacos","11 Rue Des États, Redon",1
56001,Istanbul Kebab,ChIJsSdcExKcD0gRqCsm2qfLVrI,"Restaurant Turc, Bar, Restaurant De Restauration Rapide","8 Grande Rue, Redon",1
56001,Le Royal Kebab,ChIJfzZamRGcD0gR0ZqlcENLQq8,"Kebab, Restaurant De Restauration Rapide","7 Rue Notre Dame, Redon",1
56001,Deniz Kebab,ChIJheX75O-dD0gRquaqFmXckoQ,Restaurant,"9 Pl. Eugène Lafontaine, Saint-Nicolas-de-Redon",1
56001,Le Kebab'a,ChIJV-ZuikGiD0gRrbeCVDwHtls,Restaurant,"Pl. Yves Rocher, La Gacilly",1
56001,L' Arlequin,ChIJWU1psGiaD0gRwUgCKN2Gczs,"Crêperie, Bar, Restaurant Français","4 Rue Saint-Hilaire, Allaire",0
56001,Au Fil De L'eau,ChIJZ_k4cISbD0gRX5g10nuQ940,"Restaurant, Restaurant Français","56350 Rieux, Rieux",0
56001,Auberge De Courée,ChIJmczpcf-bD0gRW_nDs4aggmU,"Restaurant, Restaurant Français, Hôtel","Rdpt De Couree, Redon",0
56001,La Minoterie,ChIJodIOSXOcD0gRqOkc-xE33RY,"Restaurant, Restaurant Français, Restaurant De Pizzas","25 Quai Surcouf, Redon",0
56001,Le Revienz’y,ChIJNZFlQG6dD0gRJ8HuseIGeRw,"Restaurant, Restaurant Brunch, Restaurant Végétarien","16 Rue Victor Hugo, Redon",0
56001,Saveurs D'asie,ChIJE_jbZBKcD0gR51qwmh5O_4Q,"Restaurant Cambodgien, Restaurant Asiatique, Restaurant Chinois","23 Rue Duguesclin, Redon",NA
56001,Raj-Mahal,ChIJJ9Sd-WidD0gR3dqnkiIO1-Q,"Restaurant Indien, Restaurant Pakistanais","47 Bd De La Liberté, Redon",NA
56001,Wasabi Saint-Nicolas-De-Redon,ChIJGb9LbXydD0gRrsgv2vxC154,Sushis À Emporter,"30 Av. Jean Burel, Saint-Nicolas-de-Redon",NA
56001,Restaurant Wok 35,ChIJfdCaMJ6eD0gR6a1qwdO0Hg8,"Restaurant, Restaurant Asiatique, Restaurant Chinois","1 Rue De Briangaud, Redon",NA
56001,Sushi Market Redon,ChIJeehs866fD0gRfl_zmNntC4k,Sushis À Emporter,"6 Rue Louis Guilloux, Redon",NA
56002,*Allin* Restauration Rapide Muzillac,ChIJ6fPO4E7wD0gRWWGwecwu2uQ,"Restaurant De Restauration Rapide, Restaurant Grec, Restaurant De Hamburgers, Kebab, Restaurant À Emporter, Restaurant, Magasin De Salades, Restaurant De Tacos, Restaurant Turc","12 Pl. Du Marché, Muzillac",1
56002,Délices Marocains,ChIJtX-SpsjxD0gRhrqoJCR4cWs,Restaurant Marocain,"4 Grande Rue, Muzillac",1
56002,Kebab La Broche Orientale,ChIJBX9Wb47jD0gR2OcqpaysXvE,"Kebab, Épicerie Fine, Restaurant Halal, Restaurant","5 Pl. Du Marché, Theix-Noyalo",1
56002,Theix Food,ChIJp7xDj7PjD0gRva9nz-9iM9M,"Kebab, Restaurant De Restauration Rapide, Restaurant À Emporter, Restaurant","9 Rue Des Sports, Theix-Noyalo",1
56002,O'quest,ChIJgXoyWcTpD0gRr38PziqYW5I,Kebab,"8 Rue Jérôme De Carné, Questembert",1
56002,Le Fournil,ChIJMZODOeH6D0gRl9vqcAcUlsU,"Crêperie, Restaurant Français","15 Pl. De L'église, Ambon",0
56002,Rest'o Plaisir Restaurant,ChIJmWDuzQzwD0gR9jnopv1fDhI,"Restaurant, Restaurant Français","Espace Littoral - Galerie Super U, Ambon",0
56002,Le Bar'bak,ChIJaZIOlnLwD0gRhtu0A7QbUVI,"Brasserie, Bar, Restaurant Barbecue, Brasserie, Restaurant Chophouse, Bar À Cocktails, Restaurant Français","Espace Littoral Sud, Ambon",0
56002,Mcdonald's,ChIJx3x3URPwD0gRf6mq-LFm4Rs,"Restaurant De Restauration Rapide, Restaurant Américain, Restaurant De Hamburgers, Restaurant De Pizzas, Restaurant, Sandwicherie","Toulan, Ambon",0
56002,La P'tite Bretonne Comme Mamie,ChIJfR9oTQ37D0gRsHdOoTs-sIM,Crêperie,"2bis Chem. Du Lic, Damgan",0
56002,Restaurant Asia,ChIJSZQ8D03wD0gR-8OpuFDEBnU,"Restaurant Vietnamien, Restaurant Asiatique, Bar, Restaurant À Emporter, Restaurant","25 Rue Du Gén De Gaulle, Muzillac",NA
56002,Délices D'asie,ChIJoaMajrPjD0gRe7gBd1xX1eE,"Restaurant Vietnamien, Restaurant Asiatique, Restaurant Chinois, Restaurant Thaïlandais","Rue Des Sports, Theix-Noyalo",NA
56002,Tuki Thai,ChIJtQmAeQodEEgRUV78SsK8bAY,"Restaurant Thaïlandais, Restaurant De Wok","18 Rue D'irlande, Séné",NA
56002,Chinois Gourmet (Wan Sheng),ChIJFWi21nceEEgRF5goCkcHApw,Restaurant Chinois,"41 Rte De Nantes, Séné",NA
56002,La Porte De L’inde,ChIJ-ZSymIYeEEgRSDYvxVr4cjI,"Restaurant Indien, Restaurant Bangladais, Restaurant Barbecue, Restaurant Haut De Gamme Français, Restaurant Indien Musulman, Restaurant À Emporter, Restaurant Pakistanais, Restaurant Végétarien","51 Rue Du Maréchal Leclerc, Vannes",NA
56003,Restaurant Bara Pita,ChIJP6N1YYwbEEgRVAKHjE-Yp8M,"Restaurant Libanais, Restaurant À Emporter, Restaurant Bio, Restaurant Végétalien","9 All. Léonard De Vinci, Arradon",1
56003,Bara Pita Foodtruck,ChIJb6hlCuEbEEgRfweFcFEilNg,Restaurant Libanais,"Chem. De Talhouac'h, Arradon",1
56003,Restaurant L'ottoman Kebab,ChIJh58SklQZEEgRTZtUGl-X2Sc,"Kebab, Restaurant De Restauration Rapide","61 Rue Du Vincin, Vannes",1
56003,My Couscous,ChIJI2MEgnYdEEgRWFvjOVww9SQ,"Restaurant De Couscous, Restaurant Algérien, Traiteur, Restaurant De Livraison","4 Pass. De Faréham, Vannes",1
56003,Bara Pita Foodtruck,ChIJi1mBTccZEEgR26lNyQ_J9eY,"Restaurant Libanais, Restaurant À Emporter, Restaurant Bio, Restaurant Végétarien","6042 Av. Louis De Cadoudal, Ploeren",1
56003,"Restaurant ""Le Médaillon""",ChIJWU-LyrcbEEgRHg4FFjBOeqQ,"Restaurant, Restaurant Français","10 Rue Bouruet Aubertot, Arradon",0
56003,Restaurant L'auberge D'arradon,ChIJz3heVLYbEEgRLdNmzp3oGWg,"Restaurant Français, Bar","2 Rue Bouruet Aubertot, Arradon",0
56003,Hôtel Restaurant Les Vénètes,ChIJJeq1lFQaEEgRfnYtiGVCgg8,"Hôtel, Restaurant Français, Restaurant Haut De Gamme Français","9 Rue De La Carrière, Arradon",0
56003,Restaurant Le Quartier Gourmand,ChIJoZogMc8bEEgRDdC19D8Uexs,"Restaurant De Pizzas, Restaurant Français, Pizza À Emporter, Brasserie","Route De La Lande, Arradon",0
56003,Vivant | Restaurant Arradon,ChIJD02867YbEEgR0hKLeN87xFM,"Restaurant, Restaurant De Cuisine Campagnarde, Restaurant Haut De Gamme Français, Restaurant Français Moderne","4 Rue François Jarlegan, Arradon",0
56003,L'aigle Céleste,ChIJFazZVbQeEEgRuIc0Cmwu5CM,"Restaurant Asiatique, Restaurant Buffet","30 Rue Gay Lussac, Vannes",NA
56003,Restaurant La Saigonnaise,ChIJTTYVBqMeEEgRLe4PvUIZw9M,"Restaurant, Restaurant Asiatique, Magasin De Bière, Restaurant Du Déjeuner, Restaurant Traditionnel, Bar À Vin","2 Pl. De La Madeleine, Vannes",NA
56003,Restaurant Lily Sushi,ChIJY9EgiwUfEEgRRm2K-q2Hir0,Restaurant Asiatique,"16 Rue Du Port, Vannes",NA
56003,Oya Breizh,ChIJGyJ8uLMZEEgRWfsmKjHCoTg,Restaurant Japonais,"3 Rue Camille Claudel Atlanparc, Bâtiment M (Entrée Parking Bâtiment N, Plescop",NA
56003,Restaurant Chez Mone,ChIJWyEEeJseEEgRKtwVVEOwYw0,"Restaurant Laotien, Restaurant Asiatique, Restaurant Chinois","30 Rue Thiers, Vannes",NA
56004,L'encas,ChIJh244dWKMD0gRZ48KJQ8YeYk,"Kebab, Restaurant De Restauration Rapide, Restaurant De Hamburgers","18 Rue De Nantes, La Roche-Bernard",1
56004,Délices Marocains,ChIJtX-SpsjxD0gRhrqoJCR4cWs,Restaurant Marocain,"4 Grande Rue, Muzillac",1
56004,*Allin* Restauration Rapide Muzillac,ChIJ6fPO4E7wD0gRWWGwecwu2uQ,"Restaurant De Restauration Rapide, Restaurant Grec, Restaurant De Hamburgers, Kebab, Restaurant À Emporter, Restaurant, Magasin De Salades, Restaurant De Tacos, Restaurant Turc","12 Pl. Du Marché, Muzillac",1
56004,Palma 44,ChIJAQBc78GKD0gR3TTwdkAwfGA,"Kebab, Restaurant De Restauration Rapide","2 Rue Saint-Cyr, Herbignac",1
56004,O'taladal,ChIJVVbCUI2JD0gREq_bhEYlp50,"Restaurant, Restaurant De Restauration Rapide, Restaurant De Hamburgers, Kebab","5 Rue Du Lavoir, La Chapelle-des-Marais",1
56004,Bar Restaurant Traiteur La Cale Sèche,ChIJYfPcnRv1D0gRAj_MWqEL5iE,"Restaurant, Bar, Restaurant Français","Le Barrage, Arzal",0
56004,Ô P’tit Bistrot,ChIJg2fIKoL0D0gR8VE7fG1fra8,"Restaurant, Bistro","Barrage, Arzal",0
56004,L'inflexible,ChIJZRT6J27zD0gRtkirdSkEnI8,"Restaurant Français, Bar","Zone Portuaire, Arzal",0
56004,Crêperie La Chouette Roulotte,ChIJH-6WfwD1D0gRt4DeU3wK47w,Restaurant Français,"Port D, Camoël",0
56004,La Cambuse,ChIJTR0TgASND0gRgIpcZWboLFw,Restaurant Français,"Quai De La Douane, La Roche-Bernard",0
56004,Restaurant Asia,ChIJSZQ8D03wD0gR-8OpuFDEBnU,"Restaurant Vietnamien, Restaurant Asiatique, Bar, Restaurant À Emporter, Restaurant","25 Rue Du Gén De Gaulle, Muzillac",NA
56004,Les Saveurs D’ayutthaya,ChIJS7x_bwCHD0gREF5aTAIwegw,Restaurant Thaïlandais,"10 Rue De La Sûreté, Missillac",NA
56004,Clan-D,ChIJsZeCJlFXBUgRG2rRPug8l4E,"Restaurant De Pizzas, Restaurant De Restauration Rapide, Restaurant De Fondue Chinoise, Restaurant Panasiatique, Pizza À Emporter","4 Rue Du Bois Venerion, Piriac-sur-Mer",NA
56004,Toto Sushi Guérande,ChIJD_eAMx5nBUgRf1jTCv04Zms,Restaurant Japonais,"5 Fbg Sainte-Anne, Guérande",NA
56004,Lady Sushi Guérande,ChIJT--MwjNbBUgRbmdVxyppM-o,Restaurant Japonais,"15 Rue Du Pavé De Beaulieu, Guérande",NA
56005,Bara Pita Foodtruck,ChIJb6hlCuEbEEgRfweFcFEilNg,Restaurant Libanais,"Chem. De Talhouac'h, Arradon",1
56005,Restaurant Mad,ChIJVZ00G5QZEEgRsAx4H5IxNbM,"Restaurant De Restauration Rapide, Restaurant De Kebab Doner, Restaurant De Hamburgers, Kebab, Restaurant, Sandwicherie, Restaurant De Tacos","3 Rue Des Deux Moulins, Ploeren",1
56005,Restaurant Bara Pita,ChIJP6N1YYwbEEgRVAKHjE-Yp8M,"Restaurant Libanais, Restaurant À Emporter, Restaurant Bio, Restaurant Végétalien","9 All. Léonard De Vinci, Arradon",1
56005,My Couscous,ChIJI2MEgnYdEEgRWFvjOVww9SQ,"Restaurant De Couscous, Restaurant Algérien, Traiteur, Restaurant De Livraison","4 Pass. De Faréham, Vannes",1
56005,Papa Kebab,ChIJBZWiM2VtEEgR3WPrK-FV8Bw,"Kebab, Restaurant De Restauration Rapide","48 Av. Des Druides, Carnac",1
56005,Le Grand Largue,ChIJgVWRxUkOEEgR2I_ZAw6_i-s,"Restaurant Gastronomique, Restaurant Français, Restaurant, Restaurant De Fruits De Mer","1 Rue Du Phare, Arzon",0
56005,Côté Mer,ChIJC410xEkOEEgRkYaSLxiWV0s,"Restaurant, Restaurant Français","20 Rue Du Gén De Gaulle, Arzon",0
56005,Le Boucanier,ChIJmxXAB0sOEEgRjT4YxDTERZs,Restaurant Français,"3 Rue Du Gén De Gaulle, Arzon",0
56005,Restaurant Le Marin,ChIJNyUzYbUPEEgR_cCGV40Fa-U,Restaurant Français,"10 Bd De La Rade, Arzon",0
56005,Le P'tit Zeph,ChIJgVWRxUkOEEgR90GZ-S5OSsY,"Restaurant, Restaurant Français, Restaurant De Fruits De Mer","1 Rue Du Phare, Arzon",0
56005,"Sushi Paragon, Carnac",ChIJhy_XFFltEEgRxKZskLsbf7I,Restaurant De Sushis,"188 Av. Des Druides, Carnac",NA
56005,Restaurant Miyoshi,ChIJS9Dj5QwUEEgRbJgpFxZ9GNI,"Restaurant Japonais, Restaurant, Restaurant De Sushis","2 Kermané, Crach",NA
56005,Sushi Wax,ChIJ-zb04chtEEgRYKbGcTedPiA,"Restaurant De Sushis, Restaurant Japonais","58 Av. Des Druides, Carnac",NA
56005,Restaurant Le Bonheur D'auray,ChIJsazc558WEEgRQ2ZRLJQYVw8,Restaurant Asiatique,"7 Imp. De Kerfontaine, Pluneret",NA
56005,Restaurant Kabuki,ChIJIY6lsT8UEEgRSsdA3OfENrU,"Restaurant De Sushis, Restaurant Japonais","32 Rue Jean Marie Barre, Auray",NA
56006,Médenine Saveurs,ChIJRfiEHVHJD0gRFTesbgOYLgU,Kebab,"7 Rue René Marie Gaillard, Ploërmel",1
56006,Délices Kebab,ChIJRQztakrID0gRWp59eJtnFSE,"Kebab, Restaurant De Restauration Rapide","30 Rue De La Gare, Ploërmel",1
56006,O'delices Tacos,ChIJoaIg_kLJD0gREx6cuxA-xuk,"Restaurant, Magasin De Bière, Boutique De Beignets, Restaurant Halal, Glacier, Restaurant Du Déjeuner, Restaurant Mexicain, Restaurant Végétarien","60 Rue De La Gare, Ploërmel",1
56006,Dervich Doner Kebab Guer,ChIJWbnLWtiuD0gRKu40HnNg7wE,"Restaurant Turc, Kebab","9 Rue De Saint-Cyr, Guer",1
56006,Deniz Kebab Guer,ChIJt9UtmKGvD0gR_1iwx9UAM54,Restaurant De Restauration Rapide,"1 Pl. De La Gare, Guer",1
56006,L'orée Des Sens,ChIJd_RIghK6D0gRwWw0LtAI2qI,"Crêperie, Restaurant Français, Restaurant","Brehaut, Augan",0
56006,A L'orée De La Forêt - Hôtel Restaurant,ChIJ2ysO6sq2D0gRm-YfaHDU_3U,"Restaurant, Restaurant Français, Hôtel","24 Rue Nationale, Campénéac",0
56006,Lunch Grill,ChIJTbqwiMK3D0gRHEhF9gSMg-Q,"Restaurant De Steakhouse Français, Gril, Restaurant De Desserts, Friterie, Restaurant De Hamburgers, Restaurant De Plats De Viande, Restaurant Traditionnel","Aire Sud De Broceliande, Ploërmel",0
56006,Restaurant - Bar - Tabac Le D8,ChIJ81n6kRS4D0gR3MZpfPCljbg,"Gastro-Pub, Bar, Restaurant Français, Restaurant","6 Rue Des Cerisiers, Ploërmel",0
56006,Restaurant Au P'tit Paris,ChIJg6hvT8u3D0gRPPkdYBFXu7I,"Restaurant, Bar, Bar À Tabac, Restaurant Français","2 Pl. Du Calvaire, Gourhel",0
56006,Le Mékong,ChIJNX0HOjTID0gR4qGPDM_eXjI,"Restaurant Mandarin, Restaurant De Fondue Chinoise, Restaurant Thaïlandais","4 Rue Alphonse Guérin, Ploërmel",NA
56006,Perle D'asie,ChIJcXZbDUrID0gRI4PdxVvNNbo,"Restaurant Vietnamien, Restaurant Asiatique, Restaurant Chinois, Restaurant, Restaurant D'asie Du Sud-Est, Restaurant Thaïlandais","87 Rue De La Gare, Ploërmel",NA
56006,Aux Saveurs D'asie,ChIJfzqc11WvD0gRUXCHQ-QEofo,"Restaurant, Restaurant Asiatique","3 Rue Saint-Gurval, Guer",NA
56006,Toko Sushi 56,ChIJa2r7a4fED0gRO4O0H01URD8,Restaurant De Sushis,"21 Rue Louise Michel, Sérent",NA
56006,Gohan,ChIJA2cjwOujD0gR02Ea03pyG2c,"Restaurant, Restaurant Japonais","2 Ter, La Gacilly",NA
56007,La Broche Alréenne,ChIJd9rpRAAVEEgRwhLXgQPzHqs,Kebab,"36 Rue Du Lait, Auray",1
56007,Le Kass' Dall,ChIJ91Ms6EYUEEgRxD3Fob8CIdA,"Restaurant, Restaurant De Restauration Rapide, Restaurant De Hamburgers, Kebab, Sandwicherie","36 Av. Du Général De Gaulle, Auray",1
56007,Grill Istanbul,ChIJJ0A-MZkVEEgRLYizqksDAU8,Restaurant Turc,"81 Rue Georges Clemenceau, Auray",1
56007,Laclé Traiteur À Auray,ChIJ3wyUbz0VEEgRFLrG_bjVLpQ,"Traiteur, Restaurant De Kebab Doner, Restaurant À Emporter","13 Rue Maréchal Foch, Auray",1
56007,Restaurant Mad,ChIJVZ00G5QZEEgRsAx4H5IxNbM,"Restaurant De Restauration Rapide, Restaurant De Kebab Doner, Restaurant De Hamburgers, Kebab, Restaurant, Sandwicherie, Restaurant De Tacos","3 Rue Des Deux Moulins, Ploeren",1
56007,"La Pause Gourmande, Restaurant Auray",ChIJM2YYnkAUEEgRw1TBettKdfc,Restaurant Français,"85 Rue Georges Clemenceau, Auray",0
56007,La Po'pote,ChIJxbYD-j8UEEgR9QnSMhmZPyI,"Restaurant, Bistro","29 Place Notre Dame, Auray",0
56007,Restaurant La Chebaudière,ChIJX3xc1xUUEEgRl-fEuwWUI4A,"Restaurant, Restaurant Français","6 Rue Abbé Joseph Martin, Auray",0
56007,Le Comptoir Auray,ChIJ06FfaWcUEEgRtNzr1-oRWl8,"Brasserie, Restaurant Français, Livraison De Pizzas, Restaurant De Pizzas, Pizza À Emporter","40 Av. De L'océan, Auray",0
56007,Restaurant Le Gwaskell,ChIJEz7K5U4UEEgRnPAv4jprbEg,"Restaurant, Bar, Restaurant Français","111 Av. Du Général De Gaulle, Auray",0
56007,Restaurant Kabuki,ChIJIY6lsT8UEEgRSsdA3OfENrU,"Restaurant De Sushis, Restaurant Japonais","32 Rue Jean Marie Barre, Auray",NA
56007,Restaurant Kinh Do,ChIJcb1NYT8UEEgR-SHBu43t4aU,"Restaurant Vietnamien, Restaurant Asiatique, Bar, Restaurant Chinois, Restaurant Thaïlandais","52 Rue Georges Clemenceau, Auray",NA
56007,Le Rajasthan Restaurant,ChIJR6ztnkAUEEgRmx4p8Rkv_4k,Restaurant Indien,"91 Rue Georges Clemenceau, Auray",NA
56007,Le Saïgon,ChIJx3Onij8UEEgR7U0_9XxeJDo,"Restaurant Vietnamien, Restaurant Asiatique, Restaurant","9 Rue De Pontorson, Auray",NA
56007,Umami Sushi,ChIJs4HI9CsVEEgR0arOizh5oQg,"Sushis À Emporter, Restaurant Japonais, Restaurant De Sushis","5 Rue Georges Clemenceau, Auray",NA
56008,Bara Pita Foodtruck,ChIJb6hlCuEbEEgRfweFcFEilNg,Restaurant Libanais,"Chem. De Talhouac'h, Arradon",1
56008,Restaurant Mad,ChIJVZ00G5QZEEgRsAx4H5IxNbM,"Restaurant De Restauration Rapide, Restaurant De Kebab Doner, Restaurant De Hamburgers, Kebab, Restaurant, Sandwicherie, Restaurant De Tacos","3 Rue Des Deux Moulins, Ploeren",1
56008,Restaurant Bara Pita,ChIJP6N1YYwbEEgRVAKHjE-Yp8M,"Restaurant Libanais, Restaurant À Emporter, Restaurant Bio, Restaurant Végétalien","9 All. Léonard De Vinci, Arradon",1
56008,La Broche Alréenne,ChIJd9rpRAAVEEgRwhLXgQPzHqs,Kebab,"36 Rue Du Lait, Auray",1
56008,Laclé Traiteur À Auray,ChIJ3wyUbz0VEEgRFLrG_bjVLpQ,"Traiteur, Restaurant De Kebab Doner, Restaurant À Emporter","13 Rue Maréchal Foch, Auray",1
56008,La Chaumière De Pomper,ChIJtWyvyHcaEEgRUfbnU1jUldQ,"Crêperie, Restaurant Français","Le Moulin De Pomper, Baden",0
56008,Restaurant Le Gavrinis,ChIJATxw_RwREEgREKeN8muOX6k,"Restaurant Haut De Gamme Français, Restaurant Français, Restaurant","1 Rue De L'île Gavrinis, Baden",0
56008,Crêperie Restaurant La Goélette,ChIJPwEGIx0REEgRqei1QqmeZ1E,"Crêperie, Restaurant","6 Pl. De Weilheim, Baden",0
56008,Le Moulin De Pomper - Au Rigad’eau,ChIJqwcWmHsaEEgRXEPAW8TKIL8,"Salon De Thé, Magasin D'antiquités, Bistro","3 Rte De Penmern, Baden",0
56008,Gouguec,ChIJNVY752cQEEgR2nlf9uIGdJk,Restaurant De Fruits De Mer,"Pen En Toul, Larmor-Baden",0
56008,Restaurant Miyoshi,ChIJS9Dj5QwUEEgRbJgpFxZ9GNI,"Restaurant Japonais, Restaurant, Restaurant De Sushis","2 Kermané, Crach",NA
56008,Restaurant Le Bonheur D'auray,ChIJsazc558WEEgRQ2ZRLJQYVw8,Restaurant Asiatique,"7 Imp. De Kerfontaine, Pluneret",NA
56008,Restaurant Kabuki,ChIJIY6lsT8UEEgRSsdA3OfENrU,"Restaurant De Sushis, Restaurant Japonais","32 Rue Jean Marie Barre, Auray",NA
56008,Le Saïgon,ChIJx3Onij8UEEgR7U0_9XxeJDo,"Restaurant Vietnamien, Restaurant Asiatique, Restaurant","9 Rue De Pontorson, Auray",NA
56008,Umami Sushi,ChIJs4HI9CsVEEgR0arOizh5oQg,"Sushis À Emporter, Restaurant Japonais, Restaurant De Sushis","5 Rue Georges Clemenceau, Auray",NA
56009,Sea Sand Wich,ChIJCYv_8Kl2EEgRQlkFcgN6arM,"Restaurant, Restaurant De Restauration Rapide, Restaurant De Hamburgers, Kebab","3 Pl. Hoche, Quiberon",1
56009,Papa Kebab,ChIJBZWiM2VtEEgR3WPrK-FV8Bw,"Kebab, Restaurant De Restauration Rapide","48 Av. Des Druides, Carnac",1
56009,Hôtel Le Grand Large Belle-Île-En-Mer,ChIJT6uzc_WEGkgRsAj3-UW-h4A,"Restaurant, Bar, Restaurant Français, Hôtel De Villégiature, Hôtel, Spa, Hôtel Bien-Être","Goulphar, Bangor",0
56009,Castel Clara Thalasso & Spa,ChIJj9AUu_SEGkgRxypVKOL1bww,"Restaurant, Bar, Hammam, Restaurant Haut De Gamme Français, Spa De Massage, Hôtel De Villégiature, Hôtel, Sauna, Spa, Hôtel Bien-Être","Port Goulphar, Bangor",0
56009,Crêperie Chez Renée,ChIJW2DawUybGkgRPS_lz8GXeTw,Crêperie,"21 Rue Sarah Bernhardt, Bangor",0
56009,Le Marie Galante,ChIJQ-6umfWEGkgRr_xaW-B-NV8,"Restaurant, Bar, Restaurant De Petit-Déjeuner, Bar À Cocktails, Café, Restaurant Français, Hôtel, Restaurant Du Déjeuner, Restaurant Méditerranéen","Goulphar, Bangor",0
56009,Le 180°,ChIJq4x-WVSFGkgR8dxaZUvYDOY,"Restaurant Haut De Gamme Français, Restaurant Européen, Restaurant Français, Hôtel, Hôtel De Villégiature, Hôtel Bien-Être, Cave À Vin","Port Goulphar, Bangor",0
56009,Le Liorzh,ChIJPWcTH751EEgRx65agSaiZmI,"Restaurant, Restaurant Vietnamien","36 Rue De Saint-Clément, Quiberon",NA
56009,Phrik Thaï 56,ChIJ4yB1uIp3EEgR4yISnsaIiVc,"Restaurant Thaïlandais, Traiteur, Restaurant","Quiberon Auray Saint Pierre Quiberon, Quiberon",NA
56009,Quiberon Livraison,ChIJ3fmroc91EEgRLBhTrpAqiYA,"Restaurant De Livraison, Restaurant De Hamburgers, Livraison De Pizzas, Restaurant De Pizzas, Poké Bar, Sushis À Emporter","Bd Du Conguel, Quiberon",NA
56009,Shoudyo's Cook (Foodtruck),ChIJ9b2maNlxEEgRhUZBEfROFzQ,"Restaurant, Plats Chinois À Emporter, Restaurant De Restauration Rapide, Restaurant De Fondue Chinoise, Restaurant Panasiatique, Restaurant Vietnamien","3 Rue De La Vierge, Quiberon",NA
56009,Aiko Sushi Saint Pierre Quiberon,ChIJP5XR5tZxEEgRxGkE3WEQUrk,Restaurant Japonais,"38 Rue De L'église, Saint-Pierre-Quiberon",NA
56010,Kebab D'or,ChIJHxWuENo5EEgRnCDApAhVAIM,"Restaurant Turc, Restaurant De Restauration Rapide, Kebab","17 Rue De Pontivy, Baud",1
56010,Le Seize Kebab,ChIJP3b6_rBFEEgR5Iz7OLuIAGo,Restaurant,"16 Rue De La Mairie, Languidic",1
56010,Kebab D’or Pluvigner,ChIJn0i5K0w_EEgRFwiNW48NuIQ,Restaurant,"16 Pl. Saint-Michel, Pluvigner",1
56010,Pacha Kebab,ChIJ74VGH2AvEEgRx6roctppM7E,"Kebab, Restaurant De Restauration Rapide","8 Rue Auguste Brizeux, Locminé",1
56010,Aux Délices Kebab,ChIJu2AEBxYlEEgRugvF9cBPqE8,Kebab,"21 Rue Chateaubriand, Locminé",1
56010,La Taverne,ChIJFQffqMc5EEgRtfPj7AhgA8Q,"Restaurant De Pizzas, Restaurant Français","Le, Baud",0
56010,Auberge Du Cheval Blanc,ChIJ-QXlGdo5EEgRRp09icE2yKc,"Restaurant, Restaurant Français, Hôtel","16 Rue De Pontivy, Baud",0
56010,Au Bon Vieux Temps,ChIJYyM17tk5EEgRH41eHfaxAG8,"Crêperie, Restaurant Français, Restaurant À Emporter","35 Rue De Pontivy, Baud",0
56010,Les Ajoncs D'or,ChIJ6UZRXdo5EEgR2_6MLI-9iO8,"Restaurant De Crêpes, Crêperie, Restaurant Français, Restaurant À Emporter, Pâtisserie","3 Rue Saint-Yves, Baud",0
56010,Crêperie Des Fontaines,ChIJTyhoLtk5EEgRkTfUz8yy1Rg,"Crêperie, Restaurant Français, Épicerie, Restaurant À Emporter, Marché Aux Fruits De Mer","14 Rue Constantin Le Priol, Baud",0
56010,Pataga,ChIJN7jO44NDEEgRTzLYCcoPtKU,"Restaurant Italien, Restaurant Asiatique, Restaurant De Pizzas","4 Av. Gén De Gaulle, Brandérion",NA
56010,Nongki Thaï,ChIJ47bKSipbEEgRpQzNwsgJ6aA,Restaurant Thaïlandais,"8 Rue Emile Zola, Inzinzac-Lochrist",NA
56010,La Lanterne Rouge,ChIJc5R04NQyEEgRH4Pv2P-wKOI,"Restaurant Chinois, Restaurant De Restauration Rapide","Rue Joseph Quilliou, Saint-Thuriau",NA
56010,Sukho Cuisine Thaïlandais,ChIJ968ATQBbEEgRhXkQFcOvRWM,Restaurant Asiatique,"1 Rue Marcel Sembat, Inzinzac-Lochrist",NA
56010,Restaurant Chinois Le Singapore,ChIJ-5r8oGsWEEgRXBCVCvP5UcI,"Restaurant Asiatique, Bar, Restaurant Chinois, Restaurant Thaïlandais","36 Rue De Vannes, Sainte-Anne-d'Auray",NA
56011,L'encas,ChIJh244dWKMD0gRZ48KJQ8YeYk,"Kebab, Restaurant De Restauration Rapide, Restaurant De Hamburgers","18 Rue De Nantes, La Roche-Bernard",1
56011,Istanbul Kebab,ChIJsSdcExKcD0gRqCsm2qfLVrI,"Restaurant Turc, Bar, Restaurant De Restauration Rapide","8 Grande Rue, Redon",1
56011,Breizh Kebab(Redon),ChIJe_qo-BGcD0gRnslOZLR-B1I,"Kebab, Restaurant De Tacos","11 Rue Des États, Redon",1
56011,Le Royal Kebab,ChIJfzZamRGcD0gR0ZqlcENLQq8,"Kebab, Restaurant De Restauration Rapide","7 Rue Notre Dame, Redon",1
56011,Deniz Kebab,ChIJheX75O-dD0gRquaqFmXckoQ,Restaurant,"9 Pl. Eugène Lafontaine, Saint-Nicolas-de-Redon",1
56011,L'escale De Foleux,ChIJn1BDJPOND0gRfPd3YJCHz0c,"Restaurant Français, Bar, Restaurant","56 Foleux, Béganne",0
56011,La Cabane À Galettes - Aventure Nocturne - La Marmite Agitée,ChIJD4xHC76TD0gRlfIuIU2X5io,"Crêperie, Centre De Loisirs, Centre D'escape Room","Za De Penhouet, Caden",0
56011,L' Arlequin,ChIJWU1psGiaD0gRwUgCKN2Gczs,"Crêperie, Bar, Restaurant Français","4 Rue Saint-Hilaire, Allaire",0
56011,Auberge Du Passeur,ChIJ3ZyEwdCED0gRYTKhovyhVBo,Restaurant Français,"Pont De Cran, Saint-Dolay",0
56011,Auberge Armor Vilaine,ChIJbTV0MajyD0gRlal1hfrX0E4,"Restaurant De Pizzas, Restaurant Français, Pizza À Emporter","11 Pl. Sainte-Anne, Péaule",0
56011,Saveurs D'asie,ChIJE_jbZBKcD0gR51qwmh5O_4Q,"Restaurant Cambodgien, Restaurant Asiatique, Restaurant Chinois","23 Rue Duguesclin, Redon",NA
56011,Raj-Mahal,ChIJJ9Sd-WidD0gR3dqnkiIO1-Q,"Restaurant Indien, Restaurant Pakistanais","47 Bd De La Liberté, Redon",NA
56011,Wasabi Saint-Nicolas-De-Redon,ChIJGb9LbXydD0gRrsgv2vxC154,Sushis À Emporter,"30 Av. Jean Burel, Saint-Nicolas-de-Redon",NA
56011,Restaurant Wok 35,ChIJfdCaMJ6eD0gR6a1qwdO0Hg8,"Restaurant, Restaurant Asiatique, Restaurant Chinois","1 Rue De Briangaud, Redon",NA
56011,Sushi Market Redon,ChIJeehs866fD0gRfl_zmNntC4k,Sushis À Emporter,"6 Rue Louis Guilloux, Redon",NA
56012,Dervich Doner Kebab Guer,ChIJWbnLWtiuD0gRKu40HnNg7wE,"Restaurant Turc, Kebab","9 Rue De Saint-Cyr, Guer",1
56012,Anatolie Kebab Plélan Le Grand,ChIJYR4riL-rD0gRtpA791jJfhg,"Restaurant, Restaurant De Restauration Rapide","12 Pl. De La République, Plélan-le-Grand",1
56012,Deniz Kebab Guer,ChIJt9UtmKGvD0gR_1iwx9UAM54,Restaurant De Restauration Rapide,"1 Pl. De La Gare, Guer",1
56012,Kebab Istanbul Guer,ChIJE3pwNgCvD0gRjxsmw-hfLt4,Restaurant,"18 Rue Saint-Gurval, Guer",1
56012,Ibo Kebab,ChIJP8aOKR9NDkgRUtQJksqjTg4,Kebab,"15 Rue Paul Maulion, Mauron",1
56012,Aux Délices Des Rois,ChIJi3PHp3yuD0gRn90k3tzZIe4,Restaurant Français,"39 Rue Saint-Cyr Coëtquidan, Beignon",0
56012,Morgane De Crêpes,ChIJNSEnH9hSDkgRlQ9knkDjpYc,"Restaurant, Crêperie, Restaurant De Restauration Rapide","Pl. De L'église, Beignon",0
56012,La Galette De L'ecureuil,ChIJRwe4q2WvD0gR1kE2dvVQKkk,"Crêperie, Restaurant De Restauration Rapide","4 Chem. Des Écureuils, Beignon",0
56012,Lours,ChIJjSfUEu2uD0gRIFK_qlhaGZ0,"Restaurant Français, Restaurant Brunch, Salon De Thé","L'étang D'aleth, Saint-Malo-de-Beignon",0
56012,Restaurant Les Forges De Paimpont,ChIJsSgcJRGsD0gRMbOhrl1uAik,"Restaurant, Bar, Restaurant Français","1, Plélan-le-Grand",0
56012,Aux Saveurs D'asie,ChIJfzqc11WvD0gRUXCHQ-QEofo,"Restaurant, Restaurant Asiatique","3 Rue Saint-Gurval, Guer",NA
56012,Le Mékong,ChIJNX0HOjTID0gR4qGPDM_eXjI,"Restaurant Mandarin, Restaurant De Fondue Chinoise, Restaurant Thaïlandais","4 Rue Alphonse Guérin, Ploërmel",NA
56012,Perle D'asie,ChIJcXZbDUrID0gRI4PdxVvNNbo,"Restaurant Vietnamien, Restaurant Asiatique, Restaurant Chinois, Restaurant, Restaurant D'asie Du Sud-Est, Restaurant Thaïlandais","87 Rue De La Gare, Ploërmel",NA
56012,Gohan,ChIJA2cjwOujD0gR02Ea03pyG2c,"Restaurant, Restaurant Japonais","2 Ter, La Gacilly",NA
56012,Suwon Restaurant Coréen - À Emporter & Livraison,ChIJ-76xRAAdD0gRvEne4E_cw5U,Restaurant Coréen,"11 Rue Des Rouges-Gorges, Goven",NA
56013,Papa Kebab,ChIJBZWiM2VtEEgR3WPrK-FV8Bw,"Kebab, Restaurant De Restauration Rapide","48 Av. Des Druides, Carnac",1
56013,Le Kass' Dall,ChIJ91Ms6EYUEEgRxD3Fob8CIdA,"Restaurant, Restaurant De Restauration Rapide, Restaurant De Hamburgers, Kebab, Sandwicherie","36 Av. Du Général De Gaulle, Auray",1
56013,Grill Istanbul,ChIJJ0A-MZkVEEgRLYizqksDAU8,Restaurant Turc,"81 Rue Georges Clemenceau, Auray",1
56013,Laclé Traiteur À Auray,ChIJ3wyUbz0VEEgRFLrG_bjVLpQ,"Traiteur, Restaurant De Kebab Doner, Restaurant À Emporter","13 Rue Maréchal Foch, Auray",1
56013,La Broche Alréenne,ChIJd9rpRAAVEEgRwhLXgQPzHqs,Kebab,"36 Rue Du Lait, Auray",1
56013,Ivre Mer,ChIJ-aTuqCNpEEgRbn0ZJQNRj_I,"Restaurant De Pizzas, Brasserie, Brasserie, Bar À Tapas, Bar À Vin, Magasin De Vin","Zone Du, Belz",0
