respondent.commune,business_name,place_id,fr_categories,business_address,treatment_arm
Courgent,Restaurant Au Fav’,ChIJF0e77tO_5kcROSChDhlpBoQ,"Restaurant De Wok, Restaurant Asiatique","France, Buchelay",NA
Courgent,Chicken Rice,ChIJaa6Gb_--5kcRLdkCSfOawnY,"Restaurant, Restaurant De Restauration Rapide, Restaurant Indien","51 Bd Roger Salengro, Mantes-la-Ville",NA
Cravent,Le Fidéle,ChIJV6Ia6tGw5kcRxHCdlAOc49o,"Restaurant, Kebab, Restaurant De Pizzas","3 Pl. Du Dr Bihorel, Bréval",1
Cravent,Gold'n Grill,ChIJF5dWN2u15kcRbADDsiZKLxc,"Kebab, Restaurant De Kebab Doner, Restaurant Turc","Rte De Paris, Pacy-sur-Eure",1
Cravent,Tonton Kebab Bueil,ChIJjQ19daKz5kcRaFcUAGkVtUc,"Restaurant Turc, Restaurant De Restauration Rapide","46 Grande Rue, Bueil",1
Cravent,Liban Sur Seine,ChIJnQZSirfJ5kcR9KNsnaERa2Q,Restaurant Libanais,"14t Prom. Des Tilleuls, Bennecourt",1
Cravent,Restaurant La Baraka,ChIJSf7WAf7H5kcRBGB9R0Forss,Restaurant Marocain,"61 Rue Marcel Sembat, Bonnières-sur-Seine",1
Cravent,Au Bon Accueil,ChIJ3W_-WOK15kcRy64xk7YhauE,"Restaurant Français, Hôtel","3, Chaufour-lès-Bonnières",0
Cravent,La Chaumière,ChIJURbnLp615kcR8_79hmrIkko,"Restaurant Français, Bar","2 Chemin De La Haie Marceau- Route Nationale 13, Chaignes",0
Cravent,Aux Gouts Du Jour,ChIJwyzXs2u35kcR617LC5IKeWk,"Restaurant, Magasin De Bière, Restaurant Français, Restaurant Du Déjeuner, Restaurant Traditionnel, Bar À Vin","2b Rue De Bréval, Saint-Illiers-la-Ville",0
Cravent,International Hotel,ChIJHcYSXO-15kcRdfJJc-SGMp4,"Hôtel, Restaurant Français","1 N13, Chaignes",0
Cravent,Alliance Receptions,ChIJe-yGoj-35kcRZeORA2V5SuA,"Traiteur, Boulangerie, Pâtisserie, Fromagerie, Restaurant Français, Restaurant D'aliments Sains, Restaurant De Fruits De Mer, Restaurant Végétalien, Restaurant Végétarien","2 Rue D'inchelin, Saint-Illiers-la-Ville",0
Cravent,Thai Jing Jing,ChIJvVn-UMi15kcRTiePdt9XV3k,"Restaurant, Restaurant Thaïlandais","32 Bis Rue Saint-Léger, Villegats",NA
Cravent,Poke Bowl Sushi Pacy-Sur-Eure,ChIJSQkleFC15kcRG8LMDyJ7A3w,Restaurant De Sushis,"À Coté Cycles Cauchois, Pacy-sur-Eure",NA
Cravent,Seikatsu Sushi,ChIJ-7xLx4FL4UcRfp_2Vl6dGF4,Restaurant Japonais,"24 Rue Edouard Isambard, Pacy-sur-Eure",NA
Cravent,Just Thaï Bonnieres Sur Seine,ChIJI_iIVNDH5kcRpYP1bmzvEQ8,Restaurant Thaïlandais,"2 Rue Marcel Sembat, Bonnières-sur-Seine",NA
Cravent,Just Sushi Bonnières-Sur-Seine,ChIJ5XII40bH5kcRnVYdy7D8pgs,Sushis À Emporter,"19 Rue Georges Herrewyn, Bonnières-sur-Seine",NA
Crespières,Doydoyfood,ChIJsRX4kUqR5kcR3VVK9lc8abQ,"Restaurant, Restaurant De Kebab Doner, Restaurant Grec, Kebab, Restaurant Turc","1 Av. De Chavoye, Mareil-sur-Mauldre",1
Crespières,Le Bon App Pizzeria,ChIJ4-IPQxiF5kcRjm30RbRd9Ws,"Restaurant, Restaurant De Restauration Rapide, Restaurant Grec, Restaurant À Emporter, Livraison De Pizzas, Restaurant De Pizzas, Pizza À Emporter, Restaurant De Tacos","53 Rue De La Gare, Plaisir",1
Crespières,Ali Baba,ChIJQe1ojCOR5kcRBu7mxDZrvx0,"Kebab, Restaurant De Restauration Rapide","Chau. Saint-Vincent, Maule",1
Crespières,Chicken Street Plaisir Naan & Fried Chicken,ChIJxwOW1P-F5kcRCRxu8TehgIk,"Restaurant De Restauration Rapide, Restaurant De Poulet, Restaurant D'ailes De Poulet, Restaurant Familial, Poulet Frit À Emporter, Restaurant Halal, Restaurant De Hamburgers, Restaurant De Livraison, Restaurant","10 Rue Paul Langevin, Plaisir",1
Crespières,Le Palais Du Maroc,ChIJO2xPOySR5kcRSuIvqIFdbkQ,"Restaurant Marocain, Restaurant Asiatique, Salle De Banquet, Restaurant Barbecue, Traiteur, Restaurant De Couscous, Salle De Réception, Restaurant À Emporter, Restaurant De Pizzas, Restaurant Du Sud De L'italie","9 Rue Saint-Vincent, Maule",1
Crespières,"La Caverne Des Artistes, Restaurant-Crêperie.",ChIJ0a0iq-GP5kcR4X_H9LtRMd4,"Crêperie, Restaurant Français, Restaurant","6 Rue De Paris, Crespières",0
Crespières,O' Petit Bouchon,ChIJ0zfKV1yP5kcRU_iD88cHnnI,Restaurant Français,"3 Rue Poteau Loge, Crespières",0
Crespières,Restaurant Cave Les Terrasses,ChIJP-PuXd6P5kcRo48Ln_gYoCc,"Restaurant, Restaurant Français","17 Rd 307, Crespières",0
Crespières,Restaurant Le Relais Des Templiers - Maison Roca,ChIJs3Tm3K6a5kcR_vSJUPmJHc4,Restaurant Français,"D198 Rue De Crespières, Thiverval-Grignon",0
Crespières,La Guinguette,ChIJG8C3ixiR5kcREdAEBSIWZ2g,Restaurant Barbecue,"20 Rue Des Vergers, Les Alluets-le-Roi",0
Crespières,Ayumi Sushi,ChIJgRYBGaWa5kcROArAGYxYZoo,"Restaurant Japonais, Restaurant De Sushis","39 Av. Du Centre, Beynes",NA
Crespières,Sayuri Sushi,ChIJe5aOYnCP5kcRJc8vtz2z_Jc,Restaurant Japonais,"37 Grande Rue, Feucherolles",NA
Crespières,Sushi Show,ChIJ3UY4p4ma5kcRCYAm9BhvQ0M,Restaurant De Sushis,"Route Nationale 191, Beynes",NA
Crespières,Saveurs Du Sushi,ChIJCfWH40mP5kcRRW94fFKpP9k,"Restaurant Japonais, Restaurant","40 Rue De La Chapelle, Orgeval",NA
Crespières,Saveurs Du Kashmir,ChIJW7mfLN6R5kcRgvLXrSh1OgE,Restaurant Indien,"1 Rue Parisis, Maule",NA
Croissy-sur-Seine,Maroc En Yvelines,ChIJVfxeIdFi5kcReopI1d3FCVQ,"Restaurant Marocain, Restaurant De Livraison","3 Quai Boissy D'anglas, Bougival",1
Croissy-sur-Seine,Les Arcades.,ChIJ3xUvZANj5kcRdjtZf2R53pQ,"Restaurant Marocain, Restaurant Français, Restaurant Méditerranéen","5 Bd De La République, Chatou",1
Croissy-sur-Seine,Le Bosphore,ChIJT-GXFG1j5kcRqIXH7gMoSak,"Restaurant Turc, Restaurant De Restauration Rapide","33 Rue Jacques Daguerre, Rueil-Malmaison",1
Croissy-sur-Seine,La Table Orientale,ChIJlSM-trVj5kcRRhlNgqDACbM,Restaurant Halal,"12 Rue Jacques Daguerre, Rueil-Malmaison",1
Croissy-sur-Seine,Snack Coté Jardin,ChIJ5wtVWl1j5kcRYS_yB-9otMw,"Restaurant De Restauration Rapide, Restaurant De Hamburgers, Kebab","119 Av. Paul Doumer, Rueil-Malmaison",1
Croissy-sur-Seine,Les Enfants De Cœur,ChIJVVX0aSBj5kcRZOfE4RXQRRw,"Restaurant, Restaurant Français","9 Av. Du Maréchal Foch, Croissy-sur-Seine",0
Croissy-sur-Seine,Les Impressionnistes,ChIJr-6zeCBj5kcRnzLBiUraHDA,"Restaurant Français, Bar, Brasserie, Café, Restaurant","21 Bd Fernand Hostachy, Croissy-sur-Seine",0
Croissy-sur-Seine,Le Village,ChIJK6rzeCBj5kcRsnje5t7deGs,"Restaurant Français, Bar, Restaurant De Hamburgers, Restaurant, Magasin De Salades","22 Bd Fernand Hostachy, Croissy-sur-Seine",0
Croissy-sur-Seine,Bonne Maman Restaurant,ChIJweEJKedi5kcRKfWekWtQyyE,"Restaurant Français, Salon, Restaurant À Emporter","58 Av. De Verdun, Croissy-sur-Seine",0
Croissy-sur-Seine,Le Montijo,ChIJF7p4_uhi5kcRpTsCAzT7BQc,"Bar À Tabac, Club D'échecs Et De Cartes, Restaurant Français, Bar Karaoké, Bar De Musique Live, Brasserie","70 Av. De La Princesse, Le Vésinet",0
Croissy-sur-Seine,Khun Thaï.,ChIJaeYAYyBj5kcRUsc_Dh4JiBM,"Restaurant Thaïlandais, Restaurant Asiatique, Bar, Restaurant Chinois","2ter Av. Du Maréchal Foch, Croissy-sur-Seine",NA
Croissy-sur-Seine,Sushi Daily Croissy,ChIJKdKEyi1j5kcRpH1xSVn0pwA,"Sushis À Emporter, Restaurant De Sushis À Tapis Roulant, Producteur Alimentaire, Restaurant De Sushis","22 Av. Du Général De Gaulle, Croissy-sur-Seine",NA
Croissy-sur-Seine,Osaka Box,ChIJvfN2IdRi5kcRxVeu3JZucts,Restaurant Japonais,"36 Rue Du Général Leclerc, Bougival",NA
Croissy-sur-Seine,Saveurs D'asie,ChIJkTLOK_Zj5kcRSWVbNLl9pPw,Restaurant Chinois,"36 Av. Du Général Sarrail, Chatou",NA
Croissy-sur-Seine,Chatou Tandoori,ChIJYa-fIX9j5kcRuPccWsKXajk,Restaurant Indien,"15 Rue De L'abbé Borreau, Chatou",NA
Dammartin-en-Serve,Pains D'ailleurs,ChIJN1jEqoa95kcRngRQ5ynnUhc,"Restaurant, Restaurant De Restauration Rapide, Restaurant De Hamburgers, Kebab, Restaurant Du Déjeuner, Sandwicherie, Restaurant Turc","Pl. De La Mairie Louis Fouché, Septeuil",1
Dammartin-en-Serve,Le Fidéle,ChIJV6Ia6tGw5kcRxHCdlAOc49o,"Restaurant, Kebab, Restaurant De Pizzas","3 Pl. Du Dr Bihorel, Bréval",1
Dammartin-en-Serve,Kebab' Home,ChIJlR7x07--5kcR_HrBr2a4_Tw,Restaurant,"2 Pl. Des Droits De L'homme, Magnanville",1
Dammartin-en-Serve,Restaurant Istanbul,ChIJwRfBrvq-5kcRidSOo0dpVyM,"Restaurant Turc, Restaurant De Restauration Rapide","1 Rue De L'ouest, Mantes-la-Ville",1
Dammartin-en-Serve,O'market,ChIJU4SDsvq-5kcRmb8MxMLHXzE,"Magasin D'alimentation En Gros, Fournisseur De Boissons Gazeuses, Boucherie, Fromagerie, Chocolaterie, Épicerie Fine, Restaurant Halal, Magasin D'articles Pour La Maison","1 Rue De L'ouest, Mantes-la-Ville",1
Dammartin-en-Serve,La Jument Verte,ChIJxYB-5hS75kcR3bKOJxSpV8s,"Restaurant, Magasin De Bière, Bar À Cocktails, Restaurant Gastronomique, Restaurant Français, Restaurant D'aliments Sains, Restaurant Du Déjeuner, Bar À Vin","6 Pl. De L'église, Montchauvet",0
Dammartin-en-Serve,Le Pigeonnier,ChIJ31v_F2-65kcRAVU2Qr3Rr4E,"Restaurant Gastronomique, Restaurant Français","7 Rue De Bréval, Longnes",0
Dammartin-en-Serve,Au Bon Accueil,ChIJf7-VEe285kcRNGI6cnHRFpk,Restaurant Français,"44 Rue De Mantes, Septeuil",0
Dammartin-en-Serve,Punish Burger,ChIJ76T1Xh695kcR-A7LMJ3CAME,"Restaurant, Restaurant Américain","5 Chem. De La Maladrerie, Rosay",0
Dammartin-en-Serve,Le Relais Du Château,ChIJATQA7F285kcRXQa16ReFaEM,"Café, Bar À Tabac, Brasserie","43 Bd De L'europe, Rosay",0
Dammartin-en-Serve,Restaurant Au Fav’,ChIJF0e77tO_5kcROSChDhlpBoQ,"Restaurant De Wok, Restaurant Asiatique","France, Buchelay",NA
Dammartin-en-Serve,Saveur Gourmandes,ChIJ05hkb7i_5kcRsAA98niRgkk,Restaurant Asiatique,"46 Bd Roger Salengro, Mantes-la-Ville",NA
Dammartin-en-Serve,Nah Sushi,ChIJo7zA-Vq-5kcR8Iub10ST7f4,"Restaurant De Sushis, Restaurant De Livraison","106 Rte De Houdan, Mantes-la-Ville",NA
Dammartin-en-Serve,Ayako Sushi Buchelay,ChIJ9VeTDni_5kcRn0tqwcYmtU4,"Restaurant De Sushis, Restaurant Japonais","Zone Des Closeaux, Buchelay",NA
Dammartin-en-Serve,Wok Center Grill,ChIJc6G8VUS-5kcRWnNMmjrD_g8,"Restaurant De Wok, Restaurant Buffet, Restaurant Mandarin","Rond Point De La Clé Des Champs, Mantes-la-Ville",NA
Dampierre-en-Yvelines,Oh Mesnil,ChIJ-4V26HmD5kcRLkeg0dNtkpo,Restaurant Libanais,"92 Av. Habert De Montmort, Le Mesnil-Saint-Denis",1
Dampierre-en-Yvelines,Restaurant Le Maroc,ChIJdQbF0sKD5kcRc_hCfxwj6sw,Restaurant Marocain,"7 Prte Henri Iv, Le Mesnil-Saint-Denis",1
Dampierre-en-Yvelines,Le Monde Des Saveurs,ChIJiwlSEgKD5kcR27lLKgXTrPs,"Restaurant Marocain, Restaurant","7 Prte Henri Iv, Le Mesnil-Saint-Denis",1
Dampierre-en-Yvelines,Yakoups Burger,ChIJ71YJsL2d5kcReEO7VkCXQ0Q,"Restaurant De Hamburgers, Restaurant Halal","2 Pl. De L'ancienne Mairie, Les Essarts-le-Roi",1
Dampierre-en-Yvelines,Restaurant Anatoli,ChIJ6X1nj5Cd5kcRMj2QTphvncQ,"Restaurant Turc, Restaurant De Restauration Rapide","12 Av. De La Gare, Les Essarts-le-Roi",1
Dampierre-en-Yvelines,Au Comptoir De Marie,ChIJd-SYmgiC5kcR3carvBLSR2A,"Restaurant De Hamburgers, Brasserie","5 Grande Rue, Dampierre-en-Yvelines",0
Dampierre-en-Yvelines,Le P'tit Chalet,ChIJHePbhAiC5kcRlb6lHLLJWXg,Restaurant Français,"8 Grande Rue, Dampierre-en-Yvelines",0
Dampierre-en-Yvelines,Les17,ChIJJX0Anh6D5kcRnn2Klx8BURQ,"Restaurant, Brasserie, Bar À Cocktails, Bar À Vin, Brasserie","1 Rue De Chevreuse, Dampierre-en-Yvelines",0
Dampierre-en-Yvelines,Café De La Poste,ChIJf7_9mgiC5kcR42UDJU_pYQQ,"Restaurant, Bar, Brasserie, Café, Restaurant Français, Salon, Bar À Tabac","7 Grande Rue, Dampierre-en-Yvelines",0
Dampierre-en-Yvelines,La Table Des Blot,ChIJG7frtxoZkkcRfdeHyUiKAGE,"Restaurant Français, Restaurant Haut De Gamme Français","1 Grande Rue, Dampierre-en-Yvelines",0
Dampierre-en-Yvelines,La Maison Du Bonheur,ChIJ8Rtd25cp5EcR8qCEQVQunAQ,"Restaurant Chinois, Restaurant Japonais, Restaurant, Restaurant De Sushis","6 Pl. Paul Grimault, Cernay-la-Ville",NA
Dampierre-en-Yvelines,Jardin Du Kashmir,ChIJndMYGuiB5kcRe6yw7F4SUgw,Restaurant Indien,"20 Rue De Rambouillet, Chevreuse",NA
Dampierre-en-Yvelines,Thaï By Toei,ChIJnUCIuA-B5kcRkeUq4xjxF5A,Restaurant Thaïlandais,"16 Rue De Versailles, Chevreuse",NA
Dampierre-en-Yvelines,Restaurant La Bienvenue,ChIJ3YryEtOB5kcRHd7y_TThe4s,Restaurant Chinois,"61 Rue De La Division Leclerc, Chevreuse",NA
Dampierre-en-Yvelines,Asia Traiteur,ChIJHy0XEQKD5kcR2srgK2_pY5Y,Restaurant Asiatique,"3 Porte Iv, Le Mesnil-Saint-Denis",NA
Dannemarie,L'horizon De Houdan,ChIJ1_SuFNSl5kcRaxTzYF5ExTI,"Restaurant De Restauration Rapide, Kebab, Restaurant De Pizzas, Restaurant","27 Rue De Paris, Houdan",1
Dannemarie,Bu Restaurant Artemis Kebab Tacos Burger,ChIJ5yCHFf6v5kcRegrKzaIKiwo,Kebab,"23 Rue Des Francs Bourgeois, Bû",1
Dannemarie,• Le National • Kebab Artisanal & Burger Frais,ChIJoxytcQCZ5kcRSE7FeA4FPJw,Restaurant De Restauration Rapide,"18 Rue Nationale, La Queue-les-Yvelines",1
Dannemarie,Izmir Grill,ChIJBaY3Et-Y5kcR40SwZ8bzqt8,"Restaurant Turc, Restaurant De Restauration Rapide, Kebab","Centre Commercial Les Croix, La Queue-les-Yvelines",1
Dannemarie,Restaurant Artemis Kebab&Pizza&Tacos&Grillade&Burger,ChIJRz79pd-Y5kcRHQi8P29dclk,Restaurant De Restauration Rapide,"Rue Des Croix, La Queue-les-Yvelines",1
Dannemarie,Le Bois L'épicier,ChIJueZ47qKm5kcROp-Fs-bOOd8,"Magasin De Meubles Anciens, Restaurant Français","D61 Rte De Rambouillet, Maulette",0
Dannemarie,Les Quat'zarts,ChIJu9QtTJqm5kcRlJ2BJJl03NQ,"Restaurant, Restaurant Français","Rte De Rambouillet, Maulette",0
Dannemarie,Le Donjon,ChIJfw0Mm9Wl5kcRkgROdkIWMHs,"Restaurant Haut De Gamme Français, Restaurant Français, Restaurant","14 Rue D'epernon, Houdan",0
Dannemarie,La Brasserie Du 35,ChIJiSwsRFOl5kcRIwnjwBQe9tA,"Restaurant, Bar, Brasserie","35 Rue De L'enclos La Petite Cour, Houdan",0
Dannemarie,La Comédie,ChIJj6XlnNWl5kcRRfo3SamiTVc,"Restaurant, Restaurant Français","45 Grande Rue, Houdan",0
Dannemarie,Sushi&Cie,ChIJvQ-rotWl5kcRKtH-HSSDGN8,"Restaurant Japonais, Restaurant De Sushis","62 Grande Rue, Houdan",NA
Dannemarie,Jardin Du Kashmir,ChIJWZiPLNSl5kcRz85iEJBH8do,"Restaurant Indien, Restaurant","2 Rue Des Vieilles Tanneries, Houdan",NA
Dannemarie,Fuji Houdan,ChIJla0U1Cyl5kcRTWoqwTEVCIM,"Restaurant Asiatique, Restaurant Japonais Authentique, Restaurant","France, Houdan",NA
Dannemarie,Au Porte Bonheur,ChIJA2bUp9-Y5kcRLVl3IETmTL4,Restaurant Asiatique,"Rue Des Croix, La Queue-les-Yvelines",NA
Dannemarie,Punjab,ChIJh3t-A0YD5EcRvBj6Fpg8oHE,Restaurant Indien,"2 Rue De L'église, Nogent-le-Roi",NA
Davron,Le Bon App Pizzeria,ChIJ4-IPQxiF5kcRjm30RbRd9Ws,"Restaurant, Restaurant De Restauration Rapide, Restaurant Grec, Restaurant À Emporter, Livraison De Pizzas, Restaurant De Pizzas, Pizza À Emporter, Restaurant De Tacos","53 Rue De La Gare, Plaisir",1
Davron,Chicken Street Plaisir Naan & Fried Chicken,ChIJxwOW1P-F5kcRCRxu8TehgIk,"Restaurant De Restauration Rapide, Restaurant De Poulet, Restaurant D'ailes De Poulet, Restaurant Familial, Poulet Frit À Emporter, Restaurant Halal, Restaurant De Hamburgers, Restaurant De Livraison, Restaurant","10 Rue Paul Langevin, Plaisir",1
Davron,Marvelous Burger & Hot Dog,ChIJBRvl13yF5kcR1lHsRZL1n48,Restaurant Halal,"Centre Commercial Mon Grand, Plaisir",1
Davron,Vedas,ChIJF9lzNLGF5kcRmvGmoOM6h6E,"Restaurant, Bar, Société De Gestion D'événements, Restaurant Familial, Restaurant Halal, Restaurant Haut De Gamme Français, Restaurant Indien, Restaurant De Livraison, Restaurant À Emporter","10 Av. Du Président John Fitzgerald Kennedy, Les Clayes-sous-Bois",1
Davron,Istanbul,ChIJGTAf862F5kcRswAeXOBZPjg,"Restaurant Turc, Restaurant","34 Rue Des Dames, Les Clayes-sous-Bois",1
Davron,Stan Food Truck,ChIJ6Qe9igiP5kcR3VHwr2M8sLE,"Restaurant, Restaurant Français Moderne","Rue Du Chemin Vert, Feucherolles",0
Davron,"La Caverne Des Artistes, Restaurant-Crêperie.",ChIJ0a0iq-GP5kcR4X_H9LtRMd4,"Crêperie, Restaurant Français, Restaurant","6 Rue De Paris, Crespières",0
Davron,O' Petit Bouchon,ChIJ0zfKV1yP5kcRU_iD88cHnnI,Restaurant Français,"3 Rue Poteau Loge, Crespières",0
Davron,Restaurant Le Relais Des Templiers - Maison Roca,ChIJs3Tm3K6a5kcR_vSJUPmJHc4,Restaurant Français,"D198 Rue De Crespières, Thiverval-Grignon",0
Davron,Restaurant Cave Les Terrasses,ChIJP-PuXd6P5kcRo48Ln_gYoCc,"Restaurant, Restaurant Français","17 Rd 307, Crespières",0
Davron,Sayuri Sushi,ChIJe5aOYnCP5kcRJc8vtz2z_Jc,Restaurant Japonais,"37 Grande Rue, Feucherolles",NA
Davron,Ayumi Sushi,ChIJgRYBGaWa5kcROArAGYxYZoo,"Restaurant Japonais, Restaurant De Sushis","39 Av. Du Centre, Beynes",NA
Davron,Bangkok Factory,ChIJRwpQaACF5kcR502xIBqvU-E,Restaurant Asiatique,"10 Rue Paul Langevin, Plaisir",NA
Davron,Sushi Shop Corner Auchan Plaisir,ChIJmXOosTqF5kcRDYVmXdzXJRY,"Restaurant De Sushis, Restaurant Asiatique, Restaurant De Restauration Rapide, Restaurant Japonais, Restaurant À Emporter, Restaurant Panasiatique, Sushis À Emporter","Chemin Départemental 161, Plaisir",NA
Davron,Mikado,ChIJhyW0-rGF5kcRTS7vPQkAWJQ,"Restaurant Asiatique, Restaurant Chinois, Restaurant Japonais, Restaurant De Sushis","80 Av. Henri Barbusse, Les Clayes-sous-Bois",NA
Drocourt,Speed'za,ChIJnU-Xj_zA5kcRLTS05_vQwGs,"Livraison De Pizzas, Restaurant De Hamburgers, Restaurant De Livraison, Pizza À Emporter, Restaurant De Tacos","5 Gr Grande Rue, Vétheuil",1
Drocourt,Anans,ChIJw1mFPQC_5kcRO5el_ee3EVw,Restaurant Marocain,"3 All. Des Bleuets, Limay",1
Drocourt,Centre Commercial Carrefour Limay,ChIJ76h803iV5kcRRPUOn7QAqhs,"Restaurant, Banque, Magasin De Vêtements, Station-Service, Magasin De Verre, Salon De Coiffure, Blanchisserie, Pharmacie, Centre Commercial, Restaurant De Tacos","190 Route Nationale, Limay",1
Drocourt,O'tiz Bella,ChIJr718Xm2_5kcRKUL2iQze4yk,"Restaurant De Pizzas, Restaurant De Hamburgers, Kebab, Brasserie, Sandwicherie, Restaurant De Tacos","71 Bis Rue Adrien Roelandt, Limay",1
Drocourt,La Baraka Limay,ChIJ824PSw6_5kcRJ7ZRTJth6Oo,"Restaurant De Kebab Doner, Restaurant De Cheesesteak, Restaurant Grec, Restaurant De Hamburgers, Restaurant De Tacos","26 Rue De Paris, Limay",1
Drocourt,Le Bistrot Du Vexin,ChIJb4fh-5Dq5kcRPYiU-4kJEUs,"Bar À Tabac, Bistro","15 Rue Nationale, Drocourt",0
Drocourt,Le Tradi Du Vexin,ChIJ_b8B_JDq5kcRJIxtQ3TLnZQ,"Restaurant, Restaurant Français","2 Grande Rue, Drocourt",0
Drocourt,Route Des Crepes,ChIJN7sURPvA5kcR2MTkLD0yD4Q,"Crêperie, Restaurant","Rue Soignée, Vétheuil",0
Drocourt,Restaurant Chez Charlot,ChIJj3Yab-TA5kcRZ82Ec5GEsv8,"Restaurant Français, Restaurant","9 Prom. Claude Monet, Moisson",0
Drocourt,Hostellerie Belle Isle,ChIJAdJ1CeLA5kcRgIdnudblqdM,Restaurant Français,"29 Av. Claude Monet, Vétheuil",0
Drocourt,Nay Sushi Thaï,ChIJ47lMsvC_5kcR0-JbWVZ6_jk,"Restaurant De Sushis, Restaurant De Fondue Chinoise, Restaurant Japonais, Restaurant Thaïlandais","30 Bis Rue Nationale, Limay",NA
Drocourt,Tandoori House,ChIJLcKUiKi_5kcRiThoq3ZbQa8,Restaurant Indien,"34 Rue De La Haye Grossets, Mantes-la-Jolie",NA
Drocourt,Maï Thaï,ChIJq719urO_5kcRWjWRquGCWsg,Restaurant Thaïlandais,"2 Rue Conrad Kilian, Mantes-la-Jolie",NA
Drocourt,Sushi,ChIJNYhVnK2_5kcRItHwWH7w6RM,"Restaurant Japonais, Restaurant Asiatique, Restaurant De Sushis","6 Bis Rue D'alsace, Mantes-la-Jolie",NA
Drocourt,Turwho,ChIJhY-gLEe_5kcR8fgk6fVBnfA,"Fabricant De Couteaux, Cours De Cuisine, École De Cuisine, Restaurant Européen, Restaurant Japonais Authentique, Restaurant Français Moderne","45 Rue D'alsace, Mantes-la-Jolie",NA
Ecquevilly,Grill Ottoman Kebab,ChIJG1N3LuWT5kcResdN82CnmPQ,"Kebab, Gril, Restaurant Grec, Restaurant De Hamburgers, Sandwicherie","5b Rue Des Pléiades, Les Mureaux",1
Ecquevilly,Resto Grill® - Les Mureaux 78 I Restaurant I Grillade Feux De Bois I Brasserie I Brunch I Boucherie I Restaurant,ChIJ3Y0c6xaT5kcRusHLzY6Qxts,"Restaurant Barbecue, Gril, Rôtisserie, Restaurant Chophouse, Restaurant De Restauration Rapide, Restaurant Halal, Magasin De Produits Carnés, Restaurant De Barbecue De Mouton, Restaurant, Steak House","5b Rue Des Pléiades, Les Mureaux",1
Ecquevilly,Obeldi,ChIJD_IDx2CT5kcRH5ha4LnBIPE,"Restaurant Marocain, Restaurant Libre-Service, Snack-Bar","1 Rue Des Pléiades, Les Mureaux",1
Ecquevilly,Deli Meal,ChIJO_6V4vuT5kcRsVbJxpx60is,"Restaurant, Restaurant Halal","1 Rue Jean Jacques Rousseau, Les Mureaux",1
Ecquevilly,Les Délices Du Maroc(Marrakech),ChIJpYilJFaT5kcRY_9rwWMTGSs,Restaurant Marocain,"12 Av. De La République, Les Mureaux",1
Ecquevilly,La Vallée Restaurant Crêperie Pizzeria Sur Place Et À Emporter,ChIJVezEEmqS5kcREMNunFsTrgk,"Restaurant Français, Crêperie, Restaurant De Pizzas","9 Rte Des Mureaux, Bouafle",0
Ecquevilly,Mcdonald's,ChIJEWEyFkaP5kcR-dMzGeLJxxI,"Restaurant De Restauration Rapide, Restaurant Américain, Restaurant De Hamburgers, Restaurant De Pizzas, Restaurant, Sandwicherie","Aire De Morainvilliers Autoroute, Morainvilliers",0
Ecquevilly,Contact Hotel Restaurant La Chaumière Les Mureaux-Flins,ChIJe1CL_mSS5kcR7ohcE4ISbP8,"Hôtel, Restaurant Français, Hébergement Intérieur","1 Bis Rue Des Pléiades, Les Mureaux",0
Ecquevilly,La Passion,ChIJVVXZLH-O5kcRd0a8mDgzW5A,Restaurant Français,"6 Rue Du Ctre, Morainvilliers",0
Ecquevilly,Val Rose,ChIJV5W4DF6O5kcRVH_Pii6U3Rs,"Restaurant, Restaurant Français, Hôtel","889 Rue De L'orme Gauthier, Orgeval",0
Ecquevilly,L'idéal Des Gourmands - Orgeval,ChIJRRU-0GKO5kcRTreolvOz3lY,"Restaurant, Restaurant Brunch, Charcuterie, Épicerie Fine, Restaurant Grec, Restaurant Italien, Restaurant Japonais, Pâtisserie","2566 Rte De Quarante Sous, Orgeval",NA
Ecquevilly,Wafu (Buffet) Flins Sur Seine,ChIJ8z5VgACT5kcRTBkJoPtTKFI,"Restaurant, Restaurant Japonais, Restaurant Mandarin, Restaurant De Sushis, Restaurant De Wok","D14, Flins-sur-Seine",NA
Ecquevilly,Daadi Kitchen,ChIJixmPr1iT5kcRAmSjKqXfwBA,"Restaurant Pakistanais, Restaurant Indien, Restaurant Indien Moderne","25 Rue Jean Jaurès, Les Mureaux",NA
Ecquevilly,Dim Sum,ChIJ5_FAncCT5kcRrK7Xp96JDHU,Restaurant Chinois,"65 D14, Flins-sur-Seine",NA
Ecquevilly,Sushi Daily Flins Sur Seine,ChIJBeKGvfp75kcRYGjZ5BTtbtU,"Sushis À Emporter, Restaurant De Sushis À Tapis Roulant, Producteur Alimentaire, Restaurant De Sushis","Rte Renault, Flins-sur-Seine",NA
Élancourt,Spécial Thaï,ChIJuaR_GqOD5kcRqFyBcbKrYro,"Restaurant Thaïlandais, Plats Chinois À Emporter, Restaurant Halal, Restaurant De Livraison, Service D'expédition","21 Rés Du Bois De L'étang, La Verrière",1
Élancourt,Big Tacos,ChIJv2wc83KD5kcRLTC2j0PwLwY,"Restaurant De Tacos, Restaurant Américain, Restaurant Barbecue, Restaurant Français, Restaurant Grec, Restaurant Halal, Kebab, Restaurant Mexicain, Restaurant, Sandwicherie","9 Rue De Brie, Maurepas",1
Élancourt,Paristanbul,ChIJ0dZAheqF5kcRLfDA5MZRaf0,Restaurant Turc,"Centre Commercial Des 7 Mares, Élancourt",1
Élancourt,Pepper Food,ChIJ1Uofb7iD5kcRxljnF1MX44Y,"Restaurant De Restauration Rapide, Restaurant De Hamburgers, Kebab, Restaurant De Tacos","14 Rue De Liège, Élancourt",1
Élancourt,S&B Fried Chicken,ChIJh7czhpCD5kcR27R22viP1Hc,"Kebab, Restaurant De Restauration Rapide, Restaurant Halal, Restaurant De Hamburgers, Restaurant, Sandwicherie","Centre Commercial De La Villedieu, Élancourt",1
Élancourt,Léon - Trappes,ChIJuT_1YAqD5kcRGI6UQ39-byM,"Restaurant, Restaurant Belge, Restaurant De Fruits De Mer","Zone Immobiliere Parc, Trappes",0
Élancourt,Le Café De L'etang,ChIJ7fnFC4CE5kcRu-d8U-5j2vw,Restaurant Français,"3 Rte De Montfort, Élancourt",0
Élancourt,L'antarès,ChIJ_6n0OHKD5kcRcvgKMqvmOp0,"Restaurant Français, Bar, Restaurant","7 Rue Du Chemin Aux Bœufs, Élancourt",0
Élancourt,Le Saint-Germain,ChIJl3urYpCD5kcRqaWGbnPQ6z0,"Restaurant Français, Café","Centre Commercial De La Villedieu, Élancourt",0
Élancourt,Afro Grill,ChIJoewd1EuD5kcRRZJOTyQrMs4,"Restaurant Africain, Restaurant Barbecue, Restaurant De Restauration Rapide","14 Rue De Liège, Élancourt",0
Élancourt,Shamim Indian Restaurant,ChIJKZ9Pi3KD5kcRxUxL1SOQ9II,Restaurant Indien,"7 Rue De Brie, Maurepas",NA
Élancourt,7+1 Restaurant,ChIJAYexDICD5kcRIrKZ-1vL5pY,"Restaurant De Sushis, Restaurant Asiatique, Restaurant Chinois, Restaurant D'asie Du Sud-Est","Centre Commercial De La Villedieu, Élancourt",NA
Élancourt,Le Jap,ChIJ0f0ahwCF5kcR0t1duReDnkA,"Restaurant Japonais, Restaurant Asiatique, Restaurant Chinois, Restaurant De Sushis","14 Rue De Liège, Élancourt",NA
Élancourt,Chez Tang,ChIJ-4j4GxOD5kcRJodi8JsG4lU,"Restaurant Chinois, Restaurant","3 Bis All. Du Bourbonnais, Maurepas",NA
Élancourt,Sushi Time's,ChIJ0f0ahwCF5kcReL8OhuEXwW8,"Restaurant Asiatique, Restaurant Chinois, Restaurant De Restauration Rapide, Restaurant Japonais, Restaurant De Fruits De Mer, Restaurant De Sushis, Restaurant Thaïlandais","6 Pl. De Bretagne, Maurepas",NA
Émancé,Le Petit Fourneau,ChIJJ6SODyMZ5EcRAAAPrDtcVCI,"Restaurant De Restauration Rapide, Restaurant De Hamburgers, Kebab, Restaurant De Tacos","15 Rue Du Général Leclerc, Épernon",1
Émancé,Royal Hanches,ChIJ066QZg4Z5EcRmKCe0lb4P88,Restaurant Turc,"3bis Rue De La Barre, Hanches",1
Émancé,Welcome Pizzeria Gallardon,ChIJX7I4zaIX5EcR9Y2LFxRgcMc,"Pizza À Emporter, Restaurant De Restauration Rapide, Restaurant Turc","3 Rue De La Prte De Chartres, Gallardon",1
Émancé,Marrakech Palmeraie,ChIJmSXBIaUm5EcRouH7Y3iXR9o,Restaurant Marocain,"107 Rue G. Lenotre, Rambouillet",1
Émancé,Lm 24 Market,ChIJf83Ljtgn5EcRxid1hrUA_sA,"Casino, Restaurant Barbecue, Chocolaterie, Épicerie, Glacier, Kebab, Magasin De Pâtes, Restaurant De Pizzas, Sandwicherie, Restaurant De Fruits De Mer","60 Rue Du Général De Gaulle, Rambouillet",1
Émancé,Le Duo Gourmand,ChIJe8EK6cMj5EcRm3KhD1rMppk,"Traiteur, Pâtisserie, Boutique De Beignets, Restaurant Français, Restaurant De Crêpes, Pâtisserie","62 Rte De Rambouillet, Saint-Hilarion",0
Émancé,Bar Station,ChIJJwjEwx8Z5EcRCZqy1qVWgVw,"Bar, Café, Restaurant Français","52 Pl. De La Gare, Épernon",0
Émancé,Mcdonald's,ChIJNfilvhwZ5EcRkYHnLKR4ce8,"Restaurant De Restauration Rapide, Restaurant Américain, Restaurant De Hamburgers, Restaurant De Pizzas, Restaurant, Sandwicherie","Route De Gallardon Centre Commercial Hyper U - Lieu Dit "" Pièce Du, Hanches",0
Émancé,Au Rêve Gourmand,ChIJu160eSEZ5EcREcbfpAOlRJk,"Restaurant, Restaurant Gastronomique, Restaurant Français","1 Rue Saint-Pierre, Épernon",0
Émancé,Villa Marinette,ChIJL4ofiZ0h5EcR9A1dhm8ngeY,"Restaurant, Restaurant Gastronomique","20 Av. Du Général De Gaulle, Gazeran",0
