respondent.commune,business_name,place_id,fr_categories,business_address,treatment_arm
81001,Les Saveurs De Tataouine,ChIJNbOCidxDrhIR0MWBAnMV008,Restaurant Tunisien,"46 Av. De Castelnaudary, Revel",1
81001,Naan Kebab,ChIJhf2JkaNCrhIRxd0RQ4B2QwU,"Restaurant De Restauration Rapide, Kebab, Restaurant De Tacos","41 Rue Du Temple, Revel",1
81001,Goût D'orient - Libano-Syrienne,ChIJHUTcsVtDrhIR5WjfCJx-K7s,Restaurant Libanais,"25 Bd Denfert Rochereau, Revel",1
81001,Revel Kebab,ChIJNY94x6RCrhIRIXOPczCB-Hk,"Kebab, Restaurant De Restauration Rapide","21 Bd Denfert Rochereau, Revel",1
81001,Restaurant L'argana,ChIJB32OrLxCrhIR4CfjwlFdrWo,"Restaurant Marocain, Restaurant Méditerranéen","35 Bd Carnot, Revel",1
81001,Hôtel Restaurant Traiteur La Bombardière,ChIJ2yAOIL5jrhIRLaWlauwiCjg,"Restaurant, Traiteur, Restaurant Français, Hôtel, Relais Routier","15 Av. De Castres, Cuq-Toulza",0
81001,Auberge De Saint Julia,ChIJh2TD78ZgrhIR9dDw1_k9PjE,Restaurant Français,"Rue Du Vinaigre, Saint-Julia",0
81001,L'antre D'eux,ChIJTwxG98ZgrhIR55hM6Ht7m0A,"Restaurant Français, Bar","Rue Du Vinaigre, Saint-Julia",0
81001,Auberge Le Cri De La Fourchette,ChIJI4M3xLtlrhIR8qFdcd0ZSC4,"Restaurant, Bar, Restaurant Français, Restaurant De Pizzas","Le Buguet, Puylaurens",0
81001,Le Chasse-Marée,ChIJ_VpWsJRprhIR9Y5wxFHyg-0,Restaurant De Fruits De Mer,"4 Rte Du Lac, Blan",0
81001,Ani.aahaanthai,ChIJMyq8gIpfrhIRKjZBuf7AkAs,Restaurant Thaïlandais,"Rue Des Nobles, Saint-Félix-Lauragais",NA
81001,An Nam Restaurant Vietnamien Revel,ChIJARAxYqRCrhIRNcsBAdZYE0Q,"Restaurant Vietnamien, Restaurant Asiatique, Restaurant, Restaurant Thaïlandais","46 Bd De La République, Revel",NA
81001,Le Pavillon De Jade,ChIJWUIXQrBCrhIR5dD3G0HmT1U,"Restaurant Asiatique, Restaurant Chinois, Restaurant","42 Av. De Castelnaudary, Revel",NA
81001,Sushiman Intermarché Revel,ChIJe2c5NR9DrhIRCnsJ6zwN-fs,"Sushis À Emporter, Restaurant Asiatique, Restaurant De Restauration Rapide, Restaurant À Emporter, Restaurant D'asie Du Sud-Est, Restaurant De Sushis","Intermarché Super Revel, Revel",NA
81001,Maki Dong,ChIJfam2KltDrhIRXLKuC9nGIXw,"Restaurant De Sushis, Restaurant De Restauration Rapide, Restaurant Japonais","19 Bd Denfert Rochereau, Revel",NA
81002,Lovely Food 81,ChIJWReAa8gZrhIRP-wqbWHHPCE,"Restaurant De Restauration Rapide, Restaurant Halal, Restaurant De Hamburgers, Restaurant","22 Rue De La Vanne, Mazamet",1
81002,Chez Tonton,ChIJA8jaNs4YrhIRZ2waY5EYaC0,"Restaurant De Restauration Rapide, Poulet Frit À Emporter, Restaurant De Hamburgers, Kebab, Sandwicherie, Restaurant De Tacos","23 Bd Soult, Mazamet",1
81002,Mister Kebab Mazamet,ChIJkdtzjdEYrhIRl44ceJ5QNuc,"Kebab, Restaurant Américain, Restaurant Anglais, Restaurant De Restauration Rapide, Restaurant De Hamburgers, Sandwicherie, Restaurant De Tacos, Restaurant Turc","6 Pl. Philippe Olombel, Mazamet",1
81002,Le Bosphore,ChIJz7BiryoXrhIRyQZEKbyZo0w,"Restaurant Turc, Restaurant De Restauration Rapide","4 Av. Jacques Simon, Labruguière",1
81002,Restaurant La Gazelle - Vert Midi,ChIJSQZJrNgerhIRhIsSu06NiW8,"Restaurant, Restaurant Méditerranéen, Restaurant Marocain","4 Rue Charles Nicolle, Castres",1
81002,Steff Burger,ChIJFZLT2aUZrhIRGZET59vOCIo,"Restaurant De Hamburgers, Restaurant Américain, Restaurant De Restauration Rapide","Fg Moto, Aiguefonde",0
81002,Le Grand Balcon,ChIJYwPe_OMerhIRi9xOCtWyadA,"Restaurant, Restaurant Français","1 Rue Des Casernes, Mazamet",0
81002,Villa Pinewood,ChIJjS2_97kZrhIRVOy0lL9RwJg,"Restaurant Gastronomique, Restaurant","590 Chem. Du Nègre, Payrin-Augmontel",0
81002,Aux Quatre Vents Restaurant,ChIJzaU899QYrhIRuinEGgmA2bM,"Restaurant, Restaurant Français","14 Rue Alphonse Tournier, Mazamet",0
81002,Mcdonald's,ChIJ7dzCvCofrhIR4MFi9IO1xmI,"Restaurant De Restauration Rapide, Restaurant Américain, Restaurant De Hamburgers, Restaurant De Pizzas, Restaurant, Sandwicherie","Av. De La Chevalière, Mazamet",0
81002,Wa Fong,ChIJHZnhEdcYrhIRa3I_Fpm-Qls,"Restaurant Chinois, Restaurant Asiatique, Restaurant","35 Av. Jean Mermoz, Mazamet",NA
81002,Japanroll,ChIJ02LcNWMZrhIRg0Qt9lTOWOU,Restaurant Japonais,"4 Pl. Philippe Olombel, Mazamet",NA
81002,Buffet Royal Castres,ChIJN29dDEsQrhIRfFODzpIhoHo,"Restaurant Chinois, Restaurant","10 Rue Jean Souterène, Castres",NA
81002,Asia Delices,ChIJ9e-5OOcRrhIRu4Z6UWqOJmM,Restaurant Asiatique,"G La Galerie, Castres",NA
81002,Ban Lo Sushi,ChIJM8A5tI8RrhIRrELTxwJdm3M,"Restaurant Japonais, Restaurant De Restauration Rapide, Restaurant De Sushis","161 Av. Charles De Gaulle, Castres",NA
81003,La Cabana,ChIJo9x4qyfprRIRNmVD82lognE,"Restaurant De Restauration Rapide, Restaurant Halal","21 Av. Germain Tequi, Saint-Juéry",1
81003,Le Petit Resto,ChIJXw9XEgDhrRIR1EYMYGotQBI,Kebab,"23 Bd Carnot, Réalmont",1
81003,Napolit’hein Albi - Bar À Pâtes,ChIJsVP4FzvprRIR5t3OzWW9Wtc,"Restaurant, Restaurant Halal, Restaurant Italien, Restaurant Du Déjeuner, Restaurant Végétarien","16 Av. Colonel Teyssier, Albi",1
81003,O Sucré Salé (Tacos-Burger) Albi,ChIJ_QXCBNXprRIR8XE8jHSCBg4,"Restaurant De Restauration Rapide, Crêperie, Restaurant De Hamburgers, Kebab, Restaurant De Tacos","54 Rue Croix Verte, Albi",1
81003,O Delices Albi,ChIJJRKh1R_prRIRK9wbYGCrt08,"Restaurant De Restauration Rapide, Restaurant De Kebab Doner, Aire De Restauration, Restaurant Halal, Restaurant De Hamburgers, Kebab, Restaurant, Restaurant De Tacos, Restaurant Turc","64 Rue Croix Verte, Albi",1
81003,Grignotte&Soda,ChIJURnxalb5rRIRq5CbcYqeUiY,"Restaurant, Brasserie","27 Av. D'albi, Alban",0
81003,Restaurant L'oustal,ChIJaeBxgecJshIRQgTnXk0cL6A,"Restaurant, Restaurant Français, Restaurant Méditerranéen","Prade Del Bourg, Trébas",0
81003,Restaurant La Chanterelle,ChIJRdGQWTcIshIRPmunNZWruGA,"Restaurant, Bar, Restaurant Barbecue","Prade Del Bourg, Trébas",0
81003,Restaurant Bar La Légende,ChIJwf1bVPkPshIR0LssqQwY-eM,"Restaurant, Restaurant Français","D33, Plaisance",0
81003,La Parenthèse,ChIJF05pvCvwrRIR4-CeDkecoPE,"Restaurant Français, Bar, Hôtel","Le Bourg, Ambialet",0
81003,Dragon D'or,ChIJW0Lot8PorRIRLxCYKQHgPSE,"Restaurant Vietnamien, Restaurant Chinois","51 Av. Jean Jaurès, Saint-Juéry",NA
81003,Nouveau Saïgon,ChIJLSUB4wforRIRqEl_DzAlTwE,"Restaurant Vietnamien, Restaurant Asiatique, Bar, Restaurant Chinois, Restaurant, Restaurant Thaïlandais","81 Av. Colonel Teyssier, Albi",NA
81003,Oki,ChIJlz6d43HprRIRZOftLteUQyM,"Restaurant Japonais, Restaurant De Restauration Rapide, Restaurant De Sushis","31 Rue Général Pont, Albi",NA
81003,Restaurant La Baie D'halong,ChIJ01OsswXorRIR4fH14LW0mzk,"Restaurant Vietnamien, Restaurant Chinois, Restaurant Thaïlandais","2 Rue Croix Verte, Albi",NA
81003,Saveurs D'asie,ChIJ7UwoUAHorRIR90I9QLWXgEA,"Restaurant Chinois, Restaurant Asiatique, Bar, Restaurant","6 Rue Louis D'amboise, Albi",NA
81004,Black & White Burger Albi,ChIJtenGCDXprRIRtIZbAMMTBDA,"Restaurant De Hamburgers, Restaurant Américain, Restaurant Familial, Restaurant De Restauration Rapide, Restaurant Halal, Restaurant De Livraison, Restaurant À Emporter, Nouveau Restaurant Américain, Restaurant, Restaurant Végétarien","43 Lices Georges Pompidou, Albi",1
81004,Tacos Avenue,ChIJ4fT8LlXprRIRsOz4jEzPKzo,"Restaurant De Tacos, Restaurant Halal, Restaurant De Hamburgers, Restaurant De Livraison, Restaurant À Emporter, Restaurant Mexicain, Restaurant Tex-Mex","2 Rue Mariès, Albi",1
81004,L'etoile D'orient,ChIJQ3u046nCrRIR0tnA9HxnmnE,"Restaurant, Restaurant De Couscous, Restaurant Halal, Artisanat, Restaurant De Livraison, Restaurant À Emporter, Restaurant Tunisien","46 Rue Émile Grand, Albi",1
81004,La Terrasse Kebab,ChIJr05LUgDorRIRJPzjd_9juh4,"Restaurant Turc, Restaurant De Restauration Rapide","24 Rue Dr Laurent Camboulives, Albi",1
81004,O Delices Albi,ChIJJRKh1R_prRIRK9wbYGCrt08,"Restaurant De Restauration Rapide, Restaurant De Kebab Doner, Aire De Restauration, Restaurant Halal, Restaurant De Hamburgers, Kebab, Restaurant, Restaurant De Tacos, Restaurant Turc","64 Rue Croix Verte, Albi",1
81004,La Forge Du Vieil Alby,ChIJhV5AItnDrRIRWjchJ-lknuU,Restaurant Français,"9 Rue De La Croix Blanche, Albi",0
81004,Restaurant Le Cascarbar À Albi,ChIJP-nl9anCrRIRz6VkudohlLI,"Restaurant Français, Restaurant De Petit-Déjeuner, Glacier","29 Rue Saint-Julien, Albi",0
81004,Alchimy,ChIJF0To2QHorRIRWBPOo-RApX8,"Restaurant Français, Brasserie, Hôtel","12 Pl. Du Palais, Albi",0
81004,La Fourchette Adroite,ChIJiUnK7KnCrRIRAhbmdKduEM4,Restaurant Français,"7 Pl. De L'archevêché, Albi",0
81004,Chez Yvette,ChIJo4yE40bdrRIRjuvm2ylzX-I,"Restaurant, Bar, Brasserie","2 Pl. Stalingrad, Albi",0
81004,Le Gourmet D'asie,ChIJdeHSN6LCrRIR68JLAuOczhg,"Restaurant Asiatique, Restaurant Chinois","157 Av. Dembourg, Albi",NA
81004,Saveurs D'asie,ChIJ7UwoUAHorRIR90I9QLWXgEA,"Restaurant Chinois, Restaurant Asiatique, Bar, Restaurant","6 Rue Louis D'amboise, Albi",NA
81004,Restaurant La Baie D'halong,ChIJ01OsswXorRIR4fH14LW0mzk,"Restaurant Vietnamien, Restaurant Chinois, Restaurant Thaïlandais","2 Rue Croix Verte, Albi",NA
81004,"Oyama, Restaurant Japonais",ChIJRc0sXQHorRIR31nCikXgdx0,Restaurant Japonais,"Fr, Albi",NA
81004,Bamboo Sushi,ChIJKX2kMQDorRIR_ZQ5mqrAOPU,Restaurant Japonais,"40 Rue Dr Laurent Camboulives, Albi",NA
81005,Mister Kebab Mazamet,ChIJkdtzjdEYrhIRl44ceJ5QNuc,"Kebab, Restaurant Américain, Restaurant Anglais, Restaurant De Restauration Rapide, Restaurant De Hamburgers, Sandwicherie, Restaurant De Tacos, Restaurant Turc","6 Pl. Philippe Olombel, Mazamet",1
81005,Chez Tonton,ChIJA8jaNs4YrhIRZ2waY5EYaC0,"Restaurant De Restauration Rapide, Poulet Frit À Emporter, Restaurant De Hamburgers, Kebab, Sandwicherie, Restaurant De Tacos","23 Bd Soult, Mazamet",1
81005,Lovely Food 81,ChIJWReAa8gZrhIRP-wqbWHHPCE,"Restaurant De Restauration Rapide, Restaurant Halal, Restaurant De Hamburgers, Restaurant","22 Rue De La Vanne, Mazamet",1
81005,Kebab Saint Pons,ChIJMbhy1PrrsRIRB9lAL4cTGGo,Kebab,"30 Grand Rue, Saint-Pons-de-Thomières",1
81005,L’oasis Food,ChIJQbh0Z0DrsRIRVZsmMsToNiM,"Restaurant De Restauration Rapide, Restaurant De Hamburgers, Kebab, Livraison De Pizzas, Restaurant De Pizzas, Pizza À Emporter, Magasin De Salades, Sandwicherie, Restaurant De Tacos","84 Grand Rue, Saint-Pons-de-Thomières",1
81005,Demeure De Flore,ChIJwSFWwXHnsRIR4sc3expnkY4,"Restaurant, Restaurant Français, Hôtel","81240 Lacabarède, Lacabarède",0
81005,La Voie Gourmande,ChIJvRRZ70LgsRIRSUpR9EVf8R4,Restaurant Français,"20 Bd Jeanne D'arc, Saint-Amans-Valtoret",0
81005,La Croix Blanche,ChIJjeMuUULgsRIR0lzwBJqkNYA,"Restaurant, Bar, Café, Support À Café, Restaurant Familial, Restaurant Français, Restaurant De Pizzas, Pizza À Emporter, Sandwicherie","46 Av. De La Méditerranée, Saint-Amans-Soult",0
81005,Les Ardeillès,ChIJS3z-pZ3esRIRQbz-kkuNqEA,"Restaurant, Restaurant Français","8 D620, Lespinassière",0
81005,Le Dolmen,ChIJgQccAUfosRIRNBhRFFxwFKA,Restaurant Français,"3 Le Galinel, Labastide-Rouairoux",0
81005,Jb's,ChIJEQseCEHosRIRPT_lnQw5s0o,"Restaurant, Café, Restaurant Anglais, Restaurant Indien, Restaurant À Emporter, Point Wi-Fi","5 Pl. Jean Jaurès, Labastide-Rouairoux",NA
81005,Japanroll,ChIJ02LcNWMZrhIRg0Qt9lTOWOU,Restaurant Japonais,"4 Pl. Philippe Olombel, Mazamet",NA
81005,Wa Fong,ChIJHZnhEdcYrhIRa3I_Fpm-Qls,"Restaurant Chinois, Restaurant Asiatique, Restaurant","35 Av. Jean Mermoz, Mazamet",NA
81005,Aurélie Sushi,ChIJVyUj9RbRsRIR8SwELIpEVoU,Sushis À Emporter,"13 Rue Des Cyprès, Peyriac-Minervois",NA
81005,Le Carabao,ChIJY3bKzqLPsRIRgBWtAj8XR1Y,"Restaurant Asiatique, Traiteur, Restaurant De Fondue Chinoise","5 Bis Pl. Jean Gastou, Pépieux",NA
81006,Kebab Turquoise,ChIJJ9nq4UqHrhIRrqyngJD5mOE,"Restaurant De Restauration Rapide, Kebab","2 Rue Du Petit Faubourg, Lavaur",1
81006,Kebab Ôpetit Creux Pain Nan,ChIJRc1D30qHrhIRju7Rw6yZGG0,Restaurant,"4 Av. Charles De Gaulle, Lavaur",1
81006,L’anatolie Kebab,ChIJPW3QWACBrhIRYFPnPl4A6yE,"Restaurant De Restauration Rapide, Restaurant Turc","11 Av. Augustin Malroux, Lavaur",1
81006,Burg' & Grill - Restaurant Caraman,ChIJqcZdZPOLrhIRer9m7Gd1DeI,"Restaurant, Restaurant Américain, Restaurant Barbecue, Restaurant Familial, Restaurant De Restauration Rapide, Restaurant De Hamburgers, Restaurant De Tacos","Pl. De Woillemont, Caraman",1
81006,Golden Tacos,ChIJdSgmHESBrhIRppbuzNbLySo,"Restaurant De Restauration Rapide, Boutique De Desserts, Restaurant De Kebab Doner, Magasin De Verre, Restaurant Grec, Restaurant De Hamburgers, Sandwicherie, Restaurant De Tacos, Restaurant Tex-Mex","Zone Commerciale Du Rouch, Lavaur",1
81006,Le Relais Cathare,ChIJ1Rfs-PRirhIRkmfMKiI1obU,Restaurant Français,"5 Rue Des Platanes, Cambon-lès-Lavaur",0
81006,Hôtel Restaurant Traiteur La Bombardière,ChIJ2yAOIL5jrhIRLaWlauwiCjg,"Restaurant, Traiteur, Restaurant Français, Hôtel, Relais Routier","15 Av. De Castres, Cuq-Toulza",0
81006,Auberge Le Cri De La Fourchette,ChIJI4M3xLtlrhIR8qFdcd0ZSC4,"Restaurant, Bar, Restaurant Français, Restaurant De Pizzas","Le Buguet, Puylaurens",0
81006,Le Fort Sainte Anne,ChIJ57wuf6Z9rhIRGIHypvzdd7Y,"Chambres D'hôtes, Restaurant Français","Route De Lavaur, Massac-Séran",0
81006,Auberge De Loubens,ChIJhymCsw-JrhIRMcfX88Xqn5A,"Restaurant Français, Bar, Restaurant, Brasserie","13 Place De La Halle, Loubens-Lauragais",0
81006,Le Petit Saigon,ChIJJbvVUs9_rhIRDunWBooZoW4,Restaurant Vietnamien,"25 Av. De Lavaur, Labastide-Saint-Georges",NA
81006,Maison Madaule,ChIJ3TSUUwB_rhIRYBfr1tH1I9k,Restaurant Asiatique,"12 Rue Jean Moulin, Labastide-Saint-Georges",NA
81006,La Cuisine Vietnamienne De Delphine,ChIJPa_QxVWHrhIRG0EdYx4-Ng8,Restaurant Vietnamien,"8 Av. Charles De Gaulle, Lavaur",NA
81006,Restaurant Le Chinatown,ChIJAW_dvUqHrhIRWeuTvBrjWj0,Restaurant Asiatique,"31 Av. Charles De Gaulle, Lavaur",NA
81006,Les Rives Du Mékong,ChIJ47XG9AmMrhIRu_0skNO7mGo,"Restaurant Asiatique, Restaurant Mandarin","48 Cr Alsace Lorraine, Caraman",NA
81007,Les Saveurs De La Madeleine,ChIJd4gLdBvTrRIRLbVtqgUA4Sw,"Kebab, Restaurant De Restauration Rapide","78 Rue De La Madeleine, Gaillac",1
81007,My Naan & Tacos,ChIJu3QU_6rTrRIRreRbaNR_TUE,"Restaurant De Restauration Rapide, Kebab, Restaurant, Sandwicherie, Restaurant Turc","44 Rue Joseph Rigal, Gaillac",1
81007,Smash & Food,ChIJde9lhanTrRIRSu3CmK_3Uks,"Restaurant De Restauration Rapide, Restaurant Halal, Kebab, Restaurant","7 Rue Du Languedoc, Gaillac",1
81007,Kebab Ô Délices,ChIJb6SMiTDSrRIRFentJg2NVt4,"Restaurant De Restauration Rapide, Kebab","14 Rue Jean Jaurès, Gaillac",1
81007,Tacos De Mars,ChIJlYCbJoPbrRIRGcImvA2DaoU,Restaurant De Tacos,"3avenue D’albi, Marssac-sur-Tarn",1
81007,La Bonne Auberge,ChIJE0fy6Z_OrRIRIQZ3bJ2cmbs,Restaurant Français,"Rue De L'église, Cahuzac-sur-Vère",0
81007,Restaurant Cahuzac-Sur-Vère Au Camping Le Soleil Des Bastides,ChIJI_vsg6DPrRIRmqF0X8c_kAc,"Restaurant, Bar, Bistro","279 Rte De Cordes, Cahuzac-sur-Vère",0
81007,Auberge De La Halle,ChIJR9Od9zTIrRIRhg05HvMN2mo,"Restaurant, Bar, Chambres D'hôtes, Crêperie, Restaurant Français","Pl. De La Halle, Cordes-sur-Ciel",0
81007,Bistrot Tonin'ty,ChIJnU1gxjTIrRIRN5pP5bltA4w,Bistro,"21 Rue Saint-Michel, Cordes-sur-Ciel",0
81007,Hostellerie Du Vieux Cordes,ChIJZWMdS8yf5UcRsglvaUuXVl0,"Restaurant, Restaurant Français, Hôtel","21 Rue Saint-Michel, Cordes-sur-Ciel",0
81007,Bubble San,ChIJy69QI2DJrRIREQjuFkqI_y0,Restaurant De Fusion Asiatique,"43 Grand Rue Raimond Vii, Cordes-sur-Ciel",NA
81007,8 Champa,ChIJn6K0LDjIrRIRydJiSpguOeY,Restaurant Asiatique,"Grand-Rue De L'horloge, Cordes-sur-Ciel",NA
81007,Petit Coin D'asie,ChIJZ7Tov6HTrRIR_5c0qZDQMjE,"Restaurant Asiatique, Restaurant Chinois De Livraison, Restaurant Japonais, Restaurant Laotien, Restaurant Mandarin","52 Rue Saint-Jean, Gaillac",NA
81007,Bangkok Deli Street Food,ChIJT3z0hkfTrRIRMLfgITQ_uog,"Restaurant Thaïlandais, Restaurant","108 Pl. D'hautpoul, Gaillac",NA
81007,Sayaka,ChIJMftDSP7SrRIRwqMosNSKWNw,Restaurant Japonais,"Espace De Piquerouge, Gaillac",NA
81008,B.burger,ChIJAQCkCZXqrRIRQbNcxS7ncEA,"Restaurant De Tacos, Restaurant De Restauration Rapide, Restaurant De Hamburgers, Kebab","30 Av. De Rodez, Carmaux",1
81008,Tacos Express Carmaux,ChIJibaUyCXrrRIRAqW7V7acLL8,"Restaurant De Tacos, Restaurant De Restauration Rapide, Restaurant Indien, Restaurant Du Déjeuner","74 Av. Jean Jaurès, Carmaux",1
81008,La Cabana,ChIJo9x4qyfprRIRNmVD82lognE,"Restaurant De Restauration Rapide, Restaurant Halal","21 Av. Germain Tequi, Saint-Juéry",1
81008,Chez Muy'ö Pizzeria De La Madeleine Albi,ChIJcR97DsvDrRIRbs4zxv7ey3Q,"Pizza À Emporter, Restaurant Halal, Épicerie Italienne, Restaurant Italien, Livraison De Pizzas, Restaurant De Pizzas, Restaurant","94 Av. Dembourg, Albi",1
81008,L'etoile D'orient,ChIJQ3u046nCrRIR0tnA9HxnmnE,"Restaurant, Restaurant De Couscous, Restaurant Halal, Artisanat, Restaurant De Livraison, Restaurant À Emporter, Restaurant Tunisien","46 Rue Émile Grand, Albi",1
81008,Le Coin Du Pont,ChIJQSZxanKVrRIR-Bdsmnp4kd0,Bistro,"Les Trois Hiboux, Crespin",0
81008,Le Boeuf Marin,ChIJYevmbJHqrRIRejGUvIwrc8k,"Restaurant Haut De Gamme Français, Restaurant Français, Restaurant","32 Av. Bouloc Torcatis, Carmaux",0
81008,Le Lapin Blanc,ChIJN_MGh9yVrRIRSfR7RxX9aqA,"Restaurant, Restaurant Français","3 Av. Du Moulin, Mirandol-Bourgnounac",0
81008,Chez Martine,ChIJ3Xcy6JDqrRIRQA_3GuXDW24,"Restaurant, Restaurant Français","16 Pl. Jean Jaurès, Carmaux",0
81008,Bistrot La Tourangelle,ChIJ___rbJHqrRIRe8BeRwxIHwA,"Restaurant Français, Bistro, Restaurant","1 Bd Du Rajol, Carmaux",0
81008,Restaurant Nuit D'orient,ChIJIdEd4JDqrRIRcSsqGCcdyyU,"Restaurant Vietnamien, Restaurant Asiatique, Bar, Restaurant Chinois","12 Rue Bousquet, Carmaux",NA
81008,Paradis D’asie,ChIJmVl10pPqrRIRf479IrGUay8,"Restaurant, Restaurant Chinois","14 Rue De L'hôtel De Ville, Carmaux",NA
81008,Tukta Thai Cuisine,ChIJZQ-8qdSRrRIRU7Z_bZ4G7wA,"Fournisseur De Nourriture Et De Boissons Pour La Restauration, Restaurant Asiatique","477 La Borie Basse, Cabanès",NA
81008,Thai Square Restaurant,ChIJI6pt4TPorRIRib4badphsnI,Restaurant Thaïlandais,"11 Imp. De Solviel, Lescure-d'Albigeois",NA
81008,Sushiman E.leclerc Lescure D'albigeois,ChIJC1gHkozprRIRpRLE9-RsdWc,"Sushis À Emporter, Restaurant Asiatique, Restaurant De Restauration Rapide, Restaurant À Emporter, Restaurant D'asie Du Sud-Est, Restaurant De Sushis","Route De Carmaux Larquipeyre Leclerc, Lescure-d'Albigeois",NA
81009,Les Saveurs De La Madeleine,ChIJd4gLdBvTrRIRLbVtqgUA4Sw,"Kebab, Restaurant De Restauration Rapide","78 Rue De La Madeleine, Gaillac",1
81009,My Naan & Tacos,ChIJu3QU_6rTrRIRreRbaNR_TUE,"Restaurant De Restauration Rapide, Kebab, Restaurant, Sandwicherie, Restaurant Turc","44 Rue Joseph Rigal, Gaillac",1
81009,Smash & Food,ChIJde9lhanTrRIRSu3CmK_3Uks,"Restaurant De Restauration Rapide, Restaurant Halal, Kebab, Restaurant","7 Rue Du Languedoc, Gaillac",1
81009,Kebab Ô Délices,ChIJb6SMiTDSrRIRFentJg2NVt4,"Restaurant De Restauration Rapide, Kebab","14 Rue Jean Jaurès, Gaillac",1
81009,Tacos De Mars,ChIJlYCbJoPbrRIRGcImvA2DaoU,Restaurant De Tacos,"3avenue D’albi, Marssac-sur-Tarn",1
81009,Auberge De La Halle,ChIJR9Od9zTIrRIRhg05HvMN2mo,"Restaurant, Bar, Chambres D'hôtes, Crêperie, Restaurant Français","Pl. De La Halle, Cordes-sur-Ciel",0
81009,Bistrot Tonin'ty,ChIJnU1gxjTIrRIRN5pP5bltA4w,Bistro,"21 Rue Saint-Michel, Cordes-sur-Ciel",0
81009,Table D'yvonne,ChIJP4c3VjTIrRIRNkSXPNuCTF4,Restaurant Français,"Pl. De La Halle, Cordes-sur-Ciel",0
81009,Hostellerie Du Vieux Cordes,ChIJZWMdS8yf5UcRsglvaUuXVl0,"Restaurant, Restaurant Français, Hôtel","21 Rue Saint-Michel, Cordes-sur-Ciel",0
81009,Restaurant Cahuzac-Sur-Vère Au Camping Le Soleil Des Bastides,ChIJI_vsg6DPrRIRmqF0X8c_kAc,"Restaurant, Bar, Bistro","279 Rte De Cordes, Cahuzac-sur-Vère",0
81009,Bubble San,ChIJy69QI2DJrRIREQjuFkqI_y0,Restaurant De Fusion Asiatique,"43 Grand Rue Raimond Vii, Cordes-sur-Ciel",NA
81009,8 Champa,ChIJn6K0LDjIrRIRydJiSpguOeY,Restaurant Asiatique,"Grand-Rue De L'horloge, Cordes-sur-Ciel",NA
81009,Petit Coin D'asie,ChIJZ7Tov6HTrRIR_5c0qZDQMjE,"Restaurant Asiatique, Restaurant Chinois De Livraison, Restaurant Japonais, Restaurant Laotien, Restaurant Mandarin","52 Rue Saint-Jean, Gaillac",NA
81009,Bangkok Deli Street Food,ChIJT3z0hkfTrRIRMLfgITQ_uog,"Restaurant Thaïlandais, Restaurant","108 Pl. D'hautpoul, Gaillac",NA
81009,Sayaka,ChIJMftDSP7SrRIRwqMosNSKWNw,Restaurant Japonais,"Espace De Piquerouge, Gaillac",NA
81010,La Cabana,ChIJo9x4qyfprRIRNmVD82lognE,"Restaurant De Restauration Rapide, Restaurant Halal","21 Av. Germain Tequi, Saint-Juéry",1
81010,Napolit’hein Albi - Bar À Pâtes,ChIJsVP4FzvprRIR5t3OzWW9Wtc,"Restaurant, Restaurant Halal, Restaurant Italien, Restaurant Du Déjeuner, Restaurant Végétarien","16 Av. Colonel Teyssier, Albi",1
81010,O Sucré Salé (Tacos-Burger) Albi,ChIJ_QXCBNXprRIR8XE8jHSCBg4,"Restaurant De Restauration Rapide, Crêperie, Restaurant De Hamburgers, Kebab, Restaurant De Tacos","54 Rue Croix Verte, Albi",1
81010,O Delices Albi,ChIJJRKh1R_prRIRK9wbYGCrt08,"Restaurant De Restauration Rapide, Restaurant De Kebab Doner, Aire De Restauration, Restaurant Halal, Restaurant De Hamburgers, Kebab, Restaurant, Restaurant De Tacos, Restaurant Turc","64 Rue Croix Verte, Albi",1
81010,Black & White Burger Albi,ChIJtenGCDXprRIRtIZbAMMTBDA,"Restaurant De Hamburgers, Restaurant Américain, Restaurant Familial, Restaurant De Restauration Rapide, Restaurant Halal, Restaurant De Livraison, Restaurant À Emporter, Nouveau Restaurant Américain, Restaurant, Restaurant Végétarien","43 Lices Georges Pompidou, Albi",1
81010,La Parenthèse,ChIJF05pvCvwrRIR4-CeDkecoPE,"Restaurant Français, Bar, Hôtel","Le Bourg, Ambialet",0
81010,Le Barry,ChIJ-_jCd_H6rRIR4lceZgQReRE,"Restaurant, Bar, Restaurant Français, Hôtel","47 Av. De Millau, Villefranche-d'Albigeois",0
81010,Le Vieux Cabaret,ChIJ2_9yg-v6rRIRr66NKMFqeGg,"Restaurant, Restaurant Français","49 Av. D'albi, Villefranche-d'Albigeois",0
81010,Restaurant L'oustal,ChIJaeBxgecJshIRQgTnXk0cL6A,"Restaurant, Restaurant Français, Restaurant Méditerranéen","Prade Del Bourg, Trébas",0
81010,Restaurant La Chanterelle,ChIJRdGQWTcIshIRPmunNZWruGA,"Restaurant, Bar, Restaurant Barbecue","Prade Del Bourg, Trébas",0
81010,Dragon D'or,ChIJW0Lot8PorRIRLxCYKQHgPSE,"Restaurant Vietnamien, Restaurant Chinois","51 Av. Jean Jaurès, Saint-Juéry",NA
81010,Nouveau Saïgon,ChIJLSUB4wforRIRqEl_DzAlTwE,"Restaurant Vietnamien, Restaurant Asiatique, Bar, Restaurant Chinois, Restaurant, Restaurant Thaïlandais","81 Av. Colonel Teyssier, Albi",NA
81010,Thai Square Restaurant,ChIJI6pt4TPorRIRib4badphsnI,Restaurant Thaïlandais,"11 Imp. De Solviel, Lescure-d'Albigeois",NA
81010,Restaurant La Baie D'halong,ChIJ01OsswXorRIR4fH14LW0mzk,"Restaurant Vietnamien, Restaurant Chinois, Restaurant Thaïlandais","2 Rue Croix Verte, Albi",NA
81010,Oki,ChIJlz6d43HprRIRZOftLteUQyM,"Restaurant Japonais, Restaurant De Restauration Rapide, Restaurant De Sushis","31 Rue Général Pont, Albi",NA
81011,Golden Tacos,ChIJdSgmHESBrhIRppbuzNbLySo,"Restaurant De Restauration Rapide, Boutique De Desserts, Restaurant De Kebab Doner, Magasin De Verre, Restaurant Grec, Restaurant De Hamburgers, Sandwicherie, Restaurant De Tacos, Restaurant Tex-Mex","Zone Commerciale Du Rouch, Lavaur",1
81011,L’anatolie Kebab,ChIJPW3QWACBrhIRYFPnPl4A6yE,"Restaurant De Restauration Rapide, Restaurant Turc","11 Av. Augustin Malroux, Lavaur",1
81011,Kebab Ôpetit Creux Pain Nan,ChIJRc1D30qHrhIRju7Rw6yZGG0,Restaurant,"4 Av. Charles De Gaulle, Lavaur",1
81011,Kebab Turquoise,ChIJJ9nq4UqHrhIRrqyngJD5mOE,"Restaurant De Restauration Rapide, Kebab","2 Rue Du Petit Faubourg, Lavaur",1
81011,O Village,ChIJ02B24gt_rhIRY9thgqw8EMQ,"Snack-Bar, Restaurant De Restauration Rapide, Kebab","22 Pl. Courtille, Briatexte",1
81011,Chez John,ChIJKxHtSoWArhIRm3gPeBaMnnI,Restaurant Français,"465 Rte De Gaillac, Ambres",0
81011,Mcdonald's,ChIJ7W_1uNOArhIRCE_cquXgEBI,"Restaurant De Restauration Rapide, Restaurant Américain, Restaurant De Hamburgers, Restaurant De Pizzas, Restaurant, Sandwicherie","De, Lavaur",0
81011,L'oeuf De Coq Restaurant Lavaur,ChIJdSQiKrWArhIRXpcL-OHZEMA,"Restaurant Haut De Gamme Français, Restaurant Français","1 Rue Pasteur, Lavaur",0
81011,Le Ver A Soie,ChIJM5FSTEuHrhIRWFMjd7fyLhk,Restaurant Français,"14 All. Jean Jaurès, Lavaur",0
81011,Restaurant L'assiette Au Comptoir,ChIJG4J8x0yHrhIRQhDGU8PSQHw,"Restaurant, Restaurant Français","19 Rue Carlesse, Lavaur",0
81011,La Cuisine Vietnamienne De Delphine,ChIJPa_QxVWHrhIRG0EdYx4-Ng8,Restaurant Vietnamien,"8 Av. Charles De Gaulle, Lavaur",NA
81011,Restaurant Le Chinatown,ChIJAW_dvUqHrhIRWeuTvBrjWj0,Restaurant Asiatique,"31 Av. Charles De Gaulle, Lavaur",NA
81011,Maison Madaule,ChIJ3TSUUwB_rhIRYBfr1tH1I9k,Restaurant Asiatique,"12 Rue Jean Moulin, Labastide-Saint-Georges",NA
81011,Le Petit Saigon,ChIJJbvVUs9_rhIRDunWBooZoW4,Restaurant Vietnamien,"25 Av. De Lavaur, Labastide-Saint-Georges",NA
81011,Asahi,ChIJJXixD6aCrhIR-Net8h4pHTQ,"Restaurant, Restaurant Japonais Authentique","28 Esp. Octave Medale, Saint-Sulpice-la-Pointe",NA
81012,Les Saveurs De La Madeleine,ChIJd4gLdBvTrRIRLbVtqgUA4Sw,"Kebab, Restaurant De Restauration Rapide","78 Rue De La Madeleine, Gaillac",1
81012,My Naan & Tacos,ChIJu3QU_6rTrRIRreRbaNR_TUE,"Restaurant De Restauration Rapide, Kebab, Restaurant, Sandwicherie, Restaurant Turc","44 Rue Joseph Rigal, Gaillac",1
81012,Smash & Food,ChIJde9lhanTrRIRSu3CmK_3Uks,"Restaurant De Restauration Rapide, Restaurant Halal, Kebab, Restaurant","7 Rue Du Languedoc, Gaillac",1
81012,Kebab Ô Délices,ChIJb6SMiTDSrRIRFentJg2NVt4,"Restaurant De Restauration Rapide, Kebab","14 Rue Jean Jaurès, Gaillac",1
81012,Tacos De Mars,ChIJlYCbJoPbrRIRGcImvA2DaoU,Restaurant De Tacos,"3avenue D’albi, Marssac-sur-Tarn",1
81012,La Bonne Auberge,ChIJE0fy6Z_OrRIRIQZ3bJ2cmbs,Restaurant Français,"Rue De L'église, Cahuzac-sur-Vère",0
81012,Restaurant Cahuzac-Sur-Vère Au Camping Le Soleil Des Bastides,ChIJI_vsg6DPrRIRmqF0X8c_kAc,"Restaurant, Bar, Bistro","279 Rte De Cordes, Cahuzac-sur-Vère",0
