respondent.commune,business_name,place_id,fr_categories,business_address,treatment_arm
Ablon-sur-Seine,260,ChIJ6ezacwB15kcRKV2ZT6N5OAk,"Restaurant De Restauration Rapide, Restaurant De Hamburgers, Restaurant De Pizzas, Restaurant De Tacos","14 Rue Du Bac, Ablon-sur-Seine",1
Ablon-sur-Seine,Au Palmier D'agadir,ChIJ89nKmx515kcR1RIWOnwZ6go,Restaurant Marocain,"18 Rue Du Maréchal Lyautey, Villeneuve-le-Roi",1
Ablon-sur-Seine,Snack Friterie (Halal) Parking Routier,ChIJxXVUu6Lf5UcRlgJWd02mGeM,Restaurant De Restauration Rapide,"Parking Euromat, Athis-Mons",1
Ablon-sur-Seine,O'tacos,ChIJI_2d1tIK5kcRkk1pskB907A,"Restaurant De Restauration Rapide, Support À Café, Restaurant Halal, Sandwicherie","6 Rue De Paris, Villeneuve-Saint-Georges",1
Ablon-sur-Seine,Testi,ChIJ0XEtUdMK5kcRHB8vr3uZoxE,Restaurant Turc,"55 Rue De Paris, Villeneuve-Saint-Georges",1
Ablon-sur-Seine,Brasserie Restaurant,ChIJzeiM5Bl15kcR5mn3h2__pYo,Brasserie,"94480 Ablon-Sur-Seine, Ablon-sur-Seine",0
Ablon-sur-Seine,Bistrot Du Marché Villeneuve Le Roi,ChIJHVablJJ15kcRnLicCseroSo,"Restaurant, Bar Et Grill, Restaurant De Petit-Déjeuner, Restaurant Familial, Restaurant De Restauration Rapide, Marché De Produits Frais, Restaurant Du Déjeuner, Restaurant À Emporter, Restaurant De Plats De Viande, Restaurant Traditionnel","32-38 Av. Le Foll, Villeneuve-le-Roi",0
Ablon-sur-Seine,Le Palace,ChIJp3flyyF15kcRAhj7JjfrdyA,"Restaurant Français, Bar, Bar Sportif","2 Av. De La République, Villeneuve-le-Roi",0
Ablon-sur-Seine,Mcdonald's,ChIJneueVS915kcRTSxXu9m-blY,"Restaurant De Restauration Rapide, Restaurant Américain, Restaurant De Hamburgers, Restaurant De Pizzas, Restaurant, Sandwicherie","20 Av. De La Haute Seine, Villeneuve-le-Roi",0
Ablon-sur-Seine,Le Faisan Doré,ChIJdRH1PSB15kcRCjAovMmco8Q,Restaurant Français,"5 Pl. Jeanne D'arc, Villeneuve-le-Roi",0
Ablon-sur-Seine,Sawadeeka Restaurant Thaïlandais & Coffee Shop,ChIJZ8YvS8h15kcRYG12M0kJBe8,"Restaurant Thaïlandais, Café","6 Rue Du Bac, Ablon-sur-Seine",NA
Ablon-sur-Seine,Restaurant Shahi (Ex-Shiva),ChIJ5SyEmB515kcRNcdIF1r-beM,"Restaurant Pakistanais, Restaurant Indien Musulman, Restaurant Indien","18 Rue Du Maréchal Lyautey, Villeneuve-le-Roi",NA
Ablon-sur-Seine,Auberge D'asie,ChIJEc1ihB515kcRTDgXJ01flYk,"Restaurant Mandarin, Restaurant Asiatique, Bar, Restaurant Chinois","47 Av. De La République, Villeneuve-le-Roi",NA
Ablon-sur-Seine,La Rizière,ChIJrY9jryF15kcRnzl3zMius2o,"Restaurant Vietnamien, Bar, Salle Des Fêtes, Restaurant","2 Rue Jean Pierre Timbaud, Villeneuve-le-Roi",NA
Ablon-sur-Seine,Sushi Land,ChIJBzLZzSF15kcRvsvwx2bp-Pg,Restaurant Japonais,"4 Av. De La République, Villeneuve-le-Roi",NA
Alfortville,Chez Eli - Restaurant/Traiteur Libanais,ChIJqWfntgVz5kcRjknJnlDsiCk,"Restaurant Libanais, Traiteur","157 Rue Véron, Alfortville",1
Alfortville,La Rogina,ChIJA40GCxBz5kcR3QcDBafzMe4,"Restaurant, Restaurant Arménien, Gril, Restaurant Barbecue, Restaurant De Kebab Doner, Restaurant De Hamburgers, Restaurant De Livraison, Livraison De Pizzas, Restaurant De Pizzas, Pizza À Emporter","177b Rue Paul Vaillant Couturier, Alfortville",1
Alfortville,Nusican,ChIJZ14tXD9z5kcRT5Fut20RWWQ,"Restaurant Turc, Café, Restaurant De Restauration Rapide, Restaurant Halal, Kebab, Restaurant Du Déjeuner, Sandwicherie, Restaurant De Tacos, Restaurant Traditionnel","75 Rue Victor Hugo, Alfortville",1
Alfortville,Locorico,ChIJXVplAM5z5kcRlXQiTpu4p6o,"Restaurant Halal, Restaurant D'ailes De Poulet, Restaurant De Restauration Rapide","21 Rue Micolon, Alfortville",1
Alfortville,O'malo Alfortville,ChIJXbVaCQJz5kcRMwxSviO_xLw,"Restaurant De Restauration Rapide, Restaurant De Hamburgers, Kebab, Restaurant À Emporter, Restaurant, Sandwicherie","28 Rue Charles De Gaulle, Alfortville",1
Alfortville,Le Jardin D'erevan,ChIJy0YOzhpz5kcRk5VoWjQGQo8,"Restaurant Arménien, Restaurant Français","4 Rue Jules Cuillerier, Alfortville",0
Alfortville,Les Hirondelles,ChIJd9iMGhtz5kcRvO9KntekwHA,"Restaurant Français, Restaurant De Couscous, Restaurant De Pizzas","59 Rue Louis Blanc, Alfortville",0
Alfortville,Caprice,ChIJ83WILaxz5kcRpIUTkJndfrA,"Restaurant Français, Restaurant Gastronomique, Restaurant Haut De Gamme Français, Restaurant","60 Rue De Charenton, Alfortville",0
Alfortville,Bouchons & Resto,ChIJ6yX_NgRz5kcR7XGRUK9NXOs,"Restaurant Français, Restaurant","118 Rue Véron, Alfortville",0
Alfortville,Edera,ChIJa5HiVo1z5kcR2_nZPByVobI,"Restaurant Roumain, Restaurant Français","3 Rue De Charenton, Alfortville",0
Alfortville,Rajpoot Restaurant Indien Et Pakistanais,ChIJZUN9if1y5kcRHSynPQDXWDQ,"Restaurant Indien, Restaurant Pakistanais, Restaurant","31 Rue Charles De Gaulle, Alfortville",NA
Alfortville,Kyotorama,ChIJvdZDXhJz5kcRQw5hNc8jdC8,Restaurant Japonais,"34 Rue Véron, Alfortville",NA
Alfortville,Sakura,ChIJcS8JJAxz5kcR4vrQTqEO27Y,"Restaurant Japonais, Restaurant Thaïlandais","206 Rue Paul Vaillant Couturier, Alfortville",NA
Alfortville,Chez Jaib,ChIJhxdMcVZz5kcRqLGiTJCHWXA,Restaurant Thaïlandais,"162 Rue Paul Vaillant Couturier, Alfortville",NA
Alfortville,Papaye,ChIJH-TJOBpz5kcRYchfi0TU3mc,"Restaurant Thaïlandais, Restaurant Vietnamien","180 Rue Paul Vaillant Couturier, Alfortville",NA
Arcueil,So'grill,ChIJD5rn8RJx5kcRvE0ermoVfvo,"Restaurant De Hamburgers, Restaurant Halal, Kebab, Restaurant De Tacos","2 Av. Paul Vaillant Couturier, Arcueil",1
Arcueil,Smash'up 🍔👑,ChIJydn_SXJx5kcRxPxIO1XohnM,Restaurant Halal,"Pl. De La Vache Noire, Arcueil",1
Arcueil,El Wadi,ChIJ-_8PIBdx5kcRXbyfJiSMfzk,"Restaurant, Traiteur, Restaurant Halal, Restaurant Libanais, Restaurant Végétalien, Restaurant Végétarien","75 Av. Aristide Briand, Arcueil",1
Arcueil,Grill Istanbul,ChIJx95bBw9x5kcROJHAK6nyYBU,"Restaurant Turc, Restaurant De Restauration Rapide","2 Av. Laplace, Arcueil",1
Arcueil,Brikabrak,ChIJnRcpfKVx5kcRC47QWaLL_2c,Restaurant Marocain,"14 Av. Du Chaperon Vert, Arcueil",1
Arcueil,Le P'tit Bistrot,ChIJc-KS7Q1x5kcRf8SHGO3flE0,"Restaurant Français, Bar, Bistro","129 Rue Marius Sidobre, Arcueil",0
Arcueil,Au Bureau,ChIJuabJ1gVx5kcRjI1JYOO7AxA,"Restaurant, Bar, Restaurant Européen, Restaurant Français, Restaurant De Hamburgers, Restaurant Irlandais, Pub, Bar Sportif","3 Pl. De La Vache Noire, Arcueil",0
Arcueil,Chez Papa,ChIJv1tmoRtx5kcRGPeUZEcv0Jw,Restaurant Français,"99 Av. Aristide Briand, Arcueil",0
Arcueil,Hippopotamus,ChIJu_T0LBtx5kcRf61cWN6vPN8,"Restaurant, Bar Et Grill, Restaurant Barbecue, Dîner, Restaurant Familial, Restaurant Français, Restaurant À Emporter, Steak House","3 Carrefour De La Vache Noire, Arcueil",0
Arcueil,L'océan Bleu,ChIJQyRiARFx5kcRlonAldQOBPw,"Brasserie, Bar, Brasserie, Restaurant","71 Rue Emile Raspail, Arcueil",0
Arcueil,Little Long House,ChIJiXwSMQFx5kcRVVJ8bhZbxM4,Restaurant Japonais,"17 Av. Victor Hugo, Bagneux",NA
Arcueil,Sawasdee Thaî,ChIJd0pQIJFx5kcR4apybMc_r9M,Restaurant Thaïlandais,"15 Av. Victor Hugo, Bagneux",NA
Arcueil,Baan Nat,ChIJe1YxEYhx5kcRYVW4tM0UFXQ,"Restaurant Thaïlandais, Restaurant","61 Av. Laplace, Arcueil",NA
Arcueil,Ô Boui Boui,ChIJmXrNHadx5kcRaxTRPZW3ZMg,Restaurant Thaïlandais,"67 Av. Laplace, Arcueil",NA
Arcueil,Dream Sushi,ChIJS8T6twhx5kcRFngyOK3ohLk,"Restaurant Japonais, Bar, Restaurant De Sushis","49 Av. Vladimir Ilitch Lenine, Arcueil",NA
Boissy-Saint-Léger,Le Palais D'agadir - Restaurant Marocain 94,ChIJoQNyI78L5kcRl7HVm4rfFh4,Restaurant Marocain,"5 Bd Léon Revillon, Boissy-Saint-Léger",1
Boissy-Saint-Léger,Maxin Chicken,ChIJ7bJ8yjUL5kcRM3SOO1Dwf4M,"Restaurant Halal, Restaurant De Restauration Rapide","3 Rue De Paris, Boissy-Saint-Léger",1
Boissy-Saint-Léger,Poulet Braisé - La Bonne Braise - Churrasqueira,ChIJMQaO1QcL5kcRbh1i9e6p5qc,"Restaurant, Restaurant Barbecue, Espace Barbecue, Restaurant De Poulet, Magasin De Poulet, Restaurant D'ailes De Poulet, Restaurant Halal, Restaurant De Hamburgers, Restaurant Portugais, Restaurant De Riz","26 Rue De Paris, Boissy-Saint-Léger",1
Boissy-Saint-Léger,So Grill,ChIJ9e-A9LYL5kcRngVZjYflysA,"Restaurant, Restaurant Halal, Restaurant Portugais","26 Rue De Paris, Boissy-Saint-Léger",1
Boissy-Saint-Léger,Palais Du Kashmir,ChIJk2IUW6IL5kcRP26HR-99D7A,"Restaurant Indien, Restaurant Halal","48 Av. Du Président Wilson, Limeil-Brévannes",1
Boissy-Saint-Léger,La Fourchette Braisée / Poulet Braisé & Grillades Halal/ Boissy Saint Léger,ChIJwxRfTzML5kcRaQg1Uj-F_Rw,Restaurant Barbecue,"4a Bd De La Gare, Boissy-Saint-Léger",0
Boissy-Saint-Léger,Rdv Ici,ChIJqyUJx5cL5kcRgqBndpaWVdA,"Crêperie, Café, Restaurant Français, Restaurant À Emporter","4a Bd De La Gare, Boissy-Saint-Léger",0
Boissy-Saint-Léger,Au Bar À Bières,ChIJndESf3kL5kcRVMzsdgYSnIQ,"Bar, Magasin De Bière, Bistro, Café, Kiosque À Journaux, Pub, Bar À Vin","1 Bd De La Gare, Boissy-Saint-Léger",0
Boissy-Saint-Léger,Courtepaille,ChIJdVcca5oL5kcRKEgpP5jasGk,"Restaurant De Steakhouse Français, Gril, Bar Et Grill, Restaurant Familial, Restaurant Français, Restaurant De Plats De Viande, Restaurant","10 Rue Du 8 Mai 1945, Boissy-Saint-Léger",0
Boissy-Saint-Léger,Royale Pizza,ChIJ2V9WcgsL5kcR6XHUd_uFD-w,"Restaurant De Pizzas, Restaurant De Restauration Rapide, Restaurant Français, Restaurant Italien, Restaurant De Livraison, Livraison De Pizzas, Restaurant, Restaurant Du Sud De L'italie","67 Rue Henri Barbusse, Limeil-Brévannes",0
Boissy-Saint-Léger,Sakura,ChIJwToKW74L5kcRAWMvwwU4Cyw,"Restaurant Japonais, Restaurant Asiatique, Restaurant De Sushis","34 Rue De Paris, Boissy-Saint-Léger",NA
Boissy-Saint-Léger,Tandoori House,ChIJx0vUlWoL5kcRMGXmXBIuxYg,Restaurant Indien,"9 Rue De Paris, Boissy-Saint-Léger",NA
Boissy-Saint-Léger,Best Thai Kitchen,ChIJqen2tScL5kcRcFw0uEwaMB4,Restaurant Thaïlandais,"28 Rue De Sucy, Boissy-Saint-Léger",NA
Boissy-Saint-Léger,Sakura.,ChIJDQcMPgsL5kcRLMMIUwx5XjA,"Restaurant Japonais, Restaurant De Sushis","2 Rue Roger Salengro, Limeil-Brévannes",NA
Boissy-Saint-Léger,Papylee,ChIJda-WUX0L5kcRtphAlEbEKd8,Restaurant Asiatique,"1-3 Av. Du Bicentenaire 1789-1989 À E.leclerc, Bonneuil-sur-Marne",NA
Bonneuil-sur-Marne,Le Boostan,ChIJi44mgIoN5kcR3oOzF5DsjQs,"Restaurant, Bar Et Grill, Restaurant Halal, Bar À Chicha, Salon","97 Av. De Paris, Bonneuil-sur-Marne",1
Bonneuil-sur-Marne,Restaurant Istanbul,ChIJUdGIa4IM5kcRo_W0cuDilbY,Restaurant Turc,"Av. Du Colonel Fabien, Bonneuil-sur-Marne",1
Bonneuil-sur-Marne,Le Riad De Marrakech,ChIJ43ynFp0M5kcRTOnbU2JBI2I,Restaurant Marocain,"Av. De Paris, Bonneuil-sur-Marne",1
Bonneuil-sur-Marne,Magnolia,ChIJAd1nZoIM5kcRh1g54y7cwSw,"Restaurant Turc, Bar, Restaurant De Restauration Rapide","3 Av. Auguste Gross, Bonneuil-sur-Marne",1
Bonneuil-sur-Marne,G La Dalle - Bonneuil,ChIJMe1YinIN5kcRb4nXbU1wJdk,"Restaurant De Hamburgers, Restaurant De Restauration Rapide, Restaurant Halal","1 Av. De Choisy, Bonneuil-sur-Marne",1
Bonneuil-sur-Marne,La Marmite - Restaurant Français,ChIJl4VoUpkM5kcR_x9AItx8Va8,"Restaurant Français, Restaurant Familial, Restaurant Français Moderne, Restaurant","77 Av. De Paris, Bonneuil-sur-Marne",0
Bonneuil-sur-Marne,Le Kong,ChIJFwEpKkIN5kcRJK2IDLul75g,Restaurant Français,"5 Rte De L'ouest, Bonneuil-sur-Marne",0
Bonneuil-sur-Marne,Café De La Mairie,ChIJRxDQdn4N5kcRWonLAKH2FDI,"Bar À Tabac, Bar Pmu, Brasserie, Bureau De Tabac","5 Rue D'estienne D'orves, Bonneuil-sur-Marne",0
Bonneuil-sur-Marne,Mcdonald's,ChIJT1PlensL5kcR8d6EOKca5y0,"Restaurant De Restauration Rapide, Restaurant Américain, Restaurant De Hamburgers, Restaurant De Pizzas, Restaurant, Sandwicherie","Zac De La, Bonneuil-sur-Marne",0
Bonneuil-sur-Marne,Burger King,ChIJeZ5lTwF06UcR7Ff7sxQO50U,"Restaurant De Restauration Rapide, Restaurant Américain, Bar Et Grill, Restaurant Familial, Restaurant De Hamburgers, Restaurant À Emporter","8 Av Des Vingt-Huit Arpents, Bonneuil-sur-Marne",0
Bonneuil-sur-Marne,Kyotorama,ChIJ974ag3sL5kcRIINSs9quyJM,"Restaurant Japonais, Restaurant De Sushis","31 Av. De Paris, Bonneuil-sur-Marne",NA
Bonneuil-sur-Marne,Mamishe,ChIJ2zfmAmIL5kcR6kuu57bSOhI,"Restaurant De Hamburgers, Stand De Hot-Dogs, Restaurant Japonais, Restaurant Casher","64 Av. De Choisy, Bonneuil-sur-Marne",NA
Bonneuil-sur-Marne,Dragonking,ChIJAQDsbYIM5kcRbbtr2G8k9sQ,Restaurant Asiatique,"Av. Du Colonel Fabien 11, Bonneuil-sur-Marne",NA
Bonneuil-sur-Marne,Palais De Bonneuil,ChIJLemNXGYL5kcRrkVYY31AyOg,"Restaurant Buffet, Restaurant Chinois, Restaurant Japonais, Restaurant, Restaurant De Sushis","7 Av Des Vingt-Huit Arpents, Bonneuil-sur-Marne",NA
Bonneuil-sur-Marne,Papylee,ChIJda-WUX0L5kcRtphAlEbEKd8,Restaurant Asiatique,"1-3 Av. Du Bicentenaire 1789-1989 À E.leclerc, Bonneuil-sur-Marne",NA
Bry-sur-Marne,Grill Bodrum,ChIJwzGD2fMN5kcRIsH2cmVSQQY,"Restaurant, Kebab","10 Bd Du Maréchal Foch, Noisy-le-Grand",1
Bry-sur-Marne,Restaurant Sympathique,ChIJL1n2vOMN5kcRizXF6f9QVj8,Kebab,"8 Gd Rue Charles De Gaulle, Bry-sur-Marne",1
Bry-sur-Marne,Le Magnifique,ChIJ4d4wTJYN5kcRfN1KkIOAv3I,"Kebab, Restaurant De Restauration Rapide, Restaurant","230 Av. Pierre Brossolette, Le Perreux-sur-Marne",1
Bry-sur-Marne,Restaurant Big Boss,ChIJOXca_4cN5kcRSTCGAjTCzA4,"Restaurant Halal, Restaurant De Hamburgers, Kebab, Restaurant De Plats De Viande","8 Blvd Gallieni, Neuilly-Plaisance",1
Bry-sur-Marne,Friday Food,ChIJj8FpRd0N5kcRJZAJTCfaiKs,"Restaurant De Restauration Rapide, Restaurant À Emporter, Restaurant Pakistanais, Restaurant De Pizzas, Restaurant, Restaurant Turc","35 Rte De Bry, Villiers-sur-Marne",1
Bry-sur-Marne,Chicken Palace,ChIJL-hmAB8N5kcRRzdHWEpglTw,Restaurant Barbecue,"14 Bd Du Maréchal Foch, Noisy-le-Grand",0
Bry-sur-Marne,Le Score,ChIJSUi0tPIN5kcRiLLIDKbW7jo,"Brasserie, Bar","39 Bd Du Général Gallieni, Bry-sur-Marne",0
Bry-sur-Marne,L'alexandrin,ChIJkf2Hz20N5kcRh0aLJkMD6Iw,"Brasserie, Bar, Café, Hôtel","33 Gd Rue Charles De Gaulle, Bry-sur-Marne",0
Bry-sur-Marne,Backstage Café,ChIJu8tEnOgN5kcRnmWMntWLS5Y,"Restaurant, Bar, Brasserie","2 Av. De L'europe, Bry-sur-Marne",0
Bry-sur-Marne,La Petite Tromenie,ChIJJVjzjpQN5kcRhnP1lRLXNDc,"Crêperie, Restaurant Français, Restaurant, Magasin De Salades","Lundis Fermés Pendant Les Vacances Scolaires, Bry-sur-Marne",0
Bry-sur-Marne,Bolkiri Bry-Sur-Marne Street Food Viêt,ChIJy9ywZBAN5kcRuEzE53JZUys,"Restaurant Vietnamien, Restaurant Asiatique, Restaurant Chinois, Restaurant De Restauration Rapide, Restaurant De Livraison, Restaurant À Emporter, Restaurant Pho, Restaurant, Restaurant Thaïlandais, Restaurant De Wok","6 Pl. Carnot, Bry-sur-Marne",NA
Bry-sur-Marne,Taj Mahal Restaurant Indien,ChIJq6parcIN5kcRkluP9097sYk,"Restaurant Indien, Restaurant Chinois","41 Rte De Bry, Villiers-sur-Marne",NA
Bry-sur-Marne,Hoki Sushi,ChIJe7f7NHYS5kcRKBx53NIFdTs,"Restaurant Japonais, Restaurant Buffet","33 Blvd Gallieni, Neuilly-Plaisance",NA
Bry-sur-Marne,My Little Warung Noisy-Le-Grand,ChIJA4W_-AQN5kcRLpoCDe0orbc,"Restaurant De Fondue Chinoise, Restaurant De Restauration Rapide, Restaurant Indonésien, Restaurant À Emporter, Restaurant De Nouilles, Restaurant Sud-Asiatique, Restaurant Thaïlandais, Restaurant Végétalien, Restaurant Végétarien, Restaurant Vietnamien","3 Bd Du Mont D'est, Noisy-le-Grand",NA
Bry-sur-Marne,Royal Plaisance,ChIJSYI5B3gS5kcRaI1O-sysLtA,"Restaurant Chinois, Restaurant Thaïlandais","11 Blvd Gallieni, Neuilly-Plaisance",NA
Cachan,Al Doken,ChIJiUiIiKFx5kcRkon6l_1zO3o,"Restaurant Tunisien, Traiteur, Restaurant","107 Av. Aristide Briand, Cachan",1
Cachan,Butcher Square,ChIJP1EV4Ndx5kcRA15_EEtdCMQ,"Restaurant Italien, Restaurant Halal, Restaurant De Pizzas, Restaurant","31 Av. Du Pont Royal, Cachan",1
Cachan,O'braisé,ChIJf-oUzk9x5kcR0IKPrImTk1Q,"Restaurant De Restauration Rapide, Poulet Frit À Emporter, Restaurant Halal, Restaurant De Hamburgers","31 Av. Du Pont Royal, Cachan",1
Cachan,Meister,ChIJvZq2mldx5kcR1HTex3GlwYc,"Kebab, Restaurant De Kebab Doner, Restaurant De Restauration Rapide, Restaurant","25 Av. Aristide Briand, Cachan",1
Cachan,Riad Fes,ChIJfSnrjzFx5kcRXRlPGH4xHYU,Restaurant Marocain,"14 Pl. Jacques Carat, Cachan",1
Cachan,Instant-Lunch,ChIJyeTGd4dx5kcR_GL_r_HUxI8,"Restaurant, Restaurant Brunch, Traiteur","1 Rue Emile Raspail, Arcueil",0
Cachan,Mcdonald's,ChIJOTCrPSFx5kcRs5dIy0UFtgU,"Restaurant De Restauration Rapide, Restaurant Américain, Restaurant De Hamburgers, Restaurant De Pizzas, Restaurant, Sandwicherie","149/151 Av. Aristide Briand, Cachan",0
Cachan,Gwenn Ha Du,ChIJ9dEAVT5x5kcRyz7sXdcKnI4,"Crêperie, Restaurant","30 Pl. Jacques Carat, Cachan",0
Cachan,Le Lorada,ChIJLxOPeyJx5kcRGw1mgPC5oOc,"Restaurant Français, Restaurant De Pizzas, Pizza À Emporter, Restaurant Traditionnel","2 Rue Condorcet, Cachan",0
Cachan,Valflor Café,ChIJucO4rT5x5kcRCgLo0pGuLs0,"Restaurant Portugais, Café, Brasserie","43 Av. Dumotel, Cachan",0
Cachan,Le Palais De Cachan,ChIJ3USwlUVx5kcR1Tyk4VGSqHU,"Restaurant Chinois, Restaurant","27 Av. Aristide Briand, Cachan",NA
Cachan,Hoki Yaki,ChIJiRqTMRlx5kcR92fkB09DpBE,"Restaurant Japonais, Restaurant Asiatique, Restaurant Chinois, Restaurant, Restaurant De Sushis","33 Av. Aristide Briand, Cachan",NA
Cachan,O'kashmir,ChIJ6_DYvE1x5kcRE16zPJznKmA,Restaurant Indien,"14 B Av. Carnot, Cachan",NA
Cachan,Toyama,ChIJRTGq2q1x5kcREXaL8uoTX90,Restaurant Japonais,"8 Pl. Jacques Carat, Cachan",NA
Cachan,Régal Thaï,ChIJjdhxO-Bx5kcRsv0TmeBHfkE,Restaurant Thaïlandais,"15 Av. Aristide Briand, Cachan",NA
Champigny-sur-Marne,786 - Champigny-Sur-Marne I Brasserie & Burger,ChIJ01yRiawN5kcRyQyvCR0U47Y,"Restaurant, Restaurant De Restauration Rapide, Restaurant Halal, Restaurant De Hamburgers, Brasserie","28 Rue Jean Jaurès, Champigny-sur-Marne",1
Champigny-sur-Marne,Restaurant Le Maroc,ChIJeZEqHhsN5kcRIxJkEQhfQhU,Restaurant Marocain,"16 Av. Du Général De Gaulle, Champigny-sur-Marne",1
Champigny-sur-Marne,Restaurant Chez Yunus,ChIJh0igrhsN5kcRytwxRAzqxoU,"Restaurant De Restauration Rapide, Kebab","3 Av. Du Général De Gaulle, Champigny-sur-Marne",1
Champigny-sur-Marne,Burger Parisien (Halal),ChIJ5XNvlmgN5kcRuXji2H_F0k8,"Restaurant De Hamburgers, Bar À Cocktails","186 Bd De Stalingrad, Champigny-sur-Marne",1
Champigny-sur-Marne,Pacha Grill,ChIJpR7JKLMN5kcRv6lWtcWSyYA,Restaurant Turc,"36 Rue Louis Talamoni, Champigny-sur-Marne",1
Champigny-sur-Marne,Brasserie De La Mairie,ChIJJe_SorIN5kcRcFpjnjitGH8,"Restaurant Français, Bar, Restaurant Du Déjeuner, Restaurant Traditionnel","2 Rue Louis Talamoni, Champigny-sur-Marne",0
Champigny-sur-Marne,Café Restaurant Le Trotteur,ChIJWw-WfBkN5kcRIwPpDs2vWyc,"Restaurant, Bar, Magasin De Bière, Pâtisserie, Bar À Cocktails, Restaurant Français, Restaurant De Hamburgers, Restaurant Du Moyen-Orient, Bar À Vin","9 Av. Roger Salengro, Champigny-sur-Marne",0
Champigny-sur-Marne,Ô Bouillon,ChIJA9i4IXwN5kcRPciT3mxM8VI,Restaurant Français,"309 Av. Du Général De Gaulle, Champigny-sur-Marne",0
Champigny-sur-Marne,Restaurant A La Maison.,ChIJ6SatoAgN5kcRT0b4SeOv7ws,"Restaurant Français, Restaurant","128 Av. Du Général De Gaulle, Champigny-sur-Marne",0
Champigny-sur-Marne,Restaurant Mar Azul,ChIJa1XPx8gN5kcRITTKK2IDVQc,"Restaurant De Fruits De Mer, Restaurant Barbecue, Restaurant Portugais","34 Rue Benoît Frachon, Champigny-sur-Marne",0
Champigny-sur-Marne,Restaurant Ravana - Champigny-Sur-Marne,ChIJCd7NbkwN5kcRU964bkU4hUQ,"Restaurant Indien, Restaurant Indien Musulman, Restaurant Sri-Lankais, Restaurant Traditionnel","8 Av. De La République, Champigny-sur-Marne",NA
Champigny-sur-Marne,Restaurant Panda Champigny Sur Marne,ChIJ-fzLa84N5kcRjPRUJvftv-I,"Restaurant, Restaurant Chinois, Restaurant De Sushis","8-10 Rue Serpente, Champigny-sur-Marne",NA
Champigny-sur-Marne,Le Punjab,ChIJ3b_e2xoN5kcRcg-RZjdhtJs,Restaurant Indien,"17-19 Av. Du Général De Gaulle, Champigny-sur-Marne",NA
Champigny-sur-Marne,New Achiana,ChIJzRi59QQN5kcRF09MPXqXtXs,"Restaurant Indien, Bar, Restaurant Végétarien","7 Rue Maurice Pirolley, Champigny-sur-Marne",NA
Champigny-sur-Marne,Sashimi-Ya,ChIJqYM6uBsN5kcROQbCwR4mB_o,"Restaurant Japonais, Restaurant De Sushis","16 Av. Roger Salengro, Champigny-sur-Marne",NA
Charenton-le-Pont,Restaurant L'etoile,ChIJIf5gP_9y5kcR6y4lI2rMFK4,"Restaurant Turc, Kebab","43 Quai Des Carrières, Charenton-le-Pont",1
Charenton-le-Pont,La Petite Terrasse,ChIJgRK5vfxy5kcRLVsOYxKe5lY,"Kebab, Restaurant","16 Rue De Paris, Charenton-le-Pont",1
Charenton-le-Pont,Au Libanais De Saint-Maurice.,ChIJmas7svxy5kcRQooxaO-YCj0,Restaurant Libanais,"8 Av. Du Maréchal De Lattre De Tassigny, Saint-Maurice",1
Charenton-le-Pont,Restaurant Léa,ChIJV1DDV49z5kcRc93zEvHJW7c,Restaurant Libanais,"152 Rue De Paris, Charenton-le-Pont",1
Charenton-le-Pont,Boulangerie Pâtisserie Breads Paradise,ChIJD1gaN7Vz5kcRhSTaeQawIks,"Boulangerie, Pâtisserie, Traiteur, Restaurant De Restauration Rapide, Restaurant Français, Restaurant Halal, Pâtisserie, Sandwicherie, Restaurant Végétarien","24 Rue Eugène Renault, Maisons-Alfort",1
Charenton-le-Pont,Le Bistrot De Charenton,ChIJvUWY-Fdy5kcRbR9D8o1Xh5A,Restaurant Français,"123 Rue De Paris, Charenton-le-Pont",0
Charenton-le-Pont,Tante Eugénie,ChIJmx2M-Vdy5kcRJaLv2Q2iOtU,"Restaurant, Café, Brasserie","121 Rue De Paris, Charenton-le-Pont",0
Charenton-le-Pont,La Bolée D'arvor,ChIJoyBffPxy5kcRYBY6xvceTyw,"Crêperie, Bar, Restaurant Français, Restaurant À Emporter","38 Rue De Paris, Charenton-le-Pont",0
Charenton-le-Pont,Le Paris Sports.,ChIJnYp0Nlhy5kcRC8lflPNu_4U,"Brasserie, Brasserie","116 Rue De Paris, Charenton-le-Pont",0
Charenton-le-Pont,Tupinambá,ChIJeYHInrhz5kcR_0BKBpTIlWc,"Restaurant Brésilien, Restaurant Français, Restaurant Méditerranéen","37 Rue Gabriel Péri, Charenton-le-Pont",0
Charenton-le-Pont,Le Pavillon Céleste,ChIJnYp0Nlhy5kcRwzY-VNBKRk8,Restaurant Asiatique,"116 Bis Rue De Paris, Charenton-le-Pont",NA
Charenton-le-Pont,La Maison De Diep,ChIJIwptvfxy5kcRw7viFPkxgwQ,"Restaurant Vietnamien, Restaurant","18 Rue De Paris, Charenton-le-Pont",NA
Charenton-le-Pont,En-Lai.,ChIJwbrvTvhy5kcRZMBbstJPJg8,"Restaurant Mandarin, Restaurant Asiatique","101 Rue De Paris, Charenton-le-Pont",NA
Charenton-le-Pont,Tandem Saveurs Nomades,ChIJcW2cX-dz5kcRsRMiJnCqgGY,"Restaurant, Restaurant De Fusion Asiatique, Restaurant Fusion, Restaurant Européen Moderne, Restaurant Nuevo Latino","50 Av. Du Maréchal De Lattre De Tassigny, Saint-Maurice",NA
Charenton-le-Pont,Huatian Chinagora Restaurant,ChIJOY72tf9y5kcRGKM2YKrJwpA,Restaurant Chinois,"France-Chine, Alfortville",NA
Chennevières-sur-Marne,Grill Istanbul,ChIJ-dDs3icM5kcRMvoHSgMtn5M,Restaurant Turc,"28 Rte De La Libération, Chennevières-sur-Marne",1
Chennevières-sur-Marne,Waffle'n Truck,ChIJXSJGASoN5kcR7qa4hbH3wMg,"Restaurant, Restaurant Belge, Restaurant De Cuisine Campagnarde, Restaurant Halal","17 Rue Du Fossé Vert, Chennevières-sur-Marne",1
Chennevières-sur-Marne,Restaurant Riad Salam,ChIJXwxFVjgM5kcR4D3wF8U-2cw,"Restaurant Marocain, Restaurant Arabe, Restaurant Halal, Restaurant, Salon De Thé","101 Quai Winston Churchill, Saint-Maur-des-Fossés",1
Chennevières-sur-Marne,Pitaya Thaï Street Food,ChIJxSWKrLcP5kcR2hTriV-iggk,"Restaurant De Restauration Rapide, Restaurant Halal, Restaurant De Fondue Chinoise, Restaurant Panasiatique, Restaurant, Restaurant D'asie Du Sud-Est, Restaurant Thaïlandais, Restaurant De Wok","Centre Commercial Pince Vent, Chennevières-sur-Marne",1
Chennevières-sur-Marne,Grill Istanbul,ChIJWTVgA5cO5kcRy6J7Mi8_LWE,"Restaurant Turc, Restaurant De Restauration Rapide","85 Rte De Provins, Chennevières-sur-Marne",1
Chennevières-sur-Marne,La Veranda,ChIJj5w7iqAN5kcRgVhavH2qzas,"Restaurant Créole, Magasin De Bière, Bar À Cocktails, Restaurant Français, Glacier, Restaurant De Fruits De Mer, Bar À Vin","69 Rue De Champigny, Chennevières-sur-Marne",0
Chennevières-sur-Marne,L'italien Restaurant,ChIJRcclxygM5kcRP-Glyyyc25U,"Restaurant, Restaurant Français","3 Rte De La Libération, Chennevières-sur-Marne",0
Chennevières-sur-Marne,Le Duo,ChIJTwW_f50O5kcRM-QdtXa6m0Q,"Restaurant, Restaurant Barbecue, Restaurant Portugais, Restaurant Traditionnel","73 Rue Des Fusillés De Châteaubriant, Chennevières-sur-Marne",0
Chennevières-sur-Marne,L'ecu De France,ChIJ43sipj4M5kcRFjrI0kOxT3c,"Restaurant Français, Restaurant Gastronomique","31 Rue De Champigny, Chennevières-sur-Marne",0
Chennevières-sur-Marne,Pizza Food,ChIJZU9bsTwM5kcR7kykQ0L1i8g,"Restaurant De Pizzas, Restaurant De Restauration Rapide, Restaurant Français, Restaurant Italien, Livraison De Pizzas, Restaurant","34 Rue Du Général De Gaulle, Chennevières-sur-Marne",0
Chennevières-sur-Marne,Sushi Wasabi 7 - Restaurant,ChIJV9Wo5ScM5kcRTK96fbodhu8,"Restaurant De Sushis, Restaurant Chinois, Restaurant Japonais, Restaurant Mandarin","25 Bis Rte De La Libération, Chennevières-sur-Marne",NA
Chennevières-sur-Marne,Out Fry - Korean Fried Chicken By Taster,ChIJ-3Co92UN5kcRY42wnvxBlMQ,"Restaurant À Emporter, Restaurant Asiatique, Restaurant De Poulet, Restaurant De Restauration Rapide, Restaurant Coréen","71 Rue Du Général De Gaulle, Chennevières-sur-Marne",NA
Chennevières-sur-Marne,Shuriken Sushi,ChIJKbn4_6cN5kcR0yNILHkMJzg,Restaurant Japonais,"France, Ormesson-sur-Marne",NA
Chennevières-sur-Marne,Matsuko（ Sushi Bar）,ChIJp45BlZcO5kcRiuycYl2s66A,"Restaurant De Fusion Asiatique, Restaurant Japonais, Restaurant De Sushis, Restaurant Yakitori","France, Ormesson-sur-Marne",NA
Chennevières-sur-Marne,Le Bonheur De Chine,ChIJ7QbjbxgM5kcRfooucbTtSpM,"Restaurant Chinois, Restaurant Asiatique, Restaurant Chinois De Livraison, Restaurant","Rue D'amboile, Chennevières-sur-Marne",NA
Chevilly-Larue,Les Maraîchers,ChIJa3bbSKFz5kcRQouYLQAondk,"Restaurant, Bar, Kebab, Restaurant À Emporter, Restaurant De Pizzas, Pizza À Emporter, Brasserie","20 Av. Du Viaduc, Chevilly-Larue",1
Chevilly-Larue,Best Break,ChIJ1bk85wZ05kcRY-DvuU7ehXE,"Restaurant De Restauration Rapide, Restaurant Halal, Sandwicherie","12 Pl. Du Maréchal De Lattre De Tassigny, Chevilly-Larue",1
Chevilly-Larue,Calm's,ChIJ_boHcwR05kcRRiOz2Yi6iFo,"Restaurant De Hamburgers, Restaurant Américain, Poulet Frit À Emporter, Restaurant Halal, Restaurant Mexicain","7 Rue Pasteur, Chevilly-Larue",1
