respondent.commune,business_name,place_id,fr_categories,business_address,treatment_arm
Limeil-Brévannes,L'arène Des Poulets,ChIJF8aycEcL5kcRykRg9rKe-LM,"Bistro, Restaurant Du Déjeuner","4 All. Léopold Sédar Senghor, Limeil-Brévannes",0
Limeil-Brévannes,Rdv Ici,ChIJqyUJx5cL5kcRgqBndpaWVdA,"Crêperie, Café, Restaurant Français, Restaurant À Emporter","4a Bd De La Gare, Boissy-Saint-Léger",0
Limeil-Brévannes,Sakura.,ChIJDQcMPgsL5kcRLMMIUwx5XjA,"Restaurant Japonais, Restaurant De Sushis","2 Rue Roger Salengro, Limeil-Brévannes",NA
Limeil-Brévannes,Ak Sushi,ChIJz6t45xQL5kcRn5Rl5xAcSQc,"Restaurant Japonais, Restaurant De Sushis","11-13 Pl. Louis Aragon, Limeil-Brévannes",NA
Limeil-Brévannes,Papylee,ChIJda-WUX0L5kcRtphAlEbEKd8,Restaurant Asiatique,"1-3 Av. Du Bicentenaire 1789-1989 À E.leclerc, Bonneuil-sur-Marne",NA
Limeil-Brévannes,Tandoori House,ChIJx0vUlWoL5kcRMGXmXBIuxYg,Restaurant Indien,"9 Rue De Paris, Boissy-Saint-Léger",NA
Limeil-Brévannes,Sakura,ChIJwToKW74L5kcRAWMvwwU4Cyw,"Restaurant Japonais, Restaurant Asiatique, Restaurant De Sushis","34 Rue De Paris, Boissy-Saint-Léger",NA
Maisons-Alfort,Ls Café,ChIJT3RmSAwN5kcRYSHOuEKOrkc,"Restaurant Brunch, Espace De Coworking, Restaurant Halal","107 Rue Marc Sangnier, Maisons-Alfort",1
Maisons-Alfort,La Perle Du Maroc,ChIJt9I-UNQM5kcR8QfiupgpAsA,"Restaurant Marocain, Restaurant","261 Av. De La République, Maisons-Alfort",1
Maisons-Alfort,Restaurant Le Poulailler | Kebab Traditionnel - Döner - Depuis 2006 - Val-De-Marne 94 Maisons-Alfort حلال,ChIJiYaZBz1z5kcRdc_gbeKEsxo,"Kebab, Restaurant De Restauration Rapide","9 Av. De La République, Maisons-Alfort",1
Maisons-Alfort,Restaurant Grillé Bos. Maisons-Alfort Phore,ChIJ80SyxShz5kcR4CS0BeW6ECg,"Kebab, Restaurant De Restauration Rapide","54 Av. Georges Clemenceau, Maisons-Alfort",1
Maisons-Alfort,Saveurs Couscous,ChIJDXGzOzpz5kcRUCBSpEJ8szY,"Restaurant, Restaurant De Livraison, Restaurant Marocain, Pâtisserie","55 Rue Victor Hugo, Maisons-Alfort",1
Maisons-Alfort,Le Charentonneau,ChIJtzuKCCRz5kcRDCN5jZKlLqs,"Restaurant Français, Bar, Restaurant, Restaurant De Fruits De Mer","159 Av. Du Général Leclerc, Maisons-Alfort",0
Maisons-Alfort,Le Pavillon Bleu,ChIJC8KEvtdy5kcRGeo3Qh_LCA8,"Restaurant, Bar À Cocktails, Restaurant Français","1 Av. Joffre, Maisons-Alfort",0
Maisons-Alfort,Mansio,ChIJIR3zXM9z5kcRmnMlQugc2cA,"Restaurant, Restaurant Français","133 Av. Georges Clemenceau, Maisons-Alfort",0
Maisons-Alfort,Le Grand Café De La Mairie,ChIJVVXlpj1z5kcRVkysxMOwDxE,"Restaurant Français, Brasserie, Brasserie","5 Av. De La République, Maisons-Alfort",0
Maisons-Alfort,Chez Michel,ChIJBxhSZCVz5kcRGfNIsh0BDSk,"Restaurant, Restaurant Français","82 Av. Du Général Leclerc, Maisons-Alfort",0
Maisons-Alfort,Sabai Sabai M.alfort,ChIJP2-XBuYN5kcR1QCY0mKQ41M,Restaurant Thaïlandais,"239 Av. De La République, Maisons-Alfort",NA
Maisons-Alfort,La Petite Table De Saïgon,ChIJAQCkuddy5kcRrecxr2K80w4,Restaurant Vietnamien,"2 Av. Joffre, Maisons-Alfort",NA
Maisons-Alfort,Jasuko,ChIJOa2ZN-By5kcRCmIIIGsPd_M,"Restaurant Japonais, Restaurant Asiatique","Fr, Maisons-Alfort",NA
Maisons-Alfort,Amakari,ChIJ5XzjFJVz5kcRXq-CBo9ryzo,"Restaurant Indien, Restaurant Indien Moderne","34 Cr Des Juilliottes, Maisons-Alfort",NA
Maisons-Alfort,Crispy Rice,ChIJfXjMKPhz5kcR70TVLIwQoUk,Restaurant Thaïlandais,"12 Cr Des Juilliottes, Maisons-Alfort",NA
Mandres-les-Roses,Grill Istanbul,ChIJT61ODfYJ5kcR1_8Mtkky2pA,"Kebab, Restaurant De Kebab Doner","12 Rue De Brie, Mandres-les-Roses",1
Mandres-les-Roses,Kebab Villecresnes - Aylin,ChIJNU94XigK5kcRTanHuw8TK1Y,Kebab,"56 Rue Du Lieutenant Dagorno, Villecresnes",1
Mandres-les-Roses,Le Régal,ChIJybrJ2nMK5kcRfQ2-kVt6nqo,Restaurant Turc,"6 Pl. De La Gare, Brunoy",1
Mandres-les-Roses,Restaurant Chez Dada,ChIJl4jV03MK5kcR46kSKcPHe6w,"Restaurant Turc, Restaurant","19 Rue De La République, Brunoy",1
Mandres-les-Roses,Le Val Senart Bar Kebab Pizza,ChIJrQKb1Rzi5UcRyCnyOS5CxFk,"Kebab, Bar Et Grill","10 Rue Des 2 Communes, Quincy-sous-Sénart",1
Mandres-les-Roses,La Taverne,ChIJ_alj2agJ5kcRl6hn6UtwY-w,"Brasserie, Restaurant","10 Rue De Brie, Mandres-les-Roses",0
Mandres-les-Roses,Poulet D2s,ChIJjzRFctsL5kcRz0cIZE4Asgk,"Restaurant, Restaurant De Restauration Rapide, Restaurant Français, Restaurant Du Déjeuner","61 Rue De Brunoy, Villecresnes",0
Mandres-les-Roses,La Poésie Des Sens,ChIJofhK0QUK5kcRpWiu1N02VZA,"Traiteur, Restaurant Français, Restaurant Français Moderne, Buffet De Mariage, Service De Mariage","1 Av. Victor Hugo Centre Cial Principal, Épinay-sous-Sénart",0
Mandres-les-Roses,Pépé & Mémé Restaurant Bar Brocante,ChIJuWBfnrEL5kcRYbCEU3ES0f4,"Restaurant Français, Restaurant","76 Rue De Cerçay, Brunoy",0
Mandres-les-Roses,Juste - La Brasserie,ChIJf9tSq29z5kcRx0PWSbMoc_8,"Brasserie, Restaurant Brunch, Bar À Cocktails, Restaurant De Cuisine Campagnarde, Glacier, Restaurant Français Moderne, Magasin De Pâtes, Restaurant De Pizzas, Salon De Thé, Bar À Vin","73 Rue Du Lieutenant Dagorno, Villecresnes",0
Mandres-les-Roses,Sushiman Intermaché Villecresnes,ChIJa4HzwoIL5kcRYErReFTb5iA,"Sushis À Emporter, Restaurant Asiatique, Restaurant De Restauration Rapide, Restaurant À Emporter, Restaurant D'asie Du Sud-Est, Restaurant De Sushis","Intermarché, Villecresnes",NA
Mandres-les-Roses,Shunfa,ChIJ9-ePJg8K5kcRMvEwy6oyaAA,Restaurant Chinois,"94 Rue Du Boisselet, Épinay-sous-Sénart",NA
Mandres-les-Roses,Ban Buriram,ChIJqYKXCQAL5kcRFz9c9UIwVEg,Restaurant Thaïlandais,"23 Rue De Cerçay, Villecresnes",NA
Mandres-les-Roses,Wokasie,ChIJeYhP52Xj5UcRixX2LXJcdrU,"Restaurant Asiatique, Restaurant Japonais","Val D'yerres, Boussy-Saint-Antoine",NA
Mandres-les-Roses,Okayama,ChIJYbXaUXIK5kcRgMqHwNDK4xo,"Restaurant, Restaurant Chinois, Restaurant Japonais, Restaurant De Sushis","8 Rte De Brie, Brunoy",NA
Marolles-en-Brie,Le Domaine Libanais,ChIJdy-0OXsJ5kcROmpoGHS7ybM,Restaurant Libanais,"Centre Commercial Du Domaine, Santeny",1
Marolles-en-Brie,Pizza Liva,ChIJI8KcciwK5kcRtEby2B_t6X4,"Restaurant De Pizzas, Restaurant Italien, Kebab, Livraison De Pizzas, Pizza À Emporter, Restaurant De Tacos","55 Av. Du Maréchal De Lattre De Tassigny, Villecresnes",1
Marolles-en-Brie,Kebab Villecresnes - Aylin,ChIJNU94XigK5kcRTanHuw8TK1Y,Kebab,"56 Rue Du Lieutenant Dagorno, Villecresnes",1
Marolles-en-Brie,Le Palais D'agadir - Restaurant Marocain 94,ChIJoQNyI78L5kcRl7HVm4rfFh4,Restaurant Marocain,"5 Bd Léon Revillon, Boissy-Saint-Léger",1
Marolles-en-Brie,Poulet Braisé - La Bonne Braise - Churrasqueira,ChIJMQaO1QcL5kcRbh1i9e6p5qc,"Restaurant, Restaurant Barbecue, Espace Barbecue, Restaurant De Poulet, Magasin De Poulet, Restaurant D'ailes De Poulet, Restaurant Halal, Restaurant De Hamburgers, Restaurant Portugais, Restaurant De Riz","26 Rue De Paris, Boissy-Saint-Léger",1
Marolles-en-Brie,Le Restaurant Du Golf,ChIJJe7XEi4J5kcRyuMOSIXXhpM,"Restaurant, Restaurant Barbecue, Restaurant De Petit-Déjeuner, Restaurant Brunch, Fromagerie, Restaurant De Hamburgers, Restaurant Du Déjeuner, Magasin De Salades, Sandwicherie","Mail De La Justice, Marolles-en-Brie",0
Marolles-en-Brie,La Villa,ChIJ7Z_IxIMJ5kcRWth_T8MEP7M,"Restaurant, Restaurant Français","54 Av. De Grosbois, Marolles-en-Brie",0
Marolles-en-Brie,Le Sunset,ChIJH2NUaAAL5kcRAIfrtJjYSOA,Restaurant Brunch,"44 Rue Du Général Leclerc, Villecresnes",0
Marolles-en-Brie,L'inattendu Villecresnes Emilien Rouable,ChIJdXIUN90L5kcRBsDpA9R1nxk,Restaurant Haut De Gamme Français,"36 Rue Du Général Leclerc, Villecresnes",0
Marolles-en-Brie,Del Arte,ChIJC4gqvqsJ5kcR6QzjF5zXt0I,"Restaurant, Restaurant Familial, Restaurant Français, Restaurant Italien, Restaurant Du Déjeuner, Restaurant À Emporter, Restaurant Méditerranéen, Restaurant Du Nord De L'italie, Restaurant De Pizzas, Restaurant Du Sud De L'italie","Lieu Dit ""Le, Santeny",0
Marolles-en-Brie,Meilleur Sushi,ChIJOwQ38lgJ5kcRaWMEygYLd-k,Restaurant Japonais,"France, Marolles-en-Brie",NA
Marolles-en-Brie,Sushi Grill Marolles En Brie,ChIJReGrHIEJ5kcRV1YJ0hqh-p0,"Restaurant Japonais, Restaurant Chinois, Restaurant De Sushis","9 Rue De La Tuilerie, Marolles-en-Brie",NA
Marolles-en-Brie,Les Merveilles De Chine,ChIJn_s_oYAJ5kcREyEDez14-6U,"Restaurant Chinois, Restaurant Asiatique","2 Av. Du Maréchal De Lattre De Tassigny, Villecresnes",NA
Marolles-en-Brie,Saigon,ChIJF77W2a4J5kcRQXZpa_qbSDk,Restaurant Vietnamien,"5 Pl. Du Village, Santeny",NA
Marolles-en-Brie,Sushi You,ChIJJd1UtScK5kcRMOgoFR3SZMY,"Restaurant Japonais, Restaurant","45 Bis Av. Du Maréchal De Lattre De Tassigny, Villecresnes",NA
Nogent-sur-Marne,Sweet Time Nogent-Sur-Marne,ChIJzcyk5M4N5kcRk9nlAWpJxrY,"Restaurant De Restauration Rapide, Restaurant Américain, Restaurant Canadien, Poulet Frit À Emporter, Restaurant Halal, Restaurant De Hamburgers","65 Gd Rue Charles De Gaulle, Nogent-sur-Marne",1
Nogent-sur-Marne,Le Marrakech,ChIJPXqj5UEN5kcRToyLhtMgZqw,"Restaurant Marocain, Bar","20 Bd De Strasbourg, Nogent-sur-Marne",1
Nogent-sur-Marne,L'assiette Express,ChIJUXv0YnEN5kcR_sDPc6zB45s,"Restaurant De Restauration Rapide, Restaurant Américain, Pâtisserie, Restaurant Halal, Restaurant De Hamburgers, Kebab, Restaurant Du Moyen-Orient, Pâtisserie","73 Gd Rue Charles De Gaulle, Nogent-sur-Marne",1
Nogent-sur-Marne,Restaurant Paristanbul,ChIJ1Ukk30AN5kcR0Emmp7R0ogI,"Restaurant Turc, Kebab","2 B Bd Gambetta, Nogent-sur-Marne",1
Nogent-sur-Marne,Burger Parisien,ChIJX9MhGCsN5kcROT6tTpYpNTc,"Restaurant, Restaurant Halal","30 Rue Paul Bert, Nogent-sur-Marne",1
Nogent-sur-Marne,Restaurant Le Nogentais,ChIJtennOmwN5kcRiDs3AB7B_78,"Restaurant Français, Gastro-Pub, Restaurant","111 Gd Rue Charles De Gaulle, Nogent-sur-Marne",0
Nogent-sur-Marne,Restaurant Guinguette Le Val De Beauté,ChIJb2J75D8N5kcRLakwlVhDoHQ,"Restaurant Français, Restaurant","1 Av. Du Val De Beauté, Nogent-sur-Marne",0
Nogent-sur-Marne,Restaurant La Salamandre,ChIJ6SbMsD8N5kcRN1JjFzIJyM0,"Restaurant Français, Restaurant","10 - 12 Bd De La Marne, Nogent-sur-Marne",0
Nogent-sur-Marne,Hippopotamus Steakhouse,ChIJHadDcXMN5kcRSxue5BuQEi8,"Restaurant, Bar Et Grill, Restaurant Barbecue, Dîner, Restaurant Familial, Restaurant Français, Restaurant À Emporter, Steak House","23 Bd Albert 1er, Nogent-sur-Marne",0
Nogent-sur-Marne,Le Crysam,ChIJ92YKEGwN5kcRLRBAqjJwJo8,"Restaurant, Restaurant Français, Restaurant Italien, Restaurant De Pizzas","5 Rue Paul Bert, Nogent-sur-Marne",0
Nogent-sur-Marne,Garden,ChIJ2wxJx2sN5kcRz5ArTJbo8nw,"Restaurant Coréen, Restaurant De Fondue Chinoise, Restaurant Mandarin, Restaurant","6 Rue André Pontier, Nogent-sur-Marne",NA
Nogent-sur-Marne,Bharati,ChIJ_RHA3m0N5kcRuf9H3Jjj13o,"Restaurant Indien, Restaurant De Livraison","2 Bd Gallieni, Nogent-sur-Marne",NA
Nogent-sur-Marne,Shaan's Paji,ChIJw0r4pOsN5kcRN3EpZlUz3yw,Restaurant Indien,"40 Av. Kléber, Nogent-sur-Marne",NA
Nogent-sur-Marne,Kokrabi,ChIJgayo3f0N5kcRnbPpwH7mWl8,"Restaurant, Restaurant Thaïlandais, Restaurant Végétarien","175 Gd Rue Charles De Gaulle, Nogent-sur-Marne",NA
Nogent-sur-Marne,Restaurant Royal Volonté,ChIJCde6k2sN5kcR0rWKC7xKOm8,"Restaurant Japonais, Restaurant Asiatique, Restaurant Chinois, Restaurant De Sushis","77 Gd Rue Charles De Gaulle, Nogent-sur-Marne",NA
Noiseau,Les Jardins De Majorelle,ChIJw9efLAUM5kcRvoGNLGMfBzc,"Restaurant, Restaurant Marocain","164 Av. Olivier D'ormesson, Ormesson-sur-Marne",1
Noiseau,L’univers De Serenay,ChIJRdmvcNEN5kcRrzTilYGSpzQ,"Restaurant Brunch, Crêperie, Restaurant De Kebab Doner, Restaurant Halal, Restaurant De Hamburgers, Kebab, Restaurant, Sandwicherie, Salon De Thé, Restaurant Turc","Av. Olivier D'ormesson, Ormesson-sur-Marne",1
Noiseau,Libane Fresh Foods,ChIJO3jJgAgL5kcRNEIHrxROfJk,"Restaurant Libanais, Traiteur","16 Rue Du Moutier, Sucy-en-Brie",1
Noiseau,Grill Istanbul,ChIJWTVgA5cO5kcRy6J7Mi8_LWE,"Restaurant Turc, Restaurant De Restauration Rapide","85 Rte De Provins, Chennevières-sur-Marne",1
Noiseau,Pitaya Thaï Street Food,ChIJxSWKrLcP5kcR2hTriV-iggk,"Restaurant De Restauration Rapide, Restaurant Halal, Restaurant De Fondue Chinoise, Restaurant Panasiatique, Restaurant, Restaurant D'asie Du Sud-Est, Restaurant Thaïlandais, Restaurant De Wok","Centre Commercial Pince Vent, Chennevières-sur-Marne",1
Noiseau,La Ferme Des Mélèzes,ChIJTzSRUqsO5kcRM6sdChj0ZJg,"Restaurant, Restaurant Barbecue, Magasin De Bière, Fromagerie, Bar À Cocktails, Glacier, Restaurant Du Déjeuner, Restaurant De Crêpes, Bar À Vin","46 Av. Pierre Mendès-France, Noiseau",0
Noiseau,Brasserie De L'hôtel De Ville,ChIJceo7NawO5kcRct7uqRBHp_U,Brasserie,"5 Av. Pierre Mendès-France, Noiseau",0
Noiseau,Trois B,ChIJWzMcU_kL5kcRV_qQ7qIWsqQ,"Restaurant De Hamburgers, Restaurant Américain, Magasin De Bière, Restaurant De Restauration Rapide, Restaurant D'aliments Sains, Glacier, Restaurant Bio, Pâtisserie, Restaurant Végétarien","21 Pl. Sainte-Bernadette, Sucy-en-Brie",0
Noiseau,Les Tilleuls Golf D'ormesson,ChIJsQT-VNwP5kcRQ-irXqH1sW0,"Restaurant, Planificateur D'événements, Lieu De L'événement, Restaurant Français, Salon, Séminaire, Service De Mariage, Lieu De Mariage","20 Chem. Du Belvédère, Ormesson-sur-Marne",0
Noiseau,L’escapade,ChIJq6rmUBwM5kcRj8fYn-c5NSc,"Restaurant, Restaurant Français","227 Av. Olivier D'ormesson, Ormesson-sur-Marne",0
Noiseau,Yama Yen,ChIJO-6tyPUL5kcRHUkA5ahPtI0,"Restaurant Japonais, Restaurant Coréen","12 Rue Guy Moquet, Sucy-en-Brie",NA
Noiseau,Le Bonheur De Chine,ChIJ7QbjbxgM5kcRfooucbTtSpM,"Restaurant Chinois, Restaurant Asiatique, Restaurant Chinois De Livraison, Restaurant","Rue D'amboile, Chennevières-sur-Marne",NA
Noiseau,Shuriken Sushi,ChIJKbn4_6cN5kcR0yNILHkMJzg,Restaurant Japonais,"France, Ormesson-sur-Marne",NA
Noiseau,Hawai Poke Livraison De Poke Bowl,ChIJT6LPm6EP5kcR-r8M4jgH_VE,"Restaurant Hawaïen, Restaurant Asiatique, Restaurant De Livraison","64 Rue Danielle Casanova, Ormesson-sur-Marne",NA
Noiseau,Shimaru,ChIJA4e7lD8P5kcRKW6EChUt-Kg,Restaurant Coréen,"Centre Commercial Pince Vent, Ormesson-sur-Marne",NA
Orly,Aux Délices De Rêve,ChIJwTwFold05kcREz4czPyDzXA,Restaurant Libanais,"21 Rue Du Commerce, Orly",1
Orly,Chez Yoyo,ChIJgwbcMPR05kcRlvLepHg5-vg,Restaurant Turc,"22 Av. Des Martyrs De Châteaubriant, Orly",1
Orly,Dz Restaurant,ChIJ24BBS0h15kcReZt_9NG6P8M,Restaurant Algérien,"1 Rue Jean Jaurès, Orly",1
Orly,Grillade Dorée,ChIJLQeunyRt5kcRcIc8bEbf41I,"Restaurant Halal, Restaurant Barbecue, Restaurant De Kebab Doner","4 Rue Elsa Triolet, Orly",1
Orly,Kebab Deniz,ChIJoQncXPd05kcRi3lsqD49Sh0,"Kebab, Restaurant De Restauration Rapide","67 Av. Adrien Raynal, Orly",1
Orly,Spa Day Event,ChIJpbiC71515kcRqZeKSFoFhk8,"Planificateur D'événements, Restaurant Brunch, Traiteur, Spa, Jardin Du Spa, Programme De Bien-Être","52 Av. Adrien Raynal, Orly",0
Orly,Mcdonald's,ChIJ_ePOk_B05kcRuOh74mPMVM4,"Restaurant De Restauration Rapide, Restaurant Américain, Restaurant De Hamburgers, Restaurant De Pizzas, Restaurant, Sandwicherie","Zac Du Fer À Cheval, Orly",0
Orly,Le Trisk'l,ChIJ2Wg2K2p05kcRjHU1_GDF_-s,Crêperie,"Rue De La Résistance, Thiais",0
Orly,La Cantine Corse,ChIJeykK5up15kcRGFey7yctQPc,"Restaurant De Pizzas, Magasin De Bière, Bistro, Brasserie, Café, Restaurant De Hamburgers, Restaurant Méditerranéen","3 Rue De La Résistance, Thiais",0
Orly,Maison Belhamici,ChIJ26T4xI105kcROyu08Ec7EzY,"Brasserie, Café, Restaurant Français, Hôtel, Agence Immobilière","107 Av. Anatole France, Choisy-le-Roi",0
Orly,Kyoto Bonheur 94310,ChIJVSz0Ufd05kcRRddg9wkY2xs,"Restaurant Japonais, Restaurant De Sushis","2 Av. Des Martyrs De Châteaubriant, Orly",NA
Orly,Fuji Sushi,ChIJVYi08kV05kcR0oGb1k6AS2I,"Restaurant De Sushis, Restaurant Japonais, Restaurant De Livraison, Sushis À Emporter","129 Av. De La Victoire, Orly",NA
Orly,Maison D'aki,ChIJsZ9NW6115kcRBJqjmbrtYQg,"Restaurant Japonais, Restaurant De Fusion Asiatique, Restaurant Japonais Authentique","12 Rue Des Oliviers, Thiais",NA
Orly,Sushi Kyo,ChIJDSVD1Wt05kcRwtZOGUUWl5U,"Restaurant Japonais, Restaurant De Sushis","3 Rue De La Résistance, Thiais",NA
Orly,Restaurant Kin,ChIJ4RomD4p05kcRuFsN83tpWn8,"Restaurant, Restaurant Chinois, Restaurant De Fondue Chinoise, Restaurant De Livraison, Restaurant D'asie Du Sud-Est, Restaurant Thaïlandais","29 Av. Du Maréchal De Lattre De Tassigny, Choisy-le-Roi",NA
Ormesson-sur-Marne,Les Jardins De Majorelle,ChIJw9efLAUM5kcRvoGNLGMfBzc,"Restaurant, Restaurant Marocain","164 Av. Olivier D'ormesson, Ormesson-sur-Marne",1
Ormesson-sur-Marne,L’univers De Serenay,ChIJRdmvcNEN5kcRrzTilYGSpzQ,"Restaurant Brunch, Crêperie, Restaurant De Kebab Doner, Restaurant Halal, Restaurant De Hamburgers, Kebab, Restaurant, Sandwicherie, Salon De Thé, Restaurant Turc","Av. Olivier D'ormesson, Ormesson-sur-Marne",1
Ormesson-sur-Marne,Grill Istanbul,ChIJWTVgA5cO5kcRy6J7Mi8_LWE,"Restaurant Turc, Restaurant De Restauration Rapide","85 Rte De Provins, Chennevières-sur-Marne",1
Ormesson-sur-Marne,Pitaya Thaï Street Food,ChIJxSWKrLcP5kcR2hTriV-iggk,"Restaurant De Restauration Rapide, Restaurant Halal, Restaurant De Fondue Chinoise, Restaurant Panasiatique, Restaurant, Restaurant D'asie Du Sud-Est, Restaurant Thaïlandais, Restaurant De Wok","Centre Commercial Pince Vent, Chennevières-sur-Marne",1
Ormesson-sur-Marne,Libane Fresh Foods,ChIJO3jJgAgL5kcRNEIHrxROfJk,"Restaurant Libanais, Traiteur","16 Rue Du Moutier, Sucy-en-Brie",1
Ormesson-sur-Marne,L’escapade,ChIJq6rmUBwM5kcRj8fYn-c5NSc,"Restaurant, Restaurant Français","227 Av. Olivier D'ormesson, Ormesson-sur-Marne",0
Ormesson-sur-Marne,La Caravelle,ChIJZ7N_hpgO5kcRjE9y4HQbUZE,"Restaurant, Bar, Restaurant Français, Restaurant Portugais","61 Rue Danielle Casanova, Ormesson-sur-Marne",0
Ormesson-sur-Marne,Les Tilleuls Golf D'ormesson,ChIJsQT-VNwP5kcRQ-irXqH1sW0,"Restaurant, Planificateur D'événements, Lieu De L'événement, Restaurant Français, Salon, Séminaire, Service De Mariage, Lieu De Mariage","20 Chem. Du Belvédère, Ormesson-sur-Marne",0
Ormesson-sur-Marne,Golf D'ormesson,ChIJv4cZl7wO5kcRIRphtjfCjxo,"Terrain De Golf, Planificateur D'événements, Lieu De L'événement, Restaurant Français, Club De Golf, Practice De Golf, Instructeur De Golf, Séminaire, Service De Mariage, Lieu De Mariage","1 Chem. Du Belvédère, Ormesson-sur-Marne",0
Ormesson-sur-Marne,Pepe Chicken By Fastgood Cuisine,ChIJEXcOcyMN5kcROk_tmapfwyM,"Restaurant À Emporter, Restaurant Américain, Restaurant De Poulet, Restaurant De Restauration Rapide","71 Rue Du Général De Gaulle, Chennevières-sur-Marne",0
Ormesson-sur-Marne,Le Bonheur De Chine,ChIJ7QbjbxgM5kcRfooucbTtSpM,"Restaurant Chinois, Restaurant Asiatique, Restaurant Chinois De Livraison, Restaurant","Rue D'amboile, Chennevières-sur-Marne",NA
Ormesson-sur-Marne,Shuriken Sushi,ChIJKbn4_6cN5kcR0yNILHkMJzg,Restaurant Japonais,"France, Ormesson-sur-Marne",NA
Ormesson-sur-Marne,Hawai Poke Livraison De Poke Bowl,ChIJT6LPm6EP5kcR-r8M4jgH_VE,"Restaurant Hawaïen, Restaurant Asiatique, Restaurant De Livraison","64 Rue Danielle Casanova, Ormesson-sur-Marne",NA
Ormesson-sur-Marne,Out Fry - Korean Fried Chicken By Taster,ChIJ-3Co92UN5kcRY42wnvxBlMQ,"Restaurant À Emporter, Restaurant Asiatique, Restaurant De Poulet, Restaurant De Restauration Rapide, Restaurant Coréen","71 Rue Du Général De Gaulle, Chennevières-sur-Marne",NA
Ormesson-sur-Marne,Sushi Daily Ormesson,ChIJKf5bPz0P5kcRMDQi9-qaVTs,"Sushis À Emporter, Restaurant De Sushis À Tapis Roulant, Producteur Alimentaire, Restaurant De Sushis","85 Rte De Provins, Ormesson-sur-Marne",NA
Périgny,Grill Istanbul,ChIJT61ODfYJ5kcR1_8Mtkky2pA,"Kebab, Restaurant De Kebab Doner","12 Rue De Brie, Mandres-les-Roses",1
Périgny,Le Val Senart Bar Kebab Pizza,ChIJrQKb1Rzi5UcRyCnyOS5CxFk,"Kebab, Bar Et Grill","10 Rue Des 2 Communes, Quincy-sous-Sénart",1
Périgny,Olmez Restaurant,ChIJaYRwEB7i5UcR6QIuAOHfqpc,"Restaurant Turc, Restaurant De Restauration Rapide, Kebab, Restaurant De Tacos","31 Rue De Brunoy, Quincy-sous-Sénart",1
Périgny,Frères Express 5,ChIJYfysKB_i5UcRLqn_EN8c-wY,Restaurant Turc,"23 Rue De Boissy-Saint-Léger, Quincy-sous-Sénart",1
Périgny,Anatol’s,ChIJheXn3dQJ5kcRxWRr5lUQcvE,"Restaurant De Restauration Rapide, Restaurant Halal","Zac Du, Servon",1
Périgny,La Taverne,ChIJ_alj2agJ5kcRl6hn6UtwY-w,"Brasserie, Restaurant","10 Rue De Brie, Mandres-les-Roses",0
Périgny,La Poésie Des Sens,ChIJofhK0QUK5kcRpWiu1N02VZA,"Traiteur, Restaurant Français, Restaurant Français Moderne, Buffet De Mariage, Service De Mariage","1 Av. Victor Hugo Centre Cial Principal, Épinay-sous-Sénart",0
Périgny,Mcdonald's,ChIJQcRQ-QLi5UcRqWwEEr_RSR0,"Restaurant De Restauration Rapide, Restaurant Américain, Restaurant De Hamburgers, Restaurant De Pizzas, Restaurant, Sandwicherie","Centre Commercial Val D'yerres, C.cial Val D'yerres, Boussy-Saint-Antoine",0
Périgny,"Les Demeures De Varennes, Bw Signature Collection",ChIJpQ1KQ27i5UcRUNEEBBUzeXo,"Restaurant, Centre De Conférence, Spa De Jour, Centre De Remise En Forme, Restaurant Français, Salle De Réception, Hôtel, Lieu De Mariage","Le Vieux Castel, Varennes-Jarcy",0
Périgny,Restaurant L'olivier | Restaurant Bistronomique (91),ChIJRwMkQ2zi5UcRBsfU1OaRC18,"Bistro, Restaurant","14 Rue De La Liberation, Varennes-Jarcy",0
Périgny,Wokasie,ChIJeYhP52Xj5UcRixX2LXJcdrU,"Restaurant Asiatique, Restaurant Japonais","Val D'yerres, Boussy-Saint-Antoine",NA
Périgny,Sushi Master,ChIJo8HCgUHj5UcR6b3j4_Vd1YE,Sushis À Emporter,"Carrefour Val D'yerres Boussy, Boussy-Saint-Antoine",NA
Périgny,Au Canard Laque,ChIJh3k33rfj5UcR3TTSBxZdmlM,Restaurant Chinois,"Centre Commercial Cora Val D’yerres Galerie Marchande, Boussy-Saint-Antoine",NA
Périgny,Sushiman Intermaché Villecresnes,ChIJa4HzwoIL5kcRYErReFTb5iA,"Sushis À Emporter, Restaurant Asiatique, Restaurant De Restauration Rapide, Restaurant À Emporter, Restaurant D'asie Du Sud-Est, Restaurant De Sushis","Intermarché, Villecresnes",NA
Périgny,Shunfa,ChIJ9-ePJg8K5kcRMvEwy6oyaAA,Restaurant Chinois,"94 Rue Du Boisselet, Épinay-sous-Sénart",NA
Le Perreux-sur-Marne,Chez Abda,ChIJbcNBy58N5kcRbg-Ja6GqlmA,"Restaurant Marocain, Restaurant De Couscous, Restaurant Méditerranéen","77 Av. Pierre Brossolette, Le Perreux-sur-Marne",1
Le Perreux-sur-Marne,La Table Marocaine,ChIJU-m_j4cN5kcRdaGbEivs7eg,"Restaurant Marocain, Restaurant","170 Bd D'alsace Lorraine, Le Perreux-sur-Marne",1
Le Perreux-sur-Marne,La Broche - Kebab Berlinois Le Perreux,ChIJ6b64nloN5kcRtUjLFt13-7Y,Restaurant De Kebab Doner,"1 Rue Denfert Rochereau, Le Perreux-sur-Marne",1
Le Perreux-sur-Marne,Anacoco,ChIJOce8oDsN5kcRBB-YekTAPEY,"Restaurant Américain, Poulet Frit À Emporter, Restaurant Halal, Restaurant De Hamburgers, Restaurant","98 Bd D'alsace Lorraine, Le Perreux-sur-Marne",1
Le Perreux-sur-Marne,Le Magnifique,ChIJ4d4wTJYN5kcRfN1KkIOAv3I,"Kebab, Restaurant De Restauration Rapide, Restaurant","230 Av. Pierre Brossolette, Le Perreux-sur-Marne",1
Le Perreux-sur-Marne,Les Magnolias,ChIJLdEnAXUN5kcRfSFOZc-Y5ZU,"Restaurant Gastronomique, Lieu De L'événement, Restaurant Français, Séminaire, Lieu De Mariage","Le, Le Perreux-sur-Marne",0
Le Perreux-sur-Marne,L'ardoise,ChIJa5U4FHQN5kcRNORCDOM1kwk,"Restaurant, Restaurant Français","22 Bd De La Liberté, Le Perreux-sur-Marne",0
Le Perreux-sur-Marne,Pourquoi Pas?,ChIJKToEHX8N5kcRRDppfivWnaA,Restaurant Français,"52 Bd D'alsace Lorraine, Le Perreux-sur-Marne",0
Le Perreux-sur-Marne,Jeanne Et Jacques,ChIJHWDzrHYN5kcR7L1Dr20l_0I,"Restaurant, Bar, Restaurant Européen, Restaurant Français, Restaurant De Hamburgers, Restaurant Irlandais, Pub, Bar Sportif","12 Pl. Robert Belvaux, Le Perreux-sur-Marne",0
Le Perreux-sur-Marne,Le Blue-Marning,ChIJ2Rudt6EN5kcRoI9pzsxV5ng,"Restaurant, Bar, Restaurant Français","44 Quai De L'artois, Le Perreux-sur-Marne",0
Le Perreux-sur-Marne,Sushitop,ChIJY1Iitn4N5kcRPfGKNuxVHjU,Restaurant Japonais,"226 Av. Du Général De Gaulle, Le Perreux-sur-Marne",NA
Le Perreux-sur-Marne,Bo Sushi,ChIJf3hAM50N5kcRGh8FAkoXrm0,"Restaurant De Sushis, Restaurant Japonais, Restaurant","71 Av. Ledru Rollin, Le Perreux-sur-Marne",NA
Le Perreux-sur-Marne,Radha,ChIJ4TvfwHYN5kcRzTHiR29Ofc0,Restaurant Indien,"18 Bis Av. Ledru Rollin, Le Perreux-sur-Marne",NA
Le Perreux-sur-Marne,Siki Sushi,ChIJUVdBEXQN5kcRilp6MnfQQBY,"Restaurant Japonais, Restaurant Asiatique, Restaurant De Sushis","20 Bd De La Liberté, Le Perreux-sur-Marne",NA
Le Perreux-sur-Marne,Resto Sai,ChIJ8eM_8H4N5kcRNxCTY311dnM,"Restaurant, Magasin De Bière, Restaurant Sans Gluten, Restaurant Indien, Restaurant Du Déjeuner, Restaurant Végétalien, Restaurant Végétarien, Bar À Vin","59b Bd D'alsace Lorraine, Le Perreux-sur-Marne",NA
Le Plessis-Trévise,Restaurant Istanbul,ChIJ3bVYvfcO5kcREyqQOYHAqVw,Restaurant Turc,"18b Av. Du Général De Gaulle, Le Plessis-Trévise",1
Le Plessis-Trévise,L'etoile Du Maroc Restaurant Marocain Pontault Combault,ChIJkzEizhMP5kcRFugp89BIjp0,"Restaurant, Restaurant De Couscous, Restaurant Marocain","16 Av. Charles Rouxel, Pontault-Combault",1
Le Plessis-Trévise,Pizza Hotimes Pontault Combault,ChIJ8XNfyhMP5kcRXj8AZWO0dsQ,"Restaurant De Pizzas, Restaurant De Restauration Rapide, Restaurant Halal, Restaurant Italien, Restaurant De Livraison, Restaurant À Emporter, Livraison De Pizzas, Pizza À Emporter, Magasin De Salades, Sandwicherie","13 Av. Charles Rouxel, Pontault-Combault",1
Le Plessis-Trévise,Turkuaz,ChIJN2Qtu6gP5kcRrCb9xU9-R0c,Kebab,"17 Av. Charles Rouxel, Pontault-Combault",1
Le Plessis-Trévise,Pitaya Thaï Street Food,ChIJxSWKrLcP5kcR2hTriV-iggk,"Restaurant De Restauration Rapide, Restaurant Halal, Restaurant De Fondue Chinoise, Restaurant Panasiatique, Restaurant, Restaurant D'asie Du Sud-Est, Restaurant Thaïlandais, Restaurant De Wok","Centre Commercial Pince Vent, Chennevières-sur-Marne",1
Le Plessis-Trévise,Les Oliviers Le Plessis Trévise,ChIJVVXZTPEO5kcRO4G0-qCH23c,"Restaurant Italien, Bistro, Traiteur, Bar À Cocktails, Charcuterie, Restaurant Gastronomique, Restaurant Méditerranéen, Restaurant Bio, Restaurant De Pizzas, Restaurant","157 Av. Maurice Berteaux, Le Plessis-Trévise",0
