respondent.commune,business_name,place_id,fr_categories,business_address,treatment_arm
Aix-en-Provence,Le Mogador,ChIJu1I2JIeNyRIRtCOyvHiSDes,"Restaurant Marocain, Restaurant Asiatique, Restaurant Méditerranéen","4 Av. Fortuné Ferrini, Aix-en-Provence",1
Aix-en-Provence,Chamas Tacos Aix En Provence Couronne,ChIJIZAnfOyNyRIRA-gOTAcTY6c,"Restaurant De Restauration Rapide, Restaurant Halal, Restaurant, Restaurant De Tacos","17 Rue De La Couronne, Aix-en-Provence",1
Aix-en-Provence,La Casa,ChIJPYgA1vONyRIRh_gFPcNLRX0,"Restaurant De Pizzas, Brasserie, Kebab, Livraison De Repas, Livraison De Pizzas, Pizza À Emporter, Restaurant, Magasin De Salades, Sandwicherie, Restaurant De Tacos","67 Av. Henri Mauriat, Aix-en-Provence",1
Aix-en-Provence,Tita - Restaurant Aix En Provence,ChIJeQWaCA3zyRIRT9NFxc4STe8,"Restaurant, Traiteur, Restaurant De Falafels, Restaurant Familial, Restaurant De Restauration Rapide, Restaurant Libanais, Restaurant À Emporter, Restaurant Méditerranéen, Restaurant De Petites Assiettes, Restaurant Végétarien","11 Rue Des Bernardines, Aix-en-Provence",1
Aix-en-Provence,Au P'tit Tajine,ChIJZ0ld4qKNyRIRnh5-K_SRIgM,"Restaurant, Restaurant Méditerranéen, Restaurant Marocain","4 Rue De La Treille, Aix-en-Provence",1
Aix-en-Provence,L'incontournable,ChIJpevxSbyNyRIRs3ZYttT4-dQ,"Restaurant Français, Restaurant Méditerranéen","Place Des 3 Ormeaux, Aix-en-Provence",0
Aix-en-Provence,L & G,ChIJ0044TeiSyRIRWyHmSvSX69o,"Restaurant De Pizzas, Restaurant De Cuisine Campagnarde, Restaurant Français, Restaurant Italien","48 Route Nationale 8, Aix-en-Provence",0
Aix-en-Provence,"Château De La Pioline, Restaurant Gastronomique À Aix-En-Provence",ChIJB7wcyaeSyRIRSEIH-wINotI,"Restaurant Haut De Gamme Français, Lieu De L'événement, Restaurant Français, Restaurant Méditerranéen, Piscine, Lieu De Mariage","260 Rue Guillaume Du Vair Pole, Aix-en-Provence",0
Aix-en-Provence,Brasserie Du Pont De L'arc,ChIJ5eqEMYeNyRIR-gU62KBOfcc,"Brasserie, Bar","61 Av. Fortuné Ferrini, Aix-en-Provence",0
Aix-en-Provence,Les Fils À Maman Aix En Provence,ChIJ1T12OL2NyRIRPe1WPjtrnaA,"Restaurant Français, Restaurant Brunch, Bar À Cocktails, Restaurant De Cuisine Campagnarde, Restaurant Éclectique, Livraison De Repas, Restaurant À Emporter, Restaurant","42 Rue De La Verrerie, Aix-en-Provence",0
Aix-en-Provence,Le Yen Koï,ChIJASDi_peNyRIRhjt6UujTxq4,Restaurant Japonais,"4 Rue Paul Doumer, Aix-en-Provence",NA
Aix-en-Provence,Chungchun Ricedog Coréen Aix-En-Provence,ChIJH0LWmjKNyRIR5mFqkX8Tmok,Restaurant Coréen,"25 Rue De La Verrerie, Aix-en-Provence",NA
Aix-en-Provence,La Mado,ChIJi8_f2b2NyRIRz5gYUSyvRjE,"Restaurant Français, Restaurant De Fruits De Mer, Restaurant De Sushis","Restaurant La Mado, Aix-en-Provence",NA
Aix-en-Provence,Oh Restaurant,ChIJJbdDiLyNyRIRcpEpE8TvMkU,"Restaurant Japonais, Restaurant Coréen","14 Rue Félibre Gaut, Aix-en-Provence",NA
Aix-en-Provence,Long Bún,ChIJq1s1kEaTyRIRo4DMHCceEnI,"Restaurant Vietnamien, Traiteur","8 Rte De Marseille, Aix-en-Provence",NA
Allauch,Snack Chez Chou’s,ChIJjZCdRACXyRIRL6YJIYL3mzc,"Snack-Bar, Restaurant De Restauration Rapide, Restaurant, Restaurant De Tacos","23 Chem. Notre Dame Des Anges, Allauch",1
Allauch,Tom&Sy,ChIJce0QTVe_yRIR_msDooN1_nc,"Snack-Bar, Livraison De Repas, Magasin De Salades, Restaurant De Tacos","Les Terrasses Du Mail, Plan-de-Cuques",1
Allauch,La Petite Pause,ChIJRS2qhhm-yRIRpfJiM13FFYc,Kebab,"31 Av. Frédéric Chevillon, Plan-de-Cuques",1
Allauch,Snack Restaurant Les Jardins D'amelia,ChIJUZiXX0e-yRIRZ6AL65_yi6A,"Snack-Bar, Restaurant Tunisien","25 Grand Rue La Croix Rouge, Marseille 13e Arrondissement",1
Allauch,Big M,ChIJyV0CSlm_yRIRqQDrnuRu8ys,"Restaurant De Hamburgers, Restaurant Halal","118 Av. Des Poilus, Marseille 13e Arrondissement",1
Allauch,Restaurant Iod’in,ChIJz_2b-wu-yRIRws5siMH6CRc,"Restaurant Français, Traiteur, Bar À Cocktails, Restaurant Haut De Gamme Français, Restaurant Français Moderne, Restaurant, Bar À Tapas","602 Av. Du 7ème Régiment Du Tirailleur Algériens, Allauch",0
Allauch,Le Colysee,ChIJt4Ce8RmWyRIRNlkY7WaLC2o,"Restaurant, Bar, Restaurant Français","Rue Etienne Cucca, Allauch",0
Allauch,Restaurant Malou,ChIJyf0B2uC9yRIRkPrSq5soSXA,"Restaurant Français, Restaurant De Pizzas","4 Rue Fernand Rambert, Allauch",0
Allauch,La Quinta Table Provençale - Restaurant Allauch,ChIJqRi97Q-WyRIRGsRt1yXdB7I,"Restaurant Provençal, Restaurant Français, Restaurant Méditerranéen","92 Rue Des Perdreaux, Allauch",0
Allauch,Le Salon Provencal,ChIJnfpc2OC9yRIRkttFlJ2FzMM,"Restaurant, Brasserie","1 Pl. Benjamin Chappe, Allauch",0
Allauch,Baonhi.b,ChIJR9eUWG6_yRIR2T2Uj8YCfaI,Restaurant Vietnamien,"55 Av. Paul Sirvent, Plan-de-Cuques",NA
Allauch,Box N Thai,ChIJzc2MzuK_yRIRKfwqeP0Lg20,Restaurant Asiatique,"55 Av. Paul Sirvent, Plan-de-Cuques",NA
Allauch,Wok N'shop,ChIJzw7ji3e_yRIRw-9-zna4HdQ,"Restaurant Asiatique, Restaurant Japonais","32 Av. Paul Sirvent, Plan-de-Cuques",NA
Allauch,Hai Dong,ChIJpQIE8xy-yRIRE_l3e-87UP4,"Restaurant Chinois, Restaurant Asiatique, Restaurant Italien, Restaurant Vietnamien","10 Av. Du Général Leclerc, Plan-de-Cuques",NA
Allauch,Sushi Art,ChIJNXjlwfG_yRIRJwu6NiZdN2M,Restaurant De Sushis,"9 Av. Frédéric Chevillon, Plan-de-Cuques",NA
Alleins,Chez Annie,ChIJB9HtG5YDyhIROx_vaUcY3vg,"Restaurant, Restaurant De Restauration Rapide, Restaurant Halal, Livraison De Repas, Restaurant À Emporter","Av. De Craponne, Mallemort",1
Alleins,Monsieur Falafels,ChIJiy5I15X5yRIRN2OdYF3lPz0,"Traiteur, Restaurant Syrien","Marché De Dimanche, Pélissanne",1
Alleins,Regal Tacos & Asian Delices,ChIJfznZ4y75yRIRKt4P7gjkhjA,"Restaurant De Tacos, Restaurant De Restauration Rapide","9 C, Pélissanne",1
Alleins,Pelifood By Szulette Snack Tacos Burger Et Bonbons,ChIJeZaXfi75yRIR0L8hrUxvRBM,"Restaurant De Restauration Rapide, Restaurant Halal, Restaurant De Hamburgers, Restaurant De Tacos","34 Pl. Cabardel, Pélissanne",1
Alleins,Alhambraofk,ChIJm0bD-sX_tRIR48ooNX77sWo,"Kebab, Restaurant De Restauration Rapide","27 Rue Raoul Jauffret, Eyguières",1
Alleins,Chez Yvonne,ChIJ1U-WRzACyhIR2XJO2d52V2c,"Brasserie, Bar, Restaurant De Pizzas","Av. Mal Leclerc De Hautecloque, Alleins",0
Alleins,Le Repaire,ChIJbycwdWsCyhIRTFJwNXjfAwE,"Crêperie, Restaurant Français, Glacier, Restaurant","76 Chemin De Très Moulins, Vernègues",0
Alleins,Bar L'embuscade,ChIJxYryT6IDyhIRbr0vkuHwpz8,"Restaurant, Brasserie, Crêperie, Restaurant De Coupes Glacées, Salon De Thé","67 Pl. Raoul Coustet, Mallemort",0
Alleins,Café De La Poste,ChIJzSihUKIDyhIRgyxGIAK7YyU,"Restaurant, Bar, Café, Restaurant Français","1 Av. Des Frères Roqueplan, Mallemort",0
Alleins,Paus'gourmande Chez Laurence,ChIJMV6NmdsDyhIRux8yZeByBHA,"Crêperie, Glacier, Salon De Thé","27 Av. Joliot Curie, Mallemort",0
Alleins,Indochine - Restaurant À Mallemort,ChIJ9V5Eh6YDyhIRkQf1ZhUCmHU,"Restaurant Vietnamien, Restaurant De Fondue Chinoise, Restaurant Mandarin","Av. Des Frères Roqueplan, Mallemort",NA
Alleins,Tama Sushis,ChIJuwDPkKEDyhIRxBAHQvx73Og,"Sushis À Emporter, Traiteur, Service D'expédition, Buffet De Mariage","127 Cr Victor Hugo, Mallemort",NA
Alleins,Kungfu Food,ChIJqcTmUGAByhIR-gMzcrGhRis,Restaurant Chinois,"Rue Des Acacias, Lamanon",NA
Alleins,Sushi’c,ChIJnXCV6IMFyhIR2ZMNehbQQ9o,"Restaurant De Sushis, Restaurant Japonais","135 Rue Roger Perin, Mérindol",NA
Alleins,Seiko Sushi,ChIJQVvtK34ByhIRbVx9yxdFGUU,"Restaurant Japonais, Restaurant Panasiatique, Restaurant Vietnamien","8 Av. Gabriel Péri, Sénas",NA
Arles,Goûts Orientaux: Cuisine Marocaine,ChIJSyXPwu13thIRvSi-HWiBkGg,Restaurant Marocain,"10 Rue Du 4 Septembre, Arles",1
Arles,L'entrevue,ChIJrRt2VBV2thIRxgEYW7kEmXo,"Restaurant, Bar, Bistro, Brasserie, Restaurant Français, Restaurant Marocain","Place Nina Berberova, Arles",1
Arles,Volubilis-Arles,ChIJY6g19gZ3thIR-68PWFOaSYs,"Restaurant Marocain, Traiteur","53 Rue Voltaire, Arles",1
Arles,𝗰𝗼𝘂𝘀𝗰𝗼𝘂𝘀 𝘇𝗶𝗱𝗮𝗻𝗲,ChIJZYvHs6jftRIRw-m_D1GH1As,Restaurant Tunisien,"2 Chem. De Montauban, Fontvieille",1
Arles,Chez Galinette Snack Tacos Burger Kebab,ChIJ6bhjHKPXtRIRL0KmfJ-EBd0,Snack-Bar,"225 Rue Des Amazones, Bellegarde",1
Arles,La Gueule Du Loup,ChIJU8XPMGt2thIRtjJPcNUIEGM,"Restaurant Français, Restaurant Français Moderne","39 Rue Des Arènes, Arles",0
Arles,L'escaladou,ChIJ48Mhkmx2thIRyzRUy8A-xAM,"Restaurant Provençal, Bar, Restaurant Français, Restaurant Méditerranéen","23 Rue Prte De Laure 13200, Arles",0
Arles,Le Q.g,ChIJ6eRPbRN2thIRQcKtoC346tA,"Restaurant, Restaurant Français, Restaurant Méditerranéen","65 Rue Amédée Pichot, Arles",0
Arles,Le Seize,ChIJSxIlDyl1thIRVOt3q17cg9Y,Restaurant Haut De Gamme Français,"15 Rue Des Porcelets, Arles",0
Arles,Restaurant Le Plaza-La Paillotte,ChIJB1uD0mp2thIRckuDiPx_ijs,"Restaurant Français, Restaurant Méditerranéen","28 Rue Du Dr Fanton, Arles",0
Arles,Ô Tuktuk De Jade,ChIJq_lljSrftRIRDiLDZDu9iLw,Restaurant Panasiatique,"Rte De Tarascon, Fontvieille",NA
Arles,Ming Chi,ChIJiyXPVsnftRIRTbjwJHXkSo4,"Restaurant Chinois, Restaurant Indien, Restaurant Thaïlandais","16 Rte Du N, Fontvieille",NA
Arles,Sushiman Super U Saint-Martin-De-Crau,ChIJiSlmfNoLthIR-htBpfrG3pg,"Sushis À Emporter, Épicerie Asiatique, Restaurant De Restauration Rapide, Restaurant De Fondue Chinoise, Restaurant Japonais, Restaurant À Emporter, Restaurant Panasiatique, Restaurant De Sushis","Za Du Salat, Saint-Martin-de-Crau",NA
Arles,Padthaï-Ya,ChIJXwePgVwLthIRhAyxqrROXj8,Restaurant Asiatique,"1 Rue Isaac Newton, Saint-Martin-de-Crau",NA
Arles,Le Saïgon,ChIJXV6HLXvctRIRio3LFGNJfZY,"Restaurant Vietnamien, Bar, Restaurant","2 Av. De La République, Tarascon",NA
Aubagne,Restaurant Boucherie L'alpine,ChIJ6YLHeZC8yRIReCoeigBbaE8,Restaurant Marocain,"Res De Chaussé 14, Aubagne",1
Aubagne,Rôtisserie-Snack De L'étoile,ChIJx9lyAT-jyRIRgxnXjoFvQtU,"Restaurant, Restaurant Halal","55 Av. Général De Gaulle, Roquevaire",1
Aubagne,Delicedelanight Aubagne,ChIJQ2tPR_CjyRIRvpAaxpdv_xo,Restaurant Halal,"28 Av. Général De Gaulle, Roquevaire",1
Aubagne,Les Salons De Vero,ChIJl-oqv_KjyRIRU_PCXV_ixjM,"Traiteur, Salle De Banquet, Magasin De Bière, Lieu De L'événement, Restaurant Français, Restaurant Halal, Organisateur De Mariage, Bar À Vin","545 Av. Du Col-De L'ange, Gémenos",1
Aubagne,Le Grim'o,ChIJQ5TPwCK8yRIRRyBC1IA4prI,"Restaurant Arménien, Restaurant Libanais, Restaurant Méditerranéen, Restaurant","65 A Rue De L'audience, Marseille 11e Arrondissement",1
Aubagne,Les Enfants Gâtés,ChIJaU1dnZG8yRIRyETUaQyPMYI,"Restaurant, Bar Et Grill, Bar À Cocktails, Restaurant Dansant, Planificateur D'événements, Lieu De L'événement, Bar De Musique Live, Buffet De Mariage","Camp Major, Aubagne",0
Aubagne,Villa Estello,ChIJ6dcNObG8yRIRzNA6fcfVgEM,"Restaurant, Restaurant Français, Restaurant Haut De Gamme Français","635 D8n Quartier La Tourtelle, Aubagne",0
Aubagne,Restaurant Le Saint Ange,ChIJwfC4II-8yRIR3vOK69vCwoI,"Restaurant, Restaurant Français, Restaurant Méditerranéen","10 Chem. De L'aumône Vieille, Aubagne",0
Aubagne,Restaurant Chez Michel,ChIJh2bkgLy8yRIRzk3ysvjFKqQ,"Restaurant, Restaurant Français, Restaurant Méditerranéen","D8n, Aubagne",0
Aubagne,Le Napollon,ChIJZ1W_sd2iyRIR9ygMpeICKWM,"Restaurant, Bar, Restaurant Familial, Restaurant Français","1275 Rte De Napollon, Aubagne",0
Aubagne,Restaurant Tan A,ChIJlw-dhpC8yRIR6h01jN8Y4XY,"Restaurant Vietnamien, Restaurant De Fondue Chinoise","1 Av. Alice, Aubagne",NA
Aubagne,Viet Xua,ChIJ-4DIoH28yRIR1Q-iEcz3LRA,"Restaurant Vietnamien, Restaurant, Restaurant Thaïlandais","176 Bd Voltaire, La Penne-sur-Huveaune",NA
Aubagne,Luzumaki Artisan Sushi,ChIJeeCXpTejyRIRmner39BY7Og,"Restaurant De Sushis, Restaurant Japonais","Za Les Barles, 13470 Carnoux-En-Provence, Carnoux-en-Provence",NA
Aubagne,Au Bouddha,ChIJ_0XRTo6jyRIRU42tfKo-GKY,"Restaurant De Fondue Chinoise, Restaurant Chinois, Restaurant De Sushis, Restaurant Vietnamien, Restaurant De Wok","390 Av. De Fontfrège, Gémenos",NA
Aubagne,Tan Viet,ChIJ-09Ww7qkyRIR_NF4b4uuY2I,"Restaurant Vietnamien, Bar, Restaurant Chinois, Restaurant À Emporter, Restaurant","1 Rue De La Frago, Carnoux-en-Provence",NA
Aureille,Mouries Tacos & Hamburgers ( Livraison Alpilles ),ChIJP8BoqBfjtRIRWhK--AEv4Zo,"Restaurant De Hamburgers, Restaurant De Restauration Rapide, Friterie, Restaurant À Emporter, Livraison De Pizzas, Restaurant De Pizzas, Pizza À Emporter, Restaurant, Sandwicherie, Restaurant De Tacos","13890 Mouriès, Mouriès",1
Aureille,Alhambraofk,ChIJm0bD-sX_tRIR48ooNX77sWo,"Kebab, Restaurant De Restauration Rapide","27 Rue Raoul Jauffret, Eyguières",1
Aureille,Kebab Y Locutorio,ChIJr4WjJGMJthIR3o8f9iD-lzg,Kebab,"2 Rue Faraman, Saint-Martin-de-Crau",1
Aureille,Kebab,ChIJvVu9tuYJthIRoUr_spOYy4w,Restaurant,"17 Av. César Bernaudon, Saint-Martin-de-Crau",1
Aureille,G La Dalle Miramas,ChIJKdhfAkoDthIRXBcIv_ADiDY,Restaurant Halal,"Av. Du 8 Mai 1945, Miramas",1
Aureille,La Table Des Alpilles,ChIJjf_q9bz9tRIR375j4ZkRZ_A,Restaurant Français,"10 Rue De L'armistice, Aureille",0
Aureille,Hotel La Bastide D'eygalières,ChIJq9TsHQz8tRIRa_vxM77hwfU,"Restaurant, Restaurant Français, Hôtel","765 Chem. De Pestelade, Eygalières",0
Aureille,Bistrot L'aubergine,ChIJ-ez4AYr7tRIRW_2iuAY2xxU,"Restaurant, Bistro, Restaurant Français","34 Av. Jean Jaurès, Eygalières",0
Aureille,Maison Hache,ChIJG_ltMuf9tRIRifqMuVKyP8Y,"Restaurant Haut De Gamme Français, Chambres D'hôtes","30 Rue De La République, Eygalières",0
Aureille,Sous Les Micocouliers,ChIJLcJGHYr7tRIRxMxnZbs4mbo,Restaurant Français,"Trav. Montfort, Eygalières",0
Aureille,Song Long,ChIJM6fhmZ_itRIRbXhD7JTfm6w,Restaurant Vietnamien,"11 Av. Pasteur, Mouriès",NA
Aureille,Seiko Sushi,ChIJQVvtK34ByhIRbVx9yxdFGUU,"Restaurant Japonais, Restaurant Panasiatique, Restaurant Vietnamien","8 Av. Gabriel Péri, Sénas",NA
Aureille,Sushiman Intermarché Orgon,ChIJb8q1gRv5tRIR-IQ48EYXpR4,"Restaurant Japonais, Restaurant Asiatique, Restaurant De Restauration Rapide, Restaurant À Emporter, Restaurant D'asie Du Sud-Est, Restaurant De Sushis","Av. De La Victoire, Orgon",NA
Aureille,Kungfu Food,ChIJqcTmUGAByhIR-gMzcrGhRis,Restaurant Chinois,"Rue Des Acacias, Lamanon",NA
Aureille,Le Chiangmai,ChIJd5FMPmEJthIRfQu8UGiq19w,Restaurant Asiatique,"20bis Rue Du Soleil, Saint-Martin-de-Crau",NA
Auriol,Pequeno,ChIJXWpEF1SZyRIRttBjYFWFHlM,Restaurant De Tacos,"23 Rue Grande, Auriol",1
Auriol,Pizza Gaby,ChIJsZjasq-ZyRIRUhBTfChn5dQ,"Livraison De Pizzas, Kebab, Restaurant Mexicain, Restaurant De Pizzas, Sandwicherie","13 Imp. De Bigaron, La Bouilladisse",1
Auriol,Delicedelanight Aubagne,ChIJQ2tPR_CjyRIRvpAaxpdv_xo,Restaurant Halal,"28 Av. Général De Gaulle, Roquevaire",1
Auriol,Rôtisserie-Snack De L'étoile,ChIJx9lyAT-jyRIRgxnXjoFvQtU,"Restaurant, Restaurant Halal","55 Av. Général De Gaulle, Roquevaire",1
Auriol,Alm Traiteur,ChIJ18J2HYCdyRIRAtiKiD9gfzE,"Traiteur, Pâtisserie, Restaurant Français, Restaurant Sans Gluten, Restaurant Halal, Restaurant Casher, Restaurant Méditerranéen, Pâtisserie, Restaurant Végétalien","15 Bd Etienne Boyer, Trets",1
Auriol,Café Du Marché Auriol,ChIJz3wddcaYyRIR02befALMO7E,"Restaurant, Restaurant Français","12 Cr Du 4 Septembre, Auriol",0
Auriol,Bistrot Cocotte,ChIJMSWD0xyZyRIRNZceEhPJGJM,"Restaurant, Magasin De Bière, Restaurant Français, Restaurant Haut De Gamme Français, Restaurant D'aliments Sains, Restaurant Du Déjeuner, Restaurant Traditionnel, Bar À Vin","14 Rue Grande, Auriol",0
Auriol,Restaurant L'inattendu By L'occitan,ChIJw8xsvTKZyRIRVGM7m0SC9Ng,Restaurant Français,"12 Rn 96, La Destrousse",0
Auriol,L'entre Terre Et Mer,ChIJ4UmQcPeYyRIRYcSaSCAsr1s,"Restaurant, Restaurant Français, Restaurant Méditerranéen","133 Av. De Solobie, La Destrousse",0
Auriol,Bistro Du Cours,ChIJY-rQEIeYyRIRjnsC93ZFdaQ,"Bistro, Bar, Restaurant","22 Rue Sainte-Anne, Roquevaire",0
Auriol,Restaurant Auriol - Phi-Long Sushi,ChIJd-K8ncaYyRIRLcDDGjreVBA,"Restaurant Vietnamien, Restaurant De Fondue Chinoise, Restaurant Japonais, Restaurant Mandarin, Livraison De Repas, Restaurant De Sushis, Restaurant De Wok","17 Rue Grande, Auriol",NA
Auriol,Le Lôtus D’asie,ChIJyY7LSc-YyRIRzbcVNS9sUzA,"Restaurant De Fondue Chinoise, Restaurant Japonais, Restaurant Vietnamien","9 Rue Du Clos, Auriol",NA
Auriol,Cisushis,ChIJa7AJwiKZyRIRNbX4sRUwHu8,Sushis À Emporter,"1 Rue Grande, Auriol",NA
Auriol,Suandshi Auriol,ChIJXcN6v_efyRIR-w7ydVdnOdQ,Restaurant De Sushis,"239 Av. Du 19 Mars 1962, Auriol",NA
Auriol,Au Riz Ol,ChIJM3hGBYKfyRIRj79WWTmhhCU,Restaurant Vietnamien,"Z.a Du Pujol Centre Commercial Du, Auriol",NA
Aurons,Monsieur Falafels,ChIJiy5I15X5yRIRN2OdYF3lPz0,"Traiteur, Restaurant Syrien","Marché De Dimanche, Pélissanne",1
Aurons,Regal Tacos & Asian Delices,ChIJfznZ4y75yRIRKt4P7gjkhjA,"Restaurant De Tacos, Restaurant De Restauration Rapide","9 C, Pélissanne",1
Aurons,Pelifood By Szulette Snack Tacos Burger Et Bonbons,ChIJeZaXfi75yRIR0L8hrUxvRBM,"Restaurant De Restauration Rapide, Restaurant Halal, Restaurant De Hamburgers, Restaurant De Tacos","34 Pl. Cabardel, Pélissanne",1
Aurons,Chez Annie,ChIJB9HtG5YDyhIROx_vaUcY3vg,"Restaurant, Restaurant De Restauration Rapide, Restaurant Halal, Livraison De Repas, Restaurant À Emporter","Av. De Craponne, Mallemort",1
Aurons,Alhambraofk,ChIJm0bD-sX_tRIR48ooNX77sWo,"Kebab, Restaurant De Restauration Rapide","27 Rue Raoul Jauffret, Eyguières",1
Aurons,Le Repaire,ChIJbycwdWsCyhIRTFJwNXjfAwE,"Crêperie, Restaurant Français, Glacier, Restaurant","76 Chemin De Très Moulins, Vernègues",0
Aurons,Restaurant Domaine De La Reynaude,ChIJpUKVjDEAyhIRgYA6s4B3d0Y,Restaurant Français,"Domaine De La Reynaude, Aurons",0
Aurons,Le Moulin À Poivre,ChIJ3wPaFi_5yRIRARBVLFW0jjQ,"Restaurant Français, Restaurant Méditerranéen","3 Rue Eugène Pelletan, Pélissanne",0
Aurons,La Table De Manon,ChIJQ5hP-CT5yRIRP9JjIiJHnBw,"Restaurant, Bar, Brasserie, Restaurant Français","Av. Pasteur, Pélissanne",0
Aurons,Café Restaurant Le Provençal,ChIJW2Of8i75yRIR3xy-L-zDUN4,"Restaurant, Bar, Restaurant Français","22 Pl. Cabardel, Pélissanne",0
Aurons,Tokyo Pélissanne,ChIJqXoDonX5yRIR2Kj-1XYOdX4,"Restaurant De Sushis, Restaurant Japonais, Livraison De Repas, Sushis À Emporter","22 Place Pisavis, Pélissanne",NA
Aurons,Restaurant Indochine Pélissanne,ChIJs5cT6yL5yRIRIrgrtE_TQ3c,Restaurant Vietnamien,"8 Cr Victor Hugo, Pélissanne",NA
Aurons,Kungfu Food,ChIJqcTmUGAByhIR-gMzcrGhRis,Restaurant Chinois,"Rue Des Acacias, Lamanon",NA
Aurons,Indochine - Restaurant À Mallemort,ChIJ9V5Eh6YDyhIRkQf1ZhUCmHU,"Restaurant Vietnamien, Restaurant De Fondue Chinoise, Restaurant Mandarin","Av. Des Frères Roqueplan, Mallemort",NA
Aurons,Tama Sushis,ChIJuwDPkKEDyhIRxBAHQvx73Og,"Sushis À Emporter, Traiteur, Service D'expédition, Buffet De Mariage","127 Cr Victor Hugo, Mallemort",NA
La Barben,Monsieur Falafels,ChIJiy5I15X5yRIRN2OdYF3lPz0,"Traiteur, Restaurant Syrien","Marché De Dimanche, Pélissanne",1
La Barben,Regal Tacos & Asian Delices,ChIJfznZ4y75yRIRKt4P7gjkhjA,"Restaurant De Tacos, Restaurant De Restauration Rapide","9 C, Pélissanne",1
La Barben,Pelifood By Szulette Snack Tacos Burger Et Bonbons,ChIJeZaXfi75yRIR0L8hrUxvRBM,"Restaurant De Restauration Rapide, Restaurant Halal, Restaurant De Hamburgers, Restaurant De Tacos","34 Pl. Cabardel, Pélissanne",1
La Barben,Chez Annie,ChIJB9HtG5YDyhIROx_vaUcY3vg,"Restaurant, Restaurant De Restauration Rapide, Restaurant Halal, Livraison De Repas, Restaurant À Emporter","Av. De Craponne, Mallemort",1
La Barben,Los Amigos,ChIJjT73rODxyRIR_U0rez5-S20,"Restaurant, Restaurant Américain, Magasin De Bière, Pâtisserie, Restaurant Sans Gluten, Restaurant Halal, Restaurant Mexicain, Restaurant Végétalien, Restaurant Végétarien","214 Rte De L'étang, Velaux",1
La Barben,La Table De Manon,ChIJQ5hP-CT5yRIRP9JjIiJHnBw,"Restaurant, Bar, Brasserie, Restaurant Français","Av. Pasteur, Pélissanne",0
La Barben,Le Moulin À Poivre,ChIJ3wPaFi_5yRIRARBVLFW0jjQ,"Restaurant Français, Restaurant Méditerranéen","3 Rue Eugène Pelletan, Pélissanne",0
La Barben,Café Restaurant Le Provençal,ChIJW2Of8i75yRIR3xy-L-zDUN4,"Restaurant, Bar, Restaurant Français","22 Pl. Cabardel, Pélissanne",0
La Barben,Fluffy,ChIJ0946rGD5yRIRhir6cTWbTxI,"Crêperie, Pâtisserie","18 Pl. Cabardel, Pélissanne",0
La Barben,Le Vincennes,ChIJubWKEuD-yRIRF38sJNrtFvg,"Restaurant, Restaurant Français","Rte De Pelissanne, Salon-de-Provence",0
La Barben,Restaurant Indochine Pélissanne,ChIJs5cT6yL5yRIRIrgrtE_TQ3c,Restaurant Vietnamien,"8 Cr Victor Hugo, Pélissanne",NA
La Barben,Tokyo Pélissanne,ChIJqXoDonX5yRIR2Kj-1XYOdX4,"Restaurant De Sushis, Restaurant Japonais, Livraison De Repas, Sushis À Emporter","22 Place Pisavis, Pélissanne",NA
La Barben,Restaurant On Aime,ChIJO0msCR37yRIRAJs3hKQHWuM,"Restaurant Vietnamien, Restaurant Thaïlandais","1455 Rn 113 D113, La Fare-les-Oliviers",NA
La Barben,Bahn Teo,ChIJ6fO8xY_2yRIR5SzAeL9rD3w,"Restaurant Vietnamien, Restaurant De Fondue Chinoise, Restaurant Mandarin, Restaurant Thaïlandais, Restaurant De Wok","7 Pl. De La Bascule, Saint-Cannat",NA
La Barben,Kana Sushi,ChIJj_mA44_2yRIR4VgUCbPRrJU,"Restaurant De Sushis, Traiteur, Restaurant Japonais","1 Bd Marcel Parraud, Saint-Cannat",NA
Barbentane,La Bella Vita,ChIJYfUXzqHptRIRXi3SbQszLfE,"Restaurant, Restaurant De Hamburgers, Magasin De Pâtes, Pizza À Emporter, Restaurant De Tacos","2 Av. Des Écoles, Rognonas",1
Barbentane,Restaurant -Pizzeria Artisanale Ô Chalet -Halal,ChIJkavL8cHrtRIRnODznz9Hayw,Restaurant Halal,"410 Rue Du Petit Gigognan, Avignon",1
Barbentane,Croq' Nem Le Tai,ChIJOXcM7o7rtRIRAZ0KiesuIRk,"Restaurant Vietnamien, Restaurant Asiatique, Restaurant Cantonais, Restaurant Chinois De Livraison, Restaurant Halal, Restaurant À Emporter, Restaurant De Nouilles, Restaurant","15 Bd Raspail, Avignon",1
Barbentane,Ô’libanais Vernet,ChIJVy_RP9XrtRIR9M9o2C43t54,"Restaurant Libanais, Restaurant De Restauration Rapide","75 Rue Joseph Vernet, Avignon",1
Barbentane,Istanbul Kebab,ChIJp_LSBYnrtRIRgsXqc-S2Cg8,Restaurant Turc,"9 Pl. Des Corps Saints, Avignon",1
Barbentane,Restaurant Ineffable,ChIJnQmzp8TptRIRdRUXmjNRqBY,Restaurant Haut De Gamme Français,"3 Rue Grande, Barbentane",0
Barbentane,Le Saint Jean Hotel Bar Restaurant,ChIJp64n7sDptRIRjSRr-CsGsIg,"Restaurant, Restaurant Français, Hôtel","Le Saint Jean, Barbentane",0
Barbentane,Au Pieds Tanqués,ChIJkZmNT7vptRIR2bK8ShRSmao,"Restaurant, Restaurant Français","3 Pl. Saint-Joseph, Barbentane",0
Barbentane,L'escapade,ChIJ4-CKVBHptRIRC2YYJcbg4Qs,"Restaurant, Bar, Restaurant Français","1 Imp. De La Gare, Barbentane",0
Barbentane,Traiteur 5 Sur 5 Réceptions,ChIJJSy0adzptRIRoI2wkYw4Pr4,"Traiteur, Service Interentreprises, Restaurant Français","Zac Du, Boulbon",0
Barbentane,Nem D'asie,ChIJ65hFm73ptRIRz-t-dN76-YA,"Restaurant Vietnamien, Restaurant Chinois","110 Av. Bertherigues, Barbentane",NA
Barbentane,Miyagi Sushi Aramon,ChIJF-52F2vDtRIRZgQQ4tft58Q,Restaurant Japonais,"39 Bd Gambetta, Aramon",NA
Barbentane,Sushibowl,ChIJL1zK9IzptRIRrYvnY6Jw7VI,"Restaurant De Sushis, Restaurant Japonais","3 Rue De Provence, Graveson",NA
Barbentane,Kaly Sushi Les Angles,ChIJrxVy9lfqtRIRDy175wpsFtM,"Restaurant Japonais, Restaurant De Sushis","920 Av. De La 2è Division Blindée, Les Angles",NA
Barbentane,Délices De Pekin,ChIJ09es8aTrtRIRMTruXsOd-ug,"Restaurant Chinois, Plats Chinois À Emporter","980 Av. De La 2è Division Blindée, Les Angles",NA
Les Baux-de-Provence,𝗰𝗼𝘂𝘀𝗰𝗼𝘂𝘀 𝘇𝗶𝗱𝗮𝗻𝗲,ChIJZYvHs6jftRIRw-m_D1GH1As,Restaurant Tunisien,"2 Chem. De Montauban, Fontvieille",1
Les Baux-de-Provence,Mouries Tacos & Hamburgers ( Livraison Alpilles ),ChIJP8BoqBfjtRIRWhK--AEv4Zo,"Restaurant De Hamburgers, Restaurant De Restauration Rapide, Friterie, Restaurant À Emporter, Livraison De Pizzas, Restaurant De Pizzas, Pizza À Emporter, Restaurant, Sandwicherie, Restaurant De Tacos","13890 Mouriès, Mouriès",1
Les Baux-de-Provence,Kebab Y Locutorio,ChIJr4WjJGMJthIR3o8f9iD-lzg,Kebab,"2 Rue Faraman, Saint-Martin-de-Crau",1
Les Baux-de-Provence,Kebab,ChIJvVu9tuYJthIRoUr_spOYy4w,Restaurant,"17 Av. César Bernaudon, Saint-Martin-de-Crau",1
Les Baux-de-Provence,Mc Chicken,ChIJy7XvL68JthIRHx2hr9tioMA,Restaurant Halal,"Lot, Saint-Martin-de-Crau",1
Les Baux-de-Provence,Le Mas D'aigret Hôtel Restaurant,ChIJ3TmpF2nhtRIRDLhJ-FWeex0,"Hôtel, Restaurant Français, Restaurant Provençal","555, Route Des Oliviers, Les Baux-de-Provence",0
Les Baux-de-Provence,Restaurant L'oustau De Baumanière,ChIJH_doE0LhtRIROj436AJRQ-k,"Restaurant Haut De Gamme Français, Restaurant Français","500 Rte De Baumaniere, Les Baux-de-Provence",0
Les Baux-de-Provence,Restaurant La Cabro D'or Baumanière,ChIJj7zK_RLhtRIRXBKnNtVYPuM,"Restaurant Gastronomique, Restaurant Français, Restaurant Méditerranéen","Mas De Baumanière, Les Baux-de-Provence",0
Les Baux-de-Provence,Le Jardin Des Délices,ChIJW08eVmnhtRIR7GMudZytxiI,"Restaurant Provençal, Restaurant Français, Restaurant","Rue Du Trencat, Les Baux-de-Provence",0
Les Baux-de-Provence,Hostellerie De La Reine-Jeanne,ChIJz__B_mvhtRIRBrXGhz81cto,"Restaurant, Bar, Brasserie","4 Rue Porte Mages, Les Baux-de-Provence",0
Les Baux-de-Provence,Ming Chi,ChIJiyXPVsnftRIRTbjwJHXkSo4,"Restaurant Chinois, Restaurant Indien, Restaurant Thaïlandais","16 Rte Du N, Fontvieille",NA
Les Baux-de-Provence,Ô Tuktuk De Jade,ChIJq_lljSrftRIRDiLDZDu9iLw,Restaurant Panasiatique,"Rte De Tarascon, Fontvieille",NA
Les Baux-de-Provence,Song Long,ChIJM6fhmZ_itRIRbXhD7JTfm6w,Restaurant Vietnamien,"11 Av. Pasteur, Mouriès",NA
Les Baux-de-Provence,Padthaï-Ya,ChIJXwePgVwLthIRhAyxqrROXj8,Restaurant Asiatique,"1 Rue Isaac Newton, Saint-Martin-de-Crau",NA
Les Baux-de-Provence,Sushiman Super U Saint-Martin-De-Crau,ChIJiSlmfNoLthIR-htBpfrG3pg,"Sushis À Emporter, Épicerie Asiatique, Restaurant De Restauration Rapide, Restaurant De Fondue Chinoise, Restaurant Japonais, Restaurant À Emporter, Restaurant Panasiatique, Restaurant De Sushis","Za Du Salat, Saint-Martin-de-Crau",NA
