respondent.commune,business_name,place_id,fr_categories,business_address,treatment_arm
Levainville,Fast Pizza Kebab,ChIJkcXAIZ0-5EcRV9IjdEBZ7h4,"Restaurant, Restaurant, Restaurant De Restauration Rapide, Restaurant De Pizzas, Pizza À Emporter","15 Rue Marceau, Auneau-Bleury-Saint-Symphorien",1
Levainville,24k - Kebab Auneau,ChIJvxvx4LY_5EcROJ6PRI8q7RM,"Restaurant, Kebab","6 Rue De La Résistance, Auneau-Bleury-Saint-Symphorien",1
Levainville,Mb Chef,ChIJhVXJd-Q_5EcRxJJqs_HvArQ,"Kebab, Restaurant De Hamburgers, Restaurant De Pizzas","6 Rue De La Résistance, Auneau-Bleury-Saint-Symphorien",1
Levainville,Pacha Kebab,ChIJO19m7pw-5EcRBgdfKKs_A4E,"Restaurant Turc, Restaurant De Restauration Rapide, Kebab","43 Pl. Du Marché, Auneau-Bleury-Saint-Symphorien",1
Levainville,Welcome Pizzeria Gallardon,ChIJX7I4zaIX5EcR9Y2LFxRgcMc,"Pizza À Emporter, Restaurant De Restauration Rapide, Restaurant Turc","3 Rue De La Prte De Chartres, Gallardon",1
Levainville,Le Relais Des Essarts,ChIJx-Wn_Kk95EcRQQs7xN2uY-k,"Restaurant, Restaurant Français, Restaurant Traditionnel","Rue De La Liberté, Auneau-Bleury-Saint-Symphorien",0
Levainville,Le Bouche À Oreilles,ChIJ3xY-1jM85EcRqEgnz-_WaVQ,"Restaurant, Restaurant Français","4 Rue Hellé Nice, Auneau-Bleury-Saint-Symphorien",0
Levainville,L'artculinairedemaeva,ChIJo2lWRRU_5EcRmkThknb5AHc,"Restaurant À Emporter, Restaurant Français Moderne","29 Rue Des Floralies, Auneau-Bleury-Saint-Symphorien",0
Levainville,Castle Of Esclimont,ChIJETRYEDIM5EcRET41F6lD-RI,"Restaurant, Restaurant Français, Hôtel","Rue Du Parc, Auneau-Bleury-Saint-Symphorien",0
Levainville,Restaurant La Rochefoucauld,ChIJ2_a8jOE85EcRVm5r0E9y4aU,"Restaurant Français, Restaurant Méditerranéen","2 Rue Du Château, Auneau-Bleury-Saint-Symphorien",0
Levainville,Restaurant Asiatique,ChIJf8wd3Jw-5EcRnSTTIpP3AOw,Restaurant Asiatique,"34 Pl. Du Marché, Auneau-Bleury-Saint-Symphorien",NA
Levainville,Sushis Thai,ChIJRd-NqSYX5EcR3FyWagMIsXI,Restaurant Asiatique,"18 Pl. De L'église, Gallardon",NA
Levainville,Grill 168,ChIJE13qCgIZ5EcRVbfh1tA8U0M,"Restaurant Asiatique, Restaurant Chinois, Restaurant Japonais, Restaurant De Sushis","200 Av. De L'europe, Épernon",NA
Levainville,Paradis D'asie,ChIJdypJXiQS5EcRIFFiUKRR2ZM,"Restaurant Asiatique, Restaurant Chinois, Restaurant Mandarin","4 Rue Du Bois Paris, Nogent-le-Phaye",NA
Levainville,Stand De Plats Asiatiques,ChIJa5bXTAUl5EcRsE96Za3lrqg,Restaurant Asiatique,"40 Rue De La Droue, Sonchamp",NA
Lèves,Foodpoint28,ChIJgyPyHksN5EcRf0gaLbHlY5s,"Restaurant, Restaurant De Kebab Doner, Restaurant De Restauration Rapide, Restaurant Halal, Restaurant De Hamburgers, Restaurant Indien, Restaurant Pakistanais, Restaurant De Tacos, Restaurant Végétalien","1 Av. De La République, Chartres",1
Lèves,Royal Kebab Chartres,ChIJUegW-OAN5EcRAeXfhAiE9Ic,"Kebab, Restaurant De Restauration Rapide","10 Rue Saint-Maurice, Chartres",1
Lèves,O’pizz’dwich Mainvilliers,ChIJ_5fJ9BIM5EcRMcGX6WYmsvk,"Restaurant De Restauration Rapide, Restaurant De Hamburgers, Restaurant De Pizzas, Sandwicherie, Restaurant De Tacos","24 Av. Des Acacias, Mainvilliers",1
Lèves,Abichou,ChIJ51HwG-cN5EcRHmG5KSek864,"Dîner, Restaurant De Restauration Rapide, Restaurant Français, Restaurant Grec, Restaurant Halal, Restaurant De Hamburgers, Restaurant Méditerranéen, Restaurant Du Moyen-Orient, Restaurant Turc","1 Pl. Du Marché, Mainvilliers",1
Lèves,Pacha Kebab,ChIJzRSaNkcM5EcRN3B3HnFY5sA,"Restaurant Turc, Restaurant De Hamburgers, Kebab","14 Av. Jehan De Beauce, Chartres",1
Lèves,Les Gourmandises De Betrou,ChIJNYlP5W4P5EcRMOVTcBNbEO0,"Pâtisserie, Boulangerie, Restaurant De Petit-Déjeuner, Restaurant Brunch, Restaurant Français, Épicerie Fine","7 Rue Auguste Rodin, Saint-Prest",0
Lèves,Le Petit Marche,ChIJQ1ZvdIEN5EcRiEp8SXPrBjc,"Épicerie, Boulangerie, Restaurant Français, Magasin De Fruits Et Légumes, Épicerie Fine, Sandwicherie","2 Pl. Du Marché, Mainvilliers",0
Lèves,Le Moulin De Ponceau,ChIJER4IKTYM5EcRoGsmMWuzJpk,"Restaurant Français, Restaurant Haut De Gamme Français, Restaurant Français Moderne","21 Rue De La Tannerie, Chartres",0
Lèves,Brasserie De L'ouest,ChIJ46ePzEAM5EcRYFH0joEUKTY,"Brasserie, Bar, Restaurant Français","7 Pl. Pierre Semard, Chartres",0
Lèves,Le Jehan,ChIJIxA_mVkN5EcRMBNvnXb6JeQ,"Restaurant, Restaurant Français, Séminaire","17 Av. Jehan De Beauce, Chartres",0
Lèves,Bb Asie,ChIJ27qzFUcM5EcR0LaOdzG37EU,"Restaurant, Restaurant De Fusion Asiatique, Restaurant Asiatique, Restaurant Chinois, Restaurant Japonais, Restaurant Panasiatique","7 Rue De La Couronne, Chartres",NA
Lèves,Kyotori,ChIJD6FEx0YM5EcRHWkhzO07BUw,"Restaurant Japonais, Restaurant Asiatique, Restaurant, Restaurant De Sushis","13 Rue Général Koenig, Chartres",NA
Lèves,Le Mughal,ChIJZUt0wUgM5EcR-gCI8TEHPHY,"Restaurant Indien, Restaurant Pakistanais","34 Rue De La Clouterie, Chartres",NA
Lèves,Côté Sushi Chartres,ChIJY2S6MZsN5EcRQv0uSoHCF30,"Restaurant De Sushis, Restaurant Asiatique, Restaurant De Poissons, Restaurant Fusion, Restaurant Japonais, Restaurant Panasiatique, Restaurant Péruvien, Sushis À Emporter","3 Pl. Marceau, Chartres",NA
Lèves,Shogun Sushi,ChIJwawcD0QM5EcRyZh7kQeZS5I,"Restaurant Japonais, Restaurant Japonais Authentique, Steakhouse Japonais, Restaurant De Livraison","8 Rue Du Dr Michel Gibert, Chartres",NA
Levesville-la-Chenard,Kebab Grille Janville,ChIJlQm6zHNQ5EcRAeJmZgMAUNo,"Kebab, Gril, Restaurant De Pizzas, Restaurant De Tacos","5 Pl. Du Martroi, Janville-en-Beauce",1
Levesville-la-Chenard,Restaurant Istanbul Kebab Angerville,ChIJk6SHmQFL5EcR8NwD0tAmN7Q,"Restaurant Turc, Restaurant De Hamburgers, Pizza À Emporter, Restaurant De Tacos","3 Ter Rue De L'église, Angerville",1
Levesville-la-Chenard,Au Bon Fourneau,ChIJ8ZoiEY5L5EcRT32R7j21JoI,"Restaurant Turc, Restaurant De Restauration Rapide, Kebab, Restaurant De Pizzas","2 Rue Des Dames De Saint-Cyr, Angerville",1
Levesville-la-Chenard,Le Royal Kebab,ChIJPcvwGY5L5EcRJwmb6WrEO3M,"Restaurant De Pizzas, Restaurant De Restauration Rapide, Kebab, Restaurant","53 Rue Nationale Bât A, Angerville",1
Levesville-la-Chenard,Allo Presto Pizza,ChIJwf9yVrxR5EcR4WYEBoAIPeo,"Restaurant De Restauration Rapide, Kebab, Restaurant De Pizzas, Restaurant, Sandwicherie","79 Rue Nationale, Toury",1
Levesville-la-Chenard,Burger King,ChIJtUllJ71F5EcRWra4nUl_y1A,"Restaurant De Restauration Rapide, Restaurant Américain, Bar Et Grill, Restaurant Familial, Restaurant De Hamburgers, Restaurant À Emporter","Aire Des Plaines De Beauce, Fresnay-l'Évêque",0
Levesville-la-Chenard,Arche Restaurant,ChIJdR6v0LxF5EcRcEtgexUQuDg,Restaurant Français,"Aire De Repos De Francheville, Fresnay-l'Évêque",0
Levesville-la-Chenard,Service Area Val Neuvy,ChIJW5WXSqJF5EcReq4-tEA2q-w,"Restaurant, Bistro, Restaurant Français, Sandwicherie","Autoroute A10 Sens Orléans Paris, Fresnay-l'Évêque",0
Levesville-la-Chenard,La Table Gourmande,ChIJ82SyMABB5EcRRYVIU0DikJc,Restaurant Français,"2 Rue De La Bezegue, Ouarville",0
Levesville-la-Chenard,Relais De Beauce,ChIJ-8PgclBC5EcRd-oIznnbdf4,"Restaurant, Bar, Restaurant Français","Lieu Dit La Michellerie, Ymonville",0
Levesville-la-Chenard,Traiteur Asiatique,ChIJwaqkEY5L5EcR9Wi7M9x9FQ0,Restaurant Asiatique,"63 Rue Nationale, Angerville",NA
Levesville-la-Chenard,Restaurant Asiatique,ChIJf8wd3Jw-5EcRnSTTIpP3AOw,Restaurant Asiatique,"34 Pl. Du Marché, Auneau-Bleury-Saint-Symphorien",NA
Levesville-la-Chenard,Paradis D'asie,ChIJdypJXiQS5EcRIFFiUKRR2ZM,"Restaurant Asiatique, Restaurant Chinois, Restaurant Mandarin","4 Rue Du Bois Paris, Nogent-le-Phaye",NA
Levesville-la-Chenard,Sushis Thai,ChIJRd-NqSYX5EcR3FyWagMIsXI,Restaurant Asiatique,"18 Pl. De L'église, Gallardon",NA
Levesville-la-Chenard,Restaurant Asiatique,ChIJR_Y1bqcN5EcRlgGUOxPcDLo,Restaurant Asiatique,"Av. D'orléans, Le Coudray",NA
Logron,Kebab Du Centre Châteaudun,ChIJxVzrzYp_40cRUb1YR912AtQ,"Kebab, Restaurant De Restauration Rapide","38bis Pl. Du 18 Octobre, Châteaudun",1
Logron,Grill Istanbul,ChIJy6QU0op_40cRvItJ8_lGpMo,Restaurant Turc,"38 Pl. Du 18 Octobre, Châteaudun",1
Logron,Le Sable D'or,ChIJt1gZmPV_40cRY28WHwr7RAE,"Kebab, Restaurant De Restauration Rapide","13 Rue De Varize, Châteaudun",1
Logron,Boucherie Halal,ChIJ9SshHAeA40cRv8gpImrBm4A,Boucherie,"34 Av. Du Général De Gaulle, Châteaudun",1
Logron,Chiken Cottage,ChIJu_1MEKSB40cRI8laxSHfa1I,Restaurant Halal,"10 Rue Albert Camus, Châteaudun",1
Logron,La Clé Des Champs,ChIJxfJxbcOZ40cRXVxOFpGPxPw,"Restaurant, Restaurant Français","1 La Brosse, Dangeau",0
Logron,Sarl _ Au P'tit Gourmand,ChIJsczqC4SB40cRB47lp4r4gfU,"Restaurant Français, Restaurant, Restaurant Traditionnel","Z.a. Hodier, Donnemain-Saint-Mamès",0
Logron,"Le Relais De Poste ""Saint-Jacques""",ChIJ2-iiCWyG40cRA35Vv762-VY,Restaurant Français,"8 Pl. De L'église, Dangeau",0
Logron,Mcdonald's,ChIJT2_zcBSA40cRz3DLSsFyLfc,"Restaurant De Restauration Rapide, Restaurant Américain, Restaurant De Hamburgers, Restaurant De Pizzas, Restaurant, Sandwicherie","Route Nationale 10 Centre Commercial Intermarché Les Garennes 28200 Chateaudun Fr, Châteaudun",0
Logron,Buffalo Grill Châteaudun,ChIJc0lkLmuA40cR7rcU-tFXVSg,"Restaurant, Restaurant Américain, Bar Et Grill, Restaurant Barbecue, Restaurant Familial, Restaurant De Hamburgers, Restaurant À Emporter, Steak House","Zone D'activités Des Garennes, Châteaudun",0
Logron,Maikruathai,ChIJW4sDv4-H40cRD3q-tkBujS8,"Restaurant, Restaurant Thaïlandais","1 Chem. De Dangeau, Trizay-lès-Bonneval",NA
Logron,"Le Royal Wok, Châteaudun",ChIJHUvyGRGA40cR0wiR-AZnC7M,"Restaurant Chinois, Restaurant Asiatique, Restaurant","1-23 Chem. Des Basses Garennes, Châteaudun",NA
Logron,Délice Châteaudun,ChIJa4KEMvV_40cRbXBvi-koy68,Plats Chinois À Emporter,"32 Pl. Du 18 Octobre, Châteaudun",NA
Logron,Sushi’lys,ChIJWc_TUPB_40cRIUdoJZmZoq4,Restaurant De Sushis,"7 Rue Gambetta, Châteaudun",NA
Logron,Le Punjab Grill,ChIJI8eRDVZ_40cRd3GIOKw7WfA,Restaurant Indien,"75bis Rue De La République, Châteaudun",NA
Loigny-la-Bataille,Lorient Kebab,ChIJh_toi3Jh5EcRLGCgyyyrPwc,Restaurant De Pizzas,"1 Place Ste Barbe, Orgères-en-Beauce",1
Loigny-la-Bataille,Ludovic Brassaud,ChIJwZv8BkNl5kcRQqizLYFguJg,"Traiteur, Pâtisserie, Restaurant Français, Restaurant Halal, Restaurant Du Déjeuner, Pâtisserie, Restaurant Végétarien","Amoinville, Éole-en-Beauce",1
Loigny-la-Bataille,Kebab Grille Janville,ChIJlQm6zHNQ5EcRAeJmZgMAUNo,"Kebab, Gril, Restaurant De Pizzas, Restaurant De Tacos","5 Pl. Du Martroi, Janville-en-Beauce",1
Loigny-la-Bataille,Kebab Express,ChIJ8wvyXC345EcROet_Ae-AgY4,"Kebab, Restaurant De Restauration Rapide","43 Rue De Paris, Chevilly",1
Loigny-la-Bataille,Cirik Llker,ChIJT5KaWy345EcRqs5LnQHwIyU,"Kebab, Restaurant De Restauration Rapide, Restaurant De Pizzas","43 Rue De Paris, Chevilly",1
Loigny-la-Bataille,Le Saint Florian,ChIJVRHyYUr15EcR_FBQFUiGegE,"Bar, Restaurant Français","21 Rue De La Croix Blanche, Patay",0
Loigny-la-Bataille,Mcdonald's,ChIJ6YOXpB9Y5EcRLa7hyDcUGOA,"Restaurant De Restauration Rapide, Restaurant Américain, Restaurant De Hamburgers, Restaurant De Pizzas, Restaurant, Sandwicherie","Zac Artenay Poupry Secteur, Artenay",0
Loigny-la-Bataille,Courtepaille,ChIJEX6Ie_NX5EcRBnB0v9eihZ0,"Restaurant De Steakhouse Français, Gril, Bar Et Grill, Restaurant Familial, Restaurant Français, Restaurant De Plats De Viande, Restaurant","N20, Artenay",0
Loigny-la-Bataille,Le Pique Assiette,ChIJ873IDfNX5EcR_NfSj7Fsm6Q,"Restaurant, Bar, Restaurant Français, Restaurant À Emporter","29 Rue De Chartres, Artenay",0
Loigny-la-Bataille,Restaurant - La Fontaine -Artenay,ChIJtZT8d_JX5EcRt2tUXa_b7WU,Restaurant Français,"2 Pl. De L Hôtel De Ville, Artenay",0
Loigny-la-Bataille,Thaï Break - Cap Saran,ChIJQ8T0eR_75EcRsTcpGyPEDW0,"Restaurant Thaïlandais, Restaurant Familial, Restaurant De Fondue Chinoise, Restaurant De Wok","2601 Rte Nationale, Saran",NA
Loigny-la-Bataille,Otaru,ChIJLw0q9Uz75EcR8t-2r9LP8MU,Restaurant Japonais,"131 Rue Thomas Edison, Saran",NA
Loigny-la-Bataille,Sushi Daily Saran,ChIJDYdhKcX75EcR3mEnEOe2XkA,"Sushis À Emporter, Kiosque","2601 Route Nationale 20, Saran",NA
Loigny-la-Bataille,Yoyoshi,ChIJEXndzMv75EcRA0bR29nObSo,Restaurant Japonais,"77 All. De L'orée De La Forêt, Saran",NA
Loigny-la-Bataille,Хадилия,ChIJo39oHCv75EcRF-dTm4YKslY,Restaurant Asiatique,"123 Rue Georges Coignet, Saran",NA
Lormaye,Lakasbah2,ChIJ3QvGDUAD5EcR1iosV9aafJY,"Restaurant De Restauration Rapide, Restaurant Halal, Restaurant Turc","18 Rue Du Général De Gaulle, Nogent-le-Roi",1
Lormaye,"Larri's Food (Pizzeria ,Kebab ,Tacos,Burgers)",ChIJK7nlQi4D5EcRhlkUiSCLz_8,"Restaurant De Pizzas, Restaurant De Restauration Rapide, Livraison De Pizzas, Pizza À Emporter, Restaurant, Sandwicherie","39 Rue Du Général De Gaulle, Nogent-le-Roi",1
Lormaye,K-Burger (Sarl),ChIJ7QyHZ4EB5EcRsms-zxct3tw,"Restaurant, Restaurant De Restauration Rapide, Restaurant De Hamburgers, Kebab, Restaurant De Tacos","72 Grande Rue, Villemeux-sur-Eure",1
Lormaye,Restaurant _ Oriental La Rose Des Sables,ChIJ3SEHE-Ia5EcR26ooOatHf88,"Restaurant, Restaurant Français, Restaurant Du Déjeuner, Restaurant Méditerranéen, Restaurant Marocain, Magasin De Salades, Restaurant De Fruits De Mer","3 Rue Collin D'harleville, Maintenon",1
Lormaye,Cappadoce,ChIJESAvFeIa5EcRp2wA4XJaSso,"Restaurant Turc, Kebab","8 Pl. Aristide Briand, Maintenon",1
Lormaye,Traiteur Asiatique La Bienvenue,ChIJ34MRkUAD5EcRcB8NkHzDT48,"Restaurant, Magasin De Bière, Restaurant De Petit-Déjeuner, Bar À Cocktails, Restaurant Français, Restaurant De Hamburgers, Restaurant Du Déjeuner, Magasin De Salades, Restaurant Traditionnel","6 Pl. De L'étoile, Nogent-le-Roi",0
Lormaye,O'bistro,ChIJOaL1hD8D5EcRog1VRhpMuP0,"Brasserie, Bar, Bistro, Traiteur, Restaurant Français, Restaurant","20 Rue De La Volaille, Nogent-le-Roi",0
Lormaye,Le Capucin Gourmand,ChIJ3UD8bUAD5EcRY7e8ne5Q0-U,Restaurant Haut De Gamme Français,"1 Rue De La Volaille, Nogent-le-Roi",0
Lormaye,Relais Des Remparts,ChIJnbW7q2oD5EcRRevpGE4ICts,"Restaurant Français, Restaurant Gastronomique, Restaurant Haut De Gamme Français","2 Rue Du Marché Aux Légumes, Nogent-le-Roi",0
Lormaye,Le Palais Breton,ChIJQ6r4NjcD5EcRxUbmBJCC1HM,"Crêperie, Restaurant Français","1 Rue De La Cavée De Houdan, Coulombs",0
Lormaye,Punjab,ChIJh3t-A0YD5EcRvBj6Fpg8oHE,Restaurant Indien,"2 Rue De L'église, Nogent-le-Roi",NA
Lormaye,Maison Huang,ChIJ37_yyUYb5EcR6U0zXA1dyUc,Restaurant Chinois,"Fr, Maintenon",NA
Lormaye,Asian Lounge,ChIJ19iWkdob5EcRWwCUGYElZZg,Restaurant Japonais,"24 Rue De La Ferté, Maintenon",NA
Lormaye,Grill 168,ChIJE13qCgIZ5EcRVbfh1tA8U0M,"Restaurant Asiatique, Restaurant Chinois, Restaurant Japonais, Restaurant De Sushis","200 Av. De L'europe, Épernon",NA
Lormaye,Nagoya,ChIJA2ZGnzRV4UcRY7GpY1oXHwo,Restaurant De Sushis,"15 Rue De Rome, Vernouillet",NA
La Loupe,Ada Délices,ChIJrbqEAPnB40cRD_sfeGQH6PM,"Kebab, Restaurant De Restauration Rapide","3 Rue Du Château, La Loupe",1
La Loupe,Ozkaya Duran,ChIJMyBjSfjB40cRHseAvVFDLhs,"Kebab, Restaurant De Restauration Rapide, Restaurant De Pizzas","8 Pl. De L'hôtel De Ville, La Loupe",1
La Loupe,Em Kebab,ChIJISJ4EC7n40cRkVJq_qEJ6n4,Restaurant Turc,"23 Rue Louis Peuret Ter, Senonches",1
La Loupe,Pizza Service,ChIJpZ2XUnjz40cR03HACdNC_QI,"Restaurant De Pizzas, Restaurant De Restauration Rapide, Restaurant Halal, Restaurant De Hamburgers, Kebab, Restaurant À Emporter, Livraison De Pizzas, Pizza À Emporter, Sandwicherie, Restaurant De Tacos","5 Rue De La Madeleine, Courville-sur-Eure",1
La Loupe,Le Paradize,ChIJRfb-RLTz40cRFfq2Bx2nV0k,"Kebab, Restaurant De Restauration Rapide","64 Rue Pannard, Courville-sur-Eure",1
La Loupe,La Gourmandise,ChIJY0c76ffB40cRsPkIKqXj5P4,"Restaurant, Restaurant Français","2 Pl. De La Gare, La Loupe",0
La Loupe,Cafe De La Loupe,ChIJcb4oCOrB40cRJEvd5o6mQRM,"Café, Magasin De Bière, Bistro, Restaurant Français, Kiosque À Journaux, Pub, Bar Sportif, Bar À Vin","2 Pl. De L'hôtel De Ville, La Loupe",0
La Loupe,Mcdonald's,ChIJXf7TQ_7p40cRR-jL3IwfHGs,"Restaurant De Restauration Rapide, Restaurant Américain, Restaurant De Hamburgers, Restaurant De Pizzas, Restaurant, Sandwicherie","2 Avenue De La Cerisaie, La Loupe",0
La Loupe,"Auberge Du Moulin À Vent, The Originals Relais",ChIJm-UQ_OTC40cRUZr46vbyBBk,"Restaurant Français, Bar, Hôtel","23 Chem. Du Moulin À Vent, Manou",0
La Loupe,Le Sebastopol,ChIJN_eEiTDr40cRTWMjExdESXE,"Restaurant, Restaurant Français","24 Grande Rue, Champrond-en-Gâtine",0
La Loupe,Chef Jin Traiteur Asiatique,ChIJ4Yn39Da340cRTYtq3INVhew,"Plats Chinois À Emporter, Restaurant Chinois","20 Rue Villette Gâte, Nogent-le-Rotrou",NA
La Loupe,Indian Street,ChIJxfTrRUu340cRkbR6hZMzQ-Y,Restaurant Indien,"13 Place St Pol, Nogent-le-Rotrou",NA
La Loupe,L’étoile D’asie,ChIJw0AlbS-340cRUWBSRexE84s,"Restaurant, Restaurant Asiatique, Restaurant Chinois, Restaurant De Sushis","19 Av. De La Victoire Du 11 Novembre 1918, Nogent-le-Rotrou",NA
La Loupe,Royal Verneuil,ChIJQQGFGiNi4UcRfQdsQrNfYew,"Restaurant, Restaurant Asiatique, Bar, Restaurant Chinois, Restaurant Japonais","514 Rue Aristide Briand, Verneuil d'Avre et d'Iton",NA
La Loupe,Siècle D’or,ChIJKWwJgDOb40cRR2RCRfAWFKo,Restaurant Chinois,"France, Brou",NA
Louville-la-Chenard,Launay Traiteur,ChIJ23v3gg1p5EcRn7hm6C16hVQ,"Traiteur, Magasin De Bière, Pâtisserie, Restaurant Français, Restaurant Sans Gluten, Restaurant Halal, Pâtisserie, Restaurant Végétalien, Restaurant Végétarien","1 Bis Rue Du Dr Rabourdin, Les Villages Vovéens",1
Louville-la-Chenard,Restaurant Méditerranée,ChIJk4U6dSlp5EcRrBf4W44hbso,"Restaurant, Kebab, Restaurant De Pizzas, Pizza À Emporter, Sandwicherie","16 Rue Du Voisin, Les Villages Vovéens",1
Louville-la-Chenard,Mb Chef,ChIJhVXJd-Q_5EcRxJJqs_HvArQ,"Kebab, Restaurant De Hamburgers, Restaurant De Pizzas","6 Rue De La Résistance, Auneau-Bleury-Saint-Symphorien",1
Louville-la-Chenard,24k - Kebab Auneau,ChIJvxvx4LY_5EcROJ6PRI8q7RM,"Restaurant, Kebab","6 Rue De La Résistance, Auneau-Bleury-Saint-Symphorien",1
Louville-la-Chenard,Pacha Kebab,ChIJO19m7pw-5EcRBgdfKKs_A4E,"Restaurant Turc, Restaurant De Restauration Rapide, Kebab","43 Pl. Du Marché, Auneau-Bleury-Saint-Symphorien",1
Louville-la-Chenard,La Table Gourmande,ChIJ82SyMABB5EcRRYVIU0DikJc,Restaurant Français,"2 Rue De La Bezegue, Ouarville",0
Louville-la-Chenard,Relais De Beauce,ChIJ-8PgclBC5EcRd-oIznnbdf4,"Restaurant, Bar, Restaurant Français","Lieu Dit La Michellerie, Ymonville",0
Louville-la-Chenard,Burger King,ChIJtUllJ71F5EcRWra4nUl_y1A,"Restaurant De Restauration Rapide, Restaurant Américain, Bar Et Grill, Restaurant Familial, Restaurant De Hamburgers, Restaurant À Emporter","Aire Des Plaines De Beauce, Fresnay-l'Évêque",0
Louville-la-Chenard,Arche Restaurant,ChIJdR6v0LxF5EcRcEtgexUQuDg,Restaurant Français,"Aire De Repos De Francheville, Fresnay-l'Évêque",0
Louville-la-Chenard,Service Area Val Neuvy,ChIJW5WXSqJF5EcReq4-tEA2q-w,"Restaurant, Bistro, Restaurant Français, Sandwicherie","Autoroute A10 Sens Orléans Paris, Fresnay-l'Évêque",0
Louville-la-Chenard,Restaurant Asiatique,ChIJf8wd3Jw-5EcRnSTTIpP3AOw,Restaurant Asiatique,"34 Pl. Du Marché, Auneau-Bleury-Saint-Symphorien",NA
Louville-la-Chenard,Traiteur Asiatique,ChIJwaqkEY5L5EcR9Wi7M9x9FQ0,Restaurant Asiatique,"63 Rue Nationale, Angerville",NA
Louville-la-Chenard,Paradis D'asie,ChIJdypJXiQS5EcRIFFiUKRR2ZM,"Restaurant Asiatique, Restaurant Chinois, Restaurant Mandarin","4 Rue Du Bois Paris, Nogent-le-Phaye",NA
Louville-la-Chenard,Restaurant Asiatique,ChIJR_Y1bqcN5EcRlgGUOxPcDLo,Restaurant Asiatique,"Av. D'orléans, Le Coudray",NA
Louville-la-Chenard,Sushis Thai,ChIJRd-NqSYX5EcR3FyWagMIsXI,Restaurant Asiatique,"18 Pl. De L'église, Gallardon",NA
Louvilliers-en-Drouais,Restaurant Broch'et ( Brochette ),ChIJnQxBLuFV4UcRzgoFeZ_bYAE,Restaurant Turc,"1 Av. Marc Chappey, Vernouillet",1
Louvilliers-en-Drouais,Beautiful Pizzeria Fast Food,ChIJ_RUgVplV4UcRyl0aJjqJhiI,"Restaurant, Buffet De Douceurs Et De Desserts, Restaurant De Restauration Rapide, Restaurant De Hamburgers, Restaurant De Pizzas, Sandwicherie, Restaurant De Tacos","Centre Commercial, Vernouillet",1
Louvilliers-en-Drouais,La Fabrique À Sushi,ChIJrwdKKWhV4UcR0KZujUc3-iQ,"Restaurant De Sushis, Restaurant Halal, Restaurant De Fondue Chinoise, Restaurant Japonais, Restaurant De Livraison, Restaurant De Wok","1 Av. Marc Chappey, Vernouillet",1
Louvilliers-en-Drouais,Crazy Poulet,ChIJHXToD25V4UcRxJRsW5Pbz30,"Restaurant D'ailes De Poulet, Restaurant Halal, Restaurant","2 Rue Louis Fauvel, Vernouillet",1
Louvilliers-en-Drouais,Istanbul Kebab Chez Abi,ChIJsQfvMg5X4UcR5teyPez4yQo,"Restaurant, Restaurant Turc","5 Rue Eugène Raymond, Saint-Rémy-sur-Avre",1
Louvilliers-en-Drouais,Lunch Grill,ChIJOXe_2o5X4UcR1BGv6OV6EAE,"Restaurant De Steakhouse Français, Gril, Restaurant De Desserts, Friterie, Restaurant De Hamburgers, Restaurant De Plats De Viande, Restaurant Traditionnel","Le Bois De Vert, Vert-en-Drouais",0
Louvilliers-en-Drouais,O Cinq Sens,ChIJR5EOw5tV4UcRUr2Q4ctWLCg,"Restaurant, Traiteur, Restaurant Français","126 Rte De Crécy, Vernouillet",0
Louvilliers-en-Drouais,Ansamble,ChIJAzXCzwlV4UcRfSYO06iD0Bo,"Restaurant, Restauration, Restaurant Français","Rue De Bretagne, Dreux",0
Louvilliers-en-Drouais,Restaurant O'trefois,ChIJ70oZbsBV4UcR6E1hZXfI1YY,"Restaurant, Restaurant Français","89 Av. Des Fenots, Dreux",0
Louvilliers-en-Drouais,Restaurant La Boucherie,ChIJ9URhwyNV4UcRfB2DlqLUpEs,"Restaurant Chophouse, Restaurant Barbecue, Brasserie, Boucherie, Restaurant Familial, Restaurant Français, Restaurant De Steakhouse Français, Salon, Restaurant De Plats De Viande","11 Rue Rene Miet, Dreux",0
Louvilliers-en-Drouais,Jardin Du Punjab,ChIJ45RvLaRV4UcRGiud7ntsOxM,Restaurant Indien,"4 Av. Marc Chappey, Vernouillet",NA
Louvilliers-en-Drouais,La Perle De Chine,ChIJvfOxzRxV4UcRZPtUbqwTKIg,"Restaurant, Bar, Restaurant Chinois","16 Rue Des Bas Buissons, Dreux",NA
Louvilliers-en-Drouais,Restaurant L'himalaya,ChIJtQOVkz1V4UcREKDaEGZQrIQ,"Restaurant Pakistanais, Restaurant Indien","35 Rue Du Bois Sabot, Dreux",NA
Louvilliers-en-Drouais,Saveurs De Siam 28,ChIJ58sLUjRV4UcRlWC_HZslI50,"Restaurant À Emporter, Restaurant De Fusion Asiatique, Restaurant Panasiatique, Restaurant Thaïlandais","Stand 18 Dans Le Marché Couvert, Dreux",NA
Louvilliers-en-Drouais,Restaurant Japonais,ChIJSRG6kztV4UcRypahI3ZDr9M,"Restaurant Japonais, Restaurant De Sushis","27 Rue Parisis, Dreux",NA
Louvilliers-lès-Perche,Em Kebab,ChIJISJ4EC7n40cRkVJq_qEJ6n4,Restaurant Turc,"23 Rue Louis Peuret Ter, Senonches",1
Louvilliers-lès-Perche,Ozkaya Duran,ChIJMyBjSfjB40cRHseAvVFDLhs,"Kebab, Restaurant De Restauration Rapide, Restaurant De Pizzas","8 Pl. De L'hôtel De Ville, La Loupe",1
Louvilliers-lès-Perche,Ada Délices,ChIJrbqEAPnB40cRD_sfeGQH6PM,"Kebab, Restaurant De Restauration Rapide","3 Rue Du Château, La Loupe",1
Louvilliers-lès-Perche,Verneuil Kebab,ChIJr1fs_pRj4UcR0UN1KEcM3a0,Restaurant Turc,"11 Rue Aristide Briand, Verneuil d'Avre et d'Iton",1
Louvilliers-lès-Perche,Punjab Food,ChIJpQANCiFj4UcRSDbUWRmxT50,"Restaurant De Kebab Doner, Restaurant","45 Pl. De La Madeleine, Verneuil d'Avre et d'Iton",1
Louvilliers-lès-Perche,Le _ Grand Claireau,ChIJyQiB8FXn40cRfPeP62mVYIQ,"Restaurant, Bar, Restaurant Français","2 Rte Des Hauts Étangs, La Saucelle",0
Louvilliers-lès-Perche,Logis Auberge De La Pomme De Pin,ChIJP0CPwuTn40cR2O5vBrlZ6tc,"Restaurant, Traiteur, Restaurant Français, Hôtel","15 Rue Michel Cauty, Senonches",0
Louvilliers-lès-Perche,Bar Des Halles,ChIJN_nEmuTn40cRTjFbojWFnNQ,"Bar, Brasserie","4 Pl. Des Halles, Senonches",0
Louvilliers-lès-Perche,Les Voyageurs,ChIJn5hYm-Tn40cRIfcdmDbw-4s,"Restaurant, Crêperie, Restaurant Français, Restaurant Italien, Restaurant De Pizzas","2 Pl. Des Halles, Senonches",0
Louvilliers-lès-Perche,Hôtel La Forêt,ChIJwcVx2vvn40cRf4DUhySIO8k,"Hôtel, Restaurant Français","22 Rue De Verdun, Senonches",0
Louvilliers-lès-Perche,Royal Verneuil,ChIJQQGFGiNi4UcRfQdsQrNfYew,"Restaurant, Restaurant Asiatique, Bar, Restaurant Chinois, Restaurant Japonais","514 Rue Aristide Briand, Verneuil d'Avre et d'Iton",NA
Louvilliers-lès-Perche,Traiteur Asiatique Nonancourt,ChIJw_M4PBdZ4UcRuQRmUKhq5W4,"Traiteur, Restaurant Chinois","34 Pl. Aristide Briand, Nonancourt",NA
Louvilliers-lès-Perche,Jardin Du Punjab,ChIJ45RvLaRV4UcRGiud7ntsOxM,Restaurant Indien,"4 Av. Marc Chappey, Vernouillet",NA
Louvilliers-lès-Perche,Etoile D'or,ChIJ9aP4nVpV4UcR1u0JPkyMDzo,"Restaurant Asiatique, Restaurant Chinois, Restaurant De Restauration Rapide, Restaurant De Wok","2 Bd De L'europe, Vernouillet",NA
Louvilliers-lès-Perche,Bonheur Sushi,ChIJ06fhYFpV4UcR9hoyq4UvxG8,"Restaurant De Sushis, Restaurant Japonais","30 Rue Du Pressoir, Vernouillet",NA
Lucé,Food Corner,ChIJeTFhWXAM5EcR_hbQ-PMzJVM,"Restaurant À Emporter, Restaurant De Restauration Rapide, Restaurant De Tacos","7 Rue Des Écoles, Lucé",1
Lucé,Bosphore,ChIJb_m9D3AM5EcR2hD_pKXlf6U,"Kebab, Restaurant Turc","78 Rue De La République, Lucé",1
Lucé,Kroosti Yummy Foodtruck Halal,ChIJM9xXX-8N5EcRyQH4R4b8_JE,"Restaurant De Restauration Rapide, Restaurant Halal","34 Rue Du Maréchal Leclerc, Lucé",1
Lucé,Delices Du Maghreb Chez Vatika Uniquement A Emporter Sur Commande,ChIJgZMoAR8L5EcR34jwJX6v6qE,Restaurant Algérien,"5 Rés Des Beguines Logt 8, Lucé",1
Lucé,Ô Coin Chaud,ChIJ8_5TRoQL5EcR2SUmmjbHk_0,"Kebab, Restaurant De Restauration Rapide, Restaurant Italien, Restaurant De Pizzas","12 Pl. Des Arcades, Lucé",1
Lucé,La Grillade D'orient,ChIJVSVFRkkM5EcRYSZJeK6pfjI,"Restaurant, Gril, Restaurant Buffet, Restaurant De Couscous, Restaurant Français","54 Rue Du Maréchal Leclerc, Lucé",0
Lucé,Broceliande,ChIJwYETCnAM5EcRQpLDUxPR1H0,Crêperie,"41 Rue De La République, Lucé",0
Lucé,L' Amuse Bouche,ChIJhawlcXgM5EcR-NyZVmJHvBE,"Restaurant, Restaurant Français","131bis Rue De La République, Lucé",0
Lucé,Garcia,ChIJR2IZCHoM5EcRgUA1BxJwxpA,Brasserie,"120 Rue De La République, Lucé",0
