respondent.commune,business_name,place_id,fr_categories,business_address,treatment_arm
Longnes,Le Pigeonnier,ChIJ31v_F2-65kcRAVU2Qr3Rr4E,"Restaurant Gastronomique, Restaurant Français","7 Rue De Bréval, Longnes",0
Longnes,Entreprise Clerice,ChIJ-wpar3mx5kcRBouGQ47WZ70,"Traiteur, Restaurant De Petit-Déjeuner, Restaurant Brunch, Restaurant Français, Restaurant D'aliments Sains, Restaurant Du Déjeuner, Restaurant Végétalien, Restaurant Végétarien","5 Rue Du Moulin Du Haut, Longnes",0
Longnes,La Jument Verte,ChIJxYB-5hS75kcR3bKOJxSpV8s,"Restaurant, Magasin De Bière, Bar À Cocktails, Restaurant Gastronomique, Restaurant Français, Restaurant D'aliments Sains, Restaurant Du Déjeuner, Bar À Vin","6 Pl. De L'église, Montchauvet",0
Longnes,Nsr Pool,ChIJvczNiNGw5kcR8j9N4-vmtts,Brasserie,"12 Pl. Du Mal Leclerc, Bréval",0
Longnes,Auberge Gilloise,ChIJuxIhse6x5kcRRi2PYaYNO14,"Restaurant Français, Chalet, Restaurant De Pizzas","16 Grande Rue, Gilles",0
Longnes,Restaurant Au Fav’,ChIJF0e77tO_5kcROSChDhlpBoQ,"Restaurant De Wok, Restaurant Asiatique","France, Buchelay",NA
Longnes,Ayako Sushi Buchelay,ChIJ9VeTDni_5kcRn0tqwcYmtU4,"Restaurant De Sushis, Restaurant Japonais","Zone Des Closeaux, Buchelay",NA
Longnes,Saveur Gourmandes,ChIJ05hkb7i_5kcRsAA98niRgkk,Restaurant Asiatique,"46 Bd Roger Salengro, Mantes-la-Ville",NA
Longnes,Nah Sushi,ChIJo7zA-Vq-5kcR8Iub10ST7f4,"Restaurant De Sushis, Restaurant De Livraison","106 Rte De Houdan, Mantes-la-Ville",NA
Longnes,Chicken Rice,ChIJaa6Gb_--5kcRLdkCSfOawnY,"Restaurant, Restaurant De Restauration Rapide, Restaurant Indien","51 Bd Roger Salengro, Mantes-la-Ville",NA
Longvilliers,Istanbul Kebab,ChIJl2XpkXIy5EcR36Bl_Ba15wY,"Restaurant Turc, Restaurant De Restauration Rapide, Kebab","4 Rue Sarcey, Dourdan",1
Longvilliers,O'chicken-Tacos,ChIJYURNrCgz5EcRPSJnBIc1TBs,Restaurant De Tacos,"27 Rue D'etampes, Dourdan",1
Longvilliers,Riad Fes,ChIJ74slXWgy5EcRFfna5_uH2Es,"Restaurant, Restaurant Marocain","51 Av. D'etampes, Dourdan",1
Longvilliers,Wasa,ChIJj1hpNzMr5EcRn6nBv68awlA,"Restaurant De Pizzas, Restaurant Italien, Kebab, Restaurant De Livraison","1 Rue De Marcoussis, Limours",1
Longvilliers,Restaurant Le Marrakech,ChIJwaXcBn7U5UcRdxQEnRpPYDI,"Restaurant Marocain, Restaurant","7 Rue Marcel Quinet, Briis-sous-Forges",1
Longvilliers,L'ambassade - Restaurant 78 Area Wedding,ChIJt5eE-Css5EcRngAvr7wLQZA,"Restaurant, Restaurant Français, Séminaire, Lieu De Mariage","1 Rte De La Bâte, Rochefort-en-Yvelines",0
Longvilliers,L'escu De Rohan-Restaurant Français,ChIJsY4S-IEu5EcRiO3dkWtxQfM,"Restaurant Haut De Gamme Français, Restaurant Français","15 Rue Guy Le Rouge, Rochefort-en-Yvelines",0
Longvilliers,La Remarde,ChIJ73zU_kGy6EcReZYS0elzqp8,"Restaurant, Restaurant Français","2 Rte De Paris, Saint-Cyr-sous-Dourdan",0
Longvilliers,Restaurant Le 42,ChIJX6v7o3Uv5EcRpBhMTjVLds4,"Restaurant, Restaurant Français","42 Rue Charles De Gaulle, Saint-Arnoult-en-Yvelines",0
Longvilliers,La Fleur De Sel,ChIJQzf9iHIy5EcRR4anFwgpCmk,"Restaurant, Restaurant Gastronomique, Restaurant Français","1 Rue Sarcey, Dourdan",0
Longvilliers,Asaki Sushi,ChIJZbNFkG0y5EcRAJk3tsDNhU8,"Restaurant Japonais, Restaurant De Sushis","48 Rue De Chartres, Dourdan",NA
Longvilliers,Les Saveurs D'himalaya,ChIJi5YB69oz5EcRfzPGoCOBhU0,Restaurant Indien,"3 All. Emile Rigal, Dourdan",NA
Longvilliers,Siecle D'or,ChIJy12CVmYy5EcRz749Go0e2Yc,"Restaurant Chinois, Restaurant Buffet","7 Rue D'orsonville, Dourdan",NA
Longvilliers,New Cygne D'or,ChIJRc7mgJoy5EcRCHGmU4l-lGw,"Restaurant, Restaurant Asiatique, Restaurant Chinois","5 Pl. Du Vieux Théatre, Roinville",NA
Longvilliers,Shiawase,ChIJAQBcNGLS5UcRxVjXkdHts88,"Restaurant Asiatique, Magasin De Bière, Restaurant Japonais, Restaurant Du Déjeuner, Restaurant De Sushis, Bar À Vin","35b Rue Charles De Gaulle, Saint-Chéron",NA
Louveciennes,Maroc En Yvelines,ChIJVfxeIdFi5kcReopI1d3FCVQ,"Restaurant Marocain, Restaurant De Livraison","3 Quai Boissy D'anglas, Bougival",1
Louveciennes,Kebab Le Pecq,ChIJJeAp1iGI5kcRcmCbgQZRQL4,Restaurant Turc,"2 Av. Des Vignes Benettes, Le Pecq",1
Louveciennes,Chicken Benettes,ChIJg8Zh99WJ5kcRwDLZDx2XoYo,"Restaurant, Restaurant De Hamburgers, Restaurant De Livraison, Restaurant De Tacos","2 Av. Des Vignes Benettes, Le Pecq",1
Louveciennes,Cannelle & Safran,ChIJMbkuphp95kcRcdVt_OjjI38,Restaurant Marocain,"29 Av. Lucien René Duchesne, La Celle-Saint-Cloud",1
Louveciennes,"Le Petit Riad, Saint Germain En Laye",ChIJnVT6PCiI5kcRzZbQd2WPu2M,Restaurant Marocain,"62ter Av. Du Général Leclerc, Le Pecq",1
Louveciennes,La Parenthèse Verte,ChIJrWW7vbVi5kcR8Nt3KAeMyVo,Restaurant Français,"5 Rue De La Princesse, Louveciennes",0
Louveciennes,Aux Chandelles,ChIJTQZKtUx95kcRoyHtK0HIovk,"Restaurant Français, Restaurant Gastronomique","12 Pl. De L'église, Louveciennes",0
Louveciennes,Café De La Mairie,ChIJC8AGSLNi5kcRdq4OYKZyelQ,"Restaurant Français, Restaurant","37 Rue Du Général Leclerc, Louveciennes",0
Louveciennes,Le 78,ChIJ49S2uFp95kcRKfgq7d0m158,"Restaurant Français, Brasserie","28 Rte De Versailles, Louveciennes",0
Louveciennes,Le Coq De Bougival,ChIJaSfL4vxj5kcRUIssRE_th7o,"Restaurant Français, Séminaire, Buffet De Mariage, Lieu De Mariage","15 Bis Quai Rennequin Sualem, Bougival",0
Louveciennes,Osaka Box,ChIJvfN2IdRi5kcRxVeu3JZucts,Restaurant Japonais,"36 Rue Du Général Leclerc, Bougival",NA
Louveciennes,Baan Mae,ChIJT5lZSdRi5kcR4ChENM-JWw4,"Restaurant Thaïlandais, Restaurant Asiatique, Restaurant","58 Rue Du Général Leclerc, Bougival",NA
Louveciennes,Le Narval,ChIJ8dxEfgGI5kcR8tqHr8zDL7w,"Restaurant Asiatique, Bar, Bar À Tabac, Bureau De Tabac, Restaurant Vietnamien","36 Grande Rue, Marly-le-Roi",NA
Louveciennes,Fresh Lounge Sushi,ChIJwyRgwit95kcR-KM8FlHTz1Q,"Restaurant De Sushis, Restaurant Japonais, Restaurant De Livraison","30 Av. Jean Moulin, Bougival",NA
Louveciennes,Vishnu Bhavan,ChIJ1doW2wOI5kcRsnW3FiDBnzA,Restaurant Indien,"18 Grande Rue, Marly-le-Roi",NA
Magnanville,Restaurant Istanbul,ChIJwRfBrvq-5kcRidSOo0dpVyM,"Restaurant Turc, Restaurant De Restauration Rapide","1 Rue De L'ouest, Mantes-la-Ville",1
Magnanville,O'market,ChIJU4SDsvq-5kcRmb8MxMLHXzE,"Magasin D'alimentation En Gros, Fournisseur De Boissons Gazeuses, Boucherie, Fromagerie, Chocolaterie, Épicerie Fine, Restaurant Halal, Magasin D'articles Pour La Maison","1 Rue De L'ouest, Mantes-la-Ville",1
Magnanville,Kebab' Home,ChIJlR7x07--5kcR_HrBr2a4_Tw,Restaurant,"2 Pl. Des Droits De L'homme, Magnanville",1
Magnanville,Taco's Mantes La Ville,ChIJk_Bd-Pu-5kcRFVvJos1HCzY,"Restaurant De Tacos, Restaurant De Restauration Rapide","34 Bis Bd Roger Salengro, Mantes-la-Ville",1
Magnanville,G La Dalle - Mantes La Ville,ChIJX_0AtrS_5kcRykrSEcDAhJ0,"Restaurant De Hamburgers, Restaurant De Restauration Rapide, Restaurant Halal","14 Bd Roger Salengro, Mantes-la-Ville",1
Magnanville,Burger King,ChIJrSzr6_q-5kcRx4KoYi2vw40,"Restaurant De Restauration Rapide, Restaurant Américain, Bar Et Grill, Restaurant Familial, Restaurant De Hamburgers, Restaurant À Emporter","7 Rue Jean Ferrat, Mantes-la-Ville",0
Magnanville,Mcdonald's,ChIJz38V9vq-5kcRPbl89bIDLTk,"Restaurant De Restauration Rapide, Restaurant Américain, Restaurant De Hamburgers, Restaurant De Pizzas, Restaurant, Sandwicherie","135 Bd Roger Salengro, Mantes-la-Ville",0
Magnanville,Au Bureau,ChIJQSJg1S6_5kcRsKwiN1IMHfo,"Restaurant, Bar, Restaurant Européen, Restaurant Français, Restaurant De Hamburgers, Restaurant Irlandais, Pub, Bar Sportif","11 Rue Jean Ferrat, Mantes-la-Ville",0
Magnanville,Restaurant Flunch Mantes,ChIJr8I4kdq-5kcRkAqqdx89xhc,"Restaurant Familial, Restaurant Buffet, Traiteur, Crêperie, Restaurant De Restauration Rapide, Restaurant Français, Restaurant, Restaurant De Coupes Glacées","Centre Commercial Auchan, Buchelay",0
Magnanville,Les Gourmandises D Erwan Et Serena,ChIJhYO-teC_5kcRBNIA8nW-AZI,"Boulangerie, Restaurant De Petit-Déjeuner, Pâtisserie, Restaurant Français, Restaurant D'aliments Sains, Restaurant Du Déjeuner, Pâtisserie, Sandwicherie","113 Bd Roger Salengro, Mantes-la-Ville",0
Magnanville,Saveur Gourmandes,ChIJ05hkb7i_5kcRsAA98niRgkk,Restaurant Asiatique,"46 Bd Roger Salengro, Mantes-la-Ville",NA
Magnanville,Chicken Rice,ChIJaa6Gb_--5kcRLdkCSfOawnY,"Restaurant, Restaurant De Restauration Rapide, Restaurant Indien","51 Bd Roger Salengro, Mantes-la-Ville",NA
Magnanville,Nah Sushi,ChIJo7zA-Vq-5kcR8Iub10ST7f4,"Restaurant De Sushis, Restaurant De Livraison","106 Rte De Houdan, Mantes-la-Ville",NA
Magnanville,Restaurant Au Fav’,ChIJF0e77tO_5kcROSChDhlpBoQ,"Restaurant De Wok, Restaurant Asiatique","France, Buchelay",NA
Magnanville,Ayako Sushi Buchelay,ChIJ9VeTDni_5kcRn0tqwcYmtU4,"Restaurant De Sushis, Restaurant Japonais","Zone Des Closeaux, Buchelay",NA
Magny-les-Hameaux,Break Time,ChIJdyjRH99_5kcR1j0OJYFOYdo,"Kebab, Restaurant De Restauration Rapide, Restaurant De Pizzas, Pizza À Emporter","39 Rte De Versailles, Magny-les-Hameaux",1
Magny-les-Hameaux,Sheherazade,ChIJccSq6fZ_5kcRpvsN3krS_DY,"Restaurant Marocain, Traiteur","193 Av. Du Général Leclerc 1, Gif-sur-Yvette",1
Magny-les-Hameaux,Dilissa Restaurant Franco Marocain,ChIJB3ZMAsh_5kcRuuzq1yLIBOk,"Restaurant Marocain, Traiteur","2 Rue Robert Esnault Pelterie, Toussus-le-Noble",1
Magny-les-Hameaux,O'tacos - Voisins-Le-Bretonneux,ChIJW4skxO6A5kcRTRV6bDjj1JY,"Restaurant De Restauration Rapide, Restaurant De Tacos","6 Rue François Couperin, Voisins-le-Bretonneux",1
Magny-les-Hameaux,Auberge D'agadir,ChIJVVVlzeWA5kcRnYSRn9HDrUU,"Restaurant Marocain, Restaurant Méditerranéen","Centre Commercial Mérantais, Voisins-le-Bretonneux",1
Magny-les-Hameaux,La Place,ChIJdUM0a3SA5kcRhK6Q6nQtjPM,"Brasserie, Bar, Restaurant Français","2 Pl. Pierre Bérégovoy, Magny-les-Hameaux",0
Magny-les-Hameaux,Restaurant La Belle Epoque Châteaufort,ChIJHaxaydV_5kcRVYLW04ojAqs,"Restaurant Haut De Gamme Français, Restaurant Français","10 Pl. De La Mairie, Châteaufort",0
Magny-les-Hameaux,Le Resto Châteaufort,ChIJ4V7fStR_5kcRmPCGryir6CQ,"Restaurant Français, Cave À Vin","11 Pl. Saint-Christophe, Châteaufort",0
Magny-les-Hameaux,Le Chalet,ChIJQaGrMxyA5kcR4O-xWRv9lTk,"Restaurant, Bar, Restaurant Français, Bureau De Tabac","3 Rue Ditte, Saint-Rémy-lès-Chevreuse",0
Magny-les-Hameaux,Mcdonald's,ChIJ76J8xPV_5kcRnSH1osxhUE4,"Restaurant De Restauration Rapide, Restaurant Américain, Restaurant De Hamburgers, Restaurant De Pizzas, Restaurant, Sandwicherie","1, Ter Route De La Noue, Gif-sur-Yvette",0
Magny-les-Hameaux,Yi Sushi,ChIJIdZzuOl_5kcRR_vI7ye9oOg,"Restaurant Japonais, Restaurant Asiatique, Restaurant Chinois, Restaurant De Sushis","2 Pl. Du 19 Mars 1962, Magny-les-Hameaux",NA
Magny-les-Hameaux,Asie Traiteur,ChIJNyaPjRuA5kcRTD2QyIkUWNY,"Restaurant Asiatique, Restaurant Chinois, Restaurant De Restauration Rapide","9 Pl. Du 14 Juillet, Saint-Rémy-lès-Chevreuse",NA
Magny-les-Hameaux,O Bento,ChIJKxjfnR6A5kcRHvRLhTEO9Cw,Restaurant Japonais,"27 Rue De La République, Saint-Rémy-lès-Chevreuse",NA
Magny-les-Hameaux,Palais Du Bonheur,ChIJPQCZ_fR_5kcRn90430oqMCI,"Restaurant Asiatique, Restaurant Chinois, Restaurant","4 Route De La Noue, Gif-sur-Yvette",NA
Magny-les-Hameaux,Sushi Yuki,ChIJFwTodn9_5kcRTBlB6c-WnjA,"Restaurant De Sushis, Restaurant Asiatique, Restaurant Japonais, Restaurant De Fruits De Mer","1 Av. Du Général Leclerc, Gif-sur-Yvette",NA
Maisons-Laffitte,O'délices,ChIJL0WKiGxh5kcR7hImfAsudMg,"Restaurant Marocain, Restaurant Africain, Restaurant Halal, Restaurant Méditerranéen","6 Rue De La Muette, Maisons-Laffitte",1
Maisons-Laffitte,Ganesh,ChIJIVgEtYZh5kcRdrg6boMWZ74,"Restaurant Bangladais, Restaurant Halal, Restaurant Indien, Restaurant Traditionnel","8 Bis Av. De Saint-Germain, Maisons-Laffitte",1
Maisons-Laffitte,Amara Traiteur Libanais,ChIJaXaykSRh5kcR6rG6sUALAD4,"Restaurant Libanais, Traiteur, Restaurant De Restauration Rapide","15 Av. De Longueil, Maisons-Laffitte",1
Maisons-Laffitte,Istanbul,ChIJb6DGW4Fh5kcRpKP41cUeWYo,"Restaurant Turc, Bar, Restaurant De Restauration Rapide","1 Av. De Saint-Germain, Maisons-Laffitte",1
Maisons-Laffitte,Traiteur Libanais Le Sajj 961,ChIJtVK3aKJh5kcR9v07nw5buIY,"Traiteur, Boulangerie, Fromagerie, Épicerie Fine, Restaurant Halal, Restaurant Libanais, Pâtisserie, Restaurant Végétarien","1 All. Claude Lamirault, Maisons-Laffitte",1
Maisons-Laffitte,Le Bistrot Du Coin,ChIJ-UOkT8Fh5kcRXGKHrv2dwLs,"Restaurant Français, Bar, Café, Restaurant De Hamburgers","95 Av. De Poissy, Le Mesnil-le-Roi",0
Maisons-Laffitte,Les Jardins De La Vieille Fontaine,ChIJvS0tMXdh5kcReeOLhNdJaKs,"Restaurant Français, Planificateur D'événements, Restaurant Haut De Gamme Français, Séminaire, Organisateur De Mariage","8 Av. De Grétry, Maisons-Laffitte",0
Maisons-Laffitte,Le Tastevin,ChIJH7-miIJh5kcRT5UU10D7Nvg,"Restaurant, Restaurant Français, Restaurant Haut De Gamme Français","9 Av. Eglé, Maisons-Laffitte",0
Maisons-Laffitte,Le Bouche À Oreille,ChIJf1jCzXhh5kcReD2kTkyBPdY,"Restaurant Français, Traiteur","51 Rue De Paris, Maisons-Laffitte",0
Maisons-Laffitte,La Plancha De Kiko,ChIJ01pEWoFh5kcRfY7onbd8iwI,"Restaurant, Restaurant Gastronomique","5 Av. De Saint-Germain, Maisons-Laffitte",0
Maisons-Laffitte,Tokyo House,ChIJhehcm4Nh5kcR9i47c-bA3MI,"Restaurant Japonais, Restaurant Asiatique, Restaurant","17 Rue Des Plantes, Maisons-Laffitte",NA
Maisons-Laffitte,Toyama,ChIJh0aPKn9h5kcRaOvBGMJDv50,"Restaurant Japonais, Restaurant De Sushis","39 Rue De Paris, Maisons-Laffitte",NA
Maisons-Laffitte,La Taverne De Chine,ChIJhZQBb4Jh5kcRO636EOoiYgA,Restaurant Mandarin,"64 Rue De Paris, Maisons-Laffitte",NA
Maisons-Laffitte,Eat Sushi Maisons Laffitte,ChIJ_V7kwhxh5kcRZeByh1aSdo0,"Restaurant De Sushis, Restaurant Japonais","3 Av. De Longueil, Maisons-Laffitte",NA
Maisons-Laffitte,Palais De Chine,ChIJzRdNLXlh5kcRG8SMRHwlBcU,Restaurant Chinois,"14 Rue De Paris, Maisons-Laffitte",NA
Mantes-la-Jolie,Joud Restaurant,ChIJuYUYN6e_5kcRCwb3lNo-Y-Y,"Restaurant Libanais, Restaurant Halal","9 Rue Marie Et Robert Dubois, Mantes-la-Jolie",1
Mantes-la-Jolie,Le Jardin Des Saveurs,ChIJeQuBbHO_5kcR-0_rQXmLwOY,"Restaurant Libanais, Restaurant Français","36 Rue Prte Aux Saints, Mantes-la-Jolie",1
Mantes-la-Jolie,L'atelier Restaurant,ChIJ2w5Ema2_5kcRsNm0W8Sbjj0,"Restaurant Halal, Restaurant Français","10 Rue D'alsace, Mantes-la-Jolie",1
Mantes-la-Jolie,La Bonne Assiette,ChIJjZ46lJa_5kcRnI6HpUYYo3Q,Restaurant Halal,"9 Rue Gambetta, Mantes-la-Jolie",1
Mantes-la-Jolie,Trisapori,ChIJa2GYRnG_5kcRB3yoWhcJ_uI,"Restaurant Italien, Traiteur, Charcuterie, Restaurant De Restauration Rapide, Restaurant Halal, Glacier, Magasin De Pâtes, Pizza À Emporter, Magasin De Salades, Sandwicherie","17 Rue Prte Aux Saints, Mantes-la-Jolie",1
Mantes-la-Jolie,Rive Gauche,ChIJ99syY7O_5kcRyywvYpVB28k,Restaurant Haut De Gamme Français,"1 Rue Du Fort, Mantes-la-Jolie",0
Mantes-la-Jolie,Restaurant Les Sens... Ciel,ChIJtZcNYa2_5kcRMnbjEF9vX_c,"Restaurant Français, Restaurant","10 Rue Henri Rivière, Mantes-la-Jolie",0
Mantes-la-Jolie,La Veranda Restaurant,ChIJtSBRybO_5kcRM4uXXG0nmaA,"Restaurant, Restaurant Brunch, Bar De Musique Live, Restaurant Traditionnel","10 Rue Conrad Kilian, Mantes-la-Jolie",0
Mantes-la-Jolie,Chez Antoine,ChIJ848NYa2_5kcRk0lyyg-68RY,"Restaurant, Restaurant Français, Restaurant Italien, Restaurant Provençal","16 Rue Gambetta, Mantes-la-Jolie",0
Mantes-la-Jolie,Relais Des Mers,ChIJZeGeYrK_5kcRYkM0t_SN9h0,"Marché Aux Fruits De Mer, Restaurant De Fruits De Mer","6 Rue Des Halles, Mantes-la-Jolie",0
Mantes-la-Jolie,Restaurant Chinois Jia Yi,ChIJtQp9U3y_5kcRGqRKQ9kEnsM,Restaurant Chinois,"20 Rue Gambetta, Mantes-la-Jolie",NA
Mantes-la-Jolie,Restaurant Namasté,ChIJ-VGLVgG_5kcRij33duLjaKs,Restaurant Indien,"151 Bd Du Maréchal Juin, Mantes-la-Jolie",NA
Mantes-la-Jolie,Le Zauq,ChIJi0iBtrK_5kcRnOp46Las-Ss,Restaurant Indien,"14 Rue Henri Rivière, Mantes-la-Jolie",NA
Mantes-la-Jolie,Tandoori House,ChIJLcKUiKi_5kcRiThoq3ZbQa8,Restaurant Indien,"34 Rue De La Haye Grossets, Mantes-la-Jolie",NA
Mantes-la-Jolie,Le Mandarin,ChIJveTBe6u_5kcRxJCx1Z3ykpk,"Restaurant Mandarin, Restaurant De Fondue Chinoise","11 Bd Du Maréchal Juin, Mantes-la-Jolie",NA
Mantes-la-Ville,Eat Station Gourmet,ChIJoWXqAMm_5kcRLGLSbu8hpEQ,Restaurant Halal,"6 Bis Bd Calmette, Mantes-la-Jolie",1
Mantes-la-Ville,Pepper Grill Mantes La Jolie,ChIJ3ccbYeS_5kcRfGdXi1iwtyA,"Restaurant, Brasserie, Restaurant Halal, Restaurant De Hamburgers","2 Bd Calmette, Mantes-la-Jolie",1
Mantes-la-Ville,Mon Poké Bowl Mantes,ChIJi57pkuK_5kcRqYxCmfARzaY,"Restaurant Hawaïen, Restaurant Halal, Restaurant Japonais, Poké Bar","8 Bd Roger Salengro, Mantes-la-Ville",1
Mantes-la-Ville,G La Dalle - Mantes La Ville,ChIJX_0AtrS_5kcRykrSEcDAhJ0,"Restaurant De Hamburgers, Restaurant De Restauration Rapide, Restaurant Halal","14 Bd Roger Salengro, Mantes-la-Ville",1
Mantes-la-Ville,Restaurant Istanbul,ChIJwRfBrvq-5kcRidSOo0dpVyM,"Restaurant Turc, Restaurant De Restauration Rapide","1 Rue De L'ouest, Mantes-la-Ville",1
Mantes-la-Ville,Buffalo Grill Mantes-La-Ville,ChIJWdGkAkW-5kcRY__aZr6tccM,"Restaurant, Restaurant Américain, Bar Et Grill, Restaurant Barbecue, Restaurant Familial, Restaurant De Hamburgers, Restaurant À Emporter, Steak House","Rue Du 8 Mai 1945, Mantes-la-Ville",0
Mantes-la-Ville,Le Moulin De La Reillère,ChIJd09NfWe-5kcRBxbtipsCD_8,Restaurant Français,"171 Rte De Houdan, Mantes-la-Ville",0
Mantes-la-Ville,Le Salengro,ChIJKexoa_--5kcRQrLl2LTgvck,"Restaurant, Magasin De Bière, Bar À Cocktails, Restaurant Français, Bar De Musique Live, Restaurant Du Déjeuner, Bureau De Tabac, Bar À Vin","59 Bd Roger Salengro, Mantes-la-Ville",0
Mantes-la-Ville,Mcdonald's,ChIJz38V9vq-5kcRPbl89bIDLTk,"Restaurant De Restauration Rapide, Restaurant Américain, Restaurant De Hamburgers, Restaurant De Pizzas, Restaurant, Sandwicherie","135 Bd Roger Salengro, Mantes-la-Ville",0
Mantes-la-Ville,Burger King,ChIJrSzr6_q-5kcRx4KoYi2vw40,"Restaurant De Restauration Rapide, Restaurant Américain, Bar Et Grill, Restaurant Familial, Restaurant De Hamburgers, Restaurant À Emporter","7 Rue Jean Ferrat, Mantes-la-Ville",0
Mantes-la-Ville,Wok Center Grill,ChIJc6G8VUS-5kcRWnNMmjrD_g8,"Restaurant De Wok, Restaurant Buffet, Restaurant Mandarin","Rond Point De La Clé Des Champs, Mantes-la-Ville",NA
Mantes-la-Ville,Nah Sushi,ChIJo7zA-Vq-5kcR8Iub10ST7f4,"Restaurant De Sushis, Restaurant De Livraison","106 Rte De Houdan, Mantes-la-Ville",NA
Mantes-la-Ville,Saveur Gourmandes,ChIJ05hkb7i_5kcRsAA98niRgkk,Restaurant Asiatique,"46 Bd Roger Salengro, Mantes-la-Ville",NA
Mantes-la-Ville,Chicken Rice,ChIJaa6Gb_--5kcRLdkCSfOawnY,"Restaurant, Restaurant De Restauration Rapide, Restaurant Indien","51 Bd Roger Salengro, Mantes-la-Ville",NA
Mantes-la-Ville,Oppa Cantine,ChIJNQpaJVm_5kcRdnxvvSOos_U,"Restaurant Coréen, Restaurant Asiatique, Restaurant De Barbecue Coréen, Restaurant De Bœuf Coréen","Pl. Henri Dunant, Mantes-la-Jolie",NA
Marcq,Doydoyfood,ChIJsRX4kUqR5kcR3VVK9lc8abQ,"Restaurant, Restaurant De Kebab Doner, Restaurant Grec, Kebab, Restaurant Turc","1 Av. De Chavoye, Mareil-sur-Mauldre",1
Marcq,Le Palais Du Maroc,ChIJO2xPOySR5kcRSuIvqIFdbkQ,"Restaurant Marocain, Restaurant Asiatique, Salle De Banquet, Restaurant Barbecue, Traiteur, Restaurant De Couscous, Salle De Réception, Restaurant À Emporter, Restaurant De Pizzas, Restaurant Du Sud De L'italie","9 Rue Saint-Vincent, Maule",1
Marcq,Ali Baba,ChIJQe1ojCOR5kcRBu7mxDZrvx0,"Kebab, Restaurant De Restauration Rapide","Chau. Saint-Vincent, Maule",1
Marcq,Restaurant Artemis Kebab&Pizza&Tacos&Grillade&Burger,ChIJRz79pd-Y5kcRHQi8P29dclk,Restaurant De Restauration Rapide,"Rue Des Croix, La Queue-les-Yvelines",1
Marcq,Izmir Grill,ChIJBaY3Et-Y5kcR40SwZ8bzqt8,"Restaurant Turc, Restaurant De Restauration Rapide, Kebab","Centre Commercial Les Croix, La Queue-les-Yvelines",1
Marcq,À Table Chez Eric Leautey,ChIJLzYPzdeZ5kcR04Cnc1R0DEw,Restaurant Français,"28 Rue De La Prte Saint-Martin, Thoiry",0
Marcq,Le Relais D'auteuil,ChIJCXxlCJKZ5kcRrpAkcbErEFc,"Hôtel, Restaurant De Fruits De Mer","34 Rue Grande Rue, Auteuil",0
Marcq,L’auberge De Montainvillle,ChIJYTZ5j5OQ5kcRLQxvBZtWnbM,Restaurant Français,"17 Rue Du Pressoir, Montainville",0
Marcq,La Licorne,ChIJv0z394ea5kcRvT2kRahD6tw,"Restaurant Français, Restaurant Gastronomique, Restaurant Méditerranéen","31 Rue De La République, Beynes",0
Marcq,Le Cardinal,ChIJVyezwyaR5kcRxUw4mdpNOKs,"Restaurant, Restaurant Français","22 Rue Quincampoix, Maule",0
Marcq,Sushi Show,ChIJ3UY4p4ma5kcRCYAm9BhvQ0M,Restaurant De Sushis,"Route Nationale 191, Beynes",NA
Marcq,Asian Food,ChIJRe4wXzCR5kcRRn-0E3D-JmE,Restaurant Asiatique,"28 Rue Parisis, Maule",NA
Marcq,Saveurs Du Kashmir,ChIJW7mfLN6R5kcRgvLXrSh1OgE,Restaurant Indien,"1 Rue Parisis, Maule",NA
Marcq,Gaston À La Campagne,ChIJF73zF86Z5kcR0SGo4z-nN_E,"Restaurant, Service De Livraison, Restaurant De Hamburgers, Restaurant De Livraison, Restaurant Thaïlandais","14 Rue Anatole Moussu, Méré",NA
Marcq,Ayumi Sushi,ChIJgRYBGaWa5kcROArAGYxYZoo,"Restaurant Japonais, Restaurant De Sushis","39 Av. Du Centre, Beynes",NA
Mareil-le-Guyon,Rapido,ChIJQe8FDg6b5kcR-Lyd7Il5U-U,"Restaurant, Restaurant De Restauration Rapide, Kebab, Pizza À Emporter","1 Pl. Du Pontel, Villiers-Saint-Frédéric",1
Mareil-le-Guyon,La Casa Del Patata,ChIJjZnfvpOr5kcRa-hgZ982MCc,"Restaurant, Restaurant Halal","3 D912, Villiers-Saint-Frédéric",1
Mareil-le-Guyon,Auberge Libanaise,ChIJ74yihz-b5kcRvw75sW0u1QQ,Restaurant Libanais,"29 Rte Du Pontel, Jouars-Pontchartrain",1
Mareil-le-Guyon,Les Délices Du Maroc,ChIJ3bBihECb5kcROZ52pJWfmMw,"Restaurant, Restaurant Marocain","11 All. André Le Notre, Jouars-Pontchartrain",1
Mareil-le-Guyon,La Rose Des Sables,ChIJlXtq-ceb5kcRdFtJxZz8pyc,Restaurant Marocain,"12 Rue Saint-Nicolas, Neauphle-le-Château",1
Mareil-le-Guyon,Numéro 3 Restaurant,ChIJEfbRRISc5kcR6A-wxc7KzaU,Restaurant Haut De Gamme Français,"3 Rue Du Général Charles De Gaulle, Le Tremblay-sur-Mauldre",0
Mareil-le-Guyon,L'auberge De L'abbaye,ChIJoeHuZK-b5kcRl8iFrBjUoIg,"Restaurant Français, Bar, Restaurant","5 Pl. Maximilien Sully, Neauphle-le-Vieux",0
Mareil-le-Guyon,Café Du Coq,ChIJez6lL7Ge5kcRZcTJz34-hdE,"Restaurant, Café, Restaurant Français","44 Rue De Paris, Montfort-l'Amaury",0
Mareil-le-Guyon,La Treille,ChIJgzwRw7Ce5kcRa5BYqBDGEDs,"Restaurant, Restaurant Français, Bar À Vin","16 Pl. Robert Brault, Montfort-l'Amaury",0
Mareil-le-Guyon,Café De La Poste,ChIJgzwRw7Ce5kcRpu4CQhh-V3I,"Restaurant, Bar, Restaurant Français, Café","16 Pl. Robert Brault, Montfort-l'Amaury",0
Mareil-le-Guyon,Gaston À La Campagne,ChIJF73zF86Z5kcR0SGo4z-nN_E,"Restaurant, Service De Livraison, Restaurant De Hamburgers, Restaurant De Livraison, Restaurant Thaïlandais","14 Rue Anatole Moussu, Méré",NA
Mareil-le-Guyon,Lanna Thai,ChIJa0jfL0OZ5kcR0X0WqBLpM6w,"Restaurant Thaïlandais, Magasin De Bière, Fromagerie, Bar À Cocktails, Restaurant D'aliments Sains, Restaurant Du Déjeuner, Bar À Vin","3 Pl. Louis Valton, Méré",NA
Mareil-le-Guyon,Sushi Montfort,ChIJiwI6rfmf5kcRlVypENgMHZw,"Restaurant Japonais, Restaurant De Sushis","40 Rue De Paris, Montfort-l'Amaury",NA
Mareil-le-Guyon,Chifan _ Restaurant,ChIJgR3_Pree5kcR16AN71hrgIM,"Restaurant Asiatique, Restaurant Chinois, Restaurant Thaïlandais","2 Pl. De La Libération, Montfort-l'Amaury",NA
Mareil-le-Guyon,Au Porte Bonheur,ChIJA2bUp9-Y5kcRLVl3IETmTL4,Restaurant Asiatique,"Rue Des Croix, La Queue-les-Yvelines",NA
Mareil-Marly,Chicken Benettes,ChIJg8Zh99WJ5kcRwDLZDx2XoYo,"Restaurant, Restaurant De Hamburgers, Restaurant De Livraison, Restaurant De Tacos","2 Av. Des Vignes Benettes, Le Pecq",1
Mareil-Marly,Kebab Le Pecq,ChIJJeAp1iGI5kcRcmCbgQZRQL4,Restaurant Turc,"2 Av. Des Vignes Benettes, Le Pecq",1
Mareil-Marly,King Food,ChIJ6YuNz06I5kcRDEXUVp8Fw6k,"Restaurant De Kebab Doner, Restaurant Américain, Restaurant De Restauration Rapide, Restaurant","6 Av. Saint-Fiacre, Saint-Germain-en-Laye",1
Mareil-Marly,"Le Petit Riad, Saint Germain En Laye",ChIJnVT6PCiI5kcRzZbQd2WPu2M,Restaurant Marocain,"62ter Av. Du Général Leclerc, Le Pecq",1
Mareil-Marly,Les Petits Plats De Sonia,ChIJ6SX30qaJ5kcRlQmwtz1a8ms,"Restaurant, Magasin De Bière, Restaurant Français, Restaurant Sans Gluten, Restaurant Halal, Restaurant Du Déjeuner, Restaurant Traditionnel, Restaurant Végétarien, Bar À Vin","Rue Armagis, Saint-Germain-en-Laye",1
Mareil-Marly,Delesalle,ChIJwTkT8leJ5kcRRK89bbIE32U,Brasserie,"30 Rue Des Closeaux, Mareil-Marly",0
Mareil-Marly,La Croix,ChIJm38QeESI5kcRA5u6G0rF-ms,"Restaurant, Bar, Restaurant Français","34 Rue De Saint-Germain, Saint-Germain-en-Laye",0
Mareil-Marly,Kashmir Delight,ChIJp-uhQJuJ5kcRGPCGv_rJL1U,"Restaurant Indien Musulman, Restaurant Barbecue, Restaurant Biryani, Plats Indiens À Emporter, Restaurant De Livraison, Restaurant De Nouilles, Restaurant Pakistanais, Magasin De Salades, Restaurant Végétarien","2 Av. Des Vignes Benettes, Le Pecq",0
Mareil-Marly,Pepe Chicken By Fastgood Cuisine,ChIJSZ2OeqGJ5kcR-rvW7UKRDJw,"Restaurant À Emporter, Restaurant Américain, Restaurant De Poulet, Restaurant De Restauration Rapide","9 Rue De L'ermitage, Le Pecq",0
Mareil-Marly,Au Fulcosa,ChIJL7L6flyI5kcREU61rodCEf0,"Restaurant Haut De Gamme Français, Bistro, Restaurant Français, Marché De Produits Frais","2 Rue Du Maréchal Foch - Quartier, Saint-Germain-en-Laye",0
Mareil-Marly,Out Fry - Korean Fried Chicken By Taster,ChIJg5BU7rqJ5kcRtrTUjanwgM4,"Restaurant À Emporter, Restaurant Asiatique, Restaurant De Poulet, Restaurant De Restauration Rapide, Restaurant Coréen","9 Rue De L'ermitage, Le Pecq",NA
Mareil-Marly,Restaurant Belle D ' Asie,ChIJKwA-3beJ5kcRq0d81CbSOBY,Restaurant Asiatique,"France, Le Pecq",NA
Mareil-Marly,Sushi Daily Marly Le Roi Vitrine,ChIJr0RrOCNj5kcRzxd1e7rWJBk,"Sushis À Emporter, Kiosque","Av. De L'amiral Lemonnier Centre Commercial Domaine Grandes Terres, Marly-le-Roi",NA
Mareil-Marly,Les Saveurs D'asie,ChIJWSpV9wOI5kcR2x-wrFLXrWI,Restaurant Chinois,"Av. De L'amiral Lemonnier, Marly-le-Roi",NA
