respondent.commune,business_name,place_id,fr_categories,business_address,treatment_arm
Affoux,Es Grill Kebab,ChIJO3h4Bu5n9EcRiN1cPWybq-E,"Kebab, Restaurant Familial","56 Bd Voltaire, Tarare",1
Affoux,Restaurant Orientale Kossaina,ChIJm0sPWcFl9EcRIYAY8X_otoc,Restaurant Halal,"34 Rue De La République, Tarare",1
Affoux,Restaurant Aspendos,ChIJgaARxidk9EcR8qyC9Sj6yRM,"Restaurant Turc, Restaurant Méditerranéen, Restaurant","16 Rue Anna Bibert, Tarare",1
Affoux,Megafood,ChIJTbVRzidk9EcR07hklTt-Yf8,"Restaurant De Restauration Rapide, Restaurant De Hamburgers, Kebab, Restaurant De Tacos","22 Rue Anna Bibert, Tarare",1
Affoux,Kebab Du Centre Sain Bel 100%Veau (Broche Fait Maison),ChIJD9R004H19EcREw9sQKdNV6U,Restaurant,"3 Pl. Du 8 Mai 1945, Sain-Bel",1
Affoux,La Ch' Tite Auberge,ChIJ551sZaNn9EcRBegzpFmx6VQ,"Restaurant Français, Bar","Le Bourg, Affoux",0
Affoux,Auberge De L'etang,ChIJV4JviWFd9EcRwBPYAb4J-t4,"Restaurant, Bar, Restaurant Français","L'étang, Villechenève",0
Affoux,Restaurant Loic Picamal,ChIJL9R5nmZo9EcR3na7jOXA6uk,"Restaurant Français, Restaurant Gastronomique","8 Rte Du Boussuivre, Violay",0
Affoux,À L'abri Du Vent,ChIJbx6eNpNm9EcR2IUDAKpTzNk,"Restaurant Français, Bar, Restaurant, Salon De Thé","127 Rue Centrale, Saint-Marcel-l'Éclairé",0
Affoux,L'attablee,ChIJJYGUfRZh9EcRUTuMoww-Xh0,"Restaurant, Restaurant Français","108 Rte De Pontcharra, Saint-Forgeux",0
Affoux,Tikka Restaurant Indien,ChIJv3zotINl9EcR5u6cDQcg1k8,Restaurant Indien,"34 Rue De La République, Tarare",NA
Affoux,Khao Thip D'asie,ChIJ4azqTj5b9EcRi8HoUWVEejU,Sushis À Emporter,"65 Grande Rue, Sainte-Foy-l'Argentière",NA
Affoux,Restaurant Swagath,ChIJQaxNjUKL9EcRwtTVVTiOeSk,Restaurant Indien,"22 Rue Pierre Brossolette, L'Arbresle",NA
Affoux,Yeti Sushi,ChIJb6FIMNmJ9EcRem5BIPus1bQ,Restaurant De Sushis,"307 Rte De La Vallée, Chessy",NA
Affoux,Restaurant Le Mughal,ChIJs8Dg7K5H9EcRAl4fVUiGgTk,Restaurant Indien,"7 Bis Rue De La République, Feurs",NA
Aigueperse,Le Bosphore Le Bosphore Cevik Hasan,ChIJ20xjo4iS80cRu_4mgNUdbA8,"Restaurant Turc, Restaurant De Restauration Rapide, Restaurant De Pizzas","10 Rue Centrale, La Clayette",1
Aigueperse,Restaurant Siham,ChIJXVXU8Q_r80cRm5AC4Q_X3Uc,Restaurant Halal,"3 Pl. De L'église, Charolles",1
Aigueperse,Restaurant Siham Kebab,ChIJz1jNfU7r80cRPkpRzpS7byI,Kebab,"3 Pl. De L'église, Charolles",1
Aigueperse,Restaurant Kebab D'or,ChIJy11dsCyA80cR6O7k2F03CIo,Kebab,"38 Rue De La République, Beaujeu",1
Aigueperse,Le Snack De Cours (Anciennement Pacha Kebab),ChIJiym63yR19EcRZ0pHD0tBEXo,Restaurant De Restauration Rapide,"406 Rue Georges Clemenceau, Cours",1
Aigueperse,Auberge Des Faillettes Sas Auberge Des Papillons Michelle Laforet Et Emmanuel Duclaux,ChIJwTQir2CP80cRevzvCh1AS9k,Restaurant Français,"33 Rte De Dun, Saint-Racho",0
Aigueperse,Le Giblotin,ChIJ4ZDgrRKS80cRsYt_hpwOgJI,"Restaurant, Bar, Restaurant Français","Face Eglise, Gibles",0
Aigueperse,Bistro Des Barres,ChIJcfZVjXyP80cRmD0reeBIJXs,"Restaurant Français, Restaurant","12route De Chauffailles, Saint-Igny-de-Vers",0
Aigueperse,La Table Des Amis,ChIJQ9grcvya80cR7S4RjVWqiZA,"Restaurant, Restaurant Français","3 Rue De Saint-Pierre, Matour",0
Aigueperse,Andouillette Cuisse De Grenouilles,ChIJvWU8kZyb80cRpE9Vb9IRoLE,Restaurant Français,"10 Grande Rue, Matour",0
Aigueperse,Baï Maï Thaï,ChIJfaQXXWKN80cRNczqdAdNL4Q,Restaurant Thaïlandais,"21 Pl. De L'hôtel De Ville, Chauffailles",NA
Aigueperse,Pojangmatcha Plats Corréens,ChIJnwQ51rb180cR1q9nZlnOZ5o,"Restaurant Coréen, Restaurant De Fondue Chinoise, Restaurant À Emporter","15 Michaudon, Maizilly",NA
Aigueperse,Charlieu Sushi N'co,ChIJHWYGSBv180cRGFsS16L1Rts,"Restaurant De Sushis, Sushis À Emporter","47 Rue Jean Morel, Charlieu",NA
Aigueperse,Aux Baguettes D'or,ChIJv_ODOlPd80cR1INp1ZWLUZ4,"Bar, Restaurant Vietnamien","14 Rue De La République, Paray-le-Monial",NA
Aigueperse,Sushi Daily Creches Sur Saone,ChIJxbqTYNVl80cR0ufCtWOR3hY,"Sushis À Emporter, Kiosque","Rn 6, Crêches-sur-Saône",NA
Albigny-sur-Saône,Hilal Kebab 1992,ChIJhUfibyiU9EcRvJyuEXafAX4,"Kebab, Restaurant De Restauration Rapide, Sandwicherie, Restaurant De Tacos","9 Quai Pasteur, Neuville-sur-Saône",1
Albigny-sur-Saône,Karaman Kebab,ChIJkXsVRSiU9EcR2Ilklhz0CTc,"Restaurant De Restauration Rapide, Kebab, Restaurant À Emporter, Restaurant De Pizzas, Sandwicherie","8 Rue Adrien Ducrot, Neuville-sur-Saône",1
Albigny-sur-Saône,L'ile Du Bosphore,ChIJHTokPSiU9EcRgLiz_MDlW28,"Kebab, Restaurant De Restauration Rapide, Restaurant De Pizzas","7 Rue Victor Hugo, Neuville-sur-Saône",1
Albigny-sur-Saône,Chamas Tacos® Neuville-Sur-Saône,ChIJOc4BCvGV9EcRFndO2vfjWok,"Restaurant Halal, Restaurant De Restauration Rapide, Restaurant, Restaurant De Tacos","2 Rue Camille, Neuville-sur-Saône",1
Albigny-sur-Saône,Bbm Tacos,ChIJi-UWQ7GV9EcRq4JPNbiGA8Y,"Restaurant De Restauration Rapide, Restaurant Halal, Restaurant De Hamburgers, Restaurant De Tacos","4 Rue Lefebvre, Neuville-sur-Saône",1
Albigny-sur-Saône,La Table D'albigny,ChIJ9wVYkDuU9EcRmBjgi5aNFq0,"Restaurant Français, Bistro, Restaurant Gastronomique, Restaurant Haut De Gamme Français, Restaurant","11 Pl. De Verdun, Albigny-sur-Saône",0
Albigny-sur-Saône,La Vie En Rose,ChIJxamatSWU9EcRqjjPLXDRN7k,"Restaurant, Restaurant Français","15 Quai Général De Gaulle, Albigny-sur-Saône",0
Albigny-sur-Saône,Les Planches,ChIJOckGMiWU9EcRVX_OOhCTE4g,"Restaurant, Restaurant Français, Restaurant De Fruits De Mer","16 Quai Général De Gaulle, Albigny-sur-Saône",0
Albigny-sur-Saône,Brasserie Val De Saône,ChIJs0SIEiiU9EcRZhfjeRVn__0,Brasserie,"3 Quai Pasteur, Neuville-sur-Saône",0
Albigny-sur-Saône,La Voile Verte,ChIJD5yAcEiU9EcRNHQC6A8k_Bw,"Restaurant Français, Bar","41 Av. Henri Barbusse, Albigny-sur-Saône",0
Albigny-sur-Saône,Sushi K • Neuville-Sur-Saône,ChIJSRTUNZ2W9EcRPAZ8m5RtaXE,"Restaurant Japonais, Restaurant De Sushis","8 Quai Pasteur, Neuville-sur-Saône",NA
Albigny-sur-Saône,Restaurant Le Quai D'asie,ChIJ0TJfDp2W9EcRnqFO_Unigvs,"Restaurant Vietnamien, Restaurant Asiatique, Bar, Restaurant Chinois, Restaurant","1 Quai Armand Barbès, Neuville-sur-Saône",NA
Albigny-sur-Saône,Ô Goût De L'inde,ChIJ7ygR0xOR9EcR4JAjGaY8hUs,Restaurant Indien,"1 Place Du 11 Novembre 1918, Saint-Germain-au-Mont-d'Or",NA
Albigny-sur-Saône,Weili Et Fan,ChIJVydDVP2V9EcRGLMEBYza3hM,Restaurant Mandarin,"17 Rue Pierre Bouvier, Fontaines-sur-Saône",NA
Albigny-sur-Saône,Vos Sushi,ChIJ1188KVGV9EcRrSjFjmF1nHE,Restaurant De Sushis,"10 Rue Pierre Bouvier, Fontaines-sur-Saône",NA
Alix,"Kebab, Pizza, Burger, Tacos, Café De La Mairie Anse",ChIJe_ceFJGP9EcRpC45aDTkeqU,Restaurant De Pizzas,"14 Av. De Brianne, Anse",1
Alix,Le Magnifique Kebab,ChIJzRM-htyP9EcRvfItezBElHE,"Restaurant, Restaurant Halal, Glacier, Kebab, Pâtisserie, Restaurant Turc, Restaurant Végétarien","12 Pl. De La Panneterie, Anse",1
Alix,Le Pacha Kebab,ChIJnXUDfdyP9EcRYKx0_Adx-LE,Restaurant Turc,"3 Rue Du Four Banal, Anse",1
Alix,Lozanne Tacos Burger,ChIJ5_trFK6N9EcR_GCvBqzz9fE,"Kebab, Restaurant De Restauration Rapide, Restaurant De Tacos","30 Rue Du Pont, Lozanne",1
Alix,Karaman 2,ChIJOedt7hCN9EcR-jw7zuhwInw,Restaurant Turc,"Cc Des Arcades, Civrieux-d'Azergues",1
Alix,Bistrot D'hélices,ChIJ36VfPLKJ9EcReVJxocZQGfA,"Restaurant, Bar, Bistro, Restaurant Français","494 Av. Odette Et Edouard Durand, Frontenas",0
Alix,Le Télégraphe,ChIJNyiTvPmO9EcR3QMfXOCBHw4,"Restaurant Français, Bar","100 Rue Du Ctre, Marcy",0
Alix,Auberge La Broc Assiette,ChIJoRVUK9CN9EcRKE0qsAZZfCU,"Restaurant Français, Restaurant De Cuisine Campagnarde","4 Pl. De L'église, Charnay",0
Alix,La Cantine Du Clos Saint Pierre,ChIJ6Ud9TXqO9EcRyc5vXuc3yus,Restaurant Français,"1620 Rte De Charnay, Morancé",0
Alix,Le 1217,ChIJlQLFthqJ9EcRWSD9te7Jr2g,"Restaurant Gastronomique, Restaurant Français","118 Pl. De La Mairie, Bagnols",0
Alix,Yeti Sushi,ChIJb6FIMNmJ9EcRem5BIPus1bQ,Restaurant De Sushis,"307 Rte De La Vallée, Chessy",NA
Alix,U’poke Charnay,ChIJj31Q2z2N9EcR_APsUonHe48,"Restaurant De Restauration Rapide, Restaurant Panasiatique","685 Ladry, Charnay",NA
Alix,Le B Complexe Hôtel,ChIJ4wVsyaSN9EcR8eUpMSDPIPY,"Restaurant, Bar, Planificateur D'événements, Hôtel, Restaurant De Livraison, Sushis À Emporter","37 Rue De L'entreprise, Lozanne",NA
Alix,Tandoori Masala Food Truck,ChIJH4L0CgqJ9EcRnwEd2oT8n1A,"Restaurant Indien, Restaurant De Restauration Rapide","473 Rte Des Meules, Cogny",NA
Alix,Restaurant Swagath,ChIJQaxNjUKL9EcRwtTVVTiOeSk,Restaurant Indien,"22 Rue Pierre Brossolette, L'Arbresle",NA
Ambérieux,Le Pacha Kebab,ChIJnXUDfdyP9EcRYKx0_Adx-LE,Restaurant Turc,"3 Rue Du Four Banal, Anse",1
Ambérieux,Le Magnifique Kebab,ChIJzRM-htyP9EcRvfItezBElHE,"Restaurant, Restaurant Halal, Glacier, Kebab, Pâtisserie, Restaurant Turc, Restaurant Végétarien","12 Pl. De La Panneterie, Anse",1
Ambérieux,"Kebab, Pizza, Burger, Tacos, Café De La Mairie Anse",ChIJe_ceFJGP9EcRpC45aDTkeqU,Restaurant De Pizzas,"14 Av. De Brianne, Anse",1
Ambérieux,Le Tacos Play,ChIJxXWjkWGQ9EcRt1b70uQ3-sw,"Restaurant De Restauration Rapide, Kebab, Livraison De Pizzas, Restaurant De Tacos","5 Bd De L'industrie, Trévoux",1
Ambérieux,Like Tacos,ChIJ3QF-JR6R9EcRlJrSJyV6FPg,Restaurant De Tacos,"7 Rue Du Palais, Trévoux",1
Ambérieux,Restaurant Le Jardin Gourmand ( La Vie Est Délicieuse ),ChIJU0TGni-Q9EcR7CoAdl2NeBM,"Restaurant Français, Bar, Restaurant Gastronomique, Piano-Bar","73 Rue Du Sophora, Ambérieux",0
Ambérieux,Restaurant Côté Sud,ChIJp_1hBy-Q9EcRQRrKU_SV4kM,"Restaurant Français, Restaurant","4 Rue De La Mairie, Ambérieux",0
Ambérieux,Régis Popy Chef Cuisinier Indépendant,ChIJ7-MmmYCP9EcRVTwZo7Yji8U,Restaurant Français Moderne,"Rte De Lyon, Anse",0
Ambérieux,La Villa Brasserie,ChIJZamQetyP9EcR2OHPaSjhZqQ,"Brasserie, Café, Restaurant Français","636 Rte De Lyon, Anse",0
Ambérieux,Auberge De Campagne Du Petit Veyssieux Retraite,ChIJVePtpPSQ9EcR9FsqicFEtGo,"Restaurant, Restaurant Français","Pré Petit, Quincieux",0
Ambérieux,Gold & Roll's,ChIJNasQIUCF9EcRie6t2R9t6p0,Restaurant Japonais,"136 Rue Antoine Arnaud, Villefranche-sur-Saône",NA
Ambérieux,Palais De Chine,ChIJC7B99DGF9EcRCIFLdOLu1UY,"Restaurant Chinois, Restaurant Asiatique, Restaurant Buffet, Restaurant À Emporter, Restaurant","860 Rue Ampère, Villefranche-sur-Saône",NA
Ambérieux,Maharajah - Spécialités Sri Lankaises Et Indiennes,ChIJ198U_DyF9EcRZAX5smh-fcc,Restaurant Indien,"56 Rue De Stalingrad, Villefranche-sur-Saône",NA
Ambérieux,Myss Sushi,ChIJV3k_j-ab9EcRoRAMeP6evB0,Restaurant De Sushis,"931 Rue Edouard Herriot, Jassans-Riottier",NA
Ambérieux,Fast Mahal,ChIJp32yZT2F9EcRffsAJsj6ZDk,Restaurant Indien,"129 Rue De Thizy, Villefranche-sur-Saône",NA
Amplepuis,Le Royal,ChIJ93dTrNhx9EcRJ1WPfgRTsWM,"Kebab, Restaurant De Restauration Rapide","12 B Rue Du Huit Mai 1945, Amplepuis",1
Amplepuis,Kebab L’angle,ChIJh4AIWUdz9EcRjdJMtpZf64U,"Restaurant De Restauration Rapide, Restaurant Turc","1 Rue General De Gaulle, Thizy-les-Bourgs",1
Amplepuis,Sultan Kebab,ChIJV5YP9ZRz9EcRYm3JG1NV5PQ,"Kebab, Restaurant De Restauration Rapide, Restaurant De Pizzas, Restaurant De Tacos","303 Rte De Roanne, Thizy-les-Bourgs",1
Amplepuis,Th Restauration - Café Des Touristes,ChIJaWktntoS9EcRDEBBbHMABhc,"Kebab, Restaurant De Restauration Rapide","6 N7, Saint-Symphorien-de-Lay",1
Amplepuis,Restaurant Orientale Kossaina,ChIJm0sPWcFl9EcRIYAY8X_otoc,Restaurant Halal,"34 Rue De La République, Tarare",1
Amplepuis,Le Café Du Marché,ChIJn8x81CBu9EcR3sa0cRKc61A,"Restaurant, Café, Restaurant Français","4 Pl. Chomienne, Amplepuis",0
Amplepuis,Retour Aux Sources,ChIJ9-cCzCBu9EcR54lV-Yov9PQ,"Restaurant, Bar, Restaurant Français","4 Rue Centrale, Amplepuis",0
Amplepuis,La Voisinée,ChIJ8QpuEVpw9EcRGWGEtq-dPPY,"Restaurant, Restaurant Français","69550 Ronno, Ronno",0
Amplepuis,La Guinguette - Lac Des Sapins,ChIJSVpuaVpw9EcR4OCUupQYykw,"Restaurant, Restaurant Français","La Blancherie, Ronno",0
Amplepuis,Restaurant La Mule Machezal,ChIJLQDAAMxt9EcROkCX4_JK3Js,"Restaurant, Restaurant Français","La Mule, Machézal",0
Amplepuis,Tikka Restaurant Indien,ChIJv3zotINl9EcR5u6cDQcg1k8,Restaurant Indien,"34 Rue De La République, Tarare",NA
Amplepuis,Restaurant Kim Chi,ChIJdfU1TAkP9EcR8O7m0eDp4q0,"Restaurant, Restaurant Asiatique, Restaurant Chinois, Restaurant Vietnamien","118 Av. De La Libération, Le Coteau",NA
Amplepuis,Le Raj Tandoor,ChIJDekEEqMP9EcRb2P-FBmdVGA,Restaurant Indien,"37 Rue Danielle Casanova, Roanne",NA
Amplepuis,Taste & Wok,ChIJcdhKHzUP9EcR0qMYydCrZ-Q,"Restaurant Chinois, Restaurant Japonais, Restaurant De Sushis","219 Rue De Charlieu, Roanne",NA
Amplepuis,Sando & Co Roanne,ChIJdcM3OPwP9EcR90inV90eB2Y,Restaurant Japonais,"6 Rue Francisque Rochard, Roanne",NA
Ampuis,Asmae Delices,ChIJfQ-o3scf9UcRlXkllJ5cx3E,"Restaurant, Restaurant Barbecue, Restaurant Halal","10 Rte De Condrieu, Saint-Clair-du-Rhône",1
Ampuis,Ô Pourquoi Pas Restaurant,ChIJW2RK9Z_f9EcRoiYCqyLN1T8,"Restaurant De Restauration Rapide, Restaurant Halal","84 Rd 386, Sainte-Colombe",1
Ampuis,St Clair Kebab,ChIJ85Qlzfke9UcRDFdv2r59VKQ,"Kebab, Restaurant De Restauration Rapide, Restaurant De Tacos","4 Rte De Péage, Saint-Clair-du-Rhône",1
Ampuis,Restaurant La Medina,ChIJ5Va62Kff9EcRUQSulRHszp4,Restaurant Marocain,"71 Rue De Bourgogne, Vienne",1
Ampuis,Le Plateau De Mezzé,ChIJoSJ6kwff9EcRvfPgXfOHRQg,"Restaurant Libanais, Restaurant Méditerranéen","20 Rue De La Table Ronde, Vienne",1
Ampuis,Le Bistrot À Vin De Serine,ChIJK6gA6egf9UcRCT6Lx3EBztk,"Restaurant Français, Bar, Bistro","16 Bd Des Allées, Ampuis",0
Ampuis,Café De La Poste Chez Toto,ChIJY3hcxOgf9UcRxClWjYfvahw,"Bistro, Bar","1 Bd Des Allées, Ampuis",0
Ampuis,Le Chemin Des Saveurs,ChIJRy1-wB4g9UcRCELBaIUoKKU,"Restaurant Français, Traiteur","322 Chem. Des Crozes, Reventin-Vaugris",0
Ampuis,Rad 'Up,ChIJF_pTpzcg9UcRMrjLJDmeidk,"Restaurant, Bistro","16 Rue Des Écoles, Reventin-Vaugris",0
Ampuis,La Table De Philippe Girardon,ChIJGee2cYYf9UcR5hpjPyD3Lc0,Restaurant Haut De Gamme Français,"105 Chem. Des Fontanettes, Chonas-l'Amballan",0
Ampuis,Nattaya Thai Food,ChIJvf-psVQf9UcRiX89fvcpC6M,Plats Chinois À Emporter,"1 Rue Jean Julien Chapelant, Ampuis",NA
Ampuis,Kajirō Sushi Condrieu,ChIJwUnE0RAf9UcRGu2EI1O91do,"Restaurant De Sushis, Magasin De Thé Aux Perles, Restaurant Japonais, Restaurant De Ramen, Sushis À Emporter","9 Pl. Du Marché, Condrieu",NA
Ampuis,Restaurant Vienne : Chez Thai,ChIJWUwBIqff9EcRTX3K5CjUmiQ,"Restaurant, Restaurant Asiatique, Restaurant Chinois, Plats Chinois À Emporter, Restaurant Chinois De Livraison, Restaurant De Livraison, Restaurant À Emporter, Service D'expédition, Restaurant Végétarien, Restaurant Vietnamien","26 Cr Marc-Antoine Brillier, Vienne",NA
Ampuis,Restaurant Vienne 38 : Mcthaï,ChIJM5Oau_Df9EcRAD-PgzEh20o,"Restaurant, Restaurant À Emporter, Sushis À Emporter","24 Cr Marc-Antoine Brillier, Vienne",NA
Ampuis,L'escale Indienne Vienne,ChIJLfEZQgjf9EcRJ_vmyaRhCRQ,Restaurant Indien,"14 Rue Henri Jacquier, Vienne",NA
Ancy,Kebab Du Centre Sain Bel 100%Veau (Broche Fait Maison),ChIJD9R004H19EcREw9sQKdNV6U,Restaurant,"3 Pl. Du 8 Mai 1945, Sain-Bel",1
Ancy,Sain Bel Kebab,ChIJUU2t9of0ikcRduLkrLzZkMg,"Restaurant, Restaurant De Restauration Rapide","22 Quai De La Brévenne, Sain-Bel",1
Ancy,Chem's Ii,ChIJkY5UrmmL9EcRR8ioSHx97iA,"Restaurant, Restaurant De Couscous, Restaurant À Emporter, Restaurant Marocain, Restaurant De Pizzas, Pizza À Emporter","49 Rue Gabriel Péri, L'Arbresle",1
Ancy,Tacos Et Pizzas À L'arbresle Fanzy Pizz Hamburger Tacos Sandwich,ChIJAbY2fGWL9EcR-hgBV1EcaZM,"Restaurant De Tacos, Restaurant Américain, Restaurant De Restauration Rapide, Restaurant De Hamburgers, Livraison De Pizzas, Restaurant De Pizzas, Pizza À Emporter, Sandwicherie","4 Rue De Paris, L'Arbresle",1
Ancy,Kebab De La Place,ChIJ5WbQSDOL9EcRuBxbzQ4M85k,Restaurant,"1 Pl. Sapeon, L'Arbresle",1
Ancy,Auberge La Forge,ChIJmf3rjzFg9EcR5VGGTJQ-0Do,"Restaurant, Bar, Restaurant Français","Le Bourg, Saint-Romain-de-Popey",0
Ancy,L'attablee,ChIJJYGUfRZh9EcRUTuMoww-Xh0,"Restaurant, Restaurant Français","108 Rte De Pontcharra, Saint-Forgeux",0
Ancy,Kales Beer,ChIJVfp2WfZn9EcRJ5btDm5vQh0,"Brasserie, Brasserie","66 Impasse Des Limousines, Montrottier",0
Ancy,Le Colvert,ChIJzUVNMF319EcR3s16QVJ2twU,"Restaurant, Bar, Restaurant Français, Restaurant De Pizzas","Le Bourg, Bibost",0
Ancy,Le Clos De L'abbaye De Savigny,ChIJo1_acNSK9EcRzEMm85b_6VA,"Restaurant Français, Bar","4 Rte De Sain-Bel, Savigny",0
Ancy,Restaurant Swagath,ChIJQaxNjUKL9EcRwtTVVTiOeSk,Restaurant Indien,"22 Rue Pierre Brossolette, L'Arbresle",NA
Ancy,Tikka Restaurant Indien,ChIJv3zotINl9EcR5u6cDQcg1k8,Restaurant Indien,"34 Rue De La République, Tarare",NA
Ancy,Yeti Sushi,ChIJb6FIMNmJ9EcRem5BIPus1bQ,Restaurant De Sushis,"307 Rte De La Vallée, Chessy",NA
Ancy,U’poke Charnay,ChIJj31Q2z2N9EcR_APsUonHe48,"Restaurant De Restauration Rapide, Restaurant Panasiatique","685 Ladry, Charnay",NA
Ancy,Le B Complexe Hôtel,ChIJ4wVsyaSN9EcR8eUpMSDPIPY,"Restaurant, Bar, Planificateur D'événements, Hôtel, Restaurant De Livraison, Sushis À Emporter","37 Rue De L'entreprise, Lozanne",NA
Anse,Le Magnifique Kebab,ChIJzRM-htyP9EcRvfItezBElHE,"Restaurant, Restaurant Halal, Glacier, Kebab, Pâtisserie, Restaurant Turc, Restaurant Végétarien","12 Pl. De La Panneterie, Anse",1
Anse,Le Pacha Kebab,ChIJnXUDfdyP9EcRYKx0_Adx-LE,Restaurant Turc,"3 Rue Du Four Banal, Anse",1
Anse,"Kebab, Pizza, Burger, Tacos, Café De La Mairie Anse",ChIJe_ceFJGP9EcRpC45aDTkeqU,Restaurant De Pizzas,"14 Av. De Brianne, Anse",1
Anse,La Calade Gourmande,ChIJ1aGORkCF9EcRqk3N9FG4U4M,"Restaurant De Restauration Rapide, Restaurant Italien, Kebab, Restaurant De Pizzas, Restaurant, Restaurant De Tacos","84 Rue Henri Depagneux, Limas",1
Anse,Campus Kebab Grill,ChIJlaslGQCF9EcRFCzDxbROgwM,Restaurant Turc,"84 Rue Henri Depagneux, Limas",1
Anse,La Villa Brasserie,ChIJZamQetyP9EcR2OHPaSjhZqQ,"Brasserie, Café, Restaurant Français","636 Rte De Lyon, Anse",0
Anse,Voulez-Vous,ChIJQzmeFOiP9EcR0-Yji9sOks4,"Restaurant, Dîner, Dîner-Théâtre, Lieu De L'événement, Restaurant Français, Théâtre Des Arts De La Scène, Club De Cabaret, Séminaire","181 Av. Du Général Leclerc, Anse",0
Anse,Régis Popy Chef Cuisinier Indépendant,ChIJ7-MmmYCP9EcRVTwZo7Yji8U,Restaurant Français Moderne,"Rte De Lyon, Anse",0
Anse,Restaurant Au Colombier,ChIJ5SJnBOSP9EcRTSx5_gwblWc,"Restaurant, Bar, Restaurant Français, Restaurant Haut De Gamme Français","126 All. Du Colombier, Anse",0
Anse,La Table De Lachassagne,ChIJr9dEJ7CP9EcRXz0TgOLo3mQ,Restaurant Gastronomique,"850 Rte De La Colline, Lachassagne",0
Anse,Gold & Roll's,ChIJNasQIUCF9EcRie6t2R9t6p0,Restaurant Japonais,"136 Rue Antoine Arnaud, Villefranche-sur-Saône",NA
Anse,Maharajah - Spécialités Sri Lankaises Et Indiennes,ChIJ198U_DyF9EcRZAX5smh-fcc,Restaurant Indien,"56 Rue De Stalingrad, Villefranche-sur-Saône",NA
Anse,Fast Mahal,ChIJp32yZT2F9EcRffsAJsj6ZDk,Restaurant Indien,"129 Rue De Thizy, Villefranche-sur-Saône",NA
Anse,Espace Asie Restaurant Thaïlandais & Laotien,ChIJwR1AZD2F9EcRqPkUqvtgjWA,"Restaurant Laotien, Restaurant Asiatique, Restaurant Thaïlandais","137 Rue De Thizy, Villefranche-sur-Saône",NA
Anse,Orijines,ChIJs4pyy8eF9EcRylMMUsOM1zs,Restaurant De Fusion Asiatique,"216 Rue De Thizy, Villefranche-sur-Saône",NA
L'Arbresle,Les Délices Restaurant,ChIJxRFmd2WL9EcRL3CKH6pR8CM,"Restaurant De Pizzas, Restaurant De Restauration Rapide, Restaurant De Hamburgers, Restaurant, Restaurant De Tacos","14 Rue Des 3 Maures, L'Arbresle",1
L'Arbresle,Chem's Ii,ChIJkY5UrmmL9EcRR8ioSHx97iA,"Restaurant, Restaurant De Couscous, Restaurant À Emporter, Restaurant Marocain, Restaurant De Pizzas, Pizza À Emporter","49 Rue Gabriel Péri, L'Arbresle",1
L'Arbresle,Kebab De La Place,ChIJ5WbQSDOL9EcRuBxbzQ4M85k,Restaurant,"1 Pl. Sapeon, L'Arbresle",1
L'Arbresle,Royal Snack,ChIJA97Mk2WL9EcRdY6ogY0n7GE,"Restaurant De Restauration Rapide, Restaurant De Hamburgers, Kebab, Restaurant À Emporter, Restaurant De Pizzas, Restaurant, Restaurant De Tacos, Restaurant Végétalien","20 Rue Pierre Brossolette, L'Arbresle",1
L'Arbresle,Tacos Et Pizzas À L'arbresle Fanzy Pizz Hamburger Tacos Sandwich,ChIJAbY2fGWL9EcR-hgBV1EcaZM,"Restaurant De Tacos, Restaurant Américain, Restaurant De Restauration Rapide, Restaurant De Hamburgers, Livraison De Pizzas, Restaurant De Pizzas, Pizza À Emporter, Sandwicherie","4 Rue De Paris, L'Arbresle",1
L'Arbresle,Les Gourmands Disent,ChIJs-ssk2WL9EcRHE4NEkwA7hI,"Restaurant, Bar, Restaurant Français, Salon De Thé","L, L'Arbresle",0
L'Arbresle,Motel - Bistro&Club,ChIJmRHaMaeL9EcRkBM7PTgAaJs,"Bistro, Club, Hôtel, Restaurant","394 Rte De Sain-Bel, L'Arbresle",0
L'Arbresle,Le Matisse,ChIJp-YD10aL9EcRMjwlcHVoRcU,"Restaurant, Restaurant Français","Rue Des Martinets, L'Arbresle",0
L'Arbresle,Bon Truc D'ici,ChIJD3F6DkeL9EcRkbhvh2AD9Dk,"Restaurant, Bistro, Restaurant Français","1560 Rue Claude Terrasse, L'Arbresle",0
L'Arbresle,Brasserie Prisca,ChIJzX4UrWmL9EcRbavHn6Jd7mw,"Brasserie, Brasserie","6 Chemin Neuf, Sain-Bel",0
L'Arbresle,Restaurant Swagath,ChIJQaxNjUKL9EcRwtTVVTiOeSk,Restaurant Indien,"22 Rue Pierre Brossolette, L'Arbresle",NA
L'Arbresle,U’poke Charnay,ChIJj31Q2z2N9EcR_APsUonHe48,"Restaurant De Restauration Rapide, Restaurant Panasiatique","685 Ladry, Charnay",NA
L'Arbresle,Yeti Sushi,ChIJb6FIMNmJ9EcRem5BIPus1bQ,Restaurant De Sushis,"307 Rte De La Vallée, Chessy",NA
L'Arbresle,Le B Complexe Hôtel,ChIJ4wVsyaSN9EcR8eUpMSDPIPY,"Restaurant, Bar, Planificateur D'événements, Hôtel, Restaurant De Livraison, Sushis À Emporter","37 Rue De L'entreprise, Lozanne",NA
L'Arbresle,Sushi Kimchi À La-Tour-De-Salvagny (69890),ChIJ_QysvkmT9EcRHJNztNzS1as,"Restaurant De Sushis, Restaurant À Emporter","6a Av. De L'hippodrome, La Tour-de-Salvagny",NA
Les Ardillats,Restaurant Kebab D'or,ChIJy11dsCyA80cR6O7k2F03CIo,Kebab,"38 Rue De La République, Beaujeu",1
Les Ardillats,Golden Kebab,ChIJkbG4Qb5980cRC-L_unzSBJI,Kebab,"127 Rue Pasteur, Villié-Morgon",1
Les Ardillats,Jamelino's,ChIJn7y10ZB980cRyVWeSwNYd5g,"Pizza À Emporter, Restaurant De Hamburgers, Restaurant De Tacos","20 Rue Baudelaire, Villié-Morgon",1
Les Ardillats,Kebab Factory,ChIJ6TwYNaCB9EcR45OdJvEC_Pk,Restaurant De Restauration Rapide,"360 Rue Du Beaujolais, Saint-Étienne-des-Oullières",1
Les Ardillats,Zozan,ChIJdU018GF980cRpMAKJ7PU70c,"Restaurant, Kebab","4 Rue Marechal Foch, Belleville-en-Beaujolais",1
Les Ardillats,Le Bouchon En Beaujolais,ChIJd2yJavF_9EcRX5KOCa3FYp4,Restaurant Français,"5 Place De L'église, Saint-Didier-sur-Beaujeu",0
Les Ardillats,Le Retinton,ChIJfcvdtSyA80cR13rrt-Hvlq4,Restaurant Français,"19 Pl. De La Liberté, Beaujeu",0
Les Ardillats,Chez Annette,ChIJXYPSydyG80cROd4WlpjPLTw,"Restaurant, Restaurant Français","7 Pl. Ganelon, Chénelette",0
Les Ardillats,Ema Restaurant,ChIJd_cJUbN580cR611PJ9n7yR8,Restaurant Français,"168 Route Du Fût D'avenas, Deux-Grosnes",0
Les Ardillats,La Terrasse Du Beaujolais,ChIJP0LhTzJ_80cRGP98-uLGLoo,Restaurant Français,"1819 Route D'avenas, Chiroubles",0
Les Ardillats,Tandori Massala,ChIJmeKAqVSB9EcRv1SQ0GlWvc0,Restaurant Indien,"69460 Saint-Étienne-Des-Oullières, Saint-Étienne-des-Oullières",NA
Les Ardillats,Star Sushi,ChIJG1fKLkB980cRgjZklUxCrHc,"Sushis À Emporter, Restaurant Asiatique, Restaurant Japonais, Restaurant Sri-Lankais","11 Imp. Edith Piaf, Belleville-en-Beaujolais",NA
Les Ardillats,Baï Maï Thaï,ChIJfaQXXWKN80cRNczqdAdNL4Q,Restaurant Thaïlandais,"21 Pl. De L'hôtel De Ville, Chauffailles",NA
Les Ardillats,Bar À Cocktails & Restaurant Indian Garden,ChIJ1cO4vjB980cRFRH4ZCKQRaQ,Restaurant Indien,"27 Rue De Bourgogne, Belleville-en-Beaujolais",NA
Les Ardillats,Namtha Foodtruck,ChIJ53BaCv1980cRHpgDpZ4DiYs,Restaurant Asiatique,"Rue Marechal Foch, Belleville-en-Beaujolais",NA
Arnas,Anatolie Kebab Villefranche,ChIJecEO9CGF9EcRyWmBNLfLZnM,"Restaurant Turc, Restaurant Méditerranéen","39 Rue Charles Germain, Villefranche-sur-Saône",1
Arnas,Le Mezre,ChIJvWBMDCOF9EcR9QTFFt0Md-E,"Restaurant Turc, Kebab, Restaurant À Emporter, Restaurant Végétarien","132 Rue Des Fayettes, Villefranche-sur-Saône",1
Arnas,Prince Burger,ChIJqTqTxbWF9EcRIPq_LQlR0Ds,Restaurant Halal,"11 Rue Des Marais, Villefranche-sur-Saône",1
Arnas,L'imperial,ChIJ0fDOHCWF9EcR1qTA9MT5ccM,"Restaurant De Restauration Rapide, Restaurant De Tacos","259 Rue De La Quarantaine, Villefranche-sur-Saône",1
Arnas,Chicken Street Villefranche Naan & Fried Chicken,ChIJ5b_t1NSF9EcRvGQ__B2YTlQ,"Restaurant Halal, Restaurant De Poulet, Restaurant D'ailes De Poulet, Restaurant Familial, Poulet Frit À Emporter, Restaurant De Hamburgers, Restaurant De Livraison, Restaurant","Rue De La Quarantaine, Villefranche-sur-Saône",1
Arnas,L'assiette Buissonnière,ChIJkbOwgMKE9EcRxtXWhyKmHsk,"Restaurant, Restaurant Français","1051 Route Nationale 6, Arnas",0
Arnas,Restaurant Les Sarments,ChIJ48I9zYiE9EcRPS6n18SrqbE,"Restaurant Français, Restaurant Haut De Gamme Français","Place Sarments, Arnas",0
Arnas,Le Bistrot D'arnas,ChIJw3U3zIiE9EcRIbPHaxu4u2Y,"Bistro, Restaurant Français","2052-2102, Arnas",0
Arnas,L'ave Maria,ChIJPYw1Z92E9EcR2P9rORb9uiU,"Restaurant, Restaurant Français","D686, Arnas",0
Arnas,Distillerie Caladoise,ChIJrT741r6F9EcR9TSD73sC51o,"Brasserie, Distillerie","192 Rte De La Grange Perret, Arnas",0
Arnas,L' Ambrasie,ChIJLXuLoVKF9EcRMBiuLZKH7EA,"Restaurant Asiatique, Traiteur","62 All. D'ouilly, Gleizé",NA
Arnas,Restaurant Kashia,ChIJY76dja6F9EcRvAjTvuUWO-s,Restaurant Asiatique,"191 Rue De Belleville, Villefranche-sur-Saône",NA
Arnas,So'hasia Traiteur Asiatique,ChIJK2SttCGF9EcRYioJj7JCDlU,"Traiteur, Restaurant Asiatique","49 Rue Nationale, Villefranche-sur-Saône",NA
Arnas,Sushi Frais,ChIJ5foaYSKF9EcRCu6X8JaFqHs,Restaurant Japonais,"60 Rue Dechavanne, Villefranche-sur-Saône",NA
Arnas,Sushi Académie,ChIJV7LM8BeF9EcRnmV4DtHygu8,Restaurant Japonais,"54 Rue De La Paix, Villefranche-sur-Saône",NA
