respondent.commune,business_name,place_id,fr_categories,business_address,treatment_arm
56197,Aux Saveurs D'asie,ChIJfzqc11WvD0gRUXCHQ-QEofo,"Restaurant, Restaurant Asiatique","3 Rue Saint-Gurval, Guer",NA
56197,Gohan,ChIJA2cjwOujD0gR02Ea03pyG2c,"Restaurant, Restaurant Japonais","2 Ter, La Gacilly",NA
56198,Délice Kebab,ChIJKR5hu9fXEUgR_M0M15eM6jA,Kebab,"13 Rue De Pontivy, Loudéac",1
56198,Crok'saveur,ChIJU4CkHSgoDkgRORjXjFRaCHg,"Restaurant, Bar, Café, Restaurant De Restauration Rapide, Restaurant À Emporter, Pâtisserie, Sandwicherie, Restaurant De Coupes Glacées, Restaurant De Tacos","10 Place Notre Dame, Loudéac",1
56198,L'escale A Pizza & Kebab Loudeac,ChIJCQLGpRrXEUgRMkAZ2uY7umk,Restaurant,"12 Rue Notre Dame, Loudéac",1
56198,Star Kebab,ChIJC4mNvNnXEUgR--FHzbBFtSU,"Kebab, Restaurant De Restauration Rapide","21 Rue De Moncontour, Loudéac",1
56198,Le Marrakech Breizh,ChIJT0osDeLMEUgRTvx0cyjI79g,"Restaurant Marocain, Restaurant","25 Rue De Lourmel, Pontivy",1
56198,L'eau D'oust,ChIJhR7Q-mXVEUgRNJ5z96QDiyc,Restaurant Français,"6 Rue Du Lac, Rohan",0
56198,La Gavotte,ChIJtzDgymfVEUgRRPxWZ4OEVms,"Crêperie, Restaurant Français","4bis Pl. De La Mairie, Rohan",0
56198,La Canotière 59,ChIJ5T8CiqjVEUgRtxEwcVPjko4,Crêperie,"1 Boju, Gueltas",0
56198,Guillo Olivier,ChIJRbBiJsfVEUgR_kTgQBBzDcw,"Restaurant, Restaurant Français","Rue Principale, Saint-Maudan",0
56198,La Clochette,ChIJhYYlMsQqEEgRHvP4IVf8yOI,Restaurant Français,"43 Rue Saint-Yves, Crédin",0
56198,Koemi Sushi (Food Truck),ChIJLz6eYCYpDkgRWanqWuZ6nBo,"Restaurant De Sushis, Restaurant Japonais, Sushis À Emporter","France, Saint-Barnabé",NA
56198,Hong Kong Moon,ChIJY4xYlALNEUgREONDM1bsL34,"Restaurant, Restaurant Thaïlandais, Restaurant Traditionnel","14 Rue Du Général De Gaulle, Pontivy",NA
56198,Taj Mahal,ChIJBXCoJHTNEUgR49wSv4myjQ8,Restaurant Indien,"42 Rue Du Fil, Pontivy",NA
56198,La Lanterne Rouge,ChIJc5R04NQyEEgRH4Pv2P-wKOI,"Restaurant Chinois, Restaurant De Restauration Rapide","Rue Joseph Quilliou, Saint-Thuriau",NA
56198,Mr Nguyen,ChIJM1pAM7QvDkgRcERpZBcNzZM,"Restaurant, Restaurant Vietnamien","15 Rue De Rennes, Plémet",NA
56199,Kebab De La Gare Gourin,ChIJofeL-3kFEUgRoTEMH6Wn-LA,Restaurant De Restauration Rapide,"2 Rue De La Gare, Gourin",1
56199,Gueho Kebab Family,ChIJ___rfP4EEUgRdHVfgM-LvuI,Restaurant,"2 Rue De La Gare, Gourin",1
56199,Aux Trois Saveurs Pizzas,ChIJnfiqLDodEUgR9fzAosRp1po,"Livraison De Pizzas, Restaurant De Restauration Rapide, Kebab, Restaurant De Tacos","65 Rue Jean Jaurès, Scaër",1
56199,Kebabacool,ChIJz56qp8kdEUgRpzglfLXiJ_s,"Restaurant De Restauration Rapide, Service D'expédition","72 Rue Jean Jaurès, Scaër",1
56199,Kardelen Kebab,ChIJd6i3DogdEUgRl4PZPfRDMB8,Restaurant,"1 Pl. De La Libération, Scaër",1
56199,Le Bienvenue,ChIJl3HVzccbEUgRaVNPQouDiTE,"Restaurant, Restaurant Français","84 Rue Nicolas Le Grand, Roudouallec",0
56199,Ty Louët Leuhan,ChIJ-U5aydYeEUgRAQMm6JMqfj4,"Restaurant, Bar, Restaurant Français","Za De Ty Louet, Leuhan",0
56199,Le Tumulus Bar / Bistro À Leuhan,ChIJuWLif8wZEUgRthFnRuA5hB4,"Bar, Bar À Tabac, Bistro","7 Pl. De L'église, Leuhan",0
56199,Creperie De Pont Min,ChIJ5c6VKOIEEUgRoXY2g_Xp4zg,"Crêperie, Restaurant","2 Rue De Pont Min, Gourin",0
56199,La Table De Morvan À Gourin(56),ChIJwdFulvwEEUgRMEH7QSjQFFY,Restaurant Français,"41 Rue Jacques Rodallec, Gourin",0
56199,Karaez Thaï Food,ChIJnzoWIQkMEUgRgNvqGNPOP8I,Restaurant Thaïlandais,"8 Rue Brizeux, Carhaix-Plouguer",NA
56199,Au Petit Viet Linh,ChIJbY_i9vYLEUgRnMZCHOTc_Lc,Restaurant Vietnamien,"16 Av. Du Général De Gaulle, Carhaix-Plouguer",NA
56199,Matin Calme,ChIJPZfPsBMLEUgRFui6umpjwYU,Restaurant Coréen,"26 Av. Du Général De Gaulle, Carhaix-Plouguer",NA
56199,Dragon D'asie,ChIJqa70q_ELEUgRTll_syhUVH0,"Restaurant, Restaurant Asiatique, Restaurant Chinois","24 Av. Victor Hugo, Carhaix-Plouguer",NA
56199,Thai Kitchen,ChIJpwIKu2MlEUgRHMFRVFrpmNQ,"Restaurant, Restaurant Du Déjeuner, Restaurant Thaïlandais","10 Rue Laennec, Briec",NA
56200,Chez Tonton56,ChIJAUZl94O_D0gRSOGx9xy6WzE,Kebab,"14 Rue Des Ponts, Malestroit",1
56200,Raoul Restauration,ChIJvddGyrDAD0gRHyDMs0V6DvE,"Pizza À Emporter, Restaurant De Hamburgers, Kebab, Restaurant De Pizzas, Magasin De Salades","17bis Pl. Du Dr Jean Queinnec, Malestroit",1
56200,Le Kebab'a,ChIJV-ZuikGiD0gRrbeCVDwHtls,Restaurant,"Pl. Yves Rocher, La Gacilly",1
56200,Médenine Saveurs,ChIJRfiEHVHJD0gRFTesbgOYLgU,Kebab,"7 Rue René Marie Gaillard, Ploërmel",1
56200,Délices Kebab,ChIJRQztakrID0gRWp59eJtnFSE,"Kebab, Restaurant De Restauration Rapide","30 Rue De La Gare, Ploërmel",1
56200,La Bonne Rencontre À Treal,ChIJn8BgFAC7D0gRLUmKblZgK8U,"Restaurant, Restaurant Français","Rue Du Moulin, Tréal",0
56200,Crêperie La Galette Rieuse,ChIJGz3rsr-4D0gRUXFnR45xfYU,"Crêperie, Restaurant Français","2 Rue Jacques Bonsergent, Missiriac",0
56200,Le Vieux Lierre,ChIJKWWt5P26D0gR4y0NEP50KZI,"Restaurant, Magasin De Bière, Restaurant Français, Restaurant Traditionnel, Bar À Vin","7 Rte De Vannes, Réminiac",0
56200,La Riv’ Reine,ChIJqZJpsD3BD0gR-Qr8EOFBxFo,Crêperie,"35 Fbg De La Madeleine, Malestroit",0
56200,Restaurant Du Corps De Garde,ChIJvYJ_fLDAD0gRjvmSkhO-xJU,Restaurant Français Moderne,"4 Rue Du Général De Gaulle, Malestroit",0
56200,Gohan,ChIJA2cjwOujD0gR02Ea03pyG2c,"Restaurant, Restaurant Japonais","2 Ter, La Gacilly",NA
56200,Le Mékong,ChIJNX0HOjTID0gR4qGPDM_eXjI,"Restaurant Mandarin, Restaurant De Fondue Chinoise, Restaurant Thaïlandais","4 Rue Alphonse Guérin, Ploërmel",NA
56200,Perle D'asie,ChIJcXZbDUrID0gRI4PdxVvNNbo,"Restaurant Vietnamien, Restaurant Asiatique, Restaurant Chinois, Restaurant, Restaurant D'asie Du Sud-Est, Restaurant Thaïlandais","87 Rue De La Gare, Ploërmel",NA
56200,Aux Saveurs D'asie,ChIJfzqc11WvD0gRUXCHQ-QEofo,"Restaurant, Restaurant Asiatique","3 Rue Saint-Gurval, Guer",NA
56200,Toko Sushi 56,ChIJa2r7a4fED0gRO4O0H01URD8,Restaurant De Sushis,"21 Rue Louise Michel, Sérent",NA
56201,Kebab De La Gare Gourin,ChIJofeL-3kFEUgRoTEMH6Wn-LA,Restaurant De Restauration Rapide,"2 Rue De La Gare, Gourin",1
56201,Gueho Kebab Family,ChIJ___rfP4EEUgRdHVfgM-LvuI,Restaurant,"2 Rue De La Gare, Gourin",1
56201,Elif Kebab,ChIJo2JlKgABEUgRP6QIRsXprCQ,Restaurant Turc,"1 Pl. Bellanger, Le Faouët",1
56201,O'53,ChIJHdq6nIkBEUgRXZ_cTQQQ_O0,Restaurant De Tacos,"1 Pl. Bellanger, Le Faouët",1
56201,Kebabacool,ChIJz56qp8kdEUgRpzglfLXiJ_s,"Restaurant De Restauration Rapide, Service D'expédition","72 Rue Jean Jaurès, Scaër",1
56201,Ar Gavotenn,ChIJfQn2lREEEUgR1xWx6HYAdb4,"Restaurant, Magasin De Bière, Restaurant De Petit-Déjeuner, Bar À Cocktails, Restaurant Français, Restaurant Du Déjeuner, Restaurant Traditionnel, Bar À Vin","Bouthiry, Le Saint",0
56201,Creperie Du Roi,ChIJNVea6PMFEUgR4aUqW8bCNgE,"Restaurant, Crêperie","8 Rue Jacques Rodallec, Gourin",0
56201,La Table De Morvan À Gourin(56),ChIJwdFulvwEEUgRMEH7QSjQFFY,Restaurant Français,"41 Rue Jacques Rodallec, Gourin",0
56201,Au Gré Du Temps,ChIJYQ1ehdIAEUgRlLgZG9w2cSw,Restaurant Français,"30 Rue Abatti Zu, Langonnet",0
56201,Crêperie Mahé,ChIJE6H5_fwEEUgRxhBM1rtaMhg,Crêperie,"11 Rue Famille Bouchard, Gourin",0
56201,Dragon D'asie,ChIJqa70q_ELEUgRTll_syhUVH0,"Restaurant, Restaurant Asiatique, Restaurant Chinois","24 Av. Victor Hugo, Carhaix-Plouguer",NA
56201,Matin Calme,ChIJPZfPsBMLEUgRFui6umpjwYU,Restaurant Coréen,"26 Av. Du Général De Gaulle, Carhaix-Plouguer",NA
56201,Karaez Thaï Food,ChIJnzoWIQkMEUgRgNvqGNPOP8I,Restaurant Thaïlandais,"8 Rue Brizeux, Carhaix-Plouguer",NA
56201,Au Petit Viet Linh,ChIJbY_i9vYLEUgRnMZCHOTc_Lc,Restaurant Vietnamien,"16 Av. Du Général De Gaulle, Carhaix-Plouguer",NA
56201,Bionems,ChIJ12lYqC77EEgRiE7cYywN3-c,"Restaurant Vietnamien, Restaurant De Fondue Chinoise, Restaurant Bio","52 Rue De Pont-Aven, Quimperlé",NA
56202,Raoul Restauration,ChIJvddGyrDAD0gRHyDMs0V6DvE,"Pizza À Emporter, Restaurant De Hamburgers, Kebab, Restaurant De Pizzas, Magasin De Salades","17bis Pl. Du Dr Jean Queinnec, Malestroit",1
56202,Chez Tonton56,ChIJAUZl94O_D0gRSOGx9xy6WzE,Kebab,"14 Rue Des Ponts, Malestroit",1
56202,Médenine Saveurs,ChIJRfiEHVHJD0gRFTesbgOYLgU,Kebab,"7 Rue René Marie Gaillard, Ploërmel",1
56202,Délices Kebab,ChIJRQztakrID0gRWp59eJtnFSE,"Kebab, Restaurant De Restauration Rapide","30 Rue De La Gare, Ploërmel",1
56202,O'delices Tacos,ChIJoaIg_kLJD0gREx6cuxA-xuk,"Restaurant, Magasin De Bière, Boutique De Beignets, Restaurant Halal, Glacier, Restaurant Du Déjeuner, Restaurant Mexicain, Restaurant Végétarien","60 Rue De La Gare, Ploërmel",1
56202,La Taverne De L'oust,ChIJc4bcYl3GD0gROLhGWLxS7QE,"Restaurant, Bar, Restaurant Français","27 Av. Des Frères Rey, Val d'Oust",0
56202,L'écluse,ChIJg6-PJDTGD0gROYmMG0sN7bk,"Restaurant, Bar, Restaurant Français","7 Rue De L'oust, Montertelot",0
56202,Crêperie O'délices De So,ChIJcQ_HVR65D0gRJUdue7sqVPA,Crêperie,"2 Rue Des Primevères, Ploërmel",0
56202,Restaurant - Bar - Tabac Le D8,ChIJ81n6kRS4D0gR3MZpfPCljbg,"Gastro-Pub, Bar, Restaurant Français, Restaurant","6 Rue Des Cerisiers, Ploërmel",0
56202,Crêperie La Galette Rieuse,ChIJGz3rsr-4D0gRUXFnR45xfYU,"Crêperie, Restaurant Français","2 Rue Jacques Bonsergent, Missiriac",0
56202,Toko Sushi 56,ChIJa2r7a4fED0gRO4O0H01URD8,Restaurant De Sushis,"21 Rue Louise Michel, Sérent",NA
56202,Le Mékong,ChIJNX0HOjTID0gR4qGPDM_eXjI,"Restaurant Mandarin, Restaurant De Fondue Chinoise, Restaurant Thaïlandais","4 Rue Alphonse Guérin, Ploërmel",NA
56202,Perle D'asie,ChIJcXZbDUrID0gRI4PdxVvNNbo,"Restaurant Vietnamien, Restaurant Asiatique, Restaurant Chinois, Restaurant, Restaurant D'asie Du Sud-Est, Restaurant Thaïlandais","87 Rue De La Gare, Ploërmel",NA
56202,Aux Saveurs D'asie,ChIJfzqc11WvD0gRUXCHQ-QEofo,"Restaurant, Restaurant Asiatique","3 Rue Saint-Gurval, Guer",NA
56202,Gohan,ChIJA2cjwOujD0gR02Ea03pyG2c,"Restaurant, Restaurant Japonais","2 Ter, La Gacilly",NA
56203,Anatolie Kebab,ChIJKTlfzmLPEUgRLzAbA4IWPrM,Restaurant De Restauration Rapide,"5 Rue De La Gare, Guerlédan",1
56203,O Baba Pondi,ChIJ6T-ianXNEUgRkDt5ZFffSvs,"Restaurant Turc, Restaurant De Restauration Rapide","13 Rue Du Pont, Pontivy",1
56203,Royal Kebab Pontivy,ChIJEbymO-LMEUgR9TQBI1KsO1c,"Restaurant, Restaurant Familial, Restaurant De Restauration Rapide","37 Rue Du Pont, Pontivy",1
56203,Kebab Tacos Burgers Öndergroünd (Halal Meat),ChIJA8pLeKDNEUgR9YRIpz4T7HM,"Kebab, Gril, Restaurant De Kebab Doner, Magasin De Salades, Sandwicherie, Restaurant De Tacos","8 Pl. Du Martray, Pontivy",1
56203,Restaurant Couscousserie Cherazade,ChIJ29QSfarNEUgRBETIIreyaGg,"Restaurant, Restaurant Marocain","15 Pl. Anne De Bretagne, Pontivy",1
56203,Les Pêcheries De Guerlédan,ChIJhYyqjknPEUgRPw5UmO7u550,"Restaurant Français, Bar","2 Rue De La Mairie, Saint-Aignan",0
56203,Le Black Dog | Hotel | Pub | Restaurant,ChIJC4kuXY_JEUgRe7Sf2FLQwYo,"Restaurant, Bar Et Grill, Hôtel","15 Rue Du Blavet, Saint-Aignan",0
56203,Epicerie Bar Creperie Le Saint Aign,ChIJlbEpaEzPEUgRrkT8hzKcsPk,"Crêperie, Restaurant Français, Restaurant À Emporter","Guerledan, Saint-Aignan",0
56203,R1.Crepes,ChIJwwuXxTjPEUgRTv-9fEzchBE,Crêperie,"104 Rue Du Lac, Guerlédan",0
56203,Les Vedettes De Guerlédan Restaurant L'embarcadère,ChIJnR78WCLGEUgRV6PCBwsiFLc,"Restaurant, Bar, Café, Restaurant Français","Beau Rivage, Caurel",0
56203,Hong Kong Moon,ChIJY4xYlALNEUgREONDM1bsL34,"Restaurant, Restaurant Thaïlandais, Restaurant Traditionnel","14 Rue Du Général De Gaulle, Pontivy",NA
56203,Taj Mahal,ChIJBXCoJHTNEUgR49wSv4myjQ8,Restaurant Indien,"42 Rue Du Fil, Pontivy",NA
56203,La Lanterne Rouge,ChIJc5R04NQyEEgRH4Pv2P-wKOI,"Restaurant Chinois, Restaurant De Restauration Rapide","Rue Joseph Quilliou, Saint-Thuriau",NA
56203,Koemi Sushi (Food Truck),ChIJLz6eYCYpDkgRWanqWuZ6nBo,"Restaurant De Sushis, Restaurant Japonais, Sushis À Emporter","France, Saint-Barnabé",NA
56203,Mr Nguyen,ChIJM1pAM7QvDkgRcERpZBcNzZM,"Restaurant, Restaurant Vietnamien","15 Rue De Rennes, Plémet",NA
56204,Délices Pizza Locminé,ChIJZzoRMiElEEgR5mfbR8ZWrHw,"Restaurant De Pizzas, Service De Livraison D'épicerie, Kebab, Restaurant De Livraison, Livraison De Pizzas, Pizza À Emporter, Restaurant, Sandwicherie, Restaurant De Tacos","16 Rue Olivier De Clisson, Locminé",1
56204,Aux Délices Kebab,ChIJu2AEBxYlEEgRugvF9cBPqE8,Kebab,"21 Rue Chateaubriand, Locminé",1
56204,Pacha Kebab,ChIJ74VGH2AvEEgRx6roctppM7E,"Kebab, Restaurant De Restauration Rapide","8 Rue Auguste Brizeux, Locminé",1
56204,Anatolie Kebab,ChIJO5qMkBnOD0gRynyL62SKe4U,"Restaurant Turc, Restaurant De Restauration Rapide","40 Rue Saint-Jacques, Josselin",1
56204,Kebab D'or,ChIJHxWuENo5EEgRnCDApAhVAIM,"Restaurant Turc, Restaurant De Restauration Rapide, Kebab","17 Rue De Pontivy, Baud",1
56204,Le Nord Ouest,ChIJyYb2-i0mEEgRZ-xq1sObays,Restaurant Français,"7 Rue Georges Cadoudal, Bignan",0
56204,Entre Terre Et Mer,ChIJ9WqOi_zWD0gRVriDB_SsK5o,"Restaurant, Restaurant Français","5 Rue Georges Grignon, Buléon",0
56204,Le 6,ChIJ29mxwYcnEEgReattpAucOoA,"Restaurant, Bar, Bistro, Restaurant Brunch","6 Rue Georges Cadoudal, Bignan",0
56204,Le Faisan Doré,ChIJdV_Jqy0vEEgRp3jzLzmvb48,"Restaurant Français, Bar","15 Rue De La Madeleine, Moréac",0
56204,Auberge De Kermarquer,ChIJceVAaqAnEEgRUyOqyFooNvg,"Hôtel, Crêperie","56660 Saint-Jean-Brévelay, Saint-Jean-Brévelay",0
56204,Toko Sushi 56,ChIJa2r7a4fED0gRO4O0H01URD8,Restaurant De Sushis,"21 Rue Louise Michel, Sérent",NA
56204,La Lanterne Rouge,ChIJc5R04NQyEEgRH4Pv2P-wKOI,"Restaurant Chinois, Restaurant De Restauration Rapide","Rue Joseph Quilliou, Saint-Thuriau",NA
56204,Perle D'asie,ChIJcXZbDUrID0gRI4PdxVvNNbo,"Restaurant Vietnamien, Restaurant Asiatique, Restaurant Chinois, Restaurant, Restaurant D'asie Du Sud-Est, Restaurant Thaïlandais","87 Rue De La Gare, Ploërmel",NA
56204,Le Mékong,ChIJNX0HOjTID0gR4qGPDM_eXjI,"Restaurant Mandarin, Restaurant De Fondue Chinoise, Restaurant Thaïlandais","4 Rue Alphonse Guérin, Ploërmel",NA
56204,Taj Mahal,ChIJBXCoJHTNEUgR49wSv4myjQ8,Restaurant Indien,"42 Rue Du Fil, Pontivy",NA
56205,Prestige Doner Kebab,ChIJtQdvrbkdEEgR7MmED-i24PQ,Restaurant,"5 Av. De Penhoët, Séné",1
56205,Theix Food,ChIJp7xDj7PjD0gRva9nz-9iM9M,"Kebab, Restaurant De Restauration Rapide, Restaurant À Emporter, Restaurant","9 Rue Des Sports, Theix-Noyalo",1
56205,Kebab La Broche Orientale,ChIJBX9Wb47jD0gR2OcqpaysXvE,"Kebab, Épicerie Fine, Restaurant Halal, Restaurant","5 Pl. Du Marché, Theix-Noyalo",1
56205,Bara Pita Foodtruck,ChIJH1MomNgdEEgRJwnvRT-0bzc,Restaurant Libanais,"4 Rue Jacques Cartier, Theix-Noyalo",1
56205,Côté Kebab,ChIJb_pv6fcdEEgRwdJ7nYfd79M,Restaurant,"3 Pl. D'irlande, Séné",1
56205,Creperie Bara Breizh,ChIJe2KFJbICEEgRZOQdwSy8yvQ,Crêperie,"35 Rte De Penvins, Saint-Armel",0
56205,Les Parcs Du Passage,ChIJB60EO0cdEEgRljjd49gd7-o,"Restaurant, Restaurant De Fruits De Mer","10 Chem. Du Poulho, Saint-Armel",0
56205,Le Vieux Colombier,ChIJP2ZVWOUCEEgRSsupNt_3VLw,Restaurant Français,"1 Rue Du Stang, Sarzeau",0
56205,Sarzeau,ChIJNXZYewADEEgRdApXMisz9ug,Restaurant Français,"1 Rue Du Stang, Sarzeau",0
56205,Les Rives Gourmandes,ChIJi64sWu4CEEgR-jrKkjqq89Q,"Traiteur, Cours De Cuisine, Planificateur D'événements, Restaurant Français Moderne, Pâtisserie, Service De Chef Personnel, Service D'expédition, Buffet De Mariage, Organisateur De Mariage, Service De Mariage","27 Rue De Lann Vrihan, Le Hézo",0
56205,Délices D'asie,ChIJoaMajrPjD0gRe7gBd1xX1eE,"Restaurant Vietnamien, Restaurant Asiatique, Restaurant Chinois, Restaurant Thaïlandais","Rue Des Sports, Theix-Noyalo",NA
56205,Tuki Thai,ChIJtQmAeQodEEgRUV78SsK8bAY,"Restaurant Thaïlandais, Restaurant De Wok","18 Rue D'irlande, Séné",NA
56205,Chinois Gourmet (Wan Sheng),ChIJFWi21nceEEgRF5goCkcHApw,Restaurant Chinois,"41 Rte De Nantes, Séné",NA
56205,Restaurant Lily Sushi,ChIJY9EgiwUfEEgRRm2K-q2Hir0,Restaurant Asiatique,"16 Rue Du Port, Vannes",NA
56205,La Porte De L’inde,ChIJ-ZSymIYeEEgRSDYvxVr4cjI,"Restaurant Indien, Restaurant Bangladais, Restaurant Barbecue, Restaurant Haut De Gamme Français, Restaurant Indien Musulman, Restaurant À Emporter, Restaurant Pakistanais, Restaurant Végétarien","51 Rue Du Maréchal Leclerc, Vannes",NA
56206,Restaurant La Goël,ChIJRajRrkseEEgRujTBkktU3Ak,"Restaurant De Restauration Rapide, Restaurant De Hamburgers, Kebab","16 Pl. Notre Dame Du Loc, Saint-Avé",1
56206,Restaurant L'oriental,ChIJjWxDUXseEEgRzRm7l-ECpOk,"Restaurant, Restaurant Asiatique, Kebab, Restaurant Méditerranéen","60 Av. De Verdun, Vannes",1
56206,Restaurant L'indus,ChIJeRN_hEsfEEgRyXNxA9siCcc,"Restaurant Indien, Restaurant Biryani, Dîner, Restaurant Halal, Restaurant Du Déjeuner, Restaurant De Livraison, Restaurant À Emporter, Restaurant Indien Moderne, Restaurant Pakistanais, Restaurant","49 Rue De La Fontaine, Vannes",1
56206,Le Palais Du Taj Mahal,ChIJsX7XF1AfEEgRU_-0245XjTk,"Restaurant Indien, Restaurant Halal, Restaurant Pakistanais, Restaurant Végétarien","11 Rue De La Fontaine, Vannes",1
56206,Food Time (Vannes),ChIJkf0t0HceEEgRhQoHFyzVJuw,"Kebab, Restaurant De Restauration Rapide, Restaurant De Hamburgers, Restaurant De Livraison, Pizza À Emporter, Sandwicherie, Restaurant De Tacos","14 Rte De Nantes, Séné",1
56206,Restaurant Le Pressoir,ChIJhZ9lTgcfEEgREdtNEn37QIA,"Restaurant Gastronomique, Restaurant Français","7 Rue De L'hôpital, Saint-Avé",0
56206,Le Caprice Du Loc,ChIJ-7z6DUseEEgRnjOm3RpDgCA,Crêperie,"2 Pl. Notre Dame Du Loc, Saint-Avé",0
56206,Le Lann Guen,ChIJuYJ9IRofEEgR57el2RfZcd8,"Restaurant, Bar, Restaurant Français","48 Rue De L'hôpital, Saint-Avé",0
56206,Bar Le Vincennes Pmu,ChIJCQ1mCEseEEgREZe39cyWr0g,"Bar Pmu, Café, Restaurant Français, Brasserie","10 Pl. Notre Dame Du Loc, Saint-Avé",0
56206,Galette Et Compagnie,ChIJSX0O8JUZEEgRsEm7F4I4g30,Crêperie,"Zone De Kermelin, Saint-Avé",0
56206,La Porte De L’inde,ChIJ-ZSymIYeEEgRSDYvxVr4cjI,"Restaurant Indien, Restaurant Bangladais, Restaurant Barbecue, Restaurant Haut De Gamme Français, Restaurant Indien Musulman, Restaurant À Emporter, Restaurant Pakistanais, Restaurant Végétarien","51 Rue Du Maréchal Leclerc, Vannes",NA
56206,Restaurant My Thailand,ChIJw156nWgfEEgR-y-oxCEJ-wc,"Restaurant Thaïlandais, Restaurant Asiatique, Restaurant De Restauration Rapide, Restaurant","28 Rue Du Capitaine Jude, Vannes",NA
56206,Sushi Pearl,ChIJpy_WXoQeEEgRHm6e2y5bYoE,"Restaurant Japonais, Restaurant Asiatique, Bar, Restaurant Japonais Authentique, Restaurant Coréen, Restaurant De Livraison, Restaurant, Restaurant De Sushis","7 Rue Alain Le Grand, Vannes",NA
56206,Chinois Gourmet (Wan Sheng),ChIJFWi21nceEEgRF5goCkcHApw,Restaurant Chinois,"41 Rte De Nantes, Séné",NA
56206,Restaurant Sushiya - Équilibre Japonais,ChIJgUQUdpseEEgRFV9gIIitN8M,"Restaurant Japonais, Restaurant De Fusion Asiatique, Restaurant Asiatique, Restaurant Sans Gluten, Restaurant À Emporter, Restaurant De Sushis","13 Rue Thomas De Closmadeuc, Vannes",NA
56207,Kebab D'or,ChIJHxWuENo5EEgRnCDApAhVAIM,"Restaurant Turc, Restaurant De Restauration Rapide, Kebab","17 Rue De Pontivy, Baud",1
56207,Le Seize Kebab,ChIJP3b6_rBFEEgR5Iz7OLuIAGo,Restaurant,"16 Rue De La Mairie, Languidic",1
56207,Pacha Kebab,ChIJ74VGH2AvEEgRx6roctppM7E,"Kebab, Restaurant De Restauration Rapide","8 Rue Auguste Brizeux, Locminé",1
56207,Aux Délices Kebab,ChIJu2AEBxYlEEgRugvF9cBPqE8,Kebab,"21 Rue Chateaubriand, Locminé",1
56207,Délices Pizza Locminé,ChIJZzoRMiElEEgR5mfbR8ZWrHw,"Restaurant De Pizzas, Service De Livraison D'épicerie, Kebab, Restaurant De Livraison, Livraison De Pizzas, Pizza À Emporter, Restaurant, Sandwicherie, Restaurant De Tacos","16 Rue Olivier De Clisson, Locminé",1
56207,La Porcherie,ChIJ59MnUz43EEgRV_GBjc6x7zI,"Bistro, Restaurant Familial","Keridan, Pluméliau-Bieuzy",0
56207,Laouen Blavezh'ti,ChIJq7ci0OY3EEgRKuL6z-Wd7H0,"Chambres D'hôtes, Restaurant Français Moderne","Saint-Rivalain-Gare, Saint-Barthélemy",0
56207,Crêperie-Bar Au Coin Tranquille,ChIJax8OxSdJEEgRfztOVIawmM0,"Crêperie, Restaurant","Saint-Tugdual, Quistinic",0
56207,Le Dauphin,ChIJc6BV3SoxEEgR2NjZ7VDD0uE,"Restaurant, Restaurant Français","Langroix, Guénin",0
56207,Quéré Yvon,ChIJgbeTucgwEEgRF80LVFDvQA0,"Bar Et Grill, Bar","Pl. De L'église, Guénin",0
56207,La Lanterne Rouge,ChIJc5R04NQyEEgRH4Pv2P-wKOI,"Restaurant Chinois, Restaurant De Restauration Rapide","Rue Joseph Quilliou, Saint-Thuriau",NA
56207,Taj Mahal,ChIJBXCoJHTNEUgR49wSv4myjQ8,Restaurant Indien,"42 Rue Du Fil, Pontivy",NA
56207,Hong Kong Moon,ChIJY4xYlALNEUgREONDM1bsL34,"Restaurant, Restaurant Thaïlandais, Restaurant Traditionnel","14 Rue Du Général De Gaulle, Pontivy",NA
56207,Pataga,ChIJN7jO44NDEEgRTzLYCcoPtKU,"Restaurant Italien, Restaurant Asiatique, Restaurant De Pizzas","4 Av. Gén De Gaulle, Brandérion",NA
56207,Nongki Thaï,ChIJ47bKSipbEEgRpQzNwsgJ6aA,Restaurant Thaïlandais,"8 Rue Emile Zola, Inzinzac-Lochrist",NA
56208,Ibo Kebab,ChIJP8aOKR9NDkgRUtQJksqjTg4,Kebab,"15 Rue Paul Maulion, Mauron",1
56208,Istanbul Kebab,ChIJz58vA8M3DkgRgzlTtTYs-bY,Restaurant,"10 Rue Philippe Lemercier, Merdrignac",1
56208,Food A Meen,ChIJTQdMxjNRDkgRpBMH7FPs-nw,"Dîner, Restaurant De Restauration Rapide, Kebab, Restaurant De Tacos","53 Rue De Merdrignac, Saint-Méen-le-Grand",1
56208,Délices Kebab,ChIJFZ-nRUVQDkgR8Uf-U9c05rc,"Kebab, Restaurant De Restauration Rapide","14 Pl. De La Mairie, Saint-Méen-le-Grand",1
56208,O'delices Tacos,ChIJoaIg_kLJD0gREx6cuxA-xuk,"Restaurant, Magasin De Bière, Boutique De Beignets, Restaurant Halal, Glacier, Restaurant Du Déjeuner, Restaurant Mexicain, Restaurant Végétarien","60 Rue De La Gare, Ploërmel",1
56208,Chez Marie,ChIJJ7hFafFKDkgRestOIbvmbAQ,Crêperie,"1 Le Bourg, Saint-Brieuc-de-Mauron",0
56208,Café Ch'ti Breizh,ChIJc5b1xjRLDkgR7Ag1FhX1Mo0,Restaurant Français,"1 Rue De, Saint-Brieuc-de-Mauron",0
56208,Simmonds Audrey,ChIJxyH0NthKDkgRpX4Bq7XIzaE,"Bar Et Grill, Bar","La Grande Vallée, Mauron",0
56208,La Maison De Manon,ChIJY4RdIA9KDkgR_9w13fTKEFk,"Restaurant Français, Crêperie","Place St Barthélémy, Brignac",0
56208,Les Galettes Des Epinettes,ChIJuabvHZxMDkgRfwVpzpgCMyo,Crêperie,"27 Rue Du Porhoët, Mauron",0
56208,Taste Of India - Restaurant & Bar,ChIJS53kbkVQDkgRW-15PV344NA,Restaurant Indien,"10 Rue De Merdrignac, Saint-Méen-le-Grand",NA
56208,Restaurant Khang,ChIJ045BafBRDkgRkVz2PzBQPz4,Restaurant Asiatique,"3 Av. Du Maréchal Foch, Saint-Méen-le-Grand",NA
56208,Le Mékong,ChIJNX0HOjTID0gR4qGPDM_eXjI,"Restaurant Mandarin, Restaurant De Fondue Chinoise, Restaurant Thaïlandais","4 Rue Alphonse Guérin, Ploërmel",NA
56208,Perle D'asie,ChIJcXZbDUrID0gRI4PdxVvNNbo,"Restaurant Vietnamien, Restaurant Asiatique, Restaurant Chinois, Restaurant, Restaurant D'asie Du Sud-Est, Restaurant Thaïlandais","87 Rue De La Gare, Ploërmel",NA
56208,Mr Nguyen,ChIJM1pAM7QvDkgRcERpZBcNzZM,"Restaurant, Restaurant Vietnamien","15 Rue De Rennes, Plémet",NA
56209,Anatolie Kebab,ChIJKTlfzmLPEUgRLzAbA4IWPrM,Restaurant De Restauration Rapide,"5 Rue De La Gare, Guerlédan",1
56209,Bar Kebab Du Scorff,ChIJcxCf4qezEUgRSuXyo5Z7jUo,Kebab,"9 Rue Bisson, Guémené-sur-Scorff",1
56209,O Baba Pondi,ChIJ6T-ianXNEUgRkDt5ZFffSvs,"Restaurant Turc, Restaurant De Restauration Rapide","13 Rue Du Pont, Pontivy",1
56209,Royal Kebab Pontivy,ChIJEbymO-LMEUgR9TQBI1KsO1c,"Restaurant, Restaurant Familial, Restaurant De Restauration Rapide","37 Rue Du Pont, Pontivy",1
56209,Restaurant Couscousserie Cherazade,ChIJ29QSfarNEUgRBETIIreyaGg,"Restaurant, Restaurant Marocain","15 Pl. Anne De Bretagne, Pontivy",1
56209,Bar Creperie La Ribote,ChIJgUPW58m3EUgR8CeEyxYwqe8,"Crêperie, Bar, Restaurant Français, Restaurant À Emporter","Le Bourg, Sainte-Brigitte",0
56209,Un Rayon De Blé Noir - Crêperie De Bon Repos,ChIJ2W0TkA24EUgRbOjomu-vpMI,Crêperie,"1 Route Des Ardoisières, Bon Repos sur Blavet",0
56209,Chabada,ChIJ-YhqT1_JEUgRfukODKmDdEc,"Pizza À Emporter, Restaurant Brunch, Traiteur","1 Rue Du Stade, Cléguérec",0
56209,L'accoudoir,ChIJ8w9U757JEUgR5OMX90aqEEw,"Restaurant, Bistro, Bar","1 Pl. Pobeguin, Cléguérec",0
56209,L'argoat,ChIJk1qTAIbJEUgRP3DsdzpWGvM,"Restaurant, Restaurant Français","22 Pl. Pobeguin, Cléguérec",0
56209,Hong Kong Moon,ChIJY4xYlALNEUgREONDM1bsL34,"Restaurant, Restaurant Thaïlandais, Restaurant Traditionnel","14 Rue Du Général De Gaulle, Pontivy",NA
56209,Taj Mahal,ChIJBXCoJHTNEUgR49wSv4myjQ8,Restaurant Indien,"42 Rue Du Fil, Pontivy",NA
56209,La Lanterne Rouge,ChIJc5R04NQyEEgRH4Pv2P-wKOI,"Restaurant Chinois, Restaurant De Restauration Rapide","Rue Joseph Quilliou, Saint-Thuriau",NA
56209,Koemi Sushi (Food Truck),ChIJLz6eYCYpDkgRWanqWuZ6nBo,"Restaurant De Sushis, Restaurant Japonais, Sushis À Emporter","France, Saint-Barnabé",NA
56209,Nongki Thaï,ChIJ47bKSipbEEgRpQzNwsgJ6aA,Restaurant Thaïlandais,"8 Rue Emile Zola, Inzinzac-Lochrist",NA
56210,Elif Kebab,ChIJo2JlKgABEUgRP6QIRsXprCQ,Restaurant Turc,"1 Pl. Bellanger, Le Faouët",1
56210,O'53,ChIJHdq6nIkBEUgRXZ_cTQQQ_O0,Restaurant De Tacos,"1 Pl. Bellanger, Le Faouët",1
56210,Bar Kebab Du Scorff,ChIJcxCf4qezEUgRSuXyo5Z7jUo,Kebab,"9 Rue Bisson, Guémené-sur-Scorff",1
56210,Dilan Kebab,ChIJb8rUhyhREEgRqin4XWBHc7g,"Kebab, Restaurant De Restauration Rapide","16 Rue Du Général De Gaulle, Plouay",1
56210,Kebab De La Gare Gourin,ChIJofeL-3kFEUgRoTEMH6Wn-LA,Restaurant De Restauration Rapide,"2 Rue De La Gare, Gourin",1
56210,Le Charly's,ChIJCRfpfo9TEEgRV65eeYcA3x8,"Restaurant, Bar, Restaurant Français","2 Pl. De L'église, Kernascléden",0
56210,Le Capri,ChIJ9Q7A1PyqEUgRrL2kaUN8qXo,"Restaurant De Pizzas, Gril, Restaurant Français, Restaurant Italien, Pizza À Emporter","7 Rue Albert Saint-Jalmes, Priziac",0
56210,Les Bières Du Cercle - Bara Mod Kozh ( Scea Feurm Hent Aer),ChIJk_BL5_CtEUgRS09gAgivLU0,"Ferme Biologique, Boulangerie, Brasserie","Rossignol, Le Croisty",0
56210,La Cabane A Samoussas,ChIJzQhEYSmrEUgRZCqW8t27w1g,"Traiteur, Restaurant Créole, Restaurant De Restauration Rapide, Restaurant Français, Restaurant Traditionnel","Lieu-Dit La Croix, Priziac",0
