respondent.commune,business_name,place_id,fr_categories,business_address,treatment_arm
81167,Napolit’hein Albi - Bar À Pâtes,ChIJsVP4FzvprRIR5t3OzWW9Wtc,"Restaurant, Restaurant Halal, Restaurant Italien, Restaurant Du Déjeuner, Restaurant Végétarien","16 Av. Colonel Teyssier, Albi",1
81167,O Sucré Salé (Tacos-Burger) Albi,ChIJ_QXCBNXprRIR8XE8jHSCBg4,"Restaurant De Restauration Rapide, Crêperie, Restaurant De Hamburgers, Kebab, Restaurant De Tacos","54 Rue Croix Verte, Albi",1
81167,Restaurant Bar La Légende,ChIJwf1bVPkPshIR0LssqQwY-eM,"Restaurant, Restaurant Français","D33, Plaisance",0
81167,Le Grand Café,ChIJ6dhxUCMFshIRgQ4PghMcSYY,"Restaurant, Bar, Restaurant Français","Pl. Du Fort, Saint-Sernin-sur-Rance",0
81167,Auberge Des Arcades,ChIJf1UAv8kEshIRt5oPpIqtSYQ,Restaurant Français,"Le Bourg, Pousthomy",0
81167,Grignotte&Soda,ChIJURnxalb5rRIRq5CbcYqeUiY,"Restaurant, Brasserie","27 Av. D'albi, Alban",0
81167,Restaurant L'oustal,ChIJaeBxgecJshIRQgTnXk0cL6A,"Restaurant, Restaurant Français, Restaurant Méditerranéen","Prade Del Bourg, Trébas",0
81167,Dragon D'or,ChIJW0Lot8PorRIRLxCYKQHgPSE,"Restaurant Vietnamien, Restaurant Chinois","51 Av. Jean Jaurès, Saint-Juéry",NA
81167,Le Dragon D'or,ChIJH9FphbA7shIRZFekTRjkB2k,"Restaurant Vietnamien, Restaurant Asiatique, Restaurant Chinois","25 Bd De La République, Saint-Affrique",NA
81167,Nouveau Saïgon,ChIJLSUB4wforRIRqEl_DzAlTwE,"Restaurant Vietnamien, Restaurant Asiatique, Bar, Restaurant Chinois, Restaurant, Restaurant Thaïlandais","81 Av. Colonel Teyssier, Albi",NA
81167,Oki,ChIJlz6d43HprRIRZOftLteUQyM,"Restaurant Japonais, Restaurant De Restauration Rapide, Restaurant De Sushis","31 Rue Général Pont, Albi",NA
81167,Restaurant La Baie D'halong,ChIJ01OsswXorRIR4fH14LW0mzk,"Restaurant Vietnamien, Restaurant Chinois, Restaurant Thaïlandais","2 Rue Croix Verte, Albi",NA
81168,B.burger,ChIJAQCkCZXqrRIRQbNcxS7ncEA,"Restaurant De Tacos, Restaurant De Restauration Rapide, Restaurant De Hamburgers, Kebab","30 Av. De Rodez, Carmaux",1
81168,Tacos Express Carmaux,ChIJibaUyCXrrRIRAqW7V7acLL8,"Restaurant De Tacos, Restaurant De Restauration Rapide, Restaurant Indien, Restaurant Du Déjeuner","74 Av. Jean Jaurès, Carmaux",1
81168,La Cabana,ChIJo9x4qyfprRIRNmVD82lognE,"Restaurant De Restauration Rapide, Restaurant Halal","21 Av. Germain Tequi, Saint-Juéry",1
81168,Chez Muy'ö Pizzeria De La Madeleine Albi,ChIJcR97DsvDrRIRbs4zxv7ey3Q,"Pizza À Emporter, Restaurant Halal, Épicerie Italienne, Restaurant Italien, Livraison De Pizzas, Restaurant De Pizzas, Restaurant","94 Av. Dembourg, Albi",1
81168,L'etoile D'orient,ChIJQ3u046nCrRIR0tnA9HxnmnE,"Restaurant, Restaurant De Couscous, Restaurant Halal, Artisanat, Restaurant De Livraison, Restaurant À Emporter, Restaurant Tunisien","46 Rue Émile Grand, Albi",1
81168,Le Coin Du Pont,ChIJQSZxanKVrRIR-Bdsmnp4kd0,Bistro,"Les Trois Hiboux, Crespin",0
81168,La Table Du Carrelier,ChIJhRnWbwOXrRIR60wrh3XAf9s,"Restaurant Familial, Restaurant Français, Restaurant","Le Carrelier, 81190, Mirandol-Bourgnounac",0
81168,Le Lapin Blanc,ChIJN_MGh9yVrRIRSfR7RxX9aqA,"Restaurant, Restaurant Français","3 Av. Du Moulin, Mirandol-Bourgnounac",0
81168,Relais Des Farguettes,ChIJS59oP7KUrRIR-sNE856w4QQ,"Restaurant, Bar À Tabac, Restaurant Français","36jm+79, Pampelonne",0
81168,L'auberge Du Tilleul,ChIJF0ZKg12XrRIR-W-NM7YfD4g,"Restaurant Français, Bar, Restaurant","15 Rte De Carmaux, La Salvetat-Peyralès",0
81168,Restaurant Nuit D'orient,ChIJIdEd4JDqrRIRcSsqGCcdyyU,"Restaurant Vietnamien, Restaurant Asiatique, Bar, Restaurant Chinois","12 Rue Bousquet, Carmaux",NA
81168,Paradis D’asie,ChIJmVl10pPqrRIRf479IrGUay8,"Restaurant, Restaurant Chinois","14 Rue De L'hôtel De Ville, Carmaux",NA
81168,Tukta Thai Cuisine,ChIJZQ-8qdSRrRIRU7Z_bZ4G7wA,"Fournisseur De Nourriture Et De Boissons Pour La Restauration, Restaurant Asiatique","477 La Borie Basse, Cabanès",NA
81168,8 Champa,ChIJn6K0LDjIrRIRydJiSpguOeY,Restaurant Asiatique,"Grand-Rue De L'horloge, Cordes-sur-Ciel",NA
81168,Bubble San,ChIJy69QI2DJrRIREQjuFkqI_y0,Restaurant De Fusion Asiatique,"43 Grand Rue Raimond Vii, Cordes-sur-Ciel",NA
81169,Ik Restaurant,ChIJn7GkKa53rhIR73orYAarHwg,Kebab,"16 Bis Av. Victor Hugo, Graulhet",1
81169,L'original Kebab,ChIJK4bGBsx5rhIRlZmP_VdcbOE,Restaurant De Restauration Rapide,"1 Av. Charles De Gaulle, Graulhet",1
81169,Kebab Tacos Le Turquoise,ChIJZeiIDGh3rhIRYwiYlC95F98,"Kebab, Restaurant De Restauration Rapide","43 Av. Amiral Jaures, Graulhet",1
81169,O Village,ChIJ02B24gt_rhIRY9thgqw8EMQ,"Snack-Bar, Restaurant De Restauration Rapide, Kebab","22 Pl. Courtille, Briatexte",1
81169,L’anatolie Kebab,ChIJPW3QWACBrhIRYFPnPl4A6yE,"Restaurant De Restauration Rapide, Restaurant Turc","11 Av. Augustin Malroux, Lavaur",1
81169,Bistrot Gourmand,ChIJNbAfLfZ3rhIRRQCgmUdcroc,"Bistro, Restaurant De Restauration Rapide","Rue Verdaussou, Graulhet",0
81169,La Fontaine,ChIJB11WU_Z3rhIRm_o-EK6e_XE,"Restaurant, Restaurant Barbecue, Magasin De Bière, Bistro, Restaurant Français, Restaurant Méditerranéen, Restaurant Du Moyen-Orient, Restaurant De Fruits De Mer, Steak House, Bar À Vin","28 Pl. Du Jourdain, Graulhet",0
81169,Mcdonald's,ChIJZTTrVGl4rhIRWZ2x6UjTuRE,"Restaurant De Restauration Rapide, Restaurant Américain, Restaurant De Hamburgers, Restaurant De Pizzas, Restaurant, Sandwicherie","23 Av. Maréchal Juin, Graulhet",0
81169,L'aviation - Chez Cathy & Mathieu,ChIJuzkNkeN3rhIRwuW3yYcisVg,"Restaurant, Restaurant Français","Rte De L'aérodrome, Graulhet",0
81169,Restaurant Les Marronniers Par Um,ChIJwy3v5r97rhIRJw4SJudwxug,"Restaurant Français, Bar","2 Grand Rue, Viterbe",0
81169,Maison Madaule,ChIJ3TSUUwB_rhIRYBfr1tH1I9k,Restaurant Asiatique,"12 Rue Jean Moulin, Labastide-Saint-Georges",NA
81169,Le Petit Saigon,ChIJJbvVUs9_rhIRDunWBooZoW4,Restaurant Vietnamien,"25 Av. De Lavaur, Labastide-Saint-Georges",NA
81169,La Cuisine Vietnamienne De Delphine,ChIJPa_QxVWHrhIRG0EdYx4-Ng8,Restaurant Vietnamien,"8 Av. Charles De Gaulle, Lavaur",NA
81169,Restaurant Le Chinatown,ChIJAW_dvUqHrhIRWeuTvBrjWj0,Restaurant Asiatique,"31 Av. Charles De Gaulle, Lavaur",NA
81169,"Makoto Sushi & Asia Food, Soual",ChIJEfE3nFptrhIR6koElzFnU9Q,Restaurant De Sushis,"1 Rue Des Vieux Logis, Soual",NA
81170,Tacos Express Carmaux,ChIJibaUyCXrrRIRAqW7V7acLL8,"Restaurant De Tacos, Restaurant De Restauration Rapide, Restaurant Indien, Restaurant Du Déjeuner","74 Av. Jean Jaurès, Carmaux",1
81170,B.burger,ChIJAQCkCZXqrRIRQbNcxS7ncEA,"Restaurant De Tacos, Restaurant De Restauration Rapide, Restaurant De Hamburgers, Kebab","30 Av. De Rodez, Carmaux",1
81170,Chez Muy'ö Pizzeria De La Madeleine Albi,ChIJcR97DsvDrRIRbs4zxv7ey3Q,"Pizza À Emporter, Restaurant Halal, Épicerie Italienne, Restaurant Italien, Livraison De Pizzas, Restaurant De Pizzas, Restaurant","94 Av. Dembourg, Albi",1
81170,L'etoile D'orient,ChIJQ3u046nCrRIR0tnA9HxnmnE,"Restaurant, Restaurant De Couscous, Restaurant Halal, Artisanat, Restaurant De Livraison, Restaurant À Emporter, Restaurant Tunisien","46 Rue Émile Grand, Albi",1
81170,La Cabana,ChIJo9x4qyfprRIRNmVD82lognE,"Restaurant De Restauration Rapide, Restaurant Halal","21 Av. Germain Tequi, Saint-Juéry",1
81170,Auberge Occitane,ChIJJxMUtoTArRIRKhH58MBbsUI,"Restaurant Français, Bar","Boulevard Lices De L'est, Monestiés",0
81170,Comme Chai Vous,ChIJnT9N4YjBrRIRYBynNtHpcYE,"Bistro, Magasin De Bière, Restaurant Britannique, Restaurant De Restauration Rapide, Restaurant Français, Restaurant D'aliments Sains, Restaurant Méditerranéen, Restaurant Traditionnel, Bar À Vin","Av. Jean Jaurès 37, Saint-Benoît-de-Carmaux",0
81170,Le Boeuf Marin,ChIJYevmbJHqrRIRejGUvIwrc8k,"Restaurant Haut De Gamme Français, Restaurant Français, Restaurant","32 Av. Bouloc Torcatis, Carmaux",0
81170,Ferme Animalière De Bellevue,ChIJp6UFA7q4rRIRvEGLhBJOOHI,"Restaurant, Restaurant Français","192 Chem. De La Boujassié, Salles",0
81170,Chez Martine,ChIJ3Xcy6JDqrRIRQA_3GuXDW24,"Restaurant, Restaurant Français","16 Pl. Jean Jaurès, Carmaux",0
81170,Restaurant Nuit D'orient,ChIJIdEd4JDqrRIRcSsqGCcdyyU,"Restaurant Vietnamien, Restaurant Asiatique, Bar, Restaurant Chinois","12 Rue Bousquet, Carmaux",NA
81170,Paradis D’asie,ChIJmVl10pPqrRIRf479IrGUay8,"Restaurant, Restaurant Chinois","14 Rue De L'hôtel De Ville, Carmaux",NA
81170,8 Champa,ChIJn6K0LDjIrRIRydJiSpguOeY,Restaurant Asiatique,"Grand-Rue De L'horloge, Cordes-sur-Ciel",NA
81170,Bubble San,ChIJy69QI2DJrRIREQjuFkqI_y0,Restaurant De Fusion Asiatique,"43 Grand Rue Raimond Vii, Cordes-sur-Ciel",NA
81170,Thai Square Restaurant,ChIJI6pt4TPorRIRib4badphsnI,Restaurant Thaïlandais,"11 Imp. De Solviel, Lescure-d'Albigeois",NA
81171,Kebab Ô Délices,ChIJb6SMiTDSrRIRFentJg2NVt4,"Restaurant De Restauration Rapide, Kebab","14 Rue Jean Jaurès, Gaillac",1
81171,Smash & Food,ChIJde9lhanTrRIRSu3CmK_3Uks,"Restaurant De Restauration Rapide, Restaurant Halal, Kebab, Restaurant","7 Rue Du Languedoc, Gaillac",1
81171,My Naan & Tacos,ChIJu3QU_6rTrRIRreRbaNR_TUE,"Restaurant De Restauration Rapide, Kebab, Restaurant, Sandwicherie, Restaurant Turc","44 Rue Joseph Rigal, Gaillac",1
81171,Les Saveurs De La Madeleine,ChIJd4gLdBvTrRIRLbVtqgUA4Sw,"Kebab, Restaurant De Restauration Rapide","78 Rue De La Madeleine, Gaillac",1
81171,L'anatolie Kebab,ChIJ07mXKEItrBIRW2nWTZX87DE,Restaurant Turc,"33 Pl. Paul Saissac, Lisle-sur-Tarn",1
81171,Le Montanais,ChIJxYiOhY7TrRIRL8K2Ld3iTn8,"Restaurant Gastronomique, Restaurant Français","38 Chem. Des Vignes, Montans",0
81171,Restaurant L'ispiens,ChIJVTA9aTrSrRIRplCC-N6fcSo,Restaurant Français,"Les Brisses, Gaillac",0
81171,Mcdonald's,ChIJJ5uMX1LSrRIRyjVL_oymzYc,"Restaurant De Restauration Rapide, Restaurant Américain, Restaurant De Hamburgers, Restaurant De Pizzas, Restaurant, Sandwicherie","Rue Du Comté De Toulouse, Gaillac",0
81171,Burger King,ChIJFbxFK4fTrRIRDtMqqgCqGow,"Restaurant De Restauration Rapide, Restaurant Américain, Bar Et Grill, Restaurant Familial, Restaurant De Hamburgers, Restaurant À Emporter","122 Av. Saint-Exupéry, Gaillac",0
81171,La Table Du Sommelier,ChIJt4KviVdfshIR6sX3WdOm-OY,"Restaurant, Restaurant Français","34 Pl. Du Griffoul, Gaillac",0
81171,Le Panda D'or,ChIJaS2bdU7SrRIRfW7LUs1bolo,"Restaurant Chinois, Restaurant Asiatique, Restaurant Chinois De Livraison","178 Av. Saint-Exupéry, Gaillac",NA
81171,Sayaka,ChIJMftDSP7SrRIRwqMosNSKWNw,Restaurant Japonais,"Espace De Piquerouge, Gaillac",NA
81171,Bangkok Deli Street Food,ChIJT3z0hkfTrRIRMLfgITQ_uog,"Restaurant Thaïlandais, Restaurant","108 Pl. D'hautpoul, Gaillac",NA
81171,Petit Coin D'asie,ChIJZ7Tov6HTrRIR_5c0qZDQMjE,"Restaurant Asiatique, Restaurant Chinois De Livraison, Restaurant Japonais, Restaurant Laotien, Restaurant Mandarin","52 Rue Saint-Jean, Gaillac",NA
81171,Minh Food,ChIJs22Yh1bbrRIR23nD8euG66E,"Restaurant De Restauration Rapide, Restaurant Vietnamien","11 Rue Vincent Van Gogh, Marssac-sur-Tarn",NA
81172,B.burger,ChIJAQCkCZXqrRIRQbNcxS7ncEA,"Restaurant De Tacos, Restaurant De Restauration Rapide, Restaurant De Hamburgers, Kebab","30 Av. De Rodez, Carmaux",1
81172,Tacos Express Carmaux,ChIJibaUyCXrrRIRAqW7V7acLL8,"Restaurant De Tacos, Restaurant De Restauration Rapide, Restaurant Indien, Restaurant Du Déjeuner","74 Av. Jean Jaurès, Carmaux",1
81172,La Cabana,ChIJo9x4qyfprRIRNmVD82lognE,"Restaurant De Restauration Rapide, Restaurant Halal","21 Av. Germain Tequi, Saint-Juéry",1
81172,Chez Muy'ö Pizzeria De La Madeleine Albi,ChIJcR97DsvDrRIRbs4zxv7ey3Q,"Pizza À Emporter, Restaurant Halal, Épicerie Italienne, Restaurant Italien, Livraison De Pizzas, Restaurant De Pizzas, Restaurant","94 Av. Dembourg, Albi",1
81172,O Sucré Salé (Tacos-Burger) Albi,ChIJ_QXCBNXprRIR8XE8jHSCBg4,"Restaurant De Restauration Rapide, Crêperie, Restaurant De Hamburgers, Kebab, Restaurant De Tacos","54 Rue Croix Verte, Albi",1
81172,Le Petit Canard Chambre D'hote,ChIJ_fbFlRjtrRIRs3hh7-eBXOo,"Chambres D'hôtes, Restaurant Français","Cornudac, Saint-Jean-de-Marcel",0
81172,Relais Des Farguettes,ChIJS59oP7KUrRIR-sNE856w4QQ,"Restaurant, Bar À Tabac, Restaurant Français","36jm+79, Pampelonne",0
81172,Le Bon Temps,ChIJ-YYAH0jyrRIRleSnd3DhQLs,"Restaurant Français, Bar","93 Gr Grand Rue, Valence-d'Albigeois",0
81172,Restaurant La Botte De Paille,ChIJIR49E0KPrRIR-ZJV8mkLUFo,"Restaurant, Restaurant Français","Za De L'issart, Naucelle",0
81172,Restaurant De Saint Cirq,ChIJ3xy_m-NLqxIRFShLdWEPucM,"Restaurant, Bar, Restaurant Français, Restaurant Méditerranéen","12120 Rullac-Saint-Cirq, Rullac-Saint-Cirq",0
81172,Tukta Thai Cuisine,ChIJZQ-8qdSRrRIRU7Z_bZ4G7wA,"Fournisseur De Nourriture Et De Boissons Pour La Restauration, Restaurant Asiatique","477 La Borie Basse, Cabanès",NA
81172,Paradis D’asie,ChIJmVl10pPqrRIRf479IrGUay8,"Restaurant, Restaurant Chinois","14 Rue De L'hôtel De Ville, Carmaux",NA
81172,Restaurant Nuit D'orient,ChIJIdEd4JDqrRIRcSsqGCcdyyU,"Restaurant Vietnamien, Restaurant Asiatique, Bar, Restaurant Chinois","12 Rue Bousquet, Carmaux",NA
81172,Dragon D'or,ChIJW0Lot8PorRIRLxCYKQHgPSE,"Restaurant Vietnamien, Restaurant Chinois","51 Av. Jean Jaurès, Saint-Juéry",NA
81172,Thai Square Restaurant,ChIJI6pt4TPorRIRib4badphsnI,Restaurant Thaïlandais,"11 Imp. De Solviel, Lescure-d'Albigeois",NA
81173,Golden Tacos,ChIJdSgmHESBrhIRppbuzNbLySo,"Restaurant De Restauration Rapide, Boutique De Desserts, Restaurant De Kebab Doner, Magasin De Verre, Restaurant Grec, Restaurant De Hamburgers, Sandwicherie, Restaurant De Tacos, Restaurant Tex-Mex","Zone Commerciale Du Rouch, Lavaur",1
81173,Kebab Turquoise,ChIJJ9nq4UqHrhIRrqyngJD5mOE,"Restaurant De Restauration Rapide, Kebab","2 Rue Du Petit Faubourg, Lavaur",1
81173,Kebab Ôpetit Creux Pain Nan,ChIJRc1D30qHrhIRju7Rw6yZGG0,Restaurant,"4 Av. Charles De Gaulle, Lavaur",1
81173,L’anatolie Kebab,ChIJPW3QWACBrhIRYFPnPl4A6yE,"Restaurant De Restauration Rapide, Restaurant Turc","11 Av. Augustin Malroux, Lavaur",1
81173,Burg' & Grill - Restaurant Caraman,ChIJqcZdZPOLrhIRer9m7Gd1DeI,"Restaurant, Restaurant Américain, Restaurant Barbecue, Restaurant Familial, Restaurant De Restauration Rapide, Restaurant De Hamburgers, Restaurant De Tacos","Pl. De Woillemont, Caraman",1
81173,"Tonnerre De Crêpes, Food Truck Crêperie",ChIJAZSV9cqPrhIRccndDpV3cNs,Restaurant Français,"Pl. D'auta, Bourg-Saint-Bernard",0
81173,Chez Fernande,ChIJxe9o9aibrhIR8sjOW8hlgsc,"Restaurant De Pizzas, Restaurant Barbecue, Restaurant De Hamburgers, Restaurant, Restaurant De Tapas","11 Av. De Lavaur, Verfeil",0
81173,Le Petit Comptoir,ChIJX7prsHubrhIRbZT_mX9YSiM,"Restaurant, Bar, Café, Crêperie, Salon De Thé","1 Imp. D'en Séguret, Verfeil",0
81173,Restaurant La Promenade,ChIJcVf6f9yarhIRsFpKFCCDU_A,"Restaurant Gastronomique, Restaurant Français, Restaurant Méditerranéen","Le Conté 1395 Chemin D, Verfeil",0
81173,Auberge De Loubens,ChIJhymCsw-JrhIRMcfX88Xqn5A,"Restaurant Français, Bar, Restaurant, Brasserie","13 Place De La Halle, Loubens-Lauragais",0
81173,Le Bus D'asie,ChIJb9dgzFOQrhIRoMDO9UG-X9o,"Restaurant, Restaurant Asiatique, Bar, Restaurant Vietnamien","9 Rte De Castres, Vallesvilles",NA
81173,Restaurant Le Chinatown,ChIJAW_dvUqHrhIRWeuTvBrjWj0,Restaurant Asiatique,"31 Av. Charles De Gaulle, Lavaur",NA
81173,La Cuisine Vietnamienne De Delphine,ChIJPa_QxVWHrhIRG0EdYx4-Ng8,Restaurant Vietnamien,"8 Av. Charles De Gaulle, Lavaur",NA
81173,Bánh Mì Lover,ChIJWciN0tKRrhIRNeQp93R95ZA,"Restaurant, Restaurant Asiatique, Restaurant De Restauration Rapide, Restaurant Du Déjeuner, Restaurant Végétarien","1 Chem. De Chastel, Drémil-Lafage",NA
81173,Les Rives Du Mékong,ChIJ47XG9AmMrhIRu_0skNO7mGo,"Restaurant Asiatique, Restaurant Mandarin","48 Cr Alsace Lorraine, Caraman",NA
81174,Le Petit Resto,ChIJXw9XEgDhrRIR1EYMYGotQBI,Kebab,"23 Bd Carnot, Réalmont",1
81174,Kebab Tacos Le Turquoise,ChIJZeiIDGh3rhIRYwiYlC95F98,"Kebab, Restaurant De Restauration Rapide","43 Av. Amiral Jaures, Graulhet",1
81174,Ik Restaurant,ChIJn7GkKa53rhIR73orYAarHwg,Kebab,"16 Bis Av. Victor Hugo, Graulhet",1
81174,L'original Kebab,ChIJK4bGBsx5rhIRlZmP_VdcbOE,Restaurant De Restauration Rapide,"1 Av. Charles De Gaulle, Graulhet",1
81174,Midnight Snack,ChIJPwH3QwDdrRIRH8G3fx60Uw0,"Snack-Bar, Restaurant De Restauration Rapide, Restaurant Halal, Restaurant De Hamburgers, Kebab","113 Av. Maréchal Franchet D'esperey, Albi",1
81174,Auberge De La Ferme,ChIJT_jgu3nfrRIRgk8XkMchNjo,Restaurant Français,"La Sagnette, Montdragon",0
81174,Restaurant L'imperial,ChIJ3dj_0ZPfrRIRxLWDz8206WA,Restaurant Français,"52 Av. De Graulhet, Laboutarie",0
81174,Le Relais Du Pic,ChIJW0cNqH7grRIReSd4OPvpiCI,"Brasserie, Restaurant Français","Pl. De La Mairie, Lombers",0
81174,Les Pieds Sous La Table,ChIJoV2JO33grRIRw6OR2yy_k7k,"Restaurant, Restaurant Français, Bar","Puech Borris, Les Guariguettes N 112, Lombers",0
81174,Les Promenades,ChIJfWXQVdHhrRIRPb5qeKZKagc,Bar Et Grill,"81120 Réalmont, Réalmont",0
81174,Style Wok Sushi,ChIJDc8tnGXdrRIR4r8Z1X3wfMk,"Restaurant De Sushis, Restaurant À Emporter","Pl. Jules Ferry, Le Sequestre",NA
81174,New Century,ChIJS2qsRy_drRIRMaSWj34oyLk,"Restaurant Asiatique, Restaurant Cantonais, Restaurant Panasiatique, Restaurant, Restaurant D'asie Du Sud-Est, Restaurant Thaïlandais","Zac La Baute, Le Sequestre",NA
81174,Minh Food,ChIJs22Yh1bbrRIR23nD8euG66E,"Restaurant De Restauration Rapide, Restaurant Vietnamien","11 Rue Vincent Van Gogh, Marssac-sur-Tarn",NA
81174,Baegopa,ChIJlxkQ5CXdrRIRsd9BMeBIwMo,"Restaurant Coréen, Restaurant À Emporter","16 Rue De Rayssac, Albi",NA
81174,Le Pékin,ChIJGzisOFTdrRIR3wSoCtsMbRg,Restaurant Chinois,"30 Av. Maréchal Foch, Albi",NA
81175,L'instant Tacos Villemur Sur Tarn,ChIJiRPQr9cZrBIRhvPmSCICTmE,"Kebab, Restaurant De Restauration Rapide, Magasin De Salades","3 Av. Du Gén Leclerc, Villemur-sur-Tarn",1
81175,Kebab Negrepelisse Abdelaziz,ChIJWfgPu-I_rBIRzoQ5w50e7E0,"Kebab, Restaurant De Restauration Rapide","14 Pl. Nationale, Nègrepelisse",1
81175,O Delice Kebab,ChIJ2STMK7UarBIRrnfedxSXBcY,"Restaurant, Restaurant De Restauration Rapide, Kebab","4 Rue Vigouroux, Labastide-Saint-Pierre",1
81175,Le Bessierain Pizza-Kebab Burger,ChIJcV31ueggrBIRNtKdIJDCy_M,"Restaurant De Restauration Rapide, Kebab, Restaurant De Pizzas","18 Rue Du Grand Pastellié, Bessières",1
81175,Ō Kebab Burger,ChIJh8JdZx0nrBIRXcNvscLq6NU,Restaurant Halal,"10 Esp. Bellecourt, Bessières",1
81175,Logis Hostellerie Des Lacs,ChIJ-YsU3Ig8rBIRGWd6FFD4jkA,"Hôtel, Restaurant Français","12 Av. Du Lac, Monclar-de-Quercy",0
81175,La Chênaie,ChIJnbbz-Eg7rBIR0MGNDVUWVng,Restaurant Français,"31 Le Village, Saint-Urcisse",0
81175,La Vierta Du Tzigane,ChIJ5xHkVnkYrBIRJuerjWmlF2Y,"Restaurant, Restaurant Barbecue, Restaurant Français","1125 Rte De Verlhac, Varennes",0
81175,Café Au Bord Du Monde,ChIJ6-M35Q4vrBIRUf2EOo1y01U,"Bistro, Café, Salle De Concert, Restaurant Français Moderne, Restaurant","12 All. Jean Jaurès, Salvagnac",0
81175,Au Relais Des Falaises,ChIJxfhsTDgxrBIRgLHCgt9l7ds,"Restaurant, Restaurant Français, Restaurant Traditionnel","344 Rue Ancien Relais De Poste, Larroque",0
81175,Ché & Vous Traiteur Asiatique,ChIJq6raALYQrBIRxwZrp_UL1rc,"Plats Chinois À Emporter, Restaurant De Restauration Rapide","France S, Saint-Nauphary",NA
81175,Chez Tâm-Tâm,ChIJAZdpLRgZrBIRyNaAZG7dCrE,Restaurant Vietnamien,"57 Rue De La République, Villemur-sur-Tarn",NA
81175,Le Song Mekong 2,ChIJaZKQxrUYrBIR4CawTUmyhVw,"Restaurant, Restaurant Chinois","3 Av. Emile Sabatié, Villemur-sur-Tarn",NA
81175,(Restaurant Asiatique) Ô Tarn Sushi,ChIJy8Cg2LUZrBIRuXK0xH-0-xg,"Restaurant De Fondue Chinoise, Restaurant De Sushis, Restaurant De Wok","7 Av. Michel Rocard, Villemur-sur-Tarn",NA
81175,Restaurant New Vietnam,ChIJUQGgID8_rBIRcpAyQtYwf08,Restaurant Vietnamien,"62 Rue Marcelin Viguié, Nègrepelisse",NA
81176,Les Saveurs De La Madeleine,ChIJd4gLdBvTrRIRLbVtqgUA4Sw,"Kebab, Restaurant De Restauration Rapide","78 Rue De La Madeleine, Gaillac",1
81176,My Naan & Tacos,ChIJu3QU_6rTrRIRreRbaNR_TUE,"Restaurant De Restauration Rapide, Kebab, Restaurant, Sandwicherie, Restaurant Turc","44 Rue Joseph Rigal, Gaillac",1
81176,Smash & Food,ChIJde9lhanTrRIRSu3CmK_3Uks,"Restaurant De Restauration Rapide, Restaurant Halal, Kebab, Restaurant","7 Rue Du Languedoc, Gaillac",1
81176,Kebab Ô Délices,ChIJb6SMiTDSrRIRFentJg2NVt4,"Restaurant De Restauration Rapide, Kebab","14 Rue Jean Jaurès, Gaillac",1
81176,Tacos De Mars,ChIJlYCbJoPbrRIRGcImvA2DaoU,Restaurant De Tacos,"3avenue D’albi, Marssac-sur-Tarn",1
81176,La Bonne Auberge,ChIJE0fy6Z_OrRIRIQZ3bJ2cmbs,Restaurant Français,"Rue De L'église, Cahuzac-sur-Vère",0
81176,Chateau De Salettes,ChIJoYhnBmPOrRIRn0U3DD-8x5o,"Restaurant, Restaurant Français, Restaurant Haut De Gamme Français, Hôtel, Séminaire, Spa, Centre De Bien-Être, Hôtel Bien-Être, Cave À Vin, Établissement Vinicole","Lieu Dit, Cahuzac-sur-Vère",0
81176,Restaurant Cahuzac-Sur-Vère Au Camping Le Soleil Des Bastides,ChIJI_vsg6DPrRIRmqF0X8c_kAc,"Restaurant, Bar, Bistro","279 Rte De Cordes, Cahuzac-sur-Vère",0
81176,L' Auberge Des Arcades,ChIJ_bX7WtgyrBIRixiuzYgXCcg,"Restaurant, Bar, Restaurant Français","1 Pl. Des Arcades, Castelnau-de-Montmiral",0
81176,"Restaurant ""Au Fil Des Saisons""",ChIJM31XlTvSrRIRObfjWrM-Vug,"Restaurant, Restaurant Français","55 Rue Denfert Rochereau, Gaillac",0
81176,Petit Coin D'asie,ChIJZ7Tov6HTrRIR_5c0qZDQMjE,"Restaurant Asiatique, Restaurant Chinois De Livraison, Restaurant Japonais, Restaurant Laotien, Restaurant Mandarin","52 Rue Saint-Jean, Gaillac",NA
81176,Bangkok Deli Street Food,ChIJT3z0hkfTrRIRMLfgITQ_uog,"Restaurant Thaïlandais, Restaurant","108 Pl. D'hautpoul, Gaillac",NA
81176,Sayaka,ChIJMftDSP7SrRIRwqMosNSKWNw,Restaurant Japonais,"Espace De Piquerouge, Gaillac",NA
81176,Le Panda D'or,ChIJaS2bdU7SrRIRfW7LUs1bolo,"Restaurant Chinois, Restaurant Asiatique, Restaurant Chinois De Livraison","178 Av. Saint-Exupéry, Gaillac",NA
81176,Bubble San,ChIJy69QI2DJrRIREQjuFkqI_y0,Restaurant De Fusion Asiatique,"43 Grand Rue Raimond Vii, Cordes-sur-Ciel",NA
81177,Le Petit Resto,ChIJXw9XEgDhrRIR1EYMYGotQBI,Kebab,"23 Bd Carnot, Réalmont",1
81177,Restaurant Le Marrakech,ChIJt1xvjOYRrhIRWZA6lc6Xyl8,Restaurant Marocain,"14 Pl. Pierre Fabre, Castres",1
81177,Le Phénicien,ChIJK2b5xaoRrhIRVxCSBZVOMaY,Restaurant Libanais,"23 Rue Milhau Ducommun, Castres",1
81177,Croc Chaud,ChIJawR19egRrhIRm25VBHoLHU8,"Restaurant De Restauration Rapide, Boulangerie, Café, Crêperie, Restaurant De Hamburgers, Kebab, Pâtisserie, Magasin De Salades, Sandwicherie, Restaurant De Tacos","10 Rue Sabatier, Castres",1
81177,Pitaya Thaï Street Food,ChIJjVrUVqoRrhIRHwoMsu3Bsm0,"Restaurant De Restauration Rapide, Restaurant Asiatique, Restaurant Halal, Restaurant Panasiatique, Restaurant, Restaurant D'asie Du Sud-Est, Restaurant Thaïlandais, Restaurant De Wok","6 Pl. Soult, Castres",1
81177,Restaurant La Chaumière,ChIJ0xWJgEi2rRIRtvpmHkOvoFw,"Restaurant, Restaurant Français","14 All. Général De Gaulle, Roquecourbe",0
81177,Les Mets D'adelaide,ChIJiTpTxWsFrhIRY89Sn5PFe9I,"Restaurant Gastronomique, Restaurant Français, Restaurant","36 Av. Georges Alquier, Castres",0
81177,Restaurant-Bar Et Chambres D’hôtes Près Castres - L'auberge Des Salvages,ChIJI8cTsccPrhIRUMDErZ_AEpo,"Restaurant, Bar, Chambres D'hôtes, Restaurant Français","1 Av. Du Sidobre, Burlats",0
81177,L'absinthe,ChIJiZH8qccPrhIR2_SYtuz3-WA,"Restaurant Français, Bar","6 Av. Du Sidobre, Burlats",0
81177,Restaurant Louis,ChIJ1broNccPrhIRO6jAQ32goX4,"Restaurant Haut De Gamme Français, Restaurant Français","27 Av. Du Sidobre, Burlats",0
81177,Sushi Daily Castres,ChIJnW11FDWlthIRn9rTGqNXF-o,"Sushis À Emporter, Restaurant De Sushis À Tapis Roulant, Producteur Alimentaire, Restaurant De Sushis","Zone La Prade, Castres",NA
81177,Sushi Yaris,ChIJv3tJy8IRrhIRY7KcD9SxLv4,"Restaurant De Sushis, Restaurant Japonais","41 Rue Fuzies, Castres",NA
81177,Délices D'asie,ChIJfQP0AOgRrhIRvgDxAlNZfig,Restaurant Vietnamien,"14 Rue Milhau Ducommun, Castres",NA
81177,Sushi World,ChIJGwo678IRrhIRhjK5-xugDGU,"Restaurant Japonais, Restaurant De Livraison, Restaurant, Service D'expédition, Restaurant De Sushis","3 Pl. Soult, Castres",NA
81177,Ban Lo Sushi,ChIJM8A5tI8RrhIRrELTxwJdm3M,"Restaurant Japonais, Restaurant De Restauration Rapide, Restaurant De Sushis","161 Av. Charles De Gaulle, Castres",NA
81178,L'instant Tacos Villemur Sur Tarn,ChIJiRPQr9cZrBIRhvPmSCICTmE,"Kebab, Restaurant De Restauration Rapide, Magasin De Salades","3 Av. Du Gén Leclerc, Villemur-sur-Tarn",1
81178,Le Bessierain Pizza-Kebab Burger,ChIJcV31ueggrBIRNtKdIJDCy_M,"Restaurant De Restauration Rapide, Kebab, Restaurant De Pizzas","18 Rue Du Grand Pastellié, Bessières",1
81178,Ō Kebab Burger,ChIJh8JdZx0nrBIRXcNvscLq6NU,Restaurant Halal,"10 Esp. Bellecourt, Bessières",1
81178,Boucherie Halal,ChIJC5JFmMSDrhIRLL39WlD5Eto,"Boucherie, Charcuterie, Épicerie, Restaurant Halal, Magasin De Produits Carnés","2 Rue René Mercier, Saint-Sulpice-la-Pointe",1
81178,L'anatolie Kebab,ChIJ07mXKEItrBIRW2nWTZX87DE,Restaurant Turc,"33 Pl. Paul Saissac, Lisle-sur-Tarn",1
81178,La Chênaie,ChIJnbbz-Eg7rBIR0MGNDVUWVng,Restaurant Français,"31 Le Village, Saint-Urcisse",0
81178,Logis Hostellerie Des Lacs,ChIJ-YsU3Ig8rBIRGWd6FFD4jkA,"Hôtel, Restaurant Français","12 Av. Du Lac, Monclar-de-Quercy",0
81178,La Vierta Du Tzigane,ChIJ5xHkVnkYrBIRJuerjWmlF2Y,"Restaurant, Restaurant Barbecue, Restaurant Français","1125 Rte De Verlhac, Varennes",0
81178,Café Au Bord Du Monde,ChIJ6-M35Q4vrBIRUf2EOo1y01U,"Bistro, Café, Salle De Concert, Restaurant Français Moderne, Restaurant","12 All. Jean Jaurès, Salvagnac",0
81178,Bar Restaurant Des Allées,ChIJx2oCT7EYrBIRZL4-Hji22RU,"Restaurant, Bar, Restaurant Français","39 All. Charles De Gaulle, Villemur-sur-Tarn",0
81178,Chez Tâm-Tâm,ChIJAZdpLRgZrBIRyNaAZG7dCrE,Restaurant Vietnamien,"57 Rue De La République, Villemur-sur-Tarn",NA
81178,Le Song Mekong 2,ChIJaZKQxrUYrBIR4CawTUmyhVw,"Restaurant, Restaurant Chinois","3 Av. Emile Sabatié, Villemur-sur-Tarn",NA
