respondent.commune,business_name,place_id,fr_categories,business_address,treatment_arm
45087,Le Vieux Port,ChIJgV8PlhT370cRLLpUPPjIlqU,"Restaurant Français, Bar","9 Rue Du Port, Châtillon-sur-Loire",0
45087,L'arlequin,ChIJtW0G2Wz370cRHg2Ul1JZSUM,"Restaurant Français, Bar","51 Gr Grande Rue, Châtillon-sur-Loire",0
45087,Hôtel Restaurant Le Clos Du Vigneron,ChIJ2Sedz5JT40cRU5naOzdzlsg,"Restaurant, Restaurant Français, Hôtel","106 Grande Rue, Ousson-sur-Loire",0
45087,O'thaï,ChIJVx4RcvFe5UcRHk9b6-7g5ZY,Restaurant Thaïlandais,"66 Rue Des Champs De La Ville, Gien",NA
45087,Paradis Sushi,ChIJdzy-JY5e5UcRpC1Y2qU0d0w,"Restaurant Japonais, Restaurant De Sushis","13 Pl. Leclerc, Gien",NA
45087,Restaurant Pho 86,ChIJ4b9MAM5f5UcRedYpstwRBD4,Restaurant Asiatique,"15 Av. Maréchal Leclerc, Gien",NA
45087,Krishnou Bhavan,ChIJT3cCJpBe5UcRq6zQvvSauwA,"Restaurant Indien, Brasserie, Traiteur, Restaurant Indien Musulman, Salon De Thé","12 Quai Lenoir, Gien",NA
45087,Le Bœuf D'or,ChIJp3DaLXhe5UcRc3D-WZUCPFE,"Restaurant Buffet, Restaurant Chinois, Restaurant Japonais","29 Av. Des Montoires, Gien",NA
45088,O Delice Pizza Kebab,ChIJg1A3rDpT5EcRmTOjd3mHXEo,Restaurant De Restauration Rapide,"13 Grande Rue, Bazoches-les-Gallerandes",1
45088,Le Kebab De La Chapelle,ChIJuTQG1qlR5EcRvPooiUbGdEk,Restaurant,"60 Av. De La Chapelle, Toury",1
45088,Allo Presto Pizza,ChIJwf9yVrxR5EcR4WYEBoAIPeo,"Restaurant De Restauration Rapide, Kebab, Restaurant De Pizzas, Restaurant, Sandwicherie","79 Rue Nationale, Toury",1
45088,Kebab Grille Janville,ChIJlQm6zHNQ5EcRAeJmZgMAUNo,"Kebab, Gril, Restaurant De Pizzas, Restaurant De Tacos","5 Pl. Du Martroi, Janville-en-Beauce",1
45088,Avanoce & Kebap,ChIJRbbcCaWq5UcRoj6ZoHwVqUI,"Kebab, Bar, Restaurant De Restauration Rapide, Restaurant Italien","34 Pl. Général Leclerc, Neuville-aux-Bois",1
45088,Le Relais De La Chapelle,ChIJzfBHCqZR5EcRY45BUly8TJg,"Restaurant, Restaurant Français","60 Av. De La Chapelle, Toury",0
45088,Chez Vero Et Gaela,ChIJ_R3PsdJQ5EcRFwsa3MPNawo,"Restaurant Français, Bar","1 Rue Charles Péguy, Santilly",0
45088,Hôtel Restaurant Les Sabots D'or,ChIJWVziRHJQ5EcRtHt8Fi54ds4,"Restaurant, Restaurant Français, Hôtel","10 Rue Du Château, Janville-en-Beauce",0
45088,Pause Et Vous,ChIJX3nrJ5qq5UcRJ-SyyXw_Skc,"Restaurant, Restaurant Français","23 Rue De Montfort, Neuville-aux-Bois",0
45088,E I Les Gourmandises De Panpan,ChIJ7yJR1VpX5EcR36kASmtIpoU,"Glacier, Crêperie","18 Rue Du Nan, Artenay",0
45088,Traiteur Asiatique,ChIJwaqkEY5L5EcR9Wi7M9x9FQ0,Restaurant Asiatique,"63 Rue Nationale, Angerville",NA
45088,L'auberge Du Bonheur,ChIJP_Z2SHIB5UcRfMpAaM9fRYo,"Restaurant Asiatique, Bar, Restaurant Chinois, Restaurant Thaïlandais","367 Rue Du 17 Juin 1940, Loury",NA
45088,Mandarin Pithiviers,ChIJjZXv76al5UcRBUspznUrCjg,"Restaurant Chinois, Plats Chinois À Emporter, Restaurant, Restaurant Thaïlandais, Restaurant Vietnamien","11 Rue Du Capitaine Giry, Pithiviers",NA
45088,Wok Bonheur Wok Grill,ChIJwdL8xA2l5UcRZyNYtAq37CQ,"Restaurant, Restaurant Chinois","39 Rue Louise Michel, Pithiviers",NA
45088,Kyotorama,ChIJb98YzaWl5UcRBtiiYuDAxZg,"Restaurant Japonais, Restaurant De Sushis","8 Mail S, Pithiviers",NA
45089,"Nadil Food Chécy - Kebab, Tacos, Burger, Panini",ChIJufyTX6bi5EcRyivjKfE3v3A,"Kebab, Restaurant De Couscous, Restaurant Halal, Restaurant De Hamburgers, Restaurant, Restaurant De Tacos","5 Rue Du Maréchal Leclerc, Chécy",1
45089,Pizza Royal,ChIJETQyls785EcRxfOMM2P-hgc,"Restaurant De Pizzas, Restaurant De Hamburgers, Restaurant Italien, Restaurant De Livraison, Livraison De Pizzas, Pizza À Emporter, Magasin De Salades, Sandwicherie, Restaurant De Tacos","28 Rue De La Mairie, Saint-Jean-de-Braye",1
45089,Wings Master,ChIJx3YK9NT95EcR0tElA0cvw8Y,"Restaurant Indien, Restaurant De Restauration Rapide, Restaurant Halal","10 Rue De La Planche De Pierre, Saint-Jean-de-Braye",1
45089,Kebab La Grignotte,ChIJ_wGCTsn85EcRzdmKGOwM2iw,"Restaurant, Restaurant De Restauration Rapide","17 Rue De La Planche De Pierre, Saint-Jean-de-Braye",1
45089,Régal Food,ChIJB5M7ESn95EcRqw8RCo7L2V8,"Restaurant, Restaurant Barbecue, Restaurant De Restauration Rapide, Restaurant Halal, Restaurant De Hamburgers, Glacier, Kebab, Pâtisserie, Sandwicherie","17 Rue De La Planche De Pierre, Saint-Jean-de-Braye",1
45089,Lb Culinaire,ChIJBTOV4Vn95EcROZ_uJx_IrwU,"Traiteur, Restaurant De Petit-Déjeuner, Restaurant Brunch, Restaurant Gastronomique, Restaurant Français, Restaurant Sans Gluten, Restaurant D'aliments Sains, Restaurant Végétalien, Restaurant Végétarien","All. Michel Marinier, Chécy",0
45089,Le Week End,ChIJw1hxB6fi5EcRkChuFCh96KE,"Restaurant Haut De Gamme Français, Restaurant Gastronomique, Restaurant Français, Restaurant","1 Pl. Du Cloître, Chécy",0
45089,Plaza Del Sol,ChIJg9D596wC5UcRmHk35mxcObE,"Brasserie, Bar, Crêperie, Restaurant Français, Restaurant De Pizzas","Centre Commercial Bellerive Zac De La Guignardiere, Chécy",0
45089,Burger King,ChIJuS6tT6cD5UcRbAtppJgigVI,"Restaurant De Restauration Rapide, Restaurant Américain, Bar Et Grill, Restaurant Familial, Restaurant De Hamburgers, Restaurant À Emporter","Rue Gustave Eiffel, Chécy",0
45089,Mcdonald's,ChIJP-3AyKoC5UcR1wxczXhW0XI,"Restaurant De Restauration Rapide, Restaurant Américain, Restaurant De Hamburgers, Restaurant De Pizzas, Restaurant, Sandwicherie","1 Rue Jean Bertin, Chécy",0
45089,Sushiman,ChIJCXRC9_UD5UcRWsQkE4CGSFs,Sushis À Emporter,"Belles Rives, Centre Commercial, Chécy",NA
45089,Lao Kitchen By Be,ChIJAeGlcjv95EcRXUtQ_GtCtM8,"Traiteur, Restaurant Asiatique, Restaurant De Restauration Rapide, Restaurant De Livraison, Restaurant À Emporter","25 Rue Du Vauroger, Chécy",NA
45089,Namaste Orléans,ChIJg-hYC7j95EcROodo7VE-bAI,"Restaurant Indien, Restaurant Asiatique, Restaurant Biryani, Traiteur, Restaurant De Poissons, Plats Indiens À Emporter, Restaurant De Livraison, Restaurant À Emporter, Restaurant Végétarien","23 Av. Louis Joseph Soulas, Saint-Jean-de-Braye",NA
45089,Asie Pacifique,ChIJS6yYcXkb5UcR4DrQ-KzBUtQ,"Restaurant Asiatique, Restaurant Mandarin, Restaurant, Restaurant Thaïlandais","15 Bd Prte Madeleine, Jargeau",NA
45089,Kimme,ChIJG4N5iM7k5EcRrw1_YiPhnsc,"Restaurant Coréen, Restaurant Asiatique, Restaurant À Emporter","137 Rue De Bourgogne, Orléans",NA
45091,Flash Kebab,ChIJWb-CUBB770cRsb5LmqF6rqA,"Kebab, Restaurant De Restauration Rapide","12 Rue Saint-Martin, Égreville",1
45091,Mr Kebab,ChIJR1MukOV_70cRKFdJSLntEa4,Restaurant,"2 Rue Du Bois Plantè, Ferrières-en-Gâtinais",1
45091,Alaturka Restaurant,ChIJxzmlciR970cRVzkL_T9FWH0,Restaurant Turc,"115 Av. De Paris, Dordives",1
45091,Crousti Liban,ChIJbSuNB5h370cR93WHjhF5q5Q,Restaurant Libanais,"1 Rte D'egreville, Ervauville",1
45091,Maestro Kebab & Grillades,ChIJy6ZP94WH5UcRVrxp9jtAzcg,"Restaurant De Restauration Rapide, Restaurant Barbecue, Kebab, Sandwicherie, Restaurant Turc","88 Av. Du Maréchal Leclerc, Souppes-sur-Loing",1
45091,A La Maison,ChIJ6SUB33Z870cRzIDnb45BDUk,"Restaurant, Restaurant Français","2 Av. Du Gâtinais, Bransles",0
45091,Lé Tindé,ChIJX3Ic7_h970cRUqNlgezJalE,"Restaurant Familial, Restaurant Français","2 Av. Du Gâtinais, Bransles",0
45091,Fourchette Et Bouchon,ChIJo0m6AJN970cRg-NpyNFRQmg,"Restaurant, Crêperie","Chem. Du Puits, Dordives",0
45091,Le Chalet De Dordives,ChIJ77m6OpN970cR-WUy4YHhZc4,"Restaurant Français, Bar","86 Av. De Paris, Dordives",0
45091,Le Relais Routier,ChIJby5Id-p970cRMNRFu26MCUc,"Restaurant Français, Bar","85 Av. De Paris, Dordives",0
45091,Indian Meat,ChIJC21kTgB770cRjZctA1p7doA,Restaurant Indien,"50 Rue Saint-Martin, Égreville",NA
45091,Kun Yaye,ChIJ3XpPEgBx70cRzL4G4dCJ9jU,Restaurant Thaïlandais,"3 Ldt La Ratonnerie, Le Bignon-Mirabeau",NA
45091,Sushi Yummy,ChIJbQjlCzx_70cRqTkB1n2SjVI,Restaurant Japonais,"2 Rue Saint-Lazare, Ferrières-en-Gâtinais",NA
45091,Restaurant A La Vieille Halle,ChIJrX-r7CGH5UcRHCQtT3MjSNE,Restaurant Vietnamien,"1 Rue Voltaire, Souppes-sur-Loing",NA
45091,A La Vieille Halle,ChIJJaCG5JWH5UcRyYQzYuOVK4U,"Restaurant, Pension De Famille, Restaurant Français, Hôtel, Restaurant Vietnamien","1 Rue Voltaire, Souppes-sur-Loing",NA
45092,Chef Experience Food Truck France,ChIJ9Uet-Ld_5UcRxbhPiddtB5M,"Restaurant De Tacos, Restaurant Halal","Rue Des Châlons, Pannes",1
45092,Sultan's Kebab,ChIJsSMNUEB-5UcRACHQjiEDN6I,"Restaurant, Restaurant De Restauration Rapide","6 Av. De La Libération, Villemandeur",1
45092,Select Pizza,ChIJnb-JbB5-5UcRVM8YyZEwrEE,"Restaurant De Pizzas, Restaurant Français, Restaurant Italien, Restaurant De Livraison, Livraison De Pizzas, Pizza À Emporter, Restaurant, Restaurant De Tacos","330 Av. D'antibes, Amilly",1
45092,Restaurant Egée,ChIJAxE-ESZ-5UcRt3SuV0p8lSI,"Restaurant Turc, Gril, Restaurant De Kebab Doner, Restaurant De Restauration Rapide, Restaurant De Pizzas","4 Rue Girodet, Montargis",1
45092,Chez Ümi̇t Restorant,ChIJ6Tedrih-5UcRBjv2a7AO1ds,Restaurant Turc,"80 Rue Du Général Leclerc, Montargis",1
45092,Le Relais De Saint Maurice,ChIJAyfyohV55UcR-D_ay7oygC8,"Restaurant, Restaurant Barbecue, Fromagerie, Restaurant Gastronomique, Restaurant Français, Restaurant Du Déjeuner","132 Rte D'orléans, Saint-Maurice-sur-Fessard",0
45092,Café Restaurant Des Ponets,ChIJ1489kl1-5UcRoN9wbIDJV_Y,Restaurant Français,"64 Av. De La Libération, Villemandeur",0
45092,A La Pause Zen,ChIJxf8WW0B-5UcRKqXtnvHMMBI,"Restaurant, Bar, Restaurant Français","4 Av. De La Libération, Villemandeur",0
45092,Au Bon Accueil,ChIJ0expKrV95UcRJ-3kJL7hgbo,"Bar, Brasserie","11 Gr Grande Rue, Vimory",0
45092,Bistrot Du Marché Villemandeur,ChIJcaxTx0p_5UcRxhUFS8Mh9vw,"Restaurant, Bar Et Grill, Restaurant De Petit-Déjeuner, Restaurant Familial, Restaurant De Restauration Rapide, Marché De Produits Frais, Restaurant Du Déjeuner, Restaurant À Emporter, Restaurant De Plats De Viande, Restaurant Traditionnel","16 Rue Des Frères Lumière, Villemandeur",0
45092,Red Sushi,ChIJbWJfvo6B70cR24qM0dYECfc,Sushis À Emporter,"291 Rue De Vesines, Pannes",NA
45092,China Town,ChIJxRSeKg9-5UcROq1sYU-SUO8,"Restaurant Chinois, Restaurant Asiatique, Restaurant De Restauration Rapide","7bis Rue Des Frères Lumière, Villemandeur",NA
45092,Bangkok-Tokyo,ChIJlRRliCR-5UcR6xr6RQbXZB4,Restaurant Thaïlandais,"56 Av. Gaillardin, Montargis",NA
45092,Sushi Market Montargis,ChIJVeIFht5_5UcRJsooev28sow,"Sushis À Emporter, Épicerie Asiatique, Poké Bar","1094 Av. D'antibes, Amilly",NA
45092,"Tubtim Thai, Plats Thai À Emporter",ChIJzUjrxup_5UcR9NvrExUyeUc,Restaurant Thaïlandais,"54 Rue Jean Jaurès, Montargis",NA
45093,Cirik Llker,ChIJT5KaWy345EcRqs5LnQHwIyU,"Kebab, Restaurant De Restauration Rapide, Restaurant De Pizzas","43 Rue De Paris, Chevilly",1
45093,Kebab Express,ChIJ8wvyXC345EcROet_Ae-AgY4,"Kebab, Restaurant De Restauration Rapide","43 Rue De Paris, Chevilly",1
45093,Le Cercottois,ChIJH5V6KPX55EcR7UgRbkaNGO4,"Restaurant De Restauration Rapide, Bar Et Grill, Épicerie, Restaurant De Hamburgers, Kebab, Livraison De Pizzas, Restaurant De Pizzas","41 Route Nationale 20, Cercottes",1
45093,Centre Commercial Cap Saran,ChIJS7eEB_v65EcRWBLBEYuwr3o,"Centre Commercial, Chocolaterie, Magasin De Vêtements, Magasin De Verre, Salon De Coiffure, Bijoutier, Magasin De Chaussures, Restaurant De Tacos, Magasin De Jeux Vidéo","2601 Route Nationale 20, Saran",1
45093,Istanbul45,ChIJcTW5rnn75EcR2OIZ9LQ10Pw,Restaurant De Kebab Doner,"1342 Rue De Montaran, Saran",1
45093,Crêperie Mam Goz,ChIJiRHyfs355EcRkcS-Cs0OlMw,"Crêperie, Restaurant De Crêpes","13 Rue De Paris, Chevilly",0
45093,Crêpaguy,ChIJL0Wydwz55EcRN9dqAcKgWuE,"Crêperie, Restaurant De Restauration Rapide, Restaurant","8 Rue Des Marcassins, Cercottes",0
45093,Fleur De Sel,ChIJ5XVELBPw5EcRGZUwadfNJZ8,Restaurant Français,"68 Route Nationale 20, Cercottes",0
45093,Courtepaille,ChIJ9X4tEajw5EcRSez8Fpp4IkU,"Restaurant De Steakhouse Français, Gril, Bar Et Grill, Restaurant Familial, Restaurant Français, Restaurant De Plats De Viande, Restaurant","Aire D'orléans, Gidy",0
45093,Restaurant - La Fontaine -Artenay,ChIJtZT8d_JX5EcRt2tUXa_b7WU,Restaurant Français,"2 Pl. De L Hôtel De Ville, Artenay",0
45093,Otaru,ChIJLw0q9Uz75EcR8t-2r9LP8MU,Restaurant Japonais,"131 Rue Thomas Edison, Saran",NA
45093,Thaï Break - Cap Saran,ChIJQ8T0eR_75EcRsTcpGyPEDW0,"Restaurant Thaïlandais, Restaurant Familial, Restaurant De Fondue Chinoise, Restaurant De Wok","2601 Rte Nationale, Saran",NA
45093,Sushi Daily Saran,ChIJDYdhKcX75EcR3mEnEOe2XkA,"Sushis À Emporter, Kiosque","2601 Route Nationale 20, Saran",NA
45093,Yoyoshi,ChIJEXndzMv75EcRA0bR29nObSo,Restaurant Japonais,"77 All. De L'orée De La Forêt, Saran",NA
45093,Wokasie,ChIJp4FxjFH65EcRKemU-7HDwrI,"Restaurant, Restaurant Chinois, Restaurant De Sushis","Proche Hypermarché Carrefour, Saran",NA
45094,Flash Kebab,ChIJWb-CUBB770cRsb5LmqF6rqA,"Kebab, Restaurant De Restauration Rapide","12 Rue Saint-Martin, Égreville",1
45094,Crousti Liban,ChIJbSuNB5h370cR93WHjhF5q5Q,Restaurant Libanais,"1 Rte D'egreville, Ervauville",1
45094,Mr Kebab,ChIJR1MukOV_70cRKFdJSLntEa4,Restaurant,"2 Rue Du Bois Plantè, Ferrières-en-Gâtinais",1
45094,Alaturka Restaurant,ChIJxzmlciR970cRVzkL_T9FWH0,Restaurant Turc,"115 Av. De Paris, Dordives",1
45094,Chez Baki,ChIJUY2P5RsU70cRQwS0pgNPors,"Restaurant Turc, Kebab","8 Rue Emile Bru, Lorrez-le-Bocage-Préaux",1
45094,A La Maison,ChIJ6SUB33Z870cRzIDnb45BDUk,"Restaurant, Restaurant Français","2 Av. Du Gâtinais, Bransles",0
45094,Lé Tindé,ChIJX3Ic7_h970cRUqNlgezJalE,"Restaurant Familial, Restaurant Français","2 Av. Du Gâtinais, Bransles",0
45094,La Grange,ChIJ-4xMz6xx70cRM3AXghBWYcI,"Restaurant, Restaurant Français","23 Pl. De L'église, Jouy",0
45094,Bouill'a Betz,ChIJ7fjpnzlx70cRUD6oteDx9Xo,"Restaurant, Restaurant Français","5 Rue Du Midi, Bazoches-sur-le-Betz",0
45094,Biscuits Cm Les Petits Plaisirs,ChIJQ2oIOHV570cRomgRI0YmXTw,"Confiserie, Pâtisserie, Chocolaterie, Boutique De Beignets, Restaurant Français, Épicerie Fine, Glacier, Restaurant De Crêpes, Pâtisserie","Le Poirier Des Femmes, La Selle-sur-le-Bied",0
45094,Indian Meat,ChIJC21kTgB770cRjZctA1p7doA,Restaurant Indien,"50 Rue Saint-Martin, Égreville",NA
45094,Kun Yaye,ChIJ3XpPEgBx70cRzL4G4dCJ9jU,Restaurant Thaïlandais,"3 Ldt La Ratonnerie, Le Bignon-Mirabeau",NA
45094,Sushi Yummy,ChIJbQjlCzx_70cRqTkB1n2SjVI,Restaurant Japonais,"2 Rue Saint-Lazare, Ferrières-en-Gâtinais",NA
45094,Restaurant A La Vieille Halle,ChIJrX-r7CGH5UcRHCQtT3MjSNE,Restaurant Vietnamien,"1 Rue Voltaire, Souppes-sur-Loing",NA
45094,A La Vieille Halle,ChIJJaCG5JWH5UcRyYQzYuOVK4U,"Restaurant, Pension De Famille, Restaurant Français, Hôtel, Restaurant Vietnamien","1 Rue Voltaire, Souppes-sur-Loing",NA
45095,Pizza Grill Des Délices,ChIJw1TlAqWq5UcR4hPAV9sFsPA,"Restaurant De Pizzas, Gril, Café, Restaurant De Hamburgers, Kebab, Pizza À Emporter, Pub, Restaurant, Restaurant De Tacos","43 Pl. Général Leclerc, Neuville-aux-Bois",1
45095,Istanbul Kebab,ChIJBWH2Iiyr5UcRIDprXEtFoxc,Kebab,"45 Pl. Général Leclerc, Neuville-aux-Bois",1
45095,Avanoce & Kebap,ChIJRbbcCaWq5UcRoj6ZoHwVqUI,"Kebab, Bar, Restaurant De Restauration Rapide, Restaurant Italien","34 Pl. Général Leclerc, Neuville-aux-Bois",1
45095,O Delice Pizza Kebab,ChIJg1A3rDpT5EcRmTOjd3mHXEo,Restaurant De Restauration Rapide,"13 Grande Rue, Bazoches-les-Gallerandes",1
45095,Afyon Kebab,ChIJC6VzgaWl5UcRjNb1Cidg1yo,"Restaurant Turc, Restaurant De Restauration Rapide, Kebab","22 Rue Antoine Beaurieux, Pithiviers",1
45095,A La Tête De Veau,ChIJR9Tj6_Cp5UcRbdld5WBbUmA,"Restaurant, Restaurant Français","27 Grande Rue, Chilleurs-aux-Bois",0
45095,Le Relais Fleuri,ChIJv-t48vmp5UcRWhGL8va69dU,"Brasserie, Bar, Restaurant Français","91 Grande Rue, Chilleurs-aux-Bois",0
45095,Pause Et Vous,ChIJX3nrJ5qq5UcRJ-SyyXw_Skc,"Restaurant, Restaurant Français","23 Rue De Montfort, Neuville-aux-Bois",0
45095,Restaurant Le Montafilan (Auberge Bar Epicerie Fdj),ChIJJSw3ivao5UcRucC5cJfji-I,"Restaurant, Bar, Épicerie, Bar Karaoké, Brasserie","2 Rue De Montafilan, Mareau-aux-Bois",0
45095,Auberge Du Cheval Blanc,ChIJOx1zBKgI5UcRBCELycsExhY,"Restaurant Français, Bar","24 Rte De Fay Aux Loges, Sully-la-Chapelle",0
45095,L'auberge Du Bonheur,ChIJP_Z2SHIB5UcRfMpAaM9fRYo,"Restaurant Asiatique, Bar, Restaurant Chinois, Restaurant Thaïlandais","367 Rue Du 17 Juin 1940, Loury",NA
45095,Kyotorama,ChIJb98YzaWl5UcRBtiiYuDAxZg,"Restaurant Japonais, Restaurant De Sushis","8 Mail S, Pithiviers",NA
45095,Mandarin Pithiviers,ChIJjZXv76al5UcRBUspznUrCjg,"Restaurant Chinois, Plats Chinois À Emporter, Restaurant, Restaurant Thaïlandais, Restaurant Vietnamien","11 Rue Du Capitaine Giry, Pithiviers",NA
45095,Ye D’asie Traiteur,ChIJSUVt0HWl5UcRjDbwmFiPdE4,Restaurant Asiatique,"9 Pl. Du Martroi, Pithiviers",NA
45095,Bouquet,ChIJIyo76YSl5UcR9Na9_bcuCwU,Restaurant Vietnamien,"1 Pl. Du Martroi, Pithiviers",NA
45096,Le Miam De Nogent,ChIJl3xbqXeJ70cRuO_iuIjhKHY,"Restaurant, Magasin De Bière, Restaurant De Restauration Rapide, Restaurant Halal, Restaurant De Hamburgers, Kebab, Sandwicherie, Restaurant Végétarien, Bar À Vin","Rue Georges Bannery 9, Nogent-sur-Vernisson",1
45096,Kebab Burger,ChIJdyVmmmRe5UcR11htdSlKjrg,"Restaurant Turc, Restaurant Américain, Restaurant De Restauration Rapide, Restaurant De Hamburgers, Kebab","6 Rue Du 32e Régiment D'infanterie, Gien",1
45096,Food City,ChIJHzxF0X9f5UcReu3GrNNEnEA,"Restaurant De Pizzas, Restaurant De Hamburgers, Restaurant De Tacos","48 Av. Président Wilson, Gien",1
45096,Délice Anatolie,ChIJVbVxcnpf5UcRfa-YcxhihiY,Restaurant Turc,"46 Av. Président Wilson, Gien",1
45096,Chez Flo,ChIJKR3m7jZf5UcRgiDt-jLvL2I,Restaurant Turc,"31 Rue De Paris, Gien",1
45096,La Petite Puisaye,ChIJm-trJHSK70cR8Fwq3zaQjXs,"Restaurant, Restaurant Français","21 Rue De L'étang, Boismorand",0
45096,Auberge Des Templiers,ChIJQaQRdhSK70cRuo_7xYActOs,"Hôtel, Restaurant Français","N7, Boismorand",0
45096,Restaurant La Campagne,ChIJT2HBeRNj5UcR9cgJTOqCFaU,"Restaurant, Restaurant Français","7 Pl. Duchesse De Dalmatie, Varennes-Changy",0
45096,Gites Auberge Loiret: L'auberge Ferme Du Tranchoir,ChIJCxUtVVNn5UcRL81LqSV-odk,"Auberge, Restaurant Français","Auberge Ferme Du Tranchoir, Nevoy",0
45096,L'insolite,ChIJr-QLRdmK70cRtxH2Nk737bU,"Restaurant, Restaurant Français","4 Rue De Lyon, La Bussière, France, La Bussière",0
45096,Gerome,ChIJr2OJiQaJ70cReaZ9TBYpWLs,Restaurant Vietnamien,"40-52 Rue De La Chevalerie, Nogent-sur-Vernisson",NA
45096,Le Bœuf D'or,ChIJp3DaLXhe5UcRc3D-WZUCPFE,"Restaurant Buffet, Restaurant Chinois, Restaurant Japonais","29 Av. Des Montoires, Gien",NA
45096,O'thaï,ChIJVx4RcvFe5UcRHk9b6-7g5ZY,Restaurant Thaïlandais,"66 Rue Des Champs De La Ville, Gien",NA
45096,Restaurant Pho 86,ChIJ4b9MAM5f5UcRedYpstwRBD4,Restaurant Asiatique,"15 Av. Maréchal Leclerc, Gien",NA
45096,Paradis Sushi,ChIJdzy-JY5e5UcRpC1Y2qU0d0w,"Restaurant Japonais, Restaurant De Sushis","13 Pl. Leclerc, Gien",NA
45097,Ô Tarpin Bon Food Truck Burger Loiret,ChIJkTTzVXSF70cRz-ZsPXx4aVA,"Restaurant De Hamburgers, Restaurant Halal, Traiteur Mobile","Pl. Du Château, Château-Renard",1
45097,Flash Kebap,ChIJjeYYOH1170cR_kClsYS7xLE,"Restaurant Turc, Restaurant De Restauration Rapide","21 Rue De Villeneuve, Courtenay",1
45097,Crousti Liban,ChIJbSuNB5h370cR93WHjhF5q5Q,Restaurant Libanais,"1 Rte D'egreville, Ervauville",1
45097,F’amilly Food,ChIJWbz8utGA70cRDlR1DZr8h9c,"Restaurant, Restaurant De Restauration Rapide, Kebab, Restaurant De Tacos","29 Rue Albert Frappin, Amilly",1
45097,Mr Kebab,ChIJR1MukOV_70cRKFdJSLntEa4,Restaurant,"2 Rue Du Bois Plantè, Ferrières-en-Gâtinais",1
45097,Le Relais De Courtemaux,ChIJLVpF_OZ370cRKCEBi21Qh2U,"Restaurant, Restaurant Français","29 Rue De La Mairie, Courtemaux",0
45097,Auberge De La Cléry,ChIJzQjTfuN170cRy6AxmLq58z4,"Restaurant, Café, Traiteur, Restaurant Français","14 Rue Grande Rue, Saint-Hilaire-les-Andrésis",0
45097,Le Chant Des Moutons,ChIJ-bQaimyf70cR57hXg8b0p70,"Théâtre Des Arts De La Scène, Bistro, Restaurant De Tapas","Les Thibaults, Douchy-Montcorbon",0
45097,Bar Du Donjon,ChIJNcHOCRib70cRqJ2Zi46-a8Y,"Restaurant, Bar, Bar Et Grill, Restaurant Français","29 Pl. De L Hôtel De Ville, Château-Renard",0
45097,Le Raboliot,ChIJhfIXdn1170cRzFyyothVy8A,Restaurant Français,"30 Pl. Armand Chesneau, Courtenay",0
45097,100% Thaï,ChIJIcEZdgB170cRM7mifhWprZQ,Restaurant Asiatique,"36 Pl. Armand Chesneau, Courtenay",NA
45097,Kun Yaye,ChIJ3XpPEgBx70cRzL4G4dCJ9jU,Restaurant Thaïlandais,"3 Ldt La Ratonnerie, Le Bignon-Mirabeau",NA
45097,Tankiu Sakura,ChIJaUde1pqA70cRRJjcHWUODTs,"Restaurant Japonais, Restaurant De Sushis","9 Rue Des Déportés Et Internés De La Résistance, Montargis",NA
45097,Sushi Yummy,ChIJbQjlCzx_70cRqTkB1n2SjVI,Restaurant Japonais,"2 Rue Saint-Lazare, Ferrières-en-Gâtinais",NA
45097,Lune Rouge,ChIJoyVJwoCA70cRCQmTTdkbj_0,"Restaurant Chinois, Restaurant Asiatique, Restaurant, Restaurant Thaïlandais","77 Av. Du Général De Gaulle, Montargis",NA
45098,L’étoile Fast-Food Cléry Saint André,ChIJ5z_lwqLr5EcRcMYJFH8PH9I,Kebab,"101 Rue Du Maréchal Foch, Cléry-Saint-André",1
45098,Night Snacks : Livraison A Domicile,ChIJJf9-ioTv5EcRaP9AzEOUQjo,"Restaurant De Restauration Rapide, Distributeur De Boissons, Magasin Général, Restaurant De Hamburgers, Kebab, Restaurant De Livraison, Livraison De Pizzas, Service D'expédition, Restaurant De Tacos","436 Rue Saint-Fiacre, Mareau-aux-Prés",1
45098,Presto Pizza,ChIJMwvZJzrr5EcRFoHsiz-OieQ,"Restaurant, Pâtisserie, Restaurant De Restauration Rapide, Restaurant Halal, Glacier, Restaurant Du Déjeuner, Restaurant De Pizzas, Magasin De Salades","44 Rue Jehan De Meung, Meung-sur-Loire",1
45098,Mag’dalle,ChIJOWdk9a_r5EcRH_j-dAYpMSk,"Restaurant De Restauration Rapide, Kebab, Restaurant De Tacos","42 Rue De La Gare, Meung-sur-Loire",1
45098,Majesty Pizza,ChIJr48NAevv5EcRMB83bfYnuJc,"Restaurant, Kebab, Restaurant De Pizzas","34 Rue Nationale, La Chapelle-Saint-Mesmin",1
45098,Le Marmiton,ChIJF0rDdN3u5EcRAX-n3vEGZxQ,Restaurant Français,"620 Rue Saint-Fiacre, Mareau-aux-Prés",0
45098,L'agylien,ChIJ67GfFjrs5EcRcrwIP2pLLus,Restaurant Français,"118 Rte Nationale, Saint-Ay",0
45098,La Grande Tour,ChIJBVRPBTDs5EcR_aMhzDxhRiw,"Restaurant Français, Restaurant Gastronomique","21 Rte Nationale, Saint-Ay",0
45098,Fleury Jean-Pierre,ChIJa7fyLATr5EcRV_yC8aPv5-U,"Brasserie, Bar","1 Rue Francis Carret, Dry",0
45098,Relais Château Luis Xi,ChIJC3FNCgDr5EcRwq2yrcrLxfY,Restaurant Français,"45130 Meung-Sur-Loire, Meung-sur-Loire",0
45098,Coco,ChIJcx7ZNmHt5EcRpxh9oYeWHS0,Restaurant Japonais,"4 Rue Jean Moulin, Meung-sur-Loire",NA
45098,Baule Bowls,ChIJvV5AZE3r5EcRmyA0DNakUUo,"Restaurant De Restauration Rapide, Restaurant Japonais, Poké Bar, Restaurant De Ramen","Route De Baule, Baule",NA
45098,Niconicoya Baule (45) - Sushi Edomae,ChIJneD5ZgaV5EcROTFvxxfwFhI,"Sushis À Emporter, Magasin De Bière, Traiteur, Restaurant Sans Gluten, Restaurant Japonais Authentique, Restaurant Du Déjeuner, Restaurant De Sushis, Restaurant Végétalien","19 Bis Rue Jean Bordier, Baule",NA
45098,Lian,ChIJeaBv8neV5EcRGRF8urZKohE,Restaurant Japonais,"62 Av. D'orléans, Beaugency",NA
45098,Nems Croquants,ChIJ88SzJOLl5EcRVzcM3_sOtEY,"Restaurant À Emporter, Traiteur, Plats Chinois À Emporter","20 Rue Amédéo Modigliani, Saint-Jean-de-la-Ruelle",NA
45099,Kebab Express,ChIJ8wvyXC345EcROet_Ae-AgY4,"Kebab, Restaurant De Restauration Rapide","43 Rue De Paris, Chevilly",1
45099,Cirik Llker,ChIJT5KaWy345EcRqs5LnQHwIyU,"Kebab, Restaurant De Restauration Rapide, Restaurant De Pizzas","43 Rue De Paris, Chevilly",1
45099,Le Cercottois,ChIJH5V6KPX55EcR7UgRbkaNGO4,"Restaurant De Restauration Rapide, Bar Et Grill, Épicerie, Restaurant De Hamburgers, Kebab, Livraison De Pizzas, Restaurant De Pizzas","41 Route Nationale 20, Cercottes",1
45099,Kebab D'ingré,ChIJp-nRgUHw5EcRKB1rylqex1c,Restaurant De Restauration Rapide,"235 Rte Nationale, Ingré",1
45099,Centre Commercial Cap Saran,ChIJS7eEB_v65EcRWBLBEYuwr3o,"Centre Commercial, Chocolaterie, Magasin De Vêtements, Magasin De Verre, Salon De Coiffure, Bijoutier, Magasin De Chaussures, Restaurant De Tacos, Magasin De Jeux Vidéo","2601 Route Nationale 20, Saran",1
45099,Le Saint Florian,ChIJVRHyYUr15EcR_FBQFUiGegE,"Bar, Restaurant Français","21 Rue De La Croix Blanche, Patay",0
45099,Le Relais Saint Jacques,ChIJ3802ar6L5EcRXEQrI-FgVnE,"Restaurant, Restaurant Français, Hôtel","35 Rue De La Mairie, Tournoisis",0
45099,Courtepaille,ChIJ9X4tEajw5EcRSez8Fpp4IkU,"Restaurant De Steakhouse Français, Gril, Bar Et Grill, Restaurant Familial, Restaurant Français, Restaurant De Plats De Viande, Restaurant","Aire D'orléans, Gidy",0
45099,La Poule Blanche,ChIJ9YBs4VPw5EcRukwjnEiQfVg,"Restaurant, Restaurant Français","123 Rue Nationale, Ormes",0
45099,Crêperie Mam Goz,ChIJiRHyfs355EcRkcS-Cs0OlMw,"Crêperie, Restaurant De Crêpes","13 Rue De Paris, Chevilly",0
45099,Thaï Break - Cap Saran,ChIJQ8T0eR_75EcRsTcpGyPEDW0,"Restaurant Thaïlandais, Restaurant Familial, Restaurant De Fondue Chinoise, Restaurant De Wok","2601 Rte Nationale, Saran",NA
45099,Ts.art & Mets,ChIJayIQQZj75EcRshHHWRcWW7U,"Traiteur, Restaurant Africain, Restaurant Américain, Restaurant Asiatique, Restaurant Barbecue, Restaurant De Petit-Déjeuner, Pâtisserie, Restaurant Chinois, Restaurant Français","All. Du Bois Bouchet, Saran",NA
45099,Otaru,ChIJLw0q9Uz75EcR8t-2r9LP8MU,Restaurant Japonais,"131 Rue Thomas Edison, Saran",NA
45099,Хадилия,ChIJo39oHCv75EcRF-dTm4YKslY,Restaurant Asiatique,"123 Rue Georges Coignet, Saran",NA
45099,Sushi Daily Saran,ChIJDYdhKcX75EcR3mEnEOe2XkA,"Sushis À Emporter, Kiosque","2601 Route Nationale 20, Saran",NA
45100,Pizza Royal,ChIJETQyls785EcRxfOMM2P-hgc,"Restaurant De Pizzas, Restaurant De Hamburgers, Restaurant Italien, Restaurant De Livraison, Livraison De Pizzas, Pizza À Emporter, Magasin De Salades, Sandwicherie, Restaurant De Tacos","28 Rue De La Mairie, Saint-Jean-de-Braye",1
