respondent.commune,business_name,place_id,fr_categories,business_address,treatment_arm
45260,Wok Bonheur Wok Grill,ChIJwdL8xA2l5UcRZyNYtAq37CQ,"Restaurant, Restaurant Chinois","39 Rue Louise Michel, Pithiviers",NA
45260,Bouquet,ChIJIyo76YSl5UcR9Na9_bcuCwU,Restaurant Vietnamien,"1 Pl. Du Martroi, Pithiviers",NA
45260,Aux Saveurs Lointaines,ChIJv87lP6al5UcR4kEawwteRT8,"Restaurant Vietnamien, Restaurant De Fusion Asiatique, Restaurant Asiatique, Magasin De Salades, Restaurant De Fruits De Mer, Restaurant De Soupe","1 Pl. Du Martroi, Pithiviers",NA
45260,Ye D’asie Traiteur,ChIJSUVt0HWl5UcRjDbwmFiPdE4,Restaurant Asiatique,"9 Pl. Du Martroi, Pithiviers",NA
45260,Mandarin Pithiviers,ChIJjZXv76al5UcRBUspznUrCjg,"Restaurant Chinois, Plats Chinois À Emporter, Restaurant, Restaurant Thaïlandais, Restaurant Vietnamien","11 Rue Du Capitaine Giry, Pithiviers",NA
45261,Pizza Grill Des Délices,ChIJw1TlAqWq5UcR4hPAV9sFsPA,"Restaurant De Pizzas, Gril, Café, Restaurant De Hamburgers, Kebab, Pizza À Emporter, Pub, Restaurant, Restaurant De Tacos","43 Pl. Général Leclerc, Neuville-aux-Bois",1
45261,Avanoce & Kebap,ChIJRbbcCaWq5UcRoj6ZoHwVqUI,"Kebab, Bar, Restaurant De Restauration Rapide, Restaurant Italien","34 Pl. Général Leclerc, Neuville-aux-Bois",1
45261,Istanbul Kebab,ChIJBWH2Iiyr5UcRIDprXEtFoxc,Kebab,"45 Pl. Général Leclerc, Neuville-aux-Bois",1
45261,New Lara,ChIJ07NQL8n85EcRv3-dgOBPakU,"Restaurant, Restaurant De Restauration Rapide, Restaurant Halal, Restaurant De Hamburgers, Kebab","5 Rue Georges Danton, Saint-Jean-de-Braye",1
45261,Wings Master,ChIJx3YK9NT95EcR0tElA0cvw8Y,"Restaurant Indien, Restaurant De Restauration Rapide, Restaurant Halal","10 Rue De La Planche De Pierre, Saint-Jean-de-Braye",1
45261,Ca-Re Bon’heure,ChIJBXVcF3YC5UcRIvSvTUI2mzA,"Restaurant, Restaurant Français","2 Rue Nationale, Vennecy",0
45261,Chez Fifille Au Marigny,ChIJ-wuG86r95EcRLA_3YyFvYqY,Restaurant Français,"25 Pl. De L'église, Marigny-les-Usages",0
45261,Restaurant Bar Tabac Le Marigny,ChIJV-8m7Zb95EcRfsiWyfzxOJ8,"Restaurant Français, Bar À Tabac","25 Pl. De L'église, Marigny-les-Usages",0
45261,Au Pont De Boigny,ChIJM1wMDkH95EcRljMyhgxM2t0,"Restaurant Français, Bar, Hôtel","2 Rue De Ponchapt, Chécy",0
45261,Del Arte,ChIJcWgSfSD95EcRwU6wZNECDDM,"Restaurant, Restaurant Familial, Restaurant Français, Restaurant Italien, Restaurant Du Déjeuner, Restaurant À Emporter, Restaurant Méditerranéen, Restaurant Du Nord De L'italie, Restaurant De Pizzas, Restaurant Du Sud De L'italie","41 All. Du Grand Coquille, Saint-Jean-de-Braye",0
45261,L'auberge Du Bonheur,ChIJP_Z2SHIB5UcRfMpAaM9fRYo,"Restaurant Asiatique, Bar, Restaurant Chinois, Restaurant Thaïlandais","367 Rue Du 17 Juin 1940, Loury",NA
45261,Lao Kitchen By Be,ChIJAeGlcjv95EcRXUtQ_GtCtM8,"Traiteur, Restaurant Asiatique, Restaurant De Restauration Rapide, Restaurant De Livraison, Restaurant À Emporter","25 Rue Du Vauroger, Chécy",NA
45261,Sushiman,ChIJCXRC9_UD5UcRWsQkE4CGSFs,Sushis À Emporter,"Belles Rives, Centre Commercial, Chécy",NA
45261,Jack Wok,ChIJxeOMzFX75EcRz4IK7ET_xgA,"Restaurant Asiatique, Restaurant Buffet, Restaurant De Steakhouse Français, Restaurant Japonais, Restaurant Mandarin","5 Rue Frédéric Et Irene Joliot Curie, Fleury-les-Aubrais",NA
45261,Shambala,ChIJHTxUxEr75EcRh-pWoztRvB4,"Restaurant Japonais, Restaurant Buffet, Restaurant Japonais Authentique","5 Rue Frédéric Et Irene Joliot Curie, Fleury-les-Aubrais",NA
45262,Lorient Kebab,ChIJh_toi3Jh5EcRLGCgyyyrPwc,Restaurant De Pizzas,"1 Place Ste Barbe, Orgères-en-Beauce",1
45262,Kebab Express,ChIJ8wvyXC345EcROet_Ae-AgY4,"Kebab, Restaurant De Restauration Rapide","43 Rue De Paris, Chevilly",1
45262,Cirik Llker,ChIJT5KaWy345EcRqs5LnQHwIyU,"Kebab, Restaurant De Restauration Rapide, Restaurant De Pizzas","43 Rue De Paris, Chevilly",1
45262,Le Cercottois,ChIJH5V6KPX55EcR7UgRbkaNGO4,"Restaurant De Restauration Rapide, Bar Et Grill, Épicerie, Restaurant De Hamburgers, Kebab, Livraison De Pizzas, Restaurant De Pizzas","41 Route Nationale 20, Cercottes",1
45262,Centre Commercial Cap Saran,ChIJS7eEB_v65EcRWBLBEYuwr3o,"Centre Commercial, Chocolaterie, Magasin De Vêtements, Magasin De Verre, Salon De Coiffure, Bijoutier, Magasin De Chaussures, Restaurant De Tacos, Magasin De Jeux Vidéo","2601 Route Nationale 20, Saran",1
45262,Le Saint Florian,ChIJVRHyYUr15EcR_FBQFUiGegE,"Bar, Restaurant Français","21 Rue De La Croix Blanche, Patay",0
45262,Le Relais Saint Jacques,ChIJ3802ar6L5EcRXEQrI-FgVnE,"Restaurant, Restaurant Français, Hôtel","35 Rue De La Mairie, Tournoisis",0
45262,Mcdonald's,ChIJ6YOXpB9Y5EcRLa7hyDcUGOA,"Restaurant De Restauration Rapide, Restaurant Américain, Restaurant De Hamburgers, Restaurant De Pizzas, Restaurant, Sandwicherie","Zac Artenay Poupry Secteur, Artenay",0
45262,Courtepaille,ChIJEX6Ie_NX5EcRBnB0v9eihZ0,"Restaurant De Steakhouse Français, Gril, Bar Et Grill, Restaurant Familial, Restaurant Français, Restaurant De Plats De Viande, Restaurant","N20, Artenay",0
45262,Le Pique Assiette,ChIJ873IDfNX5EcR_NfSj7Fsm6Q,"Restaurant, Bar, Restaurant Français, Restaurant À Emporter","29 Rue De Chartres, Artenay",0
45262,Thaï Break - Cap Saran,ChIJQ8T0eR_75EcRsTcpGyPEDW0,"Restaurant Thaïlandais, Restaurant Familial, Restaurant De Fondue Chinoise, Restaurant De Wok","2601 Rte Nationale, Saran",NA
45262,Otaru,ChIJLw0q9Uz75EcR8t-2r9LP8MU,Restaurant Japonais,"131 Rue Thomas Edison, Saran",NA
45262,Sushi Daily Saran,ChIJDYdhKcX75EcR3mEnEOe2XkA,"Sushis À Emporter, Kiosque","2601 Route Nationale 20, Saran",NA
45262,Хадилия,ChIJo39oHCv75EcRF-dTm4YKslY,Restaurant Asiatique,"123 Rue Georges Coignet, Saran",NA
45262,Ts.art & Mets,ChIJayIQQZj75EcRshHHWRcWW7U,"Traiteur, Restaurant Africain, Restaurant Américain, Restaurant Asiatique, Restaurant Barbecue, Restaurant De Petit-Déjeuner, Pâtisserie, Restaurant Chinois, Restaurant Français","All. Du Bois Bouchet, Saran",NA
45263,Au Carré,ChIJRfkEK96x5UcRj2uuMzocj3s,"Restaurant De Restauration Rapide, Restaurant De Hamburgers, Kebab, Restaurant De Pizzas, Sandwicherie, Restaurant De Tacos","25 Rue De Paris, Sermaises",1
45263,Restaurant Istanbul Étampes,ChIJRbXzjT7J5UcRG7G9ROUBBUE,Restaurant Turc,"16 Rue De La Tannerie, Étampes",1
45263,5th Avenue Etampes,ChIJgVJmzpbJ5UcRKpMb0OVKFJY,"Restaurant De Hamburgers, Restaurant Halal, Restaurant Du Déjeuner, Restaurant De Pizzas, Restaurant De Tacos","4 Rue De La Juiverie, Étampes",1
45263,Pause Poulet Etampes,ChIJAUG0rBTL5UcRdyUUVLm3iZ0,Restaurant Halal,"121 Rue Saint-Jacques, Étampes",1
45263,Bb Tacos,ChIJp9HR49jL5UcRHbCfoPKWSU8,"Restaurant De Tacos, Restaurant De Restauration Rapide","148 Rue Saint-Jacques, Étampes",1
45263,Au Repos De La Vallée De La Juine,ChIJYQbRbAG25UcRUKGsGqG3Afg,"Restaurant, Salle De Banquet, Traiteur, Restaurant Français, Restaurant De Pizzas","2 Rue De La République, Boissy-la-Rivière",0
45263,Croque O Sel,ChIJ2e2cGpW15UcR2BwjySaehXk,"Restaurant, Restaurant Gastronomique, Restaurant Français","3 Pl. De L'église, Saclas",0
45263,Le Merelis,ChIJtzlyIym15UcRa4-bk3G0RYI,Restaurant Français,"2 Av. De La République, Le Mérévillois",0
45263,Le Vieux Chaudron,ChIJDSA2cDrJ5UcR7AmcxroWlvI,"Restaurant Français, Traiteur, Restaurant","45 Grande Rue, Ormoy-la-Rivière",0
45263,Le Relais De Mondésir,ChIJhXE-jT215UcRkDr4uRXDNGw,"Restaurant Français, Relais Routier","N20, Guillerval",0
45263,Sushi Daily Etampes,ChIJP2jyasnJ5UcRZVAXY1p2YeQ,Sushis À Emporter,"Carrefour Etampes, Étampes",NA
45263,Kaiten Sushi Restaurant Japonais,ChIJNQIu9GvJ5UcRqyJbBksVXHE,"Restaurant Japonais, Restaurant De Sushis","1 Av. De Coquerive, Étampes",NA
45263,Bojanam-Restaurant Indien,ChIJF71f_hnJ5UcRty1GNluesqM,Restaurant Indien,"24 Rue De La Juiverie, Étampes",NA
45263,Le Kashmir Etampes,ChIJ28IR4tjL5UcRfMgmOKY4x8o,"Restaurant Indien, Restaurant Pakistanais","2 Pl. Saint-Gilles, Étampes",NA
45263,Kyotorama,ChIJSSNDhmbJ5UcRDKrD8bTNKvI,"Restaurant Japonais, Restaurant De Sushis","40 Rue Sainte-Croix, Étampes",NA
45264,Kebab D'ingré,ChIJp-nRgUHw5EcRKB1rylqex1c,Restaurant De Restauration Rapide,"235 Rte Nationale, Ingré",1
45264,Majesty Pizza,ChIJr48NAevv5EcRMB83bfYnuJc,"Restaurant, Kebab, Restaurant De Pizzas","34 Rue Nationale, La Chapelle-Saint-Mesmin",1
45264,Bodrum,ChIJmz6DOOzv5EcR1q9nKWs-BTI,"Kebab, Restaurant De Restauration Rapide, Restaurant De Tacos","130 Rte D'orléans, La Chapelle-Saint-Mesmin",1
45264,Mag’dalle,ChIJOWdk9a_r5EcRH_j-dAYpMSk,"Restaurant De Restauration Rapide, Kebab, Restaurant De Tacos","42 Rue De La Gare, Meung-sur-Loire",1
45264,Night Snacks : Livraison A Domicile,ChIJJf9-ioTv5EcRaP9AzEOUQjo,"Restaurant De Restauration Rapide, Distributeur De Boissons, Magasin Général, Restaurant De Hamburgers, Kebab, Restaurant De Livraison, Livraison De Pizzas, Service D'expédition, Restaurant De Tacos","436 Rue Saint-Fiacre, Mareau-aux-Prés",1
45264,B 2 S,ChIJN1tCn3bu5EcRduWEoTzAIaY,"Restaurant Français, Bar","15 Pl. Du Bourg, Chaingy",0
45264,Le Lucky's,ChIJUQ88dRWO5EcR1UyP4TdeZN4,"Restaurant, Bar, Café, Restaurant Français","7 Rue De La Libération, Charsonville",0
45264,La Poule Blanche,ChIJ9YBs4VPw5EcRukwjnEiQfVg,"Restaurant, Restaurant Français","123 Rue Nationale, Ormes",0
45264,Gem Cuisiner,ChIJ38dBLPXx5EcRMOrjTOtxrSg,"Traiteur, Restaurant Français, Restaurant Du Déjeuner, Restaurant Méditerranéen, Restaurant Espagnol","16 Rue Du Vivier, Ormes",0
45264,Nuanzza,ChIJCdauPzrw5EcRcxy0YD6MOHk,"Restaurant, Restaurant Français","6 Rue De Changelin, Ingré",0
45264,Coco,ChIJcx7ZNmHt5EcRpxh9oYeWHS0,Restaurant Japonais,"4 Rue Jean Moulin, Meung-sur-Loire",NA
45264,Ts.art & Mets,ChIJayIQQZj75EcRshHHWRcWW7U,"Traiteur, Restaurant Africain, Restaurant Américain, Restaurant Asiatique, Restaurant Barbecue, Restaurant De Petit-Déjeuner, Pâtisserie, Restaurant Chinois, Restaurant Français","All. Du Bois Bouchet, Saran",NA
45264,Nems Croquants,ChIJ88SzJOLl5EcRVzcM3_sOtEY,"Restaurant À Emporter, Traiteur, Plats Chinois À Emporter","20 Rue Amédéo Modigliani, Saint-Jean-de-la-Ruelle",NA
45264,Sushi King,ChIJLb4FQU3l5EcReoZ5yZ7SW2Y,"Restaurant De Sushis, Restaurant Japonais","Av. Pierre Mendès France, Saint-Jean-de-la-Ruelle",NA
45264,Хадилия,ChIJo39oHCv75EcRF-dTm4YKslY,Restaurant Asiatique,"123 Rue Georges Coignet, Saran",NA
45265,Crousti Liban,ChIJbSuNB5h370cR93WHjhF5q5Q,Restaurant Libanais,"1 Rte D'egreville, Ervauville",1
45265,Flash Kebab,ChIJWb-CUBB770cRsb5LmqF6rqA,"Kebab, Restaurant De Restauration Rapide","12 Rue Saint-Martin, Égreville",1
45265,Mr Kebab,ChIJR1MukOV_70cRKFdJSLntEa4,Restaurant,"2 Rue Du Bois Plantè, Ferrières-en-Gâtinais",1
45265,Flash Kebap,ChIJjeYYOH1170cR_kClsYS7xLE,"Restaurant Turc, Restaurant De Restauration Rapide","21 Rue De Villeneuve, Courtenay",1
45265,Chez Baki,ChIJUY2P5RsU70cRQwS0pgNPors,"Restaurant Turc, Kebab","8 Rue Emile Bru, Lorrez-le-Bocage-Préaux",1
45265,Bouill'a Betz,ChIJ7fjpnzlx70cRUD6oteDx9Xo,"Restaurant, Restaurant Français","5 Rue Du Midi, Bazoches-sur-le-Betz",0
45265,La Grange,ChIJ-4xMz6xx70cRM3AXghBWYcI,"Restaurant, Restaurant Français","23 Pl. De L'église, Jouy",0
45265,Le Relais De Courtemaux,ChIJLVpF_OZ370cRKCEBi21Qh2U,"Restaurant, Restaurant Français","29 Rue De La Mairie, Courtemaux",0
45265,Biscuits Cm Les Petits Plaisirs,ChIJQ2oIOHV570cRomgRI0YmXTw,"Confiserie, Pâtisserie, Chocolaterie, Boutique De Beignets, Restaurant Français, Épicerie Fine, Glacier, Restaurant De Crêpes, Pâtisserie","Le Poirier Des Femmes, La Selle-sur-le-Bied",0
45265,Auberge De La Cléry,ChIJzQjTfuN170cRy6AxmLq58z4,"Restaurant, Café, Traiteur, Restaurant Français","14 Rue Grande Rue, Saint-Hilaire-les-Andrésis",0
45265,Kun Yaye,ChIJ3XpPEgBx70cRzL4G4dCJ9jU,Restaurant Thaïlandais,"3 Ldt La Ratonnerie, Le Bignon-Mirabeau",NA
45265,Indian Meat,ChIJC21kTgB770cRjZctA1p7doA,Restaurant Indien,"50 Rue Saint-Martin, Égreville",NA
45265,100% Thaï,ChIJIcEZdgB170cRM7mifhWprZQ,Restaurant Asiatique,"36 Pl. Armand Chesneau, Courtenay",NA
45265,Sushi Yummy,ChIJbQjlCzx_70cRqTkB1n2SjVI,Restaurant Japonais,"2 Rue Saint-Lazare, Ferrières-en-Gâtinais",NA
45265,Restaurant A La Vieille Halle,ChIJrX-r7CGH5UcRHCQtT3MjSNE,Restaurant Vietnamien,"1 Rue Voltaire, Souppes-sur-Loing",NA
45266,Le Kebab De La Chapelle,ChIJuTQG1qlR5EcRvPooiUbGdEk,Restaurant,"60 Av. De La Chapelle, Toury",1
45266,Allo Presto Pizza,ChIJwf9yVrxR5EcR4WYEBoAIPeo,"Restaurant De Restauration Rapide, Kebab, Restaurant De Pizzas, Restaurant, Sandwicherie","79 Rue Nationale, Toury",1
45266,O Delice Pizza Kebab,ChIJg1A3rDpT5EcRmTOjd3mHXEo,Restaurant De Restauration Rapide,"13 Grande Rue, Bazoches-les-Gallerandes",1
45266,Avanoce & Kebap,ChIJRbbcCaWq5UcRoj6ZoHwVqUI,"Kebab, Bar, Restaurant De Restauration Rapide, Restaurant Italien","34 Pl. Général Leclerc, Neuville-aux-Bois",1
45266,Istanbul Kebab,ChIJBWH2Iiyr5UcRIDprXEtFoxc,Kebab,"45 Pl. Général Leclerc, Neuville-aux-Bois",1
45266,Chez Vero Et Gaela,ChIJ_R3PsdJQ5EcRFwsa3MPNawo,"Restaurant Français, Bar","1 Rue Charles Péguy, Santilly",0
45266,E I Les Gourmandises De Panpan,ChIJ7yJR1VpX5EcR36kASmtIpoU,"Glacier, Crêperie","18 Rue Du Nan, Artenay",0
45266,Restaurant - La Fontaine -Artenay,ChIJtZT8d_JX5EcRt2tUXa_b7WU,Restaurant Français,"2 Pl. De L Hôtel De Ville, Artenay",0
45266,Le Pique Assiette,ChIJ873IDfNX5EcR_NfSj7Fsm6Q,"Restaurant, Bar, Restaurant Français, Restaurant À Emporter","29 Rue De Chartres, Artenay",0
45266,Courtepaille,ChIJEX6Ie_NX5EcRBnB0v9eihZ0,"Restaurant De Steakhouse Français, Gril, Bar Et Grill, Restaurant Familial, Restaurant Français, Restaurant De Plats De Viande, Restaurant","N20, Artenay",0
45266,L'auberge Du Bonheur,ChIJP_Z2SHIB5UcRfMpAaM9fRYo,"Restaurant Asiatique, Bar, Restaurant Chinois, Restaurant Thaïlandais","367 Rue Du 17 Juin 1940, Loury",NA
45266,Otaru,ChIJLw0q9Uz75EcR8t-2r9LP8MU,Restaurant Japonais,"131 Rue Thomas Edison, Saran",NA
45266,Thaï Break - Cap Saran,ChIJQ8T0eR_75EcRsTcpGyPEDW0,"Restaurant Thaïlandais, Restaurant Familial, Restaurant De Fondue Chinoise, Restaurant De Wok","2601 Rte Nationale, Saran",NA
45266,Sushi Daily Saran,ChIJDYdhKcX75EcR3mEnEOe2XkA,"Sushis À Emporter, Kiosque","2601 Route Nationale 20, Saran",NA
45266,Yoyoshi,ChIJEXndzMv75EcRA0bR29nObSo,Restaurant Japonais,"77 All. De L'orée De La Forêt, Saran",NA
45268,Boule Burger,ChIJq5jPyqRp5UcR1LvZ3N3pIdw,"Restaurant De Restauration Rapide, Restaurant Halal, Kebab","23 Pl. De L Hôtel De Ville, Ouzouer-sur-Loire",1
45268,Le Pacha,ChIJzRA1-MVq5UcR4j_h0JbSCKA,"Restaurant, Restaurant De Restauration Rapide, Restaurant Turc","4 Bd Du Champ De Foire, Sully-sur-Loire",1
45268,Sully Kebab,ChIJ62f-b89q5UcRLhES6h8LkwA,Restaurant,"1 Rue Des Huiliers, Sully-sur-Loire",1
45268,La Rose Blanche,ChIJs3uwRsVr5UcRG8zrIJugcBY,Restaurant Marocain,"8 Rue Du Grand Sully, Sully-sur-Loire",1
45268,Encas2faim Gien - Livraison De Nuit A Domicile (35km),ChIJk58nbVhf5UcRU72xRPj0nEE,Restaurant De Tacos,"3 Rue De La Fabrique, Gien",1
45268,Restaurant L'abricotier,ChIJa6A1L7tp5UcRAMTvkP7CQk0,"Restaurant, Restaurant Français","106 Rue De Gien, Ouzouer-sur-Loire",0
45268,Cannelle,ChIJ4xnxKLtp5UcRA48l6t-beyA,Crêperie,"120 Rue De Gien, Ouzouer-sur-Loire",0
45268,Atrium De Sully,ChIJ4ZP3icVq5UcRFXn5RAOl8zs,"Restaurant, Restaurant Français, Salon","6 Rue Prte De Sologne, Sully-sur-Loire",0
45268,Relais Maximilien,ChIJb86L7Mlq5UcRTDRFtLsBg_A,"Restaurant, Pension De Famille, Restaurant Français, Hôtel","47 Av. De La Gare, Sully-sur-Loire",0
45268,La Rome Antique,ChIJOXEWmM9q5UcRCwGxDQZZPmE,"Restaurant, Magasin De Bière, Fromagerie, Restaurant Sans Gluten, Glacier, Restaurant Italien, Magasin De Pâtes, Restaurant De Fruits De Mer, Bar À Vin","1 Rue Du Grand Sully, Sully-sur-Loire",0
45268,Restaurant Traiteur Asiatique Chez Wang,ChIJ55Lm9cVq5UcRVW4O7n3i5aM,"Restaurant Chinois, Restaurant Asiatique","19 Rue Prte De Sologne, Sully-sur-Loire",NA
45268,Sushi D’or Restaurant,ChIJafT04h1r5UcRtcDWY8ZpMmc,Restaurant Japonais,"5 Rue Du Grand Sully, Sully-sur-Loire",NA
45268,Le Bœuf D'or,ChIJp3DaLXhe5UcRc3D-WZUCPFE,"Restaurant Buffet, Restaurant Chinois, Restaurant Japonais","29 Av. Des Montoires, Gien",NA
45268,Krishnou Bhavan,ChIJT3cCJpBe5UcRq6zQvvSauwA,"Restaurant Indien, Brasserie, Traiteur, Restaurant Indien Musulman, Salon De Thé","12 Quai Lenoir, Gien",NA
45268,Paradis Sushi,ChIJdzy-JY5e5UcRpC1Y2qU0d0w,"Restaurant Japonais, Restaurant De Sushis","13 Pl. Leclerc, Gien",NA
45269,Night Snacks : Livraison A Domicile,ChIJJf9-ioTv5EcRaP9AzEOUQjo,"Restaurant De Restauration Rapide, Distributeur De Boissons, Magasin Général, Restaurant De Hamburgers, Kebab, Restaurant De Livraison, Livraison De Pizzas, Service D'expédition, Restaurant De Tacos","436 Rue Saint-Fiacre, Mareau-aux-Prés",1
45269,L’étoile Fast-Food Cléry Saint André,ChIJ5z_lwqLr5EcRcMYJFH8PH9I,Kebab,"101 Rue Du Maréchal Foch, Cléry-Saint-André",1
45269,Mag’dalle,ChIJOWdk9a_r5EcRH_j-dAYpMSk,"Restaurant De Restauration Rapide, Kebab, Restaurant De Tacos","42 Rue De La Gare, Meung-sur-Loire",1
45269,Presto Pizza,ChIJMwvZJzrr5EcRFoHsiz-OieQ,"Restaurant, Pâtisserie, Restaurant De Restauration Rapide, Restaurant Halal, Glacier, Restaurant Du Déjeuner, Restaurant De Pizzas, Magasin De Salades","44 Rue Jehan De Meung, Meung-sur-Loire",1
45269,Majesty Pizza,ChIJr48NAevv5EcRMB83bfYnuJc,"Restaurant, Kebab, Restaurant De Pizzas","34 Rue Nationale, La Chapelle-Saint-Mesmin",1
45269,L'agylien,ChIJ67GfFjrs5EcRcrwIP2pLLus,Restaurant Français,"118 Rte Nationale, Saint-Ay",0
45269,La Grande Tour,ChIJBVRPBTDs5EcR_aMhzDxhRiw,"Restaurant Français, Restaurant Gastronomique","21 Rte Nationale, Saint-Ay",0
45269,B 2 S,ChIJN1tCn3bu5EcRduWEoTzAIaY,"Restaurant Français, Bar","15 Pl. Du Bourg, Chaingy",0
45269,Le Relais De Fourneaux,ChIJM7J9V1ru5EcRQTCB-p_5iHk,"Restaurant, Restaurant De Petit-Déjeuner, Restaurant Buffet, Restaurant Français, Hôtel, Relais Routier","47 Rte D'orléans, Chaingy",0
45269,Le Marmiton,ChIJF0rDdN3u5EcRAX-n3vEGZxQ,Restaurant Français,"620 Rue Saint-Fiacre, Mareau-aux-Prés",0
45269,Coco,ChIJcx7ZNmHt5EcRpxh9oYeWHS0,Restaurant Japonais,"4 Rue Jean Moulin, Meung-sur-Loire",NA
45269,Baule Bowls,ChIJvV5AZE3r5EcRmyA0DNakUUo,"Restaurant De Restauration Rapide, Restaurant Japonais, Poké Bar, Restaurant De Ramen","Route De Baule, Baule",NA
45269,Niconicoya Baule (45) - Sushi Edomae,ChIJneD5ZgaV5EcROTFvxxfwFhI,"Sushis À Emporter, Magasin De Bière, Traiteur, Restaurant Sans Gluten, Restaurant Japonais Authentique, Restaurant Du Déjeuner, Restaurant De Sushis, Restaurant Végétalien","19 Bis Rue Jean Bordier, Baule",NA
45269,Nems Croquants,ChIJ88SzJOLl5EcRVzcM3_sOtEY,"Restaurant À Emporter, Traiteur, Plats Chinois À Emporter","20 Rue Amédéo Modigliani, Saint-Jean-de-la-Ruelle",NA
45269,Sushi King,ChIJLb4FQU3l5EcReoZ5yZ7SW2Y,"Restaurant De Sushis, Restaurant Japonais","Av. Pierre Mendès France, Saint-Jean-de-la-Ruelle",NA
45270,La Rose Blanche,ChIJs3uwRsVr5UcRG8zrIJugcBY,Restaurant Marocain,"8 Rue Du Grand Sully, Sully-sur-Loire",1
45270,Sully Kebab,ChIJ62f-b89q5UcRLhES6h8LkwA,Restaurant,"1 Rue Des Huiliers, Sully-sur-Loire",1
45270,Le Pacha,ChIJzRA1-MVq5UcR4j_h0JbSCKA,"Restaurant, Restaurant De Restauration Rapide, Restaurant Turc","4 Bd Du Champ De Foire, Sully-sur-Loire",1
45270,Kebab Pacha,ChIJ24DliGAQ5UcRAZONhnMaxzI,Restaurant De Restauration Rapide,"28 Grande Rue, Châteauneuf-sur-Loire",1
45270,Boule Burger,ChIJq5jPyqRp5UcR1LvZ3N3pIdw,"Restaurant De Restauration Rapide, Restaurant Halal, Kebab","23 Pl. De L Hôtel De Ville, Ouzouer-sur-Loire",1
45270,Restaurant Du Grand Saint Benoît,ChIJn9PKZnIU5UcROGCd7mtnjcE,"Restaurant Français, Restaurant Gastronomique","7 Pl. Saint-André, Saint-Benoît-sur-Loire",0
45270,Hôtel Restaurant La Madeleine,ChIJZ_2nfHIU5UcRiHg3-HjnjgU,"Restaurant, Restaurant Français, Hôtel","65 Rue Orleanaise, Saint-Benoît-sur-Loire",0
45270,Mam's Cuisine,ChIJP9iFXO8R5UcRNCDbUNXIG7U,"Traiteur, Pâtisserie, Restaurant Français, Pâtisserie, Restaurant Espagnol, Restaurant Traditionnel","10 Rue D'aigrefin, Saint-Martin-d'Abbat",0
45270,Aux P'tits Oignons,ChIJDVwO8cxq5UcRftti8ay3z5A,"Restaurant, Restaurant Français","1 Rue Du Port Au Bois, Sully-sur-Loire",0
45270,Restaurant Des Arts,ChIJpVeQwD1r5UcRDCoSWqD90oQ,"Restaurant, Bar, Café, Restaurant Français","2 Rue Du Faubourg Saint-Germain, Sully-sur-Loire",0
45270,Sushi D’or Restaurant,ChIJafT04h1r5UcRtcDWY8ZpMmc,Restaurant Japonais,"5 Rue Du Grand Sully, Sully-sur-Loire",NA
45270,Restaurant Traiteur Asiatique Chez Wang,ChIJ55Lm9cVq5UcRVW4O7n3i5aM,"Restaurant Chinois, Restaurant Asiatique","19 Rue Prte De Sologne, Sully-sur-Loire",NA
45270,Lotus D'or,ChIJT7T1Al8Q5UcRbu1uF8NGhjg,Restaurant Asiatique,"77 Bis Grande Rue, Châteauneuf-sur-Loire",NA
45270,Asie Pacifique,ChIJS6yYcXkb5UcR4DrQ-KzBUtQ,"Restaurant Asiatique, Restaurant Mandarin, Restaurant, Restaurant Thaïlandais","15 Bd Prte Madeleine, Jargeau",NA
45270,Le Royal Hongshun,ChIJW9tplm505UcRvEydJgpcdFg,"Restaurant, Restaurant Chinois","7 Pl. Charles Desvergnes, Bellegarde",NA
45271,Le Z Fast-Food,ChIJwdgqF9v370cR9hdYSP-hdGM,Restaurant Halal,"3 Rue De La Liberté, Briare",1
45271,Asya Kebab,ChIJRxbidGT270cRBJ81F3BbvSI,"Restaurant, Restaurant De Restauration Rapide, Kebab","35 Rue De La Liberté, Briare",1
45271,O Regal,ChIJdzy-JY5e5UcRdqG6Evqx6FE,Kebab,"13 Av. Maréchal Leclerc, Gien",1
45271,Amico,ChIJX1pBY45e5UcRj-7Sd5KP18w,"Restaurant De Pizzas, Restaurant Italien, Kebab","21 Av. Maréchal Leclerc, Gien",1
45271,Shibo Restaurant,ChIJk4gTY45e5UcRdUKgKc0az8E,"Restaurant, Restaurant Turc","3 Rue De Montbricon, Gien",1
45271,La Taverne,ChIJsTybZ7ZY5UcRkuD-XruoQIU,"Restaurant, Bar, Restaurant Français","3 Rue D'autry, Saint-Brisson-sur-Loire",0
45271,Restaurant L'estancia,ChIJc12CG3r270cR0mHQPbmU1e4,"Restaurant, Restaurant Gastronomique, Restaurant Français","13 Av. Yver Bapterosses, Briare",0
45271,Restaurant Le Saint-Hubert De Briare,ChIJ-ak37mX270cRqXMWzEjkbFE,"Restaurant Français, Bar, Bistro, Brasserie, Café, Restaurant","2 Rue Des Grandes Allées, Briare",0
45271,Le Petit Saint Trop,ChIJafq_W2T270cRT4MLUA9ZCh0,"Restaurant Français, Bar","5 Rue Tissier, Briare",0
45271,Le Bord D'eau,ChIJMWLEb2T270cReaLxoRef6ls,Restaurant Français,"19 Rue De La Liberté, Briare",0
45271,O'thaï,ChIJVx4RcvFe5UcRHk9b6-7g5ZY,Restaurant Thaïlandais,"66 Rue Des Champs De La Ville, Gien",NA
45271,Restaurant Pho 86,ChIJ4b9MAM5f5UcRedYpstwRBD4,Restaurant Asiatique,"15 Av. Maréchal Leclerc, Gien",NA
45271,Paradis Sushi,ChIJdzy-JY5e5UcRpC1Y2qU0d0w,"Restaurant Japonais, Restaurant De Sushis","13 Pl. Leclerc, Gien",NA
45271,Krishnou Bhavan,ChIJT3cCJpBe5UcRq6zQvvSauwA,"Restaurant Indien, Brasserie, Traiteur, Restaurant Indien Musulman, Salon De Thé","12 Quai Lenoir, Gien",NA
45271,Le Bœuf D'or,ChIJp3DaLXhe5UcRc3D-WZUCPFE,"Restaurant Buffet, Restaurant Chinois, Restaurant Japonais","29 Av. Des Montoires, Gien",NA
45272,Restaurant Mayyel,ChIJgRSYr5_j5EcRE5flhK8-rBs,Restaurant Libanais,"80 Rue Du 11 Novembre 1918, Saint-Cyr-en-Val",1
45272,Bunny's,ChIJBaRjvwjk5EcR4100qPwecSk,"Restaurant Halal, Restaurant De Hamburgers, Kebab, Restaurant De Livraison, Restaurant De Pizzas, Restaurant, Restaurant De Tacos","5 Av. De La Bolière, Orléans",1
45272,Allo Food Night Orleans 45 Livraison De Nuit,ChIJxUCGygTk5EcRycyjyyNy6tQ,"Restaurant Halal, Restaurant De Livraison","2 Rue Alfred De Musset, Orléans",1
45272,Encas 2 Faim,ChIJSe3_U_Xl5EcR173UzIx6aXg,"Kebab, Restaurant De Restauration Rapide","149 Rue De Champagne, Olivet",1
45272,Sahtayn Mets Libanais,ChIJs4OsnNPl5EcRiwb3nRpQLd0,Restaurant Libanais,"19 Pl. De La Bascule, Orléans",1
45272,Le Val Trio,ChIJycCT-trj5EcRC03NgpmyJtU,"Restaurant De Pizzas, Restaurant Français, Restaurant Italien, Restaurant","67 Rue D'orléans, Saint-Cyr-en-Val",0
45272,L'auberge Saint Hubert,ChIJ9dMeddrj5EcRDQnRUwFDL4k,"Restaurant Portugais, Restaurant Français","145 Rue Du 11 Novembre 1918, Saint-Cyr-en-Val",0
45272,Clos De Saint Cyr,ChIJp6A8Dlrh5EcRYvC1jrMMPcs,Restaurant Français,"2108 Rue De La Gare, Saint-Cyr-en-Val",0
45272,O Bistro 110,ChIJv9Zzdz3k5EcRrW_VE9nt2BA,"Restaurant Barbecue, Restaurant Familial, Restaurant Français, Restaurant De Hamburgers, Restaurant De Plats De Viande, Restaurant","Zac, Olivet",0
45272,Del Arte,ChIJvySRhT3k5EcRMIMXZzDwSow,"Restaurant, Restaurant Familial, Restaurant Français, Restaurant Italien, Restaurant Du Déjeuner, Restaurant À Emporter, Restaurant Méditerranéen, Restaurant Du Nord De L'italie, Restaurant De Pizzas, Restaurant Du Sud De L'italie","Quartier Des Provinces, Olivet",0
45272,Mont Fuji,ChIJ_QMMhxPk5EcRxPbqxnGaTSQ,"Restaurant Japonais, Restaurant Asiatique, Restaurant Buffet, Restaurant, Restaurant De Sushis","11 Rue De Champagne, Olivet",NA
45272,Wokasie,ChIJb9-L1xXk5EcRXstSkqu1fkE,"Restaurant Chinois, Restaurant Buffet, Restaurant","45 Rue De Champagne, Olivet",NA
45272,Kogi,ChIJe_dyvdHk5EcRj1sgc8_eFlw,Restaurant Coréen,"149 Rue De Champagne Olivet, Olivet",NA
45272,Kogi Saran,ChIJwR__00Xl5EcRiqzxo6T4sIg,Restaurant Asiatique,"France, Olivet",NA
45272,Sushi Shop,ChIJD8Hx_IPl5EcRrEzFCg6jsO0,"Restaurant De Sushis, Restaurant Asiatique, Restaurant De Restauration Rapide, Restaurant Japonais, Restaurant À Emporter, Restaurant Panasiatique, Sushis À Emporter","181 Rue D'artois, Olivet",NA
45273,Saint Denis Kebab,ChIJFQPxi3Eb5UcRYM7wUsQ44gY,"Restaurant, Restaurant De Restauration Rapide, Kebab","11 Rue De La Bordé, Saint-Denis-de-l'Hôtel",1
45273,St Denis Turquoise Kebab,ChIJA8dr0W8b5UcR9QLBZj8qmGE,Restaurant,"45550 Saint-Denis-De-L'hôtel, Saint-Denis-de-l'Hôtel",1
45273,Crousty Food,ChIJ_TxWs3kb5UcR96PPavp6bTA,"Restaurant, Restaurant Barbecue, Pâtisserie, Restaurant De Restauration Rapide, Restaurant Halal, Restaurant De Hamburgers, Kebab, Magasin De Salades, Sandwicherie","1 Rue D'orléans, Jargeau",1
45273,Kebab Pacha,ChIJ24DliGAQ5UcRAZONhnMaxzI,Restaurant De Restauration Rapide,"28 Grande Rue, Châteauneuf-sur-Loire",1
