respondent.commune,business_name,place_id,fr_categories,business_address,treatment_arm
56068,Koemi Sushi (Food Truck),ChIJLz6eYCYpDkgRWanqWuZ6nBo,"Restaurant De Sushis, Restaurant Japonais, Sushis À Emporter","France, Saint-Barnabé",NA
56069,Jiyan Kebab,ChIJcbHJVAb1EEgRs-Ofv8Ym1v4,Kebab,"1 Rue Du Fort Bloqué, Ploemeur",1
56069,Woodfire - Restaurant Lorient,ChIJlVyOH89fEEgRQTHaCpgY2a8,"Pizza À Emporter, Restaurant Halal, Livraison De Pizzas, Restaurant De Pizzas","71 Rue De Lanveur, Lorient",1
56069,Le Nemrut Kebab,ChIJeW5uCkpeEEgRGp9K3HI1hDA,"Restaurant Turc, Restaurant De Restauration Rapide, Kebab, Pizza À Emporter, Restaurant De Tacos","8 Bd Du Général Leclerc, Lorient",1
56069,Le Palais Du Kebab Lorient,ChIJl3MDd9tfEEgR0BcPnBziGxo,Restaurant Turc,"36 Cr De La Bôve, Lorient",1
56069,Gomu Lorient,ChIJLecTQj9fEEgRb5FpOhaAYH0,"Restaurant De Hamburgers, Restaurant Américain, Restaurant De Fusion Asiatique, Restaurant De Restauration Rapide, Restaurant Halal, Restaurant De Fondue Chinoise, Restaurant Coréen, Restaurant À Emporter, Restaurant Panasiatique","15 Rue De L'assemblée Nationale, Lorient",1
56069,Auberge Du Pêcheur Restaurant Pub,ChIJfx2OpNKLEEgR8vgg0s4lHnA,"Restaurant Français, Bar","58 Rue Du Général De Gaulle, Groix",0
56069,Les Garçons Du Port - Restaurant-Bar - Vue Mer - Île De Groix,ChIJC26IqNKLEEgRt9xk_vapJlk,"Bistro, Bar, Restaurant Français","Port Tudy, Groix",0
56069,L’ancre De La Marine - Restaurant Bar,ChIJnRMaBBKLEEgR8bbs97mXAQw,"Restaurant, Bar, Bar Pmu, Bar À Tabac, Bar À Cocktails, Restaurant Français, Restaurant De Hamburgers, Brasserie, Bureau De Tabac","1 Rte Des Plages, Groix",0
56069,"Le Cinquante, Restaurant, Cave À Vins Et Chambres D'hôtes À Groix",ChIJKS93ItGLEEgRRnkJiikZv1M,"Restaurant, Chambres D'hôtes, Restaurant Français, Cave À Vin","22 Pl. De L'église, Groix",0
56069,Le Safran,ChIJyfWGHNGLEEgRmCg26srhk3Y,"Restaurant, Bar, Restaurant Français","25 Pl. De L'église, Groix",0
56069,Plats Chinois À Emporter - Yanzi,ChIJUfXx8Uf1EEgR_A6lN4cg0c0,Plats Chinois À Emporter,"10 Rue Bossuet, Ploemeur",NA
56069,Chao Asia,ChIJGahM1U1fEEgRNhYO76UK628,"Restaurant Asiatique, Épicerie Asiatique, Traiteur, Plats Chinois À Emporter, Restaurant De Restauration Rapide, Restaurant De Fondue Chinoise, Restaurant Mandarin, Restaurant De Ramen, Restaurant De Sushis, Sushis À Emporter","23 Grande Rue, Locmiquélic",NA
56069,Sky Sushi Riantec,ChIJadtRAThnEEgRs8vlRqoslus,"Restaurant, Restaurant Japonais, Restaurant Thaïlandais, Restaurant De Wok","7 Pl. Aimé Corvec, Riantec",NA
56069,Restaurant Hong Kong,ChIJ0xoYcE1eEEgRAmk9IEzCNpI,"Restaurant, Restaurant Asiatique, Magasin De Bière, Bar À Cocktails, Glacier, Restaurant Du Déjeuner, Bar À Vin","21 Av. De La Marne, Lorient",NA
56069,Aloye,ChIJ37wKdlBeEEgRBVUDJ6WUmYE,Restaurant Thaïlandais,"11 Quai Des Indes, Lorient",NA
56070,Anatolie Kebab,ChIJO5qMkBnOD0gRynyL62SKe4U,"Restaurant Turc, Restaurant De Restauration Rapide","40 Rue Saint-Jacques, Josselin",1
56070,O'delices Tacos,ChIJoaIg_kLJD0gREx6cuxA-xuk,"Restaurant, Magasin De Bière, Boutique De Beignets, Restaurant Halal, Glacier, Restaurant Du Déjeuner, Restaurant Mexicain, Restaurant Végétarien","60 Rue De La Gare, Ploërmel",1
56070,Délices Kebab,ChIJRQztakrID0gRWp59eJtnFSE,"Kebab, Restaurant De Restauration Rapide","30 Rue De La Gare, Ploërmel",1
56070,Médenine Saveurs,ChIJRfiEHVHJD0gRFTesbgOYLgU,Kebab,"7 Rue René Marie Gaillard, Ploërmel",1
56070,Raoul Restauration,ChIJvddGyrDAD0gRHyDMs0V6DvE,"Pizza À Emporter, Restaurant De Hamburgers, Kebab, Restaurant De Pizzas, Magasin De Salades","17bis Pl. Du Dr Jean Queinnec, Malestroit",1
56070,Crêperie Caro,ChIJOY2eOiHRD0gRnJ20UD-RzBk,"Fabricant De Produits Alimentaires, Crêperie","19 La Pointe, Guégon",0
56070,Osez Crepette,ChIJ2Zgku5LRD0gRgw-Fbf0jMjA,Crêperie,"Unnamed Road, Forges de Lanouée",0
56070,Relay De L'oust,ChIJ1x0fLe_RD0gRcPj6LTChLqE,"Restaurant, Bar, Restaurant Français, Hôtel, Séminaire","16 Le Rouvray En Forges De Lanouée Route Josselin Pontivy, Forges de Lanouée",0
56070,La Terrasse,ChIJIR3tfh_OD0gR4CWtdED3als,"Restaurant, Bar, Restaurant Français","55 Chem. Glatinier, Josselin",0
56070,Crêperie La Marine,ChIJEYMXASLOD0gRK_mPWcBayO0,Crêperie,"8 Rue Du Canal, Josselin",0
56070,Toko Sushi 56,ChIJa2r7a4fED0gRO4O0H01URD8,Restaurant De Sushis,"21 Rue Louise Michel, Sérent",NA
56070,Perle D'asie,ChIJcXZbDUrID0gRI4PdxVvNNbo,"Restaurant Vietnamien, Restaurant Asiatique, Restaurant Chinois, Restaurant, Restaurant D'asie Du Sud-Est, Restaurant Thaïlandais","87 Rue De La Gare, Ploërmel",NA
56070,Le Mékong,ChIJNX0HOjTID0gR4qGPDM_eXjI,"Restaurant Mandarin, Restaurant De Fondue Chinoise, Restaurant Thaïlandais","4 Rue Alphonse Guérin, Ploërmel",NA
56070,Koemi Sushi (Food Truck),ChIJLz6eYCYpDkgRWanqWuZ6nBo,"Restaurant De Sushis, Restaurant Japonais, Sushis À Emporter","France, Saint-Barnabé",NA
56070,Mr Nguyen,ChIJM1pAM7QvDkgRcERpZBcNzZM,"Restaurant, Restaurant Vietnamien","15 Rue De Rennes, Plémet",NA
56071,Anatolie Kebab,ChIJO5qMkBnOD0gRynyL62SKe4U,"Restaurant Turc, Restaurant De Restauration Rapide","40 Rue Saint-Jacques, Josselin",1
56071,Délices Pizza Locminé,ChIJZzoRMiElEEgR5mfbR8ZWrHw,"Restaurant De Pizzas, Service De Livraison D'épicerie, Kebab, Restaurant De Livraison, Livraison De Pizzas, Pizza À Emporter, Restaurant, Sandwicherie, Restaurant De Tacos","16 Rue Olivier De Clisson, Locminé",1
56071,Aux Délices Kebab,ChIJu2AEBxYlEEgRugvF9cBPqE8,Kebab,"21 Rue Chateaubriand, Locminé",1
56071,Pacha Kebab,ChIJ74VGH2AvEEgRx6roctppM7E,"Kebab, Restaurant De Restauration Rapide","8 Rue Auguste Brizeux, Locminé",1
56071,O'delices Tacos,ChIJoaIg_kLJD0gREx6cuxA-xuk,"Restaurant, Magasin De Bière, Boutique De Beignets, Restaurant Halal, Glacier, Restaurant Du Déjeuner, Restaurant Mexicain, Restaurant Végétarien","60 Rue De La Gare, Ploërmel",1
56071,Crêperie Caro,ChIJOY2eOiHRD0gRnJ20UD-RzBk,"Fabricant De Produits Alimentaires, Crêperie","19 La Pointe, Guégon",0
56071,Entre Terre Et Mer,ChIJ9WqOi_zWD0gRVriDB_SsK5o,"Restaurant, Restaurant Français","5 Rue Georges Grignon, Buléon",0
56071,Auberge De Lantillac,ChIJhxNV-7nWD0gRsRZWTwiDo74,Crêperie,"18 Rue Des Forgerons, Lantillac",0
56071,Osez Crepette,ChIJ2Zgku5LRD0gRgw-Fbf0jMjA,Crêperie,"Unnamed Road, Forges de Lanouée",0
56071,Relay De L'oust,ChIJ1x0fLe_RD0gRcPj6LTChLqE,"Restaurant, Bar, Restaurant Français, Hôtel, Séminaire","16 Le Rouvray En Forges De Lanouée Route Josselin Pontivy, Forges de Lanouée",0
56071,Toko Sushi 56,ChIJa2r7a4fED0gRO4O0H01URD8,Restaurant De Sushis,"21 Rue Louise Michel, Sérent",NA
56071,Perle D'asie,ChIJcXZbDUrID0gRI4PdxVvNNbo,"Restaurant Vietnamien, Restaurant Asiatique, Restaurant Chinois, Restaurant, Restaurant D'asie Du Sud-Est, Restaurant Thaïlandais","87 Rue De La Gare, Ploërmel",NA
56071,Le Mékong,ChIJNX0HOjTID0gR4qGPDM_eXjI,"Restaurant Mandarin, Restaurant De Fondue Chinoise, Restaurant Thaïlandais","4 Rue Alphonse Guérin, Ploërmel",NA
56071,Oya Breizh,ChIJGyJ8uLMZEEgRWfsmKjHCoTg,Restaurant Japonais,"3 Rue Camille Claudel Atlanparc, Bâtiment M (Entrée Parking Bâtiment N, Plescop",NA
56071,Restaurant My Thailand,ChIJw156nWgfEEgR-y-oxCEJ-wc,"Restaurant Thaïlandais, Restaurant Asiatique, Restaurant De Restauration Rapide, Restaurant","28 Rue Du Capitaine Jude, Vannes",NA
56072,Délice Kebab,ChIJKR5hu9fXEUgR_M0M15eM6jA,Kebab,"13 Rue De Pontivy, Loudéac",1
56072,Crok'saveur,ChIJU4CkHSgoDkgRORjXjFRaCHg,"Restaurant, Bar, Café, Restaurant De Restauration Rapide, Restaurant À Emporter, Pâtisserie, Sandwicherie, Restaurant De Coupes Glacées, Restaurant De Tacos","10 Place Notre Dame, Loudéac",1
56072,L'escale A Pizza & Kebab Loudeac,ChIJCQLGpRrXEUgRMkAZ2uY7umk,Restaurant,"12 Rue Notre Dame, Loudéac",1
56072,Star Kebab,ChIJC4mNvNnXEUgR--FHzbBFtSU,"Kebab, Restaurant De Restauration Rapide","21 Rue De Moncontour, Loudéac",1
56072,Le Marrakech Breizh,ChIJT0osDeLMEUgRTvx0cyjI79g,"Restaurant Marocain, Restaurant","25 Rue De Lourmel, Pontivy",1
56072,La Canotière 59,ChIJ5T8CiqjVEUgRtxEwcVPjko4,Crêperie,"1 Boju, Gueltas",0
56072,Guillo Olivier,ChIJRbBiJsfVEUgR_kTgQBBzDcw,"Restaurant, Restaurant Français","Rue Principale, Saint-Maudan",0
56072,L'eau D'oust,ChIJhR7Q-mXVEUgRNJ5z96QDiyc,Restaurant Français,"6 Rue Du Lac, Rohan",0
56072,La Gavotte,ChIJtzDgymfVEUgRRPxWZ4OEVms,"Crêperie, Restaurant Français","4bis Pl. De La Mairie, Rohan",0
56072,La Clochette,ChIJhYYlMsQqEEgRHvP4IVf8yOI,Restaurant Français,"43 Rue Saint-Yves, Crédin",0
56072,Koemi Sushi (Food Truck),ChIJLz6eYCYpDkgRWanqWuZ6nBo,"Restaurant De Sushis, Restaurant Japonais, Sushis À Emporter","France, Saint-Barnabé",NA
56072,Hong Kong Moon,ChIJY4xYlALNEUgREONDM1bsL34,"Restaurant, Restaurant Thaïlandais, Restaurant Traditionnel","14 Rue Du Général De Gaulle, Pontivy",NA
56072,Taj Mahal,ChIJBXCoJHTNEUgR49wSv4myjQ8,Restaurant Indien,"42 Rue Du Fil, Pontivy",NA
56072,La Lanterne Rouge,ChIJc5R04NQyEEgRH4Pv2P-wKOI,"Restaurant Chinois, Restaurant De Restauration Rapide","Rue Joseph Quilliou, Saint-Thuriau",NA
56072,Mr Nguyen,ChIJM1pAM7QvDkgRcERpZBcNzZM,"Restaurant, Restaurant Vietnamien","15 Rue De Rennes, Plémet",NA
56073,Bar Kebab Du Scorff,ChIJcxCf4qezEUgRSuXyo5Z7jUo,Kebab,"9 Rue Bisson, Guémené-sur-Scorff",1
56073,O Baba Pondi,ChIJ6T-ianXNEUgRkDt5ZFffSvs,"Restaurant Turc, Restaurant De Restauration Rapide","13 Rue Du Pont, Pontivy",1
56073,Restaurant Couscousserie Cherazade,ChIJ29QSfarNEUgRBETIIreyaGg,"Restaurant, Restaurant Marocain","15 Pl. Anne De Bretagne, Pontivy",1
56073,Royal Kebab Pontivy,ChIJEbymO-LMEUgR9TQBI1KsO1c,"Restaurant, Restaurant Familial, Restaurant De Restauration Rapide","37 Rue Du Pont, Pontivy",1
56073,Kebab Tacos Burgers Öndergroünd (Halal Meat),ChIJA8pLeKDNEUgR9YRIpz4T7HM,"Kebab, Gril, Restaurant De Kebab Doner, Magasin De Salades, Sandwicherie, Restaurant De Tacos","8 Pl. Du Martray, Pontivy",1
56073,Les Trois Marchands,ChIJfxRu2HOzEUgRKqttPHYx1Gk,"Restaurant Français, Bar","29 Rue Emile Maze, Guémené-sur-Scorff",0
56073,"Le 1931, Chez Thomas",ChIJv9-ncRmzEUgRdoInfnNHzyU,Restaurant Français,"2 Pl. Joseph Loth, Guémené-sur-Scorff",0
56073,Aux Sabots Rouges,ChIJe70f_XKzEUgRU6RH1OV40jo,Restaurant Français,"8 Rue Bisson, Guémené-sur-Scorff",0
56073,Le Transcendantal,ChIJbydiFPazEUgRDuE5fepLoOQ,"Bistro, Librairie, Café, Librairie D'occasion","10 Rue Des Frères Trebuil, Guémené-sur-Scorff",0
56073,Le Bistrot De Louisa,ChIJBZD4_HKzEUgRoVNww_x3e6M,Bistro,"7 Rue Bisson, Guémené-sur-Scorff",0
56073,Taj Mahal,ChIJBXCoJHTNEUgR49wSv4myjQ8,Restaurant Indien,"42 Rue Du Fil, Pontivy",NA
56073,Hong Kong Moon,ChIJY4xYlALNEUgREONDM1bsL34,"Restaurant, Restaurant Thaïlandais, Restaurant Traditionnel","14 Rue Du Général De Gaulle, Pontivy",NA
56073,La Lanterne Rouge,ChIJc5R04NQyEEgRH4Pv2P-wKOI,"Restaurant Chinois, Restaurant De Restauration Rapide","Rue Joseph Quilliou, Saint-Thuriau",NA
56073,Nongki Thaï,ChIJ47bKSipbEEgRpQzNwsgJ6aA,Restaurant Thaïlandais,"8 Rue Emile Zola, Inzinzac-Lochrist",NA
56073,Sukho Cuisine Thaïlandais,ChIJ968ATQBbEEgRhXkQFcOvRWM,Restaurant Asiatique,"1 Rue Marcel Sembat, Inzinzac-Lochrist",NA
56074,Kebab D'or,ChIJHxWuENo5EEgRnCDApAhVAIM,"Restaurant Turc, Restaurant De Restauration Rapide, Kebab","17 Rue De Pontivy, Baud",1
56074,Pacha Kebab,ChIJ74VGH2AvEEgRx6roctppM7E,"Kebab, Restaurant De Restauration Rapide","8 Rue Auguste Brizeux, Locminé",1
56074,Aux Délices Kebab,ChIJu2AEBxYlEEgRugvF9cBPqE8,Kebab,"21 Rue Chateaubriand, Locminé",1
56074,Délices Pizza Locminé,ChIJZzoRMiElEEgR5mfbR8ZWrHw,"Restaurant De Pizzas, Service De Livraison D'épicerie, Kebab, Restaurant De Livraison, Livraison De Pizzas, Pizza À Emporter, Restaurant, Sandwicherie, Restaurant De Tacos","16 Rue Olivier De Clisson, Locminé",1
56074,Kebab D’or Pluvigner,ChIJn0i5K0w_EEgRFwiNW48NuIQ,Restaurant,"16 Pl. Saint-Michel, Pluvigner",1
56074,Restaurant Le Bon Vallon,ChIJpcxNsWMwEEgRVyojFByPN-k,Restaurant Français,"2528 Bonvallon, Guénin",0
56074,Le Dauphin,ChIJc6BV3SoxEEgR2NjZ7VDD0uE,"Restaurant, Restaurant Français","Langroix, Guénin",0
56074,Quéré Yvon,ChIJgbeTucgwEEgRF80LVFDvQA0,"Bar Et Grill, Bar","Pl. De L'église, Guénin",0
56074,Rose & Mathurine,ChIJfeYgEMg3EEgRy7GEbAP-SCc,Crêperie,"3 Rue Du Stade, Guénin",0
56074,Dites-Le Avec Des Crêpes,ChIJbVjKVxwxEEgRzuGDZEXtGGI,Crêperie,"2 Lieu-Dit Pontual, Guénin",0
56074,La Lanterne Rouge,ChIJc5R04NQyEEgRH4Pv2P-wKOI,"Restaurant Chinois, Restaurant De Restauration Rapide","Rue Joseph Quilliou, Saint-Thuriau",NA
56074,Taj Mahal,ChIJBXCoJHTNEUgR49wSv4myjQ8,Restaurant Indien,"42 Rue Du Fil, Pontivy",NA
56074,Hong Kong Moon,ChIJY4xYlALNEUgREONDM1bsL34,"Restaurant, Restaurant Thaïlandais, Restaurant Traditionnel","14 Rue Du Général De Gaulle, Pontivy",NA
56074,Pataga,ChIJN7jO44NDEEgRTzLYCcoPtKU,"Restaurant Italien, Restaurant Asiatique, Restaurant De Pizzas","4 Av. Gén De Gaulle, Brandérion",NA
56074,Nongki Thaï,ChIJ47bKSipbEEgRpQzNwsgJ6aA,Restaurant Thaïlandais,"8 Rue Emile Zola, Inzinzac-Lochrist",NA
56075,Kebab Istanbul Guer,ChIJE3pwNgCvD0gRjxsmw-hfLt4,Restaurant,"18 Rue Saint-Gurval, Guer",1
56075,Deniz Kebab Guer,ChIJt9UtmKGvD0gR_1iwx9UAM54,Restaurant De Restauration Rapide,"1 Pl. De La Gare, Guer",1
56075,Dervich Doner Kebab Guer,ChIJWbnLWtiuD0gRKu40HnNg7wE,"Restaurant Turc, Kebab","9 Rue De Saint-Cyr, Guer",1
56075,Anatolie Kebab Plélan Le Grand,ChIJYR4riL-rD0gRtpA791jJfhg,"Restaurant, Restaurant De Restauration Rapide","12 Pl. De La République, Plélan-le-Grand",1
56075,Pause Kebab,ChIJTfspH7AJD0gR0I1LbqG5sbs,Restaurant De Restauration Rapide,"5 Pl. Du Marché, Val d'Anast",1
56075,L’eqsson,ChIJad5pDvCvD0gRqYymANRlJhY,Bistro,"L’écusson, Guer",0
56075,Hôtel Restaurant Maison Tiegezh,ChIJr30WH1evD0gRA1CnslvOPQQ,"Restaurant Gastronomique, Bistro, Hôtel","7 Pl. De La Gare, Guer",0
56075,Le Bilig De Merlin,ChIJl9hKqdmuD0gRpu1yltXyCzM,"Crêperie, Restaurant Français","9 Rue De Brocéliande, Guer",0
56075,Lours,ChIJjSfUEu2uD0gRIFK_qlhaGZ0,"Restaurant Français, Restaurant Brunch, Salon De Thé","L'étang D'aleth, Saint-Malo-de-Beignon",0
56075,Restaurant Les Mégalithes,ChIJ0zY2kc-6D0gRw_tlnWCeX0o,Restaurant Français,"4 Pl. Saint-Nicodème, Monteneuf",0
56075,Aux Saveurs D'asie,ChIJfzqc11WvD0gRUXCHQ-QEofo,"Restaurant, Restaurant Asiatique","3 Rue Saint-Gurval, Guer",NA
56075,Gohan,ChIJA2cjwOujD0gR02Ea03pyG2c,"Restaurant, Restaurant Japonais","2 Ter, La Gacilly",NA
56075,Le Mékong,ChIJNX0HOjTID0gR4qGPDM_eXjI,"Restaurant Mandarin, Restaurant De Fondue Chinoise, Restaurant Thaïlandais","4 Rue Alphonse Guérin, Ploërmel",NA
56075,Perle D'asie,ChIJcXZbDUrID0gRI4PdxVvNNbo,"Restaurant Vietnamien, Restaurant Asiatique, Restaurant Chinois, Restaurant, Restaurant D'asie Du Sud-Est, Restaurant Thaïlandais","87 Rue De La Gare, Ploërmel",NA
56075,Suwon Restaurant Coréen - À Emporter & Livraison,ChIJ-76xRAAdD0gRvEne4E_cw5U,Restaurant Coréen,"11 Rue Des Rouges-Gorges, Goven",NA
56076,Bar Kebab Du Scorff,ChIJcxCf4qezEUgRSuXyo5Z7jUo,Kebab,"9 Rue Bisson, Guémené-sur-Scorff",1
56076,O Baba Pondi,ChIJ6T-ianXNEUgRkDt5ZFffSvs,"Restaurant Turc, Restaurant De Restauration Rapide","13 Rue Du Pont, Pontivy",1
56076,Restaurant Couscousserie Cherazade,ChIJ29QSfarNEUgRBETIIreyaGg,"Restaurant, Restaurant Marocain","15 Pl. Anne De Bretagne, Pontivy",1
56076,Kebab Tacos Burgers Öndergroünd (Halal Meat),ChIJA8pLeKDNEUgR9YRIpz4T7HM,"Kebab, Gril, Restaurant De Kebab Doner, Magasin De Salades, Sandwicherie, Restaurant De Tacos","8 Pl. Du Martray, Pontivy",1
56076,Royal Kebab Pontivy,ChIJEbymO-LMEUgR9TQBI1KsO1c,"Restaurant, Restaurant Familial, Restaurant De Restauration Rapide","37 Rue Du Pont, Pontivy",1
56076,La Gourmandine,ChIJ_4LAq0FKEEgR-fhWGOHEusE,Crêperie,"18b Rue Du Calvaire, Melrand",0
56076,La Cour Julot,ChIJ_ZT6a0BKEEgRTPHHd33kEso,"Crêperie, Restaurant","12 Pl. Du Marché, Melrand",0
56076,Stéphant Hélène,ChIJJX2nZkBKEEgRDocRJCECe3g,"Restaurant De Pizzas, Restaurant Français, Restaurant Italien","1 Rue Du Calvaire, Melrand",0
56076,Auberge De La Tourelle,ChIJy2TtcUBKEEgRH-kEGjYPbZ8,Restaurant Français,"1 Pl. De L'église, Melrand",0
56076,Le Bistrot Du Père Nicolas,ChIJ6Tm24zQ0EEgR-UHl7nFPAIQ,"Bistro, Bar","6 Prom. Des Estivants, Pluméliau-Bieuzy",0
56076,La Lanterne Rouge,ChIJc5R04NQyEEgRH4Pv2P-wKOI,"Restaurant Chinois, Restaurant De Restauration Rapide","Rue Joseph Quilliou, Saint-Thuriau",NA
56076,Taj Mahal,ChIJBXCoJHTNEUgR49wSv4myjQ8,Restaurant Indien,"42 Rue Du Fil, Pontivy",NA
56076,Hong Kong Moon,ChIJY4xYlALNEUgREONDM1bsL34,"Restaurant, Restaurant Thaïlandais, Restaurant Traditionnel","14 Rue Du Général De Gaulle, Pontivy",NA
56076,Nongki Thaï,ChIJ47bKSipbEEgRpQzNwsgJ6aA,Restaurant Thaïlandais,"8 Rue Emile Zola, Inzinzac-Lochrist",NA
56076,Sukho Cuisine Thaïlandais,ChIJ968ATQBbEEgRhXkQFcOvRWM,Restaurant Asiatique,"1 Rue Marcel Sembat, Inzinzac-Lochrist",NA
56077,Délices Marocains,ChIJtX-SpsjxD0gRhrqoJCR4cWs,Restaurant Marocain,"4 Grande Rue, Muzillac",1
56077,*Allin* Restauration Rapide Muzillac,ChIJ6fPO4E7wD0gRWWGwecwu2uQ,"Restaurant De Restauration Rapide, Restaurant Grec, Restaurant De Hamburgers, Kebab, Restaurant À Emporter, Restaurant, Magasin De Salades, Restaurant De Tacos, Restaurant Turc","12 Pl. Du Marché, Muzillac",1
56077,Antalya Kebab,ChIJd5l8g1LpD0gR-DdC_uV6t8o,"Kebab, Restaurant De Restauration Rapide","2 Pl. Gombaud, Questembert",1
56077,O'quest,ChIJgXoyWcTpD0gRr38PziqYW5I,Kebab,"8 Rue Jérôme De Carné, Questembert",1
56077,L'encas,ChIJh244dWKMD0gRZ48KJQ8YeYk,"Kebab, Restaurant De Restauration Rapide, Restaurant De Hamburgers","18 Rue De Nantes, La Roche-Bernard",1
56077,La Gargouille,ChIJT9cInIntD0gRrSNoTAxqvi4,"Crêperie, Restaurant Français","4 Rue Des Hospitaliers, Le Guerno",0
56077,Le Benguë Chez Mama Bigoud,ChIJVYWvwRfuD0gRbK3ToiMyqIw,"Restaurant, Bar, Traiteur, Restaurant Français","10 Rue Du Bengue, Noyal-Muzillac",0
56077,Auberge Armor Vilaine,ChIJbTV0MajyD0gRlal1hfrX0E4,"Restaurant De Pizzas, Restaurant Français, Pizza À Emporter","11 Pl. Sainte-Anne, Péaule",0
56077,A La Porte Du Golfe,ChIJFQj1UbvxD0gRRcaFTow-SrM,"Restaurant Français, Salle De Banquet, Salle De Danse, Théâtre Des Arts De La Scène, Restaurant","Parc D'activité La Clefs Des Champs La Clé Des Champs, Muzillac",0
56077,Café Saint-Julien,ChIJ-b1znE7wD0gRRmI1NcptYZU,"Restaurant, Restaurant Français","9 Pl. Saint-Julien, Muzillac",0
56077,Restaurant Asia,ChIJSZQ8D03wD0gR-8OpuFDEBnU,"Restaurant Vietnamien, Restaurant Asiatique, Bar, Restaurant À Emporter, Restaurant","25 Rue Du Gén De Gaulle, Muzillac",NA
56077,Délices D'asie,ChIJoaMajrPjD0gRe7gBd1xX1eE,"Restaurant Vietnamien, Restaurant Asiatique, Restaurant Chinois, Restaurant Thaïlandais","Rue Des Sports, Theix-Noyalo",NA
56077,Les Saveurs D’ayutthaya,ChIJS7x_bwCHD0gREF5aTAIwegw,Restaurant Thaïlandais,"10 Rue De La Sûreté, Missillac",NA
56077,Tuki Thai,ChIJtQmAeQodEEgRUV78SsK8bAY,"Restaurant Thaïlandais, Restaurant De Wok","18 Rue D'irlande, Séné",NA
56077,Saveurs D'asie,ChIJE_jbZBKcD0gR51qwmh5O_4Q,"Restaurant Cambodgien, Restaurant Asiatique, Restaurant Chinois","23 Rue Duguesclin, Redon",NA
56078,La Cappadoce Kebab,ChIJoZ5w2B_0EEgRzurFwCkP5ys,"Restaurant Turc, Restaurant Familial, Kebab","2 Rue De Saint-Maurice, Guidel",1
56078,Anadolu Grill,ChIJyxL7ulZfEEgRvMEZTsPDqzk,Restaurant Turc,"57 Rue Jean Jaurès, Quéven",1
56078,Jiyan Kebab,ChIJcbHJVAb1EEgRs-Ofv8Ym1v4,Kebab,"1 Rue Du Fort Bloqué, Ploemeur",1
56078,Jiyan Kebab,ChIJv54k-3T6EEgRFpZN_wE003I,"Kebab, Restaurant De Restauration Rapide","21 Rue Du Bourgneuf, Quimperlé",1
56078,Woodfire - Restaurant Lorient,ChIJlVyOH89fEEgRQTHaCpgY2a8,"Pizza À Emporter, Restaurant Halal, Livraison De Pizzas, Restaurant De Pizzas","71 Rue De Lanveur, Lorient",1
56078,La Villa Victoria,ChIJjfZwbb_3EEgRnzq-8kEIPbQ,Restaurant Français,"Za De Pen Mané, Guidel",0
56078,La Moule Qui Saoule,ChIJPZm0JpHzEEgRVr0KxnRWUfo,"Restaurant, Bar, Café, Restaurant Français, Restaurant De Hamburgers, Restaurant De Pizzas","La, Guidel",0
56078,Les Pieds Dans L'eau,ChIJbR8KUOrzEEgRtOhU-hIDajM,"Restaurant, Bar, Brasserie, Crêperie, Restaurant Français, Restaurant De Fruits De Mer","6 Place Du, Guidel",0
56078,Uncle Breizh Guidel,ChIJgSwvR173EEgRJyUZkFVBNiM,Restaurant Français,"8 Pl. Louis Le Montagner, Guidel",0
56078,La Villa Toscane,ChIJ6z_TdKD2EEgRJphDFucdKmQ,"Restaurant Français, Restaurant De Pizzas","15 Pl. Jaffré, Guidel",0
56078,La Cabane Thaï,ChIJQVx14RL2EEgRwgSaD2WtVm4,Restaurant Thaïlandais,"5 Bis Rue De Quéven, Gestel",NA
56078,Plats Chinois À Emporter - Yanzi,ChIJUfXx8Uf1EEgR_A6lN4cg0c0,Plats Chinois À Emporter,"10 Rue Bossuet, Ploemeur",NA
56078,À L'abri De La Tempête,ChIJodA51Fv3EEgRx3lBwAgriTs,Restaurant Thaïlandais,"Rue Lieu Dit Kerjules, Rédené",NA
56078,Sawadee Thai Food,ChIJTWbq-Wb7EEgRmplVdvMvH7s,Restaurant Thaïlandais,"25 Rue Du Bourgneuf, Quimperlé",NA
56078,Restaurant L'orient,ChIJzcnDdQ9fEEgRjRWrvQERqmc,"Restaurant De Fondue Chinoise, Restaurant Mandarin, Restaurant Traditionnel, Restaurant Vietnamien","135 Rue De Belgique, Lorient",NA
56079,Anatolie Kebab,ChIJO5qMkBnOD0gRynyL62SKe4U,"Restaurant Turc, Restaurant De Restauration Rapide","40 Rue Saint-Jacques, Josselin",1
56079,O'delices Tacos,ChIJoaIg_kLJD0gREx6cuxA-xuk,"Restaurant, Magasin De Bière, Boutique De Beignets, Restaurant Halal, Glacier, Restaurant Du Déjeuner, Restaurant Mexicain, Restaurant Végétarien","60 Rue De La Gare, Ploërmel",1
56079,Délices Kebab,ChIJRQztakrID0gRWp59eJtnFSE,"Kebab, Restaurant De Restauration Rapide","30 Rue De La Gare, Ploërmel",1
56079,Médenine Saveurs,ChIJRfiEHVHJD0gRFTesbgOYLgU,Kebab,"7 Rue René Marie Gaillard, Ploërmel",1
56079,Raoul Restauration,ChIJvddGyrDAD0gRHyDMs0V6DvE,"Pizza À Emporter, Restaurant De Hamburgers, Kebab, Restaurant De Pizzas, Magasin De Salades","17bis Pl. Du Dr Jean Queinnec, Malestroit",1
56079,Canal Bohême,ChIJu6j0pzfJD0gRs_LEOOPPg8E,Crêperie,"L'herbinaye, Guillac",0
56079,Ar Kastell - Crêperie Josselin,ChIJh3cRgxjOD0gRQ5Bv3uj6Pls,"Crêperie, Café, Restaurant À Emporter, Restaurant, Restaurant Végétarien","4 Rue Du Château, Josselin",0
56079,La Josselinette,ChIJlxlpCMzPD0gRHiHdsdgTzVU,Crêperie,"Rue Mgr Joubier, Josselin",0
56079,Crêperie Du Centre,ChIJHzvRmhjOD0gRGay8FQ083kQ,"Crêperie, Bar, Restaurant Français, Restaurant","9 Place Notre Dame, Josselin",0
56079,Restaurant Le Guethenoc,ChIJc8fQmhjOD0gRwSLrqe6yRG8,"Restaurant, Restaurant Français, Restaurant Italien, Restaurant De Pizzas","11 Place Notre Dame, Josselin",0
56079,Perle D'asie,ChIJcXZbDUrID0gRI4PdxVvNNbo,"Restaurant Vietnamien, Restaurant Asiatique, Restaurant Chinois, Restaurant, Restaurant D'asie Du Sud-Est, Restaurant Thaïlandais","87 Rue De La Gare, Ploërmel",NA
56079,Le Mékong,ChIJNX0HOjTID0gR4qGPDM_eXjI,"Restaurant Mandarin, Restaurant De Fondue Chinoise, Restaurant Thaïlandais","4 Rue Alphonse Guérin, Ploërmel",NA
56079,Toko Sushi 56,ChIJa2r7a4fED0gRO4O0H01URD8,Restaurant De Sushis,"21 Rue Louise Michel, Sérent",NA
56079,Aux Saveurs D'asie,ChIJfzqc11WvD0gRUXCHQ-QEofo,"Restaurant, Restaurant Asiatique","3 Rue Saint-Gurval, Guer",NA
56079,Koemi Sushi (Food Truck),ChIJLz6eYCYpDkgRWanqWuZ6nBo,"Restaurant De Sushis, Restaurant Japonais, Sushis À Emporter","France, Saint-Barnabé",NA
56080,Ibo Kebab,ChIJP8aOKR9NDkgRUtQJksqjTg4,Kebab,"15 Rue Paul Maulion, Mauron",1
56080,O'delices Tacos,ChIJoaIg_kLJD0gREx6cuxA-xuk,"Restaurant, Magasin De Bière, Boutique De Beignets, Restaurant Halal, Glacier, Restaurant Du Déjeuner, Restaurant Mexicain, Restaurant Végétarien","60 Rue De La Gare, Ploërmel",1
56080,Délices Kebab,ChIJRQztakrID0gRWp59eJtnFSE,"Kebab, Restaurant De Restauration Rapide","30 Rue De La Gare, Ploërmel",1
56080,Médenine Saveurs,ChIJRfiEHVHJD0gRFTesbgOYLgU,Kebab,"7 Rue René Marie Gaillard, Ploërmel",1
56080,Anatolie Kebab,ChIJO5qMkBnOD0gRynyL62SKe4U,"Restaurant Turc, Restaurant De Restauration Rapide","40 Rue Saint-Jacques, Josselin",1
56080,Hôtel-Restaurant Au Relais Du Porhoët,ChIJH_KvdrnKD0gRaACAe2aIS60,"Hôtel, Restaurant Français, Restaurant","11 Pl. De L'église, Guilliers",0
56080,Simmonds Audrey,ChIJxyH0NthKDkgRpX4Bq7XIzaE,"Bar Et Grill, Bar","La Grande Vallée, Mauron",0
56080,Café Ch'ti Breizh,ChIJc5b1xjRLDkgR7Ag1FhX1Mo0,Restaurant Français,"1 Rue De, Saint-Brieuc-de-Mauron",0
56080,Chez Marie,ChIJJ7hFafFKDkgRestOIbvmbAQ,Crêperie,"1 Le Bourg, Saint-Brieuc-de-Mauron",0
56080,La Revanche,ChIJPe_Jv4nLD0gR6VsPU3ghFq8,"Brasserie, Bar, Restaurant De Pizzas","24 Av. Du Porhoët, Saint-Malo-des-Trois-Fontaines",0
56080,Perle D'asie,ChIJcXZbDUrID0gRI4PdxVvNNbo,"Restaurant Vietnamien, Restaurant Asiatique, Restaurant Chinois, Restaurant, Restaurant D'asie Du Sud-Est, Restaurant Thaïlandais","87 Rue De La Gare, Ploërmel",NA
56080,Le Mékong,ChIJNX0HOjTID0gR4qGPDM_eXjI,"Restaurant Mandarin, Restaurant De Fondue Chinoise, Restaurant Thaïlandais","4 Rue Alphonse Guérin, Ploërmel",NA
56080,Mr Nguyen,ChIJM1pAM7QvDkgRcERpZBcNzZM,"Restaurant, Restaurant Vietnamien","15 Rue De Rennes, Plémet",NA
56080,Taste Of India - Restaurant & Bar,ChIJS53kbkVQDkgRW-15PV344NA,Restaurant Indien,"10 Rue De Merdrignac, Saint-Méen-le-Grand",NA
56080,Restaurant Khang,ChIJ045BafBRDkgRkVz2PzBQPz4,Restaurant Asiatique,"3 Av. Du Maréchal Foch, Saint-Méen-le-Grand",NA
56081,Kebabacool,ChIJz56qp8kdEUgRpzglfLXiJ_s,"Restaurant De Restauration Rapide, Service D'expédition","72 Rue Jean Jaurès, Scaër",1
56081,Aux Trois Saveurs Pizzas,ChIJnfiqLDodEUgR9fzAosRp1po,"Livraison De Pizzas, Restaurant De Restauration Rapide, Kebab, Restaurant De Tacos","65 Rue Jean Jaurès, Scaër",1
56081,Kardelen Kebab,ChIJd6i3DogdEUgRl4PZPfRDMB8,Restaurant,"1 Pl. De La Libération, Scaër",1
56081,Kebab De La Gare Gourin,ChIJofeL-3kFEUgRoTEMH6Wn-LA,Restaurant De Restauration Rapide,"2 Rue De La Gare, Gourin",1
56081,Gueho Kebab Family,ChIJ___rfP4EEUgRdHVfgM-LvuI,Restaurant,"2 Rue De La Gare, Gourin",1
