respondent.commune,business_name,place_id,fr_categories,business_address,treatment_arm
Simiane-Collongue,The Bagel Box,ChIJOUPb3rztyRIRSz0zI3VCDD8,"Restaurant, Restaurant Américain, Boulangerie, Restaurant De Restauration Rapide, Restaurant Français, Restaurant De Hamburgers, Restaurant Du Déjeuner, Restaurant Végétarien","Chem. Du Terril, Gardanne",0
Simiane-Collongue,Le Chêne Vert,ChIJW7W-yb6TyRIRWvMOg69GCo0,"Restaurant, Restaurant Français","29 Zone D'activité Bompertuis, Gardanne",0
Simiane-Collongue,Columbus Café & Co,ChIJu4TvE0CTyRIRpyJXmv5eGiw,"Café, Restaurant Brunch, Restaurant De Restauration Rapide, Sandwicherie, Salon De Thé","Décathlon Village Rn8 La Petite Bastide, Bouc-Bel-Air",0
Simiane-Collongue,Le Familial,ChIJyzlQie-TyRIRJmRz8H0ZvPE,"Restaurant, Café, Livraison De Pizzas, Restaurant De Pizzas, Pizza À Emporter, Brasserie","896 Av. De Violési, Bouc-Bel-Air",0
Simiane-Collongue,Lady Sushi Simiane-Collongue,ChIJMT8E65qVyRIRCEOeiV_JjLk,Restaurant Japonais,"5 Av. Du Général De Gaulle, Simiane-Collongue",NA
Simiane-Collongue,Thaï Food,ChIJ1zObm72TyRIR-qPmHjVhTEc,Restaurant Asiatique,"37 Av. Henri Barbusse, Gardanne",NA
Simiane-Collongue,Traiteur Vietnam - Mimet - Emporter Ou Sur Place Midi Et Soir,ChIJAS9j7OWVyRIR9wb9tCBl6nw,Restaurant Vietnamien,"40 Chem. Des Fabres, Mimet",NA
Simiane-Collongue,Sushis Rapide,ChIJiYwiUAeUyRIRvPnzuJ18Ft8,"Restaurant Japonais, Restaurant De Sushis","1 Chem. Des Fabres Bâtiment A, Mimet",NA
Simiane-Collongue,Enjoy Sushi Bouc Bel Air,ChIJp46r5kmTyRIRaoPSIxYQ8ew,"Restaurant De Sushis, Restaurant De Fondue Chinoise, Restaurant Japonais, Livraison De Repas, Restaurant À Emporter, Restaurant, Sushis À Emporter, Restaurant Yakitori","En Face Dml Piscine, Bouc-Bel-Air",NA
Tarascon,La Médina,ChIJ1YbpgWTctRIRtjwH74UppVk,"Kebab, Restaurant De Restauration Rapide, Restaurant De Tacos","3 Rue Des Halles, Tarascon",1
Tarascon,Tacos Food,ChIJd9u7c2HctRIR1Mp-XfRd1m8,"Kebab, Restaurant De Restauration Rapide, Restaurant, Sandwicherie, Restaurant De Tacos","70 Bd Itam, Tarascon",1
Tarascon,Mogador Du Port,ChIJAx95v3jctRIRjj2D1ewHoWI,"Restaurant, Restaurant Marocain","30 Quai Du Général De Gaulle, Beaucaire",1
Tarascon,L'horizon,ChIJw0d4T4HbtRIRcXXHJB8sudg,"Restaurant, Restaurant De Restauration Rapide, Restaurant Halal, Restaurant Du Déjeuner, Restaurant De Pizzas, Sandwicherie","52 Rue Nationale, Beaucaire",1
Tarascon,La Confiserie Du Trident,ChIJFTJw7Q3btRIR7j7HdwGPPD0,"Restaurant, Magasin De Bière, Restaurant De Restauration Rapide, Restaurant Halal, Restaurant De Hamburgers, Glacier, Restaurant De Crêpes, Sandwicherie, Restaurant Végétarien","240 Chem. De L'oratoire, Beaucaire",1
Tarascon,Le Bistrot Des Anges,ChIJf332f2TctRIR05wX6McHHJw,"Restaurant Français, Bistro","20 Pl. Du Marché, Tarascon",0
Tarascon,Tailles De Bon,ChIJId4TbGXctRIRUS-2G-YL438,"Restaurant, Restaurant Français, Restaurant Méditerranéen","1 Du, Tarascon",0
Tarascon,Le Comptoir Des Gourmets,ChIJ0RCkXWXctRIR9iASj5t03T4,"Restaurant, Bistro, Restaurant Français, Épicerie Fine","18 Pl. Colonel Berrurier, Tarascon",0
Tarascon,Chez Maria Et Didier Restaurant,ChIJV-AcsmXctRIRfTsEeF2Puts,Restaurant Français,"1 Bd Victor Hugo, Tarascon",0
Tarascon,Brasserie Le Bellagio Restaurant,ChIJw3D4ZmPctRIRg3MI8HQGehg,Brasserie,"14 Bd Itam, Tarascon",0
Tarascon,Le Saïgon,ChIJXV6HLXvctRIRio3LFGNJfZY,"Restaurant Vietnamien, Bar, Restaurant","2 Av. De La République, Tarascon",NA
Tarascon,Inari Okami,ChIJGf_7GBnbtRIRyq6CNjTcZ00,"Restaurant De Sushis, Restaurant Japonais, Sushis À Emporter","5 Quai Du Général De Gaulle, Beaucaire",NA
Tarascon,Euro D'asie,ChIJUaqauoDbtRIR7xBXpWpSqHc,"Restaurant Chinois, Restaurant Asiatique","Zac Des Milliaires, 3, Beaucaire",NA
Tarascon,Miyagi Sushi Aramon,ChIJF-52F2vDtRIRZgQQ4tft58Q,Restaurant Japonais,"39 Bd Gambetta, Aramon",NA
Tarascon,Ô Tuktuk De Jade,ChIJq_lljSrftRIRDiLDZDu9iLw,Restaurant Panasiatique,"Rte De Tarascon, Fontvieille",NA
Le Tholonet,La Casa,ChIJPYgA1vONyRIRh_gFPcNLRX0,"Restaurant De Pizzas, Brasserie, Kebab, Livraison De Repas, Livraison De Pizzas, Pizza À Emporter, Restaurant, Magasin De Salades, Sandwicherie, Restaurant De Tacos","67 Av. Henri Mauriat, Aix-en-Provence",1
Le Tholonet,"Saveurs O'mix , Palmyra Restaurant Libanais Et Syrien",ChIJB0UW92aNyRIRW9KiO6ga8Qs,"Restaurant Libanais, Restaurant Syrien","3 Rue Portalis, Aix-en-Provence",1
Le Tholonet,La Menara,ChIJUa_XcJSNyRIR8Ukbgr_z7ck,Restaurant Marocain,"24 Rue Des Tanneurs, Aix-en-Provence",1
Le Tholonet,Chamas Tacos Aix En Provence Couronne,ChIJIZAnfOyNyRIRA-gOTAcTY6c,"Restaurant De Restauration Rapide, Restaurant Halal, Restaurant, Restaurant De Tacos","17 Rue De La Couronne, Aix-en-Provence",1
Le Tholonet,Tita - Restaurant Aix En Provence,ChIJeQWaCA3zyRIRT9NFxc4STe8,"Restaurant, Traiteur, Restaurant De Falafels, Restaurant Familial, Restaurant De Restauration Rapide, Restaurant Libanais, Restaurant À Emporter, Restaurant Méditerranéen, Restaurant De Petites Assiettes, Restaurant Végétarien","11 Rue Des Bernardines, Aix-en-Provence",1
Le Tholonet,O' Comptoir Gourmand,ChIJ__-vpASOyRIRyQ2xVtCBD30,"Restaurant, Bar, Restaurant Français, Brasserie","Parc Des Lauves, Le Tholonet",0
Le Tholonet,Chez Thomé,ChIJSzn22jCOyRIRJlWjASN5VCs,"Restaurant Provençal, Bar, Restaurant Français","Av. Louis Destrem, Le Tholonet",0
Le Tholonet,Le Relais Cézanne - Restaurant,ChIJTyD_ShSOyRIR0nEmrGVpWvM,"Restaurant Français, Bar","Rte Cézanne, Le Tholonet",0
Le Tholonet,L'atelier Des Lodges,ChIJBx1pm-SPyRIR4blTzWXnzJE,Brasserie,"2250 Rte Cézanne, Le Tholonet",0
Le Tholonet,Les Lodges Sainte-Victoire Hotel & Spa,ChIJS2uOXjaOyRIRp-qfZ8860Fc,"Restaurant, Centre De Remise En Forme, Restaurant Français, Spa De Massage, Hôtel, Séminaire, Spa, Piscine, Salon De Thé, Lieu De Mariage","2250 Rte Cézanne, Le Tholonet",0
Le Tholonet,Ajito Restaurant Japonais Aix En Provence,ChIJVQYyjhyOyRIR7bGcKZgt1EU,"Restaurant Japonais, Restaurant De Sushis","Av. Aurélien Houchard, Le Tholonet",NA
Le Tholonet,Enjoy Sushi Le Tholonet,ChIJNwyp2SGOyRIRs3FNq6RtjPE,"Restaurant De Sushis, Restaurant De Fondue Chinoise, Restaurant Japonais, Livraison De Repas, Restaurant À Emporter, Restaurant, Sushis À Emporter, Restaurant Yakitori","1652 Av. Paul Jullien, Le Tholonet",NA
Le Tholonet,Sushi,ChIJ0bPzFviNyRIR8PV9IujzCEo,Restaurant De Sushis,"Cr Gambetta, Aix-en-Provence",NA
Le Tholonet,Le Chemin Du Safran,ChIJgZnCXb6NyRIRltoGo__qvxg,"Restaurant Indien, Restaurant","21 Rue De La Cépède, Aix-en-Provence",NA
Le Tholonet,La Mado,ChIJi8_f2b2NyRIRz5gYUSyvRjE,"Restaurant Français, Restaurant De Fruits De Mer, Restaurant De Sushis","Restaurant La Mado, Aix-en-Provence",NA
Trets,Restaurant Ayki Libanais Arménien,ChIJkzpxba2dyRIRUGYHAN-NugA,"Restaurant Libanais, Restaurant Méditerranéen","1 Rte De Saint-Maximin, Trets",1
Trets,Alm Traiteur,ChIJ18J2HYCdyRIRAtiKiD9gfzE,"Traiteur, Pâtisserie, Restaurant Français, Restaurant Sans Gluten, Restaurant Halal, Restaurant Casher, Restaurant Méditerranéen, Pâtisserie, Restaurant Végétalien","15 Bd Etienne Boyer, Trets",1
Trets,Pizza Gaby,ChIJsZjasq-ZyRIRUhBTfChn5dQ,"Livraison De Pizzas, Kebab, Restaurant Mexicain, Restaurant De Pizzas, Sandwicherie","13 Imp. De Bigaron, La Bouilladisse",1
Trets,Pequeno,ChIJXWpEF1SZyRIRttBjYFWFHlM,Restaurant De Tacos,"23 Rue Grande, Auriol",1
Trets,By Burger Snack,ChIJ_fUTNLpxyRIRlTuc04KsMPc,"Sandwicherie, Restaurant De Restauration Rapide, Restaurant De Hamburgers, Restaurant De Tacos","20 Av. Albert 1er, Saint-Maximin-la-Sainte-Baume",1
Trets,Le Safran,ChIJR3YP702cyRIR_NqS6l6TmZE,"Restaurant Français, Restaurant Méditerranéen","14 Av. Mirabeau, Trets",0
Trets,Le Patio De Jen,ChIJ5wEmnE2cyRIR18gnVskqW3Q,"Restaurant, Restaurant Français","13 Bd De La République, Trets",0
Trets,Le Moulin De Trets,ChIJL8hi3lqcyRIRxcDSh8wXwWA,"Restaurant De Pizzas, Bar, Restaurant Français, Restaurant Italien","199 Av. De Gardanne, Trets",0
Trets,Par Vins Et Marée,ChIJs46IbU2cyRIRgB9mqPrYztw,"Cave À Vin, Marché Aux Fruits De Mer, Restaurant De Fruits De Mer","Rte De Saint-Maximin, Trets",0
Trets,Bô Événementiel,ChIJ5web03WdyRIR21eL8ihZoCg,"Bar À Cocktails, Restaurant Brunch","3173 Route De St Maximin, Trets",0
Trets,Daïsuki,ChIJH26FW02cyRIRtwgeTYrWJHA,"Restaurant Japonais, Restaurant De Sushis","24 Av. Jean Jaurès, Trets",NA
Trets,Sushi Kohi Trets 13530,ChIJBYPDdE2cyRIR11ycEs5p7Ns,"Restaurant De Sushis, Restaurant Japonais","28 Bd De La République, Trets",NA
Trets,Jardin D'asie,ChIJQQf_c02cyRIR9D2p7QgqzPE,"Restaurant Chinois, Restaurant Asiatique","1 Av. Jean Jaurès, Trets",NA
Trets,Auberge De Chine,ChIJK7IqdU2cyRIRJh5Dm3Kqg84,"Restaurant, Bar, Restaurant Chinois, Hébergement Intérieur, Restaurant Thaïlandais","8 Rue Félix Pyat, Trets",NA
Trets,L&B Sushi Les Saveurs Du Japon,ChIJcawHj0meyRIRwX_1-C13wiA,"Restaurant, Restaurant Japonais, Restaurant Traditionnel","2 Cr Louis Blanc, Saint-Zacharie",NA
Vauvenargues,Snack Comme D'hab,ChIJmXMJXu2HyRIRvFX8mI5iADs,"Restaurant, Boulangerie, Restaurant De Restauration Rapide, Restaurant Halal, Restaurant De Hamburgers, Kebab, Restaurant Du Déjeuner, Pâtisserie, Sandwicherie","Rte Du Plan, Peyrolles-en-Provence",1
Vauvenargues,La Casa,ChIJPYgA1vONyRIRh_gFPcNLRX0,"Restaurant De Pizzas, Brasserie, Kebab, Livraison De Repas, Livraison De Pizzas, Pizza À Emporter, Restaurant, Magasin De Salades, Sandwicherie, Restaurant De Tacos","67 Av. Henri Mauriat, Aix-en-Provence",1
Vauvenargues,Brasserie De La Gare,ChIJWfB1OuqJyRIRsJAhvNmu5vA,"Restaurant, Magasin De Bière, Fromagerie, Bar À Cocktails, Restaurant Français, Restaurant Halal, Restaurant De Fruits De Mer, Restaurant Végétarien, Bar À Vin","Rn 96, Meyrargues",1
Vauvenargues,"Saveurs O'mix , Palmyra Restaurant Libanais Et Syrien",ChIJB0UW92aNyRIRW9KiO6ga8Qs,"Restaurant Libanais, Restaurant Syrien","3 Rue Portalis, Aix-en-Provence",1
Vauvenargues,La Menara,ChIJUa_XcJSNyRIR8Ukbgr_z7ck,Restaurant Marocain,"24 Rue Des Tanneurs, Aix-en-Provence",1
Vauvenargues,Le Couscoussier,ChIJN_RNUbSFyRIR339o6ndtwkw,"Restaurant, Bar, Restaurant Français","5 Bd Moraliste Vauvenargues, Vauvenargues",0
Vauvenargues,Chez Le Garde,ChIJR5ULJcWMyRIR1lJdqq20Tkc,"Restaurant Italien, Bar, Restaurant Français, Restaurant Méditerranéen, Restaurant De Pizzas, Pizza À Emporter, Restaurant","342 D10, Vauvenargues",0
Vauvenargues,L'oustau De Saint-Marc,ChIJgcuKog-PyRIRC4_hMWtQPfY,"Restaurant Français, Restaurant Méditerranéen","Route De Vauvenargues, Les Verans, Saint-Marc-Jaumegarde",0
Vauvenargues,Le Relais De Saint Ser,ChIJea-wJcmEyRIRFBZAGhNNIgE,"Restaurant Français, Hôtel, Restaurant","Avenue Paul Cézanne, Puyloubier",0
Vauvenargues,Restaurant Maison Sainte-Victoire,ChIJ14DqUv2FyRIRfvxUH7X3Wgs,"Restaurant, Bar, Restaurant Brunch, Café, Pâtisserie, Salon De Thé","D17, Saint-Antonin-sur-Bayon",0
Vauvenargues,Enjoy Sushi Le Tholonet,ChIJNwyp2SGOyRIRs3FNq6RtjPE,"Restaurant De Sushis, Restaurant De Fondue Chinoise, Restaurant Japonais, Livraison De Repas, Restaurant À Emporter, Restaurant, Sushis À Emporter, Restaurant Yakitori","1652 Av. Paul Jullien, Le Tholonet",NA
Vauvenargues,Le Jade D'asie,ChIJM1DHr1eJyRIRVJNxrwVyE74,Restaurant Asiatique,"60 Av. De La Grande Bégude, Venelles",NA
Vauvenargues,Enjoy Sushi Venelles,ChIJeyfP_P2LyRIRxz6V7DKrmtg,"Restaurant De Sushis, Restaurant De Fondue Chinoise, Restaurant Japonais, Livraison De Repas, Restaurant À Emporter, Restaurant, Sushis À Emporter, Restaurant Yakitori","Centre Commercial Des Quatres Tours, Venelles",NA
Vauvenargues,Ajito Restaurant Japonais Aix En Provence,ChIJVQYyjhyOyRIR7bGcKZgt1EU,"Restaurant Japonais, Restaurant De Sushis","Av. Aurélien Houchard, Le Tholonet",NA
Vauvenargues,Le Dragon D'or,ChIJs4Ww3AaMyRIRIouOt0a3jOQ,Restaurant Vietnamien,"9 R De La Carraire, Venelles",NA
Velaux,Los Amigos,ChIJjT73rODxyRIR_U0rez5-S20,"Restaurant, Restaurant Américain, Magasin De Bière, Pâtisserie, Restaurant Sans Gluten, Restaurant Halal, Restaurant Mexicain, Restaurant Végétalien, Restaurant Végétarien","214 Rte De L'étang, Velaux",1
Velaux,O Transmontano - Restaurant Portugais,ChIJ4zd_AkjlyRIRpWXqc7dV0RU,"Restaurant, Restaurant Barbecue, Magasin De Bière, Restaurant Halal, Restaurant Méditerranéen, Restaurant Portugais, Magasin De Salades, Restaurant De Fruits De Mer, Restaurant Végétarien, Bar À Vin","113, Rognac",1
Velaux,Autour D'un Couscous,ChIJb-hcrtPvyRIRKPVh3VW0Bqw,"Restaurant, Restaurant Halal, Pâtisserie, Restaurant Végétarien","Av. Charles De Gaulle 5, Rognac",1
Velaux,Le Petit Libanais Rognac,ChIJz_JEeILlyRIREnlHVlGVQK8,"Restaurant, Restaurant Libanais, Restaurant Végétarien","Départementale 113, Station Service Des Alliées, Rognac",1
Velaux,Le Mezze,ChIJfcCGhn7lyRIRIyGqoV-Y8o8,"Restaurant Libanais, Restaurant De Kebab Doner","D113, Rognac",1
Velaux,L'unisson,ChIJEfY8VhXwyRIRNoP3XyvcblU,"Restaurant, Restaurant Français, Piano-Bar","200 Allée Louis Sibethal, Velaux",0
Velaux,Restaurant La Bastide,ChIJxTZCkT_wyRIR-lKHSuOUC4E,"Restaurant, Bar, Restaurant Français, Restaurant Méditerranéen","Av. Emile Ripert, Velaux",0
Velaux,Il Jomelia By Capannino Velaux,ChIJ8wtQIO7vyRIRhugYph8OCPU,Brasserie,"1248 Chem. Du Vallon Des Brayes, Velaux",0
Velaux,O2r,ChIJ5aK5JLnxyRIRMFz5aioBtJI,"Restaurant, Magasin De Bière, Boutique De Beignets, Restaurant Français, Restaurant De Hamburgers, Glacier, Magasin De Salades, Sandwicherie, Bar À Vin","4z Artisanal, Velaux",0
Velaux,Mcdonald's,ChIJo8bzRJ_7yRIR7aRJyQRpzZ8,"Restaurant De Restauration Rapide, Restaurant Américain, Restaurant De Hamburgers, Restaurant De Pizzas, Restaurant, Sandwicherie","93 Av. Du Général De Gaulle, La Fare-les-Oliviers",0
Velaux,Khan Gusto Traiteur,ChIJMwJegcnxyRIRUOedg0GbmLs,"Traiteur, Restaurant Asiatique, Restaurant Européen, Restaurant Français, Restaurant Géorgien, Restaurant De Barbecue Mongol, Restaurant Russe, Restaurant Traditionnel, Restaurant Ukrainien","263 Rte De Roquefavour, Ventabren",NA
Velaux,Tokio Sushi - Restaurant Velaux,ChIJtViSDv7vyRIR1pnHPGvYtrU,"Restaurant Japonais, Restaurant De Sushis","1248 Chem. Du Vallon Des Brayes, Velaux",NA
Velaux,Enjoy Sushi Velaux,ChIJ5duZMNvvyRIR9g4S9DI3Tjk,"Restaurant De Sushis, Restaurant De Fondue Chinoise, Restaurant Japonais, Livraison De Repas, Restaurant À Emporter, Restaurant, Sushis À Emporter, Restaurant Yakitori","1261 Chem. Du Vallon Des Brayes, Velaux",NA
Velaux,Mimi - Plats D'asie,ChIJtdh0NqXxyRIRp_geJlAPpr8,Restaurant Panasiatique,"28 Carraire Des Petites Plaines, Ventabren",NA
Velaux,La Table De La Fontaine,ChIJL9fJJaXxyRIRqHzLC3XOb7E,"Restaurant Chophouse, Restaurant Français, Restaurant De Sushis, Sushis À Emporter","5127 Rte De Berre, Ventabren",NA
Venelles,Brasserie De La Gare,ChIJWfB1OuqJyRIRsJAhvNmu5vA,"Restaurant, Magasin De Bière, Fromagerie, Bar À Cocktails, Restaurant Français, Restaurant Halal, Restaurant De Fruits De Mer, Restaurant Végétarien, Bar À Vin","Rn 96, Meyrargues",1
Venelles,"Saveurs O'mix , Palmyra Restaurant Libanais Et Syrien",ChIJB0UW92aNyRIRW9KiO6ga8Qs,"Restaurant Libanais, Restaurant Syrien","3 Rue Portalis, Aix-en-Provence",1
Venelles,Au P'tit Tajine,ChIJZ0ld4qKNyRIRnh5-K_SRIgM,"Restaurant, Restaurant Méditerranéen, Restaurant Marocain","4 Rue De La Treille, Aix-en-Provence",1
Venelles,Restaurant La Marocaine,ChIJ2xyz_6KNyRIRNZMjhRuK9mo,"Restaurant, Restaurant Méditerranéen, Restaurant Marocain","3 Rue Van Loo, Aix-en-Provence",1
Venelles,La Menara,ChIJUa_XcJSNyRIR8Ukbgr_z7ck,Restaurant Marocain,"24 Rue Des Tanneurs, Aix-en-Provence",1
Venelles,George Venelles,ChIJDcTfMkGLyRIRSb33k1UcVFk,"Restaurant, Gril, Restaurant Barbecue, Bar À Cocktails, Bar Karaoké, Bar À Vin","36 Av. De La Grande Bégude, Venelles",0
Venelles,Le Môme,ChIJXy3vSL2NyRIRLb2X3497q88,"Restaurant, Restaurant Français","57 Av. Maurice Plantier, Venelles",0
Venelles,Bistro De La Gare,ChIJzZ01SweMyRIRO-XZTvHLLkk,"Restaurant Français, Bar","131 Av. Des Logissons, Venelles",0
Venelles,Café Canailles,ChIJVVVlW1yJyRIRaMrgy76icQU,"Restaurant, Restaurant Français, Salon De Thé Traditionnel","45 Av. Maurice Plantier, Venelles",0
Venelles,L'esplanade,ChIJ890JKVmJyRIRxB69cJXBWPk,Restaurant Français,"4 Esp. Cézanne, Venelles",0
Venelles,Le Jade D'asie,ChIJM1DHr1eJyRIRVJNxrwVyE74,Restaurant Asiatique,"60 Av. De La Grande Bégude, Venelles",NA
Venelles,Noto Sushi Venelles,ChIJQ6Q4xHiJyRIR4KsjIKS8Sc0,"Restaurant Japonais, Restaurant De Fondue Chinoise, Livraison De Repas, Restaurant À Emporter, Restaurant, Restaurant De Sushis, Sushis À Emporter","12 Rue Du Grand Logis, Venelles",NA
Venelles,Enjoy Sushi Venelles,ChIJeyfP_P2LyRIRxz6V7DKrmtg,"Restaurant De Sushis, Restaurant De Fondue Chinoise, Restaurant Japonais, Livraison De Repas, Restaurant À Emporter, Restaurant, Sushis À Emporter, Restaurant Yakitori","Centre Commercial Des Quatres Tours, Venelles",NA
Venelles,Le Dragon D'or,ChIJs4Ww3AaMyRIRIouOt0a3jOQ,Restaurant Vietnamien,"9 R De La Carraire, Venelles",NA
Venelles,Papylee,ChIJzxn5wWmJyRIRkYU_eF6zUA8,Sushis À Emporter,"Rn 96 E.leclerc, Meyrargues",NA
Ventabren,Los Amigos,ChIJjT73rODxyRIR_U0rez5-S20,"Restaurant, Restaurant Américain, Magasin De Bière, Pâtisserie, Restaurant Sans Gluten, Restaurant Halal, Restaurant Mexicain, Restaurant Végétalien, Restaurant Végétarien","214 Rte De L'étang, Velaux",1
Ventabren,O Transmontano - Restaurant Portugais,ChIJ4zd_AkjlyRIRpWXqc7dV0RU,"Restaurant, Restaurant Barbecue, Magasin De Bière, Restaurant Halal, Restaurant Méditerranéen, Restaurant Portugais, Magasin De Salades, Restaurant De Fruits De Mer, Restaurant Végétarien, Bar À Vin","113, Rognac",1
Ventabren,Autour D'un Couscous,ChIJb-hcrtPvyRIRKPVh3VW0Bqw,"Restaurant, Restaurant Halal, Pâtisserie, Restaurant Végétarien","Av. Charles De Gaulle 5, Rognac",1
Ventabren,Le Petit Libanais Rognac,ChIJz_JEeILlyRIREnlHVlGVQK8,"Restaurant, Restaurant Libanais, Restaurant Végétarien","Départementale 113, Station Service Des Alliées, Rognac",1
Ventabren,Le Mezze,ChIJfcCGhn7lyRIRIyGqoV-Y8o8,"Restaurant Libanais, Restaurant De Kebab Doner","D113, Rognac",1
Ventabren,Restaurant Dan B.,ChIJx3v2JzHwyRIRGIYbELz2_l4,Restaurant Gastronomique,"1 Rue Frédéric Mistral, Ventabren",0
Ventabren,Wheeling Café,ChIJbRexcZnxyRIRG-GldepNSB0,"Café, Bar, Restaurant Français, Restaurant","Quartier Saint Louis, Ventabren",0
Ventabren,Kafouche,ChIJhfa0ZiPxyRIRPM2KEggI0yY,Restaurant Français,"Placette Du Chene Vert, Ventabren",0
Ventabren,Le Mas Des Vignes,ChIJRTSkAP_wyRIRjDknxni_174,"Restaurant Français, Restaurant Provençal","Campagne Le Rouret, Coudoux",0
Ventabren,L'unisson,ChIJEfY8VhXwyRIRNoP3XyvcblU,"Restaurant, Restaurant Français, Piano-Bar","200 Allée Louis Sibethal, Velaux",0
Ventabren,La Table De La Fontaine,ChIJL9fJJaXxyRIRqHzLC3XOb7E,"Restaurant Chophouse, Restaurant Français, Restaurant De Sushis, Sushis À Emporter","5127 Rte De Berre, Ventabren",NA
Ventabren,Mimi - Plats D'asie,ChIJtdh0NqXxyRIRp_geJlAPpr8,Restaurant Panasiatique,"28 Carraire Des Petites Plaines, Ventabren",NA
Ventabren,Khan Gusto Traiteur,ChIJMwJegcnxyRIRUOedg0GbmLs,"Traiteur, Restaurant Asiatique, Restaurant Européen, Restaurant Français, Restaurant Géorgien, Restaurant De Barbecue Mongol, Restaurant Russe, Restaurant Traditionnel, Restaurant Ukrainien","263 Rte De Roquefavour, Ventabren",NA
Ventabren,Asiarolls,ChIJt4j1KR_xyRIRq1DaLB8TWhs,Restaurant Thaïlandais,"Résidence Castel Verde, Ventabren",NA
Ventabren,Sushis Binto,ChIJpQZY8YrwyRIRkop7rJHYuJw,Restaurant De Sushis,"13 Place Jean Mermoz, Coudoux",NA
Vernègues,Chez Annie,ChIJB9HtG5YDyhIROx_vaUcY3vg,"Restaurant, Restaurant De Restauration Rapide, Restaurant Halal, Livraison De Repas, Restaurant À Emporter","Av. De Craponne, Mallemort",1
Vernègues,Monsieur Falafels,ChIJiy5I15X5yRIRN2OdYF3lPz0,"Traiteur, Restaurant Syrien","Marché De Dimanche, Pélissanne",1
Vernègues,Regal Tacos & Asian Delices,ChIJfznZ4y75yRIRKt4P7gjkhjA,"Restaurant De Tacos, Restaurant De Restauration Rapide","9 C, Pélissanne",1
Vernègues,Pelifood By Szulette Snack Tacos Burger Et Bonbons,ChIJeZaXfi75yRIR0L8hrUxvRBM,"Restaurant De Restauration Rapide, Restaurant Halal, Restaurant De Hamburgers, Restaurant De Tacos","34 Pl. Cabardel, Pélissanne",1
Vernègues,Alhambraofk,ChIJm0bD-sX_tRIR48ooNX77sWo,"Kebab, Restaurant De Restauration Rapide","27 Rue Raoul Jauffret, Eyguières",1
Vernègues,Le Repaire,ChIJbycwdWsCyhIRTFJwNXjfAwE,"Crêperie, Restaurant Français, Glacier, Restaurant","76 Chemin De Très Moulins, Vernègues",0
Vernègues,Restaurant Es Beu La Vie,ChIJ6XmuVFQDyhIRbMezZbcbAMU,"Restaurant, Restaurant Français, Restaurant Méditerranéen","Club House Du Golf De Pont Royal, Mallemort",0
Vernègues,La Farigoule,ChIJ6WzYXp8DyhIRLcGrDSILtLQ,"Restaurant, Restaurant Français","Domaine De Pont Royal, Mallemort",0
Vernègues,Les Tilleuls,ChIJQ-gG1t4CyhIReJ7zPmTbx9E,"Restaurant, Restaurant Français","Domaine & Golf De Pont Royal, Mallemort",0
Vernègues,Chez Yvonne,ChIJ1U-WRzACyhIR2XJO2d52V2c,"Brasserie, Bar, Restaurant De Pizzas","Av. Mal Leclerc De Hautecloque, Alleins",0
Vernègues,Indochine - Restaurant À Mallemort,ChIJ9V5Eh6YDyhIRkQf1ZhUCmHU,"Restaurant Vietnamien, Restaurant De Fondue Chinoise, Restaurant Mandarin","Av. Des Frères Roqueplan, Mallemort",NA
Vernègues,Tama Sushis,ChIJuwDPkKEDyhIRxBAHQvx73Og,"Sushis À Emporter, Traiteur, Service D'expédition, Buffet De Mariage","127 Cr Victor Hugo, Mallemort",NA
Vernègues,Restaurant Indochine Pélissanne,ChIJs5cT6yL5yRIRIrgrtE_TQ3c,Restaurant Vietnamien,"8 Cr Victor Hugo, Pélissanne",NA
Vernègues,Tokyo Pélissanne,ChIJqXoDonX5yRIR2Kj-1XYOdX4,"Restaurant De Sushis, Restaurant Japonais, Livraison De Repas, Sushis À Emporter","22 Place Pisavis, Pélissanne",NA
Vernègues,Kungfu Food,ChIJqcTmUGAByhIR-gMzcrGhRis,Restaurant Chinois,"Rue Des Acacias, Lamanon",NA
Verquières,O'delices,ChIJpfQ6lm7vtRIRsIKSPzAq22k,Restaurant Halal,"5 Boulevard Léon Gambetta, Châteaurenard",1
Verquières,Mak Kebab Châteaurenard,ChIJrxUr7lfutRIRu39X3EM2Cg0,"Kebab, Restaurant De Restauration Rapide, Restaurant De Tacos","660 Bd Ernest Genevet, Châteaurenard",1
Verquières,Snack Du Clos,ChIJe5Y0Hu_3tRIRnFWAsEkbnAs,"Kebab, Restaurant De Restauration Rapide, Restaurant De Tacos","74 Pl. Du Clos, Cavaillon",1
Verquières,Le Wendy's,ChIJ5d5lWPP3tRIRIMSTZCNaUOU,"Restaurant De Restauration Rapide, Magasin De Poulet, Boutique De Beignets, Restaurant Halal, Restaurant De Hamburgers, Restaurant De Livraison, Restaurant, Magasin De Salades, Sandwicherie, Restaurant De Tacos","102 Cours Gambetta, Cavaillon",1
Verquières,Sports Bar,ChIJLcMul_T3tRIRa2d6zN1wNQc,"Restaurant, Service De Livraison, Restaurant De Kebab Doner, Bar Sportif","3 Pl. Léon Gambetta, Cavaillon",1
Verquières,Brasserie Des Frênes,ChIJL06ZWE_xtRIRnv36r4SQ0P0,Brasserie,"80 Rte De Cabannes, Verquières",0
Verquières,Le Relais De La Bassaque,ChIJEQbxYDfwtRIRyXq5pC5tKYE,Restaurant Français,"Vieux Chemin De Saint-Andio, Noves",0
Verquières,Maison Bournissac,ChIJneJq8lnltRIRok01scAWIbA,"Hôtel, Restaurant Français, Restaurant Méditerranéen","Montée D'eyragues, Noves",0
Verquières,Le Palais Gourmet,ChIJ300N1DzwtRIRrM7hVHcWx3I,"Traiteur, Bar, Restaurant Français","Rn7, Noves",0
Verquières,Brasserie Pizzeria Le Rex,ChIJZ-ZZNS3wtRIR9813wjuF7AM,"Restaurant, Bar, Restaurant Français, Restaurant De Pizzas","Bd De La République, Noves",0
Verquières,Ho Sushi Riz,ChIJCYIDjknltRIRdsQmX1lLJ8c,"Sushis À Emporter, Service De Livraison","Av. Gabriel Péri, Eyragues",NA
Verquières,"Koumi, Le Comptoir",ChIJB4BBoBHxtRIR1kG6hrbEr_k,Restaurant De Sushis,"Pl. Du Marché, Caumont-sur-Durance",NA
Verquières,Le Palais D'hanoï,ChIJswmVq1XutRIRsPt3lNdArIU,"Restaurant Mandarin, Restaurant Panasiatique","8 Av. Du Dr Georges Perrier, Châteaurenard",NA
Verquières,Sushieats,ChIJm-gF4HzvtRIRNAY-Oqx9GoE,Restaurant Japonais,"16 Cr Carnot, Châteaurenard",NA
Verquières,Akatsushi Chateaurenard,ChIJ_WtppFnvtRIRf_xscrNahxo,"Restaurant De Sushis, Restaurant Japonais, Restaurant Thaïlandais","38 Cr Carnot, Châteaurenard",NA
Vitrolles,Bonfil'ett,ChIJ0XzNZADpyRIR6d7du000dtU,Restaurant Turc,"813 Bd Barthélémy Abbadie, Saint-Victoret",1
Vitrolles,O Goût Du Liban Traiteur Restaurant Sandwich Snack,ChIJbS9OHpfoyRIRCkyZsrLbYGA,"Restaurant Libanais, Traiteur, Restaurant De Restauration Rapide, Restaurant De Hamburgers, Snack-Bar","475 Bd Barthélémy Abbadie, Saint-Victoret",1
Vitrolles,"Fast-Food Helen Spécialité Friture Cubaine ,Pizza , Hamburger , Nouille Et Friture Chinoise , Kebab A Marignane",ChIJLV3Qbn7pyRIRw_mC4Hd77j0,Restaurant De Restauration Rapide,"6 Chem. De Carthage, Marignane",1
Vitrolles,Le Mezze,ChIJfcCGhn7lyRIRIyGqoV-Y8o8,"Restaurant Libanais, Restaurant De Kebab Doner","D113, Rognac",1
Vitrolles,Autour D'un Couscous,ChIJb-hcrtPvyRIRKPVh3VW0Bqw,"Restaurant, Restaurant Halal, Pâtisserie, Restaurant Végétarien","Av. Charles De Gaulle 5, Rognac",1
Vitrolles,L'estroublans Restaurant,ChIJMzdXMLHoyRIROPNzCfpOBy4,"Restaurant Français, Service D'expédition","Zi Les Estroublans, Vitrolles",0
Vitrolles,Restaurant Du Lac,ChIJN2NkwT3pyRIR8kToLSLqaRQ,"Restaurant Français, Bar, Traiteur","All. Des Artistes, Vitrolles",0
Vitrolles,La Terrasse Des Marettes,ChIJP0ies2HvyRIRdBq0PJqHV4s,"Restaurant, Brasserie, Restaurant Français","48 Chemin De Saint Bourdon, Vitrolles",0
Vitrolles,L'essentiel - Les Estroublans Vitrolles,ChIJidCNHLHoyRIRpVBsRvlE7vw,"Restaurant, Restaurant Français, Restaurant Italien","5 Rue De Stockholm, Vitrolles",0
Vitrolles,L'escale Restaurant Pizzeria & Burgers,ChIJPVUD11bvyRIR6etaKf-0qcU,"Restaurant Français, Restaurant Chophouse, Restaurant De Hamburgers, Restaurant De Livraison, Livraison De Pizzas, Restaurant De Pizzas, Pizza À Emporter, Restaurant, Brasserie","69 Bd Henri Loubet, Vitrolles",0
Vitrolles,Ayanami,ChIJaQcZjjvpyRIR42tVcuKbAVE,"Restaurant Japonais Authentique, Restaurant Japonais, Restaurant De Sushis","511 Av. Jean Monnet, Vitrolles",NA
