respondent.commune,business_name,place_id,fr_categories,business_address,treatment_arm
Chevilly-Larue,Nuevo Mexico,ChIJOyzAvJd15kcRihbIuGIiSGU,Restaurant Halal,"7 Rue Pasteur, Chevilly-Larue",1
Chevilly-Larue,Andiamo Pizza,ChIJt-mGfUVx5kcRvObtKY3SX8w,"Restaurant De Pizzas, Restaurant De Restauration Rapide, Restaurant Grec, Restaurant Halal, Restaurant, Sandwicherie, Restaurant Turc","117 Rue De Bicètre, L'Haÿ-les-Roses",1
Chevilly-Larue,La Criée Chevilly Larue,ChIJufXqMwR05kcRd8gpyv8ESwk,"Restaurant, Service De Livraison, Restaurant De Poisson-Frites, Restaurant De Poissons, Restaurant De Fruits De Mer","218 Av. De Stalingrad, Chevilly-Larue",0
Chevilly-Larue,Café Nelson,ChIJD4HPWAB15kcR6tBxoglTxEA,"Brasserie, Café, Restaurant","35 Av. Du Président Franklin Roosevelt, Chevilly-Larue",0
Chevilly-Larue,Taverna,ChIJyTZEVQR05kcR5KLYRh-bdvc,"Restaurant, Restaurant Barbecue, Restaurant Français, Restaurant Italien","248 Av. De Stalingrad, Chevilly-Larue",0
Chevilly-Larue,Les Vendanges,ChIJ74CRWaZ25kcR2hTY4tAExdY,"Restaurant, Restaurant Français","1 Av. De Bretagne, Chevilly-Larue",0
Chevilly-Larue,L’étoile,ChIJSRPSQaZ25kcRqIq3lPKxNXY,"Gastro-Pub, Bar, Bar Et Grill, Restaurant Français, Restaurant À Emporter, Restaurant, Brasserie, Sandwicherie","1 Rue De Lorraine, Chevilly-Larue",0
Chevilly-Larue,Restaurant Bangkok,ChIJtR_IEAN05kcRv7VHEtRe2PQ,Restaurant Thaïlandais,"4 Pl. De La Libération, Chevilly-Larue",NA
Chevilly-Larue,Japan Thaï,ChIJlXsPwUZ15kcRmQws0pYGwJc,Restaurant Japonais,"16 Rue Edith Piaf, Chevilly-Larue",NA
Chevilly-Larue,Edo Asian Bar,ChIJryoDXgB35kcR2bJVutKrs9Q,Restaurant Asiatique,"France, Chevilly-Larue",NA
Chevilly-Larue,Mangue Thaï,ChIJRdmMXx115kcRLgguEAp4iRg,Restaurant Asiatique,"Unnamed Road, Thiais",NA
Chevilly-Larue,Tamaya,ChIJtT_flxd05kcRRY1CBADckbs,Restaurant Japonais,"Belle Épine, Thiais",NA
Choisy-le-Roi,Caravana Choisy Le Roi,ChIJgx6Rbg515kcRh8t54OwJWtQ,"Restaurant, Restaurant Halal, Restaurant De Livraison","23 Av. Louis Luc, Choisy-le-Roi",1
Choisy-le-Roi,O'tacos Choisy Le Roi,ChIJA7P_1Yd05kcRsXmljkmEN4g,"Restaurant De Restauration Rapide, Restaurant, Restaurant De Tacos","34 Galerie Rouget De Lisle, Choisy-le-Roi",1
Choisy-le-Roi,786 - Choisy-Le-Roi I Brasserie & Burger,ChIJF2ePcDR15kcRyOZmIpQyudY,"Restaurant, Restaurant De Restauration Rapide, Restaurant Halal, Brasserie","4 Bd De Stalingrad, Choisy-le-Roi",1
Choisy-le-Roi,Safari Delices,ChIJwW8fGJ915kcRxsS6R2Abslk,Restaurant Halal,"23 Rue Guy Môquet, Choisy-le-Roi",1
Choisy-le-Roi,Chicken Street,ChIJRfiJFUV15kcR0R7pY5EYlfY,"Restaurant Halal, Restaurant De Poulet, Restaurant D'ailes De Poulet, Restaurant Familial, Restaurant De Restauration Rapide, Poulet Frit À Emporter, Restaurant De Hamburgers, Restaurant De Livraison, Restaurant","31 Av. Anatole France, Choisy-le-Roi",1
Choisy-le-Roi,Restaurant Le Phare De Seine,ChIJs_CYtpp05kcRdJb-L6nOthE,"Restaurant, Bar, Restaurant Français, Restaurant Français Moderne","25 Av. De Villeneuve Saint-Georges, Choisy-le-Roi",0
Choisy-le-Roi,Le Contrepoids,ChIJlQ9llf515kcRt3kDIgXwohg,"Restaurant, Restaurant Français","32 Av. Anatole France, Choisy-le-Roi",0
Choisy-le-Roi,Le Saint Louis,ChIJAQBU7Id05kcRNxRPiG7nWG0,"Brasserie, Restaurant Français","18 Bd Des Alliés, Choisy-le-Roi",0
Choisy-le-Roi,La Marine,ChIJ7_ygk4905kcRKCL5OAZWBH4,"Restaurant, Restaurant Français","52 Av. Louis Luc, Choisy-le-Roi",0
Choisy-le-Roi,Bar Restaurant L'eden,ChIJa5k0V31z5kcRluilzQ3Gfvw,"Restaurant, Bar, Restaurant Français, Restaurant Portugais","115 Av. D'alfortville, Choisy-le-Roi",0
Choisy-le-Roi,Tagawa,ChIJ4534OoZ05kcR4x0ZpaWAn84,"Restaurant Japonais, Restaurant De Sushis","Av. Jean Jaurès, Choisy-le-Roi",NA
Choisy-le-Roi,Zaki Sushi,ChIJbQJy34R05kcR_Lr1y80JrwE,"Restaurant De Sushis, Restaurant Japonais, Restaurant","14 Av. Louis Luc, Choisy-le-Roi",NA
Choisy-le-Roi,Jardin Du Printemps,ChIJiUFDPJt05kcRsu4tpxpMlwc,"Restaurant Asiatique, Restaurant Japonais, Restaurant, Restaurant De Sushis","18 Av. Victor Hugo, Choisy-le-Roi",NA
Choisy-le-Roi,Ducky’s,ChIJM2UJkdB15kcRCpl9Ayv-KiA,"Restaurant Asiatique, Restaurant Chinois","15 Rue Du Dr Roux, Choisy-le-Roi",NA
Choisy-le-Roi,Gongfu Nouilles,ChIJ9xO4Qs515kcRspa2wvM-pvA,"Restaurant Chinois, Restaurant Asiatique","26 Av. Anatole France, Choisy-le-Roi",NA
Créteil,Brendy's Café Créteil,ChIJDSpyIK8N5kcRf5Z-lAdjHtc,"Restaurant Halal, Restaurant Familial, Restaurant De Restauration Rapide, Restaurant De Hamburgers, Restaurant À Emporter, Restaurant","Av. De La France Libre, Créteil",1
Créteil,La Cantine Libanaise - Creteil,ChIJh5a8dGYN5kcRNgiqwFcf2cw,"Restaurant Libanais, Traiteur","7 Avenue Des Compagnons De La Libération, Soleil, Créteil",1
Créteil,Le Palais Du Maroc.,ChIJh43rjK4M5kcRxSATPMvxSjU,Restaurant Marocain,"Créteil Soleil Centre Commercial Régional, Créteil",1
Créteil,Orien'table (Traiteur/Cuisine Libanaise),ChIJm0KnGMgM5kcRr20au3kGNEY,"Restaurant Libanais, Restaurant Halal","14 Rue Du Général Leclerc, Créteil",1
Créteil,Foulo,ChIJPcaJ1LkM5kcR_9fhcc0IFcE,"Restaurant, Restaurant Buffet, Restaurant Halal, Restaurant De Fondue Chinoise, Restaurant Mandarin","16 Rue De Joly, Créteil",1
Créteil,Domaine Sainte Catherine,ChIJS3864cAM5kcRtE4_9NV9Fh8,Restaurant Français,"22 All. Centrale, Créteil",0
Créteil,Indiana Café - Créteil Soleil,ChIJjb0BK4cN5kcRhsRuHhz8lBo,"Restaurant Américain, Bar, Restaurant Familial","Centre Commercial Régional Créteil-Soleil, Créteil",0
Créteil,Hippopotamus Steakhouse,ChIJhcL57K4M5kcRWXQ1SdunJsE,"Restaurant, Bar Et Grill, Restaurant Barbecue, Dîner, Restaurant Familial, Restaurant Français, Restaurant À Emporter, Steak House","Centre Commercial Régional Créteil-Soleil Niveau 3, Créteil",0
Créteil,Brasserie Le Cm,ChIJkUrOPrgM5kcRdd5TDtNM1X8,"Restaurant, Brasserie","48 Rue Du Général Leclerc, Créteil",0
Créteil,Le Miam's,ChIJbSvVWktz5kcRX2Qi6MTJwJc,"Restaurant De Restauration Rapide, Restaurant Américain, Restaurant De Hamburgers, Restaurant De Livraison, Restaurant, Sandwicherie, Service D'expédition","30 Av. Du Maréchal Lyautey, Créteil",0
Créteil,Thaï Basilic Créteil Soleil,ChIJN85lo4MN5kcRKOZe5ZeOBCg,"Restaurant Thaïlandais, Restaurant Asiatique, Restaurant","101 Av. Du Général De Gaulle, Créteil",NA
Créteil,Jardin Du Prince,ChIJc8N1vFYN5kcRKXKoA9sjxYo,"Restaurant Indien, Restaurant","39 Rue Paul François Avet, Créteil",NA
Créteil,Le Bonheur Thaï,ChIJGxECk8sM5kcRcZmeWqUD96E,Restaurant Asiatique,"45 Av. Du Maréchal De Lattre De Tassigny, Créteil",NA
Créteil,Sushi Way Créteil Soleil,ChIJv6bY-zQN5kcR7NvfiVT5bIE,Restaurant Japonais,"101 Av. Du Général De Gaulle, Créteil",NA
Créteil,Shinoboy - Korean Street Food,ChIJf5-igPBz5kcRWIFwPEU9MrM,Restaurant Coréen,"26 All. Parmentier, Créteil",NA
Fontenay-sous-Bois,Saveur De Montreuil,ChIJCX13MUUT5kcR4bb0-qqGtIE,"Restaurant À Emporter, Restaurant Halal","254 Bd Théophile Sueur, Montreuil",1
Fontenay-sous-Bois,Le New Berbère,ChIJV-0NslQN5kcRksT_spL9vhA,"Restaurant, Restaurant Barbecue, Restaurant Marocain","143 Rue Dalayrac, Fontenay-sous-Bois",1
Fontenay-sous-Bois,Street Wok,ChIJ1zCNqlxz5kcRIJvQklE7pM8,"Restaurant Thaïlandais, Restaurant De Fusion Asiatique, Restaurant Halal, Restaurant De Fondue Chinoise, Restaurant Indien Musulman, Restaurant Indien Moderne","4 Bis Av. De Stalingrad, Fontenay-sous-Bois",1
Fontenay-sous-Bois,L'empreinte Saray Grill,ChIJmwBoylQN5kcR5mN7v4IOtbs,Restaurant Turc,"2 Av. De La République, Fontenay-sous-Bois",1
Fontenay-sous-Bois,Restaurant Istanbul,ChIJ3WLAiqcS5kcRtUnB7zfya7Q,"Restaurant Turc, Gril, Kebab","57 Bd De Verdun, Fontenay-sous-Bois",1
Fontenay-sous-Bois,Les Clanchistes,ChIJ04-WeVQN5kcR-ICcxUNF3gs,Restaurant Français,"99 Rue Dalayrac, Fontenay-sous-Bois",0
Fontenay-sous-Bois,Pub Brasserie Le Village,ChIJWe5vuFsN5kcRnOmbwFSRe7w,"Brasserie, Restaurant Barbecue, Brasserie, Bar À Cocktails, Charcuterie, Restaurant De Hamburgers, Pub, Magasin De Salades, Bar Sportif, Bar À Vin","8 Pl. Du Général Leclerc, Fontenay-sous-Bois",0
Fontenay-sous-Bois,Bistrot Des Rosettes,ChIJUY-ka1oN5kcR0O34DMfj7e4,Bistro,"1 Rue Du Commandant Jean Duhail, Fontenay-sous-Bois",0
Fontenay-sous-Bois,Meve Association,ChIJCc6SEBwT5kcRRl6al_4SyE4,Restaurant Américain,"Pl. Des Larris, Fontenay-sous-Bois",0
Fontenay-sous-Bois,Le Bistrot Du Coin,ChIJt6WoIeFz5kcRarmQzHF1SuA,"Restaurant, Bistro","257 Rue Diderot, Vincennes",0
Fontenay-sous-Bois,Restaurant Himalaya,ChIJXepxJmwN5kcRc3yc6UbnLFo,"Restaurant Indien, Restaurant Népalais","4 Rue De L'ancienne Mairie, Fontenay-sous-Bois",NA
Fontenay-sous-Bois,Izu Sushi Fontenay-Sous-Bois,ChIJi3B9j1oN5kcRT_Y2DrHHyxo,"Restaurant Asiatique, Restaurant Chinois, Restaurant Japonais, Restaurant De Livraison, Restaurant À Emporter, Restaurant, Restaurant De Sushis, Sushis À Emporter, Restaurant Thaïlandais, Restaurant Vietnamien","21 Rue Du Commandant Jean Duhail, Fontenay-sous-Bois",NA
Fontenay-sous-Bois,Le Kohistan,ChIJSzdXiloN5kcRH4whpwjpWes,"Restaurant Indien, Bar, Restaurant","10 Rue Grognard, Fontenay-sous-Bois",NA
Fontenay-sous-Bois,Genki,ChIJ_U2l8ioN5kcRh2R6pT-FeNk,"Restaurant De Ramen, Restaurant De Curry Japonais, Restaurant Japonais, Restaurant Katsudon, Restaurant De Takoyaki, Restaurant Tonkatsu","116 Rue Dalayrac, Fontenay-sous-Bois",NA
Fontenay-sous-Bois,Restaurant Song Hoa,ChIJ4RHPlFEN5kcRUH9CPUEInQc,Restaurant Chinois,"2 Rue Mallier, Fontenay-sous-Bois",NA
Fresnes,Restaurant Istanbul,ChIJX1JvrN125kcRTwI-5vsbRN4,Restaurant Turc,"33 Rue Henri Barbusse, Fresnes",1
Fresnes,Habibi Grill,ChIJvXhjaAB35kcRNOPu-ziNbaQ,"Restaurant Halal, Restaurant","7bis Rue Du Dr Charcot, Fresnes",1
Fresnes,Pizza Service,ChIJgVvyx8N25kcRxFqOtut6i6M,"Restaurant De Pizzas, Gril, Restaurant Halal, Restaurant De Hamburgers, Restaurant De Livraison, Restaurant, Brasserie, Sandwicherie","23 Av. De La Paix, Fresnes",1
Fresnes,Pizza Bellucci,ChIJDRIbBd125kcR-eeupaGIZE4,"Restaurant De Pizzas, Livraison De Pizzas, Pizza À Emporter, Sandwicherie, Service D'expédition, Restaurant De Tacos","33 Rue Henri Barbusse, Fresnes",1
Fresnes,Pizza Uno,ChIJUT4Er9l25kcRm1xbqusq5fw,"Restaurant, Restaurant De Couscous, Restaurant De Restauration Rapide, Restaurant Halal, Restaurant De Pizzas, Pizza À Emporter","47 Av. De La Liberté, Fresnes",1
Fresnes,L'amarelle,ChIJYVPYvel25kcRjJA06uXgjgo,"Brasserie, Restaurant","Zone De La Cerisaie, Fresnes",0
Fresnes,Au Bureau,ChIJISXqvOl25kcRTdqCSnoaw8A,"Restaurant, Bar, Restaurant Européen, Restaurant Français, Restaurant De Hamburgers, Restaurant Irlandais, Pub, Bar Sportif","Parc De La Cerisaie, Fresnes",0
Fresnes,Brasserie De L'hôtel De Ville,ChIJUy3ml-d25kcRaXzsz2ts_Gc,"Brasserie, Brasserie, Restaurant","1 Pl. De L'église, Fresnes",0
Fresnes,Crep'way,ChIJZwOX65Z35kcR6lpU6y-XaNA,Crêperie,"47 Av. De La Liberté, Fresnes",0
Fresnes,Ma Maison Renov - My Kitchen - Votre Cuisiniste Sur Antony - Un Seul Interlocuteur Pour Tous Vos Projets De Rénovation,ChIJtSOHMBV35kcR1hDN2ZRuOgU,"Rénovateur De Cuisine, Rénovateur De Salle De Bain, Magasin D'armoires, Entrepreneur Général, Restaurant Français Moderne, Menuisier","18 Rue Jean Moulin, Antony",0
Fresnes,Restaurant Indien Milane Tandoori Nan Kabab,ChIJfS4huOB25kcRGhXVPMx_uSM,"Restaurant Indien, Traiteur","21 Bd Jean Jaurès, Fresnes",NA
Fresnes,Fujiyama,ChIJZ8Lixed25kcRbufhn-wYhE8,"Restaurant Japonais, Restaurant De Sushis","16b Rue Maurice Tenine, Fresnes",NA
Fresnes,Jia Xin,ChIJu-j_Uwl35kcRxM3tboS38_8,Plats Chinois À Emporter,"50 Bd Pasteur, Fresnes",NA
Fresnes,Lumières D’asie,ChIJWYytumx35kcRjDh6EXms6xk,Restaurant Chinois,"8bis Av. De Stalingrad, Fresnes",NA
Fresnes,Atlantic,ChIJI9BGJwB35kcR7tXefybv4hk,"Restaurant, Restaurant Buffet, Restaurant Japonais","Zone La Cerisaie, Fresnes",NA
Gentilly,Brikabrak,ChIJnRcpfKVx5kcRC47QWaLL_2c,Restaurant Marocain,"14 Av. Du Chaperon Vert, Arcueil",1
Gentilly,Sur Le Pouce,ChIJo_LcvHVx5kcREOpgqVkEmVo,"Restaurant Libanais, Traiteur, Sandwicherie","18 Rue Raymond Lefebvre, Gentilly",1
Gentilly,My House | Libanais,ChIJkSDFrB1x5kcRXEBwKLvrADs,"Restaurant Halal, Restaurant De Hamburgers, Restaurant Italien, Restaurant De Pizzas","22bis Av. Paul Vaillant Couturier, Gentilly",1
Gentilly,Boubou,ChIJfb5AsLtx5kcRfmdXDc-cqyA,"Restaurant, Restaurant Géorgien, Kebab","30 Av. Jean Jaurès, Gentilly",1
Gentilly,Le Cristal Burger,ChIJC2VZCaBx5kcRW_kiq96E4H8,"Restaurant De Restauration Rapide, Restaurant De Hamburgers, Restaurant De Tacos","75 Av. Paul Vaillant Couturier, Gentilly",1
Gentilly,Chez Louise,ChIJgxwqedxx5kcR-kedb-4EWnE,"Restaurant Français, Magasin De Bière, Bistro, Bar À Cocktails, Restaurant Du Déjeuner, Restaurant De Fruits De Mer, Restaurant Végétarien, Bar À Vin","2 Rue Lecocq, Gentilly",0
Gentilly,Le Sympathique,ChIJXcnM6oVx5kcRDhgDuKpMoCw,Restaurant Français,"21 Av. Jean Jaurès, Gentilly",0
Gentilly,Café Crème,ChIJkW067XVx5kcRHk9rpO1urn8,"Bar, Café, Brasserie","13 Av. Paul Vaillant Couturier, Gentilly",0
Gentilly,Restaurant Café Le Vaillant Gentilly,ChIJScOxj3Vx5kcRr8EsvFyC7o4,"Restaurant, Bar, Restaurant Français, Café, Brasserie","31 Av. Paul Vaillant Couturier, Gentilly",0
Gentilly,Costa Brava,ChIJlReCXwtx5kcR9MPfLPIUyvQ,"Restaurant Portugais, Restaurant Américain, Restaurant À Emporter, Restaurant, Brasserie","109 Rue Raymond Lefebvre, Gentilly",0
Gentilly,Le Petit Viet,ChIJ1X0utJdx5kcRHt9Zw275a6M,Restaurant Vietnamien,"29 Av. Paul Vaillant Couturier, Gentilly",NA
Gentilly,Pho Bonjour De Gentilly,ChIJU0c-SqBx5kcR85JLOPa9FKk,Restaurant Vietnamien,"32 Av. Raspail, Gentilly",NA
Gentilly,Old School,ChIJO-rdbglx5kcR6lMrYsWKPvs,"Restaurant Indien, Restaurant De Hamburgers, Restaurant","5 1ère Av., Gentilly",NA
Gentilly,15 Baht,ChIJXU4a67Fx5kcR9g1srwufftk,"Restaurant Thaïlandais, Restaurant Asiatique, Bar, Restaurant Végétalien, Restaurant Végétarien","43 Rue Benoît Malon, Gentilly",NA
Gentilly,Japjap Sushi,ChIJteivA8lx5kcRA8vwAh8DsFg,"Restaurant Japonais, Restaurant De Fondue Chinoise, Restaurant Régional Japonais, Restaurant, Restaurant De Sushis, Sushis À Emporter","34 Av. Raspail, Gentilly",NA
L'Haÿ-les-Roses,Au Regal Original,ChIJ_cdqOnp35kcRM7PhplKKzLA,"Restaurant, Pâtisserie, Restaurant Français, Restaurant Halal, Restaurant De Hamburgers, Glacier, Restaurant Du Déjeuner, Sandwicherie, Restaurant Végétarien","1 All. Costes Et Bellonte, Chevilly-Larue",1
L'Haÿ-les-Roses,Tacos Numéro 1,ChIJI42rcNB25kcRj5PHdQmXKgI,"Restaurant De Tacos, Restaurant De Restauration Rapide, Restaurant Mexicain","1 A Rue Jean Moulin, Fresnes",1
L'Haÿ-les-Roses,Restaurant Antalya,ChIJP9ySd0px5kcRttOlOIGJUUs,Restaurant Turc,"7 Rue Dispan, L'Haÿ-les-Roses",1
L'Haÿ-les-Roses,Dare Wok (Dark Kitchen - Livraison Et À Emporter),ChIJsydZwFpx5kcRyRwsPSlpnXY,"Restaurant, Restaurant De Nouilles Chinoises, Plats Chinois À Emporter, Restaurant Chinois De Livraison, Restaurant Halal, Restaurant Mandarin, Restaurant À Emporter, Restaurant Panasiatique, Restaurant Thaïlandais, Restaurant De Wok","16 Rue Des Marronniers, L'Haÿ-les-Roses",1
L'Haÿ-les-Roses,Thai Life,ChIJJ-GtOKh35kcRSbGx37pv4j4,"Restaurant Thaïlandais, Restaurant Halal, Restaurant De Fondue Chinoise","6 Rue Marc Sangnier, L'Haÿ-les-Roses",1
L'Haÿ-les-Roses,Graffiti,ChIJoT-G4S9x5kcRSGc2EF8dGfo,"Restaurant, Magasin De Bière, Pâtisserie, Bar À Cocktails, Restaurant Français, Glacier, Restaurant Italien, Restaurant Méditerranéen, Pâtisserie","3 Rue Jean Jaurès, L'Haÿ-les-Roses",0
L'Haÿ-les-Roses,Chez Léon,ChIJibIB3Epx5kcR5ruG594G-5Y,"Restaurant, Restaurant Français","125 Bd Paul Vaillant Couturier, L'Haÿ-les-Roses",0
L'Haÿ-les-Roses,La Gourmandise,ChIJK77pdk1x5kcRaE17Ds4UXYs,"Boulangerie, Restaurant De Petit-Déjeuner, Pâtisserie, Chocolaterie, Boutique De Beignets, Restaurant Français, Pâtisserie, Sandwicherie","10 Rue Jules Ferry, L'Haÿ-les-Roses",0
L'Haÿ-les-Roses,Le Pavillon Normand,ChIJMwSUVs125kcRlHTfAmzfBG4,"Restaurant, Restaurant Français, Salon De Thé","Parc De La Roseraie Du, L'Haÿ-les-Roses",0
L'Haÿ-les-Roses,L'en-Cas,ChIJyaeWADVx5kcRE8KSBDQwJc8,Crêperie,"5 Rue Des Tournelles, L'Haÿ-les-Roses",0
L'Haÿ-les-Roses,Maru Restaurant,ChIJsSEX77V25kcRbTl6gb0NP6s,Restaurant Coréen,"58 Bd Jean Mermoz, Chevilly-Larue",NA
L'Haÿ-les-Roses,Minato,ChIJ75v6c8h25kcRgHyYl2_kOek,Restaurant Japonais,"162 Bd Jean Mermoz, Chevilly-Larue",NA
L'Haÿ-les-Roses,Le Grand Palais Du Bonheur,ChIJP76Kr7V25kcRtWNJZNZsBAk,"Restaurant Asiatique, Restaurant Chinois, Restaurant Thaïlandais, Restaurant Vietnamien","32 Av. Du Général De Gaulle, Chevilly-Larue",NA
L'Haÿ-les-Roses,Koh Samiam Thaï Food,ChIJ_R6kftt35kcR5GUVwO4gVj0,Restaurant Thaïlandais,"84 Bd Jean Mermoz, Chevilly-Larue",NA
L'Haÿ-les-Roses,Ayuko,ChIJd__ppLV25kcRx19UPWoZwj0,"Restaurant Japonais, Restaurant De Sushis, Sushis À Emporter, Restaurant Yakitori","7 Bd Jean Mermoz, Chevilly-Larue",NA
Ivry-sur-Seine,L'avanos,ChIJibV3n8lz5kcR9HKspvLkqHs,"Restaurant, Magasin De Bière, Pâtisserie, Bar À Cocktails, Restaurant De Hamburgers, Glacier, Restaurant Turc, Restaurant Végétarien, Bar À Vin","19 Promenée Marat, Ivry-sur-Seine",1
Ivry-sur-Seine,31 Street Burgers - 94200 Ivry,ChIJKTy298Vz5kcRAIqcPtIdZIw,"Restaurant De Hamburgers, Restaurant Américain, Club D'anime, Restaurant Brunch, Restaurant Familial, Restaurant De Restauration Rapide, Restaurant Halal, Restaurant De Livraison, Restaurant À Emporter, Restaurant","15 Rue Gabriel Péri, Ivry-sur-Seine",1
Ivry-sur-Seine,O'tasty,ChIJj35rDMxz5kcR3xapQu0DC7k,"Restaurant De Tacos, Restaurant De Restauration Rapide, Restaurant Halal, Restaurant De Pizzas, Sandwicherie","55 Rue Jean Le Galleu, Ivry-sur-Seine",1
Ivry-sur-Seine,Nudem,ChIJ68mb20xy5kcRz6SRt5OUu38,Restaurant Turc,"53 Rue Lénine, Ivry-sur-Seine",1
Ivry-sur-Seine,Restaurant Sile,ChIJaZTEx_Vz5kcR3rniggWOdBw,Kebab,"70 Bd Paul Vaillant Couturier, Ivry-sur-Seine",1
Ivry-sur-Seine,Le Petit Crepio Sas,ChIJxeEMkzJy5kcRbLYb6b00kMg,"Crêperie, Restaurant Français","58 Ter Av. Maurice Thorez, Ivry-sur-Seine",0
Ivry-sur-Seine,Le Carré,ChIJfQADTK1z5kcR1hn0Iq_DRP4,"Restaurant, Café, Restaurant Français, Brasserie","2 Pl. De L'insurrection D'août 1944, Ivry-sur-Seine",0
Ivry-sur-Seine,Little Kitchen,ChIJ8UtVLshz5kcRR47J8Z3FXAE,"Restaurant, Bistro, Brasserie","49 Av. Maurice Thorez, Ivry-sur-Seine",0
Ivry-sur-Seine,Soho Restaurant,ChIJs29CgJdz5kcRvw-xpgaF_PU,Restaurant Américain,"101 Av. Maurice Thorez, Ivry-sur-Seine",0
Ivry-sur-Seine,Chez Alain - Ivry-Sur-Seine,ChIJcfouGcpz5kcRcz-KGYe_o_s,Restaurant Français,"3 Rue Robespierre, Ivry-sur-Seine",0
Ivry-sur-Seine,Asian Food By Baze Ivry-Sur-Seine,ChIJLc7MtNhz5kcRnJ-S-zSYS14,Restaurant Asiatique,"45 Av. Maurice Thorez, Ivry-sur-Seine",NA
Ivry-sur-Seine,Maison Viet,ChIJBYuu3wZz5kcRA9xB1LYnHig,Restaurant Vietnamien,"3 Rue Lénine, Ivry-sur-Seine",NA
Ivry-sur-Seine,Tokyo Sushi,ChIJt9McQrZz5kcR9gYjU6AT7uw,Restaurant Japonais,"41 Rue Marat, Ivry-sur-Seine",NA
Ivry-sur-Seine,Bangkok Karaoké,ChIJW6gSGSty5kcRHP_-3UcGseo,"Restaurant Thaïlandais, Bar Karaoké","2b Av. De Verdun, Ivry-sur-Seine",NA
Ivry-sur-Seine,Sushi Edokko,ChIJa3IAdFJy5kcRO3xwIBnyVu0,Restaurant Japonais,"49 Bd Paul Vaillant Couturier, Ivry-sur-Seine",NA
Joinville-le-Pont,La Tajine D'or,ChIJXatj8ToN5kcRNZZ2ddrI3DI,Restaurant Algérien,"59 Quai De La Marne, Joinville-le-Pont",1
Joinville-le-Pont,Restaurant Norhane,ChIJda7f4NkN5kcRExs7Y_qzNZg,Restaurant Libanais,"84/86 Av. Du Général Gallieni, Joinville-le-Pont",1
Joinville-le-Pont,Enjoy Bubble,ChIJ394RdbIN5kcRzy-GPJY38L0,"Crêperie, Restaurant De Desserts, Restaurant De Restauration Rapide, Restaurant Halal","78 Av. Du Général Gallieni, Joinville-le-Pont",1
Joinville-le-Pont,Restaurant Chez Yunus,ChIJh0igrhsN5kcRytwxRAzqxoU,"Restaurant De Restauration Rapide, Kebab","3 Av. Du Général De Gaulle, Champigny-sur-Marne",1
Joinville-le-Pont,Mimosa Grill,ChIJXZJt0QYN5kcREHo0i3cxPzQ,Restaurant Turc,"30 Av. Roger Salengro, Champigny-sur-Marne",1
Joinville-le-Pont,Café Restaurant Le Trotteur,ChIJWw-WfBkN5kcRIwPpDs2vWyc,"Restaurant, Bar, Magasin De Bière, Pâtisserie, Bar À Cocktails, Restaurant Français, Restaurant De Hamburgers, Restaurant Du Moyen-Orient, Bar À Vin","9 Av. Roger Salengro, Champigny-sur-Marne",0
Joinville-le-Pont,Restaurant Le Petit Pont,ChIJDZDIriQN5kcRtvc570KcAmc,"Restaurant Français, Bistro","40 Av. Jean D'estienne D'orves, Joinville-le-Pont",0
Joinville-le-Pont,Au Cheval Blanc,ChIJ-08dXiYN5kcRF5ZOUxAZxW8,"Brasserie, Bar, Restaurant De Pizzas, Restaurant","41 Rue De Paris, Joinville-le-Pont",0
Joinville-le-Pont,Germain,ChIJg7nmpTwN5kcRxlUr-QBropc,"Restaurant, Brasserie, Fournisseur De Nourriture Et De Boissons Pour La Restauration, Restaurant Familial, Restaurant De Poissons, Restaurant Français, Restaurant De Plats De Viande","1 Ter Quai De La Marne, Joinville-le-Pont",0
Joinville-le-Pont,La Mascotte,ChIJXwl5XiEN5kcR0JEWgIYZ3Jk,"Restaurant Français, Bar","21 Quai Gabriel Péri, Joinville-le-Pont",0
Joinville-le-Pont,Bambou,ChIJW_YEcxkN5kcRl2VcVNLHk9s,"Restaurant Coréen, Restaurant","56 Av. Du Général Gallieni, Joinville-le-Pont",NA
Joinville-le-Pont,Le Palais D’or,ChIJQ9KdaCYN5kcRZk7NXpOX_Is,"Restaurant Chinois, Restaurant Japonais","33 Rue De Paris, Joinville-le-Pont",NA
Joinville-le-Pont,Ban Shan,ChIJn-SfP0YN5kcR4nMsC_nDu2M,Restaurant Thaïlandais,"8 All. Raymond Nègre, Joinville-le-Pont",NA
Joinville-le-Pont,Eat Sushi Joinville-Le-Pont,ChIJP4O5mhgN5kcRX862IQ6Je4o,"Restaurant De Sushis, Restaurant De Sushis À Tapis Roulant, Restaurant Familial, Restaurant De Fondue Chinoise, Restaurant Japonais, Restaurant De Livraison, Restaurant, Sushis À Emporter","12 Av. Du Général Gallieni, Joinville-le-Pont",NA
Joinville-le-Pont,Shun Feng,ChIJweaeLWgN5kcRnyBiZ5OwxXM,"Restaurant Asiatique, Traiteur","28 Rue De Paris, Joinville-le-Pont",NA
Le Kremlin-Bicêtre,Le Cèdre,ChIJWzrQmX9x5kcRW8qCPdQb2Yk,Restaurant Libanais,"2 Rue Roger Salengro, Le Kremlin-Bicêtre",1
Le Kremlin-Bicêtre,Le Pacha,ChIJIxrndX9x5kcRORwFOtmScTQ,"Restaurant Turc, Restaurant De Restauration Rapide","24 Av. De Fontainebleau, Le Kremlin-Bicêtre",1
Le Kremlin-Bicêtre,Sidibou Kb,ChIJy07mbH9x5kcRr9fCSIuIWzw,Restaurant Tunisien,"16 Rue Du Général Leclerc, Le Kremlin-Bicêtre",1
Le Kremlin-Bicêtre,Le Constant-Le Constantinople,ChIJBa0A5H1x5kcR4i9rwBGP1Ys,"Restaurant Turc, Restaurant De Restauration Rapide","96 Av. De Fontainebleau, Le Kremlin-Bicêtre",1
Le Kremlin-Bicêtre,La Porte De Carthage,ChIJpzD8g8Nx5kcRVlj22XTVIdw,Restaurant Tunisien,"8 Av. De Fontainebleau, Le Kremlin-Bicêtre",1
Le Kremlin-Bicêtre,Café Chez Pierre,ChIJLd0nRH5x5kcR9XPMAgLzIc4,"Brasserie, Restaurant De Cuisine Campagnarde, Restaurant Traditionnel","58 Av. De Fontainebleau, Le Kremlin-Bicêtre",0
Le Kremlin-Bicêtre,Le Kb,ChIJj59-hX1x5kcRR24F5MscTEQ,Restaurant Français,"114 Av. De Fontainebleau, Le Kremlin-Bicêtre",0
Le Kremlin-Bicêtre,Le Plaza,ChIJ_7vnfX9x5kcRBn1_tPI8jjA,"Restaurant Italien, Restaurant Français, Restaurant De Pizzas, Brasserie","8-10 Av. De Fontainebleau, Le Kremlin-Bicêtre",0
Le Kremlin-Bicêtre,L'ardoise,ChIJZZbzAdZz5kcR1h2zhG1v3RU,Restaurant Français,"2 Rue Edmond Michelet, Le Kremlin-Bicêtre",0
Le Kremlin-Bicêtre,Chez Ma-No,ChIJAQAkJ39x5kcRRyvA8i0m17Q,"Restaurant, Restaurant Français","40 Rue Du Général Leclerc, Le Kremlin-Bicêtre",0
Le Kremlin-Bicêtre,Sésame Et Sel,ChIJWzc9k39x5kcRXK3TooeyLYE,"Restaurant Coréen, Restaurant De Fusion Asiatique, Restaurant Asiatique, Restaurant De Barbecue Coréen, Restaurant De Bœuf Coréen, Restaurant De Plats De Viande, Restaurant, Restaurant Végétarien","13 Rue Roger Salengro, Le Kremlin-Bicêtre",NA
Le Kremlin-Bicêtre,Seoul Gang,ChIJWYwpDStx5kcRFvHZJS65sQw,Restaurant Coréen,"18 Av. De Fontainebleau, Le Kremlin-Bicêtre",NA
Le Kremlin-Bicêtre,Rajapreuk,ChIJu913Qa1z5kcR70C_BZyivrw,Restaurant Thaïlandais,"37 Rue Roger Salengro, Le Kremlin-Bicêtre",NA
Le Kremlin-Bicêtre,Café De La Mairie,ChIJL1_G0nhx5kcRg9BCG_lcRwE,"Restaurant Japonais, Magasin De Bière, Bistro, Café, Restaurant Français, Restaurant Méditerranéen, Restaurant Du Moyen-Orient, Restaurant De Fruits De Mer, Bar À Vin","25 Rue Du 14 Juillet, Le Kremlin-Bicêtre",NA
Le Kremlin-Bicêtre,Thai Asian Street Food.,ChIJVVV5531x5kcRtUDQoaBb_XA,"Restaurant, Restaurant Thaïlandais","98 Av. De Fontainebleau, Le Kremlin-Bicêtre",NA
Limeil-Brévannes,La Table Marocaine,ChIJrZDwyAsL5kcRBxmL0Sk0NO0,"Restaurant Marocain, Restaurant Méditerranéen, Restaurant","89 Rue Henri Barbusse, Limeil-Brévannes",1
Limeil-Brévannes,Omak-Pizza,ChIJ4cD1gQ5z5kcRNCIcJ9d_t-8,"Restaurant De Pizzas, Fromagerie, Restaurant Français, Restaurant Sans Gluten, Restaurant Halal, Restaurant De Hamburgers, Restaurant Italien, Restaurant De Crêpes, Restaurant","87 Rue Henri Barbusse, Limeil-Brévannes",1
Limeil-Brévannes,Nefis Kebab & Grillades,ChIJBfFv2RQL5kcRNN6w1cetIp0,Restaurant,"4 Pl. Arthur Rimbaud, Limeil-Brévannes",1
Limeil-Brévannes,Yankee's,ChIJCY3Yb-gL5kcRvgwHT-Kn0Fs,"Restaurant De Restauration Rapide, Restaurant Halal, Restaurant De Hamburgers, Restaurant De Pizzas, Sandwicherie, Restaurant De Tacos","1 Rue Des Herbages De Sèze, Limeil-Brévannes",1
Limeil-Brévannes,O'melting Pizz & Crêpe,ChIJryL2kp8L5kcRFRiW7lUMBXw,"Restaurant De Pizzas, Crêperie, Restaurant Halal, Restaurant De Tacos","14 Rue Antoine De Saint-Exupéry, Limeil-Brévannes",1
Limeil-Brévannes,Le Moulin Vert,ChIJa7WxbgsL5kcR06fvPiPtMhM,"Restaurant, Restaurant Français","55 Rue Henri Barbusse, Limeil-Brévannes",0
Limeil-Brévannes,Royale Pizza,ChIJ2V9WcgsL5kcR6XHUd_uFD-w,"Restaurant De Pizzas, Restaurant De Restauration Rapide, Restaurant Français, Restaurant Italien, Restaurant De Livraison, Livraison De Pizzas, Restaurant, Restaurant Du Sud De L'italie","67 Rue Henri Barbusse, Limeil-Brévannes",0
Limeil-Brévannes,Auberge De Limeil,ChIJM305YBoL5kcRfiXpj9Ejoc8,Restaurant Français,"12 Rue Georges Clemenceau, Limeil-Brévannes",0
