respondent.commune,business_name,place_id,fr_categories,business_address,treatment_arm
Prunay-le-Gillon,Chichiko,ChIJHTEfTQAN5EcRc1SARXMkd-c,Restaurant Coréen,"13 Rue Des Pierres Missigault, Barjouville",NA
La Puisaye,Em Kebab,ChIJISJ4EC7n40cRkVJq_qEJ6n4,Restaurant Turc,"23 Rue Louis Peuret Ter, Senonches",1
La Puisaye,Sofoodpizza,ChIJc1-01r9j4UcR6_TE03D1QmI,"Restaurant De Restauration Rapide, Kebab","31 Rue Prte De Mortagne, Verneuil d'Avre et d'Iton",1
La Puisaye,Verneuil Kebab,ChIJr1fs_pRj4UcR0UN1KEcM3a0,Restaurant Turc,"11 Rue Aristide Briand, Verneuil d'Avre et d'Iton",1
La Puisaye,Punjab Food,ChIJpQANCiFj4UcRSDbUWRmxT50,"Restaurant De Kebab Doner, Restaurant","45 Pl. De La Madeleine, Verneuil d'Avre et d'Iton",1
La Puisaye,Presto Snack Pizza,ChIJpYrfpj5i4UcRHcKS9Kp1UI4,"Restaurant De Pizzas, Restaurant Halal, Kebab","27 Pl. De La Madeleine, Verneuil d'Avre et d'Iton",1
La Puisaye,Leonardo Manuel,ChIJ75wrXLTb40cRZl5DAoTpvJw,"Brasserie, Bar","26 Rue De Laborde, La Ferté-Vidame",0
La Puisaye,Le _ Grand Claireau,ChIJyQiB8FXn40cRfPeP62mVYIQ,"Restaurant, Bar, Restaurant Français","2 Rte Des Hauts Étangs, La Saucelle",0
La Puisaye,Hôtel La Forêt,ChIJwcVx2vvn40cRf4DUhySIO8k,"Hôtel, Restaurant Français","22 Rue De Verdun, Senonches",0
La Puisaye,Restaurant Chez Sophie,ChIJDzk5Wfnn40cRsQnYJKr3IzE,"Restaurant, Restaurant Français","19 Rue Aristide Briand, Senonches",0
La Puisaye,Logis Auberge De La Pomme De Pin,ChIJP0CPwuTn40cR2O5vBrlZ6tc,"Restaurant, Traiteur, Restaurant Français, Hôtel","15 Rue Michel Cauty, Senonches",0
La Puisaye,Royal Verneuil,ChIJQQGFGiNi4UcRfQdsQrNfYew,"Restaurant, Restaurant Asiatique, Bar, Restaurant Chinois, Restaurant Japonais","514 Rue Aristide Briand, Verneuil d'Avre et d'Iton",NA
La Puisaye,Traiteur Asiatique Nonancourt,ChIJw_M4PBdZ4UcRuQRmUKhq5W4,"Traiteur, Restaurant Chinois","34 Pl. Aristide Briand, Nonancourt",NA
La Puisaye,Pullay,ChIJNb9xZQBl4UcRX3PRtkGpshg,Restaurant Coréen,"175 Rue Neuve De Bémécourt, Breteuil",NA
La Puisaye,Lucky Grill / Restaurant Asiatique Buffet À Volonté,ChIJnR6-WqWB4UcRz5Pf2CkqDJE,"Restaurant Asiatique, Bar, Restaurant De Wok","Zone Artisanale, Saint-Sulpice-sur-Risle",NA
La Puisaye,Restaurant Chez Laulau,ChIJsSDdLwBd4UcRbw0JLOxbMv0,Restaurant Japonais,"1 Rue De Verdun, Mesnils-sur-Iton",NA
Puiseux,K-Burger (Sarl),ChIJ7QyHZ4EB5EcRsms-zxct3tw,"Restaurant, Restaurant De Restauration Rapide, Restaurant De Hamburgers, Kebab, Restaurant De Tacos","72 Grande Rue, Villemeux-sur-Eure",1
Puiseux,Mister Wok Thaï Street Food,ChIJW0ZLFGyr5kcRw_XMxVz9tbA,"Restaurant Thaïlandais, Restaurant Asiatique, Restaurant Cambodgien, Restaurant Cantonais, Restaurant Halal, Restaurant De Wok","33 Rue Du Pressoir, Vernouillet",1
Puiseux,Aysu Délices,ChIJiRX1JABV4UcRAPVgy17x3tI,Restaurant Turc,"40 Rte De Chartres, Vernouillet",1
Puiseux,Lezzet,ChIJG4xYECBV4UcRxAZZEVaV2hY,Restaurant Turc,"Rue Alcide De Gasperi, Vernouillet",1
Puiseux,Brasserie Le Pacha,ChIJB32gWFpV4UcRp3Ky1AdLB6Y,"Restaurant De Kebab Doner, Café, Restaurant","2 Bd De L'europe, Vernouillet",1
Puiseux,Og Traiteur,ChIJ5yDAWnoH5EcR8mk8lotIE4Q,"Traiteur, Bar, Magasin De Bière, Restauration, Restaurant Français","47 Rue Du Dr Taugourdeau, Tremblay-les-Villages",0
Puiseux,Le Relais De Treon,ChIJE0QwK1H-40cRcb3hW6PtgZw,"Restaurant, Restaurant Français","20 Rue De Châteauneuf, Tréon",0
Puiseux,La Grangette,ChIJiaGd81n-40cROi2CAVZeFOI,"Restaurant Français, Bar","35 Gr Grande Rue, Tréon",0
Puiseux,Buffalo Grill Vernouillet,ChIJ5SEo01tV4UcRxp6qo_tHOJg,"Restaurant, Restaurant Américain, Bar Et Grill, Restaurant Barbecue, Restaurant Familial, Restaurant De Hamburgers, Restaurant À Emporter, Steak House","44 Rte De Chartres, Vernouillet",0
Puiseux,Mcdonald's,ChIJQ9YsU2BV4UcRc5O_Rei1_tQ,"Restaurant De Restauration Rapide, Restaurant Américain, Restaurant De Hamburgers, Restaurant De Pizzas, Restaurant, Sandwicherie","42, Bis Rte De Chartres, Vernouillet",0
Puiseux,Bonheur Sushi,ChIJ06fhYFpV4UcR9hoyq4UvxG8,"Restaurant De Sushis, Restaurant Japonais","30 Rue Du Pressoir, Vernouillet",NA
Puiseux,Etoile D'or,ChIJ9aP4nVpV4UcR1u0JPkyMDzo,"Restaurant Asiatique, Restaurant Chinois, Restaurant De Restauration Rapide, Restaurant De Wok","2 Bd De L'europe, Vernouillet",NA
Puiseux,Nagoya,ChIJA2ZGnzRV4UcRY7GpY1oXHwo,Restaurant De Sushis,"15 Rue De Rome, Vernouillet",NA
Puiseux,Jardin Du Punjab,ChIJ45RvLaRV4UcRGiud7ntsOxM,Restaurant Indien,"4 Av. Marc Chappey, Vernouillet",NA
Puiseux,Saveurs De Siam 28,ChIJ58sLUjRV4UcRlWC_HZslI50,"Restaurant À Emporter, Restaurant De Fusion Asiatique, Restaurant Panasiatique, Restaurant Thaïlandais","Stand 18 Dans Le Marché Couvert, Dreux",NA
Réclainville,Launay Traiteur,ChIJ23v3gg1p5EcRn7hm6C16hVQ,"Traiteur, Magasin De Bière, Pâtisserie, Restaurant Français, Restaurant Sans Gluten, Restaurant Halal, Pâtisserie, Restaurant Végétalien, Restaurant Végétarien","1 Bis Rue Du Dr Rabourdin, Les Villages Vovéens",1
Réclainville,Restaurant Méditerranée,ChIJk4U6dSlp5EcRrBf4W44hbso,"Restaurant, Kebab, Restaurant De Pizzas, Pizza À Emporter, Sandwicherie","16 Rue Du Voisin, Les Villages Vovéens",1
Réclainville,Mb Chef,ChIJhVXJd-Q_5EcRxJJqs_HvArQ,"Kebab, Restaurant De Hamburgers, Restaurant De Pizzas","6 Rue De La Résistance, Auneau-Bleury-Saint-Symphorien",1
Réclainville,24k - Kebab Auneau,ChIJvxvx4LY_5EcROJ6PRI8q7RM,"Restaurant, Kebab","6 Rue De La Résistance, Auneau-Bleury-Saint-Symphorien",1
Réclainville,Pacha Kebab,ChIJO19m7pw-5EcRBgdfKKs_A4E,"Restaurant Turc, Restaurant De Restauration Rapide, Kebab","43 Pl. Du Marché, Auneau-Bleury-Saint-Symphorien",1
Réclainville,La Table Gourmande,ChIJ82SyMABB5EcRRYVIU0DikJc,Restaurant Français,"2 Rue De La Bezegue, Ouarville",0
Réclainville,Relais De Beauce,ChIJ-8PgclBC5EcRd-oIznnbdf4,"Restaurant, Bar, Restaurant Français","Lieu Dit La Michellerie, Ymonville",0
Réclainville,Jerome Briand Traiteurs,ChIJEzdK5-E55EcRWRHaLdB0ODU,"Traiteur, Restaurant Français, Restaurant Du Déjeuner, Pâtisserie, Restaurant De Tapas","4b Grande Rue, Maisons",0
Réclainville,Burger King,ChIJtUllJ71F5EcRWra4nUl_y1A,"Restaurant De Restauration Rapide, Restaurant Américain, Bar Et Grill, Restaurant Familial, Restaurant De Hamburgers, Restaurant À Emporter","Aire Des Plaines De Beauce, Fresnay-l'Évêque",0
Réclainville,Arche Restaurant,ChIJdR6v0LxF5EcRcEtgexUQuDg,Restaurant Français,"Aire De Repos De Francheville, Fresnay-l'Évêque",0
Réclainville,Restaurant Asiatique,ChIJf8wd3Jw-5EcRnSTTIpP3AOw,Restaurant Asiatique,"34 Pl. Du Marché, Auneau-Bleury-Saint-Symphorien",NA
Réclainville,Traiteur Asiatique,ChIJwaqkEY5L5EcR9Wi7M9x9FQ0,Restaurant Asiatique,"63 Rue Nationale, Angerville",NA
Réclainville,Paradis D'asie,ChIJdypJXiQS5EcRIFFiUKRR2ZM,"Restaurant Asiatique, Restaurant Chinois, Restaurant Mandarin","4 Rue Du Bois Paris, Nogent-le-Phaye",NA
Réclainville,Restaurant Asiatique,ChIJR_Y1bqcN5EcRlgGUOxPcDLo,Restaurant Asiatique,"Av. D'orléans, Le Coudray",NA
Réclainville,Festin D'asie,ChIJr1X55gkN5EcRdQNVq3fYxSs,"Restaurant Asiatique, Restaurant Chinois, Restaurant De Sushis","3 Rue De La Maladrerie, Le Coudray",NA
Les Ressuintes,Em Kebab,ChIJISJ4EC7n40cRkVJq_qEJ6n4,Restaurant Turc,"23 Rue Louis Peuret Ter, Senonches",1
Les Ressuintes,Istanbul Kebab,ChIJR96G6l_N40cR1RqIpG3BlCg,Restaurant,"3 Rue Place De La Ville, Longny les Villages",1
Les Ressuintes,Ozkaya Duran,ChIJMyBjSfjB40cRHseAvVFDLhs,"Kebab, Restaurant De Restauration Rapide, Restaurant De Pizzas","8 Pl. De L'hôtel De Ville, La Loupe",1
Les Ressuintes,Ada Délices,ChIJrbqEAPnB40cRD_sfeGQH6PM,"Kebab, Restaurant De Restauration Rapide","3 Rue Du Château, La Loupe",1
Les Ressuintes,Sofoodpizza,ChIJc1-01r9j4UcR6_TE03D1QmI,"Restaurant De Restauration Rapide, Kebab","31 Rue Prte De Mortagne, Verneuil d'Avre et d'Iton",1
Les Ressuintes,Leonardo Manuel,ChIJ75wrXLTb40cRZl5DAoTpvJw,"Brasserie, Bar","26 Rue De Laborde, La Ferté-Vidame",0
Les Ressuintes,Hôtel La Forêt,ChIJwcVx2vvn40cRf4DUhySIO8k,"Hôtel, Restaurant Français","22 Rue De Verdun, Senonches",0
Les Ressuintes,Restaurant Chez Sophie,ChIJDzk5Wfnn40cRsQnYJKr3IzE,"Restaurant, Restaurant Français","19 Rue Aristide Briand, Senonches",0
Les Ressuintes,Le _ Grand Claireau,ChIJyQiB8FXn40cRfPeP62mVYIQ,"Restaurant, Bar, Restaurant Français","2 Rte Des Hauts Étangs, La Saucelle",0
Les Ressuintes,"Auberge Du Moulin À Vent, The Originals Relais",ChIJm-UQ_OTC40cRUZr46vbyBBk,"Restaurant Français, Bar, Hôtel","23 Chem. Du Moulin À Vent, Manou",0
Les Ressuintes,Royal Verneuil,ChIJQQGFGiNi4UcRfQdsQrNfYew,"Restaurant, Restaurant Asiatique, Bar, Restaurant Chinois, Restaurant Japonais","514 Rue Aristide Briand, Verneuil d'Avre et d'Iton",NA
Les Ressuintes,Pullay,ChIJNb9xZQBl4UcRX3PRtkGpshg,Restaurant Coréen,"175 Rue Neuve De Bémécourt, Breteuil",NA
Les Ressuintes,Lucky Grill / Restaurant Asiatique Buffet À Volonté,ChIJnR6-WqWB4UcRz5Pf2CkqDJE,"Restaurant Asiatique, Bar, Restaurant De Wok","Zone Artisanale, Saint-Sulpice-sur-Risle",NA
Les Ressuintes,Traiteur Asiatique Nonancourt,ChIJw_M4PBdZ4UcRuQRmUKhq5W4,"Traiteur, Restaurant Chinois","34 Pl. Aristide Briand, Nonancourt",NA
Les Ressuintes,Sakura,ChIJvQiaQQCB4UcRTejsuN0Zs4c,Restaurant Japonais,"4 Bd Vaugeois, L'Aigle",NA
Revercourt,Casa Blanca,ChIJty8DGsVZ4UcRvwjTN0Olvm4,"Restaurant, Magasin De Bière, Restaurant Halal, Restaurant D'aliments Sains, Restaurant Du Déjeuner, Restaurant Marocain, Restaurant De Fruits De Mer, Restaurant Végétarien","22 Pl. Aristide Briand, Nonancourt",1
Revercourt,Le Coin Des Saveurs Pizzeria / Kebab / Sandwicherie Et Specialites Marocaines,ChIJDciHJ91Z4UcRRyS5FuZJRf0,"Restaurant De Pizzas, Restaurant De Restauration Rapide, Kebab, Restaurant Marocain","3 Rue Gambetta, Nonancourt",1
Revercourt,"O’regal , Kebab,Tacos,Burger,Panini",ChIJtZEixPxZ4UcRQTsj1YELDpE,Kebab,"3 Rue Gambetta, Nonancourt",1
Revercourt,Verneuil Kebab,ChIJr1fs_pRj4UcR0UN1KEcM3a0,Restaurant Turc,"11 Rue Aristide Briand, Verneuil d'Avre et d'Iton",1
Revercourt,Punjab Food,ChIJpQANCiFj4UcRSDbUWRmxT50,"Restaurant De Kebab Doner, Restaurant","45 Pl. De La Madeleine, Verneuil d'Avre et d'Iton",1
Revercourt,Resto Broc,ChIJM6dMUexe4UcR-Lp0XZ3ANME,"Restaurant, Gril, Restaurant Français, Restaurant De Pizzas","17 Rte De Paris, Acon",0
Revercourt,Le Relais De Dampierre,ChIJs67EDhpZ4UcRJRAlFEBCEfY,"Restaurant Français, Bar, Restaurant De Petit-Déjeuner","15 Route Nationale, Dampierre-sur-Avre",0
Revercourt,Restaurant Le Grand Cerf,ChIJxfzStcJZ4UcRvNHDsBQZM_M,"Restaurant, Brasserie","17 Grande Rue, Nonancourt",0
Revercourt,Le Relais Du Vieux Château,ChIJx3UHvN5Z4UcR76SwKFDkvS4,Restaurant Français,"39 Rue Victor Hugo, Nonancourt",0
Revercourt,Le _ Grand Claireau,ChIJyQiB8FXn40cRfPeP62mVYIQ,"Restaurant, Bar, Restaurant Français","2 Rte Des Hauts Étangs, La Saucelle",0
Revercourt,Traiteur Asiatique Nonancourt,ChIJw_M4PBdZ4UcRuQRmUKhq5W4,"Traiteur, Restaurant Chinois","34 Pl. Aristide Briand, Nonancourt",NA
Revercourt,Royal Verneuil,ChIJQQGFGiNi4UcRfQdsQrNfYew,"Restaurant, Restaurant Asiatique, Bar, Restaurant Chinois, Restaurant Japonais","514 Rue Aristide Briand, Verneuil d'Avre et d'Iton",NA
Revercourt,Restaurant Chez Laulau,ChIJsSDdLwBd4UcRbw0JLOxbMv0,Restaurant Japonais,"1 Rue De Verdun, Mesnils-sur-Iton",NA
Revercourt,Halmoni [Choi & Choi],ChIJw4GRomZd4UcRnj7nASgvHsg,"Restaurant Coréen, Bar Karaoké","12 Rue De Verdun, Mesnils-sur-Iton",NA
Revercourt,프랑스 한식당(육개장),ChIJWequLwBd4UcRUM29rQ6r38I,Restaurant Coréen,"France, Mesnils-sur-Iton",NA
Rohaire,Sofoodpizza,ChIJc1-01r9j4UcR6_TE03D1QmI,"Restaurant De Restauration Rapide, Kebab","31 Rue Prte De Mortagne, Verneuil d'Avre et d'Iton",1
Rohaire,Verneuil Kebab,ChIJr1fs_pRj4UcR0UN1KEcM3a0,Restaurant Turc,"11 Rue Aristide Briand, Verneuil d'Avre et d'Iton",1
Rohaire,Punjab Food,ChIJpQANCiFj4UcRSDbUWRmxT50,"Restaurant De Kebab Doner, Restaurant","45 Pl. De La Madeleine, Verneuil d'Avre et d'Iton",1
Rohaire,Presto Snack Pizza,ChIJpYrfpj5i4UcRHcKS9Kp1UI4,"Restaurant De Pizzas, Restaurant Halal, Kebab","27 Pl. De La Madeleine, Verneuil d'Avre et d'Iton",1
Rohaire,Jedo,ChIJVefi0XZl4UcRb3fyEc6OcII,Restaurant Libanais,"345 Rue Du Haut Du Mur, Sainte-Marie-d'Attez",1
Rohaire,Le Relais Paris Bretagne,ChIJA3H4lSTX40cRxHaw2UGq-M4,"Bistro, Boulangerie, Magasin De Bière, Restaurant Français, Restaurant De Hamburgers, Glacier, Pâtisserie, Pizza À Emporter, Bar À Vin","50-21 Eglise D'armentières, Armentières-sur-Avre",0
Rohaire,Le Clos Du Perche,ChIJZe8SWUXY40cRLHJatMjlH10,"Restaurant, Magasin De Bière, Restaurant Français, Restaurant Du Déjeuner, Restaurant Traditionnel, Bar À Vin","2 Rue Pierre Lefébure, Boissy-lès-Perche",0
Rohaire,Leonardo Manuel,ChIJ75wrXLTb40cRZl5DAoTpvJw,"Brasserie, Bar","26 Rue De Laborde, La Ferté-Vidame",0
Rohaire,L'ardoise Normande,ChIJ0cCPpYZj4UcR1thLquNPOHs,"Restaurant, Café, Brasserie","Rn 12 Rte Nationale 12 Le Paradis, Verneuil d'Avre et d'Iton",0
Rohaire,Auberge Des Bons Enfants,ChIJ26bygah94UcRDfjOMjh4KK0,"Restaurant Français, Bar","7 Rte De Paris, Bourth",0
Rohaire,Royal Verneuil,ChIJQQGFGiNi4UcRfQdsQrNfYew,"Restaurant, Restaurant Asiatique, Bar, Restaurant Chinois, Restaurant Japonais","514 Rue Aristide Briand, Verneuil d'Avre et d'Iton",NA
Rohaire,Lucky Grill / Restaurant Asiatique Buffet À Volonté,ChIJnR6-WqWB4UcRz5Pf2CkqDJE,"Restaurant Asiatique, Bar, Restaurant De Wok","Zone Artisanale, Saint-Sulpice-sur-Risle",NA
Rohaire,Sakura,ChIJvQiaQQCB4UcRTejsuN0Zs4c,Restaurant Japonais,"4 Bd Vaugeois, L'Aigle",NA
Rohaire,Wok N' Roll Gyoza,ChIJwV9G1d2B4UcRYx1WJ-OUPnE,"Restaurant De Restauration Rapide, Plats Chinois À Emporter","48 Rue Barthelemy, Rue Barthelemy, L'Aigle",NA
Rohaire,Royal D’asie,ChIJVRfDuRuB4UcRhYkUOlwKh10,"Restaurant, Restaurant Chinois, Restaurant Chinois De Livraison","9-11 Rue Romain Darchy, L'Aigle",NA
Roinville,Mb Chef,ChIJhVXJd-Q_5EcRxJJqs_HvArQ,"Kebab, Restaurant De Hamburgers, Restaurant De Pizzas","6 Rue De La Résistance, Auneau-Bleury-Saint-Symphorien",1
Roinville,24k - Kebab Auneau,ChIJvxvx4LY_5EcROJ6PRI8q7RM,"Restaurant, Kebab","6 Rue De La Résistance, Auneau-Bleury-Saint-Symphorien",1
Roinville,Pacha Kebab,ChIJO19m7pw-5EcRBgdfKKs_A4E,"Restaurant Turc, Restaurant De Restauration Rapide, Kebab","43 Pl. Du Marché, Auneau-Bleury-Saint-Symphorien",1
Roinville,Fast Pizza Kebab,ChIJkcXAIZ0-5EcRV9IjdEBZ7h4,"Restaurant, Restaurant, Restaurant De Restauration Rapide, Restaurant De Pizzas, Pizza À Emporter","15 Rue Marceau, Auneau-Bleury-Saint-Symphorien",1
Roinville,Welcome Pizzeria Gallardon,ChIJX7I4zaIX5EcR9Y2LFxRgcMc,"Pizza À Emporter, Restaurant De Restauration Rapide, Restaurant Turc","3 Rue De La Prte De Chartres, Gallardon",1
Roinville,L'artculinairedemaeva,ChIJo2lWRRU_5EcRmkThknb5AHc,"Restaurant À Emporter, Restaurant Français Moderne","29 Rue Des Floralies, Auneau-Bleury-Saint-Symphorien",0
Roinville,Cosy Tea,ChIJRXPXxMA_5EcRCnGCZkhzRNI,"Crêperie, Café, Restaurant De Restauration Rapide, Pâtisserie, Restaurant, Salon De Thé","17 Rue Pasteur, Auneau-Bleury-Saint-Symphorien",0
Roinville,Le Bouche À Oreilles,ChIJ3xY-1jM85EcRqEgnz-_WaVQ,"Restaurant, Restaurant Français","4 Rue Hellé Nice, Auneau-Bleury-Saint-Symphorien",0
Roinville,Le Relais Des Essarts,ChIJx-Wn_Kk95EcRQQs7xN2uY-k,"Restaurant, Restaurant Français, Restaurant Traditionnel","Rue De La Liberté, Auneau-Bleury-Saint-Symphorien",0
Roinville,Jerome Briand Traiteurs,ChIJEzdK5-E55EcRWRHaLdB0ODU,"Traiteur, Restaurant Français, Restaurant Du Déjeuner, Pâtisserie, Restaurant De Tapas","4b Grande Rue, Maisons",0
Roinville,Restaurant Asiatique,ChIJf8wd3Jw-5EcRnSTTIpP3AOw,Restaurant Asiatique,"34 Pl. Du Marché, Auneau-Bleury-Saint-Symphorien",NA
Roinville,Sushis Thai,ChIJRd-NqSYX5EcR3FyWagMIsXI,Restaurant Asiatique,"18 Pl. De L'église, Gallardon",NA
Roinville,Paradis D'asie,ChIJdypJXiQS5EcRIFFiUKRR2ZM,"Restaurant Asiatique, Restaurant Chinois, Restaurant Mandarin","4 Rue Du Bois Paris, Nogent-le-Phaye",NA
Roinville,Sushi Daily Chartres,ChIJ38o0XzkN5EcRSYThfuDVbJU,Sushis À Emporter,"Av. Marcel Proust, Chartres",NA
Roinville,Grill 168,ChIJE13qCgIZ5EcRVbfh1tA8U0M,"Restaurant Asiatique, Restaurant Chinois, Restaurant Japonais, Restaurant De Sushis","200 Av. De L'europe, Épernon",NA
Rouvray-Saint-Denis,Au Bon Fourneau,ChIJ8ZoiEY5L5EcRT32R7j21JoI,"Restaurant Turc, Restaurant De Restauration Rapide, Kebab, Restaurant De Pizzas","2 Rue Des Dames De Saint-Cyr, Angerville",1
Rouvray-Saint-Denis,Le Royal Kebab,ChIJPcvwGY5L5EcRJwmb6WrEO3M,"Restaurant De Pizzas, Restaurant De Restauration Rapide, Kebab, Restaurant","53 Rue Nationale Bât A, Angerville",1
Rouvray-Saint-Denis,Restaurant Istanbul Kebab Angerville,ChIJk6SHmQFL5EcR8NwD0tAmN7Q,"Restaurant Turc, Restaurant De Hamburgers, Pizza À Emporter, Restaurant De Tacos","3 Ter Rue De L'église, Angerville",1
Rouvray-Saint-Denis,Allo Presto Pizza,ChIJwf9yVrxR5EcR4WYEBoAIPeo,"Restaurant De Restauration Rapide, Kebab, Restaurant De Pizzas, Restaurant, Sandwicherie","79 Rue Nationale, Toury",1
Rouvray-Saint-Denis,Kebab Grille Janville,ChIJlQm6zHNQ5EcRAeJmZgMAUNo,"Kebab, Gril, Restaurant De Pizzas, Restaurant De Tacos","5 Pl. Du Martroi, Janville-en-Beauce",1
Rouvray-Saint-Denis,La Panetiere,ChIJ6yOYW9RN5EcRcUPoJPwY-mk,"Restaurant Français, Restaurant Gastronomique","13, Barmainville",0
Rouvray-Saint-Denis,Hôtel De France,ChIJBZeiwpFL5EcR93N51UTkGtM,"Restaurant, Traiteur, Lieu De L'événement, Restaurant Français, Hôtel, Spa, Spa Et Club De Santé, Centre De Bien-Être","2 Pl. Du Marché, Angerville",0
Rouvray-Saint-Denis,Restaurant De L'hôtel De France,ChIJc2996JFL5EcRl-w0IXbhzYg,"Restaurant Français, Restaurant Gastronomique","2 Pl. Du Marché, Angerville",0
Rouvray-Saint-Denis,Restaurant L'angervillois,ChIJ25itjZFL5EcRF-D6NCusTBg,"Restaurant, Restaurant Français","17 Rue De Dourdan, Angerville",0
Rouvray-Saint-Denis,Mcdonald's,ChIJ7736_JZL5EcR690tuymbuaA,"Restaurant De Restauration Rapide, Restaurant Américain, Restaurant De Hamburgers, Restaurant De Pizzas, Restaurant, Sandwicherie","16 Rue Du Pont Lafleur, Angerville",0
Rouvray-Saint-Denis,Traiteur Asiatique,ChIJwaqkEY5L5EcR9Wi7M9x9FQ0,Restaurant Asiatique,"63 Rue Nationale, Angerville",NA
Rouvray-Saint-Denis,Phuket Factory Évry,ChIJs99RxgTL5UcRpAIyFd0sPCY,Restaurant Thaïlandais,"Av. Geoffroy Saint-Hilaire, Étampes",NA
Rouvray-Saint-Denis,Asian Food,ChIJgV7879jL5UcRYRnb8iGbpvc,Restaurant Japonais,"24 Pl. Saint-Gilles, Étampes",NA
Rouvray-Saint-Denis,Sushi Daily Etampes,ChIJP2jyasnJ5UcRZVAXY1p2YeQ,Sushis À Emporter,"Carrefour Etampes, Étampes",NA
Rouvray-Saint-Denis,Le Kashmir Etampes,ChIJ28IR4tjL5UcRfMgmOKY4x8o,"Restaurant Indien, Restaurant Pakistanais","2 Pl. Saint-Gilles, Étampes",NA
Rouvres,Andiamo _ Pizza,ChIJIXluw5ut5kcRbwt3N1KfRm8,"Restaurant De Pizzas, Restaurant De Restauration Rapide, Friterie, Restaurant Halal, Restaurant De Hamburgers, Kebab, Livraison De Pizzas, Pizza À Emporter, Sandwicherie, Restaurant De Tacos","28 Rue Diane De Poitiers, Anet",1
Rouvres,Bu Restaurant Artemis Kebab Tacos Burger,ChIJ5yCHFf6v5kcRegrKzaIKiwo,Kebab,"23 Rue Des Francs Bourgeois, Bû",1
Rouvres,Aux Délices De Saussay - Spécialités Turques,ChIJMd3-6nCt5kcR2UrgaCAN3eU,"Restaurant Turc, Restaurant De Restauration Rapide","17 Rue D'anet, Saussay",1
Rouvres,Zazaki,ChIJ5RRGmm-t5kcRW0kyH-ALzjw,"Restaurant, Restaurant De Kebab Doner, Restaurant De Restauration Rapide, Livraison De Pizzas, Restaurant De Pizzas","15 Rue D'anet, Saussay",1
Rouvres,Amanos Kebab Grill,ChIJnQn-Vi6t5kcRXD--W1WCosE,"Kebab, Restaurant Barbecue","33 Rue Isambard, Ézy-sur-Eure",1
Rouvres,Mcdonald's,ChIJSwN-0_Ot5kcR3P8eLZ_X2ZU,"Restaurant De Restauration Rapide, Restaurant Américain, Restaurant De Hamburgers, Restaurant De Pizzas, Restaurant, Sandwicherie","Parking E.leclerc, Anet",0
Rouvres,La Guinguette D'oulins,ChIJV8e-Gfet5kcRDPAL_N0-0T8,"Restaurant Français, Gril, Bar, Brasserie, Restaurant De Restauration Rapide, Restaurant","Rte De Mantes, Oulins",0
Rouvres,Café Du Chateau,ChIJFRUylJut5kcRDFh_am4pmJI,"Brasserie, Bar, Brasserie","9 Rue Diane De Poitiers, Anet",0
Rouvres,Le Manoir D'anet,ChIJv77Uo5ut5kcRiU9whUvEPZc,"Restaurant, Restaurant Français","3 Pl. Du Château, Anet",0
Rouvres,Chez Ginette 1931,ChIJj_uAdACv5kcRHUSxPdNEFAg,"Restaurant Français, Restaurant","5 Pl. De L'église, Berchères-sur-Vesgre",0
Rouvres,Les Etoiles De Chine,ChIJcZhD-HCt5kcRzMDrsH7i64o,"Restaurant, Restaurant Chinois","D'anet, Saussay",NA
Rouvres,Tuk Tuk Thai Food,ChIJDWPjkZWt5kcRFkCNq5gUvnI,Restaurant Thaïlandais,"45 Rue Isambard, Ézy-sur-Eure",NA
Rouvres,Fuji Houdan,ChIJla0U1Cyl5kcRTWoqwTEVCIM,"Restaurant Asiatique, Restaurant Japonais Authentique, Restaurant","France, Houdan",NA
Rouvres,Jardin Du Kashmir,ChIJWZiPLNSl5kcRz85iEJBH8do,"Restaurant Indien, Restaurant","2 Rue Des Vieilles Tanneries, Houdan",NA
Rouvres,Sushi&Cie,ChIJvQ-rotWl5kcRKtH-HSSDGN8,"Restaurant Japonais, Restaurant De Sushis","62 Grande Rue, Houdan",NA
Rueil-la-Gadelière,Verneuil Kebab,ChIJr1fs_pRj4UcR0UN1KEcM3a0,Restaurant Turc,"11 Rue Aristide Briand, Verneuil d'Avre et d'Iton",1
Rueil-la-Gadelière,Punjab Food,ChIJpQANCiFj4UcRSDbUWRmxT50,"Restaurant De Kebab Doner, Restaurant","45 Pl. De La Madeleine, Verneuil d'Avre et d'Iton",1
Rueil-la-Gadelière,Presto Snack Pizza,ChIJpYrfpj5i4UcRHcKS9Kp1UI4,"Restaurant De Pizzas, Restaurant Halal, Kebab","27 Pl. De La Madeleine, Verneuil d'Avre et d'Iton",1
Rueil-la-Gadelière,Sofoodpizza,ChIJc1-01r9j4UcR6_TE03D1QmI,"Restaurant De Restauration Rapide, Kebab","31 Rue Prte De Mortagne, Verneuil d'Avre et d'Iton",1
Rueil-la-Gadelière,Jedo,ChIJVefi0XZl4UcRb3fyEc6OcII,Restaurant Libanais,"345 Rue Du Haut Du Mur, Sainte-Marie-d'Attez",1
Rueil-la-Gadelière,Le Collectionneur Gourmand,ChIJxc8t_jxi4UcR3xbdViIg0mo,Restaurant Français,"1 Rue Gustave Roger, Verneuil d'Avre et d'Iton",0
Rueil-la-Gadelière,Crêperie Le Louisiane,ChIJRQNXyz1i4UcRAbYNYOazSR4,"Restaurant, Crêperie, Magasin De Salades","26 Rue Du Nouveau Monde, Verneuil d'Avre et d'Iton",0
Rueil-la-Gadelière,L'ardoise Normande,ChIJ0cCPpYZj4UcR1thLquNPOHs,"Restaurant, Café, Brasserie","Rn 12 Rte Nationale 12 Le Paradis, Verneuil d'Avre et d'Iton",0
Rueil-la-Gadelière,Café De La Place,ChIJUyfxmT5i4UcRglr5IkYQqLk,"Brasserie, Brasserie","112 Pl. De La Madeleine, Verneuil d'Avre et d'Iton",0
Rueil-la-Gadelière,Burger And Co,ChIJ_YuF7z5i4UcR7eQC0DaLLd4,"Restaurant De Restauration Rapide, Restaurant Américain, Restaurant De Hamburgers, Restaurant","92 Rue Thiers, Verneuil d'Avre et d'Iton",0
Rueil-la-Gadelière,Royal Verneuil,ChIJQQGFGiNi4UcRfQdsQrNfYew,"Restaurant, Restaurant Asiatique, Bar, Restaurant Chinois, Restaurant Japonais","514 Rue Aristide Briand, Verneuil d'Avre et d'Iton",NA
Rueil-la-Gadelière,Pullay,ChIJNb9xZQBl4UcRX3PRtkGpshg,Restaurant Coréen,"175 Rue Neuve De Bémécourt, Breteuil",NA
Rueil-la-Gadelière,Traiteur Asiatique Nonancourt,ChIJw_M4PBdZ4UcRuQRmUKhq5W4,"Traiteur, Restaurant Chinois","34 Pl. Aristide Briand, Nonancourt",NA
Rueil-la-Gadelière,Restaurant Chez Laulau,ChIJsSDdLwBd4UcRbw0JLOxbMv0,Restaurant Japonais,"1 Rue De Verdun, Mesnils-sur-Iton",NA
Rueil-la-Gadelière,Halmoni [Choi & Choi],ChIJw4GRomZd4UcRnj7nASgvHsg,"Restaurant Coréen, Bar Karaoké","12 Rue De Verdun, Mesnils-sur-Iton",NA
Saint-Ange-et-Torçay,La Fabrique À Sushi,ChIJrwdKKWhV4UcR0KZujUc3-iQ,"Restaurant De Sushis, Restaurant Halal, Restaurant De Fondue Chinoise, Restaurant Japonais, Restaurant De Livraison, Restaurant De Wok","1 Av. Marc Chappey, Vernouillet",1
Saint-Ange-et-Torçay,Restaurant Broch'et ( Brochette ),ChIJnQxBLuFV4UcRzgoFeZ_bYAE,Restaurant Turc,"1 Av. Marc Chappey, Vernouillet",1
Saint-Ange-et-Torçay,Beautiful Pizzeria Fast Food,ChIJ_RUgVplV4UcRyl0aJjqJhiI,"Restaurant, Buffet De Douceurs Et De Desserts, Restaurant De Restauration Rapide, Restaurant De Hamburgers, Restaurant De Pizzas, Sandwicherie, Restaurant De Tacos","Centre Commercial, Vernouillet",1
Saint-Ange-et-Torçay,Crazy Poulet,ChIJHXToD25V4UcRxJRsW5Pbz30,"Restaurant D'ailes De Poulet, Restaurant Halal, Restaurant","2 Rue Louis Fauvel, Vernouillet",1
Saint-Ange-et-Torçay,Marocain Délice Chef Domicile,ChIJdyYMreFV4UcRH8Pw84fPuU0,Restaurant Halal,"Rue Léon Blum, Vernouillet",1
Saint-Ange-et-Torçay,Dm Prince Gourmand,ChIJ7YUGy6D740cRUwnVEQ_e_Uc,"Boulangerie, Restaurant Français, Restaurant D'aliments Sains, Restaurant Du Déjeuner, Sandwicherie","30 Lieu Dit, Châteauneuf-en-Thymerais",0
Saint-Ange-et-Torçay,Le Colvert,ChIJFWyXxvf640cR79-LqdqQFpM,"Brasserie, Bar, Café","17 Rue Jean Moulin, Châteauneuf-en-Thymerais",0
Saint-Ange-et-Torçay,Le Relais D'aligre,ChIJb0Vkxff640cRgHXb5WhemjM,"Hôtel, Chambres D'hôtes, Restaurant Français","25 Rue Jean Moulin, Châteauneuf-en-Thymerais",0
Saint-Ange-et-Torçay,"Creperie, Les Galettes De Poulette",ChIJXRNxKgD740cRcRN3MR7G_FQ,Crêperie,"1 Av. Langlois, Châteauneuf-en-Thymerais",0
Saint-Ange-et-Torçay,La Grangette,ChIJiaGd81n-40cROi2CAVZeFOI,"Restaurant Français, Bar","35 Gr Grande Rue, Tréon",0
Saint-Ange-et-Torçay,Jardin Du Punjab,ChIJ45RvLaRV4UcRGiud7ntsOxM,Restaurant Indien,"4 Av. Marc Chappey, Vernouillet",NA
Saint-Ange-et-Torçay,Etoile D'or,ChIJ9aP4nVpV4UcR1u0JPkyMDzo,"Restaurant Asiatique, Restaurant Chinois, Restaurant De Restauration Rapide, Restaurant De Wok","2 Bd De L'europe, Vernouillet",NA
Saint-Ange-et-Torçay,Bonheur Sushi,ChIJ06fhYFpV4UcR9hoyq4UvxG8,"Restaurant De Sushis, Restaurant Japonais","30 Rue Du Pressoir, Vernouillet",NA
Saint-Ange-et-Torçay,Nagoya,ChIJA2ZGnzRV4UcRY7GpY1oXHwo,Restaurant De Sushis,"15 Rue De Rome, Vernouillet",NA
Saint-Ange-et-Torçay,Restaurant L'himalaya,ChIJtQOVkz1V4UcREKDaEGZQrIQ,"Restaurant Pakistanais, Restaurant Indien","35 Rue Du Bois Sabot, Dreux",NA
Saint-Arnoult-des-Bois,Pizza Service,ChIJpZ2XUnjz40cR03HACdNC_QI,"Restaurant De Pizzas, Restaurant De Restauration Rapide, Restaurant Halal, Restaurant De Hamburgers, Kebab, Restaurant À Emporter, Livraison De Pizzas, Pizza À Emporter, Sandwicherie, Restaurant De Tacos","5 Rue De La Madeleine, Courville-sur-Eure",1
