respondent.commune,business_name,place_id,fr_categories,business_address,treatment_arm
29077,Le Phnom Penh,ChIJIzuo3JSrFkgRvu-IsseZwp4,"Restaurant Chinois, Restaurant Asiatique, Restaurant Cambodgien, Restaurant D'asie Du Sud-Est, Restaurant Thaïlandais","21 Rue Du Saint-Esprit, Lesneven",2
29077,Soi 95,ChIJV1mWDfyrFkgRwBBDyYpGxF8,Restaurant Thaïlandais,"95 Rue De La Marne, Lesneven",2
29077,Food Truck Sushi Nomade,ChIJldt-AEugFkgRv_E92HD2Kto,Restaurant De Sushis,"251 Prad Al Lann, Landéda",2
29077,Thai Avel Traiteur,ChIJ07p9VQC9FkgRi0LD9etbCjM,Restaurant Thaïlandais,"Beg Avel, Milizac-Guipronvel",2
29077,Pondicherry,ChIJK7V6w2mzFkgRRf9Z7BXiiIw,Restaurant Indien,"55 Rue De Brest, Landerneau",2
29078,Good Time,ChIJJzjpMNuyFkgRVOlNjuGzs2A,"Restaurant De Restauration Rapide, Restaurant Italien, Restaurant De Pizzas, Restaurant De Tacos","12 Rue Du Pont, Landerneau",1
29078,L'elorn Kebab,ChIJAcCJM9uyFkgR4d0j_Bss-cs,Restaurant,"9 Rue Du Pont, Landerneau",1
29078,Helline Kebab,ChIJ5Zos39yyFkgRRMAywrlsnt0,"Restaurant Turc, Restaurant De Restauration Rapide, Kebab","42 Quai De Léon, Landerneau",1
29078,Restaurant Kardelen,ChIJuapAqMSyFkgRhZ0bHJfaucY,"Restaurant Turc, Restaurant De Restauration Rapide, Kebab, Restaurant","14 Rue De La Font Blanche, Landerneau",1
29078,Kemer Kebab,ChIJK11N9hi3FkgRG7V-X9w1w58,Kebab,"3 Pl. Du Calvaire, Plougastel-Daoulas",1
29078,Brasserie Du Bout Du Monde,ChIJ6wEzrrTLFkgRXnbobwbahpo,"Brasserie, Bar, Magasin D'usine","Za De Quiella, Le Faou",0
29078,Saveurs Des Halles,ChIJPRuS8hA1EUgRbA5S7eEfc6M,"Restaurant Français, Bar","3 Pl. Des Fusillés Et Résistants, Le Faou",0
29078,Le Relais De La Place & Le Vintage,ChIJ-wEhZBA1EUgRyJliyDdQN-4,"Restaurant, Salle De Banquet, L'hôtel De Ville, Dîner, Salle Des Fêtes, Restaurant Français, Salon, Hôtel, Brasserie, Séminaire","7 Pl. Aux Foires, Le Faou",0
29078,Crêperie L'estran,ChIJieuizw81EUgRnA8iR3tWjWA,Crêperie,"9 Pl. Aux Foires, Le Faou",0
29078,Crêperie De La Mignonne,ChIJgRMTdv60FkgRfwZxSbZ0VlU,"Crêperie, Restaurant Français","2 Rue Du Valy, Daoulas",0
29078,Shish Mahal,ChIJS3euztyyFkgRveyPiXeK_Ug,Restaurant Indien,"8 Rue De Brest, Landerneau",2
29078,Restaurant Thailand'erne Landerneau,ChIJkRqKV8OyFkgRzMF-1vIV63w,"Restaurant Thaïlandais, Restaurant Asiatique, Restaurant Japonais, Restaurant De Sushis, Sushis À Emporter, Restaurant Végétarien","18 Rue De La Font Blanche, Landerneau",2
29078,Sarl Baan Thai & Sushi,ChIJV1eHV8OyFkgRj2zYdeE-f6c,"Restaurant De Sushis, Restaurant Japonais, Restaurant Thaïlandais","18 Rue De La Font Blanche, Landerneau",2
29078,Pondicherry,ChIJK7V6w2mzFkgRRf9Z7BXiiIw,Restaurant Indien,"55 Rue De Brest, Landerneau",2
29078,Sushi Manga Sensei,ChIJIw-vFF63FkgR3nOHXg4uUgA,Restaurant Asiatique,"7 Rue De L'église, Plougastel-Daoulas",2
29079,Kreisker Kebab,ChIJq6p-UobhE0gRpHZay2PEBH0,Restaurant,"1 Rue Cadiou, Saint-Pol-de-Léon",1
29079,Asya Kebab,ChIJF0DPxobhE0gRodq4cbn02Eo,"Kebab, Restaurant De Restauration Rapide","7 Pl. Alfred De Guébriant, Saint-Pol-de-Léon",1
29079,Oz Kebab,ChIJlWz-3IbhE0gROs1SsGf9k2Y,Restaurant,"7 Pl. Alfred De Guébriant, Saint-Pol-de-Léon",1
29079,Le Ty Kebab,ChIJr38mtgPjE0gROdqv9wzkAbc,Kebab,"Le Croissant, Plougoulm",1
29079,La Ruche Kebab Morlaix,ChIJcw7n1jJhEUgR9vRV0UKnPXQ,"Restaurant De Restauration Rapide, Kebab","30 Route De Paris, Morlaix",1
29079,Le Comptoir Des Johnnies,ChIJ_-aCpGZfEUgR2A-P5UfZ990,Restaurant Français,"Château De Kerlaudy, Plouénan",0
29079,Les Viviers De Carantec,ChIJmxyqKobhE0gRvjlqLsEeyTM,"Marché Aux Fruits De Mer, Poissonnerie, Restaurant Bar À Huîtres, Restaurant De Fruits De Mer","38 Chem. Du Varquez, Carantec",0
29079,Le Piazza,ChIJi5z8FjBeEUgR_uI1P7FYkq8,"Restaurant, Magasin De Bière, Pâtisserie, Bar À Cocktails, Restaurant Français, Restaurant De Hamburgers, Glacier, Pâtisserie, Bar À Vin","7 Pl. De La Mairie, Taulé",0
29079,Tal Ar Milin,ChIJu-wk4fVeEUgRO7D6pBCsklk,Restaurant Français,"15 Rte Nationale, Taulé",0
29079,Crêperie Restaurant Ty Brizec,ChIJA2opBRTgE0gRl2CxXsbSzHw,"Crêperie, Bar, Restaurant Français, Restaurant","5 Pl. De La Libération, Carantec",0
29079,Wok & Grill,ChIJ91bPtLZgEUgRXwlOYsqxiH4,"Restaurant Chinois, Restaurant De Sushis","Rue Goarem Pella, Saint-Martin-des-Champs",2
29079,Sim Sushi,ChIJn2xa3Y1nEUgRJapQCvQUex4,Restaurant Japonais,"Centre Commercial La Galerie Carrefour, Saint-Martin-des-Champs",2
29079,Indochine Specialites Asiatiques,ChIJLzMiri5hEUgRBtDOb0HP2XA,"Restaurant Vietnamien, Restaurant Asiatique, Restaurant Chinois, Restaurant, Restaurant Thaïlandais","31 Pl. Charles De Gaulle, Morlaix",2
29079,Le Rajasthan,ChIJCxbEJ5thEUgRWUD3nHPGqUc,Restaurant Indien,"24 Rue Ange De Guernisac, Morlaix",2
29079,Saigon,ChIJUZx3BcBhEUgRm_LMUQV0978,Restaurant Vietnamien,"4 Ven. Au Son, Morlaix",2
29080,Kemer Kebab,ChIJK11N9hi3FkgRG7V-X9w1w58,Kebab,"3 Pl. Du Calvaire, Plougastel-Daoulas",1
29080,So Good 29 ( Tacos . Sandwichs. Panini . Assiettes. Hamburgers ),ChIJbYQP0S23FkgRs61iW5169Qw,"Restaurant, Restaurant De Hamburgers, Kebab, Restaurant De Tacos","5 Rue De La Mairie, Plougastel-Daoulas",1
29080,Helline Kebab,ChIJ5Zos39yyFkgRRMAywrlsnt0,"Restaurant Turc, Restaurant De Restauration Rapide, Kebab","42 Quai De Léon, Landerneau",1
29080,Good Time,ChIJJzjpMNuyFkgRVOlNjuGzs2A,"Restaurant De Restauration Rapide, Restaurant Italien, Restaurant De Pizzas, Restaurant De Tacos","12 Rue Du Pont, Landerneau",1
29080,L'elorn Kebab,ChIJAcCJM9uyFkgR4d0j_Bss-cs,Restaurant,"9 Rue Du Pont, Landerneau",1
29080,Crêperie De La Mignonne,ChIJgRMTdv60FkgRfwZxSbZ0VlU,"Crêperie, Restaurant Français","2 Rue Du Valy, Daoulas",0
29080,Restaurant Le Valy,ChIJHyUxdv60FkgRhEYa7ciU9FI,Restaurant Français,"11 Rue Du Pont, Daoulas",0
29080,Crêperie Du Bas Du Bourg,ChIJi524kKPLFkgRTiGaI_BjCss,Crêperie,"5 Rue Saint-Guénolé, Landévennec",0
29080,Mau'billig,ChIJpQgEA0e1FkgRR3jaFm02QyU,"Restaurant, Crêperie, Traiteur Mobile","6 Rés Du Menhir, Logonna-Daoulas",0
29080,Creperie Goustadig,ChIJvy9qy1rKFkgRD5V024h1zxA,"Crêperie, Café, Restaurant Français, Salon De Thé","11 Rue De L'abbaye, Landévennec",0
29080,Sushi Manga Sensei,ChIJIw-vFF63FkgR3nOHXg4uUgA,Restaurant Asiatique,"7 Rue De L'église, Plougastel-Daoulas",2
29080,Shish Mahal,ChIJS3euztyyFkgRveyPiXeK_Ug,Restaurant Indien,"8 Rue De Brest, Landerneau",2
29080,Sarl Baan Thai & Sushi,ChIJV1eHV8OyFkgRj2zYdeE-f6c,"Restaurant De Sushis, Restaurant Japonais, Restaurant Thaïlandais","18 Rue De La Font Blanche, Landerneau",2
29080,Restaurant Thailand'erne Landerneau,ChIJkRqKV8OyFkgRzMF-1vIV63w,"Restaurant Thaïlandais, Restaurant Asiatique, Restaurant Japonais, Restaurant De Sushis, Sushis À Emporter, Restaurant Végétarien","18 Rue De La Font Blanche, Landerneau",2
29080,Pondicherry,ChIJK7V6w2mzFkgRRf9Z7BXiiIw,Restaurant Indien,"55 Rue De Brest, Landerneau",2
29081,La Brasserie Marocaine,ChIJiTTd3QgMEUgRlLESLbdW7qg,"Restaurant Marocain, Brasserie, Restaurant De Couscous, Restaurant De Hamburgers, Restaurant À Emporter, Bar À Vin","2 Pl. De La Mairie, Carhaix-Plouguer",1
29081,Bosphore Kebab,ChIJV6TjLvYLEUgRsKZWx6wAUiE,"Kebab, Restaurant Turc","31 Rue Des Martyrs, Carhaix-Plouguer",1
29081,Antalya Kebab,ChIJm09G8PYLEUgRVx-u-j85Ot0,"Restaurant Turc, Restaurant De Restauration Rapide, Kebab","22 Av. Du Général De Gaulle, Carhaix-Plouguer",1
29081,Dounia Kebab,ChIJJ7mrw_YLEUgRDN3NHg24ms0,"Kebab, Restaurant De Restauration Rapide","37 Av. Du Général De Gaulle, Carhaix-Plouguer",1
29081,Kebab Antalya,ChIJT_M1Ss5dEUgRlN4vCMEn37U,Restaurant Turc,"82 Rue De La République, Pleyber-Christ",1
29081,Hôtel Du Lac,ChIJq8HkJ5FsEUgRgzzj5ysAg8g,"Hôtel, Restaurant Français, Restaurant De Pizzas","9 Rue Du Général De Gaulle, Huelgoat",0
29081,Krampouez Breizh,ChIJw77rXJFsEUgR112dUyhzIFA,Crêperie,"21 Pl. Aristide Briand, Huelgoat",0
29081,Bar Crêperie La Grotte,ChIJ0R8rYZFsEUgRGP6W744ho0U,"Bar, Crêperie, Restaurant De Pizzas, Bureau De Tabac","25 Rue Des Cendres, Huelgoat",0
29081,Neal David Leslie,ChIJiU55RpFsEUgRPO2FCHnSQgg,Brasserie,"7 Pl. Aristide Briand, Huelgoat",0
29081,Le Miroir Aux Fées,ChIJRxg4a5FsEUgRUd4-DfymSEU,Crêperie,"12 Rue Du Lac, Huelgoat",0
29081,Karaez Thaï Food,ChIJnzoWIQkMEUgRgNvqGNPOP8I,Restaurant Thaïlandais,"8 Rue Brizeux, Carhaix-Plouguer",2
29081,Au Petit Viet Linh,ChIJbY_i9vYLEUgRnMZCHOTc_Lc,Restaurant Vietnamien,"16 Av. Du Général De Gaulle, Carhaix-Plouguer",2
29081,Matin Calme,ChIJPZfPsBMLEUgRFui6umpjwYU,Restaurant Coréen,"26 Av. Du Général De Gaulle, Carhaix-Plouguer",2
29081,Dragon D'asie,ChIJqa70q_ELEUgRTll_syhUVH0,"Restaurant, Restaurant Asiatique, Restaurant Chinois","24 Av. Victor Hugo, Carhaix-Plouguer",2
29081,Makly,ChIJY3Ui481nEUgRUO0yX5RD6TY,Plats Chinois À Emporter,"Prajen Vian, Plourin-lès-Morlaix",2
29082,Oz Kebab,ChIJlWz-3IbhE0gROs1SsGf9k2Y,Restaurant,"7 Pl. Alfred De Guébriant, Saint-Pol-de-Léon",1
29082,Asya Kebab,ChIJF0DPxobhE0gRodq4cbn02Eo,"Kebab, Restaurant De Restauration Rapide","7 Pl. Alfred De Guébriant, Saint-Pol-de-Léon",1
29082,Kreisker Kebab,ChIJq6p-UobhE0gRpHZay2PEBH0,Restaurant,"1 Rue Cadiou, Saint-Pol-de-Léon",1
29082,Le Ty Kebab,ChIJr38mtgPjE0gROdqv9wzkAbc,Kebab,"Le Croissant, Plougoulm",1
29082,Royal Kebab,ChIJ_Sxh3An-E0gR4Z5I_sPWXOg,"Kebab, Restaurant De Restauration Rapide","44 Rue Maréchal Foch, Plouescat",1
29082,"Restaurant-Crêperie ""Le Pab - Penn Ar Batz""",ChIJQxfI0xDkE0gRndZK8LsOKO4,"Restaurant, Bar, Crêperie, Pub","Bourg, Île-de-Batz",0
29082,Crêperie Du Phare,ChIJAQAAABfkE0gRgYCxfO3lAmw,"Crêperie, Restaurant Français, Restaurant À Emporter","29253 Île-De-Batz, Île-de-Batz",0
29082,La Moule Au Pot,ChIJ-QHFM1LhE0gR8FkQdVMiBX0,"Restaurant, Restaurant Français","13 Rue Edouard Corbière, Roscoff",0
29082,Bilig De La Plage,ChIJubtVROnhE0gRBnIngyyotEk,Crêperie,"14 Rue Victor Hugo, Roscoff",0
29082,"Valdys Resort Roscoff - Hôtel, Thalasso & Spa",ChIJU059x1bhE0gRJ9JIFFVolFE,"Hôtel De Villégiature, Centre De Remise En Forme, Restaurant Français, Plateforme D'observation, Spa, Hôtel Bien-Être","16 Rue Victor Hugo, Roscoff",0
29082,La Baie D'halong,ChIJXdtLPk7hE0gRJNWdN3xxaYA,"Restaurant Vietnamien, Restaurant Asiatique, Bar, Restaurant Chinois, Restaurant Thaïlandais","22 Rue Gambetta, Roscoff",2
29082,Rosko Sushi,ChIJQVHjEdfhE0gRuwZsfoura0U,Sushis À Emporter,"Zad Du Bloscon Bretalg, Roscoff",2
29082,Ô Vietnam,ChIJD3XppLtZEUgRn3YlY1RXSQU,Restaurant Vietnamien,"5 Impasse Des Marronniers, Plouvorn",2
29082,Wok & Grill,ChIJ91bPtLZgEUgRXwlOYsqxiH4,"Restaurant Chinois, Restaurant De Sushis","Rue Goarem Pella, Saint-Martin-des-Champs",2
29082,Sim Sushi,ChIJn2xa3Y1nEUgRJapQCvQUex4,Restaurant Japonais,"Centre Commercial La Galerie Carrefour, Saint-Martin-des-Champs",2
29083,Elfida Kebab&Tacos Restaurant,ChIJv_sCypbhFkgR18CX6MSX1qQ,Restaurant,"3 Rue Victor Hugo, Audierne",1
29083,Harkos Kebab,ChIJLSzqrEDrFkgRkK4LGbu-Oyg,Restaurant De Restauration Rapide,"29570 Camaret-Sur-Mer, Camaret-sur-Mer",1
29083,Case De Tom,ChIJaR-Cl-f-FkgRBr8MdarkuJE,"Restaurant, Bar, Restaurant Français","27 Quai Des Paimpolais, Île-de-Sein",0
29083,Chez Brigitte,ChIJzWNEvOf-FkgRT_LiiJhOsvQ,Bistro,"14 Quai Des Paimpolais, Île-de-Sein",0
29083,L' Armen,ChIJU0qm8zPjFkgRwQ5QblWSMBk,"Crêperie, Restaurant Français","29770 La Pointe Du Raz, Plogoff",0
29083,Le Grand Bleu,ChIJHTcNWqHjFkgRZKaInOlph1E,"Restaurant, Bar, Crêperie","14 Cité Commerciale De, Plogoff",0
29083,Au Raz De Sein,ChIJu_Bs2hXjFkgRvj0P0OwtT3s,"Crêperie, Bar, Restaurant Français, Restaurant À Emporter","58 Imp. Roz Kerveur, Plogoff",0
29083,Misaki,ChIJa1ebVXLfFkgRr2tmumYAxXQ,Restaurant Japonais,"13 Rue Marcel Pellay, Pont-Croix",2
29084,L Oriental Kebab,ChIJWyak09WTFkgR2dTU5KkFQpc,"Restaurant, Restaurant De Livraison, Service D'expédition","8 Rue Pen Ar Bed, Plougonvelin",1
29084,Au Palais Du Bourg,ChIJTxh7mt6VFkgRSK6UdCeFrNY,"Restaurant, Restaurant Italien, Restaurant Marocain, Restaurant De Pizzas","6 Rte De La Trinité, Plouzané",1
29084,Mésopotamie,ChIJ-Qu6esmXFkgRQrZRLCkwJRg,"Kebab, Restaurant De Restauration Rapide","Suite Aux Nouvelles Concernant Le Covid 19 Nous Faisons Du Livraison, Saint-Renan",1
29084,Le Délicieux Kebab,ChIJHV_smdOYFkgR7nQJsiE_w9E,"Kebab, Restaurant De Restauration Rapide","9 Rue Henri Provostic, Ploudalmézeau",1
29084,Harkos Kebab,ChIJLSzqrEDrFkgRkK4LGbu-Oyg,Restaurant De Restauration Rapide,"29570 Camaret-Sur-Mer, Camaret-sur-Mer",1
29084,Au Vent Des Iles,ChIJtU3elNyJFkgR--H79OsCY2E,"Restaurant, Restaurant Français, Appartement De Vacances","Lieu-Dit Mez Ar Vilin, Île-Molène",0
29084,Crêperie - Tabac Presse Souvenirs,ChIJK2W3I8OJFkgRp9JhhphGbWE,"Bureau De Tabac, Crêperie, Boutique De Paniers Cadeaux","Unnamed Road, Île-Molène",0
29084,E Ti An Glesker,ChIJI-vyeSKJFkgRhOBHWClpa80,Crêperie,"Chemin Du Sillon, Île-Molène",0
29084,Chez Carole,ChIJQcF8nUZ7FkgR9m4pDT91zfA,Crêperie,"Stang Ar Glann, Ouessant",0
29084,Les Pointes Du Kailhoù,ChIJWfSUlAh7FkgRRir8qxIjf28,Brasserie,"Stang Ar Glan, Ouessant",0
29084,Koh Samui,ChIJ-eBnMIWXFkgROPWLurzcvQQ,Restaurant Thaïlandais,"2 Rue Léon Cheminant, Saint-Renan",2
29084,Sushi Daily Saint Renan,ChIJMepGPbjZVA0RlGv06H9rT-Q,"Sushis À Emporter, Restaurant De Sushis À Tapis Roulant, Producteur Alimentaire, Restaurant De Sushis","Zone Artisanale De Kerzouar, Saint-Renan",2
29084,Sushi Daily,ChIJR67FrtKXFkgRFX3pzJzcIyk,"Sushis À Emporter, Restaurant De Sushis","Za De, Saint-Renan",2
29084,Le Saphir,ChIJTRCepdKXFkgRA966t3hbapU,"Restaurant Asiatique, Restaurant Chinois","Rue Du Pont De Bois Centre Commercial Les Rives Du Lac, Saint-Renan",2
29084,Sushi Daily Plouzane,ChIJj13oS72_FkgRLD-_mCdvSg0,"Sushis À Emporter, Restaurant De Sushis À Tapis Roulant, Producteur Alimentaire, Restaurant De Sushis","Rue Des Myosotis, Plouzané",2
29085,Mashallah,ChIJT-gnvfctF0gRDDZTjn_nplw,Kebab,"4 Pl. Du Pont Guern, Pont-l'Abbé",1
29085,Restaurant Ty Grill Et Mezze,ChIJ049lNgvVEEgR9HFSzTEkW8U,Restaurant Turc,"24 Hent Kerfram, Plomelin",1
29085,Ploneour Kebab,ChIJ20Pct4kvF0gRIyo_-mNqwAY,Restaurant,"18 Rue Jules Ferry, Plonéour-Lanvern",1
29085,Bosphore Kebab,ChIJgSEi8_owF0gRHJNV8KLVzqY,"Restaurant Turc, Restaurant De Restauration Rapide, Kebab, Restaurant","35 Rue De La Marine, Guilvinec",1
29085,Chez Ali,ChIJuyk_SiHVEEgRV_DExg8FDig,"Restaurant Marocain, Restaurant Arabe, Restaurant De Couscous, Restaurant Familial, Restaurant Halal, Restaurant Du Déjeuner, Restaurant À Emporter, Restaurant Nord-Africain, Restaurant, Restaurant Végétarien","6bis Av. De La Libération, Quimper",1
29085,Bar Restaurant Le Teven,ChIJA9fpYlotF0gRM1Gh7UKw68M,Restaurant Français,"6 Av. Du Teven, Île-Tudy",0
29085,Le Maracana 2,ChIJiRB0XF4tF0gRSPCi25I1wVA,"Restaurant, Bar, Café, Restaurant Français","8 Av. De Bretagne, Île-Tudy",0
29085,Bistro De La Balise,ChIJjZ5w05gyF0gRwrHQL7PCTw4,"Bistro, Bar","1 Pl. De La Cale, Île-Tudy",0
29085,Le Tribord,ChIJ6ZPG1ZgyF0gRPvTVUApKtbQ,"Crêperie, Restaurant","3 Bis Pl. De La Cale, Île-Tudy",0
29085,Restaurant Le Malamock 2,ChIJPx7hK5kyF0gRUvRehorTv7A,Restaurant Français,"9 Pl. De La Cale, Île-Tudy",0
29085,Ô Ty Viet,ChIJ5YSXDLMtF0gRm3iIHy_6FCs,Restaurant Vietnamien,"Les Halles, Pont-l'Abbé",2
29085,Thaï Street Food,ChIJgysAsb8tF0gRrgNJRyld4Wo,Restaurant Thaïlandais,"13 Rue De La Gare, Pont-l'Abbé",2
29085,Sushi Sakana,ChIJrXvnivkxF0gRcE9iF1KyFZQ,Restaurant Japonais,"1 Rue Pen Allée, Plomeur",2
29085,Restaurant La Baguette D'or,ChIJz71-VBvREEgRgm90nqYQ5lM,"Restaurant, Bar, Restaurant Chinois, Restaurant Vietnamien","15 Chem. De Toul An Ael, Fouesnant",2
29085,Restaurant Asiatique Aigle Royal,ChIJLV1LkSTUEEgRoq_sdzcGeKg,"Restaurant Asiatique, Restaurant Buffet, Restaurant Chinois, Restaurant Japonais, Restaurant De Sushis","440 Rte De Bénodet, Quimper",2
29086,Good Time,ChIJJzjpMNuyFkgRVOlNjuGzs2A,"Restaurant De Restauration Rapide, Restaurant Italien, Restaurant De Pizzas, Restaurant De Tacos","12 Rue Du Pont, Landerneau",1
29086,L'elorn Kebab,ChIJAcCJM9uyFkgR4d0j_Bss-cs,Restaurant,"9 Rue Du Pont, Landerneau",1
29086,Helline Kebab,ChIJ5Zos39yyFkgRRMAywrlsnt0,"Restaurant Turc, Restaurant De Restauration Rapide, Kebab","42 Quai De Léon, Landerneau",1
29086,Restaurant Kardelen,ChIJuapAqMSyFkgRhZ0bHJfaucY,"Restaurant Turc, Restaurant De Restauration Rapide, Kebab, Restaurant","14 Rue De La Font Blanche, Landerneau",1
29086,Kemer Kebab,ChIJK11N9hi3FkgRG7V-X9w1w58,Kebab,"3 Pl. Du Calvaire, Plougastel-Daoulas",1
29086,Crêperie De La Mignonne,ChIJgRMTdv60FkgRfwZxSbZ0VlU,"Crêperie, Restaurant Français","2 Rue Du Valy, Daoulas",0
29086,Restaurant Le Valy,ChIJHyUxdv60FkgRhEYa7ciU9FI,Restaurant Français,"11 Rue Du Pont, Daoulas",0
29086,Golf Brest Iroise,ChIJn6cydpVMEUgR473iKjwplJA,"Restaurant, Restaurant Français, Terrain De Golf, Practice De Golf, Instructeur De Golf, Parcours De Golf Intérieur, Club De Golf","Parc De Lann Rohou, Saint-Urbain",0
29086,Le Relais Du Roual,ChIJYTfqlYG0FkgRBGibUD79mo8,"Restaurant Français, Bar, Relais Routier","13 Rue De L'église, Dirinon",0
29086,Mau'billig,ChIJpQgEA0e1FkgRR3jaFm02QyU,"Restaurant, Crêperie, Traiteur Mobile","6 Rés Du Menhir, Logonna-Daoulas",0
29086,Shish Mahal,ChIJS3euztyyFkgRveyPiXeK_Ug,Restaurant Indien,"8 Rue De Brest, Landerneau",2
29086,Restaurant Thailand'erne Landerneau,ChIJkRqKV8OyFkgRzMF-1vIV63w,"Restaurant Thaïlandais, Restaurant Asiatique, Restaurant Japonais, Restaurant De Sushis, Sushis À Emporter, Restaurant Végétarien","18 Rue De La Font Blanche, Landerneau",2
29086,Sarl Baan Thai & Sushi,ChIJV1eHV8OyFkgRj2zYdeE-f6c,"Restaurant De Sushis, Restaurant Japonais, Restaurant Thaïlandais","18 Rue De La Font Blanche, Landerneau",2
29086,Pondicherry,ChIJK7V6w2mzFkgRRf9Z7BXiiIw,Restaurant Indien,"55 Rue De Brest, Landerneau",2
29086,Sushi Manga Sensei,ChIJIw-vFF63FkgR3nOHXg4uUgA,Restaurant Asiatique,"7 Rue De L'église, Plougastel-Daoulas",2
29087,Kebab Douarnenez Bunchy City,ChIJNz6fV9vQFkgR4MY0P2FHavk,"Restaurant, Bar Et Grill, Restaurant De Restauration Rapide, Restaurant De Hamburgers, Kebab, Restaurant De Livraison, Pâtisserie, Sandwicherie, Restaurant De Tacos","6 Rue Anatole France, Douarnenez",1
29087,O’delices Restaurant Kebab,ChIJ1XYpfmTRFkgRwaWi0NqjfLA,"Kebab, Restaurant De Restauration Rapide, Restaurant Turc","53 Rue Duguay Trouin, Douarnenez",1
29087,Restaurant Kebab Chez Sofia,ChIJhUia9zzRFkgR4epkMqXXG-k,Kebab,"5 Quai De L'yser, Douarnenez",1
29087,Chez Ali,ChIJuyk_SiHVEEgRV_DExg8FDig,"Restaurant Marocain, Restaurant Arabe, Restaurant De Couscous, Restaurant Familial, Restaurant Halal, Restaurant Du Déjeuner, Restaurant À Emporter, Restaurant Nord-Africain, Restaurant, Restaurant Végétarien","6bis Av. De La Libération, Quimper",1
29087,Restaurant Ty Grill Et Mezze,ChIJ049lNgvVEEgR9HFSzTEkW8U,Restaurant Turc,"24 Hent Kerfram, Plomelin",1
29087,Bistrot Du Marché Douarnenez,ChIJ0RFImcjRFkgR-yvAmLn1-4s,"Restaurant, Bar Et Grill, Restaurant De Petit-Déjeuner, Restaurant Familial, Restaurant De Restauration Rapide, Marché De Produits Frais, Restaurant Du Déjeuner, Restaurant À Emporter, Restaurant De Plats De Viande, Restaurant Traditionnel","Route De Drevers, Douarnenez",0
29087,La P'tite Gourlizonnaise,ChIJRaqLDuHXFkgRkIivjWqajA0,Crêperie,"24 Rue De La Mairie, Gourlizon",0
29087,Lodinelle Crêperie Douarnenez,ChIJP_kxCYTRFkgRu9rOpsRRxqg,Crêperie,"55 Rue Laennec, Douarnenez",0
29087,Crêperie Du Sallé,ChIJRcvGB9zQFkgRu_Fzol4WwyE,"Crêperie, Bar, Restaurant Français, Restaurant À Emporter","7 Quai Du Petit Port, Douarnenez",0
29087,Ar-Men,ChIJ8a-0-sjRFkgRfekrg3icrFE,Restaurant Français,"11 Quai Du Petit Port, Douarnenez",0
29087,Restaurant Ty Hiro,ChIJzxuioZ3RFkgRIbtpsTexc7k,Restaurant Japonais,"27bis Quai De L'yser, Douarnenez",2
29087,Le Mahraja,ChIJJaqd45LVEEgR1160PD_u9Lk,"Restaurant Indien, Restaurant À Emporter, Restaurant Pakistanais","43 Bd Amiral De Kerguélen, Quimper",2
29087,Restaurant Le Gandhi,ChIJcxoDL-3VEEgR-CSnzEf2dKM,"Restaurant Indien, Restaurant Népalais","13 Bd Amiral De Kerguélen, Quimper",2
29087,La Cuisine Thai De Maman Ploy,ChIJW6QvcA7WEEgRW8iu8yb6Dkg,"Restaurant À Emporter, Nourriture Et Boisson, Restaurant Thaïlandais","13 Av. Du Rouillen, Ergué-Gabéric",2
29087,Misaki,ChIJa1ebVXLfFkgRr2tmumYAxXQ,Restaurant Japonais,"13 Rue Marcel Pellay, Pont-Croix",2
29089,La Brasserie Marocaine,ChIJiTTd3QgMEUgRlLESLbdW7qg,"Restaurant Marocain, Brasserie, Restaurant De Couscous, Restaurant De Hamburgers, Restaurant À Emporter, Bar À Vin","2 Pl. De La Mairie, Carhaix-Plouguer",1
29089,Bosphore Kebab,ChIJV6TjLvYLEUgRsKZWx6wAUiE,"Kebab, Restaurant Turc","31 Rue Des Martyrs, Carhaix-Plouguer",1
29089,Antalya Kebab,ChIJm09G8PYLEUgRVx-u-j85Ot0,"Restaurant Turc, Restaurant De Restauration Rapide, Kebab","22 Av. Du Général De Gaulle, Carhaix-Plouguer",1
29089,Dounia Kebab,ChIJJ7mrw_YLEUgRDN3NHg24ms0,"Kebab, Restaurant De Restauration Rapide","37 Av. Du Général De Gaulle, Carhaix-Plouguer",1
29089,Kebab De La Gare Gourin,ChIJofeL-3kFEUgRoTEMH6Wn-LA,Restaurant De Restauration Rapide,"2 Rue De La Gare, Gourin",1
29089,Koz Kastell,ChIJzw55OgAPEUgRqXMLzZvAwiU,Crêperie,"154 Ecl De Koz Kastell, Saint-Hernin",0
29089,Les Bonnets Rouges - Ar Bonedoù Ruz,ChIJ7XLX-wgMEUgR-Ky9bSmhXIA,"Restaurant, Restaurant Français, Restaurant Italien, Restaurant De Pizzas","12 Rue Des Ursulines, Carhaix-Plouguer",0
29089,Crêperie Les Salines,ChIJRR81OwkMEUgRsv3WiOjzwLY,"Crêperie, Restaurant Français","23 Rue Brizeux, Carhaix-Plouguer",0
29089,Le Carrick,ChIJOcuZJAkMEUgRo0qBE-Abq2I,Restaurant Français,"18 Rue Brizeux, Carhaix-Plouguer",0
29089,Le Tire Bouchon,ChIJr64mtnMNEUgRLrKMGKlVafU,"Bistro, Bar À Vin","5 Pl. De La Mairie, Carhaix-Plouguer",0
29089,Karaez Thaï Food,ChIJnzoWIQkMEUgRgNvqGNPOP8I,Restaurant Thaïlandais,"8 Rue Brizeux, Carhaix-Plouguer",2
29089,Au Petit Viet Linh,ChIJbY_i9vYLEUgRnMZCHOTc_Lc,Restaurant Vietnamien,"16 Av. Du Général De Gaulle, Carhaix-Plouguer",2
29089,Matin Calme,ChIJPZfPsBMLEUgRFui6umpjwYU,Restaurant Coréen,"26 Av. Du Général De Gaulle, Carhaix-Plouguer",2
29089,Dragon D'asie,ChIJqa70q_ELEUgRTll_syhUVH0,"Restaurant, Restaurant Asiatique, Restaurant Chinois","24 Av. Victor Hugo, Carhaix-Plouguer",2
29089,Makly,ChIJY3Ui481nEUgRUO0yX5RD6TY,Plats Chinois À Emporter,"Prajen Vian, Plourin-lès-Morlaix",2
29090,Kebab Douarnenez Bunchy City,ChIJNz6fV9vQFkgR4MY0P2FHavk,"Restaurant, Bar Et Grill, Restaurant De Restauration Rapide, Restaurant De Hamburgers, Kebab, Restaurant De Livraison, Pâtisserie, Sandwicherie, Restaurant De Tacos","6 Rue Anatole France, Douarnenez",1
29090,O’delices Restaurant Kebab,ChIJ1XYpfmTRFkgRwaWi0NqjfLA,"Kebab, Restaurant De Restauration Rapide, Restaurant Turc","53 Rue Duguay Trouin, Douarnenez",1
29090,Restaurant Kebab Chez Sofia,ChIJhUia9zzRFkgR4epkMqXXG-k,Kebab,"5 Quai De L'yser, Douarnenez",1
29090,Chez Ali,ChIJuyk_SiHVEEgRV_DExg8FDig,"Restaurant Marocain, Restaurant Arabe, Restaurant De Couscous, Restaurant Familial, Restaurant Halal, Restaurant Du Déjeuner, Restaurant À Emporter, Restaurant Nord-Africain, Restaurant, Restaurant Végétarien","6bis Av. De La Libération, Quimper",1
29090,Océan Kebab,ChIJybNeoPoxEUgRm2sfuk9N6aA,Kebab,"40 Quai Carnot, Châteaulin",1
29090,Manoir De Moëllien,ChIJlYSCnajTFkgReeglXxbwQEo,"Restaurant, Restaurant Français, Hôtel","Lieu Dit, Plonévez-Porzay",0
29090,Crêperie Du Sallé,ChIJRcvGB9zQFkgRu_Fzol4WwyE,"Crêperie, Bar, Restaurant Français, Restaurant À Emporter","7 Quai Du Petit Port, Douarnenez",0
29090,Lodinelle Crêperie Douarnenez,ChIJP_kxCYTRFkgRu9rOpsRRxqg,Crêperie,"55 Rue Laennec, Douarnenez",0
29090,Bistrot Du Marché Douarnenez,ChIJ0RFImcjRFkgR-yvAmLn1-4s,"Restaurant, Bar Et Grill, Restaurant De Petit-Déjeuner, Restaurant Familial, Restaurant De Restauration Rapide, Marché De Produits Frais, Restaurant Du Déjeuner, Restaurant À Emporter, Restaurant De Plats De Viande, Restaurant Traditionnel","Route De Drevers, Douarnenez",0
29090,Ar-Men,ChIJ8a-0-sjRFkgRfekrg3icrFE,Restaurant Français,"11 Quai Du Petit Port, Douarnenez",0
29090,Restaurant Ty Hiro,ChIJzxuioZ3RFkgRIbtpsTexc7k,Restaurant Japonais,"27bis Quai De L'yser, Douarnenez",2
29090,Le Mahraja,ChIJJaqd45LVEEgR1160PD_u9Lk,"Restaurant Indien, Restaurant À Emporter, Restaurant Pakistanais","43 Bd Amiral De Kerguélen, Quimper",2
29090,Restaurant Le Gandhi,ChIJcxoDL-3VEEgR-CSnzEf2dKM,"Restaurant Indien, Restaurant Népalais","13 Bd Amiral De Kerguélen, Quimper",2
29090,Misaki,ChIJa1ebVXLfFkgRr2tmumYAxXQ,Restaurant Japonais,"13 Rue Marcel Pellay, Pont-Croix",2
29090,Les Délices De Ty Hien,ChIJoVuMnZoxEUgRoy-3I1FoKiY,"Restaurant Asiatique, Restaurant Chinois, Restaurant Thaïlandais","16 Quai Charles De Gaulle, Châteaulin",2
29091,Anatolie Kebab,ChIJia2anOyrFkgR9_bQMe66dzc,"Kebab, Restaurant De Restauration Rapide","1 Pl. Maréchal Foch, Lesneven",1
29091,Le Berlinois,ChIJHb5Mi-yrFkgR4bWo-B7X9NM,Kebab,"3 Rue Alain Fergent, Lesneven",1
29091,Meilleur Kebab,ChIJ9VPdAiinFkgRiMoParEXt9o,Restaurant,"2 Rue De La Mairie, Lannilis",1
29091,Lorine Kebab,ChIJES2u1LemFkgRHqqW5In2JlY,"Restaurant, Restaurant De Restauration Rapide","2 Rue De La Mairie, Lannilis",1
29091,Royal Kebab,ChIJ_Sxh3An-E0gR4Z5I_sPWXOg,"Kebab, Restaurant De Restauration Rapide","44 Rue Maréchal Foch, Plouescat",1
29091,Bistrot Des Légendes Meneham,ChIJIaoHHzACFEgRUWGeFm6IzYU,"Restaurant, Restaurant Français","Village De Meneham, Kerlouan",0
29091,Restaurant “Au P'tit Nice”,ChIJZ7pIV6QBFEgRWa2krVT_Joo,"Restaurant, Crêperie","20 Rue De Keravezan, Plounéour-Brignogan-plages",0
29091,La Corniche,ChIJn_zBr7EBFEgRvA7xttGSZO8,"Restaurant, Restaurant Français, Restaurant De Fruits De Mer","Le Garo - Rue De La Corniche, Plounéour-Brignogan-plages",0
29091,Le Restaurant Breton,ChIJY5LOW5mpFkgRl45bvqCwhP8,"Restaurant Français, Bar À Tabac, Café","1 Le Bourg, Saint-Frégant",0
29091,Crêperie Saint Goulven,ChIJL2FQVY-qFkgRYNB-0usITCg,"Crêperie, Restaurant Français, Restaurant À Emporter, Restaurant","Ker Ar Groas, Goulven",0
