respondent.commune,business_name,place_id,fr_categories,business_address,treatment_arm
Le Plessis-Trévise,Le Trévise,ChIJcwwrPFgP5kcRtKZVfKvGxf8,Brasserie,"20 Av. Ardouin, Le Plessis-Trévise",0
Le Plessis-Trévise,Le Carré Pointu (Le Trévise),ChIJh2JJG_YO5kcRD7LU6eW8Fng,"Restaurant, Bar, Restaurant De Petit-Déjeuner, Restaurant Français","20 Av. Ardouin, Le Plessis-Trévise",0
Le Plessis-Trévise,Le Petit Paris,ChIJXXy-m-MP5kcRRLRRSzqwuHI,Brasserie,"13 Av. Ardouin, Le Plessis-Trévise",0
Le Plessis-Trévise,The Yards,ChIJhfm8xJYO5kcRllkR6WjNTuE,"Restaurant, Restaurant Américain, Bar, Restaurant De Hamburgers","12 Av. De Pince Vent, Chennevières-sur-Marne",0
Le Plessis-Trévise,Le Pavillon Du Plessis,ChIJeyxFEPEO5kcRTHCWGzVKg-8,Restaurant Chinois,"2 Av. Clément Ader, Le Plessis-Trévise",NA
Le Plessis-Trévise,Le Jade D'asie,ChIJW5RUSPYO5kcR0pqDy7RCP-U,"Restaurant Asiatique, Restaurant Mandarin","11 Av. Ardouin, Le Plessis-Trévise",NA
Le Plessis-Trévise,Ye Suizhuang,ChIJ7UDFGvEO5kcRyEJWnhu_oGE,"Restaurant Asiatique, Restaurant Chinois, Restaurant Thaïlandais","2 Av. Clément Ader, Le Plessis-Trévise",NA
Le Plessis-Trévise,Plessis Sushi,ChIJxw5LuPcO5kcRk4xLLGe9TAA,Restaurant Japonais,"3 Av. Thérèse, Le Plessis-Trévise",NA
Le Plessis-Trévise,Koyama Sushi,ChIJsQrVu_cO5kcRr9Repz1Zgp0,"Restaurant Japonais, Restaurant De Sushis","14 Av. Du Général De Gaulle, Le Plessis-Trévise",NA
La Queue-en-Brie,Grill Istanbul,ChIJWTVgA5cO5kcRy6J7Mi8_LWE,"Restaurant Turc, Restaurant De Restauration Rapide","85 Rte De Provins, Chennevières-sur-Marne",1
La Queue-en-Brie,Pitaya Thaï Street Food,ChIJxSWKrLcP5kcR2hTriV-iggk,"Restaurant De Restauration Rapide, Restaurant Halal, Restaurant De Fondue Chinoise, Restaurant Panasiatique, Restaurant, Restaurant D'asie Du Sud-Est, Restaurant Thaïlandais, Restaurant De Wok","Centre Commercial Pince Vent, Chennevières-sur-Marne",1
La Queue-en-Brie,O'tacos,ChIJQxBzCRQP5kcRnkHLfJEJtxg,"Restaurant De Restauration Rapide, Restaurant De Tacos","45 Av. Charles Rouxel, Pontault-Combault",1
La Queue-en-Brie,Grill Corner Restaurant Indien Pakistanais Livraison Emporter Halal,ChIJMTYD0D8P5kcRpnDtFTRTqFM,"Restaurant, Restaurant Halal","36 Av. Du Château, Pontault-Combault",1
La Queue-en-Brie,L'etoile Du Maroc Restaurant Marocain Pontault Combault,ChIJkzEizhMP5kcRFugp89BIjp0,"Restaurant, Restaurant De Couscous, Restaurant Marocain","16 Av. Charles Rouxel, Pontault-Combault",1
La Queue-en-Brie,Au Bureau,ChIJgx51BgAP5kcR_WMTaXigf_M,"Restaurant, Bar, Restaurant Européen, Restaurant Français, Restaurant De Hamburgers, Restaurant Irlandais, Pub, Bar Sportif","Zone Commerciale Moulin De Champlain, La Queue-en-Brie",0
La Queue-en-Brie,Burger King,ChIJNxecRRQN5kcRn1igEJlReZo,"Restaurant De Restauration Rapide, Restaurant Américain, Bar Et Grill, Restaurant Familial, Restaurant De Hamburgers, Restaurant À Emporter","Centre Commercial Pince Vent, Chennevières-sur-Marne",0
La Queue-en-Brie,Auberge Du Petit Caporal,ChIJqx7GltAO5kcRWNc5QNhu9Pw,"Restaurant, Bar, Restaurant Gastronomique, Restaurant Français","42 Rue Du Général De Gaulle, La Queue-en-Brie",0
La Queue-en-Brie,Le Bistrot La Criée La Queue En Brie,ChIJV8uUlMUO5kcR2EWVQu6xAfM,"Restaurant, Restaurant Chophouse, Restaurant De Poisson-Frites, Restaurant De Poissons, Restaurant Français, Restaurant De Livraison, Restaurant De Plats De Viande, Restaurant De Fruits De Mer","Zac De La, La Queue-en-Brie",0
La Queue-en-Brie,Multi Churrasco,ChIJ7ahGENAO5kcR04isexhCCKo,"Restaurant Portugais, Restaurant Français","22 Rue Du Général De Gaulle, La Queue-en-Brie",0
La Queue-en-Brie,Allo Sushi,ChIJN_TWidAO5kcRqHLBYT6pcj4,"Restaurant De Sushis, Restaurant De Restauration Rapide","28 Rue Du Général De Gaulle, La Queue-en-Brie",NA
La Queue-en-Brie,Le Dragon Du Soleil,ChIJfZU90pcO5kcRao9AhPi03V8,"Restaurant Asiatique, Restaurant Chinois","85 Av. De Pince Vent, Chennevières-sur-Marne",NA
La Queue-en-Brie,Shimaru,ChIJA4e7lD8P5kcRKW6EChUt-Kg,Restaurant Coréen,"Centre Commercial Pince Vent, Ormesson-sur-Marne",NA
La Queue-en-Brie,Papylee,ChIJyUUabBoP5kcRycFkSOH6HKc,Sushis À Emporter,"Chez Carrefour, Centre Commercial Pince Vent, Ormesson-sur-Marne",NA
La Queue-en-Brie,Bangkok 63,ChIJO9A3Jn0P5kcRxTIkk18BLOI,Restaurant Thaïlandais,"72 Av. Charles Rouxel, Pontault-Combault",NA
Rungis,Café Guzo - Le Kiosque,ChIJDSOvpEx35kcRPH0d2sXRxH0,"Restaurant Halal, Café, Pâtisserie","1 Rue Traversière, Rungis",1
Rungis,L'atelier Du Gout,ChIJHflyG1935kcRxqbXtVJw1iY,Restaurant Halal,"21 Rue De Chevilly, Fresnes",1
Rungis,Pizza Service,ChIJgVvyx8N25kcRxFqOtut6i6M,"Restaurant De Pizzas, Gril, Restaurant Halal, Restaurant De Hamburgers, Restaurant De Livraison, Restaurant, Brasserie, Sandwicherie","23 Av. De La Paix, Fresnes",1
Rungis,Le Souk De L'atlas,ChIJ9eVkyCJ05kcRIN2pvTP2eUY,"Restaurant, Restaurant De Couscous, Restaurant Marocain","2 Av. De Fontainebleau, Rungis",1
Rungis,Les Maraîchers,ChIJa3bbSKFz5kcRQouYLQAondk,"Restaurant, Bar, Kebab, Restaurant À Emporter, Restaurant De Pizzas, Pizza À Emporter, Brasserie","20 Av. Du Viaduc, Chevilly-Larue",1
Rungis,Restaurant La Ripaille,ChIJobHHNpd25kcRWbf0aW3gUyM,Restaurant Français,"22 Pl. Louis Xiii, Rungis",0
Rungis,Le Louis Xiii,ChIJx0UhNpd25kcRUIWEYD_cANo,"Restaurant Français, Brasserie","4 Pl. Louis Xiii, Rungis",0
Rungis,La Grange Des Halles,ChIJK3SzDpt25kcRcBAMOYjZyQw,Restaurant Français,"28 Rue Notre Dame, Rungis",0
Rungis,La Bigouden,ChIJW4mUe_Z35kcRuX-398ijgu0,"Restaurant, Café, Crêperie, Bar À Tapas","13 Rue Notre Dame, Rungis",0
Rungis,Le Notre Dame Café,ChIJ74RUkZt25kcRJdjNaWKyqiM,"Restaurant, Restaurant Français","17 Rue Notre Dame, Rungis",0
Rungis,Pho 66,ChIJh1xkGJp25kcRJLwfdjUjJxs,"Restaurant Vietnamien, Restaurant","17 Av. Lucien Grelinger, Rungis",NA
Rungis,Chez Bibi,ChIJo_sUlJp25kcRtrhkJCX15tU,"Restaurant De Sushis, Restaurant Fusion","9 Rue De L'abreuvoir, Rungis",NA
Rungis,Casinath,ChIJqZmjeoN25kcRUBTx99IZmW4,"Restaurant De Pizzas, Bar, Restaurant Indien, Restaurant Italien","21 Bis Rue De Villeneuve, Rungis",NA
Rungis,Atlantic,ChIJI9BGJwB35kcR7tXefybv4hk,"Restaurant, Restaurant Buffet, Restaurant Japonais","Zone La Cerisaie, Fresnes",NA
Rungis,Lumières D’asie,ChIJWYytumx35kcRjDh6EXms6xk,Restaurant Chinois,"8bis Av. De Stalingrad, Fresnes",NA
Saint-Mandé,Neko Poke,ChIJQVfsFgdz5kcRwht81Mpm2kU,"Restaurant Coréen, Restaurant Asiatique, Restaurant Halal, Restaurant Hawaïen","44 Av. Du Général De Gaulle, Saint-Mandé",1
Saint-Mandé,Jounieh,ChIJ5b1aIo9y5kcRouxOcwsTAWg,Restaurant Libanais,"46 Av. Du Général De Gaulle, Saint-Mandé",1
Saint-Mandé,Mostaza - Restaurant Saint Mandé,ChIJoxOjI49y5kcRaVWUr93Z0rc,"Restaurant De Restauration Rapide, Traiteur, Restaurant Familial, Restaurant De Hamburgers, Kebab, Restaurant À Emporter, Restaurant De Pizzas, Restaurant","46 Av. Du Général De Gaulle, Saint-Mandé",1
Saint-Mandé,Imzad,ChIJ-_o1Mopz5kcRBX1HhZPhgik,Restaurant Algérien,"14 Av. Du Général De Gaulle, Saint-Mandé",1
Saint-Mandé,En Faim!,ChIJC2wXakdz5kcRC_7wrBPnkOs,Restaurant Libanais,"2 Av. Foch, Saint-Mandé",1
Saint-Mandé,La Brasserie 1901,ChIJBWM6mY9y5kcRUwotVIPiPAw,"Brasserie, Restaurant Français","7 Pl. Charles Digeon, Saint-Mandé",0
Saint-Mandé,Restaurant Le Trouville Saint-Mandé,ChIJjSXwyPxz5kcRETnwZyvcVYw,"Restaurant, Bar, Café, Brasserie","1 Pl. Charles Digeon, Saint-Mandé",0
Saint-Mandé,Cuisine De Perle.,ChIJ-aBY0o1y5kcRLaXSKDUEyGg,"Restaurant Français, Bar","1 Rue Grandville, Saint-Mandé",0
Saint-Mandé,La Fraternité,ChIJByZhRI9y5kcRd_5KrMeCBpU,"Brasserie, Café, Restaurant Français, Restaurant","2 Av. Victor Hugo, Saint-Mandé",0
Saint-Mandé,L'atelier Burger - Saint-Mandé,ChIJaUmnI49y5kcRYP-iE0MYFUc,"Restaurant De Hamburgers, Restaurant Américain, Restaurant De Plats De Viande, Restaurant","46 Av. Du Général De Gaulle, Saint-Mandé",0
Saint-Mandé,Tomo,ChIJUe74wI5y5kcRyUOJzaMyJJk,"Restaurant Japonais, Restaurant De Sushis","70 Av. Du Général De Gaulle, Saint-Mandé",NA
Saint-Mandé,Nina Sushi,ChIJB7OM245y5kcR15GAo3IGQdQ,"Restaurant De Sushis, Restaurant Japonais, Restaurant","60 Av. Du Général De Gaulle, Saint-Mandé",NA
Saint-Mandé,Côté Sushi Saint-Mandé,ChIJO3a5cwNz5kcRcTcojwNhzzQ,"Restaurant, Restaurant De Fusion Asiatique, Restaurant Fusion, Restaurant Japonais, Restaurant De Livraison, Restaurant À Emporter, Restaurant Péruvien, Restaurant De Sushis, Sushis À Emporter","8 Av. Du Général De Gaulle, Saint-Mandé",NA
Saint-Mandé,Gourmet D'asie,ChIJj9Eq74Vy5kcRrI1ehM3a5K4,"Restaurant Chinois, Restaurant Asiatique, Restaurant Panasiatique","8 Av. Du Général De Gaulle, Saint-Mandé",NA
Saint-Mandé,Sushi Daily Saint Mande,ChIJZTNw9HBz5kcRs-LUEX3IUrc,"Sushis À Emporter, Kiosque","2 Av. Foch, Saint-Mandé",NA
Saint-Maur-des-Fossés,Restaurant Chez Yunus,ChIJdyWWn-4M5kcRH2FnrkQAfag,Restaurant Turc,"74 Bd De Créteil, Saint-Maur-des-Fossés",1
Saint-Maur-des-Fossés,Rajpoot Saint-Maur - Restaurant Indien & Pakistanais Halal,ChIJaVGOF-UM5kcRwyuNqaIiaig,"Restaurant Indien Musulman, Restaurant Halal, Plats Indiens À Emporter, Restaurant Pakistanais","84 Av. Joffre, Saint-Maur-des-Fossés",1
Saint-Maur-des-Fossés,Soleil De Marrakech,ChIJN8gB_VcM5kcRF_E3UjI1NKw,Restaurant Marocain,"35 Av. Joffre, Saint-Maur-des-Fossés",1
Saint-Maur-des-Fossés,Restaurant Riad Salam,ChIJXwxFVjgM5kcR4D3wF8U-2cw,"Restaurant Marocain, Restaurant Arabe, Restaurant Halal, Restaurant, Salon De Thé","101 Quai Winston Churchill, Saint-Maur-des-Fossés",1
Saint-Maur-des-Fossés,13 Original,ChIJ712SNa0N5kcRl5lA83eHRBA,"Restaurant, Restaurant De Restauration Rapide, Restaurant Halal, Restaurant De Hamburgers, Sandwicherie","13 Bd De La Marne, Saint-Maur-des-Fossés",1
Saint-Maur-des-Fossés,Restaurant Le Garden,ChIJ6SJzLY8M5kcRI_IKpvLBR0o,"Restaurant Haut De Gamme Français, Restaurant Français","29 Quai De Bonneuil, Saint-Maur-des-Fossés",0
Saint-Maur-des-Fossés,Le Petit Gourmet,ChIJ3yH86yDmC0ER3LadG1L2KRY,"Restaurant, Restaurant Français, Restaurant Haut De Gamme Français","59 Bis Av. Du Bac, Saint-Maur-des-Fossés",0
Saint-Maur-des-Fossés,Eden Sens,ChIJ6zB8ySkN5kcRW_aXl7UnWtQ,Restaurant Haut De Gamme Français,"143 Quai De Bonneuil, Saint-Maur-des-Fossés",0
Saint-Maur-des-Fossés,Buçaco,ChIJ7YBBSYgM5kcRN7TKZYXOgSg,"Restaurant Portugais, Café, Restaurant Français, Restaurant","67 Quai De Bonneuil, Saint-Maur-des-Fossés",0
Saint-Maur-des-Fossés,Restaurant La Cassolette,ChIJk52XLEEM5kcRLc2QUEIusKw,Restaurant Français,"44 Av. Du Mesnil, Saint-Maur-des-Fossés",0
Saint-Maur-des-Fossés,Restaurant Prince,ChIJf7yIn5YN5kcRn7WVN4pLnL0,Restaurant Indien,"84 Av. Joffre, Saint-Maur-des-Fossés",NA
Saint-Maur-des-Fossés,Palais Du Prince,ChIJoRDozGgM5kcRXhAdnZOOPrw,Restaurant Indien,"64 Rue Saint-Hilaire, Saint-Maur-des-Fossés",NA
Saint-Maur-des-Fossés,Maison Nouilles,ChIJKaHNWmsN5kcRpPenzyPbptY,Restaurant Asiatique,"Fr, Saint-Maur-des-Fossés",NA
Saint-Maur-des-Fossés,Chang,ChIJS7Y8lEEM5kcRfKSxiEbsBRE,"Restaurant Chinois, Restaurant","5 Bis Av. Balzac, Saint-Maur-des-Fossés",NA
Saint-Maur-des-Fossés,Carnot Thaï,ChIJ42SlUkAN5kcRP_j4tggdavQ,Restaurant Thaïlandais,"83 Av. Carnot, Saint-Maur-des-Fossés",NA
Saint-Maurice,Au Libanais De Saint-Maurice.,ChIJmas7svxy5kcRQooxaO-YCj0,Restaurant Libanais,"8 Av. Du Maréchal De Lattre De Tassigny, Saint-Maurice",1
Saint-Maurice,La Petite Terrasse,ChIJgRK5vfxy5kcRLVsOYxKe5lY,"Kebab, Restaurant","16 Rue De Paris, Charenton-le-Pont",1
Saint-Maurice,Boulangerie Pâtisserie Breads Paradise,ChIJD1gaN7Vz5kcRhSTaeQawIks,"Boulangerie, Pâtisserie, Traiteur, Restaurant De Restauration Rapide, Restaurant Français, Restaurant Halal, Pâtisserie, Sandwicherie, Restaurant Végétarien","24 Rue Eugène Renault, Maisons-Alfort",1
Saint-Maurice,O'malo Alfortville,ChIJXbVaCQJz5kcRMwxSviO_xLw,"Restaurant De Restauration Rapide, Restaurant De Hamburgers, Kebab, Restaurant À Emporter, Restaurant, Sandwicherie","28 Rue Charles De Gaulle, Alfortville",1
Saint-Maurice,Cappadoce,ChIJsdcpcgNz5kcR5fAeLoksKss,"Restaurant Turc, Kebab","89 Rue Paul Vaillant Couturier, Alfortville",1
Saint-Maurice,Bar Tabac Fdj Le Village,ChIJv6p75uRy5kcRXGoCFiHPofc,"Bar, Brasserie, Bureau De Tabac","18 Rue Adrien Damalix, Saint-Maurice",0
Saint-Maurice,Tupinambá,ChIJeYHInrhz5kcR_0BKBpTIlWc,"Restaurant Brésilien, Restaurant Français, Restaurant Méditerranéen","37 Rue Gabriel Péri, Charenton-le-Pont",0
Saint-Maurice,Chez Beberthe,ChIJHxJXDmxz5kcRst3PP0AB1zs,"Restaurant, Bar, Restaurant Barbecue, Restaurant Familial, Restaurant Français, Restaurant De Plats De Viande","2 Quai Fernand Saguet, Maisons-Alfort",0
Saint-Maurice,Gentiane,ChIJJdKP4Qtz5kcRF02I5nO2KPA,Restaurant Français,"11 Av. Du Général Leclerc, Maisons-Alfort",0
Saint-Maurice,Bar Du Metro Brasserie Restaurant,ChIJ40CbluJy5kcRGRAF1EDaypg,"Bar, Brasserie","7 Av. Du Général Leclerc, Maisons-Alfort",0
Saint-Maurice,Tandem Saveurs Nomades,ChIJcW2cX-dz5kcRsRMiJnCqgGY,"Restaurant, Restaurant De Fusion Asiatique, Restaurant Fusion, Restaurant Européen Moderne, Restaurant Nuevo Latino","50 Av. Du Maréchal De Lattre De Tassigny, Saint-Maurice",NA
Saint-Maurice,La Maison De Diep,ChIJIwptvfxy5kcRw7viFPkxgwQ,"Restaurant Vietnamien, Restaurant","18 Rue De Paris, Charenton-le-Pont",NA
Saint-Maurice,Jasuko,ChIJOa2ZN-By5kcRCmIIIGsPd_M,"Restaurant Japonais, Restaurant Asiatique","Fr, Maisons-Alfort",NA
Saint-Maurice,Susheat,ChIJJ0ilbpNz5kcRkALwfVujWtQ,Restaurant Japonais,"20 Av. Du Général De Gaulle, Maisons-Alfort",NA
Saint-Maurice,Aux Délices D'alfort,ChIJUbZJpeJy5kcR58E7_RkEdHo,Restaurant Chinois,"22 Av. Du Général De Gaulle, Maisons-Alfort",NA
Santeny,Le Domaine Libanais,ChIJdy-0OXsJ5kcROmpoGHS7ybM,Restaurant Libanais,"Centre Commercial Du Domaine, Santeny",1
Santeny,Nuri Doner Kebab,ChIJqxIMmpIJ5kcRPVei7vyyf7E,Restaurant,"Centre Commercial Eden, Servon",1
Santeny,O'tacos - Servon,ChIJparLuokJ5kcRSO-K2R8AYaM,"Restaurant De Tacos, Restaurant De Restauration Rapide","1 Rue D'iverny, Servon",1
Santeny,Anatol’s,ChIJheXn3dQJ5kcRxWRr5lUQcvE,"Restaurant De Restauration Rapide, Restaurant Halal","Zac Du, Servon",1
Santeny,Obrigado Rodizio Servon,ChIJa4TmuyEJ5kcRbsK-gJ-msRQ,"Restaurant Brésilien, Restaurant Barbecue, Rôtisserie, Restaurant Chophouse, Restaurant Halal, Steak House, Restaurant Yakiniku","Centre Commercial Eden, Servon",1
Santeny,"Restaurant ""Clepsydre""",ChIJ___PIrsJ5kcR9gAXWU50zuw,"Restaurant, Restaurant Français","4 Rue Du Noyer-Saint-Germain, Santeny",0
Santeny,Del Arte,ChIJC4gqvqsJ5kcR6QzjF5zXt0I,"Restaurant, Restaurant Familial, Restaurant Français, Restaurant Italien, Restaurant Du Déjeuner, Restaurant À Emporter, Restaurant Méditerranéen, Restaurant Du Nord De L'italie, Restaurant De Pizzas, Restaurant Du Sud De L'italie","Lieu Dit ""Le, Santeny",0
Santeny,Le Farmer,ChIJv98kHQEJ5kcRSnNM0W_2yxE,Restaurant Français,"9 Av. Des Érables, Santeny",0
Santeny,Léon - Servon,ChIJn5g9i0oI5kcRG3ybV-VXJ9E,"Restaurant, Restaurant Belge, Restaurant De Fruits De Mer","Route Nationale, Servon",0
Santeny,Le Bistrot La Criée Servon,ChIJ1f2hnBkI5kcRw_eZXVpo1ME,"Restaurant, Bistro, Restaurant Chophouse, Restaurant De Poisson-Frites, Restaurant De Poissons, Restaurant De Livraison, Restaurant De Fruits De Mer","4 Rue Georges Truffaut, Servon",0
Santeny,Saigon,ChIJF77W2a4J5kcRQXZpa_qbSDk,Restaurant Vietnamien,"5 Pl. Du Village, Santeny",NA
Santeny,Restau Japonais,ChIJNa_0OQAJ5kcRx3vyCP1QuUk,Restaurant Japonais,"132 Rue Des Roses, Servon",NA
Santeny,Sushi Grill Servon,ChIJN2_g40oI5kcRJdhnCs9NY34,"Restaurant Japonais, Salle De Banquet, Restaurant Chinois, Restaurant De Sushis","132 Rue Des Roses, Servon",NA
Santeny,Royal Grill,ChIJjaEBqUsI5kcRJFL8rOhI-h0,"Restaurant Asiatique, Restaurant Chinois, Restaurant Chinois De Livraison, Restaurant Japonais, Restaurant Panasiatique, Restaurant De Sushis, Restaurant De Wok","99 Rue Des Roses, Servon",NA
Santeny,Meilleur Sushi,ChIJOwQ38lgJ5kcRaWMEygYLd-k,Restaurant Japonais,"France, Marolles-en-Brie",NA
Sucy-en-Brie,Min's,ChIJoShDUYgL5kcRgIYMzLtf7-U,"Kebab, Restaurant De Restauration Rapide, Restaurant Halal, Restaurant De Hamburgers","2 Rue De Villeneuve, Sucy-en-Brie",1
Sucy-en-Brie,Libane Fresh Foods,ChIJO3jJgAgL5kcRNEIHrxROfJk,"Restaurant Libanais, Traiteur","16 Rue Du Moutier, Sucy-en-Brie",1
Sucy-en-Brie,Sweet Food,ChIJAQAEs4kL5kcRIcjWKcDl7qM,"Sandwicherie, Restaurant De Restauration Rapide, Kebab","11 Pl. De La Gare, Sucy-en-Brie",1
Sucy-en-Brie,L’univers De Serenay,ChIJRdmvcNEN5kcRrzTilYGSpzQ,"Restaurant Brunch, Crêperie, Restaurant De Kebab Doner, Restaurant Halal, Restaurant De Hamburgers, Kebab, Restaurant, Sandwicherie, Salon De Thé, Restaurant Turc","Av. Olivier D'ormesson, Ormesson-sur-Marne",1
Sucy-en-Brie,Les Jardins De Majorelle,ChIJw9efLAUM5kcRvoGNLGMfBzc,"Restaurant, Restaurant Marocain","164 Av. Olivier D'ormesson, Ormesson-sur-Marne",1
Sucy-en-Brie,Le Sixieme Sens,ChIJP-icE7wL5kcRlo7MS1BDUGQ,Restaurant Français,"6 Rue Pierre Semard, Sucy-en-Brie",0
Sucy-en-Brie,Le Quercy,ChIJVYRDvvUL5kcRtOfOdz6n4bE,"Brasserie, Bar, Restaurant Français","8 Rue Du Temple, Sucy-en-Brie",0
Sucy-en-Brie,Trois B,ChIJWzMcU_kL5kcRV_qQ7qIWsqQ,"Restaurant De Hamburgers, Restaurant Américain, Magasin De Bière, Restaurant De Restauration Rapide, Restaurant D'aliments Sains, Glacier, Restaurant Bio, Pâtisserie, Restaurant Végétarien","21 Pl. Sainte-Bernadette, Sucy-en-Brie",0
Sucy-en-Brie,Eden Crêpe,ChIJ2XEB3PUL5kcRIMbLy80Y5-0,"Crêperie, Restaurant Français","18 Av. Winston Churchill, Sucy-en-Brie",0
Sucy-en-Brie,La Ferme Des Mélèzes,ChIJTzSRUqsO5kcRM6sdChj0ZJg,"Restaurant, Restaurant Barbecue, Magasin De Bière, Fromagerie, Bar À Cocktails, Glacier, Restaurant Du Déjeuner, Restaurant De Crêpes, Bar À Vin","46 Av. Pierre Mendès-France, Noiseau",0
Sucy-en-Brie,Yama Yen,ChIJO-6tyPUL5kcRHUkA5ahPtI0,"Restaurant Japonais, Restaurant Coréen","12 Rue Guy Moquet, Sucy-en-Brie",NA
Sucy-en-Brie,Palais Du Prince,ChIJoRDozGgM5kcRXhAdnZOOPrw,Restaurant Indien,"64 Rue Saint-Hilaire, Saint-Maur-des-Fossés",NA
Sucy-en-Brie,Best Thai Kitchen,ChIJqen2tScL5kcRcFw0uEwaMB4,Restaurant Thaïlandais,"28 Rue De Sucy, Boissy-Saint-Léger",NA
Sucy-en-Brie,Papylee,ChIJda-WUX0L5kcRtphAlEbEKd8,Restaurant Asiatique,"1-3 Av. Du Bicentenaire 1789-1989 À E.leclerc, Bonneuil-sur-Marne",NA
Sucy-en-Brie,Dragonking,ChIJAQDsbYIM5kcRbbtr2G8k9sQ,Restaurant Asiatique,"Av. Du Colonel Fabien 11, Bonneuil-sur-Marne",NA
Thiais,Khao Thaï,ChIJ3eP0v2J05kcRrsJ173as_Mk,"Restaurant Thaïlandais, Restaurant Halal, Restaurant","31 Av. Gambetta, Choisy-le-Roi",1
Thiais,Abi Kebab,ChIJdx5DkeR15kcRbursSwn3cPk,Restaurant,"29 Av. Gambetta, Choisy-le-Roi",1
Thiais,Le Sultan,ChIJS3vpTHd05kcRYkNPmZF0rq4,"Restaurant, Restaurant Marocain","55 Rue Jean Jaurès, Thiais",1
Thiais,Clems'd,ChIJrYWLFhV15kcRzVpGgny4JeQ,"Traiteur, Restaurant Africain, Restaurant Barbecue, Magasin De Bière, Restaurant Halal, Magasin De Salades, Restaurant De Fruits De Mer, Bar À Vin","6 Rue Hélène Muller, Thiais",1
Thiais,Burn In Box,ChIJCXeeJAx15kcRYvc267ODTYc,"Restaurant, Restaurant Halal","105 Bd De Stalingrad, Thiais",1
Thiais,L'osteria-Ciociara,ChIJ5Y6CKm505kcRtKjBCRh6H6Y,"Restaurant Italien, Restaurant Haut De Gamme Français, Restaurant De Pizzas","2-4 Rue Du Perreux, Thiais",0
Thiais,Le Trisk'l,ChIJ2Wg2K2p05kcRjHU1_GDF_-s,Crêperie,"Rue De La Résistance, Thiais",0
Thiais,L'espérance,ChIJ0S1xvnF05kcRBjZAFWtr_io,"Bar Et Grill, Bar","2 Rue De L'égalité, Thiais",0
Thiais,La Cantine Corse,ChIJeykK5up15kcRGFey7yctQPc,"Restaurant De Pizzas, Magasin De Bière, Bistro, Brasserie, Café, Restaurant De Hamburgers, Restaurant Méditerranéen","3 Rue De La Résistance, Thiais",0
Thiais,Planète Pizza Thiais,ChIJP-Dn3H505kcR6wXDuAeMuO8,"Restaurant De Pizzas, Restaurant De Restauration Rapide, Restaurant Français, Restaurant Italien, Restaurant De Livraison, Livraison De Pizzas, Pizza À Emporter, Restaurant","59 Bd De Stalingrad, Thiais",0
Thiais,Pum Thaï,ChIJ____3mt05kcRwGlD1e0JdD0,"Restaurant, Restaurant Du Déjeuner, Restaurant À Emporter, Restaurant Thaïlandais","Rue De La Résistance, Thiais",NA
Thiais,Le Palais De Thiais,ChIJZ5J9KW505kcRPt75nfUdk38,Restaurant Asiatique,"7 Rue Robert Laporte, Thiais",NA
Thiais,Sushi Kyo,ChIJDSVD1Wt05kcRwtZOGUUWl5U,"Restaurant Japonais, Restaurant De Sushis","3 Rue De La Résistance, Thiais",NA
Thiais,Restaurant Japonais Okayama,ChIJs97zamN05kcRr4wxIhXoURI,Restaurant Japonais,"11 Av. René Panhard, Thiais",NA
Thiais,Restaurant Kin,ChIJ4RomD4p05kcRuFsN83tpWn8,"Restaurant, Restaurant Chinois, Restaurant De Fondue Chinoise, Restaurant De Livraison, Restaurant D'asie Du Sud-Est, Restaurant Thaïlandais","29 Av. Du Maréchal De Lattre De Tassigny, Choisy-le-Roi",NA
Valenton,Pizza Di Napoli Valenton,ChIJ2REhrjoL5kcRHyy0hI7Q5u8,"Restaurant De Pizzas, Restaurant De Restauration Rapide, Restaurant Halal, Livraison De Pizzas, Pizza À Emporter, Restaurant","160 Av. De La Division Du General Leclerc, Valenton",1
Valenton,Resto Halal Karien Livraison Et À Emporter,ChIJw3AVVG4L5kcRCvW5eBwYeHo,Restaurant,"Imp. Guérin, Valenton",1
Valenton,Home Kebab,ChIJRZVCA-IL5kcRmEIk3jpiqiQ,Restaurant Turc,"2 Rue Fernand Pelloutier, Villeneuve-Saint-Georges",1
Valenton,Ali Baba,ChIJu_T6hTYL5kcR59AlknLYPjI,Kebab,"34 Rue De La Sablonnière, Valenton",1
Valenton,Nefis Kebab & Grillades,ChIJBfFv2RQL5kcRNN6w1cetIp0,Restaurant,"4 Pl. Arthur Rimbaud, Limeil-Brévannes",1
Valenton,Aux Deux Colonnes,ChIJofgFez4L5kcR0qgFrWc9Ms4,Restaurant Français,"1 Rue Gabriel Péri, Valenton",0
Valenton,Auberge De Limeil,ChIJM305YBoL5kcRfiXpj9Ejoc8,Restaurant Français,"12 Rue Georges Clemenceau, Limeil-Brévannes",0
Valenton,L'arène Des Poulets,ChIJF8aycEcL5kcRykRg9rKe-LM,"Bistro, Restaurant Du Déjeuner","4 All. Léopold Sédar Senghor, Limeil-Brévannes",0
Valenton,Jall Candy Paris,ChIJ2wLCK9sL5kcRmrA2XS2b6U4,"Traiteur, Chocolaterie, Restaurant Français","Rue Albert Camus, Villeneuve-Saint-Georges",0
Valenton,Ren,ChIJyVwgMM105kcRSYlGqPIXkoI,Brasserie,"278 Pass. Chazal, Villeneuve-Saint-Georges",0
Valenton,Ak Sushi,ChIJz6t45xQL5kcRn5Rl5xAcSQc,"Restaurant Japonais, Restaurant De Sushis","11-13 Pl. Louis Aragon, Limeil-Brévannes",NA
Valenton,Mak Thaï,ChIJ81I7VaEL5kcRn4sWTm__Qq4,"Restaurant Thaïlandais, Restaurant Japonais","25 Rue Raymond De La Grange, Villeneuve-Saint-Georges",NA
Valenton,Out Fry Korean Fried Chicken,ChIJX8OwGwB15kcRY_yluX2dflw,Restaurant Coréen,"264 Rue De Paris, Villeneuve-Saint-Georges",NA
Valenton,Régal Thaï,ChIJhQGWclwL5kcRo4kl7SQyaW8,Restaurant Thaïlandais,"132 Rue De Paris, Villeneuve-Saint-Georges",NA
Valenton,Fast Fried Chicken(Indian),ChIJ2RHvENUK5kcRBhwmecXQm9E,"Restaurant De Restauration Rapide, Restaurant Indien","10 Rue Henri Leduc, Villeneuve-Saint-Georges",NA
Villecresnes,Kebab Villecresnes - Aylin,ChIJNU94XigK5kcRTanHuw8TK1Y,Kebab,"56 Rue Du Lieutenant Dagorno, Villecresnes",1
Villecresnes,Pizza Liva,ChIJI8KcciwK5kcRtEby2B_t6X4,"Restaurant De Pizzas, Restaurant Italien, Kebab, Livraison De Pizzas, Pizza À Emporter, Restaurant De Tacos","55 Av. Du Maréchal De Lattre De Tassigny, Villecresnes",1
Villecresnes,Grill Istanbul,ChIJT61ODfYJ5kcR1_8Mtkky2pA,"Kebab, Restaurant De Kebab Doner","12 Rue De Brie, Mandres-les-Roses",1
Villecresnes,Restaurant Chez Dada,ChIJl4jV03MK5kcR46kSKcPHe6w,"Restaurant Turc, Restaurant","19 Rue De La République, Brunoy",1
Villecresnes,Le Régal,ChIJybrJ2nMK5kcRfQ2-kVt6nqo,Restaurant Turc,"6 Pl. De La Gare, Brunoy",1
Villecresnes,L'inattendu Villecresnes Emilien Rouable,ChIJdXIUN90L5kcRBsDpA9R1nxk,Restaurant Haut De Gamme Français,"36 Rue Du Général Leclerc, Villecresnes",0
Villecresnes,Le Sunset,ChIJH2NUaAAL5kcRAIfrtJjYSOA,Restaurant Brunch,"44 Rue Du Général Leclerc, Villecresnes",0
Villecresnes,Juste - La Brasserie,ChIJf9tSq29z5kcRx0PWSbMoc_8,"Brasserie, Restaurant Brunch, Bar À Cocktails, Restaurant De Cuisine Campagnarde, Glacier, Restaurant Français Moderne, Magasin De Pâtes, Restaurant De Pizzas, Salon De Thé, Bar À Vin","73 Rue Du Lieutenant Dagorno, Villecresnes",0
Villecresnes,Mcdonald's,ChIJuyzAaSwK5kcRbWi45I5O-nY,"Restaurant De Restauration Rapide, Restaurant Américain, Restaurant De Hamburgers, Restaurant De Pizzas, Restaurant, Sandwicherie","61 Av. Du Maréchal De Lattre De Tassigny, Villecresnes",0
Villecresnes,Poulet D2s,ChIJjzRFctsL5kcRz0cIZE4Asgk,"Restaurant, Restaurant De Restauration Rapide, Restaurant Français, Restaurant Du Déjeuner","61 Rue De Brunoy, Villecresnes",0
Villecresnes,Les Merveilles De Chine,ChIJn_s_oYAJ5kcREyEDez14-6U,"Restaurant Chinois, Restaurant Asiatique","2 Av. Du Maréchal De Lattre De Tassigny, Villecresnes",NA
Villecresnes,Sushiman Intermaché Villecresnes,ChIJa4HzwoIL5kcRYErReFTb5iA,"Sushis À Emporter, Restaurant Asiatique, Restaurant De Restauration Rapide, Restaurant À Emporter, Restaurant D'asie Du Sud-Est, Restaurant De Sushis","Intermarché, Villecresnes",NA
Villecresnes,Ban Buriram,ChIJqYKXCQAL5kcRFz9c9UIwVEg,Restaurant Thaïlandais,"23 Rue De Cerçay, Villecresnes",NA
Villecresnes,Sushi You,ChIJJd1UtScK5kcRMOgoFR3SZMY,"Restaurant Japonais, Restaurant","45 Bis Av. Du Maréchal De Lattre De Tassigny, Villecresnes",NA
Villecresnes,Sushi Grill Marolles En Brie,ChIJReGrHIEJ5kcRV1YJ0hqh-p0,"Restaurant Japonais, Restaurant Chinois, Restaurant De Sushis","9 Rue De La Tuilerie, Marolles-en-Brie",NA
Villejuif,Le Majestic,ChIJBegga5Zz5kcR9e_-lxLyPvY,"Restaurant, Restaurant Halal, Restaurant De Hamburgers, Brasserie, Magasin De Salades, Sandwicherie, Restaurant De Tacos, Restaurant De Wok","49 Av. De Paris, Villejuif",1
Villejuif,Amaya Paris Restaurant Lounge,ChIJ86ZJOcxz5kcRspevkpm6qQ8,Restaurant Halal,"84 Bd Maxime Gorki, Villejuif",1
Villejuif,Tassili Restaurant,ChIJ-aOdk9tz5kcRO5UMSo-UPM4,"Restaurant Algérien, Restaurant Halal, Restaurant Marocain","85 Rue Jean Jaurès, Villejuif",1
Villejuif,Restaurant Beyti Villejuif,ChIJZ4x8huNz5kcRlM2JHu5_NCU,Restaurant Turc,"Restaurant Beyti, Villejuif",1
