respondent.commune,business_name,place_id,fr_categories,business_address,treatment_arm
44105,Mister Masala,ChIJefF2wwB3D0gRc9FzQDM6Gys,"Restaurant, Restaurant Indien","22 Pl. De L'église, Avessac",2
44105,Restaurant Kashfull Indien,ChIJE1GyP3RjD0gRnn-TrjFN_Ns,"Restaurant Indien, Restaurant Traditionnel","2b Rte Du Gavre, Blain",2
44106,Emportez-Moi ! - Chaumes-En-Retz,ChIJW7Y4NkmhBUgRlWw0WsN8lLU,"Pizza À Emporter, Restaurant De Restauration Rapide, Restaurant De Hamburgers, Kebab","4 Rue De Bourgneuf, Chaumes-en-Retz",1
44106,So Kebab,ChIJSwu_aCsNBUgRvJEnYOpMpwE,"Kebab, Restaurant De Restauration Rapide, Restaurant De Tacos","3 Rue De L'église, Pornic",1
44106,Emportez- Moi ! - Sainte-Pazanne,ChIJRYlQIbaiBUgRoJHt6rEsYlo,"Pizza À Emporter, Restaurant De Restauration Rapide, Restaurant De Hamburgers, Kebab","12 Bis Rue De L'hotel De Ville, Sainte-Pazanne",1
44106,"L'or En Pizza, Pizzeria Beauvoir Sur Mer",ChIJicZ8j4IGBUgRVe9IoFvukRI,"Restaurant De Pizzas, Friterie, Kebab, Pizza À Emporter","19 Grand Place, Beauvoir-sur-Mer",1
44106,La Casbah,ChIJq7gn3HkXBUgRa2LTfHR4YvU,Restaurant Marocain,"2 Bis Rue Parmentier, Noirmoutier-en-l'Île",1
44106,Town Mounties,ChIJUUUhRQALBUgRyVkhzb7RzH8,Restaurant Français,"4 Rue De La Gare, Les Moutiers-en-Retz",0
44106,La Bonne Auberge,ChIJN05AbUgKBUgRPBAdDZUk43U,"Restaurant Français, Bar, Restaurant Gastronomique","5 Av. De La Mer, Les Moutiers-en-Retz",0
44106,Restaurant La Petite Monasterienne,ChIJ-233C3ULBUgRjLlDAdIhK4w,"Restaurant De Pizzas, Restaurant Français, Restaurant Italien","5bis Place De L'église, Les Moutiers-en-Retz",0
44106,Manable Amelie Ingrid Caroline,ChIJ_x_NEq8LBUgRB8mQmuqHoFg,"Restaurant Français, Bar, Restaurant","86 Rue Des Moutiers, La Bernerie-en-Retz",0
44106,Poiskaï Sud,ChIJXQ3olHgLBUgR2gJ2O6Er3dM,Restaurant De Fruits De Mer,"Rte De Lyarne, Les Moutiers-en-Retz",0
44106,Sushi Atlantic,ChIJma54vlqhBUgRBg8HyveYnOM,Restaurant Japonais,"14 Av. De La Gare, Villeneuve-en-Retz",2
44106,Hh Misay,ChIJSRi6QkgNBUgRcIkYvjakjDA,"Restaurant Asiatique, Restaurant Laotien, Restaurant À Emporter, Restaurant Thaïlandais, Restaurant Vietnamien","26 Rue De La Source, Pornic",2
44106,La Poissonnerie Du Môle,ChIJaza45SoNBUgRPbv3ww1tjE4,"Restaurant, Restaurant Gastronomique, Restaurant Français, Poissonnerie, Brasserie, Restaurant De Fruits De Mer, Restaurant De Sushis","30 Rue De La Marine, Pornic",2
44106,La Casa D'hernesto,ChIJE_GC9DENBUgRgvWE9K_qUdQ,"Restaurant Asiatique, Pub, Restaurant","Le Nouveau Port La Noeveillard, Pornic",2
44106,Ban Sushi Pornic,ChIJm6u_2kxzBUgRHzRwdBIDhWQ,Restaurant Japonais,"70 Bd De Linz, Pornic",2
44107,Nazar Kebab Ligné,ChIJfcKYHMf_BUgRVv93Grs6XSw,"Kebab, Restaurant De Restauration Rapide","10 Rue Des Palmiers, Ligné",1
44107,Bsk Kebab,ChIJZ2CmEj9XD0gR-C8G4Qw8BQs,Restaurant De Restauration Rapide,"105 Rue De Ribaudière, Joué-sur-Erdre",1
44107,Jm French Tacos-Foodtruck,ChIJIaTioLn5BUgRKi_OCub92qU,"Restaurant De Restauration Rapide, Traiteur, Producteur Alimentaire, Sandwicherie, Restaurant De Tacos","1 Pl. Saint-Pierre, Petit-Mars",1
44107,Istanbul Kebab,ChIJaZ-0F235BUgRZga3pgPHGeQ,Restaurant De Restauration Rapide,"25 Rue De Nantes, Petit-Mars",1
44107,"O’resto 2 St-Georges, Smash Burger, Kebab, Burger, Bowl, Fried Chicken.",ChIJZZEwKXxZD0gRvdfj-6_b498,Restaurant,"14 Rue Saint-Georges, Nort-sur-Erdre",1
44107,Auberge Touchoise Ménard (Restaurant & Gîte),ChIJd_mPVIL4BUgR4W0sTa-f31M,"Restaurant, Restaurant Français","44390 Les Touches, Les Touches",0
44107,Le Relais De L'erdre,ChIJg_j3I2OrCEgRqeGu8J0mpVs,"Restaurant Français, Bar, Crêperie, Restaurant De Hamburgers, Restaurant De Pizzas, Pizza À Emporter","124 Rue Des Chênes, Riaillé",0
44107,L'incontournable Bar-Restaurant Ouvrier-Fdj,ChIJf_iq2hoCBkgRrGp2ddYg7ow,"Restaurant, Bar, Traiteur, Barre De Fléchettes, Restaurant Français","235 Av. Des Chênes, Mésanger",0
44107,Cookies Et Gourmandises,ChIJn1G8JS9TD0gRQXwYMjvx82o,"Restaurant, Restaurant De Petit-Déjeuner, Restaurant Brunch, Pâtisserie, Traiteur, Restaurant Français, Épicerie Fine, Traiteur Mobile, Pâtisserie","4 Le Marais, Joué-sur-Erdre",0
44107,Place Saint Mars,ChIJu1nUeh35BUgRUFpycBGVeB0,Crêperie,"22 Rue Du 3 Août 1944, Saint-Mars-du-Désert",0
44107,Le Mékong,ChIJPZl5uQBYD0gRjpBneTVQT3Y,Plats Chinois À Emporter,"41 Rue Saint-Georges, Nort-sur-Erdre",2
44107,Royal Wok,ChIJaWbAv5oDBkgRPdxGLEzaIpg,"Restaurant Chinois, Restaurant Japonais, Restaurant Mandarin, Restaurant De Sushis, Restaurant Vietnamien, Restaurant De Wok","992 Bd De La Prairie, Ancenis-Saint-Géréon",2
44107,Mon Petit Sushi 🌸 Ancenis,ChIJO7eYiZ-mim0RIZznDVGKpMk,"Restaurant De Sushis, Restaurant De Ramen, Sushis À Emporter","8 Rue Georges Clemenceau, Ancenis-Saint-Géréon",2
44107,Toujours Bernard,ChIJDXrLLxHwBUgR9LjLg4baykg,"Restaurant Indien, Traiteur, Restaurant, Restaurant Sri-Lankais","18 Rue Des Halles, Carquefou",2
44107,Instant Sushi Nantes,ChIJ74lexSPvBUgRGUv6NdjpcSQ,"Restaurant Japonais, Restaurant De Sushis","28 Rue Jules Verne, Carquefou",2
44108,Cicek Cengiz,ChIJvbUcswMLBkgRvJjPUs_2sLM,Restaurant Turc,"32 Rue D'anjou, Vallet",1
44108,As Kebab,ChIJQzeLTwILBkgRDJFl7iFTiow,"Kebab, Restaurant De Restauration Rapide","32 Rue D'anjou, Vallet",1
44108,Kebab Les Halles,ChIJiTWXSph1BkgR2oaZts77NRk,"Restaurant, Restaurant De Restauration Rapide, Glacier, Restaurant Turc","4 Rue Basse Des Halles, Clisson",1
44108,Au Feu De Bois,ChIJJVakITJ0BkgRIjHAndPAi9A,"Restaurant De Pizzas, Kebab","12 Rue De La Penissière, Cugand",1
44108,Gourmand Kebab,ChIJQ5d2FzvcBUgRGOW0kLfdWPQ,Restaurant De Restauration Rapide,"27 Av. De La Vendée, Aigrefeuille-sur-Maine",1
44108,Bar Brasserie La Sanguèze,ChIJ5QZMF8YKBkgRIDnnQBMrBIg,"Brasserie, Bar","77 Pl. De La Vendée, Mouzillon",0
44108,"Globe Crêpeuse, La Crêperie Nomade De Julie",ChIJwSeQQgALBkgRkwMQWo1xyGI,Crêperie,"Pl. De La Vendée, Mouzillon",0
44108,La Petite Auberge,ChIJ_18NccYKBkgRAWWQ_AzQAi8,Restaurant Français,"6 Rue Clément Guilbaud, Mouzillon",0
44108,Mcdonald's,ChIJD1NrwncLBkgRxRRf8oYR_Rg,"Restaurant De Restauration Rapide, Restaurant Américain, Restaurant De Hamburgers, Restaurant De Pizzas, Restaurant, Sandwicherie","Zac Le Brochet, Vallet",0
44108,Don Quichotte,ChIJN0yXVfsKBkgR7vputEFv6HA,"Restaurant, Restaurant Français, Hôtel","35 Rte De Clisson, Vallet",0
44108,Restaurant Traditionnel Viet Nam,ChIJ4TgbUAILBkgRV7TSWpylgIo,Restaurant Vietnamien,"19 Rte De Clisson, Vallet",2
44108,Win & Wok,ChIJ60QkiWILBkgRzyALy7Ctp-8,"Restaurant Asiatique, Traiteur","2 Rue Des Forges, Vallet",2
44108,Restaurant Sanya Cuisine Au Wok,ChIJWTb04p51BkgRYl8HQ8sfmME,Restaurant Asiatique,"21 Rue Ferdinand Albert, Clisson",2
44108,Le Million D'éléphants,ChIJb1kNmH3kBUgRgWtHcwmg9ek,"Traiteur, Plats Chinois À Emporter","44430 Le Loroux-Bottereau, Le Loroux-Bottereau",2
44108,Route De L'inde,ChIJzQRSX4vnBUgRnSYAwF9h5Vo,"Restaurant Indien Musulman, Restaurant Indien, Restaurant Indien Moderne, Restaurant Pakistanais, Restaurant","32 Rue De L'atlantique, Basse-Goulaine",2
44109,Mi Noodles,ChIJhc91L3zvBUgRa1ccJaaKQsA,"Restaurant Vietnamien, Restaurant De Fusion Asiatique, Restaurant Halal, Restaurant Panasiatique, Restaurant Thaïlandais, Restaurant De Wok","7 Rue Kepler, La Chapelle-sur-Erdre",1
44109,Le Grill Du Gesvres,ChIJXwMMSRTvBUgRvVbsNfRSQLQ,"Restaurant Turc, Bar, Restaurant Halal, Restaurant","Centre Commercial De Gesvrine, La Chapelle-sur-Erdre",1
44109,Beau Rêve,ChIJX75n5qPuBUgRBErPY8NPPuw,"Restaurant, Magasin De Bière, Restaurant Libanais, Restaurant Végétalien, Restaurant Végétarien, Bar À Vin","16 Rue Léon Blum, Nantes",1
44109,Comptoir Libanais Nantes,ChIJ_yl3Wu_vBUgRz610wu2tX3M,"Restaurant Libanais, Traiteur, Restaurant De Falafels, Restaurant De Livraison, Restaurant À Emporter, Restaurant Du Moyen-Orient, Pâtisserie, Sandwicherie, Restaurant Végétalien, Restaurant Végétarien","5 Rue De La Clavurerie, Nantes",1
44109,Aspendos,ChIJHXHoqAPsBUgRHgAcJUdUExs,"Restaurant Méditerranéen, Restaurant Grec, Restaurant Turc","41 Quai De La Fosse, Nantes",1
44109,Brasserie Artisanale Philmore,ChIJSflIn1npBUgRp_CyHpKOG_I,"Brasserie, Bar, Distributeur De Bière, Brasserie, Brasserie, Charcuterie, Bar À Cocktails, Bar De Musique Live, Brasserie, Bar Sportif","15 Rue Kepler, La Chapelle-sur-Erdre",0
44109,Chez Maman,ChIJrZyYq6XuBUgRTGexJ_YQCSE,"Restaurant, Restaurant Français","2 Rue De La Juiverie, Nantes",0
44109,L'epicurien - Restaurant Nantes,ChIJx-JmR6nvBUgRAK3rpQT23Q0,"Gril, Bar, Café, Restaurant Français, Restaurant Traditionnel","Est Entreprises Centre De Gros, Nantes",0
44109,Flunch Nantes,ChIJxyi4XFPuBUgRrjfEU1OhVlE,"Restaurant, Restaurant Buffet, Traiteur, Crêperie, Restaurant Familial, Restaurant De Restauration Rapide, Restaurant Français, Restaurant De Coupes Glacées","13 Rte De Paris, Nantes",0
44109,Les Vesprées,ChIJN7B1yaDvBUgRJzstI0hPrRs,"Restaurant, Restaurant Français","313 Rte De Sainte-Luce, Nantes",0
44109,Wok Gourmand,ChIJk65-R-3rBUgRAZKtksPPsC8,"Restaurant Buffet, Restaurant Chinois, Restaurant Japonais","1 Imp. Ordronneau, Bouguenais",2
44109,Les Goûts D'asie,ChIJmSojHd7vBUgREhp6j8cjauY,Restaurant Indien,"Centre Commercial Gesvrine, La Chapelle-sur-Erdre",2
44109,Les Epices De L'inde,ChIJ_77T0NbtBUgRen2RyQgVMKo,Restaurant Indien,"7 Rue De Mazagran, Nantes",2
44109,Song Saveur Et Sens,ChIJr4yirALsBUgRsWUbmqXIRg4,"Restaurant Vietnamien, Restaurant Asiatique, Restaurant Français","5 Rue Santeuil, Nantes",2
44109,India And You,ChIJOzOxXKHuBUgRab6B08gQYmw,"Restaurant Indien, Restaurant, Restaurant Sud-Asiatique","3 All. D'erdre, Nantes",2
44110,"O’resto 2 St-Georges, Smash Burger, Kebab, Burger, Bowl, Fried Chicken.",ChIJZZEwKXxZD0gRvdfj-6_b498,Restaurant,"14 Rue Saint-Georges, Nort-sur-Erdre",1
44110,Jm French Tacos-Foodtruck,ChIJIaTioLn5BUgRKi_OCub92qU,"Restaurant De Restauration Rapide, Traiteur, Producteur Alimentaire, Sandwicherie, Restaurant De Tacos","1 Pl. Saint-Pierre, Petit-Mars",1
44110,Istanbul Kebab,ChIJaZ-0F235BUgRZga3pgPHGeQ,Restaurant De Restauration Rapide,"25 Rue De Nantes, Petit-Mars",1
44110,Bsk Kebab,ChIJZ2CmEj9XD0gR-C8G4Qw8BQs,Restaurant De Restauration Rapide,"105 Rue De Ribaudière, Joué-sur-Erdre",1
44110,Nazar Kebab Ligné,ChIJfcKYHMf_BUgRVv93Grs6XSw,"Kebab, Restaurant De Restauration Rapide","10 Rue Des Palmiers, Ligné",1
44110,Mcdonald's,ChIJl14eJydWD0gRVET6S2ni7HE,"Restaurant De Restauration Rapide, Restaurant Américain, Restaurant De Hamburgers, Restaurant De Pizzas, Restaurant, Sandwicherie","1 Rue De L’amerique Zac, Les Touches",0
44110,Le Bretagne Nort Sur Erdre Restaurant Lorin,ChIJc1k6zwlYD0gRN2su0NDKSKg,"Restaurant Français, Restaurant À Emporter","41 Rue Aristide Briand, Nort-sur-Erdre",0
44110,Le Coralys,ChIJJ446-eL3BUgRmcfLC0ysU3k,"Restaurant Français, Bar","10 Pl. Du Champ De Foire, Nort-sur-Erdre",0
44110,La Grange,ChIJ3b75Pf5XD0gRzxSxQzbQ1L8,"Restaurant, Restaurant Barbecue, Restaurant De Pizzas, Brasserie","6 Rte De Nantes, Nort-sur-Erdre",0
44110,Crêperie Ambulante La Régalette,ChIJqdtEQA9ZD0gRcYoMEOI24Bw,Crêperie,"Rte De Nozay, Nort-sur-Erdre",0
44110,Le Mékong,ChIJPZl5uQBYD0gRjpBneTVQT3Y,Plats Chinois À Emporter,"41 Rue Saint-Georges, Nort-sur-Erdre",2
44110,Toujours Bernard,ChIJDXrLLxHwBUgR9LjLg4baykg,"Restaurant Indien, Traiteur, Restaurant, Restaurant Sri-Lankais","18 Rue Des Halles, Carquefou",2
44110,Instant Sushi Nantes,ChIJ74lexSPvBUgRGUv6NdjpcSQ,"Restaurant Japonais, Restaurant De Sushis","28 Rue Jules Verne, Carquefou",2
44110,Au Bon Accueil,ChIJ_1GaSErlBUgRBgeLr5Z6fxo,"Restaurant Buffet, Restaurant Asiatique, Restaurant Chinois, Restaurant De Sushis","9 Rue Véga, Carquefou",2
44110,Les Goûts D'asie,ChIJmSojHd7vBUgREhp6j8cjauY,Restaurant Indien,"Centre Commercial Gesvrine, La Chapelle-sur-Erdre",2
44111,L'as Burger,ChIJAVsmfPyLBUgRtAidLJOaqtc,"Restaurant De Hamburgers, Restaurant Halal","15 Av. Gustave Eiffel, Héric",1
44111,Smiley Kebab Heric,ChIJVaXZB8mKBUgR-VsZn4-l0zg,"Kebab, Restaurant De Restauration Rapide","28 Av. Gustave Eiffel, Héric",1
44111,Bbq Time,ChIJVQ5xTSSLBUgRM0p62NWvjs8,"Restaurant De Restauration Rapide, Restaurant De Cheesesteak, Restaurant De Hamburgers, Kebab, Restaurant De Pizzas, Pizza À Emporter","28 Av. Gustave Eiffel, Héric",1
44111,Sief Kebab,ChIJ9RruTHn0BUgRy9V0Z6sO388,"Restaurant Turc, Restaurant De Restauration Rapide, Kebab","29 Av. Du General De Gaulle, Grandchamp-des-Fontaines",1
44111,Vigneux Kebab,ChIJnSNJHoGOBUgRVQeUqpGjDxI,"Kebab, Restaurant De Restauration Rapide","46 Rue Du Petit Prince, Vigneux-de-Bretagne",1
44111,Le 4 - Bar Tabac,ChIJWVNNHbyLBUgRIyfBiJdMa-Y,"Bar À Tabac, Restaurant À Emporter, Brasserie, Bar Sportif","4 Pl. De L'église, Notre-Dame-des-Landes",0
44111,Mcdonald's,ChIJsRk2Rs70BUgRcslYAX-bhjU,"Restaurant De Restauration Rapide, Restaurant Américain, Restaurant De Hamburgers, Restaurant De Pizzas, Restaurant, Sandwicherie","Erettegrand'haie, Héric",0
44111,Burger King,ChIJ_XD5skH1BUgR0AqH-8GY498,"Restaurant De Restauration Rapide, Restaurant Américain, Bar Et Grill, Restaurant Familial, Restaurant De Hamburgers, Restaurant À Emporter","4 Av. De L'erette - Zi L'erette, Héric",0
44111,La Table Des...,ChIJy-q8CzT1BUgRERV1jYIAn2s,"Crêperie, Restaurant Français","13 Rue Saint-Pierre, Héric",0
44111,Chez Mathurin,ChIJN-PMq3eKBUgRqxpaqZ82hJ4,"Restaurant, Restaurant Français","6 Place De L'église, Blain",0
44111,Restaurant Asiatique Baguettes D'or,ChIJ31zsYbVjD0gRmgFWU4w9HGs,"Restaurant Vietnamien, Restaurant Asiatique, Restaurant Chinois","12 Rue Aristide Briand, Blain",2
44111,Restaurant Kashfull Indien,ChIJE1GyP3RjD0gRnn-TrjFN_Ns,"Restaurant Indien, Restaurant Traditionnel","2b Rte Du Gavre, Blain",2
44111,Sushi Daily Sautron,ChIJlXLemmqTBUgRib-u485DhkY,"Sushis À Emporter, Kiosque","20 Rue De Nantes, Sautron",2
44111,Yummy Orvault,ChIJT0alWd3tBUgRDoFzd2Kk5JI,Restaurant Thaïlandais,"8 Rue Léon Gaumont, Orvault",2
44111,Le Fogg - Restaurant Orvault,ChIJGWLxjZ7tBUgRJEy0iUVkSWI,"Restaurant, Restaurant Français, Restaurant Italien, Restaurant Thaïlandais, Restaurant De Wok","368 Rte De Vannes, Orvault",2
44112,Poyraz Erol,ChIJUWgiVv9KD0gRcTLZqD1mCIY,"Kebab, Restaurant De Restauration Rapide, Restaurant Italien","15 Rue Du 11 Novembre 1918, Châteaubriant",1
44112,Le Royal Kebap Restaurant,ChIJseMFV_9KD0gRy_NbH7P4-DU,"Restaurant, Restaurant De Restauration Rapide, Kebab","11 Rue Du 11 Novembre, Châteaubriant",1
44112,La Cappadoce,ChIJj_ljzlVKD0gRj4ILVMNmzXg,"Restaurant Turc, Restaurant De Restauration Rapide, Kebab","2 Bd Victor Hugo, Châteaubriant",1
44112,Galata Kebab,ChIJaR4w2QVLD0gRoRtb7RI-_QU,Restaurant Turc,"2 Rue Prte Neuve, Châteaubriant",1
44112,Tandoori Foods,ChIJ0XQigmBLD0gRt7qoSVlFCZQ,Restaurant De Kebab Doner,"15 Pl. Saint-Nicolas, Châteaubriant",1
44112,La Schtroumphière,ChIJPw1mSwA1D0gR6WA04D-oRs0,Restaurant Français,"44660 Fercé, Fercé",0
44112,"Restaurant Bar La Virgule,",ChIJI3AYXxLLCEgRrqKHlwQ8A10,"Restaurant, Bar, Restaurant Français","Zone D'activité, Martigné-Ferchaud",0
44112,Le Galopin,ChIJP3dPTsDLCEgR0JqbSTlaoxA,"Bar, Magasin De Bière, Bar À Cocktails, Restaurant Français, Glacier, Pâtisserie, Sandwicherie, Restaurant Végétarien, Bar À Vin","13 Rue Corbin, Martigné-Ferchaud",0
44112,Le Pourquoi Pas,ChIJRRdTFl7LCEgRGCXZ4YcmbYI,"Restaurant, Bar, Restaurant Français","8 Rue Emile Bridel, Martigné-Ferchaud",0
44112,L'ile Aux Saveurs Gourmandes,ChIJGc1MhPhLD0gRf9Wn2crh_DA,"Restaurant Européen Moderne, Restaurant Africain, Restaurant Barbecue, Bar À Cocktails, Restaurant Continental, Restaurant De Poissons, Restaurant De Steakhouse Français, Nouveau Restaurant Américain, Restaurant","32 Grande Rue, Châteaubriant",0
44112,Muraille De Chine,ChIJX89DyFVKD0gRfFfm1Upud3Q,"Restaurant Vietnamien, Restaurant Chinois, Restaurant, Restaurant D'asie Du Sud-Est","33 Rue De Couere, Châteaubriant",2
44112,Sushi Cido,ChIJzSiEGABLD0gRGeDWH5p9l2U,Restaurant Japonais,"France, Châteaubriant",2
44112,Restaurant Etoilebriant Buffet Et Wok Volonte,ChIJ3xRgucZLD0gRhE-VrOajgJE,"Restaurant, Restaurant Chinois, Restaurant Japonais, Restaurant De Sushis, Restaurant Thaïlandais","Rue Sidney Béchet, Châteaubriant",2
44112,L-Sushi,ChIJ3XBBnLvRCEgR7tHqEgFkPoQ,"Restaurant Japonais, Restaurant De Fondue Chinoise, Restaurant À Emporter, Restaurant, Restaurant De Sushis, Sushis À Emporter","2 Rue Saint-Nicolas, La Guerche-de-Bretagne",2
44112,Sushiman Super U Janzé,ChIJSXzxsRIvD0gRv18JDxzHncA,"Restaurant Japonais, Restaurant Asiatique, Restaurant De Restauration Rapide, Restaurant À Emporter, Restaurant D'asie Du Sud-Est, Restaurant De Sushis","Super U - Stand Sushiman, Janzé",2
44113,Smiley Kebab,ChIJT_bWvBxdD0gRmU7b77T9Pfk,"Restaurant De Restauration Rapide, Restaurant De Hamburgers","1 Bis Rue Marie Curie, Nozay",1
44113,"Le Dm - Tabac, Bar Et Pmu",ChIJm44chGVgD0gRmKk0BZKH6r0,"Bar, Bar Pmu, Restaurant De Kebab Doner, Bureau De Tabac","4 Pl. De L'église, La Chevallerais",1
44113,Le Taj Mar,ChIJQ3q9O99jD0gR2MBu1u-9cdU,"Restaurant, Restaurant De Hamburgers, Restaurant Du Déjeuner, Restaurant Du Moyen-Orient, Restaurant Marocain, Restaurant De Crêpes, Pâtisserie, Restaurant De Pizzas, Restaurant Traditionnel","22 Rue Des Namnètes, Blain",1
44113,Kebab Blain Yasmine Food,ChIJkcrtD9OJBUgRhOWxqVb3riU,Restaurant De Restauration Rapide,"4 Rue Du 11 Novembre, Blain",1
44113,Kebbab Blain,ChIJ2_MOnspjD0gRpi3l9shv4SI,"Restaurant, Restaurant De Restauration Rapide, Restaurant Halal, Restaurant De Hamburgers, Kebab, Restaurant Du Déjeuner, Steak House, Restaurant Turc","9 Rue Aristide Briand, Blain",1
44113,Restaurant Les 3 Marchands,ChIJhRRBcANdD0gRf-03RaCwF_o,"Restaurant, Bistro, Restaurant Français","1 Rte D'abbaretz, Nozay",0
44113,Zigzag Tiers-Lieu,ChIJtc-s-sxdD0gR5bTUGDEvFPU,Restaurant Français,"5 Rue Saint-Jean, Nozay",0
44113,La Pierre Bleue,ChIJT71GWgNdD0gRGj8Ao36USdE,"Restaurant Français, Restaurant Gastronomique","22 Rue Alexis Létourneau, Nozay",0
44113,Restaurant Le Spot,ChIJMwbkHCBdD0gRpxsYD2HiONM,"Restaurant, Restaurant Français","1 Route De La Base De Loisirs, Nozay",0
44113,Chez Léa,ChIJ1a7WMvFdD0gRQo6OOv_IGmM,Restaurant Brunch,"1 Bd Du Petit Versailles, Nozay",0
44113,Restaurant Kashfull Indien,ChIJE1GyP3RjD0gRnn-TrjFN_Ns,"Restaurant Indien, Restaurant Traditionnel","2b Rte Du Gavre, Blain",2
44113,Restaurant Asiatique Baguettes D'or,ChIJ31zsYbVjD0gRmgFWU4w9HGs,"Restaurant Vietnamien, Restaurant Asiatique, Restaurant Chinois","12 Rue Aristide Briand, Blain",2
44113,Le Mékong,ChIJPZl5uQBYD0gRjpBneTVQT3Y,Plats Chinois À Emporter,"41 Rue Saint-Georges, Nort-sur-Erdre",2
44113,Restaurant Etoilebriant Buffet Et Wok Volonte,ChIJ3xRgucZLD0gRhE-VrOajgJE,"Restaurant, Restaurant Chinois, Restaurant Japonais, Restaurant De Sushis, Restaurant Thaïlandais","Rue Sidney Béchet, Châteaubriant",2
44113,Muraille De Chine,ChIJX89DyFVKD0gRfFfm1Upud3Q,"Restaurant Vietnamien, Restaurant Chinois, Restaurant, Restaurant D'asie Du Sud-Est","33 Rue De Couere, Châteaubriant",2
44114,100% Crousti Original - Nantes,ChIJTxfG2ijtBUgRoZ-mYmL3suc,"Restaurant, Magasin De Poulet, Restaurant De Restauration Rapide, Poulet Frit À Emporter, Restaurant Halal, Restaurant À Emporter","168 Rte De Vannes, Orvault",1
44114,Marmara Kebab,ChIJfQS2tQHtBUgRbRIaoi-XZF0,"Kebab, Restaurant De Restauration Rapide","3 Pl. Des Thébaudières, Saint-Herblain",1
44114,El Foundou Saveur Tunisienne,ChIJWUv__HntBUgRn2fhmyiuorU,Restaurant Tunisien,"68 Rte De La Chapelle-Sur-Erdre, Nantes",1
44114,Naan Délice - Nord,ChIJd6Ph78LtBUgR2rypm4S17QQ,"Restaurant De Restauration Rapide, Restaurant Familial, Restaurant Halal, Restaurant Indien Musulman, Plats Indiens À Emporter, Restaurant De Livraison, Restaurant À Emporter, Restaurant, Restaurant Traditionnel","91 Rte De La Chapelle-Sur-Erdre, Nantes",1
44114,Le Mesopotamia 2,ChIJJyuLFr3tBUgRgxWNs8aoITs,Restaurant Turc,"1 Rte Du Télégraphe, Orvault",1
44114,La Peau De Vache,ChIJD6R92pftBUgRn0CwhUwwrIY,"Restaurant Français, Gril, Brasserie","8 Rue Aristide Et Marguerite Boucicaut, Orvault",0
44114,Restaurant Le 31,ChIJVVXloxDtBUgRaMyzEZTlh7I,Restaurant Français,"31 Rue Jules Verne, Orvault",0
44114,Le Chantilly,ChIJFxKs36jtBUgRMtWPSmaw1Ag,"Brasserie, Bar, Brasserie, Restaurant Français","58 Av. De La Morlière, Orvault",0
44114,Crescendo Restaurant,ChIJs0MXcZbtBUgRHfxTkRG42HY,"Restaurant, Restaurant Barbecue, Restaurant Familial, Restaurant Français, Restaurant De Hamburgers, Restaurant D'aliments Sains, Restaurant À Emporter","1 Rue De La Conraie Cc. E.leclerc, Orvault",0
44114,Buffalo Grill,ChIJYRg-oFLsBUgRLRm0LMSeIAs,"Restaurant, Restaurant Américain, Bar Et Grill, Restaurant Barbecue, Restaurant Familial, Restaurant De Hamburgers, Restaurant À Emporter, Steak House","La Braudière, Orvault",0
44114,Sushi Design Orvault,ChIJ_ZD2K8XtBUgRjXHVylulEJQ,Restaurant Japonais,"121 Rte De Rennes, Orvault",2
44114,Foodtruck Wokman,ChIJsVv8ildvBUgRkPRKqbAK3Q0,"Restaurant De Wok, Traiteur, Restaurant Thaïlandais","7 Rue Louis Blériot, Orvault",2
44114,Sushi Market Orvault,ChIJQUhQAcrtBUgRCYEsKODbxyI,"Sushis À Emporter, Épicerie Asiatique, Poké Bar","1 Rue De La Conraie E.leclerc, Orvault",2
44114,Naoki,ChIJaZQkwADtBUgRI5A0JXPWt5c,"Restaurant, Restaurant Japonais, Restaurant De Sushis","13 Av. Des Thébaudières, Saint-Herblain",2
44114,Restaurant Rajasthan,ChIJ__9vTUzsBUgRh1kFycBwYM4,Restaurant Indien,"175 Rte De Vannes, Saint-Herblain",2
44115,"Syracuse Atelier Pizzas Au Feu De Bois, Burgers & Tacos",ChIJF9aOvZoDBkgRpKqy9bHxtNE,"Restaurant, Restaurant Français, Restaurant De Hamburgers, Restaurant De Pizzas, Restaurant De Tacos","992 Bd De La Prairie, Ancenis-Saint-Géréon",1
44115,Authentic Kebab,ChIJtTqiZGIDBkgRhDCGweVT40E,"Restaurant De Restauration Rapide, Restaurant De Hamburgers, Magasin De Salades, Sandwicherie, Restaurant De Tacos","49 Rue Des Halles, Ancenis-Saint-Géréon",1
44115,Restaurant L'oudaya,ChIJU6G0b2EDBkgRJBy7lbrOiCA,Restaurant Marocain,"185 Bd Léon Séché, Ancenis-Saint-Géréon",1
44115,Nazar Kebab Ligné,ChIJfcKYHMf_BUgRVv93Grs6XSw,"Kebab, Restaurant De Restauration Rapide","10 Rue Des Palmiers, Ligné",1
44115,Zara Restaurants Gr,ChIJU087j8biBUgRKd2vEGdYCM8,"Restaurant Turc, Restaurant De Restauration Rapide","12 Pl. De L'église, Divatte-sur-Loire",1
44115,La Villa St Germain,ChIJKz_lrz0HBkgReOtEGlfXCxw,"Restaurant, Bar, Restaurant Français","170 Rue Alphonse Fouschard, Oudon",0
44115,Le Port Du Moulin,ChIJzWHCzh0HBkgRNsHKDgvWasg,"Restaurant, Restaurant Français","Le Cul Du Moulin, Orée d'Anjou",0
44115,Maison Crand - Bistrot De La Forge - La Charbonnière,ChIJK0kZZeQGBkgRI6SN3NRteaI,Restaurant Haut De Gamme Français,"1 Pl. Des Piliers, Orée d'Anjou",0
44115,Brasserie La Cohue,ChIJ36NYH4cHBkgRMeo8G9GDdt8,"Brasserie, Bistro, Restaurant","1 Pl. Du Chanoine Bricard, Orée d'Anjou",0
44115,Hôtel Le Champalud,ChIJGSwtuuUGBkgRPR6yYWES0V8,"Restaurant, Bar, Brasserie, Restaurant Français, Hôtel","1 Pl. Du Chanoine Bricard, Orée d'Anjou",0
44115,Royal Wok,ChIJaWbAv5oDBkgRPdxGLEzaIpg,"Restaurant Chinois, Restaurant Japonais, Restaurant Mandarin, Restaurant De Sushis, Restaurant Vietnamien, Restaurant De Wok","992 Bd De La Prairie, Ancenis-Saint-Géréon",2
44115,Mon Petit Sushi 🌸 Ancenis,ChIJO7eYiZ-mim0RIZznDVGKpMk,"Restaurant De Sushis, Restaurant De Ramen, Sushis À Emporter","8 Rue Georges Clemenceau, Ancenis-Saint-Géréon",2
44115,Le Million D'éléphants,ChIJb1kNmH3kBUgRgWtHcwmg9ek,"Traiteur, Plats Chinois À Emporter","44430 Le Loroux-Bottereau, Le Loroux-Bottereau",2
44115,Au Bon Accueil,ChIJ_1GaSErlBUgRBgeLr5Z6fxo,"Restaurant Buffet, Restaurant Asiatique, Restaurant Chinois, Restaurant De Sushis","9 Rue Véga, Carquefou",2
44115,Toujours Bernard,ChIJDXrLLxHwBUgR9LjLg4baykg,"Restaurant Indien, Traiteur, Restaurant, Restaurant Sri-Lankais","18 Rue Des Halles, Carquefou",2
44116,Restaurant İzmir Kebab,ChIJm7_DHNZ7BUgRmtUwVBdLFOY,Kebab,"33 Av. De La Paix, Donges",1
44116,Smash Food Savenay,ChIJmUnzv-uBBUgRNYs8512-fRQ,"Restaurant, Restaurant De Kebab Doner, Restaurant De Restauration Rapide, Restaurant Halal, Restaurant De Hamburgers, Kebab, Restaurant À Emporter, Magasin De Salades, Sandwicherie, Restaurant De Tacos","31 Rue Aristide Briand, Savenay",1
44116,İstanbul Kebab Savenay,ChIJsYl-THmBBUgRG_IPsPZ0gFM,"Restaurant, Restaurant De Restauration Rapide","12 Pl. De L Hôtel De Ville, Savenay",1
44116,Délices De Zarzis,ChIJZUpiLxllBUgRQeeZs5VHNpI,"Restaurant De Restauration Rapide, Kebab","26 Rue Henri Gautier, Montoir-de-Bretagne",1
44116,Pizza King,ChIJqQDjw3RlBUgRkUSH2g_LMek,"Restaurant De Pizzas, Restaurant De Restauration Rapide, Restaurant De Hamburgers, Kebab, Livraison De Pizzas, Pizza À Emporter, Restaurant De Tacos","9 Av. De Penhoët, Saint-Nazaire",1
44116,Restaurant Reverie L'estuaire - Réservation Uniquement Par Téléphone,ChIJpeCWDMZ5BUgRKpqIqN9H54o,"Restaurant Français, Crêperie","Chem. De L'estuaire, Paimbœuf",0
44116,Cafe-Restaurant De La Poste,ChIJ1ZV10dV7BUgR1YPmkMjSIr8,"Restaurant, Bar, Restaurant Français","5 Pl. De La Gare, Donges",0
44116,La Maison Du Port,ChIJkfK3pfKCBUgRZADrqxDhVDg,"Crêperie, Restaurant Français, Restaurant Italien, Restaurant À Emporter, Restaurant De Pizzas","39 Rue Du Port, Lavau-sur-Loire",0
44116,Les Six Croix,ChIJ8zS1zpJ7BUgRdcV7p_kLwFE,"Restaurant Français, Bar","4 Rue Des Six Croix, Donges",0
44116,Restaurant Des Basses Landes,ChIJJ88NGE1_BUgRheKY8MuC5wA,Restaurant Français,"19 Rte Des Basses Landes, Prinquiau",0
44116,Rasoii Ghar,ChIJL2vc-xKBBUgRvOs1RGpSuLY,Restaurant Indien,"2 Pl. De L Hôtel De Ville, Savenay",2
44116,Nhu-Y,ChIJbaIpIDZuBUgRXgqZzkfuSYw,"Restaurant, Restaurant Asiatique, Restaurant Chinois, Restaurant De Fondue Chinoise, Restaurant Thaïlandais","90 Av. Du Président Roosevelt, Saint-Brevin-les-Pins",2
44116,Sushi Kyo,ChIJV7XHMo9lBUgR3yqjC_tYVM8,Restaurant De Sushis,"6 Rue François Marceau, Saint-Nazaire",2
