respondent.commune,business_name,place_id,fr_categories,business_address,treatment_arm
Osmoy,Au Bon Accueil,ChIJf7-VEe285kcRNGI6cnHRFpk,Restaurant Français,"44 Rue De Mantes, Septeuil",0
Osmoy,Les Crepes De Deolinda,ChIJ49hKzHWZ5kcRAqx8GLfhvCQ,"Crêperie, Café, Chocolaterie, Café, Restaurant Français, Restaurant Sans Gluten, Glacier, Restaurant Du Déjeuner","6 Rue Noël Benoist, Garancières",0
Osmoy,Le Relais Du Clair De Lune,ChIJv5Dn8q-k5kcR-2pj7YdE9Y4,"Restaurant, Restaurant Français","20 Rue Du Pré Saint-Martin, Orvilliers",0
Osmoy,Au Porte Bonheur,ChIJA2bUp9-Y5kcRLVl3IETmTL4,Restaurant Asiatique,"Rue Des Croix, La Queue-les-Yvelines",NA
Osmoy,Lanna Thai,ChIJa0jfL0OZ5kcR0X0WqBLpM6w,"Restaurant Thaïlandais, Magasin De Bière, Fromagerie, Bar À Cocktails, Restaurant D'aliments Sains, Restaurant Du Déjeuner, Bar À Vin","3 Pl. Louis Valton, Méré",NA
Osmoy,Gaston À La Campagne,ChIJF73zF86Z5kcR0SGo4z-nN_E,"Restaurant, Service De Livraison, Restaurant De Hamburgers, Restaurant De Livraison, Restaurant Thaïlandais","14 Rue Anatole Moussu, Méré",NA
Osmoy,Asian Food,ChIJRe4wXzCR5kcRRn-0E3D-JmE,Restaurant Asiatique,"28 Rue Parisis, Maule",NA
Osmoy,Saveurs Du Kashmir,ChIJW7mfLN6R5kcRgvLXrSh1OgE,Restaurant Indien,"1 Rue Parisis, Maule",NA
Paray-Douaville,Le Petit Fourneau,ChIJ1ays1mw75EcRTsfxG76EoW8,"Restaurant À Emporter, Kebab, Restaurant De Pizzas","11 Rue Pierre Trouvé, Ablis",1
Paray-Douaville,Pacha Kebab,ChIJO19m7pw-5EcRBgdfKKs_A4E,"Restaurant Turc, Restaurant De Restauration Rapide, Kebab","43 Pl. Du Marché, Auneau-Bleury-Saint-Symphorien",1
Paray-Douaville,24k - Kebab Auneau,ChIJvxvx4LY_5EcROJ6PRI8q7RM,"Restaurant, Kebab","6 Rue De La Résistance, Auneau-Bleury-Saint-Symphorien",1
Paray-Douaville,Mb Chef,ChIJhVXJd-Q_5EcRxJJqs_HvArQ,"Kebab, Restaurant De Hamburgers, Restaurant De Pizzas","6 Rue De La Résistance, Auneau-Bleury-Saint-Symphorien",1
Paray-Douaville,Fast Pizza Kebab,ChIJkcXAIZ0-5EcRV9IjdEBZ7h4,"Restaurant, Restaurant, Restaurant De Restauration Rapide, Restaurant De Pizzas, Pizza À Emporter","15 Rue Marceau, Auneau-Bleury-Saint-Symphorien",1
Paray-Douaville,Reflets Gourmands,ChIJ2-aOFdg75EcRFNLVLO7udw0,"Restaurant Français, Bar, Épicerie Fine, Restaurant, Salon De Thé","4 Pl. De L'église, Ablis",0
Paray-Douaville,Au Soleil D'or,ChIJRQP4Ktw75EcR4_yrZvX-POI,"Restaurant Français, Magasin De Bière, Bar À Cocktails, Restaurant Sans Gluten, Restaurant, Restaurant Végétarien, Bar À Vin","45 Rue Pierre Trouvé, Ablis",0
Paray-Douaville,L'auberge De La Plaine,ChIJAa6hlsc25EcRvrydzlUlGHk,"Restaurant, Restaurant Français","5 Grande Rue, Authon-la-Plaine",0
Paray-Douaville,Aux Sources De L'orge,ChIJM5qZYFow5EcRQl9R_2digwY,"Restaurant, Bar, Restaurant Français, Chambres D'hôtes","9 Grande Rue, Saint-Martin-de-Bréthencourt",0
Paray-Douaville,Jerome Briand Traiteurs,ChIJEzdK5-E55EcRWRHaLdB0ODU,"Traiteur, Restaurant Français, Restaurant Du Déjeuner, Pâtisserie, Restaurant De Tapas","4b Grande Rue, Maisons",0
Paray-Douaville,Restaurant Asiatique,ChIJf8wd3Jw-5EcRnSTTIpP3AOw,Restaurant Asiatique,"34 Pl. Du Marché, Auneau-Bleury-Saint-Symphorien",NA
Paray-Douaville,Asaki Sushi,ChIJZbNFkG0y5EcRAJk3tsDNhU8,"Restaurant Japonais, Restaurant De Sushis","48 Rue De Chartres, Dourdan",NA
Paray-Douaville,Siecle D'or,ChIJy12CVmYy5EcRz749Go0e2Yc,"Restaurant Chinois, Restaurant Buffet","7 Rue D'orsonville, Dourdan",NA
Paray-Douaville,Les Saveurs D'himalaya,ChIJi5YB69oz5EcRfzPGoCOBhU0,Restaurant Indien,"3 All. Emile Rigal, Dourdan",NA
Paray-Douaville,New Cygne D'or,ChIJRc7mgJoy5EcRCHGmU4l-lGw,"Restaurant, Restaurant Asiatique, Restaurant Chinois","5 Pl. Du Vieux Théatre, Roinville",NA
Le Pecq,"Le Petit Riad, Saint Germain En Laye",ChIJnVT6PCiI5kcRzZbQd2WPu2M,Restaurant Marocain,"62ter Av. Du Général Leclerc, Le Pecq",1
Le Pecq,Restaurant Istanbul,ChIJWzvo9OZj5kcRG8wNHucTWl4,"Restaurant Turc, Restaurant","124 Bd Carnot, Le Vésinet",1
Le Pecq,O’tacos Le Vesinet,ChIJq6pqkohi5kcR1mAoEI0Ef_8,"Restaurant De Tacos, Restaurant De Restauration Rapide","131 Bd Carnot, Le Vésinet",1
Le Pecq,Chicken Benettes,ChIJg8Zh99WJ5kcRwDLZDx2XoYo,"Restaurant, Restaurant De Hamburgers, Restaurant De Livraison, Restaurant De Tacos","2 Av. Des Vignes Benettes, Le Pecq",1
Le Pecq,Kebab Le Pecq,ChIJJeAp1iGI5kcRcmCbgQZRQL4,Restaurant Turc,"2 Av. Des Vignes Benettes, Le Pecq",1
Le Pecq,Burger King Du Pecq,ChIJpZmx_pxi5kcRXWAO2sP-wrg,"Restaurant De Restauration Rapide, Restaurant Américain, Bar Et Grill, Restaurant Familial, Restaurant De Hamburgers, Restaurant À Emporter","21 Av. Charles De Gaulle, Le Pecq",0
Le Pecq,Chez Jc Et Sabine,ChIJseglVgBj5kcRa2yy_7Q7nf0,Restaurant Français,"34 Rue Du Président Wilson Allée 4, Le Pecq",0
Le Pecq,Café Le Paris,ChIJ76lj7Yhi5kcRoWYmrmxqyno,"Restaurant, Bar À Tabac, Brasserie, Café, Restaurant Français, Bureau De Tabac","129 Bd Carnot, Le Vésinet",0
Le Pecq,Le Bar Du Marché,ChIJyaFG-Yhi5kcRFCQk_cz-OJw,"Restaurant, Bar, Magasin De Bière, Bar À Cocktails, Restaurant Français","92 Rte De Montesson, Le Vésinet",0
Le Pecq,Le Red,ChIJMbbajohi5kcRFvT821J0lys,"Bar À Chicha, Bar, Café, Restaurant Français, Restaurant De Hamburgers","128 Bd Carnot, Le Vésinet",0
Le Pecq,Bibimbaps78,ChIJd4xyJoZi5kcR2R2SmM5bEFA,Restaurant Coréen,"14 Av. Jean Jaurès, Le Pecq",NA
Le Pecq,Au Palais Des Rizières.,ChIJcxHa5Ihi5kcRT1aCC4MrviA,Restaurant Chinois,"125 Bd Carnot, Le Vésinet",NA
Le Pecq,Goût Sans Fin,ChIJOdrPd2Ni5kcRVZtrhGeqOtE,"Restaurant Asiatique, Restaurant Chinois, Restaurant Japonais, Restaurant Thaïlandais","3 Av. Gabriel Péri, Montesson",NA
Le Pecq,Out Fry - Korean Fried Chicken By Taster,ChIJg5BU7rqJ5kcRtrTUjanwgM4,"Restaurant À Emporter, Restaurant Asiatique, Restaurant De Poulet, Restaurant De Restauration Rapide, Restaurant Coréen","9 Rue De L'ermitage, Le Pecq",NA
Le Pecq,Asia Bay,ChIJNaA3tlyJ5kcR0lc_yVXb8lg,"Restaurant Thaïlandais, Restaurant De Sushis","22 Rue Alexandre Dumas, Saint-Germain-en-Laye",NA
Perdreauville,Le Banquet / Kebab,ChIJT7NcsOi45kcRPUYt9OFfx1g,Restaurant Turc,"55 Rue Nationale, Rosny-sur-Seine",1
Perdreauville,Restaurant,ChIJNeqBILm55kcRhklpFsSrr-4,"Restaurant Turc, Restaurant De Desserts, Restaurant De Blé Dur, Restaurant Grec, Restaurant Kofta, Restaurant À Emporter, Restaurant De Tacos","5 Rue Régine Pernoud, Rosny-sur-Seine",1
Perdreauville,Les Saveurs Du Palais,ChIJNyuHt3G55kcRjrUTmaNm8Ds,Restaurant Marocain,"70 Rue Nationale, Rosny-sur-Seine",1
Perdreauville,L'auberge Du Maroc,ChIJyQXxE6655kcRmx4b6ad9Ruk,Restaurant Marocain,"70 Rue Nationale, Rosny-sur-Seine",1
Perdreauville,Kebab' Home,ChIJlR7x07--5kcR_HrBr2a4_Tw,Restaurant,"2 Pl. Des Droits De L'homme, Magnanville",1
Perdreauville,La Terrasse Du Château,ChIJyzlpj-i45kcRkGYT2qXQqso,"Restaurant, Restaurant Français, Restaurant Italien, Restaurant De Pizzas","39 Rue Nationale, Rosny-sur-Seine",0
Perdreauville,L'escale,ChIJ36r-QO-45kcRitR4_8bPd-k,"Bar, Brasserie","73 Rue Nationale, Rosny-sur-Seine",0
Perdreauville,Del Arte,ChIJnbVSJdy-5kcRSt59Q_ftnd8,"Restaurant, Restaurant Familial, Restaurant Français, Restaurant Italien, Restaurant Du Déjeuner, Restaurant À Emporter, Restaurant Méditerranéen, Restaurant Du Nord De L'italie, Restaurant De Pizzas, Restaurant Du Sud De L'italie","Zac Des, Buchelay",0
Perdreauville,Léon - Mantes-Buchelay,ChIJBcHxFt--5kcRzQaQaRlUrhY,"Restaurant, Restaurant Belge, Restaurant De Fruits De Mer","Bd De La Communauté, Buchelay",0
Perdreauville,Alliance Receptions,ChIJe-yGoj-35kcRZeORA2V5SuA,"Traiteur, Boulangerie, Pâtisserie, Fromagerie, Restaurant Français, Restaurant D'aliments Sains, Restaurant De Fruits De Mer, Restaurant Végétalien, Restaurant Végétarien","2 Rue D'inchelin, Saint-Illiers-la-Ville",0
Perdreauville,Restaurant Au Fav’,ChIJF0e77tO_5kcROSChDhlpBoQ,"Restaurant De Wok, Restaurant Asiatique","France, Buchelay",NA
Perdreauville,Ayako Sushi Buchelay,ChIJ9VeTDni_5kcRn0tqwcYmtU4,"Restaurant De Sushis, Restaurant Japonais","Zone Des Closeaux, Buchelay",NA
Perdreauville,Saveur Gourmandes,ChIJ05hkb7i_5kcRsAA98niRgkk,Restaurant Asiatique,"46 Bd Roger Salengro, Mantes-la-Ville",NA
Perdreauville,Chicken Spot,ChIJ2U_a7he_5kcRJYPwPK1X1q8,"Restaurant De Restauration Rapide, Traiteur, Fish And Chips À Emporter, Poulet Frit À Emporter, Restaurant Indien, Plats Indiens À Emporter","5 Rue Pierre De Ronsard, Mantes-la-Jolie",NA
Perdreauville,Wok-N-Thaï,ChIJ__8vehe_5kcRajg4uQ6wLzM,Restaurant Thaïlandais,"36 Bd Georges Clemenceau, Mantes-la-Jolie",NA
Le Perray-en-Yvelines,Dar'wich,ChIJh6rIdHAn5EcRitheeTA3drA,"Kebab, Restaurant De Hamburgers, Restaurant De Livraison, Pizza À Emporter","2b Av. De La Gare, Le Perray-en-Yvelines",1
Le Perray-en-Yvelines,Yakoups Burger,ChIJ71YJsL2d5kcReEO7VkCXQ0Q,"Restaurant De Hamburgers, Restaurant Halal","2 Pl. De L'ancienne Mairie, Les Essarts-le-Roi",1
Le Perray-en-Yvelines,Restaurant Anatoli,ChIJ6X1nj5Cd5kcRMj2QTphvncQ,"Restaurant Turc, Restaurant De Restauration Rapide","12 Av. De La Gare, Les Essarts-le-Roi",1
Le Perray-en-Yvelines,Lm 24 Market,ChIJf83Ljtgn5EcRxid1hrUA_sA,"Casino, Restaurant Barbecue, Chocolaterie, Épicerie, Glacier, Kebab, Magasin De Pâtes, Restaurant De Pizzas, Sandwicherie, Restaurant De Fruits De Mer","60 Rue Du Général De Gaulle, Rambouillet",1
Le Perray-en-Yvelines,Tacos Kebab,ChIJl4u7wbcm5EcRfYrxzMEgC0U,"Kebab, Restaurant De Tacos","1 Bis Rue Du Général Humbert, Rambouillet",1
Le Perray-en-Yvelines,Le Bistro Aveyronnais,ChIJKyHORWsn5EcRiMiphnoD9Js,"Restaurant, Bar, Bistro, Restaurant Français, Cave À Vin","57 Rue De Chartres, Le Perray-en-Yvelines",0
Le Perray-en-Yvelines,Café De La Gare,ChIJHQwvQqon5EcRpc2LLYqDK8E,Bar Et Grill,"18 Rue De L'église, Le Perray-en-Yvelines",0
Le Perray-en-Yvelines,Brasserie Volcelest,ChIJ_QkugHAs5EcR6tmCNJpXvnc,"Distributeur De Bière, Brasserie","28 Rue Du Roseau, Le Perray-en-Yvelines",0
Le Perray-en-Yvelines,Crêperie De La Saint-Eloi,ChIJI903VQAn5EcRgtaB1qpAEDk,Crêperie,"3b Rue De Chartres, Le Perray-en-Yvelines",0
Le Perray-en-Yvelines,Bar-Tabac-Brasserie,ChIJXVT_5Ion5EcRKDFeVLUA3e8,"Brasserie, Bar À Tabac","28 Grande Rue, Auffargis",0
Le Perray-en-Yvelines,Le Mandarin Rouge,ChIJM0ZlCHAn5EcRpKt8UttNxDM,"Restaurant Asiatique, Bar, Restaurant Chinois, Restaurant Thaïlandais","6 Rue De Chartres, Le Perray-en-Yvelines",NA
Le Perray-en-Yvelines,Sushi Wokii Le Perray En Yvelines,ChIJ6y4XU2Un5EcRXkT-hiAi4Hg,"Restaurant Japonais, Restaurant De Sushis","51 Bis Rue De Paris, Le Perray-en-Yvelines",NA
Le Perray-en-Yvelines,Ak2m Thaï,ChIJ0YKdTaCd5kcRViBmK_Sh_ks,Restaurant Thaïlandais,"2 Rue De La Haie Aux Vaches, Les Essarts-le-Roi",NA
Le Perray-en-Yvelines,Au Lagon De Chine,ChIJ23TRCM0m5EcRwcC_lkGHFoE,Restaurant Chinois,"42 Rue De Groussay, Rambouillet",NA
Le Perray-en-Yvelines,Wafu Rambouillet,ChIJTcAuVesm5EcRzW4N-FmFpJY,"Restaurant Asiatique, Restaurant Chinois, Restaurant Japonais, Restaurant De Sushis","132 Rue De La Louvière, Rambouillet",NA
Plaisir,Plaisirs Du Maroc,ChIJU2d37OSE5kcR3FXc8itySJo,Restaurant Marocain,"3 Rue De La République, Plaisir",1
Plaisir,Chicken Street Plaisir Naan & Fried Chicken,ChIJxwOW1P-F5kcRCRxu8TehgIk,"Restaurant De Restauration Rapide, Restaurant De Poulet, Restaurant D'ailes De Poulet, Restaurant Familial, Poulet Frit À Emporter, Restaurant Halal, Restaurant De Hamburgers, Restaurant De Livraison, Restaurant","10 Rue Paul Langevin, Plaisir",1
Plaisir,Resto S & B,ChIJqzJBqv-F5kcRnLodFTzLY70,Restaurant Halal,"Pl. Du Silo 9, Plaisir",1
Plaisir,Le Bon App Pizzeria,ChIJ4-IPQxiF5kcRjm30RbRd9Ws,"Restaurant, Restaurant De Restauration Rapide, Restaurant Grec, Restaurant À Emporter, Livraison De Pizzas, Restaurant De Pizzas, Pizza À Emporter, Restaurant De Tacos","53 Rue De La Gare, Plaisir",1
Plaisir,Marvelous Burger & Hot Dog,ChIJBRvl13yF5kcR1lHsRZL1n48,Restaurant Halal,"Centre Commercial Mon Grand, Plaisir",1
Plaisir,Restaurant De La Ferme,ChIJd6Zd5gSF5kcR74wm1LplxTs,"Restaurant, Bar À Cocktails, Restaurant Français, Restaurant Haut De Gamme Français, Bar À Vin","66 Pass. Paul Langevin, Plaisir",0
Plaisir,Factory & Co Plaisir,ChIJU0o089iF5kcRF2RXxT9P4jA,"Restaurant Américain, Restaurant Brunch, Café, Restaurant De Desserts, Restaurant De Restauration Rapide, Restaurant De Hamburgers, Nouveau Restaurant Américain, Pâtisserie, Restaurant, Bar Sportif","1170 Av. De Saint-Germain, Plaisir",0
Plaisir,Hippopotamus Steakhouse,ChIJoz_utgmF5kcRRDTVbo_gq4o,"Restaurant, Bar Et Grill, Restaurant Barbecue, Dîner, Restaurant Familial, Restaurant Français, Restaurant À Emporter, Steak House","31 Rue Francis Carco, Plaisir",0
Plaisir,La Criée Plaisir,ChIJBYCr2mCE5kcRXqvxrDaWQYY,"Restaurant, Service De Livraison, Restaurant De Poisson-Frites, Restaurant De Poissons, Restaurant Français, Restaurant De Fruits De Mer","2 Rue Pierre Curie, Plaisir",0
Plaisir,Del Arte,ChIJ0y8dBgOF5kcRNZSXyEjDl_A,"Restaurant, Restaurant Familial, Restaurant Français, Restaurant Italien, Restaurant Du Déjeuner, Restaurant À Emporter, Restaurant Méditerranéen, Restaurant Du Nord De L'italie, Restaurant De Pizzas, Restaurant Du Sud De L'italie","Rond-Point Des Buissons, Plaisir",0
Plaisir,Indian Palace,ChIJ8x49CWyF5kcRfnQZh2a4SOk,Restaurant Indien,"Centre Commercial Des Gâtines, Plaisir",NA
Plaisir,Bangkok Factory,ChIJRwpQaACF5kcR502xIBqvU-E,Restaurant Asiatique,"10 Rue Paul Langevin, Plaisir",NA
Plaisir,Sushi Shop Corner Auchan Plaisir,ChIJmXOosTqF5kcRDYVmXdzXJRY,"Restaurant De Sushis, Restaurant Asiatique, Restaurant De Restauration Rapide, Restaurant Japonais, Restaurant À Emporter, Restaurant Panasiatique, Sushis À Emporter","Chemin Départemental 161, Plaisir",NA
Plaisir,Le Longchamp Kitchen,ChIJhdDCnlKE5kcRePNTgdPMQyg,"Restaurant Asiatique, Brasserie, Restaurant Vietnamien","1 Pl. Nelson Mandela, Les Clayes-sous-Bois",NA
Plaisir,Sushi Lin,ChIJO4Pp7K2F5kcRCOvLkscNm6U,"Restaurant Japonais, Restaurant, Restaurant De Sushis","32 Rue Des Dames, Les Clayes-sous-Bois",NA
Poigny-la-Forêt,Lm 24 Market,ChIJf83Ljtgn5EcRxid1hrUA_sA,"Casino, Restaurant Barbecue, Chocolaterie, Épicerie, Glacier, Kebab, Magasin De Pâtes, Restaurant De Pizzas, Sandwicherie, Restaurant De Fruits De Mer","60 Rue Du Général De Gaulle, Rambouillet",1
Poigny-la-Forêt,Tacos Kebab,ChIJl4u7wbcm5EcRfYrxzMEgC0U,"Kebab, Restaurant De Tacos","1 Bis Rue Du Général Humbert, Rambouillet",1
Poigny-la-Forêt,Burger Tacos Kebab,ChIJnQT7jLcm5EcROF2_hAhbweI,"Kebab, Restaurant De Hamburgers, Restaurant De Tacos","35 Pl. Félix Faure, Rambouillet",1
Poigny-la-Forêt,O’tacos Rambouillet,ChIJifARFbYn5EcR7i87af-S4f0,Restaurant De Tacos,"2 Rue Raymond Patenotre, Rambouillet",1
Poigny-la-Forêt,Tonton Kebab,ChIJfcBzB7km5EcRHSm9Ju_l0gg,"Kebab, Restaurant De Restauration Rapide","22 Rue Raymond Patenotre, Rambouillet",1
Poigny-la-Forêt,Auberge De La Forêt,ChIJk5fffiAh5EcR4enLHbcT0-M,"Restaurant, Boulangerie, Magasin De Bière, Pâtisserie, Fromagerie, Restaurant Français, Épicerie Fine, Restaurant De Fruits De Mer, Bar À Vin","24 Rte De Saint-Léger, Poigny-la-Forêt",0
Poigny-la-Forêt,Marion Les Saveurs,ChIJ5a2n_0cg5EcRqYc4TupNtew,"Restaurant, Restaurant Français","2 Pl. Maurice Hude, Poigny-la-Forêt",0
Poigny-la-Forêt,Villa Marinette,ChIJL4ofiZ0h5EcR9A1dhm8ngeY,"Restaurant, Restaurant Gastronomique","20 Av. Du Général De Gaulle, Gazeran",0
Poigny-la-Forêt,Le Comptoir,ChIJp7hYU8-f5kcRLfZl78r8NbE,"Restaurant, Bar, Restaurant Français","1 Rue De La Harpe, Saint-Léger-en-Yvelines",0
Poigny-la-Forêt,L'orangerie,ChIJE36L48om5EcRozY6QKWS6vE,"Restaurant Gastronomique, Restaurant Français, Restaurant Haut De Gamme Français, Restaurant À Emporter, Restaurant, Restaurant De Fruits De Mer","4 Rue Raymond Poincaré, Rambouillet",0
Poigny-la-Forêt,Au Lagon De Chine,ChIJ23TRCM0m5EcRwcC_lkGHFoE,Restaurant Chinois,"42 Rue De Groussay, Rambouillet",NA
Poigny-la-Forêt,Hokkaido À Rambouillet - Restaurant Sushi Japonais,ChIJddbt78om5EcRIY4tgd9-1ds,"Restaurant Japonais, Restaurant De Livraison, Restaurant À Emporter, Restaurant De Sushis","22 Rue Raymond Poincaré, Rambouillet",NA
Poigny-la-Forêt,Yummy Sushi,ChIJwQgZ0r8n5EcRpyhKXrYUL-A,Restaurant Thaïlandais,"95 Rue Du Général De Gaulle, Rambouillet",NA
Poigny-la-Forêt,Chapati Restaurant Indien,ChIJ0abaOrYm5EcR58haMaInq0Y,Restaurant Indien,"101 Rue Du Général De Gaulle, Rambouillet",NA
Poigny-la-Forêt,Le Bon Chinois,ChIJRY41jLcm5EcRQ0qImGo58s4,"Restaurant Asiatique, Restaurant Chinois","37 Pl. Félix Faure, Rambouillet",NA
Poissy,Le Riad,ChIJ3XvcY2iJ5kcRHTXZrEk4Tn4,"Restaurant Marocain, Restaurant","20 Rue De La Gare, Poissy",1
Poissy,Tower Food,ChIJq6q6hhWJ5kcRfCcKfTAaVvE,"Restaurant, Crêperie, Restaurant De Restauration Rapide, Poulet Frit À Emporter, Kebab, Restaurant De Tacos","55 Pl. Corneille, Poissy",1
Poissy,Boulevard Beirut,ChIJRYwOrgGJ5kcR_Y1hemKWkcA,"Restaurant Libanais, Restaurant Halal","5 Av. Maurice Berteaux, Poissy",1
Poissy,La Médina,ChIJyeJL5DiJ5kcRUDRrDNasj54,Restaurant Marocain,"94 Bd Robespierre, Poissy",1
Poissy,Didim Grill,ChIJiaDgGeqJ5kcR_82jRG42Pw8,"Restaurant, Restaurant Barbecue, Restaurant Halal, Restaurant De Hamburgers, Kebab, Restaurant Du Déjeuner, Sandwicherie, Restaurant Turc","84 Bis Bd Robespierre, Poissy",1
Poissy,Burger Breton Poissy,ChIJtxVoj7eJ5kcREqGkrtfhvBk,"Restaurant, Crêperie, Restaurant De Restauration Rapide, Restaurant Français, Restaurant De Hamburgers, Restaurant De Livraison, Restaurant Végétarien","14 Rue De La Gare, Poissy",0
Poissy,Restaurant La Chaumiere,ChIJ1WLP5WiJ5kcRehUOFUL7w8I,Restaurant Français,"6 Rue Au Pain, Poissy",0
Poissy,L'instant,ChIJAXhWNGmJ5kcRe135eGvNRvg,"Brasserie, Bar, Brasserie","24 Av. Du Cep, Poissy",0
Poissy,Le Batignolle,ChIJURr402iJ5kcRuSlgr7HrDCs,"Brasserie, Bar, Café, Restaurant Français","29 Rue Du Général De Gaulle, Poissy",0
Poissy,Le Cep,ChIJLawsMmmJ5kcRozBFhgw3zcQ,"Brasserie, Bar","21 Av. Du Cep, Poissy",0
Poissy,Spice Route,ChIJK67cZveJ5kcRMHI7O7PhPj4,"Restaurant Indien, Restaurant À Emporter","109 Av. Du Maréchal Foch, Poissy",NA
Poissy,Le Maharaja Du Kashmir,ChIJCasdKW-J5kcRTLEDRvb_2Ws,"Restaurant, Restaurant Indien","2 Rue Sandrier, Poissy",NA
Poissy,Hokkaido,ChIJiy5MikOJ5kcRgOs9VQFZ3V8,"Restaurant Asiatique, Magasin De Bière, Restaurant Sans Gluten, Glacier, Restaurant Japonais, Restaurant Végétalien, Restaurant Végétarien, Bar À Vin","46 Rue Du Général De Gaulle, Poissy",NA
Poissy,Bao « Restaurant Asiatique »,ChIJSe9zG-mJ5kcRE4ms6V9F05o,"Restaurant Asiatique, Épicerie","116 Bis Rue Du Général De Gaulle, Poissy",NA
Poissy,Côté Sushi Poissy,ChIJfTWn9HCJ5kcRlN6eSJY7HtQ,"Restaurant De Sushis, Restaurant De Fusion Asiatique, Restaurant Japonais","55 Rue Du Général De Gaulle, Poissy",NA
Ponthévrard,Le Petit Fourneau,ChIJ1ays1mw75EcRTsfxG76EoW8,"Restaurant À Emporter, Kebab, Restaurant De Pizzas","11 Rue Pierre Trouvé, Ablis",1
Ponthévrard,Istanbul Kebab,ChIJl2XpkXIy5EcR36Bl_Ba15wY,"Restaurant Turc, Restaurant De Restauration Rapide, Kebab","4 Rue Sarcey, Dourdan",1
Ponthévrard,O'chicken-Tacos,ChIJYURNrCgz5EcRPSJnBIc1TBs,Restaurant De Tacos,"27 Rue D'etampes, Dourdan",1
Ponthévrard,Riad Fes,ChIJ74slXWgy5EcRFfna5_uH2Es,"Restaurant, Restaurant Marocain","51 Av. D'etampes, Dourdan",1
Ponthévrard,Marrakech Palmeraie,ChIJmSXBIaUm5EcRouH7Y3iXR9o,Restaurant Marocain,"107 Rue G. Lenotre, Rambouillet",1
Ponthévrard,Restaurant Le 42,ChIJX6v7o3Uv5EcRpBhMTjVLds4,"Restaurant, Restaurant Français","42 Rue Charles De Gaulle, Saint-Arnoult-en-Yvelines",0
Ponthévrard,Enfin Une Épicerie,ChIJFyx9pYox5EcRwF_lRgkZsh4,"Restaurant Brunch, Bar, Épicerie Fine, Restaurant, Salon De Thé","4 Rue Charles Legaigneur, Sainte-Mesme",0
Ponthévrard,Aux Sources De L'orge,ChIJM5qZYFow5EcRQl9R_2digwY,"Restaurant, Bar, Restaurant Français, Chambres D'hôtes","9 Grande Rue, Saint-Martin-de-Bréthencourt",0
Ponthévrard,Lunch Grill,ChIJ9SRTYowl5EcRprfFuC9sYXc,"Restaurant De Steakhouse Français, Gril, Restaurant De Desserts, Friterie, Restaurant De Hamburgers, Restaurant De Plats De Viande, Restaurant Traditionnel","N10, Sonchamp",0
Ponthévrard,Mcdonald's,ChIJ38S55zg75EcRqugAuf3ksEk,"Restaurant De Restauration Rapide, Restaurant Américain, Restaurant De Hamburgers, Restaurant De Pizzas, Restaurant, Sandwicherie","Za, Ablis",0
Ponthévrard,Asaki Sushi,ChIJZbNFkG0y5EcRAJk3tsDNhU8,"Restaurant Japonais, Restaurant De Sushis","48 Rue De Chartres, Dourdan",NA
Ponthévrard,Les Saveurs D'himalaya,ChIJi5YB69oz5EcRfzPGoCOBhU0,Restaurant Indien,"3 All. Emile Rigal, Dourdan",NA
Ponthévrard,Siecle D'or,ChIJy12CVmYy5EcRz749Go0e2Yc,"Restaurant Chinois, Restaurant Buffet","7 Rue D'orsonville, Dourdan",NA
Ponthévrard,Stand De Plats Asiatiques,ChIJa5bXTAUl5EcRsE96Za3lrqg,Restaurant Asiatique,"40 Rue De La Droue, Sonchamp",NA
Ponthévrard,New Cygne D'or,ChIJRc7mgJoy5EcRCHGmU4l-lGw,"Restaurant, Restaurant Asiatique, Restaurant Chinois","5 Pl. Du Vieux Théatre, Roinville",NA
Porcheville,Restaurant Delune,ChIJnYBpXPeV5kcRP8doSTl4HLk,"Restaurant, Restaurant Asiatique, Magasin De Bière, Pâtisserie, Magasin De Fruits Et Légumes, Restaurant Halal, Restaurant Du Déjeuner, Restaurant De Sushis, Bar À Vin","Imp. De La Voye Bonnard, Mézières-sur-Seine",1
Porcheville,Centre Commercial Carrefour Limay,ChIJ76h803iV5kcRRPUOn7QAqhs,"Restaurant, Banque, Magasin De Vêtements, Station-Service, Magasin De Verre, Salon De Coiffure, Blanchisserie, Pharmacie, Centre Commercial, Restaurant De Tacos","190 Route Nationale, Limay",1
Porcheville,Ottoman Restaurant,ChIJp_nXB0aV5kcRWRYLd0q8ndE,Restaurant Turc,"1 Av. Lucie Desnos, Gargenville",1
Porcheville,Le Ryad,ChIJ5YaLByu-5kcRY2GlTb92So8,"Restaurant Marocain, Restaurant","74 Pl. Maximilien Robespierre, Limay",1
Porcheville,Chrono Pizza,ChIJk7nXdCu-5kcReaRw4jMbAC0,"Restaurant De Pizzas, Crêperie, Restaurant De Hamburgers, Kebab","177 Av. Du Président Wilson, Limay",1
Porcheville,Auberge De Gascogne,ChIJQfTvBLyV5kcR0-57cbgKz-0,Restaurant Français,"49 Bd De La République, Porcheville",0
Porcheville,Hôtel Brasserie Des 2 Gares,ChIJowh6QTmU5kcRbnNsfhqmsDo,"Restaurant, Bar, Magasin De Bière, Bistro, Restaurant De Petit-Déjeuner, Brasserie, Café, Fromagerie, Bar À Cocktails, Hôtel, Brasserie","2 Av. De La Gare, Mézières-sur-Seine",0
Porcheville,La Maison D'aurore,ChIJy9VMLFmU5kcROCsdyS1333k,"Restaurant Français, Restaurant Méditerranéen","1 Av. Lucie Desnos, Gargenville",0
Porcheville,Le Diamant,ChIJXU7AaumV5kcRvBxn0HfywIM,"Restaurant, Magasin De Bière, Bar À Cocktails, Restaurant Du Déjeuner, Magasin De Pâtes, Restaurant De Pizzas, Restaurant De Fruits De Mer, Steak House, Bar À Vin","1 Av. Lucie Desnos, Gargenville",0
Porcheville,Mcdonald's,ChIJE1de0yq-5kcRa_0II99N62s,"Restaurant De Restauration Rapide, Restaurant Américain, Restaurant De Hamburgers, Restaurant De Pizzas, Restaurant, Sandwicherie","32 Rue Lafarge, Limay",0
Porcheville,Royal De Mezieres,ChIJSxAUADGU5kcRbOTBxTmF_H8,"Restaurant Asiatique, Restaurant","France, Mézières-sur-Seine",NA
Porcheville,Nay Sushi Thaï,ChIJ47lMsvC_5kcR0-JbWVZ6_jk,"Restaurant De Sushis, Restaurant De Fondue Chinoise, Restaurant Japonais, Restaurant Thaïlandais","30 Bis Rue Nationale, Limay",NA
Porcheville,Wok Center Grill,ChIJc6G8VUS-5kcRWnNMmjrD_g8,"Restaurant De Wok, Restaurant Buffet, Restaurant Mandarin","Rond Point De La Clé Des Champs, Mantes-la-Ville",NA
Porcheville,Maï Thaï,ChIJq719urO_5kcRWjWRquGCWsg,Restaurant Thaïlandais,"2 Rue Conrad Kilian, Mantes-la-Jolie",NA
Porcheville,Nah Sushi,ChIJo7zA-Vq-5kcR8Iub10ST7f4,"Restaurant De Sushis, Restaurant De Livraison","106 Rte De Houdan, Mantes-la-Ville",NA
Le Port-Marly,Kebab Le Pecq,ChIJJeAp1iGI5kcRcmCbgQZRQL4,Restaurant Turc,"2 Av. Des Vignes Benettes, Le Pecq",1
Le Port-Marly,Chicken Benettes,ChIJg8Zh99WJ5kcRwDLZDx2XoYo,"Restaurant, Restaurant De Hamburgers, Restaurant De Livraison, Restaurant De Tacos","2 Av. Des Vignes Benettes, Le Pecq",1
Le Port-Marly,"Le Petit Riad, Saint Germain En Laye",ChIJnVT6PCiI5kcRzZbQd2WPu2M,Restaurant Marocain,"62ter Av. Du Général Leclerc, Le Pecq",1
Le Port-Marly,O’tacos Le Vesinet,ChIJq6pqkohi5kcR1mAoEI0Ef_8,"Restaurant De Tacos, Restaurant De Restauration Rapide","131 Bd Carnot, Le Vésinet",1
Le Port-Marly,Restaurant Istanbul,ChIJWzvo9OZj5kcRG8wNHucTWl4,"Restaurant Turc, Restaurant","124 Bd Carnot, Le Vésinet",1
Le Port-Marly,L'épicurien,ChIJPSyAEZhi5kcR40TRi7FwNLg,"Restaurant Français, Restaurant De Fruits De Mer","27 Rue De Paris, Le Port-Marly",0
Le Port-Marly,Le Porc Marly,ChIJuwF-krhj5kcR-Aq1-_WFE1w,"Restaurant Français, Restaurant, Bar À Vin","13 Rue De Paris, Le Port-Marly",0
Le Port-Marly,La P'tite Marche,ChIJTRMduqJi5kcRE8bG_gkamlE,"Restaurant, Restaurant Français","1 Rue Jean Jaurès, Le Port-Marly",0
Le Port-Marly,La Cantine Yokai,ChIJRUH-Ekpj5kcRrPRuYjTZ57k,"Restaurant, Fromagerie, Restaurant D'aliments Sains, Restaurant Du Déjeuner, Restaurant De Fruits De Mer","2 Sq. De Monte Cristo, Marly-le-Roi",0
Le Port-Marly,Bistrot De Marly,ChIJWSpV9wOI5kcRqjhVUEhBIuM,"Bistro, Bar","Av. De L'amiral Lemonnier, Marly-le-Roi",0
Le Port-Marly,Le Palais De Port-Marly,ChIJ1wfq_KJi5kcRk1bNxM4poX8,"Restaurant Asiatique, Restaurant Chinois, Restaurant Thaïlandais","15 Rte De Versailles, Le Port-Marly",NA
Le Port-Marly,Soleil Levant,ChIJNwmMSL1i5kcR7j3PnrN7yuU,"Restaurant Japonais, Restaurant De Sushis","16 Av. Simon Vouet, Le Port-Marly",NA
Le Port-Marly,Royal Port-Marly,ChIJnZQnTr1i5kcRAIk_Fp5bwUA,"Restaurant, Restaurant Asiatique, Bar, Restaurant Chinois, Restaurant De Sushis","12 Rue De Paris, Le Port-Marly",NA
Le Port-Marly,Les Saveurs D'asie,ChIJWSpV9wOI5kcR2x-wrFLXrWI,Restaurant Chinois,"Av. De L'amiral Lemonnier, Marly-le-Roi",NA
Le Port-Marly,Sushi Daily Marly Le Roi Vitrine,ChIJr0RrOCNj5kcRzxd1e7rWJBk,"Sushis À Emporter, Kiosque","Av. De L'amiral Lemonnier Centre Commercial Domaine Grandes Terres, Marly-le-Roi",NA
